question,contexts,ground_truth,answer,faithfulness,answer_relevancy,context_precision,context_relevancy,answer_similarity,bleu_score,cos-sim-TF-IDF,cos-sim-BertModel,sim-spacy
Можно ли не расписываться на карте?,"[""['После получения карты поставьте свою подпись в прямоугольнике, расположенном на оборотной стороне карты. При отсутствии подписи карта может быть не принята к оплате в торгово-сервисном предприятии, а также повышается риск использования карты злоумышленниками в случае ее утраты/кражи.']""]","При отсутствии подписи карта может быть не принята к оплате в торгово-сервисном предприятии, а также повышается риск использования карты злоумышленниками в случае ее утраты/кражи.","Для совершения операции оплаты покупки или услуги с использованием карты необходимо подписать квитанцию или чек. В случае отсутствия подписи на карте, она может быть не принята к оплате в торгово-сервисном предприятии, и Вам может быть отказано в обслуживании. Поэтому важно расписаться на карте при совершении операции.",,0.8585707679310436,0.9999999999,1.0,0.933562110184312,0.1447,0.26615405315953317,0.98818594,0.9520568553523651
"Мой друг попросил меня дать свою карту для оплаты и потом вернуть, это не опасно?","[""['Никогда не принимайте рекомендации, советы, помощь от третьих лиц при пользовании картой, особенно при снятии наличных денежных средств в банкоматах. В случае возникновения затруднений при совершении операции обратитесь Банк посредством дистанционного обслуживания. Обращайте внимание на расположение банкоматов. Старайтесь не пользоваться банкоматами, расположенными в плохо освещенных и безлюдных местах', 'Не передавайте карту другим лицам, в т.ч. родственникам и знакомым для проведения транзакций. С целью исключения Ваших потерь от несанкционированного использования Вашей карты (копирования информации с Вашей карты для ее дальнейшего мошеннического использования): при совершении операции оплаты с использованием карты никогда не выпускайте Вашу карту из поля зрения и требуйте от обслуживающего Вас лица, чтобы все операции с использованием карты совершались в Вашем присутствии.']""]","Не передавайте карту другим лицам, в т.ч. родственникам и знакомым для проведения транзакций и никогда не принимайте рекомендации, советы, помощь от третьих лиц при пользовании картой, особенно при снятии наличных денежных средств в банкоматах.","Для безопасности Вашей карты лучше не передавать ее другим лицам, даже друзьям, для совершения операций оплаты. Все операции с использованием карты должны совершаться в Вашем присутствии, чтобы исключить риск несанкционированного использования. Если друг попросил Вас дать карту для оплаты, лучше посоветуйте ему использовать другой способ оплаты или совершить операцию вместе с ним, чтобы избежать потенциальных проблем с безопасностью.",1.0,0.845286656113844,0.9999999999,1.0,0.9194534563675395,0.0,0.09278709052335252,0.98161656,0.7955561186284902
Безопасно ли хранить пинкод в заметках в телефоне?,"[""['Категорически запрещается записывать ПИН-код на карте. Постарайтесь не записывать ПИН-код, запомните его. Если же Вы предпочитаете записать свой ПИН-код, никогда не указывайте, что это ПИН-код и не храните документ с записанным ПИН-кодом рядом с картой.']""]","Да, однако не указывайте в названии заметки, что это ПИН-код от Вашей карты.","Не рекомендуется хранить ПИН-код в заметках в телефоне, так как это может привести к его компрометации и злоупотреблению. ПИН-код является конфиденциальной информацией, которую следует хранить в надежном месте и не передавать третьим лицам. В случае утери ПИН-кода или подозрений на его утечку, рекомендуется изменить его и обратиться в банк для блокировки карты и получения дополнительной информации по безопасности.",0.6666666666666666,0.8896239809344367,0.9999999999,0.0,0.8767668817588223,0.0,0.17885743363559356,0.941128,0.7324980670245224
Я потеряла карту,"[""[' Вы потеряли карту или ее украли\\nПрежде всего, как можно быстрее, сообщите о случившемся в Банк посредством дистанционного обслуживания \\nи заблокируйте карту. Заблокировать карту можно по телефону, в интернет-банке или в мобильном приложении Банка. \\nЧем раньше Вы это сделаете, тем меньше вероятность несанкционированного использования карты злоумышленниками. \\nРазблокировать карту нельзя — можно только перевыпустить. Если вы не уверены, что карту украли, не спешите ее \\nблокировать, установите лимит «0» на операции и запретите покупки через Интернет, если карта будет найдена лимиты \\nможно изменить.\\nНапоминаем Вам, что в соответствии с Общими условиями выпуска и обслуживания кредитных карт и Общими \\nусловиями открытия, ведения и закрытия счетов физических лиц, а также выпуска и обслуживания расчетных карт Ваша \\nответственность за дальнейшее использование карты прекращается, после осуществления блокировки, если не станет \\nизвестно, что незаконное использование карты имело место с Вашего согласия.\\nЕсли карта была у Вас украдена на территории РФ, после блокировки карты заявите о случившемся в полицию. При краже \\nкарты за границей, заявите в полицию или в консульский отдел посольства Российской Федерации в стране, на территории \\nкоторой произошла кража. Пожалуйста, сохраняйте копию протокола (квитанцию о заявлении) для последующего \\nпредъявления в Банк.']""]","Если вы не уверены, что карту украли, не спешите ее блокировать, установите лимит «0» на операции и запретите покупки через Интернет, если карта будет найдена лимиты можно изменить. В случае, если вы полагаете, что Вашу карту всё-таки украли, то как можно быстрее, сообщите о случившемся в Банк посредством дистанционного обслуживания и заблокируйте карту. Это возможно сделать по телефону, в интернет-банке или в мобильном приложении Банка.","Если вы потеряли карту, необходимо немедленно сообщить об этом в Банк посредством дистанционного обслуживания и заблокировать карту. Это можно сделать по телефону, в интернет-банке или в мобильном приложении Банка. Чем быстрее вы заблокируете карту, тем меньше вероятность несанкционированного использования ею злоумышленниками. После блокировки карты необходимо обратиться в Банк для получения дальнейших инструкций по дальнейшим действиям. Если у вас есть подозрения, что карта была украдена, также следует сообщить об этом в полицию. В любом случае, сохраняйте копию протокола или квитанции о заявлении для предъявления в Банк.",1.0,0.8706919995070921,0.9999999999,0.1,0.9262992543467784,0.1747,0.33083756635239525,0.9922697,0.8801323040617343
"Почему при использовании карты важно не расписываться на квитанциях/чеках до того, как вы проверите правильность указанной суммы?","[""['Проверяйте правильность суммы, указанной на платежном чеке. Поставив подпись на платежном чеке, Вы соглашаетесь со списанием указанной на нем суммы с Вашего карточного счета.']""]","Важно проверять правильность суммы перед подписанием квитанции/чека, потому что после подписи вы соглашаетесь с этой суммой, и она будет списана с вашего счета.","При использовании карты важно не расписываться на квитанциях или чеках до того, как вы проверите правильность указанной суммы, потому что ваша подпись подтверждает факт совершения операции. Пожалуйста, всегда проверяйте информацию на квитанции или чеке перед тем, как поставить свою подпись, чтобы избежать возможных ошибок или недоразумений.",1.0,0.9626972295400654,0.9999999999,1.0,0.9390134562541057,0.0,0.13341068610976037,0.9824256,0.9417772210224219
"Что делать, если я потеряла телефон, на котором было установлено мобильное приложение банка?","[""['При утрате Мобильного телефона, используемого с абонентским номером подвижной радиотелефонной связи, на который установлено Мобильное приложение Банка, Вам следует срочно обратиться к своему оператору сотовой связи для блокировки SIM-карты и в Банк посредством дистанционного обслуживания для блокировки доступа в мобильное приложение Банка и удаления данных карты с Мобильного телефона.']""]","Если вы потеряли телефон с установленным мобильным приложением банка, необходимо:

Срочно обратиться к оператору сотовой связи для блокировки SIM-карты.
Обратиться в банк через дистанционное обслуживание для блокировки доступа в мобильное приложение и удаления данных карты с телефона.","Если вы потеряли телефон, на котором было установлено мобильное приложение банка Tinkoff, то сначала вам следует обратиться к вашему оператору сотовой связи для блокировки SIM-карты. Затем необходимо связаться с банком через дистанционное обслуживание для блокировки доступа в мобильное приложение банка и удаления данных карты с утерянного телефона. Необходимо также следить за операциями по карте в режиме реального времени, устанавливать лимиты на платежи и снятие наличных, а также иметь под рукой контактные номера банка для экстренной блокировки карты в случае потери или кражи.",0.6666666666666666,0.9550040960281952,0.9999999999,1.0,0.9639669221470321,0.1456,0.5346588480383718,0.9880785,0.9739381491852805
Можно ли использовать интернет-кафе и другие общедоступные места для совершения операций по карте в интернете? Объясните причину.,"[""['Избегайте осуществления Интернет-операций с использованием карты в местах, где услуги Интернет являются общедоступными, например, в Интернет-кафе.']""]","Нет, не рекомендуется использовать интернет-кафе и другие общедоступные места для совершения операций по карте в интернете. Причина в том, что такие общедоступные сети являются менее безопасными, и есть риск перехвата данных карты злоумышленниками.","Можно использовать интернет-кафе и другие общедоступные места для совершения операций по карте в интернете, однако следует быть осторожным и избегать осуществления Интернет-операций в таких местах, где услуги Интернет являются общедоступными. Лучше пользоваться проверенными интернет-магазинами, в которых вы уверены. При оплате покупок в сети Интернет необходимо ввести трехзначный код безопасности CVC2/CVV2 для повышения безопасности операций. Не сообщайте реквизиты вашей банковской карты, за исключением использования автоматизированных систем MOTO и систем интернет-коммерции.",1.0,0.8673802531921915,0.9999999999,1.0,0.9327551342048263,0.1197,0.3005690788999135,0.9849555,0.9215740072770922
"Что делать, если я получил SMS-оповещение о операции по карте, которую я не совершал?","[""['Если Вы уверены, что операция не могла быть совершена Вами, то как можно быстрее сообщите об этом в Банк посредством дистанционного обслуживания и заблокируйте карту.']""]","Если вы получили SMS-оповещение о операции, которую не совершали, нужно как можно быстрее сообщить об этом в банк через дистанционное обслуживание и заблокировать карту.","Если вы получили SMS-оповещение о операции по карте, которую вы не совершали, следует немедленно сообщить об этом в банк посредством дистанционного обслуживания и заблокировать карту. Для более быстрой реакции и предотвращения несанкционированного использования карты рекомендуется заблокировать карту как можно скорее. В случае украденной карты на территории России после блокировки карты необходимо сообщить в полицию. Если кража произошла за границей, следует обратиться в полицию или в консульский отдел посольства Российской Федерации в соответствующей стране и сохранить копию протокола для последующего предъявления в банк.",1.0,0.863592642808419,0.9999999999,1.0,0.9511223443943397,0.035,0.3557800564757548,0.97104263,0.860326671648572
Как обезопасить себя от съема данных карты в банкомате злоумышленниками? Приведи два способа.,"[""['Поэтому, при пользовании банкоматом не ленитесь внимательно осмотреть его и убедиться в отсутствии каких-либо «накладок» и посторонних устройств.', 'Пожалуйста, примите все меры, чтобы вводимый Вами ПИН-код был не заметен для окружающих.']""]","Чтобы обезопасить себя от съема данных карты в банкомате:

Внимательно осматривайте банкомат перед использованием на наличие подозрительных накладок и посторонних устройств.
Прикрывайте рукой клавиатуру при вводе ПИН-кода, чтобы его не могли увидеть окружающие.","Чтобы обезопасить себя от съема данных карты в банкомате злоумышленниками, важно соблюдать следующие меры безопасности:
1. Не передавайте карту другим лицам для проведения транзакций, даже родственникам и знакомым.
2. При использовании банкомата внимательно осмотрите его на предмет подозрительных устройств или накладок, убедитесь в отсутствии посторонних элементов.

Если контекст не дает достаточно информации для точного ответа, рекомендую обратиться в банк Tinkoff для получения дополнительной информации.",1.0,0.9359899445248084,0.9999999999,1.0,0.9395356734067983,0.0914,0.25686199798234866,0.9862283,0.9228918423991371
"Правда ли, что при бронировании гостиницы по карте мне необходимо сообщить все реквизиты карты, включая ПИН-код? Если нет, то что именно требуется сообщить?","[""['При бронировании номера в гостинице по карте Вас попросят сообщить свое имя, номер карты, срок ее действия (иногда, дополнительно — трехзначный код безопасности, напечатанный на обратной стороне карты на полосе для подписи) и срок Вашего пребывания.']""]","Нет, неправда. При бронировании гостиницы по карте не требуется сообщать ПИН-код. Обычно для бронирования запрашивают ваше имя, номер карты, срок ее действия, иногда трехзначный код безопасности (CVV/CVC) с оборотной стороны карты и планируемый срок пребывания.","Для бронирования номера в гостинице по карте необходимо сообщить свое имя, номер карты, срок ее действия, трехзначный код безопасности (иногда), срок пребывания. При проверке подлинности карты может быть произведен авторизационный запрос на незначительную сумму. При бронировании на карте блокируется сумма, равная стоимости проживания, которая может остаться недоступной для использования в течение 30 дней. После окончательного расчета потребуйте отправить уведомление о снятии блокировки.",1.0,0.9167711310412502,0.9999999999,1.0,0.9360368937809204,0.0995,0.3405586786120563,0.9903997,0.9326268410246112
"Если я из другой страны и у меня нет паспорта РФ, что мне делать?","[""['\\n                     1. Документы и сведения, получаемые в целях идентификации Клиентов-физических лиц, а также в целях обслуживания таких Клиентов в рамках Универсального договора\\n                     1.4. Реквизиты документа, удостоверяющего личность: серия (при наличии) и номер документа, дата выдачи документа, наименование органа, выдавшего документ (при наличии кода подразделения может не устанавливаться), и код подразделения (при наличии).\\n                     1.4.2.для иностранных граждан:\\n                     •паспорт иностранного гражданина;\\n                     •дипломатический паспорт, служебный паспорт, удостоверяющие личность иностранного гражданина.', '.5.Документ, подтверждающий право иностранного гражданина или лица без гражданства на пребывание (проживание) в Российской Федерации (миграционной карты в случае отсутствия иных документов), в случае если наличие таких документов обязательно в соответствии с международными договорами Российской Федерации и законодательством Российской Федерации;Документами, подтверждающими право иностранного гражданина или лица без гражданства на пребывание (проживание) в РФ, являются:\\n                    •миграционная карта в случае отсутствия иных документов;\\n                    •вид на жительство;\\n                    •разрешение на временное проживание;\\n                    •виза;\\n                    •иной документ, подтверждающий в соответствии с международными договорами Российской Федерации и законодательством РФ право иностранного гражданина или лица без гражданства на пребывание (проживание) в РФ.\\n']""]","
                        Если вы из другой страны, то для заключения договора вам неообходимы документы, удостоверяющие Вашу личность. Для иностранных граждан это:
                            •паспорт иностранного гражданина;
                            •дипломатический паспорт, служебный паспорт, удостоверяющие личность иностранного гражданина.
                        Также необходимы документы, подтверждающие право иностранного гражданина (проживание) в Российской Федерации (миграционной карты в случае отсутствия иных документов), в случае если наличие таких документов обязательно в соответствии с международными договорами Российской Федерации и законодательством Российской Федерации;Документами, подтверждающими право иностранного гражданина или лица без гражданства на пребывание (проживание) в РФ, являются:
                            •миграционная карта в случае отсутствия иных документов;
                            •вид на жительство;
                            •разрешение на временное проживание;
                            •виза;
                            •иной документ, подтверждающий в соответствии с международными договорами Российской Федерации и законодательством РФ право иностранного гражданина или лица без гражданства на пребывание (проживание) в РФ. ","Вам необходимо обратиться в банк Tinkoff для получения информации о процедуре открытия счета, если у вас нет паспорта РФ.",,0.9106273394219739,0.9999999999,0.16666666666666666,0.8402137560935985,0.0,0.06838032874999869,0.9378582,0.8369254618712493
В течении скольких дней действительна выписка из ЕГРЮЛ?,"[""['\\n                    2.2. Выписка из Единого государственного реестра юридических лиц (ЕГРЮЛ). Банком может быть принята копия \\n                    выписки, заверенная регистрирующим органом. Выписка считается действительной для предоставления в Банк \\n                    в течение 30 (тридцати) календарных дней с даты ее выдачи и должна содержать актуальные сведения на дату  \\n                    ее предоставления;']""]",Выписка из Единого государственного реестра юридических лиц (ЕГРЮЛ) действительна в течении 30 дней с даты ее выдачи.,Выписка из ЕГРЮЛ считается действительной для предоставления в банк в течение 30 (тридцати) календарных дней с даты ее выдачи.,1.0,0.9455374071274858,0.9999999999,0.25,0.9365978361622559,0.2331,0.35097566463211377,0.9836522,0.827410244164809
Нужно ли ИП указывать свой сайт для предприятия?,"[""['\\n                    3. Документы и сведения, предоставляемые Клиентом-индивидуальным предпринимателем: \\n                    3.5. Сведения о доменном имени, указателе страницы сайта в сети «Интернет», с использованием которых Клиентом \\nоказываются услуги (при наличии);\\n                    ']""]","Да, индивидуальному предпринимателю необходимо указать сведения о доменном имени, указателе страницы сайта в сети «Интернет».","Да, ИП должен указать свой доменный адрес и указатель страницы сайта в сети ""Интернет"", с использованием которых оказываются услуги, если таковые имеются.",,0.9153489958205477,0.9999999999,0.6666666666666666,0.9416087918929295,0.1142,0.23940392836234434,0.9831561,0.8317448469987875
Может ли Банк запросить дополнительные документы - не из списка обязательных?,"[""['\\n                     26. Банк может запросить у Клиента, а Клиент обязуется предоставить по запросу Банка дополнительные документы \\n                    и сведения, как предусмотренные, так и не предусмотренные настоящим Перечнем, в том числе в целях надлежащей \\n                    идентификации Клиента, его представителя, выгодоприобретателя и бенефициарного владельца в соответствии \\n                    с требованиями действующего законодательства Российской Федерации, нормативных актов Банка России, а также \\n                    требованиями Банка. Банк вправе не запрашивать отдельные документы и сведения, предусмотренные настоящим \\n                    Перечнем, в случаях, установленных внутренними правилами Банка.']""]","Да, Банк может запросить у Вас дополнительные не предусмотренные Перечнем документы.","Да, Банк может запросить у Клиента дополнительные документы и сведения, как предусмотренные, так и не предусмотренные в перечне документов.",,0.9577292967966017,0.9999999999,0.25,0.9632919398728224,0.2016,0.5446085357335911,0.98015445,0.9152824766100148
Какие документы нужно предоставить физическому лицу для открытия счета?,"[""['1. Документы и сведения, получаемые в целях идентификации Клиентов-физических лиц, а также в целях обслуживания таких Клиентов в рамках Универсального договора']""]","Физическому лицу для открытия счета необходимо предоставить документ, удостоверяющий личность (паспорт или иной документ из списка в п.1.4), документ, подтверждающий регистрацию или место пребывания, ИНН, СНИЛС и контактную информацию.","Для открытия счета физическому лицу необходимо предоставить следующие документы:
1. Документ, удостоверяющий личность (пункт 1.4).
2. Документ, подтверждающий регистрацию физического лица в реестре адвокатов (для физического лица, занимающегося частной практикой).
3. Документ, подтверждающий учреждение физическим лицом адвокатского кабинета.
4. Адрес места жительства или места пребывания.
5. Контактная информация (номер телефона, адрес электронной почты).

Также могут потребоваться дополнительные документы в зависимости от требований законодательства и организационно-правовой формы. Если у вас есть дополнительные вопросы, обращайтесь в банк для получения подробной информации.",0.5714285714285714,0.9911397536587442,0.9999999999,0.0,0.9513602772572203,0.0,0.31881521063231316,0.9768228,0.9572927984954832
Какие документы необходимо предоставить юридическому лицу для открытия счета в Банке? Можно ли предоставить сканы документов или нужны оригиналы?,"[""['2.1. Учредительные документы юридического лица...', '2.2. Выписка из Единого государственного реестра юридических лиц (ЕГРЮЛ)...', '2.3. Документ об избрании единоличного исполнительного органа юридического лица...']""]","Юридическому лицу необходимо предоставить учредительные документы, выписку из ЕГРЮЛ, документ об избрании руководителя, документы, подтверждающие личность руководителя и лиц, имеющих право подписи. Документы можно предоставить в копиях, заверенных нотариально, регистрирующим органом, руководителем или сотрудником Банка при наличии оригиналов.","Для открытия счета в банке Tinkoff юридическому лицу необходимо предоставить следующие документы:
1. Выписка из Единого государственного реестра юридических лиц (ЕГРЮЛ) - копия выписки, заверенная регистрирующим органом.
2. Документ об избрании единоличного исполнительного органа юридического лица.
3. Документы, подтверждающие полномочия единоличного исполнительного органа юридического лица.
4. Документ, удостоверяющий личность физического лица-единоличного исполнительного органа юридического лица.
5. Учредительные документы юридического лица: Устав юридического лица и/или Учредительный договор.

Сканы документов могут быть приняты, если они заверены регистрирующим органом. Документы предоставляются по требованию банка.",1.0,0.9350400520345575,0.9999999999,0.0,0.9397252024931086,0.0,0.2506129172272072,0.9748963,0.8509507450981063
Можно ли открыть счет индивидуальному предпринимателю – иностранному гражданину? Какие документы для этого нужны?,"[""['3.1. Идентификация индивидуального предпринимателя осуществляется на основании документов и сведений, указанных в пункте 1.4 настоящего Перечня', '3.2. Документ, подтверждающий право иностранного гражданина или лица без гражданства на пребывание (проживание) в Российской Федерации...']""]","Да, индивидуальному предпринимателю-иностранному гражданину можно открыть счет. Для этого нужно предоставить документ, удостоверяющий личность, документ, подтверждающий право пребывания/проживания в РФ (напр. миграционную карту), ИНН, СНИЛС, выписку из ЕГРИП и контактную информацию.","Для открытия счета индивидуальному предпринимателю – иностранному гражданину необходимы следующие документы:

1. Учредительные документы (Устав, Учредительный договор или иной документ, предусмотренный законодательством страны регистрации ЮЛ-нерезидента).
2. Документ, подтверждающий государственную регистрацию ЮЛ-нерезидента.
3. Выписка об аккредитации филиала, представительства иностранного юридического лица в государственном реестре аккредитованных филиалов, представительств иностранных юридических лиц (при необходимости).
4. Свидетельство о постановке на учет в налоговом органе ЮЛ-нерезидента в случаях, предусмотренных законодательством Российской Федерации.
5. Разрешение Национального (Центрального) банка иностранного государства на открытие счета.
6. Документ, подтверждающий полномочия руководителя ЮЛ-нерезидента.
7. Документ, удостоверяющий личность лица, наделенного правом подписи и руководителя ЮЛ-нерезидента.

Для более точной информации рекомендуется обратиться в банк Tinkoff.",1.0,0.9664456228373858,0.9999999999,0.0,0.9324749385166327,0.0,0.14337808028432394,0.9677203,0.8873607957571908
"Какие документы потребуются, если открывать счет для нотариуса, занимающегося частной практикой? Может ли нотариус быть иностранцем при этом?","[""['5.1. Документ, удостоверяющий личность и указанный в пункте 1.4 настоящего Перечня', '5.2. Документ, подтверждающий наделение нотариуса полномочиями (назначение на должность), выдаваемый органами юстиции субъектов Российской Федерации, в соответствии с законодательством Российской Федерации']""]","Для открытия счета нотариусу, занимающемуся частной практикой, требуется предоставить документ, удостоверяющий личность, документ о назначении на должность нотариуса от органов юстиции, регистрационные документы, финансовые документы и контактные данные. Нотариус может быть иностранцем, в этом случае дополнительно потребуется документ, подтверждающий право на пребывание/проживание в РФ.","Для открытия счета для нотариуса, занимающегося частной практикой и являющегося иностранным гражданином, необходимо предоставить следующие документы:
1. Учредительные документы (Устав, Учредительный договор или иной документ, предусмотренный законодательством страны регистрации нотариуса-иностранца).
2. Документ, подтверждающий государственную регистрацию нотариуса-иностранца.
3. Документ, подтверждающий право иностранного гражданина на пребывание (проживание) в Российской Федерации, если наличие такого документа предусмотрено законодательством.
4. Миграционную карту.
5. Документ, подтверждающий полномочия руководителя нотариуса-иностранца.
6. Документ, удостоверяющий личность нотариуса-иностранца и лица, уполномоченного распоряжаться денежными средствами на счете.

Если у нотариуса-иностранца есть филиал или представительство в России, то также может потребоваться выписка об аккредитации филиала или представительства.

Если у нотариуса-иностранца есть разрешение Национального (Центрального) банка иностранного государства на открытие счета, то это также должно быть предоставлено.

Если у вас есть дополнительные вопросы или необходима более подробная информация, вы можете обратиться в банк Tinkoff для получения консультации.",0.7777777777777778,0.962241784290888,0.9999999999,1.0,0.9573901515946383,0.0,0.29422975183856703,0.98235244,0.9259609791188808
"Как узнать, кто является бенефициарным владельцем юридического лица? Какие документы для этого нужны?","[""['12. Идентификация бенефициарного(ых) владельца(ев) осуществляется на основании следующий документов и сведений...']""]","Для идентификации бенефициарного владельца юридического лица необходимо предоставить документы, удостоверяющие личность бенефициара, документ о регистрации/пребывании в РФ (если бенефициар - иностранец), ИНН, адрес регистрации и контактные данные. Также можно заполнить анкету бенефициарного владельца по форме Банка.","Для установления бенефициарного владельца юридического лица необходимо предоставить следующие документы и сведения: выписка из ЕГРИП, документ, удостоверяющий личность, контактная информация, информация о страховом номере индивидуального лицевого счета, сведения о целях установления деловых отношений с банком. При этом идентификация бенефициарных владельцев осуществляется на основании заполненной Анкеты физического лица - бенефициарного владельца по форме банка. Если бенефициарный владелец является иностранным гражданином, идентификация осуществляется исключительно на основании предоставленных документов и сведений.",1.0,0.9431735739749892,0.9999999999,1.0,0.970320853929383,0.0858,0.23437465404483243,0.9881472,0.8807668005272995
Расскажи про термины 'Договор страхования' и 'КАСКО',"[""['1. Термины и определения     \\n                    Договор страхования — договор, по которому одна сторона (Страховщик) обязуется за обусловленную договором \\n                    плату (страховую премию) при наступлении предусмотренного в договоре события (страхового случая) осуществить \\n                    другой стороне (страхователю) или иному лицу, в пользу которого заключен договор (выгодоприобретателю), \\n                    страховое возмещение в пределах определенной договором суммы (страховой суммы).', 'КАСКО — комбинированное страхование транспортных средств и сопутствующих рисков.']""]"," Да, конечно! Договор страхования — это договор, по которому одна сторона (Страховщик) обязуется за обусловленную договором 
                    плату (страховую премию) при наступлении предусмотренного в договоре события (страхового случая) осуществить 
                    другой стороне (страхователю) или иному лицу, в пользу которого заключен договор (выгодоприобретателю), 
                    страховое возмещение в пределах определенной договором суммы (страховой суммы). 
                    КАСКО — это комбинированное страхование транспортных средств и сопутствующих рисков.","Договор страхования - это юридический документ, который определяет условия страхования между страхователем и страховщиком. В данном контексте, договор страхования может быть обязательным (например, ОСАГО) или добровольным (например, КАСКО). Договор страхования может быть продлен автоматически на новый срок при соблюдении условий продления, предусмотренных самим договором. Страховая сумма в договоре страхования может быть установлена как в рублях, так и в иностранной валюте. При заключении договоров страхования страховщик имеет право осуществлять различные виды наблюдения и фиксации информации.",1.0,0.8758233014689146,0.9999999999,0.25,0.9155852523628645,0.0,0.18129846809596575,0.982706,0.9051366355966497
"Какой минимум страховой выплаты мне вернут, если моя страховая сумма = 50 000 долларов?","[' \n                    2.19.   При добровольном страховании непредвиденных расходов путешественников страховая сумма в договоре \n                    страхования может быть установлена в рублях или иностранной валюте в рублевом эквиваленте по официальному \n                    курсу иностранных валют ЦБ РФ на дату заключения Договора страхования, но не менее чем 66,7 руб. за 1 у.е.  при \n                    страховой сумме 30 000 у.е., 57,2 руб. за 1 у.е. при страховой сумме 35 000 у.е., 50 руб. за 1 у.е. при страховой сумме \n                    50 000 у.е., 26,7 руб. за 1 у.е. при страховой сумме 75 000 у.е.']"," 
                    Минимальная страховая выплата, которую вам вернут, если ваша страховая сумма составляет 50 000 долларов, составляет 50 рублей за 1 доллар США. Минимальная выплата составит 2 500 000 рублей.
                    Обратите внимание, что это минимальная выплата, которую вы получите. Фактическая сумма выплаты может варьироваться в зависимости от условий вашего договора.
        ",Из предоставленного контекста необходимой информации о минимальной страховой выплате при страховой сумме в 50 000 долларов нет. Рекомендуется обратиться в банк Tinkoff для получения точной информации по данному вопросу.,,0.0,0.9999999999,0.2,0.9134241447539656,0.0,0.05809924880465303,0.9758333,0.8716633902482881
"При принятии пользовательских соглашений, кому еще попадают мои данные?","[""['\\n                    5. Персональные данные     \\n                        5.1.       Пользователь подтверждает, что с использованием Дистанционных каналов взаимодействия дает Страховщику, \\n                        аффилированным лицам страховщика, Страховому агенту или Страховому брокеру, а также лицам, \\n                        предоставляющим услуги по использованию их информационных возможностей для целей заключения договоров \\n                        страхования, хранения документов, в том числе, облачных сервисов, серверов, программных продуктов, согласие на \\n                        обработку его персональных данных с целью осуществления дистанционного взаимодействия с последними при \\n                        использовании их Сайта и/или сайтов в сети Интернет или при помощи ПО Страховщика и в целях осуществления \\n                        маркетинговых коммуникаций перечисленных лиц с Пользователем.  \\n        ']""]","
                    Согласно пункту 5.1 пользовательского соглашения, ваши персональные данные могут быть переданы следующим сторонам:
                        • Аффилированные лица страховщика
                        • Страховой агент
                        • Страховой брокер
                        • Лица, предоставляющие услуги по использованию их информационных возможностей для целей заключения договоров страхования, хранения документов, в том числе облачных сервисов, серверов, программных продуктов
","При принятии пользовательских соглашений, Ваши данные могут попасть к страховщику, аффилированным лицам страховщика, страховому агенту или страховому брокеру, а также лицам, предоставляющим услуги по использованию их информационных возможностей для целей заключения договоров страхования, хранения документов и осуществления маркетинговых коммуникаций. Пользователь подтверждает, что предоставленные им согласия на обработку персональных данных содержат все необходимые сведения, предусмотренные законодательством. Важно помнить, что обработка Ваших данных может осуществляться на протяжении 15 лет, а в случае отзыва согласия, данные должны быть уничтожены в течение года после отзыва согласия и прекращения отношений с банком.",1.0,0.0,0.9999999999,0.25,0.9211255295855036,0.1076,0.1700169467209856,0.99231213,0.916992479228023
Зачем страховщик ведет аудио и видеозапись при взаимодействии с клиентом? Как долго эти записи хранятся?,"[""['При заключении Договоров страхования, а также при ином обращении Клиента или Пользователя к Страховщику или его представителям Страховщик вправе осуществлять наблюдение, фотографирование, аудио- и видеозапись, включая запись телефонных разговоров, а также копирование и хранение переписок между Пользователем и Страховщиком (его представителями) по электронной почте или в мессенджерах, без дополнительного уведомления Клиента (Пользователя) о такой записи. Клиент соглашается, что Страховщик вправе хранить такие записи в течение 5 (пяти) лет с момента прекращения отношений с Клиентом (Пользователем), с целью улучшения качества обслуживания, исполнения Договора страхования, а также использовать их при проведении любых расследований в связи с Договором страхования.']""]","Страховщик ведет аудио, видеозапись, фотографирование, копирует переписку с клиентом без дополнительного уведомления с целью улучшения качества обслуживания, исполнения договора страхования, а также для использования этих записей при проведении расследований, связанных с договором. Такие записи страховщик вправе хранить в течение 5 лет с момента прекращения отношений с клиентом.","Страховщик ведет аудио и видеозапись при взаимодействии с клиентом с целью улучшения качества обслуживания, исполнения Договора страхования, а также использования при проведении расследований в связи с Договором страхования. Эти записи хранятся в течение 5 лет с момента прекращения отношений с клиентом.",1.0,0.937818760320403,0.9999999999,1.0,0.982596268069897,0.3565,0.6286451831229066,0.9962523,0.9713393280688765
В каких случаях застрахованному могут быть оплачены планируемые расходы по страховому случаю до предоставления подтверждающих документов? Какие ограничения есть по размеру таких выплат?,"[""['По договорам добровольного страхования непредвиденных расходов путешественников по предварительному согласованию со Страховщиком Застрахованному могут оплачиваться планируемые расходы по предусмотренным договором страхования страховым событиям, предусматривающим возмещение расходов на оказание Экстренной или Неотложной амбулаторной и/или стационарной помощи, с условием предоставления Застрахованным документов, подтверждающих такие расходы Страховщику непосредственно после их несения (чеки, платежные документы и пр.). В случае если в результате страхового случая Застрахованным лицом были понесены соответствующие расходы на оказание Экстренной или Неотложной амбулаторной и/или стационарной помощи, в том числе, предварительно согласованные Страховщиком, но не были предоставлены документы, подтверждающие их оплату, Страховщик возмещает расходы в размере не более 200 у.е. (если страховая сумма установлена в валюте, отличной от российского рубля) или 10 000 российских рублей (если страховая сумма установлена в российских рублях), за один страховой случай.']""]","По договорам добровольного страхования непредвиденных расходов путешественников застрахованному могут быть оплачены планируемые расходы по страховым случаям, предусматривающим возмещение расходов на экстренную/неотложную амбулаторную или стационарную помощь, по предварительному согласованию со страховщиком. Условие - предоставление подтверждающих документов сразу после несения расходов. Если документы не предоставлены, то страховщик возмещает расходы в размере не более 200 у.е. (если страховая сумма в валюте) или 10 000 рублей (если в рублях) за один случай.","В случае добровольного страхования непредвиденных расходов путешественников, застрахованному могут быть оплачены планируемые расходы по страховому случаю до предоставления подтверждающих документов, при условии предоставления документов, подтверждающих такие расходы страховщику непосредственно после их несения. Однако, если в результате страхового случая были понесены расходы, но не были предоставлены документы, подтверждающие оплату, страховщик возмещает расходы в размере не более 200 у.е. или 10 000 российских рублей за один страховой случай, в зависимости от установленной страховой суммы.",1.0,0.8806892260185869,0.9999999999,1.0,0.9707489790492296,0.2536,0.43383963747998716,0.99589634,0.9635567841358713
Куда пользователь может направить обращение при возникновении вопросов или спора со страховщиком?,"[""['При возникновении вопросов или спора можно отправить обращение:\\n\\nв АО «Тинькофф Страхование» по почте по адресу: 127287, Российская Федерация, г. Москва, ул. 2-я Хуторская, дом 38А, строение 26, либо путем заполнения соответствующей формы на сайте Страховщика;\\nк финансовому уполномоченному путем регистрации обращения на сайте — finombudsman.ru или по почтовому адресу: 119017, г. Москва, Старомонетный пер., дом 3;\\nво Всероссийский союз страховщиков на сайте — ins-union.ru, приложив к обращению необходимые документы и сведения, либо на почтовый адрес: 115093, г. Москва, ул. Люсиновская, д. 27, стр. 3;\\nв Центральный Банк Российской Федерации (Банк России) через интернет-приемную на официальном сайте — cbr.ru, приложив к обращению необходимые документы и сведения, либо на почтовый адрес: 107016, г. Москва, ул. Неглинная, д. 12.']""]","При возникновении вопросов или спора с АО 'Тинькофф Страхование' пользователь может направить обращение:

 - В АО 'Тинькофф Страхование' по почте или через форму на сайте;
 - Финансовому уполномоченному на сайте finombudsman.ru или почтовым адресом;
 - Во Всероссийский союз страховщиков на сайте ins-union.ru или почтовым адресом;
В Центральный Банк РФ через интернет-приемную на сайте cbr.ru или почтовым адресом.","При возникновении вопросов или споров со страховщиком пользователь может направить обращение:

1. В АО ""Тинькофф Страхование"" по почте по адресу: 127287, Российская Федерация, г. Москва, ул. 2-я Хуторская, дом 38А, строение 26, либо заполнить соответствующую форму на сайте Страховщика.
2. К финансовому уполномоченному через регистрацию обращения на сайте finombudsman.ru или по почтовому адресу: 119017, г. Москва, Старомонетный пер., дом 3.
3. Во Всероссийский союз страховщиков на сайте ins-union.ru, приложив необходимые документы и сведения, или по почтовому адресу: 115093, г. Москва, ул. Люсиновская, д. 27, стр. 3.
4. В Центральный Банк Российской Федерации (Банк России) через интернет-приемную на официальном сайте cbr.ru, приложив необходимые документы и сведения, или на почтовый адрес: 107016, г. Москва, ул. Неглинная, д. 12.

Надеюсь, это поможет вам решить ваш вопрос.",0.8,0.982424272809009,0.9999999999,1.0,0.9688223349707166,0.0869,0.48764595313280995,0.98407716,0.9338369341899061
Где можно ознакомиться с дополнительной информацией и документами о деятельности АО 'Тинькофф Страхование'?,"[""['Дополнительная информация и документы о деятельности Страховщика в соответствии с п. 6.1 Закона РФ от 27.11.1992 N 4015-1 «Об организации страхового дела в Российской Федерации» и п. 2.1.1. «Базового стандарта защиты прав и интересов физических и юридических лиц — получателей финансовых услуг, оказываемых членами саморегулируемых организаций, объединяющих страховые организации» размещены по ссылкам: tinkoffinsurance.ru/about, tinkoffinsurance.ru/about/documents.']""]",Дополнительная информация и документы о деятельности АО 'Тинькофф Страхование' в соответствии с законом 'Об организации страхового дела в РФ' и базовым стандартом защиты прав получателей финансовых услуг размещены на сайте страховщика по ссылкам tinkoffinsurance.ru/about и tinkoffinsurance.ru/about/documents.,"Дополнительная информация и документы о деятельности АО ""Тинькофф Страхование"" размещены на официальном сайте tinkoﬃnsurance.ru/about и tinkoﬃnsurance.ru/about/documents. Кроме того, возможно обратиться в Страховщика по почтовому адресу: 127287, Российская Федерация, г. Москва, ул. 2-я Хуторская, дом 38А, строение 26, либо заполнить соответствующую форму на сайте Страховщика.",,0.0,0.9999999999,1.0,0.9567348565697673,0.1568,0.35208905836384347,0.98796606,0.8853482522327923
Что означает 'Партия' и вообще 'Слиток' для драгоценных металлов?,"[""['\\n                    Партия — приобретенные Клиентом Слитки в количестве, превышающем 1 (одну) штуку, и подлежащие доставке Клиенту, \\n                    в рамках одной Заявки', ' Слиток — аффинированный драгоценный металл: золото, серебро, платина и палладий в виде слитков (стандартных, \\n                    мерных), соответствующих установленным в Российской Федерации стандартам или международным стандартам качества, \\n                    изготовленных и маркированных организацией, осуществляющей аффинаж драгоценного металла. Слиток в рамках \\n                    предоставления Сервиса доставляется / принимается на хранение в ненарушенной Упаковке с приложением Сертификата-\\n                    ярлыка (при наличии) и Сертификата качества слитка']""]","Давайте разберемся! 
                    Партия — это приобретенные клиентом слитки в количестве, превышающем 1 штуку, и подлежащие доставке клиенту, в рамках одной заявки.
                    Слиток — это аффинированный драгоценный металл: золото, серебро, платина и палладий в виде слитков (стандартных, 
                    мерных), соответствующих установленным в Российской Федерации стандартам или международным стандартам качества, 
                    изготовленных и маркированных организацией, осуществляющей аффинаж драгоценного металла. Слиток в рамках 
                    предоставления Сервиса доставляется / принимается на хранение в ненарушенной Упаковке с приложением Сертификата-
                    ярлыка (при наличии) и Сертификата качества слитка.
        ","Партия - это приобретенные клиентом слитки в количестве, превышающем одну штуку, и подлежащие доставке клиенту в рамках одной заявки. Слиток - это аффинированный драгоценный металл (золото, серебро, платина, палладий) в виде стандартных или мерных слитков, соответствующих установленным стандартам качества и маркированных организацией, занимающейся аффинажем драгоценного металла.",1.0,0.9042722491818633,0.9999999999,1.0,0.9647942287985954,0.2006,0.6356700693764269,0.9963264,0.9785309376440924
Меня действительно должны фотографировать после полкчения слитка? Какой это пункт в соглашении?,"[""['\\n                    2.13.12. После подтверждения получения Клиентом/Доверенным лицом Слитка Представитель фотографирует Клиента/\\n                    Доверенное лицо с полученным Слитком в ненарушенной заводской упаковке и документом, удостоверяющим личность \\n                    Клиента/Доверенного лица']""]","Да, Вас действительно должнен сфотографировать Представитель в соответсвии с пунктом 2.13.12.","Да, согласно пункту 2.13.12 пользователь соглашается на фотографирование с полученным слитком в ненарушенной заводской упаковке и документом, удостоверяющим личность клиента.",1.0,0.8562666856451253,0.9999999999,0.5,0.880798229523959,0.0,0.12802809697436165,0.9805148,0.6940107653672092
Какие условия хранения?,"[""[' \\n                    2.14.9. Условия хранения: температура воздуха от +17 до +25 °С, атмосферное давление от 740 до 760 мм рт. ст., относительная \\n                    влажность воздуха от 30 до 60%']""]","
                    В соответсвии с пунктом 2.14.9. условия хранения слитка слудующие: 
                        - температура воздуха от +17 до +25 °С,
                        - атмосферное давление от 740 до 760 мм рт. ст.,
                        - относительная влажность воздуха от 30 до 60% ","Условия хранения Слитка в банке Tinkoff включают в себя следующее:
- Срок хранения Слитка устанавливается до востребования Клиентом.
- Слиток хранится в хранилище 5 класса устойчивости к взлому, с системой видеонаблюдения и охранно-пожарной сигнализацией.
- Условия хранения включают определенные параметры: температура воздуха от +17 до +25 °С, атмосферное давление от 740 до 760 мм рт. ст., относительная влажность воздуха от 30 до 60%.
- Банк вправе изменить условия и место хранения Слитка с письменного согласия Клиента или в случае обстоятельств непреодолимой силы.
- Клиент обязан получить Слиток или обеспечить его получение в согласованные дату, время и место.",0.2,0.8298415720830405,0.9999999999,0.75,0.911758022544306,0.0927,0.5251264610560191,0.9685102,0.9010947955531293
Что такое 'Сертификат качества слитка'?,"[""['Сертификат качества слитка — документ о качестве драгоценного металла, содержащий сведения о соответствии драгоценного металла стандартам качества, технические характеристики и параметры Слитка, информацию о химическом составе, произведенный/заверенный предприятием-изготовителем Слитка.']""]","Сертификат качества слитка - это документ, выданный изготовителем слитка драгоценного металла, который содержит информацию о соответствии металла стандартам качества, его технические характеристики, параметры и химический состав.","Сертификат качества слитка - это документ, который содержит информацию о качестве драгоценного металла, технические характеристики и параметры слитка, а также данные о химическом составе. Этот документ производится или заверяется предприятием-изготовителем слитка и является важным элементом при покупке или продаже драгоценных металлов. Сертификат качества слитка помогает клиенту убедиться в соответствии слитка стандартам качества и правильности его приобретения.",1.0,0.9645125633714192,0.9999999999,1.0,0.9856893453676798,0.1032,0.5834723842718468,0.99169743,0.9239090184182619
На какой срок выдается эта доверенность? Можно ли ее передоверить другому лицу?,"[""['Датой выдачи доверенности считается дата предоставления Представляемым Банку данных своего представителя. Доверенность выдана сроком на 1 (один) год, полномочия по настоящей доверенности не могут быть передоверены другим лицам.']""]",Доверенность выдается сроком на 1 год. Полномочия по этой доверенности нельзя передоверять другим лицам.,Доверенность выдается сроком на 1 (один) год и не может быть передоверена другим лицам.,,0.9560303323446292,0.9999999999,1.0,0.9724368258951452,0.3058,0.39244259912930424,0.98615396,0.9537611896499469
"Как клиент может получить сертификат качества слитка, который он передал на хранение в банк?","[""['По требованию Клиента Банк предоставляет Клиенту заверенную Банком копию Сертификата качества слитка, переданного на ответственное хранение.']""]","По требованию клиента банк предоставляет ему заверенную копию сертификата качества слитка, который клиент передал на ответственное хранение в банке.","Клиент может получить сертификат качества слитка, который он передал на хранение в банк, по требованию. Банк предоставляет клиенту заверенную копию сертификата качества слитка, переданного на ответственное хранение. Факт приема-передачи слитка на ответственное хранение подтверждается актом приема-передачи, который подписывается в двух экземплярах сторонами (по одному для каждой из сторон).",1.0,0.9999999999999999,0.9999999999,1.0,0.9697147274896953,0.0713,0.553726365849992,0.98483133,0.89338396572891
Какие условия хранения слитков в банке? Где их хранят?,"[""['Хранение Банком Слитка Клиента осуществляется в хранилище 5 (Пятого) класса устойчивости к взлому, оборудованном системой видеонаблюдения и охранно-пожарной и тревожной сигнализации с выводом сигнала на пункт централизованной охраны, с осуществлением физической круглосуточной специализированной охраны хранилища.', 'Условия хранения: температура воздуха от +17 до +25 °С, атмосферное давление от 740 до 760 мм рт. ст., относительная влажность воздуха от 30 до 60%.']""]","Слитки хранятся в специальном хранилище 5 класса устойчивости к взлому, оборудованном системами видеонаблюдения, охранно-пожарной и тревожной сигнализацией, а также круглосуточной охраной. Условия хранения: температура +17...+25°С, атмосферное давление 740-760 мм рт.ст., влажность 30-60%.","Слитки драгоценных металлов в банке Tinkoff хранятся в хранилище 5 класса устойчивости к взлому, оборудованном системой видеонаблюдения и охранно-пожарной сигнализации. Условия хранения слитков включают в себя температуру воздуха от +17 до +25 °C, атмосферное давление от 740 до 760 мм рт. ст. и относительную влажность воздуха от 30 до 60%. Слитки могут храниться в различных местах, включая офисные помещения в бизнес-центрах, торговые центры, частные дома в коттеджных поселках или квартиры. Срок хранения слитка у банка - с даты подписания до востребования. В случае необходимости изменения условий или места хранения слитка, банк может это сделать только с письменного согласия клиента или при возникновении обстоятельств непреодолимой силы.",0.6,0.8857239070810078,0.9999999999,1.0,0.9389252492062017,0.0242,0.29070175517603225,0.98317724,0.9470269497409919
"Можно ли вернуть слиток в банк, если при получении были обнаружены его повреждения? Как это сделать?","[""['В случае обнаружения при приеме Слитка с ответственного хранения от Представителя нарушения целостности заводской упаковки Слитка, несоответствия нанесенной на Слиток маркировки данным, указанным в Сертификате качества слитка и/или Сертификате-ярлыке, отсутствия либо повреждения Сертификата качества слитка и/или Слитка (наличие на поверхности Слитка наплывов / заусенцев / царапин / жировых пятен / посторонних включений) Клиентом/Доверенным лицом и Представителем оформляется в двух экземплярах Рекламационный акт по форме Приложения № 3 к настоящим Правилам, в котором фиксируются указанные выше нарушения / несоответствия / повреждения. В случае наличия указанных выше нарушений / несоответствий / повреждений Слиток вместе с Сертификатом качества слитка и Сертификатом-ярлыком вкладываются Клиентом/Доверенным лицом в порожний сейф-пакет и запечатываются, после чего сейф-пакет помещается в Устройство для перевозки слитка с дальнейшим опломбированием номерной разовой пломбой. Номер сейф-пакета, а также номерной разовой пломбы отражаются в Рекламационном акте.']""]","Да, если при получении слитка с хранения были обнаружены его повреждения или нарушения упаковки, несоответствия маркировки и т.п., то клиент/доверенное лицо вместе с представителем банка оформляют рекламационный акт в двух экземплярах. В этом акте фиксируются все нарушения. После этого слиток вместе с сертификатами запечатывают в новый сейф-пакет и опломбировывают, указав номера на рекламационном акте. Затем слиток возвращается обратно в банк.","Для возврата слитка в банк Tinkoff при обнаружении повреждений при получении необходимо оформить Рекламационный акт в двух экземплярах. Клиент/Доверенное лицо должны удостоверить личность, сверить номер пломбы и номер сейф-пакета, после чего вскрыть сейф-пакет в присутствии Представителя. При обнаружении повреждений слитка, несоответствия маркировки или отсутствия/повреждения сертификатов, оформляется Рекламационный акт. Слиток затем подлежит возврату в банк Tinkoff.",,0.9103546869851268,0.9999999999,1.0,0.9428415217252422,0.0598,0.26974370348437543,0.9937769,0.940898659866227
Кто может стать доверенным лицом?,"[""['Доверенное лицо — физическое лицо, уполномоченное Клиентом, которому предоставлено право на представление интересов Клиента и осуществление действий от его имени в рамках Сервиса на основании доверенности, оформленной посредством Дистанционного обслуживания в соответствии с п. 5.3 настоящих Правил по форме Приложения № 5 к настоящим Правилам.']""]","Доверенным лицом клиента может стать любое физическое лицо, которому клиент предоставит полномочия представлять его интересы в рамках сервиса покупки/продажи слитков драгоценных металлов. Доверенность на это лицо оформляется клиентом посредством дистанционного обслуживания в банке по форме из Приложения №5 к Правилам.","Доверенным лицом может стать лицо, которое имеет доверенность или иной документ, подтверждающий его полномочия и признаваемый таковым. Для идентификации представителя клиента требуется предоставление соответствующих документов и сведений, включая наименование, дату выдачи, срок действия и номер документа, на основании которых основаны полномочия представителя. Требования к оформлению доверенностей также устанавливаются законодательством Российской Федерации, включая указание необходимых для совершения сделки полномочий представителя и действующую на момент заключения сделки доверенность.",1.0,0.8546966712167712,0.9999999999,1.0,0.915150298793046,0.0,0.14881331697981084,0.9862374,0.9052878935023206
Можно ли поменять доверенное лицо? Как это сделать?,"[""['Клиент может отменить выданную доверенность путем обращения в Банк посредством Дистанционного обслуживания в любое время, но не позднее одного дня до планируемой даты встречи с представителем Клиента.']""]","Да, клиент может отменить ранее выданную доверенность на доверенное лицо. Для этого он должен обратиться в банк посредством дистанционного обслуживания не позднее чем за 1 день до планируемой даты встречи с действующим доверенным лицом.","Для изменения доверенного лица необходимо выдать доверенность на нового представителя по форме Приложения № 5 к настоящим Правилам. Клиент должен предоставить банку данные нового представителя (фамилия, имя, отчество, дата рождения, серия и номер паспорта, кем и когда выдан). Выданную доверенность можно отменить обратившись в банк через Дистанционное обслуживание не позднее чем за один день до планируемой встречи с представителем.",0.3333333333333333,0.9513687242142957,0.9999999999,1.0,0.9225207223794393,0.0653,0.2568043163032857,0.9893822,0.8980599184365199
Как происходит покупка слитка банком? Есть ли какие-то особые условия?,"[""['Банк приобретает у Клиента только Слитки, находящиеся на ответственном хранении в Банке.', 'Клиент, обращаясь с Заявкой, подтверждает, что на момент заключения договора купли-продажи Слиток принадлежит на праве собственности Клиенту, не продан, не является предметом залога, не обременен правами третьих лиц, в споре, под арестом и иным запрещением не состоит.']""]","Банк осуществляет покупку слитков драгоценных металлов только у тех клиентов, чьи слитки находятся на ответственном хранении в самом банке. При подаче заявки на продажу слитка клиент должен подтвердить, что на момент продажи слиток принадлежит ему на праве собственности, не продан, не заложен, не арестован и не обременен правами третьих лиц.","При покупке слитка в банке Tinkoff следующие основные условия:

1. Договор купли-продажи Слитка заключается на условиях, установленных Правилами банка и действующим законодательством Российской Федерации.
2. Акцептом является зачисление стоимости Слитка на Картсчет Клиента.
3. Право собственности на Слиток переходит от Клиента к Банку с момента зачисления стоимости на Картсчет.
4. Прием Слитка производится по Сертификату-ярлыку и Сертификату качества с проведением контрольного взвешивания и проверкой целостности упаковки, маркировки и состояния Слитка.

Поэтому, основные шаги при покупке слитка в банке Tinkoff включают оформление Заявки, согласование условий с Банком, подписание необходимых документов и зачисление стоимости на Картсчет Клиента.",0.0,0.9179526286737015,0.9999999999,1.0,0.8962890193954272,0.0,0.19702748323089475,0.9714538,0.8423242503234016
Что такое накопительный счет и как начисляются проценты?,"[""['\\n                    3.1. Начисление процентов на остаток средств по Счету вклада/Накопительному счету производится со дня, следующего \\n                    за днем зачисления денежных средств на Счет вклада/Накопительный счет Клиента, до дня окончания срока Вклада \\n                    (включительно) либо до их списания со Счета вклада/Накопительного счета по иным основаниям.', ' \\n                    3.3. Клиент имеет возможность по согласованию с Банком посредством Дистанционного обслуживания изменить Тарифный \\n                    план Вклада на Тарифный план для мультивалютного Вклада. При смене Тарифного плана изменения в части процентной \\n                    ставки по Счету вклада, изначально открытого в рамках текущего Договора вклада, не распространяются до конца срока \\n                    размещения, установленного предыдущим Тарифным планом. Процентные ставки по валютам, отличным от валюты \\n                    измененного Тарифного плана, устанавливаются новым Тарифным планом.\\n                    3.4. При начислении процентов в расчет принимается величина процентной ставки (в процентах годовых) и фактическое \\n                    количество календарных дней, на которое привлечены денежные средства. При этом за базу берется действительное \\n                    число календарных дней в году (365 или 366 дней соответственно).\\n                    ', ' \\n                    Накопительный счет — счет, на котором учитываются денежные средства Клиента, предусматривающий начисление \\n                    процентов на остаток денежных средств, в соответствии с Договором накопительного счета.']""]","
                    Накопительный счет - это счет, на котором учитываются денежные средства клиента и на который начисляются проценты на остаток денежных средств. Проценты начисляются в соответствии с условиями договора накопительного счета.
                    Проценты на накопительном счете начисляются со дня, следующего за днем зачисления денежных средств на счет, до дня окончания срока вклада (включительно) либо до их списания со счета по другим основаниям.

                    При начислении процентов учитываются:
                    • Величина процентной ставки (в процентах годовых)
                    • Фактическое количество календарных дней, на которое привлечены денежные средства

                    За базу берется действительное число календарных дней в году (365 или 366 дней соответственно).","Накопительный счет - это счет, на который можно перевести крупные суммы денег для их накопления. Проценты начисляются на остаток средств на накопительном счете в соответствии с условиями банка. Для получения более подробной информации о начислении процентов на накопительный счет в банке Tinkoff, рекомендуется обратиться в банк для консультации.",,0.9534691364632103,0.9999999999,0.3333333333333333,0.9249640776599732,0.1083,0.35121081362304385,0.9896264,0.9482716248933285
Можно ли открыть вклад в 12 лет?,"[""['1.2. Банк не заключает Договор вклада (Договор накопительного счета) с лицами, не достигшими возраста 14 лет']""]","Нет, Банк не заключает договор вклада с лицами, не достигшими возраста 14 лет.","Для открытия вклада в банке Tinkoff необходимо достичь совершеннолетия, то есть быть старше 18 лет. Таким образом, открыть вклад в 12 лет нельзя.",,0.896015543002349,0.9999999999,1.0,0.8753738243676915,0.0,0.09291665595867052,0.96623427,0.897619937935978
Могу ли я открыть несколько вкладов и пополнять их?,"[""['\\n                    4.1. Клиент имеет право:\\n                    4.1.1. Предъявить Банку требование о досрочном полном или частичном изъятии Вклада.\\n                    4.1.2. Вносить дополнительные денежные средства во Вклад/Накопительный счет, если данная возможность установлена \\n                    Тарифным планом.\\n                    4.1.3. Разместить несколько Вкладов (открыть несколько Счетов вклада/Накопительных счетов на условиях, устанавливаемых \\n                    Договором вклада (Договором накопительного счета), Тарифами:\\n                    • через Дистанционное обслуживание;\\n                    • в офисе Банка в часы работы операционного подразделения Банка.\\n']""]"," 
                    Да, вы можете открыть несколько вкладов и пополнять их.
                    Согласно пункту 4.1.3 приведенного контекста, клиент имеет право разместить несколько вкладов (открыть несколько счетов вклада/накопительных счетов) на условиях, устанавливаемых договором вклада (договором накопительного счета) и тарифами.
                    Вы можете открыть несколько вкладов как через дистанционное обслуживание, так и в офисе банка в часы работы операционного подразделения банка.",Клиенты могут открывать несколько вкладов в банке Tinkoff и пополнять их.,1.0,0.9296321637600696,0.9999999999,0.375,0.89878877239659,0.0,0.2016538860308617,0.93187606,0.7610991640550948
Для получения страховой выплаты в случае несчастного случая с летальным исходом нужна ли справка из психушки?,"[""['\\n                    6.1. По риску Смерть в результате Несчастного случая должны быть предоставлены следующие документы:\\n                    j. Справка из психоневрологического диспансера и наркологического диспансера']""]","Да, в таком случае необходимы справки из психоневрологического диспансера и наркологического диспансера.","Для получения страховой выплаты в случае несчастного случая с летальным исходом не требуется предоставление справки из психушки. Для получения страховой выплаты необходимо заключить договор страхования с соответствующими условиями и предоставить документы, подтверждающие страховой случай и причину летального исхода. В случае сомнений или необходимости дополнительной информации, рекомендуем обратиться в банк Tinkoff для получения конкретных инструкций и требований.",,0.0,0.9999999999,0.6666666666666666,0.8311693621207921,0.0,0.0762569399124133,0.9620082,0.7423572631712184
Дают ли кредит на автомобиль?,"[""['3.1. Банк предоставляет Клиенту Кредит на потребительские цели, в том числе на приобретение Товара и/или Автомобиля, в соответствии с законодательством Российской Федерации.']""]","Да, в соответсвии с пунктом 3.1. Банк предоставляет Клиенту Кредит на потребительские цели, , в том числе на приобретение автомобиля.","К сожалению, из предоставленного контекста нельзя однозначно определить, дает ли банк Tinkoff кредит на автомобиль. Рекомендую обратиться в банк напрямую для получения подробной информации по данному вопросу.",,0.0,0.9999999999,1.0,0.8773573359531358,0.0,0.13779746270958373,0.97890013,0.809813644662806
Распростроняется ли страховое покрытие на смерть в алкогольном опьянении?,"[""[' \\n                    Страховое покрытие по рискам «Смерть» и «Инвалидность» не распространяется на события, произошедшие в результате \\n                    и/или в период:\\n                    a. действий, совершенных Застрахованным лицом в состоянии алкогольного, наркотического и/или токсического \\n                    опьянения; в результате употребления им наркотических, сильнодействующих лекарственных препаратов \\n                    и психотропных веществ без предписания врача (или по предписанию врача, но с нарушением указанной  \\n                    им дозировки); болезни Застрахованного лица, прямо связанной с наркоманией, токсикоманией, хроническим \\n                    алкоголизмом\\n                    ']""]","Нет, страховое покрытие не распространяется на смерть в алкогольном опьянении.","К сожалению, предоставленный контекст не содержит информации о том, распространяется ли страховое покрытие на смерть в алкогольном опьянении. Рекомендую обратиться в банк Tinkoff для получения точной информации по данному вопросу.",,0.0,0.9999999999,0.5,0.9097661207612852,0.0651,0.3674930504891881,0.9707457,0.7959092588676108
"Может ли Банк изменить Тарифный план по кредитной карте, и какие условия должны быть соблюдены для этого?","[""['\\n                    Банк вправе в одностороннем порядке изменить Тарифный план, применяемый\\nв рамках Договора, и/или заменить его на другой Тарифный план, в том числе при заключении Договора и/или\\nна определенный период времени по усмотрению Банка, с целью уменьшения процентной ставки по кредиту\\nи/или улучшения иных условий обслуживания при условии, что это не повлечет возникновение новых или увеличение размера существующих денежных обязательств Клиента\\n                    ']""]","Да, Банк может изменить Тарифный план по кредитной карте в одностороннем порядке, но при условии, что это не приведет к возникновению новых или увеличению уже существующих денежных обязательств клиента ","Да, банк Tinkoff может изменить тарифный план по кредитной карте. Для этого необходимо ознакомиться с общими условиями выпуска и обслуживания кредитных карт, а также общими условиями открытия, ведения и закрытия счетов физических лиц. При изменении тарифного плана банк должен уведомить вас об этом заранее в письменной форме или через личный кабинет в интернет-банке. В случае возникновения вопросов или необходимости уточнения информации, рекомендуется обратиться в банк для получения подробной консультации.",1.0,0.9520612840223791,0.9999999999,1.0,0.916182611585565,0.0,0.18908669788761986,0.97395766,0.9170086748690194
Можно ли внести частичное досрочное погашение кредита? И как это повлияет на остаток задолженности?,"[""['«Клиент имеет право досрочно погасить Задолженность с уплатой Банку суммы непогашенного Кредита и начисленных процентов, а также (если применимо) комиссий и плат, предусмотренных Тарифным планом, в любой момент путем зачисления необходимой суммы денежных средств на Картсчет (Счет) и извещения Банка о необходимости проведения досрочного погашения. В случае частичного досрочного погашения уменьшается срок Кредита или сумма Регулярного платежа по выбору Клиента, при этом Клиент не освобождается от оплаты ближайшего Регулярного платежа, а также применимых комиссий и плат, предусмотренных Тарифным планом.», «При обращении Клиента в Банк для совершения частичного досрочного погашения до или в дату оплаты ближайшего Регулярного платежа Клиенту может быть предложено совершить частичное досрочное погашение с погашением ближайшего Регулярного платежа и последующим уменьшением срока Кредита или суммы Регулярного платежа по выбору Клиента.»']""]","Да, Клиент имеет право совершить частичное досрочное погашение кредита. При этом по выбору Клиента уменьшится либо срок кредита, либо сумма регулярного платежа. Однако Клиент не освобождается от оплаты ближайшего регулярного платежа и применимых комиссий.","Да, можно внести частичное досрочное погашение кредита. При этом уменьшается срок кредита или сумма регулярного платежа по выбору клиента. Клиент не освобождается от оплаты ближайшего регулярного платежа и применимых комиссий и плат. При частичном досрочном погашении оплачиваются только начисленные проценты и сумма непогашенного кредита, а комиссии и платы направляются на их досрочную оплату. Проценты, начисленные после частичного досрочного погашения, включаются в следующий регулярный платеж. При полном погашении ближайшего регулярного платежа и применимых комиссий и плат, клиенту не предъявляется требование об их оплате. При неполном погашении ближайшего регулярного платежа, клиент не освобождается от оплаты соответствующей части суммы ближайшего регулярного платежа в установленную дату.",0.4,0.9671219599588209,0.9999999999,1.0,0.9569744255980659,0.0604,0.5390222688346226,0.9854531,0.9058474697178969
Что будет в случае просрочки платежа по кредиту? И какой штраф может быть начислен?,"[""['«В случае неоплаты платежа Клиент должен уплатить штраф за неоплату Минимального платежа согласно Тарифному плану. Банк рассматривает любой поступивший платеж Клиента как признание Клиентом данного штрафа в размере поступившего платежа, но не более суммы штрафа, определенного в соответствии с Тарифами.»']""]","В случае неоплаты минимального платежа по кредиту, Клиент должен уплатить штраф в соответствии с Тарифным планом. Размер штрафа определяется Тарифами, и любой поступивший от Клиента платеж Банк будет рассматривать как оплату штрафа в пределах установленной суммы.","В случае просрочки платежа по кредиту, возможны следующие последствия:

1. Вам может быть начислен штраф за просрочку платежа. Размер штрафа может быть указан в договоре кредита или в пользовательском соглашении с банком Tinkoff.
2. Кроме штрафа, могут применяться дополнительные санкции со стороны банка, такие как увеличение процентной ставки по кредиту или ухудшение кредитной истории заемщика.
3. В случае продолжительной просрочки платежа, банк может принять дальнейшие меры, вплоть до передачи вашего дела на взыскание третьей стороне или взыскание задолженности через судебные органы.

Для получения точной информации о возможных штрафах и последствиях просрочки платежа по кредиту, рекомендуем обратиться в банк Tinkoff и ознакомиться с условиями вашего кредитного договора.",1.0,0.9448937558541335,0.9999999999,1.0,0.8873928370983393,0.0,0.18288490146544908,0.9769755,0.8627790814854883
Можно ли на время приостановить выплаты по кредиту? И как это повлияет на начисление процентов?,"[""['«На основании обращения Клиента и по согласованию с Банком на период от 1 (одного) до 12 (двенадцати) месяцев возможно приостановление обязанности Клиента по погашению Задолженности, по оплате Регулярных платежей и/или иных платежей. В указанный период Банк вправе приостановить начисление процентов и иных сумм, предусмотренных Договором реструктуризации задолженности.»']""]","Да, на основании обращения Клиента и по согласованию с Банком возможно приостановить обязанность по погашению задолженности и оплате платежей на срок от 1 до 12 месяцев. В этот период Банк вправе также приостановить начисление процентов и иных сумм по кредиту.","Извините, данный контекст не содержит информации о возможности приостановки выплат по кредиту и влиянии этого действия на начисление процентов. Рекомендую обратиться в банк Tinkoff для получения точной информации по этому вопросу.",,0.0,0.9999999999,1.0,0.8924825106583039,0.0,0.1939407120099568,0.9852689,0.906587145053206
Я хочу оформить дополнительную карту на супругу. Как это сделать? И будет ли она иметь доступ к общему лимиту по кредитке?,"[""['«3.2. По заявлению Клиента, переданному в Банк на бумажном носителе или через Дистанционное обслуживание, в рамках Договора кредитной карты Банком может быть выпущена одна или несколько дополнительных Кредитных карт.»', '«3.5. Клиент вправе установить лимит для проведения расходных операций с использованием Кредитной карты.»']""]","Вы можете оформить дополнительную кредитную карту на супругу, подав заявление в банк на бумажном носителе или через дистанционное обслуживание. Дополнительная карта будет иметь доступ к общему лимиту задолженности по вашей основной кредитной карте, однако вы можете установить отдельный лимит для расходных операций по дополнительной карте.","Для оформления дополнительной карты на супругу вам следует обратиться в ближайшее отделение банка Tinkoff или воспользоваться услугами дистанционного обслуживания. При оформлении карты на супругу, вы можете выбрать, будет ли она иметь доступ к общему лимиту по кредитке или будет иметь отдельный лимит. Для получения подробной информации по данному вопросу, рекомендуем обратиться в банк Tinkoff для консультации с специалистом.",1.0,0.911844325461909,0.9999999999,1.0,0.9399569904825469,0.0947,0.32065894498173025,0.9942749,0.9127059907179392
"А что если я потеряю карту? Сколько у меня есть времени, чтобы ее заблокировать? И как вообще это делается? Через приложение или звонить надо?","[""['«6.1. При обнаружении утери, кражи или порчи Кредитной карты и/или возникновения подозрений, что Кредитная карта или ее реквизиты, а также ПИН-код, QR-код, Коды доступа, Аутентификационные данные, Абонентский номер, Абонентское устройство могли быть утрачены или похищены, а также в случае изъятия Кредитной карты в банкомате или торгово-сервисном предприятии и в случае изменения имени или фамилии Держателя Клиент должен незамедлительно уведомить Банк по телефонам 8 800 555-10-10 или +7 495 645-59-19 (круглосуточно) и заблокировать Кредитную карту и/или Интернет-Банк и/или Мобильный банк, а также подать заявление о досрочном перевыпуске Кредитной карты.»']""]","В случае утери или кражи кредитной карты, вы должны незамедлительно уведомить банк по телефонам горячей линии 8 800 555-10-10 или +7 495 645-59-19 (круглосуточно) и заблокировать карту. Также необходимо подать заявление на досрочный перевыпуск новой карты. Чем быстрее вы заблокируете карту, тем меньше риск несанкционированного использования.","Если вы потеряли карту или она была украдена, важно как можно быстрее заблокировать её. Это можно сделать по телефону, в интернет-банке или в мобильном приложении банка Tinkoff. Чем раньше вы заблокируете карту, тем меньше вероятность несанкционированного использования. После блокировки карту нельзя разблокировать, только перевыпустить. Если не уверены, что карта украдена, установите лимит ""0"" и запретите покупки через интернет. После блокировки карты, ваша ответственность за дальнейшее использование прекращается. В случае утери карты в РФ, обратитесь в полицию, за границей - в полицию или к консульскому отделу. Сохраните копию протокола о случившемся для предъявления в банк.",1.0,0.8884805120220521,0.9999999999,1.0,0.918075975575372,0.0452,0.2542795979094963,0.98159444,0.8681904911424728
"Прочитал тут у вас про блокировку карточки. А если я её забуду забрать в банкомате, что тогда делать?","[""['«6.1. [...] а также в случае изъятия Кредитной карты в банкомате или торгово-сервисном предприятии и в случае изменения имени или фамилии Держателя Клиент должен незамедлительно уведомить Банк по телефонам 8 800 555-10-10 или +7 495 645-59-19 (круглосуточно) и заблокировать Кредитную карту и/или Интернет-Банк и/или Мобильный банк, а также подать заявление о досрочном перевыпуске Кредитной карты.»']""]","Если вы забыли карту в банкомате, вам необходимо незамедлительно сообщить об этом в банк по телефонам горячей линии 8 800 555-10-10 или +7 495 645-59-19 и заблокировать кредитную карту, а также подать заявление на ее досрочный перевыпуск. Это позволит предотвратить возможное несанкционированное использование забытой карты третьими лицами.","Если вы забыли забрать карту в банкомате, то сначала попробуйте связаться с банком, обслуживающим этот банкомат, посредством дистанционного обслуживания. Возможно, они смогут помочь вам вернуть карту. Если карта была удержана из-за технической неисправности или задержки в извлечении, то вы можете обратиться в банк, обслуживающий банкомат, и предъявить документ, удостоверяющий личность, для получения карты обратно. Однако стоит учитывать, что сторонний банк вправе не вернуть карту, если она была заблокирована заранее или по вашей просьбе.",0.25,0.8951803125141792,0.9999999999,1.0,0.9163726456196604,0.0,0.17600246152693863,0.9880027,0.8787089974021712
"А есть ли какие-то льготные условия, если я захочу приостановить выплаты по кредитке на какое-то время? Например, на ремонт или что-то в этом роде?","[""['«5.15. На основании обращения Клиента и по согласованию с Банком на период от 1 (одного) до 12 (двенадцати) месяцев возможно приостановление обязанности Клиента по погашению Задолженности, по оплате Минимальных платежей, Регулярных платежей и/или иных платежей. В указанный период Банк вправе приостановить начисление процентов и иных сумм, предусмотренных Договором кредитной карты.»']""]","Да, в документе указано, что по обращению клиента и по согласованию с банком возможно приостановление обязанности по погашению задолженности, выплате минимальных и регулярных платежей на срок от 1 до 12 месяцев. В этот период банк также может приостановить начисление процентов и других сумм по кредитной карте. Таким образом, вы можете получить льготный период для ремонта или других нужд, обратившись в банк с соответствующим заявлением.","Да, у банка Tinkoff есть возможность приостановить обязанность по погашению задолженности по кредитной карте на период от 1 до 12 месяцев. В этот период банк может также приостановить начисление процентов и других сумм, предусмотренных договором кредитной карты.",,0.8956700041197964,0.9999999999,1.0,0.9490336187778391,0.2027,0.50023688071845,0.9918598,0.9510547370846691
Какие процедуры предусмотрены банком для обработки жалоб клиентов?,"[""['Банк имеет установленные процедуры для обработки и рассмотрения жалоб клиентов, включая регистрацию жалобы, ее анализ и предоставление ответа клиенту в установленные сроки.']""]","Банк следует четко установленным процедурам для обработки жалоб клиентов, которые включают регистрацию жалобы, ее тщательный анализ и предоставление ответа клиенту в соответствии с установленными сроками.","Банк Tinkoff предусматривает следующие процедуры для обработки жалоб клиентов:

1. Клиент может обратиться по контактной информации банка, включая номер телефона, адрес электронной почты и почтовый адрес (при наличии).
2. Банк рассматривает жалобы клиентов в соответствии с установленными процедурами.
3. При необходимости, клиент может предоставить дополнительные сведения и документы для рассмотрения жалобы.
4. Банк обязан информировать клиента о ходе рассмотрения жалобы и принятых мерах по ее разрешению.

Если у вас возникли жалобы или претензии, рекомендуется обратиться в банк Tinkoff для получения более подробной информации о процедурах обработки жалоб.",0.0,0.9653384921208824,0.9999999999,1.0,0.8975182998581426,0.0125,0.24122187797725872,0.9825124,0.9152580329300987
Что происходит с депозитами в случае смерти?,"[""['В случае смерти клиента банк замораживает депозиты до решения вопросов наследства в соответствии с законодательством.']""]","После смерти клиента банк замораживает все его депозиты и удерживает их до тех пор, пока не будут решены вопросы наследства в соответствии с действующим законодательством.","В случае смерти, депозиты в банке Tinkoff подлежат переходу в наследство в соответствии с законодательством Российской Федерации. Наследникам необходимо обратиться в банк для предоставления необходимых документов и урегулирования всех вопросов по наследованию депозита.",1.0,0.8934774616099057,0.9999999999,1.0,0.9121111833815629,0.0,0.11807092418271087,0.98617357,0.758235788592654
Могу я отказаться от получения уведомлений от банка и как это влияет на его обслуживание?,"[""['Клиенты имеют право отказаться от получения определенных типов уведомлений от банка, однако это может повлиять на их способность получать своевременную информацию о изменениях условий, сбоях в системе или других важных обновлениях.']""]","Клиенты могут отказаться от получения определенных типов уведомлений от банка, но это может привести к тому, что они не будут получать важные обновления и информацию своевременно, что может повлиять на их способность управлять своими счетами и услугами эффективно.","Вы можете отказаться от получения уведомлений от банка путем настройки соответствующих предпочтений в личном кабинете или обратившись в банк через каналы дистанционного обслуживания. Отказ от уведомлений не должен негативно повлиять на обслуживание вашего счета или карты, однако вы можете пропустить важную информацию или оповещения о транзакциях. Для более подробной информации рекомендуется обратиться в банк.",1.0,0.935530589324607,0.9999999999,1.0,0.9318273934660513,0.0,0.16535815629402648,0.99186665,0.8838620096256022
Как я могу увеличить лимит по своей кредитной карте?,"[""['Для увеличения кредитного лимита клиенты должны подать заявление через мобильное приложение или веб-сайт банка, после чего банк рассмотрит их кредитную историю и текущую финансовую ситуацию.']""]","Чтобы увеличить кредитный лимит, клиентам необходимо подать соответствующее заявление через мобильное приложение или веб-сайт банка. Банк затем оценит их кредитную историю и текущую финансовую ситуацию перед принятием решения.","Для увеличения лимита по кредитной карте вам необходимо обратиться в банк Tinkoff. Банк может рассмотреть ваш запрос на увеличение лимита, но принимает решение на основе установленных критериев и проведения оценки вашей платежеспособности. Необходимо связаться с банком и ознакомиться с процедурой увеличения лимита по вашей кредитной карте.",0.3333333333333333,0.9495678083951248,0.9999999999,1.0,0.9165724635488203,0.0,0.0507023148804274,0.9827431,0.8003106708284528
"Каковы условия отмены банковской операции, например, перевода средств или платежа?","[""['Клиенты могут отменить определенные банковские операции, если они не были еще обработаны банком. Условия отмены операций установлены в пользовательском соглашении и зависят от типа операции.']""]","Условия отмены банковской операции зависят от того, была ли операция уже обработана банком. Для операций, которые еще не обработаны, клиенты могут инициировать отмену, следуя процедурам, описанным в пользовательском соглашении и в зависимости от типа операции.","Банк Tinkoff имеет право приостановить проведение операций по счету или использование карты на срок до 2 рабочих дней в случае выявления операций без согласия клиента. Банк также может приостановить зачисление денежных средств на счет или карту на срок до 5 рабочих дней в соответствии с законодательством. Клиент соглашается, что банк не несет ответственности за сбои в дистанционном обслуживании, вызванные проблемами с оборудованием связи. Если клиент не предоставит необходимые документы в установленный срок, банк может отказать в зачислении денежных средств.",1.0,0.8400189056930732,0.9999999999,1.0,0.8715664967248766,0.0,0.032329763792084645,0.9820656,0.8069031467782
Какие услуги доступны клиентам через Интернет-банк?,"[""['Через Интернет-банк клиенты могут управлять своими счетами, осуществлять платежи и переводы, а также получать детальную информацию о своих финансовых операциях.']""]","Интернет-банк предоставляет клиентам возможности управления их счетами, осуществления платежей и переводов, а также доступ к подробной информации о всех их финансовых операциях.","Клиенты могут воспользоваться услугами банка через Интернет-Банк, Мобильный Банк, Мобильные приложения банка и другие каналы обслуживания в Интернет для получения информации и совершения операций. через Интернет-Банк клиенты могут изменить аутентификационные данные, а также использовать их для совершения операций. через Банкоматы клиенты могут совершать различные операции, такие как пополнение и снятие наличных, платежи и переводы, обмен валюты и получение информации об остатке денежных средств на договоре.",0.6666666666666666,0.9239423190635181,0.9999999999,1.0,0.9313012552811772,0.0,0.14364157861818325,0.9742186,0.9135621864406126
"Я не пользовалась кредиткой год, но у меня там лежат мои 800 рублей, я могу их как-то вернуть?","['[\'""8. Расторжение Договора кредитной карты\\n                8.1. Банк вправе в любой момент расторгнуть Договор кредитной карты в одностороннем порядке в случаях, предусмотренных \\n                законодательством Российской Федерации, а также:\\n                • в случае если Держатель не пользовался Кредитной картой более, чем 6 (шесть) месяцев при отсутствии \\n                Задолженности по Договору кредитной карты;\\n                В этих случаях Банк блокирует все Кредитные карты/Токены, выпущенные в рамках Договора кредитной карты. Договор \\n                кредитной карты считается расторгнутым со дня формирования Банком Заключительного счета, который направляется \\n                Клиенту. Если в момент расторжения Договора кредитной карты Задолженность Клиента перед Банком отсутствует, Банк \\n                вправе расторгнуть Договор кредитной карты без направления Заключительного счета, информируя Клиента о своем \\n                решении любым способом по усмотрению Банка.\\n                8.5. В случае, если при расторжении Договора кредитной карты в Банке находятся денежные средства Клиента, излишне \\n                перечисленные им при погашении Задолженности, Банк осуществляет возврат таких денежных средств по распоряжению \\n                Клиента почтовым переводом или иным способом, указанном в распоряжении Клиента. При этом Банк вправе удержать \\n                из суммы такого перевода комиссию за перевод денежных средств в размере, предусмотренном Тарифами на услуги \\n                по переводам, платежам и дополнительные услуги с использованием каналов Дистанционного обслуживания.\\n                8.6. В случае неполучения Банком распоряжения Клиента о переводе денежных средств в течение 120 (ста двадцати) дней \\n                со дня обработки Банком последней операции Клиента/Держателя и, если остаток денежных средств не превышает \\n                1000 руб., указанный остаток считается безвозмездно переданным Банку. \\n                В случае неполучения Банком распоряжения Клиента о переводе денежных средств в течение 3 (трех) лет со дня обработки \\n                Банком последней операции Клиента/Держателя указанные денежные средства считаются безвозмездно переданными \\n                Банку.\\n                \']']","Согласно пунуту 8.6 - вы не можете вернуть ваши деньги, так как не дали распоряжение Банку о переводе денежных средств в течение 120 дней.","Извините, но у меня недостаточно информации, чтобы точно ответить на ваш вопрос. Рекомендую обратиться в банк Tinkoff для получения дополнительной информации о возврате денежных средств с неактивированной кредитной карты.",,0.0,0.9999999999,0.07692307692307693,0.850628420144887,0.0,0.04330720686609804,0.96952283,0.7715653185300332
