question,contexts,ground_truth,answer,faithfulness,answer_relevancy,context_precision,context_relevancy,answer_similarity,bleu_score,cos-sim-TF-IDF,cos-sim-BertModel,sim-spacy,Human_score
Можно ли не расписываться на карте?,"[""['После получения карты поставьте свою подпись в прямоугольнике, расположенном на оборотной стороне карты. При отсутствии подписи карта может быть не принята к оплате в торгово-сервисном предприятии, а также повышается риск использования карты злоумышленниками в случае ее утраты/кражи.']""]","При отсутствии подписи карта может быть не принята к оплате в торгово-сервисном предприятии, а также повышается риск использования карты злоумышленниками в случае ее утраты/кражи.","Для совершения операции оплаты покупки или услуги с использованием карты, необходимо подписать квитанцию или чек, что подтверждает факт совершения операции. Без подписи на карте она может быть недействительна, и вам может быть отказано в обслуживании. В случае отсутствия вашей подписи на полосе для подписи, кассир может попросить вас расписаться на карте после проверки удостоверяющих личность документов. Перед проведением операции по карте кассир также имеет право запросить у вас документы, удостоверяющие личность, чтобы убедиться, что вы являетесь законным держателем карты.",1.0,0.8265545801848334,0.9999999999,1.0,0.9157478421126068,0.0,0.1338669753501766,0.97696334,0.9353855357314582,1.0
"Мой друг попросил меня дать свою карту для оплаты и потом вернуть, это не опасно?","[""['Никогда не принимайте рекомендации, советы, помощь от третьих лиц при пользовании картой, особенно при снятии наличных денежных средств в банкоматах. В случае возникновения затруднений при совершении операции обратитесь Банк посредством дистанционного обслуживания. Обращайте внимание на расположение банкоматов. Старайтесь не пользоваться банкоматами, расположенными в плохо освещенных и безлюдных местах', 'Не передавайте карту другим лицам, в т.ч. родственникам и знакомым для проведения транзакций. С целью исключения Ваших потерь от несанкционированного использования Вашей карты (копирования информации с Вашей карты для ее дальнейшего мошеннического использования): при совершении операции оплаты с использованием карты никогда не выпускайте Вашу карту из поля зрения и требуйте от обслуживающего Вас лица, чтобы все операции с использованием карты совершались в Вашем присутствии.']""]","Не передавайте карту другим лицам, в т.ч. родственникам и знакомым для проведения транзакций и никогда не принимайте рекомендации, советы, помощь от третьих лиц при пользовании картой, особенно при снятии наличных денежных средств в банкоматах.","Не передавайте карту другим лицам, в т.ч. родственникам и знакомым для проведения транзакций. С целью исключения Ваших потерь от несанкционированного использования Вашей карты: при совершении операции оплаты с использованием карты никогда не выпускайте Вашу карту из поля зрения и требуйте от обслуживающего Вас лица, чтобы все операции с использованием карты совершались в Вашем присутствии.",,0.8415672858731335,0.9999999999,1.0,0.9548954672645708,0.2019,0.2767686402178719,0.98930144,0.8931597672190063,1.0
Безопасно ли хранить пинкод в заметках в телефоне?,"[""['Категорически запрещается записывать ПИН-код на карте. Постарайтесь не записывать ПИН-код, запомните его. Если же Вы предпочитаете записать свой ПИН-код, никогда не указывайте, что это ПИН-код и не храните документ с записанным ПИН-кодом рядом с картой.']""]","Да, однако не указывайте в названии заметки, что это ПИН-код от Вашей карты.","Хранение пин-кода в заметках в телефоне является небезопасным действием, поскольку это повышает риск доступа злоумышленников к вашим финансовым данным. ПИН-код является конфиденциальной информацией, которую необходимо хранить в надежном месте и не сообщать третьим лицам. Рекомендуется запоминать ПИН-код и не записывать его на бумажке или в телефоне для обеспечения безопасности ваших средств. В случае утери или кражи карты, рекомендуется немедленно обратиться в банк для блокировки карты и предотвращения несанкционированных операций.",0.75,0.9392908289716476,0.9999999999,0.0,0.8696644062110308,0.0,0.1824109318781109,0.93243444,0.7941804646578162,1.0
Я потеряла карту,"[""[' Вы потеряли карту или ее украли\\nПрежде всего, как можно быстрее, сообщите о случившемся в Банк посредством дистанционного обслуживания \\nи заблокируйте карту. Заблокировать карту можно по телефону, в интернет-банке или в мобильном приложении Банка. \\nЧем раньше Вы это сделаете, тем меньше вероятность несанкционированного использования карты злоумышленниками. \\nРазблокировать карту нельзя — можно только перевыпустить. Если вы не уверены, что карту украли, не спешите ее \\nблокировать, установите лимит «0» на операции и запретите покупки через Интернет, если карта будет найдена лимиты \\nможно изменить.\\nНапоминаем Вам, что в соответствии с Общими условиями выпуска и обслуживания кредитных карт и Общими \\nусловиями открытия, ведения и закрытия счетов физических лиц, а также выпуска и обслуживания расчетных карт Ваша \\nответственность за дальнейшее использование карты прекращается, после осуществления блокировки, если не станет \\nизвестно, что незаконное использование карты имело место с Вашего согласия.\\nЕсли карта была у Вас украдена на территории РФ, после блокировки карты заявите о случившемся в полицию. При краже \\nкарты за границей, заявите в полицию или в консульский отдел посольства Российской Федерации в стране, на территории \\nкоторой произошла кража. Пожалуйста, сохраняйте копию протокола (квитанцию о заявлении) для последующего \\nпредъявления в Банк.']""]","Если вы не уверены, что карту украли, не спешите ее блокировать, установите лимит «0» на операции и запретите покупки через Интернет, если карта будет найдена лимиты можно изменить. В случае, если вы полагаете, что Вашу карту всё-таки украли, то как можно быстрее, сообщите о случившемся в Банк посредством дистанционного обслуживания и заблокируйте карту. Это возможно сделать по телефону, в интернет-банке или в мобильном приложении Банка.","Если вы потеряли карту, сначала потребуйте составления акта об изъятии с указанием даты, времени и причины изъятия, а также подписью сотрудника предприятия/банка, где была изъята карта. После этого срочно проинформируйте Банк о изъятии посредством дистанционного обслуживания.",,0.8744415692541954,0.9999999999,0.1,0.8693294750171778,0.0,0.1541573384150918,0.98710036,0.7220930032952158,0.0
"Почему при использовании карты важно не расписываться на квитанциях/чеках до того, как вы проверите правильность указанной суммы?","[""['Проверяйте правильность суммы, указанной на платежном чеке. Поставив подпись на платежном чеке, Вы соглашаетесь со списанием указанной на нем суммы с Вашего карточного счета.']""]","Важно проверять правильность суммы перед подписанием квитанции/чека, потому что после подписи вы соглашаетесь с этой суммой, и она будет списана с вашего счета.","При использовании карты важно не расписываться на квитанциях/чеках до того, как вы проверите правильность указанной суммы, так как ваша подпись подтверждает факт совершения операции. Поэтому перед тем, как поставить свою подпись, обязательно проверьте информацию на квитанции или чеке. В случае возникновения ошибок или несоответствия суммы, требуйте исправления и оформления нового чека или слипа. Никогда не подписывайте чек или слип, если на них не указана сумма покупки. В случае возврата товара, требуйте сделать возврат на карту в вашем присутствии и не забудьте получить чек/слип, подтверждающий возврат. Сохраняйте копии слипов и чеков по операциям с картой, чтобы иметь возможность доказать проведенные операции.",1.0,0.0,0.9999999999,1.0,0.9247087585438574,0.0,0.0794633202062899,0.9718087,0.9211744237900577,1.0
"Что делать, если я потеряла телефон, на котором было установлено мобильное приложение банка?","[""['При утрате Мобильного телефона, используемого с абонентским номером подвижной радиотелефонной связи, на который установлено Мобильное приложение Банка, Вам следует срочно обратиться к своему оператору сотовой связи для блокировки SIM-карты и в Банк посредством дистанционного обслуживания для блокировки доступа в мобильное приложение Банка и удаления данных карты с Мобильного телефона.']""]","Если вы потеряли телефон с установленным мобильным приложением банка, необходимо:

Срочно обратиться к оператору сотовой связи для блокировки SIM-карты.
Обратиться в банк через дистанционное обслуживание для блокировки доступа в мобильное приложение и удаления данных карты с телефона.","При утрате мобильного телефона, на котором установлено мобильное приложение банка Tinkoff, необходимо срочно обратиться к оператору сотовой связи для блокировки SIM-карты. После этого следует связаться с банком через дистанционное обслуживание для блокировки доступа в мобильное приложение банка и удаления данных карты с мобильного телефона.",1.0,0.9504934204457308,0.9999999999,1.0,0.9651370267841588,0.4093,0.5851380602230255,0.9924003,0.9746682169290992,1.0
Можно ли использовать интернет-кафе и другие общедоступные места для совершения операций по карте в интернете? Объясните причину.,"[""['Избегайте осуществления Интернет-операций с использованием карты в местах, где услуги Интернет являются общедоступными, например, в Интернет-кафе.']""]","Нет, не рекомендуется использовать интернет-кафе и другие общедоступные места для совершения операций по карте в интернете. Причина в том, что такие общедоступные сети являются менее безопасными, и есть риск перехвата данных карты злоумышленниками.","Для безопасности рекомендуется избегать совершения операций с использованием карты в общедоступных местах, таких как интернет-кафе. Лучше всего использовать проверенные интернет-магазины, на которые вы уверены. При оплате покупок в интернете, также следует вводить трехзначный код безопасности CVC2/CVV2 для повышения безопасности операций. Не рекомендуется сообщать реквизиты вашей банковской карты, за исключением случаев использования автоматизированных систем MOTO и систем интернет-коммерции.",1.0,0.8826339193701424,0.9999999999,1.0,0.9089266390488928,0.0,0.1943442762445009,0.9823693,0.8882016641298145,1.0
"Что делать, если я получил SMS-оповещение о операции по карте, которую я не совершал?","[""['Если Вы уверены, что операция не могла быть совершена Вами, то как можно быстрее сообщите об этом в Банк посредством дистанционного обслуживания и заблокируйте карту.']""]","Если вы получили SMS-оповещение о операции, которую не совершали, нужно как можно быстрее сообщить об этом в банк через дистанционное обслуживание и заблокировать карту.","Если вы получили SMS-оповещение о операции по карте, которую вы не совершали, то необходимо как можно быстрее сообщить об этом в Банк посредством дистанционного обслуживания и заблокировать карту. Помните, что при операциях в сети Интернет или заказах по телефону в SMS-сообщении могут быть указаны страна/город, отличающиеся от места вашего проживания. В случае подозрительных обращений к вам от имени Банка, немедленно проинформируйте об этом Банк. Если у вас возникли претензии по списаниям, отраженным в выписке по карточному счету, оформите заявление на отказ от операций и предоставьте любые документы, которые могут доказать, что вы не совершали эти операции.",1.0,0.9775796394856904,0.9999999999,1.0,0.9581513860513968,0.0235,0.3761302441822997,0.9810013,0.8886445752322814,1.0
Как обезопасить себя от съема данных карты в банкомате злоумышленниками? Приведи два способа.,"[""['Поэтому, при пользовании банкоматом не ленитесь внимательно осмотреть его и убедиться в отсутствии каких-либо «накладок» и посторонних устройств.', 'Пожалуйста, примите все меры, чтобы вводимый Вами ПИН-код был не заметен для окружающих.']""]","Чтобы обезопасить себя от съема данных карты в банкомате:

Внимательно осматривайте банкомат перед использованием на наличие подозрительных накладок и посторонних устройств.
Прикрывайте рукой клавиатуру при вводе ПИН-кода, чтобы его не могли увидеть окружающие.","Для обезопасить себя от съема данных карты в банкомате злоумышленниками, следует соблюдать следующие меры безопасности:

1. Никогда не принимайте рекомендации, советы, помощь от третьих лиц при пользовании картой, особенно при снятии наличных денежных средств в банкоматах. В случае возникновения затруднений при совершении операции, обратитесь в Банк посредством дистанционного обслуживания.

2. Не передавайте карту другим лицам, в том числе родственникам и знакомым для проведения транзакций. При совершении операции оплаты с использованием карты, никогда не выпускайте карту из поля зрения и требуйте, чтобы все операции с использованием карты совершались в вашем присутствии.

Дополнительные рекомендации по безопасности при использовании карты можно найти в разделах ""Меры безопасности при использовании карты"" и ""Что такое ПИН-код и как обеспечить его конфиденциальность"".",1.0,0.9141944947018008,0.9999999999,1.0,0.9380487312241323,0.0166,0.2225433832850425,0.98118144,0.8663272538332134,0.5
"Правда ли, что при бронировании гостиницы по карте мне необходимо сообщить все реквизиты карты, включая ПИН-код? Если нет, то что именно требуется сообщить?","[""['При бронировании номера в гостинице по карте Вас попросят сообщить свое имя, номер карты, срок ее действия (иногда, дополнительно — трехзначный код безопасности, напечатанный на обратной стороне карты на полосе для подписи) и срок Вашего пребывания.']""]","Нет, неправда. При бронировании гостиницы по карте не требуется сообщать ПИН-код. Обычно для бронирования запрашивают ваше имя, номер карты, срок ее действия, иногда трехзначный код безопасности (CVV/CVC) с оборотной стороны карты и планируемый срок пребывания.","При бронировании гостиницы по карте необходимо сообщить свое имя, номер карты, срок ее действия, трехзначный код безопасности (CVV-код), который находится на обратной стороне карты на полосе для подписи, и срок пребывания. Не требуется сообщать ПИН-код карты.",0.8333333333333334,0.9095499145159096,0.9999999999,1.0,0.9594806445404784,0.2967,0.5833094476633176,0.9935167,0.9540560733793312,1.0
"Если я из другой страны и у меня нет паспорта РФ, что мне делать?","[""['\\n                     1. Документы и сведения, получаемые в целях идентификации Клиентов-физических лиц, а также в целях обслуживания таких Клиентов в рамках Универсального договора\\n                     1.4. Реквизиты документа, удостоверяющего личность: серия (при наличии) и номер документа, дата выдачи документа, наименование органа, выдавшего документ (при наличии кода подразделения может не устанавливаться), и код подразделения (при наличии).\\n                     1.4.2.для иностранных граждан:\\n                     •паспорт иностранного гражданина;\\n                     •дипломатический паспорт, служебный паспорт, удостоверяющие личность иностранного гражданина.', '.5.Документ, подтверждающий право иностранного гражданина или лица без гражданства на пребывание (проживание) в Российской Федерации (миграционной карты в случае отсутствия иных документов), в случае если наличие таких документов обязательно в соответствии с международными договорами Российской Федерации и законодательством Российской Федерации;Документами, подтверждающими право иностранного гражданина или лица без гражданства на пребывание (проживание) в РФ, являются:\\n                    •миграционная карта в случае отсутствия иных документов;\\n                    •вид на жительство;\\n                    •разрешение на временное проживание;\\n                    •виза;\\n                    •иной документ, подтверждающий в соответствии с международными договорами Российской Федерации и законодательством РФ право иностранного гражданина или лица без гражданства на пребывание (проживание) в РФ.\\n']""]","
                        Если вы из другой страны, то для заключения договора вам неообходимы документы, удостоверяющие Вашу личность. Для иностранных граждан это:
                            •паспорт иностранного гражданина;
                            •дипломатический паспорт, служебный паспорт, удостоверяющие личность иностранного гражданина.
                        Также необходимы документы, подтверждающие право иностранного гражданина (проживание) в Российской Федерации (миграционной карты в случае отсутствия иных документов), в случае если наличие таких документов обязательно в соответствии с международными договорами Российской Федерации и законодательством Российской Федерации;Документами, подтверждающими право иностранного гражданина или лица без гражданства на пребывание (проживание) в РФ, являются:
                            •миграционная карта в случае отсутствия иных документов;
                            •вид на жительство;
                            •разрешение на временное проживание;
                            •виза;
                            •иной документ, подтверждающий в соответствии с международными договорами Российской Федерации и законодательством РФ право иностранного гражданина или лица без гражданства на пребывание (проживание) в РФ. ","Для оформления в банке Tinkoff, если вы из другой страны и у вас нет паспорта РФ, вам необходимо сообщить об этом в банк через дистанционное обслуживание и оформить претензию. Сотрудник банка поможет вам в этом.",,0.909563210179984,0.9999999999,0.1666666666666666,0.8661248981158103,0.0,0.0795699555439338,0.9644893,0.8069161407342629,0.5
В течении скольких дней действительна выписка из ЕГРЮЛ?,"[""['\\n                    2.2. Выписка из Единого государственного реестра юридических лиц (ЕГРЮЛ). Банком может быть принята копия \\n                    выписки, заверенная регистрирующим органом. Выписка считается действительной для предоставления в Банк \\n                    в течение 30 (тридцати) календарных дней с даты ее выдачи и должна содержать актуальные сведения на дату  \\n                    ее предоставления;']""]",Выписка из Единого государственного реестра юридических лиц (ЕГРЮЛ) действительна в течении 30 дней с даты ее выдачи.,Выписка из ЕГРЮЛ считается действительной для предоставления в банк в течение 30 (тридцати) календарных дней с даты ее выдачи.,1.0,0.9473773897925742,0.9999999999,0.25,0.936597836162256,0.2331,0.3509756646321137,0.9836522,0.827410244164809,1.0
Нужно ли ИП указывать свой сайт для предприятия?,"[""['\\n                    3. Документы и сведения, предоставляемые Клиентом-индивидуальным предпринимателем: \\n                    3.5. Сведения о доменном имени, указателе страницы сайта в сети «Интернет», с использованием которых Клиентом \\nоказываются услуги (при наличии);\\n                    ']""]","Да, индивидуальному предпринимателю необходимо указать сведения о доменном имени, указателе страницы сайта в сети «Интернет».","Да, ИП должно указывать свой сайт для предприятия в документах и сведениях, предоставляемых банку в рамках условий Универсального договора.",,0.9386937474015048,0.9999999999,0.3333333333333333,0.9181017040990586,0.0,0.0363532387476215,0.9834763,0.8396409931440707,1.0
Может ли Банк запросить дополнительные документы - не из списка обязательных?,"[""['\\n                     26. Банк может запросить у Клиента, а Клиент обязуется предоставить по запросу Банка дополнительные документы \\n                    и сведения, как предусмотренные, так и не предусмотренные настоящим Перечнем, в том числе в целях надлежащей \\n                    идентификации Клиента, его представителя, выгодоприобретателя и бенефициарного владельца в соответствии \\n                    с требованиями действующего законодательства Российской Федерации, нормативных актов Банка России, а также \\n                    требованиями Банка. Банк вправе не запрашивать отдельные документы и сведения, предусмотренные настоящим \\n                    Перечнем, в случаях, установленных внутренними правилами Банка.']""]","Да, Банк может запросить у Вас дополнительные не предусмотренные Перечнем документы.","Да, банк Tinkoff имеет право запросить дополнительные документы и сведения от клиента, как предусмотренные, так и не предусмотренные в перечне, в том числе для надлежащей идентификации клиента, его представителя, выгодоприобретателя и бенефициарного владельца в соответствии с требованиями законодательства и внутренними правилами банка.",1.0,0.93927798352225,0.9999999999,0.25,0.903061550763949,0.0,0.2753407257640639,0.9674094,0.7307197780094469,1.0
Какие документы нужно предоставить физическому лицу для открытия счета?,"[""['1. Документы и сведения, получаемые в целях идентификации Клиентов-физических лиц, а также в целях обслуживания таких Клиентов в рамках Универсального договора']""]","Физическому лицу для открытия счета необходимо предоставить документ, удостоверяющий личность (паспорт или иной документ из списка в п.1.4), документ, подтверждающий регистрацию или место пребывания, ИНН, СНИЛС и контактную информацию.","Для открытия счета физическому лицу необходимо предоставить следующие документы:
1. Документы, удостоверяющие личность (паспорт или иной документ, указанный в Перечне документов и сведений).
2. В случае иностранных граждан или лиц без гражданства - документ, подтверждающий право на пребывание в Российской Федерации.
3. Дополнительные документы, если физическое лицо занимается частной практикой в установленном законодательством порядке.

Если у вас есть дополнительные вопросы или требуется более подробная информация, обращайтесь в банк Tinkoff для консультации.",1.0,0.9911664513797916,0.9999999999,1.0,0.9544160888677446,0.0318,0.3161731838421197,0.9797589,0.9658841144448526,0.5
Какие документы необходимо предоставить юридическому лицу для открытия счета в Банке? Можно ли предоставить сканы документов или нужны оригиналы?,"[""['2.1. Учредительные документы юридического лица...', '2.2. Выписка из Единого государственного реестра юридических лиц (ЕГРЮЛ)...', '2.3. Документ об избрании единоличного исполнительного органа юридического лица...']""]","Юридическому лицу необходимо предоставить учредительные документы, выписку из ЕГРЮЛ, документ об избрании руководителя, документы, подтверждающие личность руководителя и лиц, имеющих право подписи. Документы можно предоставить в копиях, заверенных нотариально, регистрирующим органом, руководителем или сотрудником Банка при наличии оригиналов.","Для открытия счета в Банке Tinkoff юридическому лицу необходимо предоставить следующие документы:
1. Сведения и документы, в зависимости от организационно-правовой формы и сведения о договорах о привлечении банковского платежного агента;
2. Документы-основания участия бенефициара или бенефициаров в отношениях по договору номинального счета;
3. Документы, удостоверяющие личность и указанные в перечне документов;
4. Выписка из Единого государственного реестра юридических лиц (ЕГРЮЛ);
5. Документ об избрании единоличного исполнительного органа юридического лица;
6. Документы, подтверждающие полномочия единоличного исполнительного органа юридического лица;
7. Документ, удостоверяющий личность физического лица-единоличного исполнительного органа юридического лица.

Сканы документов также могут быть предоставлены, но в некоторых случаях оригиналы могут потребоваться. Дополнительную информацию и уточнения по открытию счета можно получить, обратившись непосредственно в Банк Tinkoff.",1.0,0.9383758753545474,0.9999999999,0.0,0.9026799446459912,0.0,0.2275896945322498,0.9841686,0.8706597753537296,1.0
Можно ли открыть счет индивидуальному предпринимателю – иностранному гражданину? Какие документы для этого нужны?,"[""['3.1. Идентификация индивидуального предпринимателя осуществляется на основании документов и сведений, указанных в пункте 1.4 настоящего Перечня', '3.2. Документ, подтверждающий право иностранного гражданина или лица без гражданства на пребывание (проживание) в Российской Федерации...']""]","Да, индивидуальному предпринимателю-иностранному гражданину можно открыть счет. Для этого нужно предоставить документ, удостоверяющий личность, документ, подтверждающий право пребывания/проживания в РФ (напр. миграционную карту), ИНН, СНИЛС, выписку из ЕГРИП и контактную информацию.","Для открытия счета индивидуальному предпринимателю – иностранному гражданину необходимо предоставить следующие документы:
1. Документы, удостоверяющие личность и указанные в соответствующем перечне.
2. Документ, подтверждающий право иностранного гражданина на пребывание в Российской Федерации.
3. Лицензии или разрешения на осуществление деятельности, если таковые требуются.
4. Информация о страховом номере индивидуального лицевого счета застрахованного лица.
5. Сведения о доменном имени и странице сайта, если таковые имеются.
6. Адрес места жительства или пребывания.
7. Контактная информация (номер телефона, факса, адрес электронной почты).
8. Выписка из ЕГРИП, действительная в течение 30 календарных дней с даты выдачи.

Если уточнения по документам или требованиям банка возникнут, рекомендуется обратиться в банк для получения конкретной информации.",1.0,0.9633262119026088,0.9999999999,1.0,0.9492305833222184,0.0,0.1464605148600672,0.97377485,0.8940616676560256,1.0
"Какие документы потребуются, если открывать счет для нотариуса, занимающегося частной практикой? Может ли нотариус быть иностранцем при этом?","[""['5.1. Документ, удостоверяющий личность и указанный в пункте 1.4 настоящего Перечня', '5.2. Документ, подтверждающий наделение нотариуса полномочиями (назначение на должность), выдаваемый органами юстиции субъектов Российской Федерации, в соответствии с законодательством Российской Федерации']""]","Для открытия счета нотариусу, занимающемуся частной практикой, требуется предоставить документ, удостоверяющий личность, документ о назначении на должность нотариуса от органов юстиции, регистрационные документы, финансовые документы и контактные данные. Нотариус может быть иностранцем, в этом случае дополнительно потребуется документ, подтверждающий право на пребывание/проживание в РФ.","Для открытия счета для нотариуса, занимающегося частной практикой, потребуются следующие документы:
1. Документ, удостоверяющий личность.
2. Документ, подтверждающий наделение нотариуса полномочиями, выдаваемый органами юстиции.
3. Адрес места жительства или места пребывания.
4. Контактная информация.
5. Выписка из ЕГРИП.
6. Информация о страховом номере индивидуального лицевого счета.
7. Сведения о целях установления и предполагаемом характере деловых отношений с банком.
8. Миграционная карта и документ, подтверждающий право иностранного гражданина на пребывание в России, если нотариус является иностранным гражданином.",0.625,0.9641886386588476,0.9999999999,0.0,0.967672449035076,0.0,0.3200524955715957,0.9894719,0.9408215043906402,1.0
"Как узнать, кто является бенефициарным владельцем юридического лица? Какие документы для этого нужны?","[""['12. Идентификация бенефициарного(ых) владельца(ев) осуществляется на основании следующий документов и сведений...']""]","Для идентификации бенефициарного владельца юридического лица необходимо предоставить документы, удостоверяющие личность бенефициара, документ о регистрации/пребывании в РФ (если бенефициар - иностранец), ИНН, адрес регистрации и контактные данные. Также можно заполнить анкету бенефициарного владельца по форме Банка.","Для определения бенефициарных владельцев юридического лица необходимо предоставить следующие документы и сведения:
1. Документы, удостоверяющие личность и указанные в пункте 1.4 Перечня.
2. В случае иностранных граждан или лиц без гражданства - документ, подтверждающий их право на пребывание в Российской Федерации.
3. Анкета физического лица - бенефициарного владельца по форме банка, подписанная клиентом.
4. Идентификационный номер налогоплательщика, если имеется.
5. Адрес места жительства или пребывания, контактная информация.

Если бенефициарный владелец иностранный гражданин или лицо без гражданства, или существуют сомнения в достоверности предоставленной информации, идентификация осуществляется исключительно на основании указанных документов и сведений, без использования анкеты бенефициарного владельца по форме банка.",1.0,0.9480913038965398,0.9999999999,1.0,0.9665452022918748,0.0277,0.2629854017202086,0.9855953,0.8925677038177194,1.0
Расскажи про термины 'Договор страхования' и 'КАСКО',"[""['1. Термины и определения     \\n                    Договор страхования — договор, по которому одна сторона (Страховщик) обязуется за обусловленную договором \\n                    плату (страховую премию) при наступлении предусмотренного в договоре события (страхового случая) осуществить \\n                    другой стороне (страхователю) или иному лицу, в пользу которого заключен договор (выгодоприобретателю), \\n                    страховое возмещение в пределах определенной договором суммы (страховой суммы).', 'КАСКО — комбинированное страхование транспортных средств и сопутствующих рисков.']""]"," Да, конечно! Договор страхования — это договор, по которому одна сторона (Страховщик) обязуется за обусловленную договором 
                    плату (страховую премию) при наступлении предусмотренного в договоре события (страхового случая) осуществить 
                    другой стороне (страхователю) или иному лицу, в пользу которого заключен договор (выгодоприобретателю), 
                    страховое возмещение в пределах определенной договором суммы (страховой суммы). 
                    КАСКО — это комбинированное страхование транспортных средств и сопутствующих рисков.","Договор страхования - это договор, по которому страховщик обязуется выплатить страховое возмещение страхователю или выгодоприобретателю в случае наступления страхового случая в пределах определенной суммы.

КАСКО - это комбинированное страхование транспортных средств и сопутствующих рисков, которое покрывает ущерб, нанесенный вашему автомобилю в результате различных событий, таких как ДТП, угона, стихийные бедствия и другие.",1.0,0.8833899508935449,0.9999999999,0.25,0.9590893294339388,0.1819,0.4201894889447417,0.991456,0.9314941650194256,1.0
"Какой минимум страховой выплаты мне вернут, если моя страховая сумма = 50 000 долларов?","[' \n                    2.19.   При добровольном страховании непредвиденных расходов путешественников страховая сумма в договоре \n                    страхования может быть установлена в рублях или иностранной валюте в рублевом эквиваленте по официальному \n                    курсу иностранных валют ЦБ РФ на дату заключения Договора страхования, но не менее чем 66,7 руб. за 1 у.е.  при \n                    страховой сумме 30 000 у.е., 57,2 руб. за 1 у.е. при страховой сумме 35 000 у.е., 50 руб. за 1 у.е. при страховой сумме \n                    50 000 у.е., 26,7 руб. за 1 у.е. при страховой сумме 75 000 у.е.']"," 
                    Минимальная страховая выплата, которую вам вернут, если ваша страховая сумма составляет 50 000 долларов, составляет 50 рублей за 1 доллар США. Минимальная выплата составит 2 500 000 рублей.
                    Обратите внимание, что это минимальная выплата, которую вы получите. Фактическая сумма выплаты может варьироваться в зависимости от условий вашего договора.
        ","Для ответа на ваш вопрос о минимальной страховой выплате, необходимо обратиться к условиям договора страхования. В соответствии с пользовательским соглашением банка Tinkoff, в случае если страховая сумма установлена в валюте, отличной от российского рубля, минимальная страховая выплата составит не более 200 у.е. За один страховой случай. Если же страховая сумма установлена в российских рублях, минимальная страховая выплата будет не более 10 000 российских рублей за один страховой случай.",,0.8559977129898111,0.9999999999,0.2,0.919210576618861,0.0,0.2758152371639539,0.9865217,0.8027498628917701,0.0
"При принятии пользовательских соглашений, кому еще попадают мои данные?","[""['\\n                    5. Персональные данные     \\n                        5.1.       Пользователь подтверждает, что с использованием Дистанционных каналов взаимодействия дает Страховщику, \\n                        аффилированным лицам страховщика, Страховому агенту или Страховому брокеру, а также лицам, \\n                        предоставляющим услуги по использованию их информационных возможностей для целей заключения договоров \\n                        страхования, хранения документов, в том числе, облачных сервисов, серверов, программных продуктов, согласие на \\n                        обработку его персональных данных с целью осуществления дистанционного взаимодействия с последними при \\n                        использовании их Сайта и/или сайтов в сети Интернет или при помощи ПО Страховщика и в целях осуществления \\n                        маркетинговых коммуникаций перечисленных лиц с Пользователем.  \\n        ']""]","
                    Согласно пункту 5.1 пользовательского соглашения, ваши персональные данные могут быть переданы следующим сторонам:
                        • Аффилированные лица страховщика
                        • Страховой агент
                        • Страховой брокер
                        • Лица, предоставляющие услуги по использованию их информационных возможностей для целей заключения договоров страхования, хранения документов, в том числе облачных сервисов, серверов, программных продуктов
","При принятии пользовательских соглашений, Ваши данные могут попасть к страховщику, аффилированным лицам страховщика, страховому агенту или страховому брокеру. Также данные могут быть переданы лицам, предоставляющим услуги по использованию информационных возможностей для заключения договоров страхования, хранения документов, а также для осуществления маркетинговых коммуникаций. Важно отметить, что передача данных третьим лицам происходит с вашего согласия на обработку персональных данных.",1.0,0.0,0.9999999999,0.25,0.9425434115515668,0.1363,0.2175655670981278,0.99483037,0.9260849776953288,1.0
Зачем страховщик ведет аудио и видеозапись при взаимодействии с клиентом? Как долго эти записи хранятся?,"[""['При заключении Договоров страхования, а также при ином обращении Клиента или Пользователя к Страховщику или его представителям Страховщик вправе осуществлять наблюдение, фотографирование, аудио- и видеозапись, включая запись телефонных разговоров, а также копирование и хранение переписок между Пользователем и Страховщиком (его представителями) по электронной почте или в мессенджерах, без дополнительного уведомления Клиента (Пользователя) о такой записи. Клиент соглашается, что Страховщик вправе хранить такие записи в течение 5 (пяти) лет с момента прекращения отношений с Клиентом (Пользователем), с целью улучшения качества обслуживания, исполнения Договора страхования, а также использовать их при проведении любых расследований в связи с Договором страхования.']""]","Страховщик ведет аудио, видеозапись, фотографирование, копирует переписку с клиентом без дополнительного уведомления с целью улучшения качества обслуживания, исполнения договора страхования, а также для использования этих записей при проведении расследований, связанных с договором. Такие записи страховщик вправе хранить в течение 5 лет с момента прекращения отношений с клиентом.","Страховщик ведет аудио и видеозапись при взаимодействии с клиентом для улучшения качества обслуживания, исполнения договора страхования и использования записей при проведении расследований в связи с договором страхования. Эти записи хранятся в течение 5 лет с момента прекращения отношений с клиентом.",0.75,0.9256690048934996,0.9999999999,1.0,0.9841646385321764,0.325,0.6286451831229066,0.9942753,0.9647096418620372,1.0
В каких случаях застрахованному могут быть оплачены планируемые расходы по страховому случаю до предоставления подтверждающих документов? Какие ограничения есть по размеру таких выплат?,"[""['По договорам добровольного страхования непредвиденных расходов путешественников по предварительному согласованию со Страховщиком Застрахованному могут оплачиваться планируемые расходы по предусмотренным договором страхования страховым событиям, предусматривающим возмещение расходов на оказание Экстренной или Неотложной амбулаторной и/или стационарной помощи, с условием предоставления Застрахованным документов, подтверждающих такие расходы Страховщику непосредственно после их несения (чеки, платежные документы и пр.). В случае если в результате страхового случая Застрахованным лицом были понесены соответствующие расходы на оказание Экстренной или Неотложной амбулаторной и/или стационарной помощи, в том числе, предварительно согласованные Страховщиком, но не были предоставлены документы, подтверждающие их оплату, Страховщик возмещает расходы в размере не более 200 у.е. (если страховая сумма установлена в валюте, отличной от российского рубля) или 10 000 российских рублей (если страховая сумма установлена в российских рублях), за один страховой случай.']""]","По договорам добровольного страхования непредвиденных расходов путешественников застрахованному могут быть оплачены планируемые расходы по страховым случаям, предусматривающим возмещение расходов на экстренную/неотложную амбулаторную или стационарную помощь, по предварительному согласованию со страховщиком. Условие - предоставление подтверждающих документов сразу после несения расходов. Если документы не предоставлены, то страховщик возмещает расходы в размере не более 200 у.е. (если страховая сумма в валюте) или 10 000 рублей (если в рублях) за один случай.","Застрахованному могут быть оплачены планируемые расходы по страховому случаю до предоставления подтверждающих документов в случае, если расходы были связаны с оказанием экстренной или неотложной амбулаторной и/или стационарной помощи, и предварительно согласованы со Страховщиком. Однако, если не были предоставлены документы, подтверждающие оплату таких расходов, то Страховщик возмещает расходы в размере не более 200 у.е. или 10 000 российских рублей за один страховой случай, в зависимости от установленной страховой суммы.",1.0,0.0,0.9999999999,1.0,0.9714190832697912,0.2119,0.4521454229976616,0.9942005,0.9274082391864774,1.0
Куда пользователь может направить обращение при возникновении вопросов или спора со страховщиком?,"[""['При возникновении вопросов или спора можно отправить обращение:\\n\\nв АО «Тинькофф Страхование» по почте по адресу: 127287, Российская Федерация, г. Москва, ул. 2-я Хуторская, дом 38А, строение 26, либо путем заполнения соответствующей формы на сайте Страховщика;\\nк финансовому уполномоченному путем регистрации обращения на сайте — finombudsman.ru или по почтовому адресу: 119017, г. Москва, Старомонетный пер., дом 3;\\nво Всероссийский союз страховщиков на сайте — ins-union.ru, приложив к обращению необходимые документы и сведения, либо на почтовый адрес: 115093, г. Москва, ул. Люсиновская, д. 27, стр. 3;\\nв Центральный Банк Российской Федерации (Банк России) через интернет-приемную на официальном сайте — cbr.ru, приложив к обращению необходимые документы и сведения, либо на почтовый адрес: 107016, г. Москва, ул. Неглинная, д. 12.']""]","При возникновении вопросов или спора с АО 'Тинькофф Страхование' пользователь может направить обращение:

 - В АО 'Тинькофф Страхование' по почте или через форму на сайте;
 - Финансовому уполномоченному на сайте finombudsman.ru или почтовым адресом;
 - Во Всероссийский союз страховщиков на сайте ins-union.ru или почтовым адресом;
В Центральный Банк РФ через интернет-приемную на сайте cbr.ru или почтовым адресом.","Пользователь может направить обращение при возникновении вопросов или спора со страховщиком следующим образом: 
- В АО «Тинькофф Страхование» по почте по адресу: 127287, Российская Федерация, г. Москва, ул. 2-я Хуторская, дом 38А, строение 26, либо путем заполнения соответствующей формы на сайте Страховщика;
- К финансовому уполномоченному путем регистрации обращения на сайте — ﬁnombudsman.ru или по почтовому адресу: 119017, г. Москва, Старомонетный пер., дом 3;
- Во Всероссийский союз страховщиков на сайте — ins-union.ru, приложив к обращению необходимые документы и сведения, либо на почтовый адрес: 115093, г. Москва, ул. Люсиновская, д. 27, стр. 3;
- В Центральный Банк Российской Федерации (Банк России) через интернет-приемную на официальном сайте — cbr.ru, приложив к обращению необходимые документы и сведения, либо на почтовый адрес: 107016.",1.0,0.9575863809783366,0.9999999999,1.0,0.9722711367192356,0.0782,0.4538084156125068,0.9876362,0.9632822468847037,1.0
Где можно ознакомиться с дополнительной информацией и документами о деятельности АО 'Тинькофф Страхование'?,"[""['Дополнительная информация и документы о деятельности Страховщика в соответствии с п. 6.1 Закона РФ от 27.11.1992 N 4015-1 «Об организации страхового дела в Российской Федерации» и п. 2.1.1. «Базового стандарта защиты прав и интересов физических и юридических лиц — получателей финансовых услуг, оказываемых членами саморегулируемых организаций, объединяющих страховые организации» размещены по ссылкам: tinkoffinsurance.ru/about, tinkoffinsurance.ru/about/documents.']""]",Дополнительная информация и документы о деятельности АО 'Тинькофф Страхование' в соответствии с законом 'Об организации страхового дела в РФ' и базовым стандартом защиты прав получателей финансовых услуг размещены на сайте страховщика по ссылкам tinkoffinsurance.ru/about и tinkoffinsurance.ru/about/documents.,Вы можете ознакомиться с дополнительной информацией и документами о деятельности АО 'Тинькофф Страхование' на сайте tinkoinsurance.ru/about и tinkoinsurance.ru/about/documents.,,0.0,0.9999999999,1.0,0.9570702469576352,0.1207,0.3171074665802709,0.98328775,0.9031233458118176,1.0
Что означает 'Партия' и вообще 'Слиток' для драгоценных металлов?,"[""['\\n                    Партия — приобретенные Клиентом Слитки в количестве, превышающем 1 (одну) штуку, и подлежащие доставке Клиенту, \\n                    в рамках одной Заявки', ' Слиток — аффинированный драгоценный металл: золото, серебро, платина и палладий в виде слитков (стандартных, \\n                    мерных), соответствующих установленным в Российской Федерации стандартам или международным стандартам качества, \\n                    изготовленных и маркированных организацией, осуществляющей аффинаж драгоценного металла. Слиток в рамках \\n                    предоставления Сервиса доставляется / принимается на хранение в ненарушенной Упаковке с приложением Сертификата-\\n                    ярлыка (при наличии) и Сертификата качества слитка']""]","Давайте разберемся! 
                    Партия — это приобретенные клиентом слитки в количестве, превышающем 1 штуку, и подлежащие доставке клиенту, в рамках одной заявки.
                    Слиток — это аффинированный драгоценный металл: золото, серебро, платина и палладий в виде слитков (стандартных, 
                    мерных), соответствующих установленным в Российской Федерации стандартам или международным стандартам качества, 
                    изготовленных и маркированных организацией, осуществляющей аффинаж драгоценного металла. Слиток в рамках 
                    предоставления Сервиса доставляется / принимается на хранение в ненарушенной Упаковке с приложением Сертификата-
                    ярлыка (при наличии) и Сертификата качества слитка.
        ","Партия - это приобретенные клиентом слитки в количестве, превышающем 1 штуку, и подлежащие доставке клиенту в рамках одной заявки. Слиток - это аффинированный драгоценный металл в виде слитков (стандартных, мерных), соответствующих установленным стандартам качества.",,0.9685371385728926,0.9999999999,1.0,0.9603622807855504,0.273,0.5892220682372739,0.9885623,0.9577087992277932,0.5
Меня действительно должны фотографировать после полкчения слитка? Какой это пункт в соглашении?,"[""['\\n                    2.13.12. После подтверждения получения Клиентом/Доверенным лицом Слитка Представитель фотографирует Клиента/\\n                    Доверенное лицо с полученным Слитком в ненарушенной заводской упаковке и документом, удостоверяющим личность \\n                    Клиента/Доверенного лица']""]","Да, Вас действительно должнен сфотографировать Представитель в соответсвии с пунктом 2.13.12.","Да, после подтверждения получения слитка клиентом или его доверенным лицом, представитель банка фотографирует клиента или его доверенное лицо с полученным слитком в ненарушенной заводской упаковке и документом, удостоверяющим личность клиента или его доверенного лица. Этот пункт описан в разделе 2.13.12 правил оказания сервиса ""Покупка/продажа слитков драгоценных металлов"".",1.0,0.8453691649531508,0.9999999999,1.0,0.8408595010641949,0.0,0.094659767107822,0.96386755,0.6141653414520898,1.0
Какие условия хранения?,"[""[' \\n                    2.14.9. Условия хранения: температура воздуха от +17 до +25 °С, атмосферное давление от 740 до 760 мм рт. ст., относительная \\n                    влажность воздуха от 30 до 60%']""]","
                    В соответсвии с пунктом 2.14.9. условия хранения слитка слудующие: 
                        - температура воздуха от +17 до +25 °С,
                        - атмосферное давление от 740 до 760 мм рт. ст.,
                        - относительная влажность воздуха от 30 до 60% ","Условия хранения слитка устанавливаются настоящими Правилами и действующим законодательством Российской Федерации. Слиток может быть перемещен или принят на ответственное хранение в банке. Право собственности на слиток переходит к клиенту с момента списания стоимости слитка с его картсчета и подписания акта приема-передачи. Слиток хранится в хранилище пятого класса устойчивости к взлому, с системой видеонаблюдения и охранно-пожарной сигнализацией. Условия хранения включают определенные параметры: температура воздуха, атмосферное давление и относительная влажность воздуха. Банк имеет право изменить условия и место хранения слитка с письменного согласия клиента или без него в случае опасности порчи или гибели слитка.",1.0,0.9204319778461826,0.9999999999,0.75,0.8825287717956132,0.0,0.1573660092177058,0.9570707,0.8959190303684847,0.5
Что такое 'Сертификат качества слитка'?,"[""['Сертификат качества слитка — документ о качестве драгоценного металла, содержащий сведения о соответствии драгоценного металла стандартам качества, технические характеристики и параметры Слитка, информацию о химическом составе, произведенный/заверенный предприятием-изготовителем Слитка.']""]","Сертификат качества слитка - это документ, выданный изготовителем слитка драгоценного металла, который содержит информацию о соответствии металла стандартам качества, его технические характеристики, параметры и химический состав.","Сертификат качества слитка - это документ, который содержит информацию о качестве драгоценного металла, технические характеристики и параметры слитка, информацию о химическом составе, а также производителя или заверителя слитка. Этот сертификат является важным документом при приеме слитка клиентом или его доверенным лицом. В случае утраты, порчи или нарушения целостности заводской упаковки слитка, приобретенный слиток может быть признан ненадлежащего качества. Клиент или доверенное лицо обязаны сохранить этот сертификат для подтверждения качества слитка.",1.0,0.9645125633714192,0.9999999999,1.0,0.9785866016255126,0.0586,0.4357711877024263,0.98956746,0.9528233933821288,1.0
На какой срок выдается эта доверенность? Можно ли ее передоверить другому лицу?,"[""['Датой выдачи доверенности считается дата предоставления Представляемым Банку данных своего представителя. Доверенность выдана сроком на 1 (один) год, полномочия по настоящей доверенности не могут быть передоверены другим лицам.']""]",Доверенность выдается сроком на 1 год. Полномочия по этой доверенности нельзя передоверять другим лицам.,Доверенность выдается на срок один год и не может быть передоверена другому лицу.,,0.9576124931891532,0.9999999999,1.0,0.9658527559499182,0.0,0.192614670652939,0.9781495,0.9305141021200332,1.0
"Как клиент может получить сертификат качества слитка, который он передал на хранение в банк?","[""['По требованию Клиента Банк предоставляет Клиенту заверенную Банком копию Сертификата качества слитка, переданного на ответственное хранение.']""]","По требованию клиента банк предоставляет ему заверенную копию сертификата качества слитка, который клиент передал на ответственное хранение в банке.","Клиент может получить сертификат качества слитка, который он передал на хранение в банк, по требованию, предоставившему заверенную банком копию сертификата качества слитка, переданного на ответственное хранение.",,1.0,0.9999999999,1.0,0.9785678751099582,0.1544,0.6094620998158794,0.9918725,0.8941040748803317,1.0
Какие условия хранения слитков в банке? Где их хранят?,"[""['Хранение Банком Слитка Клиента осуществляется в хранилище 5 (Пятого) класса устойчивости к взлому, оборудованном системой видеонаблюдения и охранно-пожарной и тревожной сигнализации с выводом сигнала на пункт централизованной охраны, с осуществлением физической круглосуточной специализированной охраны хранилища.', 'Условия хранения: температура воздуха от +17 до +25 °С, атмосферное давление от 740 до 760 мм рт. ст., относительная влажность воздуха от 30 до 60%.']""]","Слитки хранятся в специальном хранилище 5 класса устойчивости к взлому, оборудованном системами видеонаблюдения, охранно-пожарной и тревожной сигнализацией, а также круглосуточной охраной. Условия хранения: температура +17...+25°С, атмосферное давление 740-760 мм рт.ст., влажность 30-60%.","Слитки хранятся в банке в хранилище 5 класса устойчивости к взлому, оборудованном системой видеонаблюдения и охранно-пожарной и тревожной сигнализации с выводом сигнала на пункт централизованной охраны, с осуществлением физической круглосуточной специализированной охраны хранилища. Условия хранения слитков включают в себя температуру воздуха от +17 до +25 °С, атмосферное давление от 740 до 760 мм рт. ст., относительная влажность воздуха от 30 до 60%. Кроме того, банк имеет право изменить условия и место хранения слитков с письменного согласия клиента.",1.0,0.9574304082517768,0.9999999999,1.0,0.9676851331205454,0.0703,0.3810882591256139,0.9872527,0.9590993886426082,1.0
"Можно ли вернуть слиток в банк, если при получении были обнаружены его повреждения? Как это сделать?","[""['В случае обнаружения при приеме Слитка с ответственного хранения от Представителя нарушения целостности заводской упаковки Слитка, несоответствия нанесенной на Слиток маркировки данным, указанным в Сертификате качества слитка и/или Сертификате-ярлыке, отсутствия либо повреждения Сертификата качества слитка и/или Слитка (наличие на поверхности Слитка наплывов / заусенцев / царапин / жировых пятен / посторонних включений) Клиентом/Доверенным лицом и Представителем оформляется в двух экземплярах Рекламационный акт по форме Приложения № 3 к настоящим Правилам, в котором фиксируются указанные выше нарушения / несоответствия / повреждения. В случае наличия указанных выше нарушений / несоответствий / повреждений Слиток вместе с Сертификатом качества слитка и Сертификатом-ярлыком вкладываются Клиентом/Доверенным лицом в порожний сейф-пакет и запечатываются, после чего сейф-пакет помещается в Устройство для перевозки слитка с дальнейшим опломбированием номерной разовой пломбой. Номер сейф-пакета, а также номерной разовой пломбы отражаются в Рекламационном акте.']""]","Да, если при получении слитка с хранения были обнаружены его повреждения или нарушения упаковки, несоответствия маркировки и т.п., то клиент/доверенное лицо вместе с представителем банка оформляют рекламационный акт в двух экземплярах. В этом акте фиксируются все нарушения. После этого слиток вместе с сертификатами запечатывают в новый сейф-пакет и опломбировывают, указав номера на рекламационном акте. Затем слиток возвращается обратно в банк.","Для возврата слитка в банк из-за обнаруженных повреждений необходимо оформить Рекламационный акт. По результатам рассмотрения акта, банк обязан связаться с клиентом и предоставить новый слиток или вернуть старый в течение 5 рабочих дней. Если повреждения не подтверждаются, то банк вернет старый слиток. Для оформления Рекламационного акта необходимо в двух экземплярах заполнить форму Приложения № 3 к правилам, фиксируя все нарушения, несоответствия или повреждения. Клиент должен вложить слиток в порожний сейф-пакет, запечатать его и передать представителю для предоставления в банк.",1.0,0.9422159755802598,0.9999999999,1.0,0.9271772330651964,0.0,0.2470506899814442,0.9931536,0.9371620404299362,1.0
Кто может стать доверенным лицом?,"[""['Доверенное лицо — физическое лицо, уполномоченное Клиентом, которому предоставлено право на представление интересов Клиента и осуществление действий от его имени в рамках Сервиса на основании доверенности, оформленной посредством Дистанционного обслуживания в соответствии с п. 5.3 настоящих Правил по форме Приложения № 5 к настоящим Правилам.']""]","Доверенным лицом клиента может стать любое физическое лицо, которому клиент предоставит полномочия представлять его интересы в рамках сервиса покупки/продажи слитков драгоценных металлов. Доверенность на это лицо оформляется клиентом посредством дистанционного обслуживания в банке по форме из Приложения №5 к Правилам.","Доверенным лицом может стать лицо, которое обладает документом, подтверждающим его полномочия представителя клиента. Этот документ может быть доверенностью или иным документом, признаваемым как таковой. Доверенность должна содержать прямое указание на необходимые для совершения сделки полномочия представителя и действовать на момент заключения такой сделки. Для идентификации представителя физического лица осуществляется на основании документов и сведений, указанных в соответствующем Перечне.",1.0,0.9366035604988336,0.9999999999,1.0,0.9206733670805638,0.0,0.1648204312067382,0.9900081,0.8918525439491581,1.0
Можно ли поменять доверенное лицо? Как это сделать?,"[""['Клиент может отменить выданную доверенность путем обращения в Банк посредством Дистанционного обслуживания в любое время, но не позднее одного дня до планируемой даты встречи с представителем Клиента.']""]","Да, клиент может отменить ранее выданную доверенность на доверенное лицо. Для этого он должен обратиться в банк посредством дистанционного обслуживания не позднее чем за 1 день до планируемой даты встречи с действующим доверенным лицом.","Для изменения доверенного лица в рамках сервиса «Покупка/продажа слитков драгоценных металлов» необходимо обратиться в Банк посредством Дистанционного обслуживания. Клиент может отменить выданную доверенность путем обращения в Банк в любое время, но не позднее одного дня до планируемой даты встречи с представителем Клиента.",0.5,0.9105712944467363,0.9999999999,0.0,0.937610068564982,0.126,0.349185685172466,0.9919687,0.8322515193490818,1.0
Как происходит покупка слитка банком? Есть ли какие-то особые условия?,"[""['Банк приобретает у Клиента только Слитки, находящиеся на ответственном хранении в Банке.', 'Клиент, обращаясь с Заявкой, подтверждает, что на момент заключения договора купли-продажи Слиток принадлежит на праве собственности Клиенту, не продан, не является предметом залога, не обременен правами третьих лиц, в споре, под арестом и иным запрещением не состоит.']""]","Банк осуществляет покупку слитков драгоценных металлов только у тех клиентов, чьи слитки находятся на ответственном хранении в самом банке. При подаче заявки на продажу слитка клиент должен подтвердить, что на момент продажи слиток принадлежит ему на праве собственности, не продан, не заложен, не арестован и не обременен правами третьих лиц.","Для покупки слитка банком клиент должен сначала подать заявку на сделку купли-продажи слитка через Дистанционное обслуживание в рабочие дни с 10:00 до 17:00 по московскому времени. Клиент должен подтвердить, что слиток принадлежит ему на праве собственности, не продан, не является предметом залога и не обременен правами третьих лиц. После согласования заявки, банк направит клиенту информацию о стоимости, массе и номере слитка. Клиент должен будет подтвердить свое согласие с заявкой и подписать необходимые документы посредством Дистанционного обслуживания. Зачисление стоимости слитка на картсчет клиента производится после подписания документов. Право собственности на слиток переходит от клиента к банку с момента зачисления стоимости слитка на картсчет клиента. Прием слитка банком производится по сертификату-ярлыку и сертификату качества слитка с проведением контрольного взвешивания и проверкой целостности заводской упаковки.",1.0,0.9297372690718486,0.9999999999,1.0,0.9353386933107638,0.0697,0.3656450603242032,0.9903186,0.923070330859738,1.0
Что такое накопительный счет и как начисляются проценты?,"[""['\\n                    3.1. Начисление процентов на остаток средств по Счету вклада/Накопительному счету производится со дня, следующего \\n                    за днем зачисления денежных средств на Счет вклада/Накопительный счет Клиента, до дня окончания срока Вклада \\n                    (включительно) либо до их списания со Счета вклада/Накопительного счета по иным основаниям.', ' \\n                    3.3. Клиент имеет возможность по согласованию с Банком посредством Дистанционного обслуживания изменить Тарифный \\n                    план Вклада на Тарифный план для мультивалютного Вклада. При смене Тарифного плана изменения в части процентной \\n                    ставки по Счету вклада, изначально открытого в рамках текущего Договора вклада, не распространяются до конца срока \\n                    размещения, установленного предыдущим Тарифным планом. Процентные ставки по валютам, отличным от валюты \\n                    измененного Тарифного плана, устанавливаются новым Тарифным планом.\\n                    3.4. При начислении процентов в расчет принимается величина процентной ставки (в процентах годовых) и фактическое \\n                    количество календарных дней, на которое привлечены денежные средства. При этом за базу берется действительное \\n                    число календарных дней в году (365 или 366 дней соответственно).\\n                    ', ' \\n                    Накопительный счет — счет, на котором учитываются денежные средства Клиента, предусматривающий начисление \\n                    процентов на остаток денежных средств, в соответствии с Договором накопительного счета.']""]","
                    Накопительный счет - это счет, на котором учитываются денежные средства клиента и на который начисляются проценты на остаток денежных средств. Проценты начисляются в соответствии с условиями договора накопительного счета.
                    Проценты на накопительном счете начисляются со дня, следующего за днем зачисления денежных средств на счет, до дня окончания срока вклада (включительно) либо до их списания со счета по другим основаниям.

                    При начислении процентов учитываются:
                    • Величина процентной ставки (в процентах годовых)
                    • Фактическое количество календарных дней, на которое привлечены денежные средства

                    За базу берется действительное число календарных дней в году (365 или 366 дней соответственно).","Накопительный счет - это счет, на который можно откладывать деньги для накопления и получения процентов. Проценты начисляются на остаток средств на счете по определенной процентной ставке, которая устанавливается банком. Как правило, проценты начисляются ежемесячно или по иной установленной банком схеме. Для получения подробной информации о начислении процентов на накопительный счет в банке Tinkoff, рекомендуется обратиться в банк для консультации с специалистом.",1.0,0.9534691364632104,0.9999999999,0.3333333333333333,0.928647972723112,0.0808,0.333691518225942,0.99260336,0.89511706605141,0.5
Можно ли открыть вклад в 12 лет?,"[""['1.2. Банк не заключает Договор вклада (Договор накопительного счета) с лицами, не достигшими возраста 14 лет']""]","Нет, Банк не заключает договор вклада с лицами, не достигшими возраста 14 лет.","Для открытия вклада в банке Tinkoff необходимо достигнуть совершеннолетия, то есть быть старше 18 лет. Возможно, в случае наличия родительского согласия, лицам в возрасте 14-18 лет также могут быть доступны некоторые банковские услуги, однако для конкретной информации рекомендуем обратиться в банк для получения детальной консультации.",1.0,0.8814320570201525,0.9999999999,1.0,0.8828533303729614,0.0,0.1026725177071551,0.93244183,0.8051805620083847,0.0
Могу ли я открыть несколько вкладов и пополнять их?,"[""['\\n                    4.1. Клиент имеет право:\\n                    4.1.1. Предъявить Банку требование о досрочном полном или частичном изъятии Вклада.\\n                    4.1.2. Вносить дополнительные денежные средства во Вклад/Накопительный счет, если данная возможность установлена \\n                    Тарифным планом.\\n                    4.1.3. Разместить несколько Вкладов (открыть несколько Счетов вклада/Накопительных счетов на условиях, устанавливаемых \\n                    Договором вклада (Договором накопительного счета), Тарифами:\\n                    • через Дистанционное обслуживание;\\n                    • в офисе Банка в часы работы операционного подразделения Банка.\\n']""]"," 
                    Да, вы можете открыть несколько вкладов и пополнять их.
                    Согласно пункту 4.1.3 приведенного контекста, клиент имеет право разместить несколько вкладов (открыть несколько счетов вклада/накопительных счетов) на условиях, устанавливаемых договором вклада (договором накопительного счета) и тарифами.
                    Вы можете открыть несколько вкладов как через дистанционное обслуживание, так и в офисе банка в часы работы операционного подразделения банка.","Да, вы можете открыть несколько вкладов в банке Tinkoff и пополнять их.",0.5,0.956272699855344,0.9999999999,0.375,0.8919285415082534,0.1064,0.4381141090204723,0.9266497,0.7744592299858206,1.0
Для получения страховой выплаты в случае несчастного случая с летальным исходом нужна ли справка из психушки?,"[""['\\n                    6.1. По риску Смерть в результате Несчастного случая должны быть предоставлены следующие документы:\\n                    j. Справка из психоневрологического диспансера и наркологического диспансера']""]","Да, в таком случае необходимы справки из психоневрологического диспансера и наркологического диспансера.","Для получения страховой выплаты в случае несчастного случая с летальным исходом не требуется справка из психушки. Для получения страховой выплаты необходимо создать и отправить информацию страховщику в соответствии с правилами страхования, указанными в документах, включая заявление об осуществлении страховой выплаты. Это можно сделать через официальный сайт страховщика, его агентов или мобильные приложения.",1.0,0.934855529895577,0.9999999999,0.6666666666666666,0.823730760731664,0.0,0.0390604973397785,0.96498877,0.6710094196625503,0.5
Дают ли кредит на автомобиль?,"[""['3.1. Банк предоставляет Клиенту Кредит на потребительские цели, в том числе на приобретение Товара и/или Автомобиля, в соответствии с законодательством Российской Федерации.']""]","Да, в соответсвии с пунктом 3.1. Банк предоставляет Клиенту Кредит на потребительские цели, , в том числе на приобретение автомобиля.","Да, банк Tinkoff предоставляет кредиты на автомобили.",1.0,0.929021620439272,0.9999999999,1.0,0.9148165110931112,0.0,0.3068273642329138,0.9770405,0.8207726038569485,1.0
Распростроняется ли страховое покрытие на смерть в алкогольном опьянении?,"[""[' \\n                    Страховое покрытие по рискам «Смерть» и «Инвалидность» не распространяется на события, произошедшие в результате \\n                    и/или в период:\\n                    a. действий, совершенных Застрахованным лицом в состоянии алкогольного, наркотического и/или токсического \\n                    опьянения; в результате употребления им наркотических, сильнодействующих лекарственных препаратов \\n                    и психотропных веществ без предписания врача (или по предписанию врача, но с нарушением указанной  \\n                    им дозировки); болезни Застрахованного лица, прямо связанной с наркоманией, токсикоманией, хроническим \\n                    алкоголизмом\\n                    ']""]","Нет, страховое покрытие не распространяется на смерть в алкогольном опьянении.","Из предоставленного контекста не удалось найти информацию о том, распространяется ли страховое покрытие на смерть в алкогольном опьянении. Рекомендую обратиться в банк Tinkoff для получения более подробной информации по данному вопросу.",,0.0,0.9999999999,0.5,0.9199408436111852,0.0589,0.3674930504891883,0.96760154,0.7511043629909798,0.0
"Может ли Банк изменить Тарифный план по кредитной карте, и какие условия должны быть соблюдены для этого?","[""['\\n                    Банк вправе в одностороннем порядке изменить Тарифный план, применяемый\\nв рамках Договора, и/или заменить его на другой Тарифный план, в том числе при заключении Договора и/или\\nна определенный период времени по усмотрению Банка, с целью уменьшения процентной ставки по кредиту\\nи/или улучшения иных условий обслуживания при условии, что это не повлечет возникновение новых или увеличение размера существующих денежных обязательств Клиента\\n                    ']""]","Да, Банк может изменить Тарифный план по кредитной карте в одностороннем порядке, но при условии, что это не приведет к возникновению новых или увеличению уже существующих денежных обязательств клиента ","Да, Банк может изменить Тарифный план по кредитной карте. Для этого необходимо ознакомиться с Общими условиями выпуска и обслуживания кредитных карт и Общими условиями открытия, ведения и закрытия счетов физических лиц, а также выпуска и обслуживания расчетных карт. В этих условиях должны быть указаны правила и процедуры изменения тарифного плана. Если у вас возникли дополнительные вопросы, рекомендуем обратиться в банк для получения более подробной информации.",1.0,0.9687703503860656,0.9999999999,1.0,0.9344888754748756,0.0693,0.1342142273550489,0.9766498,0.952186501799916,1.0
Можно ли внести частичное досрочное погашение кредита? И как это повлияет на остаток задолженности?,"[""['«Клиент имеет право досрочно погасить Задолженность с уплатой Банку суммы непогашенного Кредита и начисленных процентов, а также (если применимо) комиссий и плат, предусмотренных Тарифным планом, в любой момент путем зачисления необходимой суммы денежных средств на Картсчет (Счет) и извещения Банка о необходимости проведения досрочного погашения. В случае частичного досрочного погашения уменьшается срок Кредита или сумма Регулярного платежа по выбору Клиента, при этом Клиент не освобождается от оплаты ближайшего Регулярного платежа, а также применимых комиссий и плат, предусмотренных Тарифным планом.», «При обращении Клиента в Банк для совершения частичного досрочного погашения до или в дату оплаты ближайшего Регулярного платежа Клиенту может быть предложено совершить частичное досрочное погашение с погашением ближайшего Регулярного платежа и последующим уменьшением срока Кредита или суммы Регулярного платежа по выбору Клиента.»']""]","Да, Клиент имеет право совершить частичное досрочное погашение кредита. При этом по выбору Клиента уменьшится либо срок кредита, либо сумма регулярного платежа. Однако Клиент не освобождается от оплаты ближайшего регулярного платежа и применимых комиссий.","Да, можно внести частичное досрочное погашение кредита. При этом уменьшится срок кредита или сумма регулярного платежа по выбору клиента. Клиент не освобождается от оплаты ближайшего регулярного платежа, а также применимых комиссий и плат, предусмотренных тарифным планом. При частичном досрочном погашении оплачиваются только начисленные проценты и сумма непогашенного кредита, а комиссии и платы, предусмотренные тарифным планом, направляются на их досрочную оплату. Проценты, начисленные после частичного досрочного погашения до установленной даты оплаты погашенного ближайшего регулярного платежа, включаются в следующий регулярный платеж.",1.0,0.9671219599588208,0.9999999999,1.0,0.9568311243292268,0.0989,0.4864347167510845,0.9855481,0.9193945995316554,1.0
Что будет в случае просрочки платежа по кредиту? И какой штраф может быть начислен?,"[""['«В случае неоплаты платежа Клиент должен уплатить штраф за неоплату Минимального платежа согласно Тарифному плану. Банк рассматривает любой поступивший платеж Клиента как признание Клиентом данного штрафа в размере поступившего платежа, но не более суммы штрафа, определенного в соответствии с Тарифами.»']""]","В случае неоплаты минимального платежа по кредиту, Клиент должен уплатить штраф в соответствии с Тарифным планом. Размер штрафа определяется Тарифами, и любой поступивший от Клиента платеж Банк будет рассматривать как оплату штрафа в пределах установленной суммы.","В случае просрочки платежа по кредиту вам необходимо сообщить об этом в Банк посредством дистанционного обслуживания и оформить претензию. Сотрудник Банка поможет вам в этом. Штраф за просрочку платежа может быть начислен, однако конкретная сумма штрафа зависит от условий вашего кредитного договора. Для получения точной информации о штрафе в случае просрочки рекомендуется обратиться в банк для консультации.",0.75,0.925089802683413,0.9999999999,1.0,0.898211712081585,0.0,0.1551571131770861,0.9856865,0.913172399846358,1.0
Можно ли на время приостановить выплаты по кредиту? И как это повлияет на начисление процентов?,"[""['«На основании обращения Клиента и по согласованию с Банком на период от 1 (одного) до 12 (двенадцати) месяцев возможно приостановление обязанности Клиента по погашению Задолженности, по оплате Регулярных платежей и/или иных платежей. В указанный период Банк вправе приостановить начисление процентов и иных сумм, предусмотренных Договором реструктуризации задолженности.»']""]","Да, на основании обращения Клиента и по согласованию с Банком возможно приостановить обязанность по погашению задолженности и оплате платежей на срок от 1 до 12 месяцев. В этот период Банк вправе также приостановить начисление процентов и иных сумм по кредиту.","Да, можно на время приостановить выплаты по кредиту. Для этого необходимо обратиться в Банк и согласовать с ним период от 1 до 12 месяцев для приостановки обязанности по погашению задолженности и оплаты регулярных платежей. В указанный период Банк может приостановить начисление процентов и других сумм, предусмотренных кредитным договором. При этом срок возврата кредита продлевается на согласованный период приостановления обязанности по погашению задолженности.",1.0,0.9648509445512068,0.9999999999,1.0,0.9642880438767344,0.1258,0.4679954040729122,0.99183196,0.9269198589623228,1.0
Я хочу оформить дополнительную карту на супругу. Как это сделать? И будет ли она иметь доступ к общему лимиту по кредитке?,"[""['«3.2. По заявлению Клиента, переданному в Банк на бумажном носителе или через Дистанционное обслуживание, в рамках Договора кредитной карты Банком может быть выпущена одна или несколько дополнительных Кредитных карт.»', '«3.5. Клиент вправе установить лимит для проведения расходных операций с использованием Кредитной карты.»']""]","Вы можете оформить дополнительную кредитную карту на супругу, подав заявление в банк на бумажном носителе или через дистанционное обслуживание. Дополнительная карта будет иметь доступ к общему лимиту задолженности по вашей основной кредитной карте, однако вы можете установить отдельный лимит для расходных операций по дополнительной карте.","Для оформления дополнительной карты на супругу необходимо обратиться в Банк через дистанционное обслуживание и оформить соответствующую заявку. После этого, сотрудники Банка помогут вам с процессом. 

Относительно доступа к общему лимиту по кредитке: обычно дополнительные карты имеют свой собственный лимит, отдельный от основной карты. Однако, для уточнения информации о доступе к общему лимиту рекомендуется обратиться в Банк для получения подробной консультации.",1.0,0.9267386582177138,0.9999999999,1.0,0.9647805939913572,0.0,0.238198651268334,0.9920792,0.959500239928084,1.0
"А что если я потеряю карту? Сколько у меня есть времени, чтобы ее заблокировать? И как вообще это делается? Через приложение или звонить надо?","[""['«6.1. При обнаружении утери, кражи или порчи Кредитной карты и/или возникновения подозрений, что Кредитная карта или ее реквизиты, а также ПИН-код, QR-код, Коды доступа, Аутентификационные данные, Абонентский номер, Абонентское устройство могли быть утрачены или похищены, а также в случае изъятия Кредитной карты в банкомате или торгово-сервисном предприятии и в случае изменения имени или фамилии Держателя Клиент должен незамедлительно уведомить Банк по телефонам 8 800 555-10-10 или +7 495 645-59-19 (круглосуточно) и заблокировать Кредитную карту и/или Интернет-Банк и/или Мобильный банк, а также подать заявление о досрочном перевыпуске Кредитной карты.»']""]","В случае утери или кражи кредитной карты, вы должны незамедлительно уведомить банк по телефонам горячей линии 8 800 555-10-10 или +7 495 645-59-19 (круглосуточно) и заблокировать карту. Также необходимо подать заявление на досрочный перевыпуск новой карты. Чем быстрее вы заблокируете карту, тем меньше риск несанкционированного использования.","Если вы потеряли карту, важно как можно быстрее заблокировать ее. Это можно сделать через телефон, интернет-банк или мобильное приложение банка. Чем раньше вы заблокируете карту, тем меньше вероятность несанкционированного использования ею злоумышленниками. Необходимо напомнить, что после блокировки ваша ответственность за дальнейшее использование карты прекращается, если не станет известно, что незаконное использование карты имело место с вашего согласия. Если карта была украдена на территории РФ, важно заявить об этом в полицию. При краже карты за границей, следует обратиться в полицию или в консульский отдел посольства Российской Федерации в стране, где произошла кража.",1.0,0.8815344551012463,0.9999999999,1.0,0.9229433355452444,0.0355,0.2234158021713284,0.9817918,0.9109200000680868,1.0
"Прочитал тут у вас про блокировку карточки. А если я её забуду забрать в банкомате, что тогда делать?","[""['«6.1. [...] а также в случае изъятия Кредитной карты в банкомате или торгово-сервисном предприятии и в случае изменения имени или фамилии Держателя Клиент должен незамедлительно уведомить Банк по телефонам 8 800 555-10-10 или +7 495 645-59-19 (круглосуточно) и заблокировать Кредитную карту и/или Интернет-Банк и/или Мобильный банк, а также подать заявление о досрочном перевыпуске Кредитной карты.»']""]","Если вы забыли карту в банкомате, вам необходимо незамедлительно сообщить об этом в банк по телефонам горячей линии 8 800 555-10-10 или +7 495 645-59-19 и заблокировать кредитную карту, а также подать заявление на ее досрочный перевыпуск. Это позволит предотвратить возможное несанкционированное использование забытой карты третьими лицами.","Если вы забудете забрать карту в банкомате, то вам необходимо обратиться в банк посредством дистанционного обслуживания. Если карта была удержана банкоматом стороннего банка, вам нужно обратиться в банк, обслуживающий этот банкомат. Причины удержания карты могут быть различными, и в зависимости от этого карта может быть возвращена вам при предъявлении документа, удостоверяющего личность. В случае необходимости, сторонний банк может потребовать письменный запрос из банка, выпустившего карту. Помните, что сторонний банк имеет право не вернуть карту, если она была заблокирована ранее вами или банком, выпустившим карту.",1.0,0.8790274054352416,0.9999999999,1.0,0.9064661943589049,0.0,0.176665457188354,0.981309,0.9143339201884224,1.0
"А есть ли какие-то льготные условия, если я захочу приостановить выплаты по кредитке на какое-то время? Например, на ремонт или что-то в этом роде?","[""['«5.15. На основании обращения Клиента и по согласованию с Банком на период от 1 (одного) до 12 (двенадцати) месяцев возможно приостановление обязанности Клиента по погашению Задолженности, по оплате Минимальных платежей, Регулярных платежей и/или иных платежей. В указанный период Банк вправе приостановить начисление процентов и иных сумм, предусмотренных Договором кредитной карты.»']""]","Да, в документе указано, что по обращению клиента и по согласованию с банком возможно приостановление обязанности по погашению задолженности, выплате минимальных и регулярных платежей на срок от 1 до 12 месяцев. В этот период банк также может приостановить начисление процентов и других сумм по кредитной карте. Таким образом, вы можете получить льготный период для ремонта или других нужд, обратившись в банк с соответствующим заявлением.","Да, согласно пользовательскому соглашению банка Tinkoff, вы можете обратиться с запросом на приостановление обязанности по погашению задолженности, оплате регулярных платежей и/или иных платежей на период от 1 до 12 месяцев. В указанный период банк может приостановить начисление процентов и других сумм, предусмотренных кредитным договором. При этом оставшийся срок возврата кредита продлевается на согласованный период приостановления обязанности по погашению задолженности. Также можно изменить дату регулярного платежа, что может повлиять на срок возврата кредита.",,0.8880097195679529,0.9999999999,1.0,0.9548008605107507,0.2113,0.4408451345208181,0.99575245,0.9676000027698594,1.0
Какие процедуры предусмотрены банком для обработки жалоб клиентов?,"[""['Банк имеет установленные процедуры для обработки и рассмотрения жалоб клиентов, включая регистрацию жалобы, ее анализ и предоставление ответа клиенту в установленные сроки.']""]","Банк следует четко установленным процедурам для обработки жалоб клиентов, которые включают регистрацию жалобы, ее тщательный анализ и предоставление ответа клиенту в соответствии с установленными сроками.","Банк Tinkoff предусматривает процедуры обработки жалоб клиентов в соответствии с универсальным договором. Клиент может предоставить любой документ, указанный в перечне, не позднее 3 рабочих дней с даты первого представления их в налоговый орган. В случае обоснованного отсутствия документов, клиент может представить в банк письмо с указанием причин невозможности их представления. Дополнительно банк вправе запросить оборотно-сальдовую ведомость по счетам клиента. Если клиент не предоставляет сведения о неисполненных денежных обязательствах, это считается отсутствием таковых. Клиент также соглашается на предоставление сведений о деловой репутации от других клиентов банка или кредитных организаций, в которых клиент ранее был на обслуживании. В случае отсутствия документов, предусмотренных в перечне, могут быть предоставлены письменные отзывы о юридическом лице от контрагента клиента.",1.0,0.9670971806965328,0.9999999999,1.0,0.8635696601150451,0.0,0.0880634453839402,0.9860175,0.8605986733046843,0.5
Что происходит с депозитами в случае смерти?,"[""['В случае смерти клиента банк замораживает депозиты до решения вопросов наследства в соответствии с законодательством.']""]","После смерти клиента банк замораживает все его депозиты и удерживает их до тех пор, пока не будут решены вопросы наследства в соответствии с действующим законодательством.","Депозиты в случае смерти клиента могут быть переданы наследникам в соответствии с законодательством Российской Федерации. Однако, для получения более точной информации по данному вопросу, рекомендуется обратиться в банк Tinkoff для получения консультации у специалистов по наследственным вопросам.",,0.0,0.9999999999,1.0,0.9185597416163562,0.0,0.1176089132769869,0.98009646,0.7555316946570317,0.5
Могу я отказаться от получения уведомлений от банка и как это влияет на его обслуживание?,"[""['Клиенты имеют право отказаться от получения определенных типов уведомлений от банка, однако это может повлиять на их способность получать своевременную информацию о изменениях условий, сбоях в системе или других важных обновлениях.']""]","Клиенты могут отказаться от получения определенных типов уведомлений от банка, но это может привести к тому, что они не будут получать важные обновления и информацию своевременно, что может повлиять на их способность управлять своими счетами и услугами эффективно.","Для отказа от получения уведомлений от банка Tinkoff необходимо обратиться в банк через дистанционное обслуживание и оформить соответствующее заявление. Это не должно повлиять на обслуживание вашего счета или карты, однако вы можете упустить важную информацию или уведомления от банка, которые могут быть полезными для вас.",1.0,0.9149555304835596,0.9999999999,1.0,0.9047059895343312,0.0,0.2017075040604056,0.9933589,0.8860572655229786,1.0
Как я могу увеличить лимит по своей кредитной карте?,"[""['Для увеличения кредитного лимита клиенты должны подать заявление через мобильное приложение или веб-сайт банка, после чего банк рассмотрит их кредитную историю и текущую финансовую ситуацию.']""]","Чтобы увеличить кредитный лимит, клиентам необходимо подать соответствующее заявление через мобильное приложение или веб-сайт банка. Банк затем оценит их кредитную историю и текущую финансовую ситуацию перед принятием решения.",Для увеличения лимита по вашей кредитной карте вам необходимо обратиться в Банк через дистанционное обслуживание и оформить претензию. Сотрудник Банка поможет вам в этом.,,0.9834268530681244,0.9999999999,1.0,0.9225434012217332,0.0,0.0865679102321894,0.9901447,0.8504651463246795,1.0
"Каковы условия отмены банковской операции, например, перевода средств или платежа?","[""['Клиенты могут отменить определенные банковские операции, если они не были еще обработаны банком. Условия отмены операций установлены в пользовательском соглашении и зависят от типа операции.']""]","Условия отмены банковской операции зависят от того, была ли операция уже обработана банком. Для операций, которые еще не обработаны, клиенты могут инициировать отмену, следуя процедурам, описанным в пользовательском соглашении и в зависимости от типа операции.","Банк Tinkoff вправе отменить банковскую операцию, например, перевод средств или платежа, в случае невыполнения Клиентом своих обязательств по Договору реструктуризации задолженности или в других случаях по усмотрению Банка. При этом Банк направляет Клиенту Заключительный счет. В случае расторжения Договора реструктуризации задолженности в Банке находятся денежные средства Клиента, излишне перечисленные при погашении задолженности, Банк осуществляет возврат таких средств почтовым переводом или иным согласованным способом с удержанием комиссии за перевод. Если Банк не получает распоряжение Клиента о переводе денежных средств в течение определенного срока, указанные средства могут быть переданы Банку безвозмездно.",1.0,0.8846123668123549,0.9999999999,1.0,0.8744165778236612,0.0,0.0153038842992625,0.9823332,0.7384052266401818,0.0
Какие услуги доступны клиентам через Интернет-банк?,"[""['Через Интернет-банк клиенты могут управлять своими счетами, осуществлять платежи и переводы, а также получать детальную информацию о своих финансовых операциях.']""]","Интернет-банк предоставляет клиентам возможности управления их счетами, осуществления платежей и переводов, а также доступ к подробной информации о всех их финансовых операциях.","Клиент может воспользоваться услугами банка через Интернет-Банк, Мобильный Банк, Мобильные приложения Банка и другие каналы обслуживания в Интернет для получения информации и совершения операций. Это включает в себя возможность осуществлять платежи и переводы денежных средств, получать информацию об остатке денежных средств на счете, обменивать валюту и совершать другие операции по усмотрению банка.",0.4285714285714285,0.9220333538041195,0.9999999999,1.0,0.945693312257667,0.0,0.0748716908811539,0.9801933,0.897296915343621,1.0
"Я не пользовалась кредиткой год, но у меня там лежат мои 800 рублей, я могу их как-то вернуть?","['[\'""8. Расторжение Договора кредитной карты\\n                8.1. Банк вправе в любой момент расторгнуть Договор кредитной карты в одностороннем порядке в случаях, предусмотренных \\n                законодательством Российской Федерации, а также:\\n                • в случае если Держатель не пользовался Кредитной картой более, чем 6 (шесть) месяцев при отсутствии \\n                Задолженности по Договору кредитной карты;\\n                В этих случаях Банк блокирует все Кредитные карты/Токены, выпущенные в рамках Договора кредитной карты. Договор \\n                кредитной карты считается расторгнутым со дня формирования Банком Заключительного счета, который направляется \\n                Клиенту. Если в момент расторжения Договора кредитной карты Задолженность Клиента перед Банком отсутствует, Банк \\n                вправе расторгнуть Договор кредитной карты без направления Заключительного счета, информируя Клиента о своем \\n                решении любым способом по усмотрению Банка.\\n                8.5. В случае, если при расторжении Договора кредитной карты в Банке находятся денежные средства Клиента, излишне \\n                перечисленные им при погашении Задолженности, Банк осуществляет возврат таких денежных средств по распоряжению \\n                Клиента почтовым переводом или иным способом, указанном в распоряжении Клиента. При этом Банк вправе удержать \\n                из суммы такого перевода комиссию за перевод денежных средств в размере, предусмотренном Тарифами на услуги \\n                по переводам, платежам и дополнительные услуги с использованием каналов Дистанционного обслуживания.\\n                8.6. В случае неполучения Банком распоряжения Клиента о переводе денежных средств в течение 120 (ста двадцати) дней \\n                со дня обработки Банком последней операции Клиента/Держателя и, если остаток денежных средств не превышает \\n                1000 руб., указанный остаток считается безвозмездно переданным Банку. \\n                В случае неполучения Банком распоряжения Клиента о переводе денежных средств в течение 3 (трех) лет со дня обработки \\n                Банком последней операции Клиента/Держателя указанные денежные средства считаются безвозмездно переданными \\n                Банку.\\n                \']']","Согласно пунуту 8.6 - вы не можете вернуть ваши деньги, так как не дали распоряжение Банку о переводе денежных средств в течение 120 дней.","Для возврата 800 рублей, которые находятся на вашей кредитной карте после года неиспользования, вам необходимо обратиться в Банк посредством дистанционного обслуживания и оформить претензию. Сотрудник Банка поможет вам в этом.",,0.924157488886498,0.9999999999,0.0769230769230769,0.8629693518816709,0.0,0.0,0.9700921,0.7332454466046504,0.5
