question,contexts,ground_truth,answer,faithfulness,answer_relevancy,context_precision,context_relevancy,answer_similarity,bleu_score,cos-sim-TF-IDF,cos-sim-BertModel,sim-spacy
Можно ли не расписываться на карте?,"[""['После получения карты поставьте свою подпись в прямоугольнике, расположенном на оборотной стороне карты. При отсутствии подписи карта может быть не принята к оплате в торгово-сервисном предприятии, а также повышается риск использования карты злоумышленниками в случае ее утраты/кражи.']""]","При отсутствии подписи карта может быть не принята к оплате в торгово-сервисном предприятии, а также повышается риск использования карты злоумышленниками в случае ее утраты/кражи.","По правилам использования карты банка Tinkoff, при совершении операции оплаты покупки или услуги с использованием карты, вы обязаны подписать квитанцию или чек, что подтверждает факт совершения операции. В случае использования электронного терминала, кассир может предложить вам самостоятельно ввести ПИН-код, но операция должна проводиться в вашем присутствии. Если на карте отсутствует ваша подпись, она считается недействительной, и вам может быть отказано в обслуживании.

Таким образом, важно всегда расписываться на карте при проведении операций, чтобы подтвердить свое согласие на совершение транзакции и обеспечить безопасность использования карты. В случае отказа от расписывания на карте, вы можете столкнуться с отказом в обслуживании или другими проблемами при использовании карты. Поэтому рекомендуется всегда следовать правилам и указаниям банка по использованию карты для вашего собственного комфорта и безопасности.",0.0,0.9097012975017345,0.9999999999,1.0,0.9011647625766436,0.0,0.14615877205055836,0.97689223,0.93990347893617
"Мой друг попросил меня дать свою карту для оплаты и потом вернуть, это не опасно?","[""['Никогда не принимайте рекомендации, советы, помощь от третьих лиц при пользовании картой, особенно при снятии наличных денежных средств в банкоматах. В случае возникновения затруднений при совершении операции обратитесь Банк посредством дистанционного обслуживания. Обращайте внимание на расположение банкоматов. Старайтесь не пользоваться банкоматами, расположенными в плохо освещенных и безлюдных местах', 'Не передавайте карту другим лицам, в т.ч. родственникам и знакомым для проведения транзакций. С целью исключения Ваших потерь от несанкционированного использования Вашей карты (копирования информации с Вашей карты для ее дальнейшего мошеннического использования): при совершении операции оплаты с использованием карты никогда не выпускайте Вашу карту из поля зрения и требуйте от обслуживающего Вас лица, чтобы все операции с использованием карты совершались в Вашем присутствии.']""]","Не передавайте карту другим лицам, в т.ч. родственникам и знакомым для проведения транзакций и никогда не принимайте рекомендации, советы, помощь от третьих лиц при пользовании картой, особенно при снятии наличных денежных средств в банкоматах.","Дорогой клиент, спасибо за ваш вопрос о безопасности использования карты. Важно помнить, что передача своей карты другим лицам может нести определенные риски. 

Для обеспечения безопасности вашей карты и избежания возможных проблем, следует придерживаться нескольких простых правил. Во-первых, всегда следите за вашей картой и не оставляйте ее в надежде на кого-либо еще. Если ваш друг просит вас передать ему карту для оплаты, убедитесь, что все операции с использованием карты будут совершены в вашем присутствии. Это поможет избежать каких-либо недоразумений или возможных мошеннических действий.

Также важно помнить, что никогда не передавайте свою карту третьим лицам, даже родственникам или знакомым, для проведения транзакций. Это поможет избежать потерь от несанкционированного использования вашей карты.

Если у вас возникнут какие-либо сомнения или вопросы относительно безопасности использования карты, рекомендуем обратиться в Банк посредством дистанционного обслуживания. Наши специалисты всегда готовы помочь вам и ответить на все ваши вопросы.

Помните, что безопасность ваших финансов наш главный приоритет, и мы рекомендуем всегда быть бдительными и следовать простым правилам безопасности при использовании карты. Надеемся, что эта информация была полезной для вас. Если у вас есть еще какие-либо вопросы, не стесняйтесь обращаться к нам. Благодарим за внимание и доверие к нашему Банку.",0.7142857142857143,0.8475096909696033,0.9999999999,1.0,0.9116592985309553,0.0,0.1417412798499625,0.9841826,0.8051122298626555
Безопасно ли хранить пинкод в заметках в телефоне?,"[""['Категорически запрещается записывать ПИН-код на карте. Постарайтесь не записывать ПИН-код, запомните его. Если же Вы предпочитаете записать свой ПИН-код, никогда не указывайте, что это ПИН-код и не храните документ с записанным ПИН-кодом рядом с картой.']""]","Да, однако не указывайте в названии заметки, что это ПИН-код от Вашей карты.","Хранение пин-кода в заметках на телефоне является крайне небезопасной практикой, которую нельзя рекомендовать. ПИН-код - это ключевой элемент безопасности при использовании банковской карты, и его конфиденциальность должна быть обеспечена на высоком уровне. Поэтому рекомендуется запомнить пин-код, чтобы не писать его на бумаге или хранить в электронном виде.

Возможность доступа третьих лиц к вашему телефону и, следовательно, к такой чувствительной информации, как пин-код, может привести к утечке данных и, в конечном итоге, к финансовым потерям. Помните, что безопасность вашей банковской карты зависит от того, насколько хорошо вы защищаете свои конфиденциальные данные.

Следуя рекомендациям по безопасному использованию банковской карты, предоставленным в документах Банка, важно не только сохранять конфиденциальность пин-кода, но и применять другие меры безопасности, такие как не передача пин-кода третьим лицам, наблюдение за окружающими при вводе кода и немедленное блокирование карты в случае утери или подозрения на компрометацию данных.

Таким образом, хранение пин-кода в заметках на телефоне является рискованным действием, которое следует избегать во избежание угроз безопасности данных и финансов. Вместо этого рекомендуется запомнить пин-код или воспользоваться другими способами его безопасного хранения.",1.0,0.9153420203458822,0.9999999999,1.0,0.8643617665636407,0.0,0.2304098262906627,0.9272568,0.752335580420749
Я потеряла карту,"[""[' Вы потеряли карту или ее украли\\nПрежде всего, как можно быстрее, сообщите о случившемся в Банк посредством дистанционного обслуживания \\nи заблокируйте карту. Заблокировать карту можно по телефону, в интернет-банке или в мобильном приложении Банка. \\nЧем раньше Вы это сделаете, тем меньше вероятность несанкционированного использования карты злоумышленниками. \\nРазблокировать карту нельзя — можно только перевыпустить. Если вы не уверены, что карту украли, не спешите ее \\nблокировать, установите лимит «0» на операции и запретите покупки через Интернет, если карта будет найдена лимиты \\nможно изменить.\\nНапоминаем Вам, что в соответствии с Общими условиями выпуска и обслуживания кредитных карт и Общими \\nусловиями открытия, ведения и закрытия счетов физических лиц, а также выпуска и обслуживания расчетных карт Ваша \\nответственность за дальнейшее использование карты прекращается, после осуществления блокировки, если не станет \\nизвестно, что незаконное использование карты имело место с Вашего согласия.\\nЕсли карта была у Вас украдена на территории РФ, после блокировки карты заявите о случившемся в полицию. При краже \\nкарты за границей, заявите в полицию или в консульский отдел посольства Российской Федерации в стране, на территории \\nкоторой произошла кража. Пожалуйста, сохраняйте копию протокола (квитанцию о заявлении) для последующего \\nпредъявления в Банк.']""]","Если вы не уверены, что карту украли, не спешите ее блокировать, установите лимит «0» на операции и запретите покупки через Интернет, если карта будет найдена лимиты можно изменить. В случае, если вы полагаете, что Вашу карту всё-таки украли, то как можно быстрее, сообщите о случившемся в Банк посредством дистанционного обслуживания и заблокируйте карту. Это возможно сделать по телефону, в интернет-банке или в мобильном приложении Банка.","При потере карты, в соответствии с пользовательским соглашением банка Tinkoff, необходимо незамедлительно уведомить Банк. Для этого вы можете воспользоваться круглосуточными телефонами службы поддержки: 8 800 555-25-50 или +7 495 645-59-19. Важно заблокировать карту и/или доступ к Интернет-Банку и/или Мобильному Банку, а также подать заявление о досрочном перевыпуске карты.

По факту устного заявления, Банк примет меры только по блокированию карты. Если потерянная карта будет найдена, обязательно верните ее в Банк, так как использование ее в дальнейшем запрещено.

Также, при изъятии карты в торгово-сервисном предприятии или банке, потребуйте составления акта об изъятии с указанием даты, времени и причины изъятия, а также подписью сотрудника предприятия/банка. После этого немедленно проинформируйте Банк о случившемся посредством дистанционного обслуживания.

Банк обязуется предоставить вам всю необходимую информацию и поддержку в случае утери или изъятия карты, а также проводить операции по вашему счету в соответствии с условиями Договора и законодательством. Не забывайте следить за безопасностью своих банковских данных и никогда не передавайте их третьим лицам.",1.0,0.0,0.9999999999,0.1,0.9065463472146489,0.0,0.19583127976633385,0.9931395,0.8617822118063915
"Почему при использовании карты важно не расписываться на квитанциях/чеках до того, как вы проверите правильность указанной суммы?","[""['Проверяйте правильность суммы, указанной на платежном чеке. Поставив подпись на платежном чеке, Вы соглашаетесь со списанием указанной на нем суммы с Вашего карточного счета.']""]","Важно проверять правильность суммы перед подписанием квитанции/чека, потому что после подписи вы соглашаетесь с этой суммой, и она будет списана с вашего счета.","При использовании карты важно не расписываться на квитанциях/чеках до того, как вы проверите правильность указанной суммы по нескольким причинам. Во-первых, ваша подпись на квитанции или чеке подтверждает факт совершения операции и согласие списать указанную сумму с вашего карточного счета. Поэтому перед тем, как поставить свою подпись, важно убедиться, что сумма указана правильно и соответствует фактической сумме покупки или услуги.

Кроме того, при проведении операции с использованием карты важно быть внимательным и следить за каждым шагом. Например, при использовании электронного терминала кассир может предложить вам самостоятельно вставить карту и ввести ПИН-код. Операция должна проводиться в вашем присутствии, чтобы избежать возможных ошибок или мошенничества.

Также важно помнить, что при возникновении ошибок или несоответствий в слипе или чеке, вы имеете право требовать их исправления или оформления нового документа. Сохраняйте копии слипов и чеков по операциям с картой, чтобы иметь возможность доказать свои действия в случае возникновения споров или проблем.

Банк Tinkoff несет ответственность за безопасность и правильность проведения операций с использованием карты, однако важно также следовать указанным рекомендациям и быть внимательным при каждой транзакции. В случае возникновения вопросов или проблем, обратитесь в службу поддержки банка для получения помощи и консультации. Ваша бдительность и внимательность при использовании карты помогут избежать неприятных ситуаций и обеспечат безопасность ваших финансов.",1.0,0.9430150824790523,0.9999999999,1.0,0.8936088680394232,0.0,0.10855767033972219,0.9675156,0.9404771693465774
"Что делать, если я потеряла телефон, на котором было установлено мобильное приложение банка?","[""['При утрате Мобильного телефона, используемого с абонентским номером подвижной радиотелефонной связи, на который установлено Мобильное приложение Банка, Вам следует срочно обратиться к своему оператору сотовой связи для блокировки SIM-карты и в Банк посредством дистанционного обслуживания для блокировки доступа в мобильное приложение Банка и удаления данных карты с Мобильного телефона.']""]","Если вы потеряли телефон с установленным мобильным приложением банка, необходимо:

Срочно обратиться к оператору сотовой связи для блокировки SIM-карты.
Обратиться в банк через дистанционное обслуживание для блокировки доступа в мобильное приложение и удаления данных карты с телефона.","В случае утери мобильного телефона, на котором было установлено мобильное приложение нашего банка, важно принять несколько мер для обеспечения безопасности ваших данных и финансов. 

В первую очередь, необходимо связаться с вашим оператором сотовой связи для блокировки SIM-карты, чтобы предотвратить возможное злоупотребление вашим телефонным номером. После этого необходимо обратиться в наш банк через дистанционное обслуживание для блокировки доступа к мобильному приложению банка и удаления данных карты с потерянного мобильного телефона. 

Такие меры помогут предотвратить возможные финансовые риски и защитят вашу информацию от несанкционированного доступа. После этого, вам также необходимо обратиться в наш банк для восстановления доступа к мобильному приложению на новом устройстве и обеспечения безопасности вашего аккаунта. 

Не забывайте следить за своей финансовой информацией и регулярно проверять операции по вашему счету, чтобы своевременно заметить любые подозрительные транзакции. В случае каких-либо вопросов или дополнительной помощи, наша служба поддержки всегда готова помочь вам. Безопасность и защита ваших средств - наш главный приоритет.",1.0,0.9387660159512273,0.9999999999,1.0,0.9528840320897305,0.0171,0.33407485049682983,0.9875108,0.8911027809793717
Можно ли использовать интернет-кафе и другие общедоступные места для совершения операций по карте в интернете? Объясните причину.,"[""['Избегайте осуществления Интернет-операций с использованием карты в местах, где услуги Интернет являются общедоступными, например, в Интернет-кафе.']""]","Нет, не рекомендуется использовать интернет-кафе и другие общедоступные места для совершения операций по карте в интернете. Причина в том, что такие общедоступные сети являются менее безопасными, и есть риск перехвата данных карты злоумышленниками.","Пользование интернет-кафе и других общедоступных мест для совершения операций по карте в интернете не рекомендуется из-за риска компрометации безопасности ваших финансовых данных. В соответствии с нашими рекомендациями, следует избегать использования общедоступных интернет-услуг для проведения операций с использованием банковской карты. 

Вместо этого, старайтесь пользоваться проверенными интернет-магазинами, в которых вы уверены в надежности и безопасности. При совершении покупок в сети Интернет также следует обращать внимание на ввод трехзначного кода безопасности CVC2/CVV2 для повышения безопасности операций с использованием карты. Не сообщайте свои банковские данные (номер карты, срок действия, трехзначный код безопасности, ПИН-код) никому, за исключением использования автоматизированных систем MOTO и систем интернет-коммерции.

Эти меры безопасности помогут защитить ваши финансовые средства от возможных мошеннических действий и обеспечат безопасность при совершении операций по карте в интернете. Помните, что безопасность ваших финансовых данных является нашим приоритетом, и мы рекомендуем следовать указанным рекомендациям для минимизации рисков и обеспечения безопасности при использовании банковской карты в интернете.",1.0,0.8850941562781632,0.9999999999,1.0,0.9226577867752285,0.007,0.21986030925882505,0.9779988,0.9150381617953456
"Что делать, если я получил SMS-оповещение о операции по карте, которую я не совершал?","[""['Если Вы уверены, что операция не могла быть совершена Вами, то как можно быстрее сообщите об этом в Банк посредством дистанционного обслуживания и заблокируйте карту.']""]","Если вы получили SMS-оповещение о операции, которую не совершали, нужно как можно быстрее сообщить об этом в банк через дистанционное обслуживание и заблокировать карту.","Если вы получили SMS-оповещение о операции по карте, которую вы не совершали, важно принять несколько мер для защиты вашей безопасности и предотвращения возможных финансовых потерь.

В первую очередь, убедитесь, что у вас действительно есть карта, которая была использована для операции. Если карта у вас, то возможно, данные вашей карты стали известны третьим лицам, и операции были совершены без вашего согласия. 

Посмотрите на текст SMS-сообщения и вспомните, соответствует ли операция тем, что вы совершали за последнее время. Если вы уверены, что определенные операции не могли быть совершены вами, необходимо как можно быстрее сообщить об этом в Банк через дистанционное обслуживание и запросить блокировку карты.

Необходимо помнить, что при операциях в интернете или по телефону в SMS-сообщении могут быть указаны страна/город, отличающиеся от вашего места проживания, что также может свидетельствовать о мошенничестве.

Обратитесь в Банк посредством дистанционного обслуживания и предъявите претензию по оспариваемым операциям. Оформите заявление на отказ от операций, перечислив спорные платежи и указав причину отказа. Приложите любые документы, которые могут подтвердить, что операции были совершены без вашего согласия.

Банк обязан рассмотреть вашу претензию и принять меры для защиты ваших финансовых средств. В случае подтверждения мошенничества, вам будет возвращен ущерб, нанесенный незаконными операциями.

Не откладывайте обращение в Банк и следуйте рекомендациям по защите вашей карты и финансовых средств. Ваши действия могут помочь предотвратить мошеннические операции и сохранить целостность вашего банковского счета.",1.0,0.9825049656670622,0.9999999999,1.0,0.938354430141758,0.0001,0.28672993210624725,0.9755446,0.884230427350704
Как обезопасить себя от съема данных карты в банкомате злоумышленниками? Приведи два способа.,"[""['Поэтому, при пользовании банкоматом не ленитесь внимательно осмотреть его и убедиться в отсутствии каких-либо «накладок» и посторонних устройств.', 'Пожалуйста, примите все меры, чтобы вводимый Вами ПИН-код был не заметен для окружающих.']""]","Чтобы обезопасить себя от съема данных карты в банкомате:

Внимательно осматривайте банкомат перед использованием на наличие подозрительных накладок и посторонних устройств.
Прикрывайте рукой клавиатуру при вводе ПИН-кода, чтобы его не могли увидеть окружающие.","Для обезопасить себя от съема данных карты в банкомате злоумышленниками, существует несколько способов, которые я могу рекомендовать.

Первый способ - внимательно осматривать банкомат перед использованием. Как указано в предоставленном контексте, мошенники могут устанавливать специальные устройства на клавиатуру и приемное устройство для карты. Поэтому, перед вводом ПИН-кода или вставкой карты, убедитесь, что не видно никаких подозрительных элементов на банкомате. Если что-то кажется странным или необычным, лучше отказаться от использования этого устройства.

Второй способ - при вводе ПИН-кода прикрывайте клавиатуру рукой. Это поможет предотвратить подсмотр ПИН-кода мошенниками при помощи скрытых камер. Также, следует быть осторожным, чтобы не дать возможность мошенникам отвлечь вас в момент снятия денежных средств из банкомата.

Банк Tinkoff также рекомендует следовать простым правилам безопасности при использовании карты, таким как подписание карты при получении, хранение ее в безопасном месте, не разглашение ПИН-кода третьим лицам, и т.д. Эти меры помогут уменьшить риски кражи данных и денег с вашей карты.

В целом, внимательность, осторожность и соблюдение правил безопасности при использовании карты в банкомате помогут вам обезопасить себя от потенциальных мошеннических действий. Если у вас возникнут подозрения или необычные ситуации при использовании банкомата, лучше всего обратиться за помощью к сотрудникам банка или выбрать другое безопасное место для проведения операции.",1.0,0.9678669266775213,0.9999999999,1.0,0.9539718908365411,0.0016,0.34515637274623157,0.98404896,0.9373313228795755
"Правда ли, что при бронировании гостиницы по карте мне необходимо сообщить все реквизиты карты, включая ПИН-код? Если нет, то что именно требуется сообщить?","[""['При бронировании номера в гостинице по карте Вас попросят сообщить свое имя, номер карты, срок ее действия (иногда, дополнительно — трехзначный код безопасности, напечатанный на обратной стороне карты на полосе для подписи) и срок Вашего пребывания.']""]","Нет, неправда. При бронировании гостиницы по карте не требуется сообщать ПИН-код. Обычно для бронирования запрашивают ваше имя, номер карты, срок ее действия, иногда трехзначный код безопасности (CVV/CVC) с оборотной стороны карты и планируемый срок пребывания.","При бронировании гостиницы по карте на сайте гостиницы или при общении с представителями гостиницы вам необходимо будет предоставить следующие реквизиты карты: ваше имя, номер карты, срок ее действия, а также трехзначный код безопасности, который обычно находится на обратной стороне карты на полосе для подписи. Необходимости сообщать ПИН-код карты не существует.

При бронировании номера в гостинице на вашей карте блокируется сумма, равная стоимости проживания в отеле на указанный вами срок. После окончательного расчета, в который может входить стоимость дополнительных услуг, со счета карты списывается итоговая сумма. После бронирования гостиницы также может быть произведен авторизационный запрос на незначительную сумму, обычно 1 USD, для проверки подлинности карты. Эта сумма не будет списана с вашей карты и станет доступна для использования через 30 дней.

При отмене бронирования гостиницы важно соблюдать сроки и правила отмены, чтобы избежать списания с вашего счета суммы одного дня проживания или полной стоимости проживания, особенно в случае бронирования с предоплатой.

Таким образом, для бронирования гостиницы по карте необходимо предоставить определенные реквизиты карты, но ПИН-код сообщать не требуется. При соблюдении правил и осторожности использование карты будет безопасным и удобным.",,0.9112610760170612,0.9999999999,1.0,0.9504603823257113,0.0054,0.4114914700826416,0.9813218,0.9266461433858039
"Если я из другой страны и у меня нет паспорта РФ, что мне делать?","[""['\\n                     1. Документы и сведения, получаемые в целях идентификации Клиентов-физических лиц, а также в целях обслуживания таких Клиентов в рамках Универсального договора\\n                     1.4. Реквизиты документа, удостоверяющего личность: серия (при наличии) и номер документа, дата выдачи документа, наименование органа, выдавшего документ (при наличии кода подразделения может не устанавливаться), и код подразделения (при наличии).\\n                     1.4.2.для иностранных граждан:\\n                     •паспорт иностранного гражданина;\\n                     •дипломатический паспорт, служебный паспорт, удостоверяющие личность иностранного гражданина.', '.5.Документ, подтверждающий право иностранного гражданина или лица без гражданства на пребывание (проживание) в Российской Федерации (миграционной карты в случае отсутствия иных документов), в случае если наличие таких документов обязательно в соответствии с международными договорами Российской Федерации и законодательством Российской Федерации;Документами, подтверждающими право иностранного гражданина или лица без гражданства на пребывание (проживание) в РФ, являются:\\n                    •миграционная карта в случае отсутствия иных документов;\\n                    •вид на жительство;\\n                    •разрешение на временное проживание;\\n                    •виза;\\n                    •иной документ, подтверждающий в соответствии с международными договорами Российской Федерации и законодательством РФ право иностранного гражданина или лица без гражданства на пребывание (проживание) в РФ.\\n']""]","
                        Если вы из другой страны, то для заключения договора вам неообходимы документы, удостоверяющие Вашу личность. Для иностранных граждан это:
                            •паспорт иностранного гражданина;
                            •дипломатический паспорт, служебный паспорт, удостоверяющие личность иностранного гражданина.
                        Также необходимы документы, подтверждающие право иностранного гражданина (проживание) в Российской Федерации (миграционной карты в случае отсутствия иных документов), в случае если наличие таких документов обязательно в соответствии с международными договорами Российской Федерации и законодательством Российской Федерации;Документами, подтверждающими право иностранного гражданина или лица без гражданства на пребывание (проживание) в РФ, являются:
                            •миграционная карта в случае отсутствия иных документов;
                            •вид на жительство;
                            •разрешение на временное проживание;
                            •виза;
                            •иной документ, подтверждающий в соответствии с международными договорами Российской Федерации и законодательством РФ право иностранного гражданина или лица без гражданства на пребывание (проживание) в РФ. ","Если вы находитесь в другой стране и у вас нет паспорта Российской Федерации, для получения услуг банка Tinkoff вам необходимо предоставить документ, подтверждающий вашу личность и право на пребывание в данной стране. Это может быть ваш паспорт иностранного гражданина, дипломатический паспорт, служебный паспорт или другой документ, удостоверяющий вашу личность.

В случае отсутствия паспорта Российской Федерации, вы можете использовать миграционную карту, вид на жительство, разрешение на временное проживание, визу или другой документ, подтверждающий ваше право на пребывание в Российской Федерации в соответствии с международными договорами и законодательством РФ.

Важно убедиться, что предоставленный вами документ является действительным и признаваемым в Российской Федерации. Если у вас возникли дополнительные вопросы или затруднения, не стесняйтесь обращаться в банк Tinkoff для получения более подробной консультации и инструкций по оформлению услуг.",0.8,0.8998282436540471,0.9999999999,0.16666666666666666,0.9369455095668887,0.0684,0.473120673797555,0.9920344,0.9164876840657256
В течении скольких дней действительна выписка из ЕГРЮЛ?,"[""['\\n                    2.2. Выписка из Единого государственного реестра юридических лиц (ЕГРЮЛ). Банком может быть принята копия \\n                    выписки, заверенная регистрирующим органом. Выписка считается действительной для предоставления в Банк \\n                    в течение 30 (тридцати) календарных дней с даты ее выдачи и должна содержать актуальные сведения на дату  \\n                    ее предоставления;']""]",Выписка из Единого государственного реестра юридических лиц (ЕГРЮЛ) действительна в течении 30 дней с даты ее выдачи.,"Выписка из ЕГРЮЛ считается действительной для предоставления в Банк в течение 30 (тридцати) календарных дней с даты ее выдачи. Это значит, что если у вас есть выписка из ЕГРЮЛ, то вам необходимо предоставить ее в банк в течение месяца с момента выдачи этого документа. Важно, чтобы выписка содержала актуальные сведения на дату ее предоставления, чтобы информация была корректной и актуальной для банка.

Таким образом, если у вас есть выписка из ЕГРЮЛ и вы планируете использовать ее для предоставления в банк Tinkoff, убедитесь, что вы делаете это в течение 30 дней с момента ее выдачи. В противном случае, банк может потребовать обновленную выписку с актуальной информацией. Важно соблюдать этот срок, чтобы процесс обработки документов прошел гладко и без задержек.",0.8571428571428571,0.9375123233331983,0.9999999999,0.25,0.9121624870825061,0.0008,0.26709609829604786,0.95199364,0.7331121197888066
Нужно ли ИП указывать свой сайт для предприятия?,"[""['\\n                    3. Документы и сведения, предоставляемые Клиентом-индивидуальным предпринимателем: \\n                    3.5. Сведения о доменном имени, указателе страницы сайта в сети «Интернет», с использованием которых Клиентом \\nоказываются услуги (при наличии);\\n                    ']""]","Да, индивидуальному предпринимателю необходимо указать сведения о доменном имени, указателе страницы сайта в сети «Интернет».","Для предприятий индивидуальных предпринимателей, зарегистрированных в банке Tinkoff, предусмотрена возможность указания доменного имени и указателя страницы сайта в сети Интернет, с использованием которых оказываются услуги клиентом (при наличии такой информации). Это требование предоставляется в рамках процедуры идентификации индивидуального предпринимателя при обслуживании в банке.

Указание сайта для предприятия является важным элементом для банка, так как это дает возможность более детально изучить деятельность клиента, его цели и характер бизнеса. Это также может помочь банку в проведении проверок и анализе платежеспособности клиента.

Поэтому, если у индивидуального предпринимателя есть сайт, предполагается, что он должен указать его в соответствующих документах при обслуживании в банке Tinkoff. Это необходимо для обеспечения прозрачности бизнеса, соблюдения законодательства и установленных правил банка. 

Если у клиента-индивидуального предпринимателя нет сайта, то данное требование не является обязательным, но при его наличии рекомендуется предоставить соответствующую информацию для более полного представления о бизнесе клиента. 

Таким образом, указание сайта для предприятия не является обязательным требованием, но может быть рекомендовано для целей прозрачности и дополнительной идентификации клиента при обслуживании в банке Tinkoff.",0.75,0.8723072309989631,0.9999999999,0.3333333333333333,0.9127188946808796,0.0,0.0913020952254723,0.96136546,0.8823594131548594
Может ли Банк запросить дополнительные документы - не из списка обязательных?,"[""['\\n                     26. Банк может запросить у Клиента, а Клиент обязуется предоставить по запросу Банка дополнительные документы \\n                    и сведения, как предусмотренные, так и не предусмотренные настоящим Перечнем, в том числе в целях надлежащей \\n                    идентификации Клиента, его представителя, выгодоприобретателя и бенефициарного владельца в соответствии \\n                    с требованиями действующего законодательства Российской Федерации, нормативных актов Банка России, а также \\n                    требованиями Банка. Банк вправе не запрашивать отдельные документы и сведения, предусмотренные настоящим \\n                    Перечнем, в случаях, установленных внутренними правилами Банка.']""]","Да, Банк может запросить у Вас дополнительные не предусмотренные Перечнем документы.","Банк Тинькофф имеет право запросить у клиента дополнительные документы и сведения, как предусмотренные, так и не предусмотренные в перечне, в том числе для надлежащей идентификации клиента, его представителя, выгодоприобретателя и бенефициарного владельца в соответствии с требованиями действующего законодательства Российской Федерации, нормативных актов Банка России и требованиями самого Банка. Это необходимо для обеспечения безопасности операций и соблюдения законодательства.

Банк также может запросить у клиента документы, подтверждающие его доход, например, справку о заработной плате с места работы. В случае непредоставления указанных документов, Банк вправе использовать статистическую информацию о среднедушевом доходе в регионе регистрации клиента. Это делается с целью определения долговой нагрузки клиента и может повлиять на условия предоставления кредита.

Таким образом, ответ на ваш вопрос - да, Банк Тинькофф может запросить у клиента дополнительные документы, не входящие в список обязательных, если это необходимо для выполнения законодательства и обеспечения безопасности операций.",1.0,0.9652102407928301,0.9999999999,0.25,0.9045706915962682,0.0,0.29835811023583453,0.94627076,0.7572754149591755
Какие документы нужно предоставить физическому лицу для открытия счета?,"[""['1. Документы и сведения, получаемые в целях идентификации Клиентов-физических лиц, а также в целях обслуживания таких Клиентов в рамках Универсального договора']""]","Физическому лицу для открытия счета необходимо предоставить документ, удостоверяющий личность (паспорт или иной документ из списка в п.1.4), документ, подтверждающий регистрацию или место пребывания, ИНН, СНИЛС и контактную информацию.","Для открытия счета физическому лицу необходимо предоставить следующие документы:

1. Документ, удостоверяющий личность. Это может быть паспорт РФ или иной документ, удостоверяющий личность в соответствии с законодательством РФ.

2. В случае, если физическое лицо является иностранным гражданином или лицом без гражданства, необходимо предоставить документ, подтверждающий право на пребывание (проживание) в Российской Федерации.

3. Дополнительные документы могут потребоваться в зависимости от организационно-правовой формы и требований законодательства РФ. Например, могут потребоваться документы-основания участия бенефициара в отношениях по договору с банком.

Важно отметить, что предоставление полного пакета документов является обязательным для успешного открытия счета. Без необходимых документов банк не сможет принять заявку на открытие счета. Поэтому рекомендуется заранее ознакомиться с перечнем необходимых документов и подготовить все необходимые документы заранее.",1.0,0.9902676896789208,0.9999999999,1.0,0.9524416957248285,0.0,0.2993480242380846,0.9753443,0.9461805588985273
Какие документы необходимо предоставить юридическому лицу для открытия счета в Банке? Можно ли предоставить сканы документов или нужны оригиналы?,"[""['2.1. Учредительные документы юридического лица...', '2.2. Выписка из Единого государственного реестра юридических лиц (ЕГРЮЛ)...', '2.3. Документ об избрании единоличного исполнительного органа юридического лица...']""]","Юридическому лицу необходимо предоставить учредительные документы, выписку из ЕГРЮЛ, документ об избрании руководителя, документы, подтверждающие личность руководителя и лиц, имеющих право подписи. Документы можно предоставить в копиях, заверенных нотариально, регистрирующим органом, руководителем или сотрудником Банка при наличии оригиналов.","Для открытия счета юридическому лицу в Банке Tinkoff необходимо предоставить определенные документы в зависимости от организационно-правовой формы компании и требований законодательства РФ. В частности, для открытия номинального счета требуется предоставить сведения и документы, включая документы-основания участия бенефициара или бенефициаров в отношениях по договору номинального счета.

Кроме того, юридическим лицам необходимо предоставить ряд документов, таких как свидетельства о постановке на учет в налоговом органе, разрешения Национального (Центрального) банка иностранного государства на открытие счета (с заверенным переводом на русский язык), документы, подтверждающие полномочия руководителя ЮЛ-нерезидента, а также документы, удостоверяющие личность лиц, наделенных правом подписи и руководителя ЮЛ-нерезидента.

Относительно предоставления сканов документов или оригиналов, обычно требуется предоставление оригиналов документов для верификации информации. Однако, в некоторых случаях, банк может принять сканы документов, если они являются официально заверенными и соответствуют требованиям банка.

Таким образом, для открытия счета в Банке Tinkoff юридическому лицу необходимо предоставить определенные документы в соответствии с требованиями банка и законодательства РФ, включая оригиналы или официально заверенные сканы документов.",1.0,0.9337686036378466,0.9999999999,1.0,0.8990110579471216,0.0,0.27442151669031284,0.9878532,0.9240910732655585
Можно ли открыть счет индивидуальному предпринимателю – иностранному гражданину? Какие документы для этого нужны?,"[""['3.1. Идентификация индивидуального предпринимателя осуществляется на основании документов и сведений, указанных в пункте 1.4 настоящего Перечня', '3.2. Документ, подтверждающий право иностранного гражданина или лица без гражданства на пребывание (проживание) в Российской Федерации...']""]","Да, индивидуальному предпринимателю-иностранному гражданину можно открыть счет. Для этого нужно предоставить документ, удостоверяющий личность, документ, подтверждающий право пребывания/проживания в РФ (напр. миграционную карту), ИНН, СНИЛС, выписку из ЕГРИП и контактную информацию.","Спасибо за ваш вопрос. Да, индивидуальный предприниматель – иностранный гражданин имеет возможность открыть счет в банке Tinkoff. Для этого потребуется предоставить определенный набор документов. 

Согласно предоставленному контексту, для открытия счета индивидуальному предпринимателю – иностранному гражданину необходимо предоставить следующие документы:

1. Свидетельство о постановке на учет в налоговом органе ЮЛ-нерезидента в случаях, предусмотренных законодательством Российской Федерации.
2. Разрешение Национального (Центрального) банка иностранного государства на открытие счета (с заверенным переводом на русский язык), если наличие такого разрешения требуется в соответствии с международными договорами с участием Российской Федерации или законодательством иностранного государства.
3. Документ, подтверждающий полномочия руководителя ЮЛ-нерезидента.
4. Документ, удостоверяющий личность лица (лиц), наделенного (ых) правом подписи и руководителя ЮЛ-нерезидента, а также лица (лиц) уполномоченного (ых) распоряжаться денежными средствами, находящимися на счете ЮЛ-нерезидента.

Кроме того, индивидуальному предпринимателю – иностранному гражданину потребуется предоставить документ, подтверждающий право на пребывание (проживание) в Российской Федерации, лицензии на осуществление деятельности, информацию о страховом номере индивидуального лицевого счета застрахованного лица в системе обязательного пенсионного страхования и другие необходимые документы.

Таким образом, для открытия счета индивидуальному предпринимателю – иностранному гражданину в банке Tinkoff требуется предоставить полный комплект документов, соответствующий требованиям банка и законодательству Российской Федерации.",1.0,0.9411753908262098,0.9999999999,1.0,0.939896614333606,0.0,0.2106654856063626,0.9763465,0.9175674120468379
"Какие документы потребуются, если открывать счет для нотариуса, занимающегося частной практикой? Может ли нотариус быть иностранцем при этом?","[""['5.1. Документ, удостоверяющий личность и указанный в пункте 1.4 настоящего Перечня', '5.2. Документ, подтверждающий наделение нотариуса полномочиями (назначение на должность), выдаваемый органами юстиции субъектов Российской Федерации, в соответствии с законодательством Российской Федерации']""]","Для открытия счета нотариусу, занимающемуся частной практикой, требуется предоставить документ, удостоверяющий личность, документ о назначении на должность нотариуса от органов юстиции, регистрационные документы, финансовые документы и контактные данные. Нотариус может быть иностранцем, в этом случае дополнительно потребуется документ, подтверждающий право на пребывание/проживание в РФ.","Для открытия счета для нотариуса, занимающегося частной практикой, потребуются следующие документы и сведения:

1. Документ, удостоверяющий личность нотариуса и указанный в соответствующем перечне документов.
2. Документ, подтверждающий наделение нотариуса полномочиями (назначение на должность), выдаваемый органами юстиции субъектов Российской Федерации, в соответствии с законодательством Российской Федерации.
3. Адрес места жительства (регистрации) или места пребывания нотариуса, при условии, что он не совпадает с адресом, указанным в документе, удостоверяющем личность.
4. Контактная информация нотариуса, такая как номер телефона, факс, адрес электронной почты, почтовый адрес.
5. Выписка из ЕГРИП, которая должна содержать актуальные сведения на дату ее предоставления и быть предоставлена в Банк в течение 30 календарных дней с даты выдачи.

Относительно вопроса о том, может ли нотариус быть иностранцем при открытии счета, следует отметить, что в соответствии с законодательством Российской Федерации иностранные граждане имеют право на занятие частной практикой в России. Однако, для открытия банковского счета в банке Tinkoff, иностранный нотариус должен предоставить все необходимые документы и сведения, перечисленные выше, в соответствии с требованиями банка и законодательством РФ. Таким образом, иностранный нотариус может открыть счет в банке Tinkoff, при условии предоставления всех необходимых документов и соблюдения требований банка.",,0.0,0.9999999999,1.0,0.9607606496934044,0.0,0.2886048886284724,0.982037,0.9381467726157116
"Как узнать, кто является бенефициарным владельцем юридического лица? Какие документы для этого нужны?","[""['12. Идентификация бенефициарного(ых) владельца(ев) осуществляется на основании следующий документов и сведений...']""]","Для идентификации бенефициарного владельца юридического лица необходимо предоставить документы, удостоверяющие личность бенефициара, документ о регистрации/пребывании в РФ (если бенефициар - иностранец), ИНН, адрес регистрации и контактные данные. Также можно заполнить анкету бенефициарного владельца по форме Банка.","Для определения бенефициарного владельца юридического лица необходимо предоставить определенные документы и сведения в соответствии с требованиями Банка. Идентификация бенефициарного владельца осуществляется на основании предоставленных документов, включая документы, удостоверяющие личность, и указанные в Перечне документов и сведений, предоставляемых Клиентом для присоединения к условиям Универсального договора.

Для физического лица, которое является иностранным гражданином или лицом без гражданства, необходимо предоставить документ, подтверждающий право на пребывание в Российской Федерации. Кроме того, требуется указать контактную информацию, адрес места жительства или пребывания, идентификационный номер налогоплательщика (при наличии) и другие сведения.

В случае, если возникают сомнения в достоверности предоставленной информации или если бенефициарный владелец является иностранным гражданином или лицом без гражданства, идентификация осуществляется исключительно на основании документов и сведений, указанных в Перечне.

Таким образом, для определения бенефициарного владельца юридического лица необходимо предоставить определенные документы и сведения, указанные в Перечне Банка, чтобы обеспечить соответствие требованиям и процедурам идентификации.",,0.9413798808077791,0.9999999999,1.0,0.9665601698843105,0.0096,0.2628600113125368,0.98799306,0.8030413834226476
Расскажи про термины 'Договор страхования' и 'КАСКО',"[""['1. Термины и определения     \\n                    Договор страхования — договор, по которому одна сторона (Страховщик) обязуется за обусловленную договором \\n                    плату (страховую премию) при наступлении предусмотренного в договоре события (страхового случая) осуществить \\n                    другой стороне (страхователю) или иному лицу, в пользу которого заключен договор (выгодоприобретателю), \\n                    страховое возмещение в пределах определенной договором суммы (страховой суммы).', 'КАСКО — комбинированное страхование транспортных средств и сопутствующих рисков.']""]"," Да, конечно! Договор страхования — это договор, по которому одна сторона (Страховщик) обязуется за обусловленную договором 
                    плату (страховую премию) при наступлении предусмотренного в договоре события (страхового случая) осуществить 
                    другой стороне (страхователю) или иному лицу, в пользу которого заключен договор (выгодоприобретателю), 
                    страховое возмещение в пределах определенной договором суммы (страховой суммы). 
                    КАСКО — это комбинированное страхование транспортных средств и сопутствующих рисков.","Договор страхования и КАСКО — это два важных понятия в сфере страхования, особенно когда речь идет о финансовых операциях с имуществом или транспортными средствами.

Договор страхования представляет собой соглашение между сторонами, где одна из них (Страховщик) обязуется выплатить страховое возмещение другой стороне (Страхователю) или выгодоприобретателю в случае наступления определенного события (страхового случая). Страховщик получает за это страховую премию. Клиентом может быть как юридическое, так и физическое лицо, которое заключило договор страхования.

КАСКО (комплексное автострахование) — это вид страхования транспортного средства, который обеспечивает защиту от различных рисков, таких как угоны, дорожно-транспортные происшествия, повреждения и другие непредвиденные ситуации. Страховая сумма определяется в договоре и является максимальной суммой, которую Страховщик выплатит в случае страхового случая.

Таким образом, договор страхования и КАСКО играют важную роль в обеспечении финансовой безопасности и защите имущества клиентов от различных рисков и непредвиденных обстоятельств. Важно внимательно изучать условия договора и правильно выбирать виды страхования, чтобы быть уверенным в своей защите и безопасности.",1.0,0.875543902755039,0.9999999999,0.25,0.9451805536168296,0.0,0.28993478703565184,0.9923546,0.946219244664217
"Какой минимум страховой выплаты мне вернут, если моя страховая сумма = 50 000 долларов?","[' \n                    2.19.   При добровольном страховании непредвиденных расходов путешественников страховая сумма в договоре \n                    страхования может быть установлена в рублях или иностранной валюте в рублевом эквиваленте по официальному \n                    курсу иностранных валют ЦБ РФ на дату заключения Договора страхования, но не менее чем 66,7 руб. за 1 у.е.  при \n                    страховой сумме 30 000 у.е., 57,2 руб. за 1 у.е. при страховой сумме 35 000 у.е., 50 руб. за 1 у.е. при страховой сумме \n                    50 000 у.е., 26,7 руб. за 1 у.е. при страховой сумме 75 000 у.е.']"," 
                    Минимальная страховая выплата, которую вам вернут, если ваша страховая сумма составляет 50 000 долларов, составляет 50 рублей за 1 доллар США. Минимальная выплата составит 2 500 000 рублей.
                    Обратите внимание, что это минимальная выплата, которую вы получите. Фактическая сумма выплаты может варьироваться в зависимости от условий вашего договора.
        ","Минимальная страховая выплата зависит от условий вашего страхового контракта и конкретных обстоятельств страхового случая. По условиям страхования от банка Tinkoff, страховая сумма составляет 50 000 долларов. Однако, важно учитывать, что страховая выплата не может превышать размер установленной страховой суммы на дату наступления страхового случая. 

В документе условий страхования ""Программа страховой защиты заемщиков Банка 4.0"" указано, что максимальное количество календарных дней, за которые производится страховая выплата, составляет 91 день. Таким образом, при наступлении страхового случая, вам будет выплачена сумма, соответствующая размеру убытков, но не более 50 000 долларов и не более указанного максимального периода выплаты.

Пожалуйста, обратитесь к вашему страховому контракту и ближайшему представителю банка Tinkoff для получения более подробной информации о страховых выплатах и условиях вашего страхования.",0.16666666666666666,0.90750091565798,0.9999999999,0.2,0.9072542007970201,0.0302,0.2909051589339081,0.9862358,0.8844571828660573
"При принятии пользовательских соглашений, кому еще попадают мои данные?","[""['\\n                    5. Персональные данные     \\n                        5.1.       Пользователь подтверждает, что с использованием Дистанционных каналов взаимодействия дает Страховщику, \\n                        аффилированным лицам страховщика, Страховому агенту или Страховому брокеру, а также лицам, \\n                        предоставляющим услуги по использованию их информационных возможностей для целей заключения договоров \\n                        страхования, хранения документов, в том числе, облачных сервисов, серверов, программных продуктов, согласие на \\n                        обработку его персональных данных с целью осуществления дистанционного взаимодействия с последними при \\n                        использовании их Сайта и/или сайтов в сети Интернет или при помощи ПО Страховщика и в целях осуществления \\n                        маркетинговых коммуникаций перечисленных лиц с Пользователем.  \\n        ']""]","
                    Согласно пункту 5.1 пользовательского соглашения, ваши персональные данные могут быть переданы следующим сторонам:
                        • Аффилированные лица страховщика
                        • Страховой агент
                        • Страховой брокер
                        • Лица, предоставляющие услуги по использованию их информационных возможностей для целей заключения договоров страхования, хранения документов, в том числе облачных сервисов, серверов, программных продуктов
","При принятии пользовательских соглашений, ваши данные могут попасть к следующим лицам: 
1. АО «Тинькофф Страхование» - в соответствии с вашим согласием на обработку персональных данных, предоставленным при заключении договора страхования. 
2. Аффилированным лицам Страховщика, Страховому агенту или Страховому брокеру - также с вашим согласием на обработку персональных данных. 
3. Лицам, предоставляющим услуги по использованию информационных возможностей для целей заключения договоров страхования, хранения документов и осуществления маркетинговых коммуникаций - при использовании Дистанционных каналов взаимодействия. 
4. Банку и его аффилированным лицам - при предоставлении информации при заключении договора или в ходе его обслуживания. 

Важно отметить, что все эти лица обязаны соблюдать законы о защите персональных данных и использовать вашу информацию только в соответствии с целями, указанными в пользовательских соглашениях. При отзыве согласия на обработку персональных данных, обработка данных должна быть прекращена, а данные уничтожены в установленные сроки. 

Таким образом, ваша конфиденциальность и безопасность данных являются приоритетом для банка Tinkoff, и все действия с вашей информацией осуществляются в соответствии с законодательством и условиями пользовательских соглашений.",1.0,0.9297692699109187,0.9999999999,0.25,0.9106159640884276,0.017,0.12499896433629962,0.9850237,0.9114572577694857
Зачем страховщик ведет аудио и видеозапись при взаимодействии с клиентом? Как долго эти записи хранятся?,"[""['При заключении Договоров страхования, а также при ином обращении Клиента или Пользователя к Страховщику или его представителям Страховщик вправе осуществлять наблюдение, фотографирование, аудио- и видеозапись, включая запись телефонных разговоров, а также копирование и хранение переписок между Пользователем и Страховщиком (его представителями) по электронной почте или в мессенджерах, без дополнительного уведомления Клиента (Пользователя) о такой записи. Клиент соглашается, что Страховщик вправе хранить такие записи в течение 5 (пяти) лет с момента прекращения отношений с Клиентом (Пользователем), с целью улучшения качества обслуживания, исполнения Договора страхования, а также использовать их при проведении любых расследований в связи с Договором страхования.']""]","Страховщик ведет аудио, видеозапись, фотографирование, копирует переписку с клиентом без дополнительного уведомления с целью улучшения качества обслуживания, исполнения договора страхования, а также для использования этих записей при проведении расследований, связанных с договором. Такие записи страховщик вправе хранить в течение 5 лет с момента прекращения отношений с клиентом.","Страховщик ведет аудио и видеозапись при взаимодействии с клиентом с целью обеспечения безопасности обеих сторон, зафиксировать все детали обсуждений и предоставленной информации, а также для использования в случае необходимости при расследовании споров или разбирательствах. Эти записи хранятся в течение 5 лет с момента прекращения отношений с клиентом в соответствии с законодательством и правилами банка. Хранение записей в течение указанного срока позволяет банку обеспечить качественное обслуживание клиентов, исполнение договоров страхования, а также использовать записи при проведении любых расследований, связанных с договором страхования. Таким образом, аудио и видеозаписи играют важную роль в улучшении качества обслуживания клиентов и обеспечении безопасности операций между страховщиком и клиентом.",1.0,0.9590630707953512,0.9999999999,1.0,0.9598825041462267,0.0966,0.39238497293937524,0.9928312,0.9734458649368308
В каких случаях застрахованному могут быть оплачены планируемые расходы по страховому случаю до предоставления подтверждающих документов? Какие ограничения есть по размеру таких выплат?,"[""['По договорам добровольного страхования непредвиденных расходов путешественников по предварительному согласованию со Страховщиком Застрахованному могут оплачиваться планируемые расходы по предусмотренным договором страхования страховым событиям, предусматривающим возмещение расходов на оказание Экстренной или Неотложной амбулаторной и/или стационарной помощи, с условием предоставления Застрахованным документов, подтверждающих такие расходы Страховщику непосредственно после их несения (чеки, платежные документы и пр.). В случае если в результате страхового случая Застрахованным лицом были понесены соответствующие расходы на оказание Экстренной или Неотложной амбулаторной и/или стационарной помощи, в том числе, предварительно согласованные Страховщиком, но не были предоставлены документы, подтверждающие их оплату, Страховщик возмещает расходы в размере не более 200 у.е. (если страховая сумма установлена в валюте, отличной от российского рубля) или 10 000 российских рублей (если страховая сумма установлена в российских рублях), за один страховой случай.']""]","По договорам добровольного страхования непредвиденных расходов путешественников застрахованному могут быть оплачены планируемые расходы по страховым случаям, предусматривающим возмещение расходов на экстренную/неотложную амбулаторную или стационарную помощь, по предварительному согласованию со страховщиком. Условие - предоставление подтверждающих документов сразу после несения расходов. Если документы не предоставлены, то страховщик возмещает расходы в размере не более 200 у.е. (если страховая сумма в валюте) или 10 000 рублей (если в рублях) за один случай.","В соответствии с условиями пользовательского соглашения АО «Тинькофф Страхование», застрахованному лицу могут быть оплачены планируемые расходы по страховому случаю до предоставления подтверждающих документов в случае, если были понесены расходы на оказание Экстренной или Неотложной амбулаторной и/или стационарной помощи, в том числе, предварительно согласованные со страховщиком. Однако, важно отметить, что такие выплаты ограничены размером до 200 у.е. (если страховая сумма установлена в валюте, отличной от российского рубля) или 10 000 российских рублей (если страховая сумма установлена в российских рублях) за один страховой случай.

Таким образом, если застрахованное лицо понесло расходы на медицинскую помощь в результате страхового случая и не может предоставить документы, подтверждающие оплату, то страховщик может возместить эти расходы, но с учетом указанных ограничений по размеру выплаты. Следовательно, важно оформить все необходимые документы и своевременно предоставить их страховщику для получения полной страховой выплаты в соответствии с условиями договора страхования.",1.0,0.8617571526874593,0.9999999999,1.0,0.9569046580332086,0.0682,0.34221841468467806,0.99414414,0.9723862958306287
Куда пользователь может направить обращение при возникновении вопросов или спора со страховщиком?,"[""['При возникновении вопросов или спора можно отправить обращение:\\n\\nв АО «Тинькофф Страхование» по почте по адресу: 127287, Российская Федерация, г. Москва, ул. 2-я Хуторская, дом 38А, строение 26, либо путем заполнения соответствующей формы на сайте Страховщика;\\nк финансовому уполномоченному путем регистрации обращения на сайте — finombudsman.ru или по почтовому адресу: 119017, г. Москва, Старомонетный пер., дом 3;\\nво Всероссийский союз страховщиков на сайте — ins-union.ru, приложив к обращению необходимые документы и сведения, либо на почтовый адрес: 115093, г. Москва, ул. Люсиновская, д. 27, стр. 3;\\nв Центральный Банк Российской Федерации (Банк России) через интернет-приемную на официальном сайте — cbr.ru, приложив к обращению необходимые документы и сведения, либо на почтовый адрес: 107016, г. Москва, ул. Неглинная, д. 12.']""]","При возникновении вопросов или спора с АО 'Тинькофф Страхование' пользователь может направить обращение:

 - В АО 'Тинькофф Страхование' по почте или через форму на сайте;
 - Финансовому уполномоченному на сайте finombudsman.ru или почтовым адресом;
 - Во Всероссийский союз страховщиков на сайте ins-union.ru или почтовым адресом;
В Центральный Банк РФ через интернет-приемную на сайте cbr.ru или почтовым адресом.","При возникновении вопросов или споров со страховщиком пользователь может направить обращение в соответствии с пунктом 4.3 настоящего Пользовательского соглашения. В соответствии с действующим законодательством Российской Федерации, все споры и разногласия, которые могут возникнуть между Пользователем и Страховщиком в связи с использованием Дистанционных каналов взаимодействия, подлежат рассмотрению в судебном порядке.

Пользователь имеет право обратиться в суд для разрешения спора, если не смог достигнуть согласия со страховщиком непосредственно. Суд будет рассматривать вопросы и споры в соответствии с действующим законодательством Российской Федерации, и примет во внимание все аргументы и доказательства, представленные сторонами.

Таким образом, при возникновении вопросов или споров со страховщиком, пользователь может обратиться в судебный орган для разрешения конфликта согласно законодательству Российской Федерации.",1.0,0.9624264658409288,0.9999999999,0.08333333333333333,0.8863734432607275,0.0245,0.09964716827723268,0.98145914,0.8390129271573915
Где можно ознакомиться с дополнительной информацией и документами о деятельности АО 'Тинькофф Страхование'?,"[""['Дополнительная информация и документы о деятельности Страховщика в соответствии с п. 6.1 Закона РФ от 27.11.1992 N 4015-1 «Об организации страхового дела в Российской Федерации» и п. 2.1.1. «Базового стандарта защиты прав и интересов физических и юридических лиц — получателей финансовых услуг, оказываемых членами саморегулируемых организаций, объединяющих страховые организации» размещены по ссылкам: tinkoffinsurance.ru/about, tinkoffinsurance.ru/about/documents.']""]",Дополнительная информация и документы о деятельности АО 'Тинькофф Страхование' в соответствии с законом 'Об организации страхового дела в РФ' и базовым стандартом защиты прав получателей финансовых услуг размещены на сайте страховщика по ссылкам tinkoffinsurance.ru/about и tinkoffinsurance.ru/about/documents.,"Дополнительная информация и документы о деятельности АО ""Тинькофф Страхование"" могут быть найдены на официальном сайте компании по следующим ссылкам: tinkoﬃnsurance.ru/about и tinkoﬃnsurance.ru/about/documents. Там вы сможете ознакомиться с информацией о деятельности страховщика в соответствии с законодательством Российской Федерации, включая Закон от 27.11.1992 N 4015-1 ""Об организации страхового дела в Российской Федерации"". 

Кроме того, если у вас возникли вопросы или споры, вы можете обратиться напрямую в АО ""Тинькофф Страхование"" по почтовому адресу: 127287, Российская Федерация, г. Москва, ул. 2-я Хуторская, дом 38А, строение 26, либо заполнить соответствующую форму на сайте компании. Также возможно обратиться к финансовому уполномоченному через интернет или по почте, лиро в организации такие как Всероссийский союз страховщиков или Центральный Банк Российской Федерации (Банк России).

Официальный сайт Центрального Банка Российской Федерации (Банка России) также предоставляет возможность обращения через интернет-приемную или по почтовому адресу. По всем вопросам контроля и надзора за страховой деятельностью страховых организаций следует обращаться к Центральному Банку Российской Федерации (Банку России).

Таким образом, для получения дополнительной информации и документов о деятельности АО ""Тинькофф Страхование"" следует обращаться по указанным выше ссылкам и контактам.",1.0,0.991227345765786,0.9999999999,1.0,0.9573063401206604,0.0063,0.25796757371860485,0.9794639,0.9328052578951619
Что означает 'Партия' и вообще 'Слиток' для драгоценных металлов?,"[""['\\n                    Партия — приобретенные Клиентом Слитки в количестве, превышающем 1 (одну) штуку, и подлежащие доставке Клиенту, \\n                    в рамках одной Заявки', ' Слиток — аффинированный драгоценный металл: золото, серебро, платина и палладий в виде слитков (стандартных, \\n                    мерных), соответствующих установленным в Российской Федерации стандартам или международным стандартам качества, \\n                    изготовленных и маркированных организацией, осуществляющей аффинаж драгоценного металла. Слиток в рамках \\n                    предоставления Сервиса доставляется / принимается на хранение в ненарушенной Упаковке с приложением Сертификата-\\n                    ярлыка (при наличии) и Сертификата качества слитка']""]","Давайте разберемся! 
                    Партия — это приобретенные клиентом слитки в количестве, превышающем 1 штуку, и подлежащие доставке клиенту, в рамках одной заявки.
                    Слиток — это аффинированный драгоценный металл: золото, серебро, платина и палладий в виде слитков (стандартных, 
                    мерных), соответствующих установленным в Российской Федерации стандартам или международным стандартам качества, 
                    изготовленных и маркированных организацией, осуществляющей аффинаж драгоценного металла. Слиток в рамках 
                    предоставления Сервиса доставляется / принимается на хранение в ненарушенной Упаковке с приложением Сертификата-
                    ярлыка (при наличии) и Сертификата качества слитка.
        ","По документу ""Правила оказания сервиса «Покупка/продажа слитков драгоценных металлов»"" компании Тинькофф Банк, термин ""Партия"" определяется как приобретенные Клиентом Слитки в количестве, превышающем 1 (одну) штуку, и подлежащие доставке Клиенту в рамках одной Заявки. То есть, это группа слитков, которая приобретается и доставляется одновременно в рамках одной сделки.

Что касается термина ""Слиток"", он определяется как аффинированный драгоценный металл в виде стандартных или мерных слитков (золото, серебро, платина и палладий), соответствующих установленным в Российской Федерации стандартам или международным стандартам качества. Слиток изготавливается и маркируется организацией, занимающейся аффинажем драгоценного металла. В рамках предоставления сервиса Слиток доставляется или принимается на хранение в ненарушенной упаковке с приложением Сертификата-ярлыка и Сертификата качества слитка.

Таким образом, в контексте драгоценных металлов ""Партия"" представляет собой группу слитков, а ""Слиток"" - это сам драгоценный металл, который может быть приобретен, доставлен и хранен с соблюдением всех установленных стандартов и требований качества.",1.0,0.8732283910397701,0.9999999999,1.0,0.9368956139786679,0.1403,0.599508993337922,0.99508345,0.9733249895267764
Меня действительно должны фотографировать после полкчения слитка? Какой это пункт в соглашении?,"[""['\\n                    2.13.12. После подтверждения получения Клиентом/Доверенным лицом Слитка Представитель фотографирует Клиента/\\n                    Доверенное лицо с полученным Слитком в ненарушенной заводской упаковке и документом, удостоверяющим личность \\n                    Клиента/Доверенного лица']""]","Да, Вас действительно должнен сфотографировать Представитель в соответсвии с пунктом 2.13.12.","Да, в соответствии с пунктом 2.13.12 Правил оказания сервиса «Покупка/продажа слитков драгоценных металлов», после подтверждения получения клиентом или его доверенным лицом слитка, представитель банка фотографирует клиента или доверенное лицо с полученным слитком в ненарушенной заводской упаковке и документом, удостоверяющим личность клиента или доверенного лица. Это необходимо для обеспечения доказательств получения слитка в ненарушенном состоянии и может быть использовано в качестве доказательства в случае возникновения претензий или споров. Таким образом, фотографирование является частью процедуры приема-передачи слитка и помогает обеспечить прозрачность и безопасность операций по покупке или продаже драгоценных металлов через указанный сервис банка Tinkoff.",1.0,0.7728710918980529,0.9999999999,1.0,0.8425971217512245,0.0,0.08471900137277766,0.9574264,0.6170210775640744
Какие условия хранения?,"[""[' \\n                    2.14.9. Условия хранения: температура воздуха от +17 до +25 °С, атмосферное давление от 740 до 760 мм рт. ст., относительная \\n                    влажность воздуха от 30 до 60%']""]","
                    В соответсвии с пунктом 2.14.9. условия хранения слитка слудующие: 
                        - температура воздуха от +17 до +25 °С,
                        - атмосферное давление от 740 до 760 мм рт. ст.,
                        - относительная влажность воздуха от 30 до 60% ","Условия хранения слитка в банке Tinkoff предусматривают, что хранение осуществляется с момента подписания Акта приема-передачи до востребования. Слитки клиента хранятся в хранилище 5 класса устойчивости к взлому, оборудованном системой видеонаблюдения и охранно-пожарной и тревожной сигнализации. Физическая круглосуточная специализированная охрана хранилища также обеспечивает безопасность хранения слитков.

Условия хранения предусматривают определенные параметры, такие как температура воздуха от +17 до +25 °C, атмосферное давление от 740 до 760 мм рт. ст., и относительная влажность воздуха от 30 до 60%. Банк имеет право изменить условия и место хранения слитка с письменного согласия клиента, а также при необходимости для предотвращения опасности порчи или гибели слитка в случае обстоятельств непреодолимой силы, таких как пожар или наводнение.

Банк принимает на себя ответственность за хранение слитков с момента подписания Акта приема-передачи и обязуется вернуть их клиенту в сохранности. Срок хранения слитка устанавливается с даты подписания Акта и продолжается до момента, когда клиент пожелает вернуть слиток. Доставка слитка клиенту осуществляется в пределах города Москвы до указанного адреса в Заявке, а в другие регионы согласовывается с банком через Дистанционное обслуживание.

Таким образом, условия хранения слитков в банке Tinkoff обеспечивают их безопасность и сохранность, а также предусматривают возможность изменения условий хранения при необходимости.",,0.8853620493328277,0.9999999999,0.75,0.8698438856945012,0.0058,0.38324279539395956,0.9663729,0.879858889339305
Что такое 'Сертификат качества слитка'?,"[""['Сертификат качества слитка — документ о качестве драгоценного металла, содержащий сведения о соответствии драгоценного металла стандартам качества, технические характеристики и параметры Слитка, информацию о химическом составе, произведенный/заверенный предприятием-изготовителем Слитка.']""]","Сертификат качества слитка - это документ, выданный изготовителем слитка драгоценного металла, который содержит информацию о соответствии металла стандартам качества, его технические характеристики, параметры и химический состав.","Сертификат качества слитка - это документ, который содержит основные сведения о слитке драгоценного металла. В нем указывается номер (шифр) слитка, соответствие драгоценного металла стандартам качества, легировочная масса, проба драгоценного металла, дата выпуска, а также информация о химическом составе и технические характеристики слитка. Этот документ является подтверждением качества драгоценного металла и его соответствия установленным стандартам. Сертификат качества слитка выдается предприятием-изготовителем слитка и является важным элементом при совершении сделок с драгоценными металлами.

Клиент при получении слитка обязан проверить наличие сертификата качества и удостовериться в его подлинности. В случае обнаружения каких-либо несоответствий или повреждений слитка, указанных в сертификате, клиент имеет право оформить рекламационный акт, в котором фиксируются все выявленные проблемы. Данное действие позволяет защитить интересы клиента и обеспечить прозрачность сделок с драгоценными металлами.

Банк Tinkoff стремится обеспечить высокое качество предоставляемых услуг связанных с покупкой и продажей слитков драгоценных металлов. В этом контексте сертификат качества слитка играет важную роль, гарантируя клиентам надежность и безопасность сделок. Надеемся, что данная информация была полезной и понятной. Если у вас возникнут дополнительные вопросы, не стесняйтесь обращаться к нам.",0.8888888888888888,0.9341136297910445,0.9999999999,1.0,0.9659605872481705,0.0011,0.45473325043243323,0.9889618,0.9029997833184588
На какой срок выдается эта доверенность? Можно ли ее передоверить другому лицу?,"[""['Датой выдачи доверенности считается дата предоставления Представляемым Банку данных своего представителя. Доверенность выдана сроком на 1 (один) год, полномочия по настоящей доверенности не могут быть передоверены другим лицам.']""]",Доверенность выдается сроком на 1 год. Полномочия по этой доверенности нельзя передоверять другим лицам.,"Доверенность выдается сроком на 1 (один) год с момента предоставления данных представителя Банку. Важно отметить, что полномочия по данной доверенности не могут быть передоверены другим лицам. Это означает, что лицо, которому выдана доверенность, не имеет права передать свои полномочия третьему лицу.

Этот запрет на передоверие полномочий важен для обеспечения безопасности и защиты интересов всех сторон, включая Банк и клиента. Предоставление доверенности на определенный срок и с ограничением на передоверие помогает избежать возможных злоупотреблений и несанкционированных действий.

Поэтому, если у вас возникли вопросы или необходимость передачи полномочий другому лицу, рекомендуется связаться с Банком для получения консультации и информации о возможных действиях в вашей конкретной ситуации. Всегда лучше быть в курсе всех правил и условий, чтобы избежать недоразумений и обеспечить соблюдение всех требований.",1.0,0.9513023556729395,0.9999999999,1.0,0.9237080022169587,0.0002,0.24903439915046435,0.9571502,0.8018027126540098
"Как клиент может получить сертификат качества слитка, который он передал на хранение в банк?","[""['По требованию Клиента Банк предоставляет Клиенту заверенную Банком копию Сертификата качества слитка, переданного на ответственное хранение.']""]","По требованию клиента банк предоставляет ему заверенную копию сертификата качества слитка, который клиент передал на ответственное хранение в банке.","Для того чтобы клиент мог получить сертификат качества слитка, который он передал на хранение в банк Tinkoff, необходимо следовать определенной процедуре, описанной в правилах оказания сервиса «Покупка/продажа слитков драгоценных металлов» банка.

Согласно этим правилам, при передаче слитка на ответственное хранение в банк клиент должен убедиться, что слиток находится в ненарушенной упаковке и сопровождается сертификатом-ярлыком, а также сертификатом качества слитка. По требованию клиента банк обязуется предоставить заверенную копию сертификата качества слитка, который был передан на ответственное хранение.

Факт приема-передачи слитка на ответственное хранение подтверждается актом приема-передачи, который подписывается обеими сторонами - клиентом и банком. Банк обязуется хранить слиток в сохранности и возвратить клиенту или его доверенному лицу в том же состоянии, в котором он был принят на хранение, вместе с сертификатом качества слитка.

Срок хранения слитка устанавливается с даты подписания акта приема-передачи и зависит от условий, установленных банком и действующим законодательством Российской Федерации.

Таким образом, чтобы получить сертификат качества слитка, переданного на хранение в банк Tinkoff, клиент должен обратиться к банку с запросом на предоставление копии сертификата, который будет заверен банком в соответствии с законодательством.",1.0,0.9514788100623445,0.9999999999,1.0,0.9385577007385008,0.0002,0.45873808551484163,0.97744966,0.8684910417575668
Какие условия хранения слитков в банке? Где их хранят?,"[""['Хранение Банком Слитка Клиента осуществляется в хранилище 5 (Пятого) класса устойчивости к взлому, оборудованном системой видеонаблюдения и охранно-пожарной и тревожной сигнализации с выводом сигнала на пункт централизованной охраны, с осуществлением физической круглосуточной специализированной охраны хранилища.', 'Условия хранения: температура воздуха от +17 до +25 °С, атмосферное давление от 740 до 760 мм рт. ст., относительная влажность воздуха от 30 до 60%.']""]","Слитки хранятся в специальном хранилище 5 класса устойчивости к взлому, оборудованном системами видеонаблюдения, охранно-пожарной и тревожной сигнализацией, а также круглосуточной охраной. Условия хранения: температура +17...+25°С, атмосферное давление 740-760 мм рт.ст., влажность 30-60%.","Условия хранения слитков в банке Тинькофф являются очень строгими и надежными, чтобы обеспечить безопасность и сохранность ценных металлов для клиентов. Согласно правилам оказания сервиса ""Покупка/продажа слитков драгоценных металлов"", слитки клиентов хранятся в хранилище 5 класса устойчивости к взлому. Это хранилище оборудовано системой видеонаблюдения, охранно-пожарной и тревожной сигнализации, а также имеет круглосуточную специализированную физическую охрану.

Температурные условия хранения слитков в банке Тинькофф предполагают поддержание температуры воздуха от +17 до +25 °C, атмосферного давления от 740 до 760 мм рт. ст. и относительной влажности воздуха от 30 до 60%. Эти параметры контролируются и поддерживаются для обеспечения оптимальных условий хранения.

Банк имеет право изменить условия и место хранения слитков с письменного согласия клиента, включая изменение условий хранения посредством дистанционного обслуживания. В случае опасности порчи или гибели слитка, банк также вправе изменить условия и место их хранения без письменного уведомления клиента, если возникли обстоятельства непреодолимой силы, такие как пожар или наводнение.

Таким образом, слитки клиентов хранятся в специализированном хранилище с соблюдением строгих температурных и безопасностных условий, что обеспечивает надежную защиту и сохранность ценных металлов.",1.0,0.9431275499180668,0.9999999999,1.0,0.9226329146739745,0.0029,0.2540890494612825,0.9838603,0.9398694260887241
"Можно ли вернуть слиток в банк, если при получении были обнаружены его повреждения? Как это сделать?","[""['В случае обнаружения при приеме Слитка с ответственного хранения от Представителя нарушения целостности заводской упаковки Слитка, несоответствия нанесенной на Слиток маркировки данным, указанным в Сертификате качества слитка и/или Сертификате-ярлыке, отсутствия либо повреждения Сертификата качества слитка и/или Слитка (наличие на поверхности Слитка наплывов / заусенцев / царапин / жировых пятен / посторонних включений) Клиентом/Доверенным лицом и Представителем оформляется в двух экземплярах Рекламационный акт по форме Приложения № 3 к настоящим Правилам, в котором фиксируются указанные выше нарушения / несоответствия / повреждения. В случае наличия указанных выше нарушений / несоответствий / повреждений Слиток вместе с Сертификатом качества слитка и Сертификатом-ярлыком вкладываются Клиентом/Доверенным лицом в порожний сейф-пакет и запечатываются, после чего сейф-пакет помещается в Устройство для перевозки слитка с дальнейшим опломбированием номерной разовой пломбой. Номер сейф-пакета, а также номерной разовой пломбы отражаются в Рекламационном акте.']""]","Да, если при получении слитка с хранения были обнаружены его повреждения или нарушения упаковки, несоответствия маркировки и т.п., то клиент/доверенное лицо вместе с представителем банка оформляют рекламационный акт в двух экземплярах. В этом акте фиксируются все нарушения. После этого слиток вместе с сертификатами запечатывают в новый сейф-пакет и опломбировывают, указав номера на рекламационном акте. Затем слиток возвращается обратно в банк.","Если при получении слитка были обнаружены повреждения, то вам следует оформить рекламационный акт в соответствии с правилами оказания сервиса «Покупка/продажа слитков драгоценных металлов» банка Tinkoff. В этом акте необходимо указать все выявленные нарушения, несоответствия или повреждения. После оформления акта, он будет передан в банк для рассмотрения.

Банк обязан рассмотреть рекламационный акт в течение 5 рабочих дней с даты его оформления. По результатам рассмотрения банк свяжется с вами и предоставит новый слиток или вернет старый, если нарушения не были подтверждены. Это произойдет в течение 5 рабочих дней с даты рассмотрения рекламационного акта.

Важно помнить, что в случае повреждения слитка, заводской упаковки или документов в результате неосторожных действий клиента, банк не несет ответственности и не принимает претензии к качеству слитка. Поэтому важно тщательно следить за процессом приема и вскрытия сейф-пакета, чтобы избежать повреждений.

Таким образом, для возврата поврежденного слитка в банк необходимо оформить рекламационный акт, дождаться его рассмотрения и получить новый слиток или вернуть старый в соответствии с результатами проверки банка.",0.8571428571428571,0.902255494638856,0.9999999999,1.0,0.9302058282251024,0.0,0.2835072000666189,0.99190986,0.9586510800625244
Кто может стать доверенным лицом?,"[""['Доверенное лицо — физическое лицо, уполномоченное Клиентом, которому предоставлено право на представление интересов Клиента и осуществление действий от его имени в рамках Сервиса на основании доверенности, оформленной посредством Дистанционного обслуживания в соответствии с п. 5.3 настоящих Правил по форме Приложения № 5 к настоящим Правилам.']""]","Доверенным лицом клиента может стать любое физическое лицо, которому клиент предоставит полномочия представлять его интересы в рамках сервиса покупки/продажи слитков драгоценных металлов. Доверенность на это лицо оформляется клиентом посредством дистанционного обслуживания в банке по форме из Приложения №5 к Правилам.","Доверенным лицом может стать лицо, которое имеет на то полномочия от Клиента и предоставляет соответствующие документы, подтверждающие его право действовать от имени Клиента. В соответствии с установленным Перечнем документов и сведений, предоставляемых Клиентом для присоединения к условиям Универсального договора, доверенность или иной документ, удостоверяющий полномочия и признаваемый таковым, является основанием для идентификации представителя Клиента. 

Для идентификации представителей физических лиц необходимо предоставить документы и сведения, указанные в соответствующем Перечне, а также документ, подтверждающий право иностранного гражданина или лица без гражданства на распоряжение денежными средствами на банковском счете. 

Кроме того, в случае если бенефициарный владелец является иностранным гражданином или лицом без гражданства, и в отношении полученных сведений возникают сомнения в их достоверности, идентификация осуществляется исключительно на основании установленных документов и сведений.

Таким образом, доверенным лицом может быть лицо, имеющее соответствующие полномочия от Клиента и предоставляющее необходимые документы для идентификации в соответствии с установленными требованиями.",1.0,0.9709610204748084,0.9999999999,1.0,0.9074096573700752,0.0,0.16751343708567368,0.9846064,0.8735848835963999
Можно ли поменять доверенное лицо? Как это сделать?,"[""['Клиент может отменить выданную доверенность путем обращения в Банк посредством Дистанционного обслуживания в любое время, но не позднее одного дня до планируемой даты встречи с представителем Клиента.']""]","Да, клиент может отменить ранее выданную доверенность на доверенное лицо. Для этого он должен обратиться в банк посредством дистанционного обслуживания не позднее чем за 1 день до планируемой даты встречи с действующим доверенным лицом.","Да, возможно изменить доверенное лицо. Для этого необходимо обратиться в Банк посредством Дистанционного обслуживания. Клиент должен предоставить данные нового доверенного лица, такие как фамилия, имя, отчество, дата рождения, серия и номер паспорта, а также информацию о том, кем и когда был выдан паспорт. После предоставления необходимых данных и подтверждения личности нового доверенного лица, изменения будут внесены в систему Банка.

Важно отметить, что клиент может отменить доверенность в любое время, но не позднее чем за один день до запланированной встречи с представителем Банка. Это действие также следует совершать через Дистанционное обслуживание.

При изменении доверенного лица, Банк будет обрабатывать персональные данные нового доверенного лица в соответствии с законодательством Российской Федерации о персональных данных. Это позволит Банку осуществлять свои функции и обязанности в соответствии с условиями предоставляемых услуг и внутренними правилами.

Таким образом, клиент имеет возможность сменить доверенное лицо, следуя установленной процедуре через Дистанционное обслуживание и предоставляя необходимую информацию о новом доверенном лице.",1.0,0.930369890797528,0.9999999999,0.0,0.9244436136457855,0.007,0.23042083589377738,0.98479235,0.9365285856380665
Как происходит покупка слитка банком? Есть ли какие-то особые условия?,"[""['Банк приобретает у Клиента только Слитки, находящиеся на ответственном хранении в Банке.', 'Клиент, обращаясь с Заявкой, подтверждает, что на момент заключения договора купли-продажи Слиток принадлежит на праве собственности Клиенту, не продан, не является предметом залога, не обременен правами третьих лиц, в споре, под арестом и иным запрещением не состоит.']""]","Банк осуществляет покупку слитков драгоценных металлов только у тех клиентов, чьи слитки находятся на ответственном хранении в самом банке. При подаче заявки на продажу слитка клиент должен подтвердить, что на момент продажи слиток принадлежит ему на праве собственности, не продан, не заложен, не арестован и не обременен правами третьих лиц.","При покупке слитка банком, процесс осуществляется в соответствии с установленными правилами и законодательством Российской Федерации. Клиент подает заявку на совершение сделки купли-продажи слитка через дистанционное обслуживание в определенное рабочее время. После согласования условий с банком, клиенту направляется ключ простой электронной подписи для подтверждения сделки.

Важно отметить, что банк приобретает только те слитки, которые находятся на ответственном хранении в банке. Клиент должен удостовериться, что слиток, который он желает продать, принадлежит ему на праве собственности и не обременен никакими обязательствами перед третьими лицами.

После согласования условий и передачи слитка на ответственное хранение в банк, производится контрольное взвешивание, проверка целостности упаковки и соответствие маркировки указанным данным. После подписания акта приема-передачи слитка, банк списывает согласованную стоимость слитка и плату за сервис с картсчета клиента.

Таким образом, покупка слитка банком осуществляется в строгом соответствии с законодательством и установленными правилами банка, гарантируя безопасность и прозрачность сделки для всех сторон.",0.75,0.9469724092919988,0.9999999999,1.0,0.935462291885076,0.0242,0.2713462215151916,0.987103,0.9294621143778787
Что такое накопительный счет и как начисляются проценты?,"[""['\\n                    3.1. Начисление процентов на остаток средств по Счету вклада/Накопительному счету производится со дня, следующего \\n                    за днем зачисления денежных средств на Счет вклада/Накопительный счет Клиента, до дня окончания срока Вклада \\n                    (включительно) либо до их списания со Счета вклада/Накопительного счета по иным основаниям.', ' \\n                    3.3. Клиент имеет возможность по согласованию с Банком посредством Дистанционного обслуживания изменить Тарифный \\n                    план Вклада на Тарифный план для мультивалютного Вклада. При смене Тарифного плана изменения в части процентной \\n                    ставки по Счету вклада, изначально открытого в рамках текущего Договора вклада, не распространяются до конца срока \\n                    размещения, установленного предыдущим Тарифным планом. Процентные ставки по валютам, отличным от валюты \\n                    измененного Тарифного плана, устанавливаются новым Тарифным планом.\\n                    3.4. При начислении процентов в расчет принимается величина процентной ставки (в процентах годовых) и фактическое \\n                    количество календарных дней, на которое привлечены денежные средства. При этом за базу берется действительное \\n                    число календарных дней в году (365 или 366 дней соответственно).\\n                    ', ' \\n                    Накопительный счет — счет, на котором учитываются денежные средства Клиента, предусматривающий начисление \\n                    процентов на остаток денежных средств, в соответствии с Договором накопительного счета.']""]","
                    Накопительный счет - это счет, на котором учитываются денежные средства клиента и на который начисляются проценты на остаток денежных средств. Проценты начисляются в соответствии с условиями договора накопительного счета.
                    Проценты на накопительном счете начисляются со дня, следующего за днем зачисления денежных средств на счет, до дня окончания срока вклада (включительно) либо до их списания со счета по другим основаниям.

                    При начислении процентов учитываются:
                    • Величина процентной ставки (в процентах годовых)
                    • Фактическое количество календарных дней, на которое привлечены денежные средства

                    За базу берется действительное число календарных дней в году (365 или 366 дней соответственно).","Накопительный счет - это счет, на котором учитываются денежные средства Клиента, предусматривающий начисление процентов на остаток денежных средств, в соответствии с Договором накопительного счета. Проценты начисляются на остаток средств по счету начиная со дня, следующего за днем зачисления денежных средств на счет, и до дня окончания срока вклада или до их списания со счета по иным основаниям.

Изменение процентных ставок по накопительному счету может производиться путем информирования Клиента не позднее дня, предшествующего дню изменений. Клиент также имеет возможность по согласованию с Банком изменить тарифный план вклада на тарифный план для мультивалютного счета.

Банк не заключает договор накопительного счета с лицами, не достигшими 14 лет. Договор накопительного счета заключается путем акцепта Банком оферты, содержащейся в заявке Клиента, и считается заключенным в дату зачисления денежных средств на счет.

Таким образом, накопительный счет предоставляет возможность клиенту увеличивать свои средства за счет начисления процентов на остаток денежных средств согласно условиям договора, а изменение тарифных планов и процентных ставок может осуществляться с уведомлением клиента и его согласия.",0.8571428571428571,0.9293144419627949,0.9999999999,0.3333333333333333,0.9466813304323607,0.1607,0.5090552388373639,0.9967347,0.9493869290974702
Можно ли открыть вклад в 12 лет?,"[""['1.2. Банк не заключает Договор вклада (Договор накопительного счета) с лицами, не достигшими возраста 14 лет']""]","Нет, Банк не заключает договор вклада с лицами, не достигшими возраста 14 лет.","Согласно общим условиям открытия банковских вкладов в банке Tinkoff, лица, не достигшие возраста 14 лет, не имеют права заключать договор вклада или накопительного счета. Это означает, что открыть вклад в 12 лет в банке Tinkoff невозможно. Договор вклада заключается путем акцепта Банком оферты, содержащейся в заявке клиента, и предполагает зачисление денежных средств на счет вклада. Поэтому, исходя из представленного контекста, банк не предоставляет возможности открыть вклад лицам моложе 14 лет.

Если у вас возникли дополнительные вопросы или вам необходима более подробная информация, пожалуйста, обратитесь в контактный центр банка Tinkoff для получения консультации у специалистов.",0.6,0.8807336368981135,0.9999999999,1.0,0.895472545533567,0.0,0.29720455750023567,0.92884344,0.8744284793013348
Могу ли я открыть несколько вкладов и пополнять их?,"[""['\\n                    4.1. Клиент имеет право:\\n                    4.1.1. Предъявить Банку требование о досрочном полном или частичном изъятии Вклада.\\n                    4.1.2. Вносить дополнительные денежные средства во Вклад/Накопительный счет, если данная возможность установлена \\n                    Тарифным планом.\\n                    4.1.3. Разместить несколько Вкладов (открыть несколько Счетов вклада/Накопительных счетов на условиях, устанавливаемых \\n                    Договором вклада (Договором накопительного счета), Тарифами:\\n                    • через Дистанционное обслуживание;\\n                    • в офисе Банка в часы работы операционного подразделения Банка.\\n']""]"," 
                    Да, вы можете открыть несколько вкладов и пополнять их.
                    Согласно пункту 4.1.3 приведенного контекста, клиент имеет право разместить несколько вкладов (открыть несколько счетов вклада/накопительных счетов) на условиях, устанавливаемых договором вклада (договором накопительного счета) и тарифами.
                    Вы можете открыть несколько вкладов как через дистанционное обслуживание, так и в офисе банка в часы работы операционного подразделения банка.","Да, согласно условиям пользовательского соглашения для банка Tinkoff, вы имеете право разместить несколько вкладов и пополнять их. Вам предоставляется возможность открыть несколько счетов вклада на условиях, установленных Договором вклада, через дистанционное обслуживание или в офисе банка в часы работы операционного подразделения. Кроме того, если данная возможность предусмотрена тарифным планом, вы можете вносить дополнительные денежные средства на свои вклады. Важно помнить, что при пополнении или пролонгации вкладов необходимо соблюдать условия, установленные банком, и быть в курсе минимальных сумм вклада, чтобы избежать возможных ограничений. Таким образом, вы можете спокойно открывать несколько вкладов и управлять ими согласно вашим потребностям и финансовым целям.",1.0,0.8068119535407177,0.9999999999,0.375,0.9332099927592832,0.1181,0.4901890855720889,0.9936827,0.9625055715536217
Для получения страховой выплаты в случае несчастного случая с летальным исходом нужна ли справка из психушки?,"[""['\\n                    6.1. По риску Смерть в результате Несчастного случая должны быть предоставлены следующие документы:\\n                    j. Справка из психоневрологического диспансера и наркологического диспансера']""]","Да, в таком случае необходимы справки из психоневрологического диспансера и наркологического диспансера.","Для получения страховой выплаты в случае несчастного случая с летальным исходом вам не потребуется предоставлять справку из психоневрологического диспансера или наркологического диспансера. В соответствии с условиями страхования по «Программе страховой защиты заемщиков Банка 4.0», необходимо предоставить следующие документы: копию свидетельства о смерти, копию протокола патологоанатомического вскрытия, копию справки о смерти, документы компетентных органов подтверждающие обстоятельства наступления страхового случая, копию акта о несчастном случае и другие необходимые документы. Поэтому справка из психоневрологического диспансера или наркологического диспансера не входит в список необходимых документов для получения страховой выплаты в данном случае. 

Если у вас возникли дополнительные вопросы или вам необходима более подробная консультация, пожалуйста, обращайтесь к нашим специалистам по страхованию, которые смогут предоставить вам всю необходимую информацию и помощь в данном вопросе. Ваше удовлетворение и понимание условий страхования для нас очень важно, поэтому мы готовы ответить на все ваши вопросы и предоставить необходимую поддержку.",,0.9119948273205293,0.9999999999,0.6666666666666666,0.8634396377158426,0.0,0.23485265639378705,0.9583901,0.8540788754411118
Дают ли кредит на автомобиль?,"[""['3.1. Банк предоставляет Клиенту Кредит на потребительские цели, в том числе на приобретение Товара и/или Автомобиля, в соответствии с законодательством Российской Федерации.']""]","Да, в соответсвии с пунктом 3.1. Банк предоставляет Клиенту Кредит на потребительские цели, , в том числе на приобретение автомобиля.","Да, банк Tinkoff предоставляет кредиты на приобретение автомобилей. Клиент может оформить заявку на кредитный договор для получения кредита на автомобиль через дистанционное обслуживание. В случае одобрения заявки, банк может зачислить сумму кредита на картсчет (счет) клиента. Погашение задолженности по кредитному договору осуществляется путем безакцептного списания суммы регулярного платежа, комиссий, штрафов и других плат с картсчета (счета) клиента. Клиент также может заключить договор залога для обеспечения исполнения обязательств по кредитному договору, если это необходимо. Кроме того, в случае реструктуризации задолженности, применяются соответствующие положения общих условий кредитования. Главное, чтобы клиент соблюдал условия договора и своевременно погашал задолженность перед банком.",0.8571428571428571,0.9175654822530676,0.9999999999,1.0,0.8942516262641569,0.0,0.16317880591652378,0.9644833,0.9037841499626093
Распростроняется ли страховое покрытие на смерть в алкогольном опьянении?,"[""[' \\n                    Страховое покрытие по рискам «Смерть» и «Инвалидность» не распространяется на события, произошедшие в результате \\n                    и/или в период:\\n                    a. действий, совершенных Застрахованным лицом в состоянии алкогольного, наркотического и/или токсического \\n                    опьянения; в результате употребления им наркотических, сильнодействующих лекарственных препаратов \\n                    и психотропных веществ без предписания врача (или по предписанию врача, но с нарушением указанной  \\n                    им дозировки); болезни Застрахованного лица, прямо связанной с наркоманией, токсикоманией, хроническим \\n                    алкоголизмом\\n                    ']""]","Нет, страховое покрытие не распространяется на смерть в алкогольном опьянении.","Страховое покрытие по рискам ""Смерть"" и ""Инвалидность"" для заемщиков Банка Tinkoff не распространяется на события, произошедшие в результате действий, совершенных в состоянии алкогольного, наркотического и/или токсического опьянения. Это значит, что если застрахованное лицо находилось в состоянии опьянения от алкоголя, наркотиков или токсических веществ, и произошло событие, связанное с риском ""Смерть"" или ""Инвалидность"", то страховая компания не будет выплачивать возмещение по данному случаю.

Таким образом, если случай смерти произошел в связи с алкогольным опьянением застрахованного лица, страховое покрытие не будет распространяться на данный случай. Это является исключением из страхового покрытия, описанным в пользовательском соглашении программы страхования заемщиков Банка Tinkoff.

Важно помнить, что условия страхования четко определяют случаи, на которые распространяется страховое покрытие, и случаи, которые исключаются из этого покрытия. Поэтому рекомендуется внимательно изучить все условия перед заключением договора страхования, чтобы быть в курсе всех ограничений и исключений.",1.0,0.8729162986483745,0.9999999999,0.5,0.8880974544332628,0.0,0.24828903497194732,0.94448274,0.8488272594792253
"Может ли Банк изменить Тарифный план по кредитной карте, и какие условия должны быть соблюдены для этого?","[""['\\n                    Банк вправе в одностороннем порядке изменить Тарифный план, применяемый\\nв рамках Договора, и/или заменить его на другой Тарифный план, в том числе при заключении Договора и/или\\nна определенный период времени по усмотрению Банка, с целью уменьшения процентной ставки по кредиту\\nи/или улучшения иных условий обслуживания при условии, что это не повлечет возникновение новых или увеличение размера существующих денежных обязательств Клиента\\n                    ']""]","Да, Банк может изменить Тарифный план по кредитной карте в одностороннем порядке, но при условии, что это не приведет к возникновению новых или увеличению уже существующих денежных обязательств клиента ","Банк Tinkoff имеет право изменить Тарифный план по кредитной карте в рамках договора с клиентом. Для этого необходимо соблюсти определенные условия, которые были оговорены в индивидуальных условиях договора. Способ доставки информации о изменениях также определяется Банком. Информация, содержащаяся в Тарифном плане, может быть включена в индивидуальные условия договора, которые предоставляются клиенту до заключения кредитного договора.

Банк имеет право в одностороннем порядке изменить Тарифный план, применяемый в рамках договора, и заменить его на другой Тарифный план, в том числе при заключении договора или на определенный период времени по усмотрению Банка. Целью таких изменений может быть уменьшение процентной ставки по кредиту или улучшение иных условий обслуживания клиента при условии, что это не повлечет возникновение новых или увеличение размера существующих денежных обязательств клиента, а также уменьшить или прекратить взимание плат и штрафов по договору. 

Банк обязан уведомить клиента о любых изменениях в Тарифном плане не позднее дня соответствующих изменений посредством дистанционного обслуживания. При этом Банк также вправе в любое время вернуться к Тарифному плану, согласованному с клиентом при заключении договора или действовавшему до соответствующих изменений. 

Таким образом, Банк имеет законное право изменить Тарифный план по кредитной карте, соблюдая определенные условия и уведомляя клиента о всех изменениях.",1.0,0.9348708865301915,0.9999999999,1.0,0.9251526124283553,0.0014,0.3580869629428301,0.96880865,0.96676375527537
Можно ли внести частичное досрочное погашение кредита? И как это повлияет на остаток задолженности?,"[""['«Клиент имеет право досрочно погасить Задолженность с уплатой Банку суммы непогашенного Кредита и начисленных процентов, а также (если применимо) комиссий и плат, предусмотренных Тарифным планом, в любой момент путем зачисления необходимой суммы денежных средств на Картсчет (Счет) и извещения Банка о необходимости проведения досрочного погашения. В случае частичного досрочного погашения уменьшается срок Кредита или сумма Регулярного платежа по выбору Клиента, при этом Клиент не освобождается от оплаты ближайшего Регулярного платежа, а также применимых комиссий и плат, предусмотренных Тарифным планом.», «При обращении Клиента в Банк для совершения частичного досрочного погашения до или в дату оплаты ближайшего Регулярного платежа Клиенту может быть предложено совершить частичное досрочное погашение с погашением ближайшего Регулярного платежа и последующим уменьшением срока Кредита или суммы Регулярного платежа по выбору Клиента.»']""]","Да, Клиент имеет право совершить частичное досрочное погашение кредита. При этом по выбору Клиента уменьшится либо срок кредита, либо сумма регулярного платежа. Однако Клиент не освобождается от оплаты ближайшего регулярного платежа и применимых комиссий.","Да, в рамках пользовательского соглашения с банком Tinkoff предусмотрена возможность частичного досрочного погашения кредита. Это означает, что вы можете погасить часть задолженности, внести определенную сумму денежных средств на ваш Картсчет (Счет) и известить Банк о необходимости проведения частичного досрочного погашения. 

При частичном досрочном погашении уменьшается либо срок кредита, либо сумма регулярного платежа по вашему выбору. Однако важно отметить, что частичное досрочное погашение не освобождает вас от оплаты ближайшего регулярного платежа, а также применимых комиссий и плат, предусмотренных тарифным планом. 

Если вы решите совершить частичное досрочное погашение до или в дату оплаты ближайшего регулярного платежа, вам может быть предложено совершить погашение суммы ближайшего регулярного платежа и последующее уменьшение срока кредита или суммы регулярного платежа по выбору Банка. 

В случае неполного погашения суммы ближайшего регулярного платежа, вам необходимо будет оплатить оставшуюся часть суммы в установленную дату оплаты регулярного платежа, а также применимые комиссии и платы. При этом после оплаты неоплаченных регулярных платежей, начисленных процентов, штрафов и применимых комиссий, Банк осуществит частичное досрочное погашение задолженности с уменьшением срока кредита или суммы регулярного платежа по выбору Банка за счет денежных средств на вашем Картсчете (Счет).

Таким образом, частичное досрочное погашение кредита представляет собой удобный способ уменьшить срок кредита или сумму регулярного платежа, однако не освобождает вас от обязательств по оплате текущих платежей и комиссий. Пожалуйста, обращайтесь в Банк для более подробной информации и консультации по данному вопросу.",1.0,0.0,0.9999999999,1.0,0.9325501576397466,0.0015,0.4982359612732358,0.9885486,0.9239588999450388
Что будет в случае просрочки платежа по кредиту? И какой штраф может быть начислен?,"[""['«В случае неоплаты платежа Клиент должен уплатить штраф за неоплату Минимального платежа согласно Тарифному плану. Банк рассматривает любой поступивший платеж Клиента как признание Клиентом данного штрафа в размере поступившего платежа, но не более суммы штрафа, определенного в соответствии с Тарифами.»']""]","В случае неоплаты минимального платежа по кредиту, Клиент должен уплатить штраф в соответствии с Тарифным планом. Размер штрафа определяется Тарифами, и любой поступивший от Клиента платеж Банк будет рассматривать как оплату штрафа в пределах установленной суммы.","В случае просрочки платежа по кредиту, банк Tinkoff имеет право начислить штрафы и проценты за просрочку в соответствии с условиями кредитного договора. При этом, если клиент не выполняет свои обязательства по оплате регулярных платежей и других комиссий в установленные сроки, банк может потребовать частичное досрочное погашение задолженности за счет денежных средств на карточном счете клиента. 

Банк имеет право начислить штрафы за просрочку, которые могут быть определены согласно тарифам и условиям кредитного договора. В случае просрочки более чем на 15 календарных дней, банк может потребовать обращения взыскания на предмет залога или другие меры, предусмотренные договором. 

Клиент должен осознавать, что просрочка платежа по кредиту может повлечь за собой дополнительные финансовые обязательства в виде штрафов, процентов за просрочку и других расходов. Поэтому важно всегда своевременно погашать задолженность по кредиту, чтобы избежать негативных последствий.",1.0,0.9281712752619887,0.9999999999,1.0,0.9023623658044668,0.0,0.13879549781397668,0.9812289,0.9224846095345256
Можно ли на время приостановить выплаты по кредиту? И как это повлияет на начисление процентов?,"[""['«На основании обращения Клиента и по согласованию с Банком на период от 1 (одного) до 12 (двенадцати) месяцев возможно приостановление обязанности Клиента по погашению Задолженности, по оплате Регулярных платежей и/или иных платежей. В указанный период Банк вправе приостановить начисление процентов и иных сумм, предусмотренных Договором реструктуризации задолженности.»']""]","Да, на основании обращения Клиента и по согласованию с Банком возможно приостановить обязанность по погашению задолженности и оплате платежей на срок от 1 до 12 месяцев. В этот период Банк вправе также приостановить начисление процентов и иных сумм по кредиту.","Да, согласно условиям пользовательского соглашения банка Tinkoff, клиент имеет возможность обратиться и согласовать с банком приостановление обязанности по погашению задолженности, оплате минимальных или регулярных платежей на период от 1 до 12 месяцев. В течение указанного периода банк вправе приостановить начисление процентов и других сумм, предусмотренных договором кредита. 

Однако важно учитывать, что приостановление выплат не освобождает клиента от обязательств по кредитному договору, и задолженность должна быть погашена в полном объеме после завершения периода приостановления. Также стоит отметить, что оставшийся срок возврата кредита может быть скорректирован после возобновления платежей.

В целом, приостановление выплат по кредиту на временный период может быть полезным решением для клиента в случае временных финансовых трудностей. Однако перед принятием такого решения рекомендуется обратиться в банк для согласования условий и последствий данного действия.",1.0,0.864928257891107,0.9999999999,1.0,0.9449836648214385,0.0287,0.34255624479165464,0.9876243,0.9355164810915966
Я хочу оформить дополнительную карту на супругу. Как это сделать? И будет ли она иметь доступ к общему лимиту по кредитке?,"[""['«3.2. По заявлению Клиента, переданному в Банк на бумажном носителе или через Дистанционное обслуживание, в рамках Договора кредитной карты Банком может быть выпущена одна или несколько дополнительных Кредитных карт.»', '«3.5. Клиент вправе установить лимит для проведения расходных операций с использованием Кредитной карты.»']""]","Вы можете оформить дополнительную кредитную карту на супругу, подав заявление в банк на бумажном носителе или через дистанционное обслуживание. Дополнительная карта будет иметь доступ к общему лимиту задолженности по вашей основной кредитной карте, однако вы можете установить отдельный лимит для расходных операций по дополнительной карте.","Для оформления дополнительной карты на супругу вам необходимо обратиться в ближайшее отделение банка Tinkoff или воспользоваться дистанционным обслуживанием. При этом дополнительная карта будет выпущена на имя вашей супруги и зарегистрирована в программе лояльности на ваше имя. 

Относительно общего доступа к лимиту по кредитке, следует уточнить, что обычно дополнительные карты имеют отдельный лимит, который устанавливается банком или клиентом. Это означает, что ваша супруга будет иметь доступ к своему собственному лимиту на дополнительной карте, независимо от основной карты. Таким образом, операции, совершаемые вашей супругой с использованием дополнительной карты, не будут влиять на общий лимит по кредитке. 

Если у вас возникнут какие-либо дополнительные вопросы или вам потребуется помощь с оформлением дополнительной карты, не стесняйтесь обращаться в отделение банка или в службу поддержки клиентов. Будем рады помочь вам с любыми вопросами, касающимися услуг и условий использования кредитных карт от банка Tinkoff.",1.0,0.9050614940767702,0.9999999999,1.0,0.9486448429955845,0.0103,0.23458221878393562,0.99293184,0.9287700075739524
"А что если я потеряю карту? Сколько у меня есть времени, чтобы ее заблокировать? И как вообще это делается? Через приложение или звонить надо?","[""['«6.1. При обнаружении утери, кражи или порчи Кредитной карты и/или возникновения подозрений, что Кредитная карта или ее реквизиты, а также ПИН-код, QR-код, Коды доступа, Аутентификационные данные, Абонентский номер, Абонентское устройство могли быть утрачены или похищены, а также в случае изъятия Кредитной карты в банкомате или торгово-сервисном предприятии и в случае изменения имени или фамилии Держателя Клиент должен незамедлительно уведомить Банк по телефонам 8 800 555-10-10 или +7 495 645-59-19 (круглосуточно) и заблокировать Кредитную карту и/или Интернет-Банк и/или Мобильный банк, а также подать заявление о досрочном перевыпуске Кредитной карты.»']""]","В случае утери или кражи кредитной карты, вы должны незамедлительно уведомить банк по телефонам горячей линии 8 800 555-10-10 или +7 495 645-59-19 (круглосуточно) и заблокировать карту. Также необходимо подать заявление на досрочный перевыпуск новой карты. Чем быстрее вы заблокируете карту, тем меньше риск несанкционированного использования.","Если вы обнаружите утерю, кражу или порчу вашей Расчетной карты, или у вас возникнут подозрения, что данные о карте или ее реквизиты могли быть утрачены или похищены, вам необходимо незамедлительно уведомить Банк. Это можно сделать позвонив по телефонам 8 800 555-25-50 или +7 495 645-59-19 (круглосуточно). 

После уведомления Банка, вам следует заблокировать Расчетную карту и/или Интернет-Банк и/или Мобильный Банк. Это можно сделать через приложение Банка, в интернет-банке или по телефону. Чем быстрее вы это сделаете, тем меньше вероятность несанкционированного использования вашей карты злоумышленниками.

Не стоит забывать, что в соответствии с условиями использования карты, ваша ответственность за дальнейшее использование карты прекращается после блокировки, если не будет известно, что незаконное использование карты произошло с вашего согласия.

Также важно отметить, что если вы найдете карту, которую уже объявили утраченной, обязательно верните ее в Банк. Использование такой карты в дальнейшем будет запрещено. 

Помните также о мерах безопасности при использовании карты, установите лимиты на операции, храните телефоны Банка отдельно от карты и всегда имейте их при себе для экстренной блокировки в случае утери или кражи. 

Надеюсь, данная информация поможет вам в случае утери или кражи карты.",0.6666666666666666,0.8498293049890906,0.9999999999,1.0,0.9523425791954077,0.0092,0.39778938653807283,0.9799589,0.8896382848565415
"Прочитал тут у вас про блокировку карточки. А если я её забуду забрать в банкомате, что тогда делать?","[""['«6.1. [...] а также в случае изъятия Кредитной карты в банкомате или торгово-сервисном предприятии и в случае изменения имени или фамилии Держателя Клиент должен незамедлительно уведомить Банк по телефонам 8 800 555-10-10 или +7 495 645-59-19 (круглосуточно) и заблокировать Кредитную карту и/или Интернет-Банк и/или Мобильный банк, а также подать заявление о досрочном перевыпуске Кредитной карты.»']""]","Если вы забыли карту в банкомате, вам необходимо незамедлительно сообщить об этом в банк по телефонам горячей линии 8 800 555-10-10 или +7 495 645-59-19 и заблокировать кредитную карту, а также подать заявление на ее досрочный перевыпуск. Это позволит предотвратить возможное несанкционированное использование забытой карты третьими лицами.","Если вы забудете забрать карту из банкомата, то вам следует обратиться в банк посредством дистанционного обслуживания. Если карта была удержана банкоматом стороннего банка, то необходимо связаться с банком, обслуживающим данный банкомат. В случае технического сбоя или задержки с извлечением карты из устройства банкомата, карта может быть возвращена вам при предъявлении документа, удостоверяющего личность.

Некоторые сторонние банки могут потребовать письменный запрос из банка, выпустившего карту, для возврата удержанной карты. В этом случае необходимо обратиться в банк, выпустивший карту. Однако стоит помнить, что сторонний банк вправе не вернуть карту, если она была заблокирована вами ранее или банком, выпустивший карту, не даст соответствующего разрешения.

В случае обнаружения утери, кражи или подозрений на компрометацию вашей карты, вы также должны незамедлительно уведомить банк и заблокировать карту. По факту устного заявления банк примет меры по блокировке карты. Если потерянная карта будет найдена позднее, ее также необходимо вернуть в банк, и использование этой карты будет запрещено. 

Таким образом, в случае забытой карты в банкомате, следует обращаться в банк для получения дальнейших инструкций и решения данной ситуации.",1.0,0.8989063183505553,0.9999999999,1.0,0.9230525437734751,0.0,0.2634482840468802,0.9799345,0.9276646414913929
"А есть ли какие-то льготные условия, если я захочу приостановить выплаты по кредитке на какое-то время? Например, на ремонт или что-то в этом роде?","[""['«5.15. На основании обращения Клиента и по согласованию с Банком на период от 1 (одного) до 12 (двенадцати) месяцев возможно приостановление обязанности Клиента по погашению Задолженности, по оплате Минимальных платежей, Регулярных платежей и/или иных платежей. В указанный период Банк вправе приостановить начисление процентов и иных сумм, предусмотренных Договором кредитной карты.»']""]","Да, в документе указано, что по обращению клиента и по согласованию с банком возможно приостановление обязанности по погашению задолженности, выплате минимальных и регулярных платежей на срок от 1 до 12 месяцев. В этот период банк также может приостановить начисление процентов и других сумм по кредитной карте. Таким образом, вы можете получить льготный период для ремонта или других нужд, обратившись в банк с соответствующим заявлением.","Да, в Банке Tinkoff предусмотрены льготные условия для приостановления выплат по кредитной карте на определенный период времени. По обращению Клиента и согласованию с Банком возможно приостановление обязанности Клиента по погашению задолженности, оплате минимальных платежей, регулярных платежей и/или иных платежей на период от 1 до 12 месяцев. В указанный период Банк также вправе приостановить начисление процентов и иных сумм, предусмотренных договором кредитной карты.

Это означает, что если у вас возникла необходимость временно приостановить выплаты по кредитной карте из-за ремонта или другой причины, вы можете обратиться в Банк с соответствующим запросом. После согласования условий с Банком, вам может быть предоставлен период временного освобождения от обязанности по погашению задолженности.

Важно отметить, что оставшийся срок возврата кредита будет продлен на согласованный период приостановления обязательств по погашению задолженности и оплате регулярных платежей. Также возможно изменение даты регулярного платежа с увеличением или уменьшением срока возврата кредита.

Поэтому, если у вас возникла необходимость приостановить выплаты по кредитной карте на определенный период времени, рекомендуем обратиться в Банк Tinkoff для получения подробной консультации и согласования условий приостановления платежей.",1.0,0.9038002424202619,0.9999999999,1.0,0.9522608181734116,0.0421,0.53695963864046,0.99377704,0.9760112005131638
Какие процедуры предусмотрены банком для обработки жалоб клиентов?,"[""['Банк имеет установленные процедуры для обработки и рассмотрения жалоб клиентов, включая регистрацию жалобы, ее анализ и предоставление ответа клиенту в установленные сроки.']""]","Банк следует четко установленным процедурам для обработки жалоб клиентов, которые включают регистрацию жалобы, ее тщательный анализ и предоставление ответа клиенту в соответствии с установленными сроками.","Для обработки жалоб клиентов банк Tinkoff предусматривает определенные процедуры, которые направлены на обеспечение эффективного и справедливого рассмотрения претензий. В соответствии с документами банка, клиент может подать жалобу в письменной форме, после чего банк обязан рассмотреть данную жалобу в установленные сроки. 

В случае получения жалобы от клиента, банк имеет право запросить у клиента дополнительные документы и сведения, необходимые для проведения проверки и вынесения обоснованного решения. Банк также оставляет за собой право отказать в рассмотрении претензии, если она предъявлена после истечения определенного срока с момента получения уведомления о совершенной операции или начислении комиссии.

Для ускорения процесса рассмотрения жалобы, банк может блокировать действие расчетной карты или токена клиента, устанавливать лимиты на операции или проводить дополнительные проверки. В случае несогласия клиента с решением банка, клиент имеет право обратиться с жалобой в уполномоченные органы или органы защиты прав потребителей.

Таким образом, банк Tinkoff серьезно относится к рассмотрению жалоб клиентов и предусматривает четкие процедуры, направленные на защиту интересов клиентов и обеспечение их удовлетворенности обслуживанием.",0.875,0.9664027248924292,0.9999999999,1.0,0.9167574183748721,0.0,0.15164032287378718,0.9803619,0.9341433693441702
Что происходит с депозитами в случае смерти?,"[""['В случае смерти клиента банк замораживает депозиты до решения вопросов наследства в соответствии с законодательством.']""]","После смерти клиента банк замораживает все его депозиты и удерживает их до тех пор, пока не будут решены вопросы наследства в соответствии с действующим законодательством.","При возникновении ситуации смерти вкладчика, банк Tinkoff следует определенной процедуре по обработке депозитов. В случае поступления в банк заявления на получение наследства с соответствующими документами (оригинал с нотариально заверенной подписью) и свидетельством о праве на наследство, банк прекращает начисление процентов, пересчитывает их в соответствии с тарифным планом, и направляет средства наследнику(-ам) по указанным в заявлении реквизитам. Далее банк закрывает все счета вклада, расторгает договор вклада и переводит денежные средства наследнику.

Следует отметить, что банк имеет определенные процедуры и требования к документам для обработки наследства, и важно предоставить все необходимые документы для успешного завершения процесса. После завершения всех необходимых действий по наследству, банк закрывает счета вклада и расторгает договор вклада.

Таким образом, в случае смерти вкладчика, банк Tinkoff обеспечивает процедуры по передаче наследства и закрытию счетов вклада в соответствии с установленными правилами и требованиями.",1.0,0.9045219518245694,0.9999999999,1.0,0.9062866798645646,0.0,0.1525371448162447,0.9796278,0.8503832172311724
Могу я отказаться от получения уведомлений от банка и как это влияет на его обслуживание?,"[""['Клиенты имеют право отказаться от получения определенных типов уведомлений от банка, однако это может повлиять на их способность получать своевременную информацию о изменениях условий, сбоях в системе или других важных обновлениях.']""]","Клиенты могут отказаться от получения определенных типов уведомлений от банка, но это может привести к тому, что они не будут получать важные обновления и информацию своевременно, что может повлиять на их способность управлять своими счетами и услугами эффективно.","Да, вы можете отказаться от получения уведомлений от банка. При этом, отказ от рекламы по сетям электросвязи не является основанием для изменения или расторжения договора с банком или отказа в предоставлении продуктов и услуг. Однако, важно понимать, что отказ от уведомлений может повлиять на ваше обслуживание в банке. Например, вы можете упустить важную информацию о новых продуктах или услугах, изменениях в тарифах, условиях обслуживания и других важных моментах. Поэтому, прежде чем принимать решение об отказе от уведомлений, рекомендуется внимательно оценить все возможные последствия и, возможно, обратиться в банк для консультации. Клиент всегда вправе выразить отказ от получения рекламы по сетям электросвязи в соответствии с установленными процедурами, чтобы сохранить контроль над способом получения информации от банка. Важно помнить, что банк всегда стремится обеспечить удобство и комфорт своим клиентам, поэтому решение о отказе от уведомлений должно быть осознанным и обдуманным.",1.0,0.0,0.9999999999,1.0,0.9371267687475793,0.0,0.23752714070827097,0.98599106,0.8803441962981591
Как я могу увеличить лимит по своей кредитной карте?,"[""['Для увеличения кредитного лимита клиенты должны подать заявление через мобильное приложение или веб-сайт банка, после чего банк рассмотрит их кредитную историю и текущую финансовую ситуацию.']""]","Чтобы увеличить кредитный лимит, клиентам необходимо подать соответствующее заявление через мобильное приложение или веб-сайт банка. Банк затем оценит их кредитную историю и текущую финансовую ситуацию перед принятием решения.","Для увеличения лимита по своей кредитной карте вам необходимо обратиться в Банк с запросом на увеличение лимита. Банк рассматривает запросы на увеличение лимита и принимает решение исходя из различных факторов, включая вашу кредитную историю, доходы и другие обстоятельства.

Для этого может потребоваться предоставить дополнительные документы, подтверждающие ваш доход, например, справку о заработной плате с места работы или другие документы, подтверждающие вашу финансовую состоятельность. Банк также может использовать другую информацию, предоставленную вами или государственными органами с вашего согласия.

Важно отметить, что решение о увеличении лимита по кредитной карте принимается Банком на основе анализа вашей кредитоспособности и может быть отклонено, если Банк считает, что увеличение лимита может повлечь за собой риски для вас или для Банка.

Также стоит учитывать, что Банк вправе ограничивать перечень операций, совершаемых с использованием кредитной линии, в соответствии с законодательством Российской Федерации, в том числе путем установления лимита для проведения расходных операций с использованием кредитной линии.

Поэтому, для увеличения лимита по своей кредитной карте, рекомендуется обратиться в Банк с запросом и предоставить необходимую информацию для рассмотрения вашего запроса.",1.0,0.9480375671957416,0.9999999999,1.0,0.9277195830522083,0.0,0.07732263139678361,0.9806969,0.8681019535086509
"Каковы условия отмены банковской операции, например, перевода средств или платежа?","[""['Клиенты могут отменить определенные банковские операции, если они не были еще обработаны банком. Условия отмены операций установлены в пользовательском соглашении и зависят от типа операции.']""]","Условия отмены банковской операции зависят от того, была ли операция уже обработана банком. Для операций, которые еще не обработаны, клиенты могут инициировать отмену, следуя процедурам, описанным в пользовательском соглашении и в зависимости от типа операции.","При отмене банковской операции, такой как перевод средств или платеж, следует руководствоваться условиями, установленными в договоре кредитной карты или других соответствующих документах. Обычно банк предоставляет клиенту возможность отозвать заявление о расторжении договора до истечения установленного срока путем письменного уведомления или через дистанционное обслуживание.

Если при расторжении договора банк обнаруживает, что на счету клиента имеются излишне перечисленные денежные средства, то банк осуществляет возврат этих средств по распоряжению клиента. В этом случае банк может удержать комиссию за перевод денежных средств в соответствии с тарифами на услуги по переводам.

Если клиент не предоставляет распоряжение по переводу денежных средств в течение определенного срока, то банк может приостановить проведение операции и ограничить дистанционное обслуживание до предоставления необходимых документов. Банк также вправе отказать клиенту в приеме распоряжений на операции через дистанционное обслуживание, принимая только оформленные документы на бумажном носителе.

Клиент должен быть внимателен к условиям договора и обязательствам, которые он принимает при совершении банковских операций. Отмена ошибочных операций по погашению задолженности или пополнению счета может быть произведена банком без уведомления клиента, но при этом не будет начисляться проценты за соответствующий период.

Таким образом, условия отмены банковской операции зависят от конкретного случая, и клиент должен следовать инструкциям банка и условиям договора для корректного решения возникающих вопросов.",,0.9369936267358733,0.9999999999,1.0,0.9278905575381964,0.0011,0.11302695091310797,0.9794819,0.8103082858715703
Какие услуги доступны клиентам через Интернет-банк?,"[""['Через Интернет-банк клиенты могут управлять своими счетами, осуществлять платежи и переводы, а также получать детальную информацию о своих финансовых операциях.']""]","Интернет-банк предоставляет клиентам возможности управления их счетами, осуществления платежей и переводов, а также доступ к подробной информации о всех их финансовых операциях.","Через Интернет-банк клиентам предоставляются различные услуги для получения информации и совершения операций. Это включает в себя доступ к банковским счетам, открытым в банке, возможность осуществления различных операций, таких как переводы, платежи, а также использование уникальных кодов для подтверждения операций. Клиенты также могут получать информацию о продуктах и услугах, предлагаемых банком и его партнерами, а также обмениваться информацией для целей обслуживания клиента.

Кроме того, клиенты могут ознакомиться с тарифами на услуги, условиями тарифных планов, получить информацию о договорах, а также ознакомиться с различной информацией, предоставляемой в Интернет-банке, Мобильном банке и других мобильных приложениях банка.

Информация о доступных услугах и функционале Интернет-банка, а также другие важные детали предоставляются клиентам на сайте банка и через другие каналы обслуживания. Поэтому клиенты могут удобно пользоваться банковскими услугами через Интернет, получая необходимую информацию и осуществляя операции в любое удобное для них время.",1.0,0.9576373133455109,0.9999999999,1.0,0.947354469834677,0.0,0.1289052927007711,0.9764443,0.9171970507015239
"Я не пользовалась кредиткой год, но у меня там лежат мои 800 рублей, я могу их как-то вернуть?","['[\'""8. Расторжение Договора кредитной карты\\n                8.1. Банк вправе в любой момент расторгнуть Договор кредитной карты в одностороннем порядке в случаях, предусмотренных \\n                законодательством Российской Федерации, а также:\\n                • в случае если Держатель не пользовался Кредитной картой более, чем 6 (шесть) месяцев при отсутствии \\n                Задолженности по Договору кредитной карты;\\n                В этих случаях Банк блокирует все Кредитные карты/Токены, выпущенные в рамках Договора кредитной карты. Договор \\n                кредитной карты считается расторгнутым со дня формирования Банком Заключительного счета, который направляется \\n                Клиенту. Если в момент расторжения Договора кредитной карты Задолженность Клиента перед Банком отсутствует, Банк \\n                вправе расторгнуть Договор кредитной карты без направления Заключительного счета, информируя Клиента о своем \\n                решении любым способом по усмотрению Банка.\\n                8.5. В случае, если при расторжении Договора кредитной карты в Банке находятся денежные средства Клиента, излишне \\n                перечисленные им при погашении Задолженности, Банк осуществляет возврат таких денежных средств по распоряжению \\n                Клиента почтовым переводом или иным способом, указанном в распоряжении Клиента. При этом Банк вправе удержать \\n                из суммы такого перевода комиссию за перевод денежных средств в размере, предусмотренном Тарифами на услуги \\n                по переводам, платежам и дополнительные услуги с использованием каналов Дистанционного обслуживания.\\n                8.6. В случае неполучения Банком распоряжения Клиента о переводе денежных средств в течение 120 (ста двадцати) дней \\n                со дня обработки Банком последней операции Клиента/Держателя и, если остаток денежных средств не превышает \\n                1000 руб., указанный остаток считается безвозмездно переданным Банку. \\n                В случае неполучения Банком распоряжения Клиента о переводе денежных средств в течение 3 (трех) лет со дня обработки \\n                Банком последней операции Клиента/Держателя указанные денежные средства считаются безвозмездно переданными \\n                Банку.\\n                \']']","Согласно пунуту 8.6 - вы не можете вернуть ваши деньги, так как не дали распоряжение Банку о переводе денежных средств в течение 120 дней.","Согласно условиям пользовательского соглашения банка Tinkoff, если у вас на кредитной карте лежат денежные средства, которые были излишне перечислены при погашении задолженности, вы имеете право на их возврат. Для этого необходимо направить соответствующее распоряжение банку о переводе денежных средств. Банк осуществит возврат указанных средств по вашему распоряжению, например, почтовым переводом или иным удобным для вас способом.

В случае, если вы не пользовались кредитной картой в течение года, но на ней есть денежные средства, вы также можете запросить их возврат. Обратитесь в банк с запросом о возврате денежных средств, и банк проведет соответствующие операции по возврату указанных средств в соответствии с условиями договора.

Необходимо учитывать, что банк вправе удержать комиссию за перевод денежных средств в размере, предусмотренном тарифами на услуги по переводам. Важно также помнить, что банк осуществляет возврат денежных средств по вашему распоряжению, поэтому убедитесь, что предоставленная вами информация для возврата средств корректна и полна.

Таким образом, чтобы вернуть денежные средства, которые находятся на вашей кредитной карте, вам следует обратиться в банк с запросом о возврате средств и предоставить необходимую информацию для проведения операции возврата.",1.0,0.8794215553015241,0.9999999999,0.07692307692307693,0.8644592616391714,0.0,0.1740168857493581,0.9604114,0.8868573982573758
