question,contexts,ground_truth,answer,faithfulness,answer_relevancy,context_precision,context_relevancy,answer_similarity,bleu_score,cos-sim-TF-IDF,sim-spacy,cos-sim-BertModel
Можно ли не расписываться на карте?,"[""['После получения карты поставьте свою подпись в прямоугольнике, расположенном на оборотной стороне карты. При отсутствии подписи карта может быть не принята к оплате в торгово-сервисном предприятии, а также повышается риск использования карты злоумышленниками в случае ее утраты/кражи.']""]","При отсутствии подписи карта может быть не принята к оплате в торгово-сервисном предприятии, а также повышается риск использования карты злоумышленниками в случае ее утраты/кражи.","Нет, согласно пользовательскому соглашению банка Tinkoff, при проведении операции необходимо поставить подпись на карте и на чеке.",,0.8216641351387793,0.9999999999,1.0,0.8829319450747384,0.0,0.02609042123539068,0.8023781176462522,0.9783786
"Мой друг попросил меня дать свою карту для оплаты и потом вернуть, это не опасно?","[""['Никогда не принимайте рекомендации, советы, помощь от третьих лиц при пользовании картой, особенно при снятии наличных денежных средств в банкоматах. В случае возникновения затруднений при совершении операции обратитесь Банк посредством дистанционного обслуживания. Обращайте внимание на расположение банкоматов. Старайтесь не пользоваться банкоматами, расположенными в плохо освещенных и безлюдных местах', 'Не передавайте карту другим лицам, в т.ч. родственникам и знакомым для проведения транзакций. С целью исключения Ваших потерь от несанкционированного использования Вашей карты (копирования информации с Вашей карты для ее дальнейшего мошеннического использования): при совершении операции оплаты с использованием карты никогда не выпускайте Вашу карту из поля зрения и требуйте от обслуживающего Вас лица, чтобы все операции с использованием карты совершались в Вашем присутствии.']""]","Не передавайте карту другим лицам, в т.ч. родственникам и знакомым для проведения транзакций и никогда не принимайте рекомендации, советы, помощь от третьих лиц при пользовании картой, особенно при снятии наличных денежных средств в банкоматах.","Нет, это не безопасно. Если вы передадите свою карту другому человеку, то можете стать жертвой мошенничества. Лучше всего использовать онлайн-платежи или другие безопасные способы оплаты.",0.5,0.0,0.9999999999,1.0,0.8818778122620137,0.0,0.05495795873442595,0.7072666556827131,0.9849079
Безопасно ли хранить пинкод в заметках в телефоне?,"[""['Категорически запрещается записывать ПИН-код на карте. Постарайтесь не записывать ПИН-код, запомните его. Если же Вы предпочитаете записать свой ПИН-код, никогда не указывайте, что это ПИН-код и не храните документ с записанным ПИН-кодом рядом с картой.']""]","Да, однако не указывайте в названии заметки, что это ПИН-код от Вашей карты.","Нет, не безопасно. Хранение ПИН-кода в заметках в телефоне может подвергнуть вас риску кражи личных данных и финансовых потерь. Рекомендуется использовать другие методы хранения ПИН-кода, такие как запоминание кода или использование виртуальной клавиатуры при вводе ПИН-кода.",,0.9181374694468808,0.9999999999,1.0,0.8808828080042257,0.0,0.08341205139474898,0.6710285908031451,0.95516425
Я потеряла карту,"[""[' Вы потеряли карту или ее украли\\nПрежде всего, как можно быстрее, сообщите о случившемся в Банк посредством дистанционного обслуживания \\nи заблокируйте карту. Заблокировать карту можно по телефону, в интернет-банке или в мобильном приложении Банка. \\nЧем раньше Вы это сделаете, тем меньше вероятность несанкционированного использования карты злоумышленниками. \\nРазблокировать карту нельзя — можно только перевыпустить. Если вы не уверены, что карту украли, не спешите ее \\nблокировать, установите лимит «0» на операции и запретите покупки через Интернет, если карта будет найдена лимиты \\nможно изменить.\\nНапоминаем Вам, что в соответствии с Общими условиями выпуска и обслуживания кредитных карт и Общими \\nусловиями открытия, ведения и закрытия счетов физических лиц, а также выпуска и обслуживания расчетных карт Ваша \\nответственность за дальнейшее использование карты прекращается, после осуществления блокировки, если не станет \\nизвестно, что незаконное использование карты имело место с Вашего согласия.\\nЕсли карта была у Вас украдена на территории РФ, после блокировки карты заявите о случившемся в полицию. При краже \\nкарты за границей, заявите в полицию или в консульский отдел посольства Российской Федерации в стране, на территории \\nкоторой произошла кража. Пожалуйста, сохраняйте копию протокола (квитанцию о заявлении) для последующего \\nпредъявления в Банк.']""]","Если вы не уверены, что карту украли, не спешите ее блокировать, установите лимит «0» на операции и запретите покупки через Интернет, если карта будет найдена лимиты можно изменить. В случае, если вы полагаете, что Вашу карту всё-таки украли, то как можно быстрее, сообщите о случившемся в Банк посредством дистанционного обслуживания и заблокируйте карту. Это возможно сделать по телефону, в интернет-банке или в мобильном приложении Банка.","Если вы потеряли карту, вам следует немедленно заблокировать ее через приложение или интернет-банкинг, чтобы предотвратить возможные несанкционированные операции. Также рекомендуется сообщить о потере карты в банк и запросить перевыпуск новой карты.",1.0,0.8706385945206728,0.9999999999,0.3,0.9178273789888812,0.0,0.17909955424581114,0.9343758456350822,0.9902415
"Почему при использовании карты важно не расписываться на квитанциях/чеках до того, как вы проверите правильность указанной суммы?","[""['Проверяйте правильность суммы, указанной на платежном чеке. Поставив подпись на платежном чеке, Вы соглашаетесь со списанием указанной на нем суммы с Вашего карточного счета.']""]","Важно проверять правильность суммы перед подписанием квитанции/чека, потому что после подписи вы соглашаетесь с этой суммой, и она будет списана с вашего счета.","Подпись на квитанции или чеке является подтверждением факта совершения операции по карте. Если вы распишетесь на квитанции или чеке до проверки правильности указанной суммы, то можете подтвердить неправильную сумму, что может привести к финансовым потерям для вас. Поэтому рекомендуется сначала проверить правильность информации на квитанции или чеке, а затем уже ставить свою подпись.",1.0,0.8524776497397797,0.9999999999,1.0,0.9364273786192606,0.0,0.09798542203678193,0.9038365004449728,0.97949535
"Что делать, если я потеряла телефон, на котором было установлено мобильное приложение банка?","[""['При утрате Мобильного телефона, используемого с абонентским номером подвижной радиотелефонной связи, на который установлено Мобильное приложение Банка, Вам следует срочно обратиться к своему оператору сотовой связи для блокировки SIM-карты и в Банк посредством дистанционного обслуживания для блокировки доступа в мобильное приложение Банка и удаления данных карты с Мобильного телефона.']""]","Если вы потеряли телефон с установленным мобильным приложением банка, необходимо:

Срочно обратиться к оператору сотовой связи для блокировки SIM-карты.
Обратиться в банк через дистанционное обслуживание для блокировки доступа в мобильное приложение и удаления данных карты с телефона.","Если вы потеряли телефон, на котором было установлено мобильное приложение банка, вам следует срочно обратиться к своему оператору сотовой связи для блокировки SIM-карты и в банк посредством дистанционного обслуживания для блокировки доступа в мобильное приложение банка и удаления данных карты с мобильного телефона.",1.0,0.980642534619771,0.9999999999,1.0,0.986945269484267,0.3223,0.6375766656194644,0.968332414985018,0.9956849
Можно ли использовать интернет-кафе и другие общедоступные места для совершения операций по карте в интернете? Объясните причину.,"[""['Избегайте осуществления Интернет-операций с использованием карты в местах, где услуги Интернет являются общедоступными, например, в Интернет-кафе.']""]","Нет, не рекомендуется использовать интернет-кафе и другие общедоступные места для совершения операций по карте в интернете. Причина в том, что такие общедоступные сети являются менее безопасными, и есть риск перехвата данных карты злоумышленниками.","Нет, не рекомендуется использовать интернет-кафе и другие общедоступные места для совершения операций по карте в интернете. Это связано с повышенным риском мошенничества и кражи личных данных. Лучше всего использовать проверенные интернет-магазины и сервисы, которые обеспечивают безопасность транзакций.",1.0,0.8957952073334178,0.9999999999,1.0,0.9708568948958702,0.413,0.38823653943220715,0.8368115344240292,0.9927439
"Что делать, если я получил SMS-оповещение о операции по карте, которую я не совершал?","[""['Если Вы уверены, что операция не могла быть совершена Вами, то как можно быстрее сообщите об этом в Банк посредством дистанционного обслуживания и заблокируйте карту.']""]","Если вы получили SMS-оповещение о операции, которую не совершали, нужно как можно быстрее сообщить об этом в банк через дистанционное обслуживание и заблокировать карту.","Если вы получили SMS-оповещение о операции по карте, которую вы не совершали, вам следует проверить наличие карты. Если карта у вас, возможно, данные вашей карты стали известны третьим лицам. Учитывайте, что иногда SMS-сообщения могут доставляться с задержкой, поэтому проверьте, соответствует ли текст в SMS-сообщении операциям, которые вы совершили по карте за последнее время. Если вы уверены, что 6 из 10 операций не могли быть совершены вами, то как можно быстрее сообщите об этом в банк посредством дистанционного обслуживания и заблокируйте карту.",1.0,0.9774982238627414,0.9999999999,1.0,0.9484610984895976,0.0308,0.34827872434940943,0.875600753193386,0.9774601
Как обезопасить себя от съема данных карты в банкомате злоумышленниками? Приведи два способа.,"[""['Поэтому, при пользовании банкоматом не ленитесь внимательно осмотреть его и убедиться в отсутствии каких-либо «накладок» и посторонних устройств.', 'Пожалуйста, примите все меры, чтобы вводимый Вами ПИН-код был не заметен для окружающих.']""]","Чтобы обезопасить себя от съема данных карты в банкомате:

Внимательно осматривайте банкомат перед использованием на наличие подозрительных накладок и посторонних устройств.
Прикрывайте рукой клавиатуру при вводе ПИН-кода, чтобы его не могли увидеть окружающие.","Для защиты от съема данных карты в банкомате злоумышленниками можно использовать следующие способы:

1. Прикрывайте клавиатуру банкомата рукой при вводе ПИН-кода. Это поможет скрыть информацию от камер видеонаблюдения, которые могут использоваться мошенниками.

2. Никогда не сообщайте свой ПИН-код при совершении операций по карте через сайты сети Интернет, при опросах/информировании по телефону, электронной почте и т.д. в том числе лицам, представляющимся сотрудниками Банка. Операции в сети Интернет в защищенном режиме проводятся с использованием одноразовых паролей, которые можно получить в виде SMS-сообщения и/или Push-уведомления на ваше мобильное устройство. SMS-сообщение/Push-уведомление содержит один одноразовый пароль, состоящий из четырех (четырех) цифр.

Вот два способа, которые помогут обезопасить себя от съема данных карты в банкомате злоумышленниками.",1.0,0.9584455823087046,0.9999999999,1.0,0.9478517914946398,0.0212,0.23054058021359788,0.8980862503568808,0.98483425
"Правда ли, что при бронировании гостиницы по карте мне необходимо сообщить все реквизиты карты, включая ПИН-код? Если нет, то что именно требуется сообщить?","[""['При бронировании номера в гостинице по карте Вас попросят сообщить свое имя, номер карты, срок ее действия (иногда, дополнительно — трехзначный код безопасности, напечатанный на обратной стороне карты на полосе для подписи) и срок Вашего пребывания.']""]","Нет, неправда. При бронировании гостиницы по карте не требуется сообщать ПИН-код. Обычно для бронирования запрашивают ваше имя, номер карты, срок ее действия, иногда трехзначный код безопасности (CVV/CVC) с оборотной стороны карты и планируемый срок пребывания.","При бронировании номера в гостинице по карте Вам потребуется сообщить следующие данные: имя, номер карты, срок её действия (иногда дополнительно — трёхзначный код безопасности, напечатанный на обратной стороне карты на полосе для подписи), а также срок Вашего пребывания. ПИН-код сообщать не требуется.",,0.90694652363135,0.9999999999,1.0,0.9531821348122288,0.0856,0.44132859103419075,0.9225737556129188,0.99281293
"Если я из другой страны и у меня нет паспорта РФ, что мне делать?","[""['\\n                     1. Документы и сведения, получаемые в целях идентификации Клиентов-физических лиц, а также в целях обслуживания таких Клиентов в рамках Универсального договора\\n                     1.4. Реквизиты документа, удостоверяющего личность: серия (при наличии) и номер документа, дата выдачи документа, наименование органа, выдавшего документ (при наличии кода подразделения может не устанавливаться), и код подразделения (при наличии).\\n                     1.4.2.для иностранных граждан:\\n                     •паспорт иностранного гражданина;\\n                     •дипломатический паспорт, служебный паспорт, удостоверяющие личность иностранного гражданина.', '.5.Документ, подтверждающий право иностранного гражданина или лица без гражданства на пребывание (проживание) в Российской Федерации (миграционной карты в случае отсутствия иных документов), в случае если наличие таких документов обязательно в соответствии с международными договорами Российской Федерации и законодательством Российской Федерации;Документами, подтверждающими право иностранного гражданина или лица без гражданства на пребывание (проживание) в РФ, являются:\\n                    •миграционная карта в случае отсутствия иных документов;\\n                    •вид на жительство;\\n                    •разрешение на временное проживание;\\n                    •виза;\\n                    •иной документ, подтверждающий в соответствии с международными договорами Российской Федерации и законодательством РФ право иностранного гражданина или лица без гражданства на пребывание (проживание) в РФ.\\n']""]","
                        Если вы из другой страны, то для заключения договора вам неообходимы документы, удостоверяющие Вашу личность. Для иностранных граждан это:
                            •паспорт иностранного гражданина;
                            •дипломатический паспорт, служебный паспорт, удостоверяющие личность иностранного гражданина.
                        Также необходимы документы, подтверждающие право иностранного гражданина (проживание) в Российской Федерации (миграционной карты в случае отсутствия иных документов), в случае если наличие таких документов обязательно в соответствии с международными договорами Российской Федерации и законодательством Российской Федерации;Документами, подтверждающими право иностранного гражданина или лица без гражданства на пребывание (проживание) в РФ, являются:
                            •миграционная карта в случае отсутствия иных документов;
                            •вид на жительство;
                            •разрешение на временное проживание;
                            •виза;
                            •иной документ, подтверждающий в соответствии с международными договорами Российской Федерации и законодательством РФ право иностранного гражданина или лица без гражданства на пребывание (проживание) в РФ. ","Для получения услуг банка Tinkoff, если вы являетесь гражданином другой страны и у вас нет паспорта РФ, вам необходимо предоставить паспорт иностранного гражданина или другие документы, удостоверяющие вашу личность, такие как дипломатический паспорт или служебный паспорт. Обратитесь в отделение банка для получения подробной информации о необходимых документах и процедурах.",,0.0,0.9999999999,0.1666666666666666,0.9069630792263011,0.0,0.24052453802901058,0.8943007182517171,0.980698
В течении скольких дней действительна выписка из ЕГРЮЛ?,"[""['\\n                    2.2. Выписка из Единого государственного реестра юридических лиц (ЕГРЮЛ). Банком может быть принята копия \\n                    выписки, заверенная регистрирующим органом. Выписка считается действительной для предоставления в Банк \\n                    в течение 30 (тридцати) календарных дней с даты ее выдачи и должна содержать актуальные сведения на дату  \\n                    ее предоставления;']""]",Выписка из Единого государственного реестра юридических лиц (ЕГРЮЛ) действительна в течении 30 дней с даты ее выдачи.,Выписка из ЕГРЮЛ действительна в течение 30 календарных дней с даты ее выдачи.,1.0,0.9718079403239008,0.9999999999,0.25,0.9480908907911868,0.2818,0.5476747268645816,0.9303222532030372,0.97988063
Нужно ли ИП указывать свой сайт для предприятия?,"[""['\\n                    3. Документы и сведения, предоставляемые Клиентом-индивидуальным предпринимателем: \\n                    3.5. Сведения о доменном имени, указателе страницы сайта в сети «Интернет», с использованием которых Клиентом \\nоказываются услуги (при наличии);\\n                    ']""]","Да, индивидуальному предпринимателю необходимо указать сведения о доменном имени, указателе страницы сайта в сети «Интернет».","Нет, ИП не обязан указывать свой сайт для предприятия.",,0.0,0.9999999999,0.6666666666666666,0.8869667052897489,0.0,0.0,0.6621598140510931,0.9616013
Может ли Банк запросить дополнительные документы - не из списка обязательных?,"[""['\\n                     26. Банк может запросить у Клиента, а Клиент обязуется предоставить по запросу Банка дополнительные документы \\n                    и сведения, как предусмотренные, так и не предусмотренные настоящим Перечнем, в том числе в целях надлежащей \\n                    идентификации Клиента, его представителя, выгодоприобретателя и бенефициарного владельца в соответствии \\n                    с требованиями действующего законодательства Российской Федерации, нормативных актов Банка России, а также \\n                    требованиями Банка. Банк вправе не запрашивать отдельные документы и сведения, предусмотренные настоящим \\n                    Перечнем, в случаях, установленных внутренними правилами Банка.']""]","Да, Банк может запросить у Вас дополнительные не предусмотренные Перечнем документы.","Да, Банк может запросить у Клиента дополнительные документы, которые не предусмотрены настоящим Перечнем, в том числе в целях надлежащей идентификации Клиента, его представителя, выгодоприобретателя и бенефициарного владельца в соответствии с требованиями действующего законодательства Российской Федерации, нормативных актов Банка России, а также требованиями Банка. Банк вправе не запрашивать отдельные документы и сведения, предусмотренные настоящим Перечнем, в случаях, установленных внутренними правилами Банка.",1.0,0.9623749396773046,0.9999999999,0.25,0.9170610725513588,0.0046,0.35856396361214843,0.794858147673085,0.96000594
Какие документы нужно предоставить физическому лицу для открытия счета?,"[""['1. Документы и сведения, получаемые в целях идентификации Клиентов-физических лиц, а также в целях обслуживания таких Клиентов в рамках Универсального договора']""]","Физическому лицу для открытия счета необходимо предоставить документ, удостоверяющий личность (паспорт или иной документ из списка в п.1.4), документ, подтверждающий регистрацию или место пребывания, ИНН, СНИЛС и контактную информацию.","Для открытия счета физическому лицу необходимо предоставить следующие документы: паспорт гражданина Российской Федерации, СНИЛС (при наличии), ИНН (при наличии).",1.0,0.9911333088310398,0.9999999999,1.0,0.9669060183372972,0.0,0.22095591066337195,0.9045896833363352,0.98114634
Какие документы необходимо предоставить юридическому лицу для открытия счета в Банке? Можно ли предоставить сканы документов или нужны оригиналы?,"[""['2.1. Учредительные документы юридического лица...', '2.2. Выписка из Единого государственного реестра юридических лиц (ЕГРЮЛ)...', '2.3. Документ об избрании единоличного исполнительного органа юридического лица...']""]","Юридическому лицу необходимо предоставить учредительные документы, выписку из ЕГРЮЛ, документ об избрании руководителя, документы, подтверждающие личность руководителя и лиц, имеющих право подписи. Документы можно предоставить в копиях, заверенных нотариально, регистрирующим органом, руководителем или сотрудником Банка при наличии оригиналов.","Для открытия счета в Банке юридическому лицу необходимо предоставить следующие документы:

1. Учредительные документы юридического лица, заверенные регистрирующим органом. Документы предоставляются по требованию. Учредительные документы предоставляются в виде последней актуальной и действующей на дату предоставления в Банк редакции. Если изменения в учредительные документы вносились путем регистрации новой редакции учредительных документов, то предоставляется последняя актуальная редакция. Если изменения в учредительные документы юридического лица внесены и зарегистрированы в виде отдельных листов изменений, то предоставляются действующая редакция с приложением листов изменений, зарегистрированных на дату предоставления документов в Банк, с отметкой о такой регистрации. Учредительные документы и листы изменений к ним должны содержать штамп регистрирующего органа, за исключением случаев, когда предоставлены документы, заверенные аналогом.

2. Сведения и документы, в зависимости от организационно-правовой формы и сведения о договорах о привлечении банковского платежного агента (банковского платежного субагента), о договорах об осуществлении деятельности по приему платежей физических лиц, а также договоры об осуществлении деятельности по приему платежей физических лиц.

3. Документы-основания участия бенефициара или бенефициаров в отношениях по договору номинального счета (договор, шаблон применяемого договора, правила инвестиционной деятельности).

Сканы документов предоставлять можно, но лучше иметь оригиналы.",1.0,0.9495991846748087,0.9999999999,0.0,0.922570171865498,0.0,0.24481594025749553,0.8920681736840056,0.98206013
Можно ли открыть счет индивидуальному предпринимателю – иностранному гражданину? Какие документы для этого нужны?,"[""['3.1. Идентификация индивидуального предпринимателя осуществляется на основании документов и сведений, указанных в пункте 1.4 настоящего Перечня', '3.2. Документ, подтверждающий право иностранного гражданина или лица без гражданства на пребывание (проживание) в Российской Федерации...']""]","Да, индивидуальному предпринимателю-иностранному гражданину можно открыть счет. Для этого нужно предоставить документ, удостоверяющий личность, документ, подтверждающий право пребывания/проживания в РФ (напр. миграционную карту), ИНН, СНИЛС, выписку из ЕГРИП и контактную информацию.","Да, индивидуальный предприниматель – иностранный гражданин может открыть счет в банке Tinkoff. Для этого ему необходимо предоставить следующие документы:

1. Аккредитованные филиалы, представительства иностранных юридических лиц (при необходимости).
2. Свидетельство о постановке на учет в налоговом органе ЮЛ-нерезидента в случаях, предусмотренных законодательством Российской Федерации.
3. Разрешение Национального (Центрального) банка иностранного государства на открытие счета (с заверенным переводом на русский язык), если наличие такого разрешения требуется в соответствии с международными договорами с участием Российской Федерации или законодательством иностранного государства.
4. Документ, подтверждающий полномочия руководителя ЮЛ-нерезидента (единоличного исполнительного органа ЮЛ-нерезидента).
5. Документ, удостоверяющий личность лица (лиц), наделенного (ых) правом подписи и руководителя ЮЛ-нерезидента, а также лица (лиц) уполномоченного (ых) распоряжаться денежными средствами, находящимися на счете ЮЛ-нерезидента, используя аналог собственноручной подписи, представителя ЮЛ-нерезидента, и указанные в пункте 1.4 настоящего.",0.5,0.932356863881458,0.9999999999,1.0,0.9336423726847918,0.0,0.08924488315201204,0.9055721403648858,0.96995133
"Какие документы потребуются, если открывать счет для нотариуса, занимающегося частной практикой? Может ли нотариус быть иностранцем при этом?","[""['5.1. Документ, удостоверяющий личность и указанный в пункте 1.4 настоящего Перечня', '5.2. Документ, подтверждающий наделение нотариуса полномочиями (назначение на должность), выдаваемый органами юстиции субъектов Российской Федерации, в соответствии с законодательством Российской Федерации']""]","Для открытия счета нотариусу, занимающемуся частной практикой, требуется предоставить документ, удостоверяющий личность, документ о назначении на должность нотариуса от органов юстиции, регистрационные документы, финансовые документы и контактные данные. Нотариус может быть иностранцем, в этом случае дополнительно потребуется документ, подтверждающий право на пребывание/проживание в РФ.","Для открытия счета для нотариуса, занимающегося частной практикой, потребуется предоставить следующие документы:

1. Документ, удостоверяющий личность и указанный в пункте 1.4 настоящего Перечня.
2. Документ, подтверждающий наделение нотариуса полномочиями (назначение на должность), выдаваемый органами юстиции субъектов Российской Федерации, в соответствии с законодательством Российской Федерации.
3. Адрес места жительства (регистрации) или места пребывания (если его нельзя установить из документа, удостоверяющего личность, а также если адрес места жительства (регистрации) или места пребывания не совпадают).
4. Контактная информация (например, номер телефона, факса, адрес электронной почты, почтовый адрес (при наличии).

Нотариус может быть иностранцем при этом, однако ему необходимо иметь документ, удостоверяющий личность иностранного гражданина, который соответствует требованиям законодательства Российской Федерации.",,0.9641777408611184,0.9999999999,0.0,0.9707473987908578,0.0,0.26498356059480316,0.9334890411395242,0.9854183
"Как узнать, кто является бенефициарным владельцем юридического лица? Какие документы для этого нужны?","[""['12. Идентификация бенефициарного(ых) владельца(ев) осуществляется на основании следующий документов и сведений...']""]","Для идентификации бенефициарного владельца юридического лица необходимо предоставить документы, удостоверяющие личность бенефициара, документ о регистрации/пребывании в РФ (если бенефициар - иностранец), ИНН, адрес регистрации и контактные данные. Также можно заполнить анкету бенефициарного владельца по форме Банка.","Для того чтобы узнать, кто является бенефициарным владельцем юридического лица, необходимо обратиться к документам, которые были подписаны клиентом при присоединении к условиям Универсального договора. Эти документы содержат информацию о бенефициарных владельцах. Если бенефициарный владелец является иностранным гражданином или лицом без гражданства, то идентификация осуществляется исключительно на основании указанных выше документов.",1.0,0.9646230183270968,0.9999999999,1.0,0.9498465553187776,0.0,0.07457243233306797,0.7465598765173752,0.99253005
Расскажи про термины 'Договор страхования' и 'КАСКО',"[""['1. Термины и определения     \\n                    Договор страхования — договор, по которому одна сторона (Страховщик) обязуется за обусловленную договором \\n                    плату (страховую премию) при наступлении предусмотренного в договоре события (страхового случая) осуществить \\n                    другой стороне (страхователю) или иному лицу, в пользу которого заключен договор (выгодоприобретателю), \\n                    страховое возмещение в пределах определенной договором суммы (страховой суммы).', 'КАСКО — комбинированное страхование транспортных средств и сопутствующих рисков.']""]"," Да, конечно! Договор страхования — это договор, по которому одна сторона (Страховщик) обязуется за обусловленную договором 
                    плату (страховую премию) при наступлении предусмотренного в договоре события (страхового случая) осуществить 
                    другой стороне (страхователю) или иному лицу, в пользу которого заключен договор (выгодоприобретателю), 
                    страховое возмещение в пределах определенной договором суммы (страховой суммы). 
                    КАСКО — это комбинированное страхование транспортных средств и сопутствующих рисков.","Договор страхования - это документ, который заключается между клиентом и страховщиком и определяет условия предоставления страховой защиты. В рамках этого документа клиент оплачивает страховую премию, а страховщик обязуется выплатить страховое возмещение при наступлении страхового случая.

КАСКО - это сокращение от ""Комбинированное страхование автотранспортных средств"". Это вид добровольного страхования, который покрывает риски повреждения или утраты автомобиля в результате различных событий, таких как авария, угон, стихийные бедствия и т.д.",1.0,0.8647460343991359,0.9999999999,0.25,0.954382291836496,0.0,0.26455902337322396,0.9288852324154372,0.9870816
"Какой минимум страховой выплаты мне вернут, если моя страховая сумма = 50 000 долларов?","[' \n                    2.19.   При добровольном страховании непредвиденных расходов путешественников страховая сумма в договоре \n                    страхования может быть установлена в рублях или иностранной валюте в рублевом эквиваленте по официальному \n                    курсу иностранных валют ЦБ РФ на дату заключения Договора страхования, но не менее чем 66,7 руб. за 1 у.е.  при \n                    страховой сумме 30 000 у.е., 57,2 руб. за 1 у.е. при страховой сумме 35 000 у.е., 50 руб. за 1 у.е. при страховой сумме \n                    50 000 у.е., 26,7 руб. за 1 у.е. при страховой сумме 75 000 у.е.']"," 
                    Минимальная страховая выплата, которую вам вернут, если ваша страховая сумма составляет 50 000 долларов, составляет 50 рублей за 1 доллар США. Минимальная выплата составит 2 500 000 рублей.
                    Обратите внимание, что это минимальная выплата, которую вы получите. Фактическая сумма выплаты может варьироваться в зависимости от условий вашего договора.
        ","Извините, но я не могу предоставить конкретную сумму возврата страховой выплаты без знания точных условий вашего договора страхования. Пожалуйста, обратитесь к вашему договору страхования или свяжитесь с вашим банком для получения подробной информации о размере возможного возврата.",,0.0,0.9999999999,0.2,0.8641276867095053,0.0,0.04118393126805236,0.8335695101897088,0.98242056
"При принятии пользовательских соглашений, кому еще попадают мои данные?","[""['\\n                    5. Персональные данные     \\n                        5.1.       Пользователь подтверждает, что с использованием Дистанционных каналов взаимодействия дает Страховщику, \\n                        аффилированным лицам страховщика, Страховому агенту или Страховому брокеру, а также лицам, \\n                        предоставляющим услуги по использованию их информационных возможностей для целей заключения договоров \\n                        страхования, хранения документов, в том числе, облачных сервисов, серверов, программных продуктов, согласие на \\n                        обработку его персональных данных с целью осуществления дистанционного взаимодействия с последними при \\n                        использовании их Сайта и/или сайтов в сети Интернет или при помощи ПО Страховщика и в целях осуществления \\n                        маркетинговых коммуникаций перечисленных лиц с Пользователем.  \\n        ']""]","
                    Согласно пункту 5.1 пользовательского соглашения, ваши персональные данные могут быть переданы следующим сторонам:
                        • Аффилированные лица страховщика
                        • Страховой агент
                        • Страховой брокер
                        • Лица, предоставляющие услуги по использованию их информационных возможностей для целей заключения договоров страхования, хранения документов, в том числе облачных сервисов, серверов, программных продуктов
","Ваши данные могут быть переданы третьим лицам, включая операторов фискальных данных и операторов электронного документооборота, с целью проверки платежеспособности, предложения и/или предоставления продуктов и услуг Банка и его партнеров, а также заключения, исполнения и/или прекращения договоров.",0.5,0.0,0.9999999999,0.5,0.8712164895554687,0.0515,0.11343917512449388,0.8954510746201458,0.99103326
Зачем страховщик ведет аудио и видеозапись при взаимодействии с клиентом? Как долго эти записи хранятся?,"[""['При заключении Договоров страхования, а также при ином обращении Клиента или Пользователя к Страховщику или его представителям Страховщик вправе осуществлять наблюдение, фотографирование, аудио- и видеозапись, включая запись телефонных разговоров, а также копирование и хранение переписок между Пользователем и Страховщиком (его представителями) по электронной почте или в мессенджерах, без дополнительного уведомления Клиента (Пользователя) о такой записи. Клиент соглашается, что Страховщик вправе хранить такие записи в течение 5 (пяти) лет с момента прекращения отношений с Клиентом (Пользователем), с целью улучшения качества обслуживания, исполнения Договора страхования, а также использовать их при проведении любых расследований в связи с Договором страхования.']""]","Страховщик ведет аудио, видеозапись, фотографирование, копирует переписку с клиентом без дополнительного уведомления с целью улучшения качества обслуживания, исполнения договора страхования, а также для использования этих записей при проведении расследований, связанных с договором. Такие записи страховщик вправе хранить в течение 5 лет с момента прекращения отношений с клиентом.",Страховщик может вести аудио и видеозапись при взаимодействии с клиентом с целью улучшения качества обслуживания. Эти записи хранятся в течение 5 лет с момента прекращения отношений между клиентом и страховщиком.,1.0,0.9497594692654356,0.9999999999,1.0,0.977593268833795,0.214,0.4194859788148018,0.9604366383779088,0.9894703
В каких случаях застрахованному могут быть оплачены планируемые расходы по страховому случаю до предоставления подтверждающих документов? Какие ограничения есть по размеру таких выплат?,"[""['По договорам добровольного страхования непредвиденных расходов путешественников по предварительному согласованию со Страховщиком Застрахованному могут оплачиваться планируемые расходы по предусмотренным договором страхования страховым событиям, предусматривающим возмещение расходов на оказание Экстренной или Неотложной амбулаторной и/или стационарной помощи, с условием предоставления Застрахованным документов, подтверждающих такие расходы Страховщику непосредственно после их несения (чеки, платежные документы и пр.). В случае если в результате страхового случая Застрахованным лицом были понесены соответствующие расходы на оказание Экстренной или Неотложной амбулаторной и/или стационарной помощи, в том числе, предварительно согласованные Страховщиком, но не были предоставлены документы, подтверждающие их оплату, Страховщик возмещает расходы в размере не более 200 у.е. (если страховая сумма установлена в валюте, отличной от российского рубля) или 10 000 российских рублей (если страховая сумма установлена в российских рублях), за один страховой случай.']""]","По договорам добровольного страхования непредвиденных расходов путешественников застрахованному могут быть оплачены планируемые расходы по страховым случаям, предусматривающим возмещение расходов на экстренную/неотложную амбулаторную или стационарную помощь, по предварительному согласованию со страховщиком. Условие - предоставление подтверждающих документов сразу после несения расходов. Если документы не предоставлены, то страховщик возмещает расходы в размере не более 200 у.е. (если страховая сумма в валюте) или 10 000 рублей (если в рублях) за один случай.","Застрахованному могут быть оплачены планируемые расходы по страховому случаю до предоставления подтверждающих документов, если это предусмотрено договором страхования. В случае если в результате страхового случая Застрахованным лицом были понесены соответствующие расходы на оказание Экстренной или Неотложной амбулаторной и/или стационарной помощи, в том числе, предварительно согласованные Страховщиком, но не были предоставлены документы, подтверждающие их оплату, Страховщик возмещает расходы в размере не более 200 у.е. (если страховая сумма установлена в валюте, отличной от российского рубля) или 10 000 российских рублей (если страховая сумма установлена в российских рублях), за один страховой случай.",,0.0,0.9999999999,1.0,0.9683659437972938,0.1917,0.43237783407251124,0.9578887153415468,0.9964319
Куда пользователь может направить обращение при возникновении вопросов или спора со страховщиком?,"[""['При возникновении вопросов или спора можно отправить обращение:\\n\\nв АО «Тинькофф Страхование» по почте по адресу: 127287, Российская Федерация, г. Москва, ул. 2-я Хуторская, дом 38А, строение 26, либо путем заполнения соответствующей формы на сайте Страховщика;\\nк финансовому уполномоченному путем регистрации обращения на сайте — finombudsman.ru или по почтовому адресу: 119017, г. Москва, Старомонетный пер., дом 3;\\nво Всероссийский союз страховщиков на сайте — ins-union.ru, приложив к обращению необходимые документы и сведения, либо на почтовый адрес: 115093, г. Москва, ул. Люсиновская, д. 27, стр. 3;\\nв Центральный Банк Российской Федерации (Банк России) через интернет-приемную на официальном сайте — cbr.ru, приложив к обращению необходимые документы и сведения, либо на почтовый адрес: 107016, г. Москва, ул. Неглинная, д. 12.']""]","При возникновении вопросов или спора с АО 'Тинькофф Страхование' пользователь может направить обращение:

 - В АО 'Тинькофф Страхование' по почте или через форму на сайте;
 - Финансовому уполномоченному на сайте finombudsman.ru или почтовым адресом;
 - Во Всероссийский союз страховщиков на сайте ins-union.ru или почтовым адресом;
В Центральный Банк РФ через интернет-приемную на сайте cbr.ru или почтовым адресом.",Пользователь может направить обращение в службу поддержки банка Tinkoff или напрямую к страховщику через официальный сайт или мобильное приложение.,,0.9342080130083148,0.9999999999,1.0,0.9182935959490242,0.0,0.2026938684707531,0.8605564456080026,0.9635791
Где можно ознакомиться с дополнительной информацией и документами о деятельности АО 'Тинькофф Страхование'?,"[""['Дополнительная информация и документы о деятельности Страховщика в соответствии с п. 6.1 Закона РФ от 27.11.1992 N 4015-1 «Об организации страхового дела в Российской Федерации» и п. 2.1.1. «Базового стандарта защиты прав и интересов физических и юридических лиц — получателей финансовых услуг, оказываемых членами саморегулируемых организаций, объединяющих страховые организации» размещены по ссылкам: tinkoffinsurance.ru/about, tinkoffinsurance.ru/about/documents.']""]",Дополнительная информация и документы о деятельности АО 'Тинькофф Страхование' в соответствии с законом 'Об организации страхового дела в РФ' и базовым стандартом защиты прав получателей финансовых услуг размещены на сайте страховщика по ссылкам tinkoffinsurance.ru/about и tinkoffinsurance.ru/about/documents.,"Дополнительную информацию и документы о деятельности АО ""Тинькофф Страхование"" можно найти на сайте Страховщика по ссылке: https://www.tinkoff.ru/insurance/.",,0.99094496838048,0.9999999999,1.0,0.9687197525950052,0.1141,0.2562561457500635,0.9281979532995284,0.9789092
Что означает 'Партия' и вообще 'Слиток' для драгоценных металлов?,"[""['\\n                    Партия — приобретенные Клиентом Слитки в количестве, превышающем 1 (одну) штуку, и подлежащие доставке Клиенту, \\n                    в рамках одной Заявки', ' Слиток — аффинированный драгоценный металл: золото, серебро, платина и палладий в виде слитков (стандартных, \\n                    мерных), соответствующих установленным в Российской Федерации стандартам или международным стандартам качества, \\n                    изготовленных и маркированных организацией, осуществляющей аффинаж драгоценного металла. Слиток в рамках \\n                    предоставления Сервиса доставляется / принимается на хранение в ненарушенной Упаковке с приложением Сертификата-\\n                    ярлыка (при наличии) и Сертификата качества слитка']""]","Давайте разберемся! 
                    Партия — это приобретенные клиентом слитки в количестве, превышающем 1 штуку, и подлежащие доставке клиенту, в рамках одной заявки.
                    Слиток — это аффинированный драгоценный металл: золото, серебро, платина и палладий в виде слитков (стандартных, 
                    мерных), соответствующих установленным в Российской Федерации стандартам или международным стандартам качества, 
                    изготовленных и маркированных организацией, осуществляющей аффинаж драгоценного металла. Слиток в рамках 
                    предоставления Сервиса доставляется / принимается на хранение в ненарушенной Упаковке с приложением Сертификата-
                    ярлыка (при наличии) и Сертификата качества слитка.
        ","""Партия"" и ""Слиток"" в контексте использования их для драгоценных металлов относятся к определенным понятиям, которые описывают конкретные аспекты процесса покупки и продажи этих металлов.

""Партия"" означает количество Слитков, которое превышает одну штуку и подлежит доставке клиенту в рамках одной заявки. Это может включать в себя несколько Слитков, которые клиент приобретает одновременно.

""Слиток"" относится к физическому объекту, который представляет собой определенное количество драгоценного металла, обычно золота или серебра. Он имеет форму бруска или слитка и может быть различных размеров и весов.

В целом, эти термины используются для описания процессов покупки и продажи драгоценных металлов, включая их транспортировку и учет.",1.0,0.9599215775327576,0.9999999999,1.0,0.9245454541294263,0.0301,0.13812100001847205,0.95686124587183,0.99372685
Меня действительно должны фотографировать после полкчения слитка? Какой это пункт в соглашении?,"[""['\\n                    2.13.12. После подтверждения получения Клиентом/Доверенным лицом Слитка Представитель фотографирует Клиента/\\n                    Доверенное лицо с полученным Слитком в ненарушенной заводской упаковке и документом, удостоверяющим личность \\n                    Клиента/Доверенного лица']""]","Да, Вас действительно должнен сфотографировать Представитель в соответсвии с пунктом 2.13.12.","Да, вас должны сфотографировать после получения слитка. Это указано в пункте 2.13.12 Пользовательского соглашения.",,0.8857030795684105,0.9999999999,1.0,0.920157135211321,0.0,0.2716186451929928,0.6601336870928612,0.98248243
Какие условия хранения?,"[""[' \\n                    2.14.9. Условия хранения: температура воздуха от +17 до +25 °С, атмосферное давление от 740 до 760 мм рт. ст., относительная \\n                    влажность воздуха от 30 до 60%']""]","
                    В соответсвии с пунктом 2.14.9. условия хранения слитка слудующие: 
                        - температура воздуха от +17 до +25 °С,
                        - атмосферное давление от 740 до 760 мм рт. ст.,
                        - относительная влажность воздуха от 30 до 60% ","Условия хранения включают температуру воздуха от +17 до +25 °С, атмосферное давление от 740 до 760 мм рт. ст., относительную влажность воздуха от 30 до 60%.",1.0,0.9349077347274076,0.9999999999,0.75,0.9329296520219852,0.4573,0.7876386456756866,0.9093865102834484,0.99093175
Что такое 'Сертификат качества слитка'?,"[""['Сертификат качества слитка — документ о качестве драгоценного металла, содержащий сведения о соответствии драгоценного металла стандартам качества, технические характеристики и параметры Слитка, информацию о химическом составе, произведенный/заверенный предприятием-изготовителем Слитка.']""]","Сертификат качества слитка - это документ, выданный изготовителем слитка драгоценного металла, который содержит информацию о соответствии металла стандартам качества, его технические характеристики, параметры и химический состав.","Сертификат качества слитка - это документ, который содержит информацию о качестве драгоценного металла, включая сведения о соответствии металла стандартам качества, технические характеристики и параметры слитка, а также информацию о химическом составе. Он выдается предприятием-изготовителем слитка и подтверждает его качество.",1.0,0.9645125633714192,0.9999999999,1.0,0.9923504706670296,0.2731,0.6875218272690647,0.9554445909662316,0.9954816
На какой срок выдается эта доверенность? Можно ли ее передоверить другому лицу?,"[""['Датой выдачи доверенности считается дата предоставления Представляемым Банку данных своего представителя. Доверенность выдана сроком на 1 (один) год, полномочия по настоящей доверенности не могут быть передоверены другим лицам.']""]",Доверенность выдается сроком на 1 год. Полномочия по этой доверенности нельзя передоверять другим лицам.,"Из представленного текста невозможно определить конкретный срок действия данной доверенности. Однако, в соответствии с требованиями, установленными действующим законодательством Российской Федерации, доверенность должна содержать прямое указание на необходимые для совершения сделки полномочия представителя и действовать на момент заключения такой сделки. Также, доверенность, заверенная нотариусом и состоящая более чем из одного листа, должна быть прошита, а листы пронумерованы.",0.0,0.0,0.9999999999,1.0,0.8837859414487511,0.0,0.12217610990661551,0.7802438296473412,0.96344805
"Как клиент может получить сертификат качества слитка, который он передал на хранение в банк?","[""['По требованию Клиента Банк предоставляет Клиенту заверенную Банком копию Сертификата качества слитка, переданного на ответственное хранение.']""]","По требованию клиента банк предоставляет ему заверенную копию сертификата качества слитка, который клиент передал на ответственное хранение в банке.","Клиент может запросить заверенную банком копию Сертификата качества слитка, переданного на ответственное хранение, согласно пункту 2.14.3 Правил оказания сервиса «Покупка/продажа слитков драгоценных металлов».",,0.904865005237212,0.9999999999,1.0,0.9521413924405864,0.0,0.2798280652432879,0.8703558703175247,0.9867266
Какие условия хранения слитков в банке? Где их хранят?,"[""['Хранение Банком Слитка Клиента осуществляется в хранилище 5 (Пятого) класса устойчивости к взлому, оборудованном системой видеонаблюдения и охранно-пожарной и тревожной сигнализации с выводом сигнала на пункт централизованной охраны, с осуществлением физической круглосуточной специализированной охраны хранилища.', 'Условия хранения: температура воздуха от +17 до +25 °С, атмосферное давление от 740 до 760 мм рт. ст., относительная влажность воздуха от 30 до 60%.']""]","Слитки хранятся в специальном хранилище 5 класса устойчивости к взлому, оборудованном системами видеонаблюдения, охранно-пожарной и тревожной сигнализацией, а также круглосуточной охраной. Условия хранения: температура +17...+25°С, атмосферное давление 740-760 мм рт.ст., влажность 30-60%.","Слитки в банке Tinkoff хранятся в специальном хранилище 5 класса устойчивости к взлому. Это помещение оборудовано системой видеонаблюдения, охранно-пожарной и тревожной сигнализацией с выводом сигнала на пункт централизованной охраны. Физическая круглосуточная специализированная охрана также обеспечивается для безопасности хранения слитков. Условия хранения включают температуру воздуха от +17 до +25 °C, атмосферное давление от 740 до 760 мм рт. ст. и относительную влажность воздуха от 30 до 60%. Банк имеет право изменить условия и место хранения слитков с письменного согласия клиента, включая получение такого согласия через дистанционное обслуживание.",0.6,0.9435989133876492,0.9999999999,1.0,0.9475881587819472,0.0607,0.3829774893626025,0.9642620999770478,0.98402196
"Можно ли вернуть слиток в банк, если при получении были обнаружены его повреждения? Как это сделать?","[""['В случае обнаружения при приеме Слитка с ответственного хранения от Представителя нарушения целостности заводской упаковки Слитка, несоответствия нанесенной на Слиток маркировки данным, указанным в Сертификате качества слитка и/или Сертификате-ярлыке, отсутствия либо повреждения Сертификата качества слитка и/или Слитка (наличие на поверхности Слитка наплывов / заусенцев / царапин / жировых пятен / посторонних включений) Клиентом/Доверенным лицом и Представителем оформляется в двух экземплярах Рекламационный акт по форме Приложения № 3 к настоящим Правилам, в котором фиксируются указанные выше нарушения / несоответствия / повреждения. В случае наличия указанных выше нарушений / несоответствий / повреждений Слиток вместе с Сертификатом качества слитка и Сертификатом-ярлыком вкладываются Клиентом/Доверенным лицом в порожний сейф-пакет и запечатываются, после чего сейф-пакет помещается в Устройство для перевозки слитка с дальнейшим опломбированием номерной разовой пломбой. Номер сейф-пакета, а также номерной разовой пломбы отражаются в Рекламационном акте.']""]","Да, если при получении слитка с хранения были обнаружены его повреждения или нарушения упаковки, несоответствия маркировки и т.п., то клиент/доверенное лицо вместе с представителем банка оформляют рекламационный акт в двух экземплярах. В этом акте фиксируются все нарушения. После этого слиток вместе с сертификатами запечатывают в новый сейф-пакет и опломбировывают, указав номера на рекламационном акте. Затем слиток возвращается обратно в банк.","Да, клиент может вернуть слиток в банк, если при получении были обнаружены его повреждения. Для этого необходимо оформить рекламационный акт по форме Приложения № 3 к настоящим Правилам, в котором фиксируются указанные нарушения или повреждения. В случае наличия таких нарушений или повреждений слиток вместе с сертификатом качества слитка и сертификатом-ярлыком вкладываются клиентом или доверенным лицом в порожний сейф-пакет и передаются представителю банка.",,0.9638144564965714,0.9999999999,1.0,0.9351996771353108,0.0,0.32713234576413514,0.9529572087138012,0.9941031
Кто может стать доверенным лицом?,"[""['Доверенное лицо — физическое лицо, уполномоченное Клиентом, которому предоставлено право на представление интересов Клиента и осуществление действий от его имени в рамках Сервиса на основании доверенности, оформленной посредством Дистанционного обслуживания в соответствии с п. 5.3 настоящих Правил по форме Приложения № 5 к настоящим Правилам.']""]","Доверенным лицом клиента может стать любое физическое лицо, которому клиент предоставит полномочия представлять его интересы в рамках сервиса покупки/продажи слитков драгоценных металлов. Доверенность на это лицо оформляется клиентом посредством дистанционного обслуживания в банке по форме из Приложения №5 к Правилам.","Доверенным лицом может стать любое физическое лицо, которое соответствует требованиям, установленным действующим законодательством Российской Федерации, и которому клиент доверил свои финансовые операции и права.",,0.9464558646193746,0.9999999999,1.0,0.9309558320035716,0.1102,0.21008507734458862,0.8355755148555396,0.9831956
Можно ли поменять доверенное лицо? Как это сделать?,"[""['Клиент может отменить выданную доверенность путем обращения в Банк посредством Дистанционного обслуживания в любое время, но не позднее одного дня до планируемой даты встречи с представителем Клиента.']""]","Да, клиент может отменить ранее выданную доверенность на доверенное лицо. Для этого он должен обратиться в банк посредством дистанционного обслуживания не позднее чем за 1 день до планируемой даты встречи с действующим доверенным лицом.","Да, возможно изменить доверенное лицо. Для этого необходимо оформить новую доверенность на нового представителя и предоставить ее в банк. Однако, перед этим следует убедиться, что предыдущий представитель выполнил все свои обязательства по доверенности.",,0.984017986707479,0.9999999999,0.0,0.8969822857257777,0.0871,0.1497212193351827,0.8653462590165429,0.9891404
Как происходит покупка слитка банком? Есть ли какие-то особые условия?,"[""['Банк приобретает у Клиента только Слитки, находящиеся на ответственном хранении в Банке.', 'Клиент, обращаясь с Заявкой, подтверждает, что на момент заключения договора купли-продажи Слиток принадлежит на праве собственности Клиенту, не продан, не является предметом залога, не обременен правами третьих лиц, в споре, под арестом и иным запрещением не состоит.']""]","Банк осуществляет покупку слитков драгоценных металлов только у тех клиентов, чьи слитки находятся на ответственном хранении в самом банке. При подаче заявки на продажу слитка клиент должен подтвердить, что на момент продажи слиток принадлежит ему на праве собственности, не продан, не заложен, не арестован и не обременен правами третьих лиц.","Покупка слитка банком происходит следующим образом: Банк приобретает у клиента только слитки, находящиеся на ответственном хранении в банке. Заявки на совершение сделки купли-продажи слитка принимаются банком в рабочие дни в период с 10:00 до 17:00 часов по московскому времени посредством дистанционного обслуживания. Клиент, обращаясь с заявкой, подтверждает, что на момент заключения договора купли-продажи слиток принадлежит ему на праве собственности, не продан, не является предметом залога, не обременен правами третьих лиц, в споре, под арестом и иным запрещением не состоит.",0.6666666666666666,0.9704060783867192,0.9999999999,1.0,0.9528097507882158,0.1663,0.47788456643799077,0.936441987462024,0.99138093
Что такое накопительный счет и как начисляются проценты?,"[""['\\n                    3.1. Начисление процентов на остаток средств по Счету вклада/Накопительному счету производится со дня, следующего \\n                    за днем зачисления денежных средств на Счет вклада/Накопительный счет Клиента, до дня окончания срока Вклада \\n                    (включительно) либо до их списания со Счета вклада/Накопительного счета по иным основаниям.', ' \\n                    3.3. Клиент имеет возможность по согласованию с Банком посредством Дистанционного обслуживания изменить Тарифный \\n                    план Вклада на Тарифный план для мультивалютного Вклада. При смене Тарифного плана изменения в части процентной \\n                    ставки по Счету вклада, изначально открытого в рамках текущего Договора вклада, не распространяются до конца срока \\n                    размещения, установленного предыдущим Тарифным планом. Процентные ставки по валютам, отличным от валюты \\n                    измененного Тарифного плана, устанавливаются новым Тарифным планом.\\n                    3.4. При начислении процентов в расчет принимается величина процентной ставки (в процентах годовых) и фактическое \\n                    количество календарных дней, на которое привлечены денежные средства. При этом за базу берется действительное \\n                    число календарных дней в году (365 или 366 дней соответственно).\\n                    ', ' \\n                    Накопительный счет — счет, на котором учитываются денежные средства Клиента, предусматривающий начисление \\n                    процентов на остаток денежных средств, в соответствии с Договором накопительного счета.']""]","
                    Накопительный счет - это счет, на котором учитываются денежные средства клиента и на который начисляются проценты на остаток денежных средств. Проценты начисляются в соответствии с условиями договора накопительного счета.
                    Проценты на накопительном счете начисляются со дня, следующего за днем зачисления денежных средств на счет, до дня окончания срока вклада (включительно) либо до их списания со счета по другим основаниям.

                    При начислении процентов учитываются:
                    • Величина процентной ставки (в процентах годовых)
                    • Фактическое количество календарных дней, на которое привлечены денежные средства

                    За базу берется действительное число календарных дней в году (365 или 366 дней соответственно).","Накопительный счет - это счет, на котором учитываются денежные средства клиента, предусматривающий начисление процентов на остаток денежных средств, в соответствии с договором накопительного счета. Проценты начисляются на основании общих условий, которые являются неотъемлемой частью настоящих Условий и приложением к ним.",1.0,0.9534691364632104,0.9999999999,0.3333333333333333,0.950733086642378,0.1403,0.42596095405913403,0.9510177833723604,0.99173516
Можно ли открыть вклад в 12 лет?,"[""['1.2. Банк не заключает Договор вклада (Договор накопительного счета) с лицами, не достигшими возраста 14 лет']""]","Нет, Банк не заключает договор вклада с лицами, не достигшими возраста 14 лет.","Нет, согласно условиям договора, банк не заключает договор вклада с лицами, не достигшими 14 лет.",1.0,0.8699459408725504,0.9999999999,1.0,0.9762874560457072,0.537,0.7721927900513825,0.9062168603944531,0.9932811
Могу ли я открыть несколько вкладов и пополнять их?,"[""['\\n                    4.1. Клиент имеет право:\\n                    4.1.1. Предъявить Банку требование о досрочном полном или частичном изъятии Вклада.\\n                    4.1.2. Вносить дополнительные денежные средства во Вклад/Накопительный счет, если данная возможность установлена \\n                    Тарифным планом.\\n                    4.1.3. Разместить несколько Вкладов (открыть несколько Счетов вклада/Накопительных счетов на условиях, устанавливаемых \\n                    Договором вклада (Договором накопительного счета), Тарифами:\\n                    • через Дистанционное обслуживание;\\n                    • в офисе Банка в часы работы операционного подразделения Банка.\\n']""]"," 
                    Да, вы можете открыть несколько вкладов и пополнять их.
                    Согласно пункту 4.1.3 приведенного контекста, клиент имеет право разместить несколько вкладов (открыть несколько счетов вклада/накопительных счетов) на условиях, устанавливаемых договором вклада (договором накопительного счета) и тарифами.
                    Вы можете открыть несколько вкладов как через дистанционное обслуживание, так и в офисе банка в часы работы операционного подразделения банка.","Да, вы можете открыть несколько вкладов и пополнять их. Однако, условия открытия и пополнения могут различаться в зависимости от типа вклада и условий, установленных банком. Пожалуйста, обратитесь к документам, предоставленным выше, чтобы узнать подробности о конкретных условиях вашего банка Tinkoff.",0.6666666666666666,0.9772114991803682,0.9999999999,0.375,0.9091753354511356,0.1548,0.2705041910519094,0.8614739291313372,0.98513335
Для получения страховой выплаты в случае несчастного случая с летальным исходом нужна ли справка из психушки?,"[""['\\n                    6.1. По риску Смерть в результате Несчастного случая должны быть предоставлены следующие документы:\\n                    j. Справка из психоневрологического диспансера и наркологического диспансера']""]","Да, в таком случае необходимы справки из психоневрологического диспансера и наркологического диспансера.","Нет, справка из психбольницы не требуется для получения страховой выплаты в случае несчастного случая с летальным исходом.",,0.0,0.9999999999,0.6666666666666666,0.8489201906617324,0.0,0.08150598686233711,0.8001576719819937,0.9785424
Дают ли кредит на автомобиль?,"[""['3.1. Банк предоставляет Клиенту Кредит на потребительские цели, в том числе на приобретение Товара и/или Автомобиля, в соответствии с законодательством Российской Федерации.']""]","Да, в соответсвии с пунктом 3.1. Банк предоставляет Клиенту Кредит на потребительские цели, , в том числе на приобретение автомобиля.","Да, банк Tinkoff предоставляет кредит на приобретение автомобиля в соответствии с законодательством Российской Федерации.",,0.9238611626302088,0.9999999999,1.0,0.9043180677438086,0.0,0.39894137434994853,0.9191524144983292,0.97422606
Распростроняется ли страховое покрытие на смерть в алкогольном опьянении?,"[""[' \\n                    Страховое покрытие по рискам «Смерть» и «Инвалидность» не распространяется на события, произошедшие в результате \\n                    и/или в период:\\n                    a. действий, совершенных Застрахованным лицом в состоянии алкогольного, наркотического и/или токсического \\n                    опьянения; в результате употребления им наркотических, сильнодействующих лекарственных препаратов \\n                    и психотропных веществ без предписания врача (или по предписанию врача, но с нарушением указанной  \\n                    им дозировки); болезни Застрахованного лица, прямо связанной с наркоманией, токсикоманией, хроническим \\n                    алкоголизмом\\n                    ']""]","Нет, страховое покрытие не распространяется на смерть в алкогольном опьянении.","Нет, страховое покрытие не распространяется на смерть в алкогольном опьянении.",,0.9856761715671896,0.9999999999,0.5,1.0,1.0,1.0000000000000002,1.0,1.0
"Может ли Банк изменить Тарифный план по кредитной карте, и какие условия должны быть соблюдены для этого?","[""['\\n                    Банк вправе в одностороннем порядке изменить Тарифный план, применяемый\\nв рамках Договора, и/или заменить его на другой Тарифный план, в том числе при заключении Договора и/или\\nна определенный период времени по усмотрению Банка, с целью уменьшения процентной ставки по кредиту\\nи/или улучшения иных условий обслуживания при условии, что это не повлечет возникновение новых или увеличение размера существующих денежных обязательств Клиента\\n                    ']""]","Да, Банк может изменить Тарифный план по кредитной карте в одностороннем порядке, но при условии, что это не приведет к возникновению новых или увеличению уже существующих денежных обязательств клиента ","Да, банк Tinkoff имеет право изменить Тарифный план по кредитной карте. Это может произойти в одностороннем порядке, если банк посчитает это необходимым для улучшения условий обслуживания или снижения процентной ставки по кредиту. Однако, любые изменения не должны повлечь за собой возникновение новых или увеличение размера существующих денежных обязательств клиента. Банк также имеет право вернуть клиента к ранее согласованному тарифному плану в любое время.",0.8,0.953422961292238,0.9999999999,1.0,0.9476409399193706,0.0734,0.3933994725037151,0.9630241245601748,0.98375636
Можно ли внести частичное досрочное погашение кредита? И как это повлияет на остаток задолженности?,"[""['«Клиент имеет право досрочно погасить Задолженность с уплатой Банку суммы непогашенного Кредита и начисленных процентов, а также (если применимо) комиссий и плат, предусмотренных Тарифным планом, в любой момент путем зачисления необходимой суммы денежных средств на Картсчет (Счет) и извещения Банка о необходимости проведения досрочного погашения. В случае частичного досрочного погашения уменьшается срок Кредита или сумма Регулярного платежа по выбору Клиента, при этом Клиент не освобождается от оплаты ближайшего Регулярного платежа, а также применимых комиссий и плат, предусмотренных Тарифным планом.», «При обращении Клиента в Банк для совершения частичного досрочного погашения до или в дату оплаты ближайшего Регулярного платежа Клиенту может быть предложено совершить частичное досрочное погашение с погашением ближайшего Регулярного платежа и последующим уменьшением срока Кредита или суммы Регулярного платежа по выбору Клиента.»']""]","Да, Клиент имеет право совершить частичное досрочное погашение кредита. При этом по выбору Клиента уменьшится либо срок кредита, либо сумма регулярного платежа. Однако Клиент не освобождается от оплаты ближайшего регулярного платежа и применимых комиссий.","Да, в банке Tinkoff возможно осуществить частичное досрочное погашение кредита. При частичном досрочном погашении уменьшается срок кредита или сумма регулярного платежа по выбору клиента, однако клиент не освобождается от оплаты ближайшего регулярного платежа, а также применимых комиссий и плат, предусмотренных тарифным планом. При обращении клиента в банк для совершения частичного досрочного погашения до или в дату оплаты ближайшего регулярного платежа клиенту может быть предложено совершить частичное досрочное погашение с погашением ближайшего регулярного платежа и последующим уменьшением срока кредита или суммы регулярного платежа по выбору клиента. При этом к оплате предъявляются только начисленные до даты такого частичного досрочного погашения проценты и сумма непогашенного кредита, входящая в состав ближайшего регулярного платежа, а оплачиваемые совместно с ближайшим регулярным платежом комиссии и платы, предусмотренные тарифным планом, направляются.",,0.9292182804038922,0.9999999999,1.0,0.9459842964176816,0.029,0.544418897294376,0.9389873506638738,0.9847526
Что будет в случае просрочки платежа по кредиту? И какой штраф может быть начислен?,"[""['«В случае неоплаты платежа Клиент должен уплатить штраф за неоплату Минимального платежа согласно Тарифному плану. Банк рассматривает любой поступивший платеж Клиента как признание Клиентом данного штрафа в размере поступившего платежа, но не более суммы штрафа, определенного в соответствии с Тарифами.»']""]","В случае неоплаты минимального платежа по кредиту, Клиент должен уплатить штраф в соответствии с Тарифным планом. Размер штрафа определяется Тарифами, и любой поступивший от Клиента платеж Банк будет рассматривать как оплату штрафа в пределах установленной суммы.","В случае просрочки платежа по кредиту могут применяться различные меры, включая штрафы и пени. Точные условия и размеры штрафов зависят от конкретного кредитного продукта и политики банка. Рекомендую обратиться в банк Tinkoff для получения подробной информации о возможных последствиях просрочки платежа и условиях кредитного договора.",0.6666666666666666,0.0,0.9999999999,1.0,0.8993074820763536,0.0,0.10280613079696958,0.8935944835223805,0.97865796
Можно ли на время приостановить выплаты по кредиту? И как это повлияет на начисление процентов?,"[""['«На основании обращения Клиента и по согласованию с Банком на период от 1 (одного) до 12 (двенадцати) месяцев возможно приостановление обязанности Клиента по погашению Задолженности, по оплате Регулярных платежей и/или иных платежей. В указанный период Банк вправе приостановить начисление процентов и иных сумм, предусмотренных Договором реструктуризации задолженности.»']""]","Да, на основании обращения Клиента и по согласованию с Банком возможно приостановить обязанность по погашению задолженности и оплате платежей на срок от 1 до 12 месяцев. В этот период Банк вправе также приостановить начисление процентов и иных сумм по кредиту.","Да, на основании обращения клиента и по согласованию с банком возможно приостановление обязанности клиента по погашению задолженности, оплате регулярных платежей и/или иных платежей. В этот период банк вправе приостановить начисление процентов и иных сумм, предусмотренных кредитным договором. Оставшийся срок возврата кредита продлевается на согласованный период приостановления обязанности клиента по погашению задолженности, оплате регулярных платежей и/или иных платежей.",,0.924777671777644,0.9999999999,1.0,0.9634774618610192,0.1716,0.5878853365283965,0.946286846788832,0.98807216
Я хочу оформить дополнительную карту на супругу. Как это сделать? И будет ли она иметь доступ к общему лимиту по кредитке?,"[""['«3.2. По заявлению Клиента, переданному в Банк на бумажном носителе или через Дистанционное обслуживание, в рамках Договора кредитной карты Банком может быть выпущена одна или несколько дополнительных Кредитных карт.»', '«3.5. Клиент вправе установить лимит для проведения расходных операций с использованием Кредитной карты.»']""]","Вы можете оформить дополнительную кредитную карту на супругу, подав заявление в банк на бумажном носителе или через дистанционное обслуживание. Дополнительная карта будет иметь доступ к общему лимиту задолженности по вашей основной кредитной карте, однако вы можете установить отдельный лимит для расходных операций по дополнительной карте.","Чтобы оформить дополнительную карту на супругу, необходимо подать заявление на выпуск дополнительной кредитной карты. Это можно сделать через интернет-банк или обратившись в отделение банка. После одобрения заявки, банк выпустит дополнительную карту и предоставит доступ к общему лимиту по кредитке.",1.0,0.9333202068618568,0.9999999999,1.0,0.9647938848001056,0.0976,0.3031131733132017,0.9197741953499808,0.9949317
"А что если я потеряю карту? Сколько у меня есть времени, чтобы ее заблокировать? И как вообще это делается? Через приложение или звонить надо?","[""['«6.1. При обнаружении утери, кражи или порчи Кредитной карты и/или возникновения подозрений, что Кредитная карта или ее реквизиты, а также ПИН-код, QR-код, Коды доступа, Аутентификационные данные, Абонентский номер, Абонентское устройство могли быть утрачены или похищены, а также в случае изъятия Кредитной карты в банкомате или торгово-сервисном предприятии и в случае изменения имени или фамилии Держателя Клиент должен незамедлительно уведомить Банк по телефонам 8 800 555-10-10 или +7 495 645-59-19 (круглосуточно) и заблокировать Кредитную карту и/или Интернет-Банк и/или Мобильный банк, а также подать заявление о досрочном перевыпуске Кредитной карты.»']""]","В случае утери или кражи кредитной карты, вы должны незамедлительно уведомить банк по телефонам горячей линии 8 800 555-10-10 или +7 495 645-59-19 (круглосуточно) и заблокировать карту. Также необходимо подать заявление на досрочный перевыпуск новой карты. Чем быстрее вы заблокируете карту, тем меньше риск несанкционированного использования.","Если вы потеряете карту, вам следует немедленно ее заблокировать. Это можно сделать по телефону, в интернет-банке или в мобильном приложении Банка. Чем раньше вы это сделаете, тем меньше вероятность несанкционированного использования карты злоумышленниками. Разблокировать карту нельзя, можно только перевыпустить. Если вы не уверены, что карту украли, не спешите ее блокировать, установите лимит ""0"" на операции и запретите покупки через Интернет, если карта будет найдена лимиты можно изменить. Напоминаем Вам, что в соответствии с Общими условиями выпуска и обслуживания кредитных карт и Общими условиями открытия, ведения и закрытия счетов физических лиц, а также выпуска и обслуживания расчетных карт Ваша ответственность за дальнейшее использование карты прекращается, после осуществления блокировки, если не станет известно, что незаконное использование карты имело место с вашего согласия. Если карта была у вас украдена на территории РФ, после блокировки карты заявите о случившемся в полицию. При краже карты за границей, заявите в полицию или в консульский отдел посольства Российской Федерации в стране, на территории которой произошла кража. Пожалуйста, сохраняйте копию протокола (квитанцию о заявлении) для последующего предъявления в Банк. Карта изъята в торгово-сервисном предприятии или в учреждении банка. Потребуйте составления акта об изъятии с указанием даты, времени и причины изъятия, а также подписью сотрудника предприятия/банка, изъявшего карту. После этого срочно проинформируйте об изъятии Банк посредством дистанционного обслуживания. Банкомат не вернул карту. Если карта удержана банкоматом, то вам необходимо обратиться в банк посредством дистанционного обслуживания. Если карта удержана банкоматом стороннего банка, то вам необходимо обратиться в банк, обслуживающий банкомат, и, если удержание карты произошло по причине технического сбоя или из-за промедления с извлечением карты из приемного устройства, сообщите об этом банку, который выдал карту.",,0.0,0.9999999999,1.0,0.9280794077309112,0.0,0.20992302680790065,0.8928440928490238,0.9743619
"Прочитал тут у вас про блокировку карточки. А если я её забуду забрать в банкомате, что тогда делать?","[""['«6.1. [...] а также в случае изъятия Кредитной карты в банкомате или торгово-сервисном предприятии и в случае изменения имени или фамилии Держателя Клиент должен незамедлительно уведомить Банк по телефонам 8 800 555-10-10 или +7 495 645-59-19 (круглосуточно) и заблокировать Кредитную карту и/или Интернет-Банк и/или Мобильный банк, а также подать заявление о досрочном перевыпуске Кредитной карты.»']""]","Если вы забыли карту в банкомате, вам необходимо незамедлительно сообщить об этом в банк по телефонам горячей линии 8 800 555-10-10 или +7 495 645-59-19 и заблокировать кредитную карту, а также подать заявление на ее досрочный перевыпуск. Это позволит предотвратить возможное несанкционированное использование забытой карты третьими лицами.","Если Вы забыли забрать карту из банкомата, Вам следует немедленно связаться с банком для получения дальнейших инструкций. Возможно, потребуется предоставить информацию о месте и времени операции, чтобы банк мог помочь Вам вернуть карту.",1.0,0.8931561744609372,0.9999999999,1.0,0.9249704719646176,0.0,0.14313521311775695,0.8206493165616688,0.98880243
"А есть ли какие-то льготные условия, если я захочу приостановить выплаты по кредитке на какое-то время? Например, на ремонт или что-то в этом роде?","[""['«5.15. На основании обращения Клиента и по согласованию с Банком на период от 1 (одного) до 12 (двенадцати) месяцев возможно приостановление обязанности Клиента по погашению Задолженности, по оплате Минимальных платежей, Регулярных платежей и/или иных платежей. В указанный период Банк вправе приостановить начисление процентов и иных сумм, предусмотренных Договором кредитной карты.»']""]","Да, в документе указано, что по обращению клиента и по согласованию с банком возможно приостановление обязанности по погашению задолженности, выплате минимальных и регулярных платежей на срок от 1 до 12 месяцев. В этот период банк также может приостановить начисление процентов и других сумм по кредитной карте. Таким образом, вы можете получить льготный период для ремонта или других нужд, обратившись в банк с соответствующим заявлением.","Да, на основании обращения клиента и по согласованию с банком на период от 1 (одного) до 12 (двенадцати) месяцев возможно приостановление обязанности клиента по погашению задолженности, по оплате минимальных платежей, регулярных платежей и/или иных платежей. В указанный период банк вправе приостановить начисление процентов и иных сумм, предусмотренных договором кредитной карты.",,0.8745243395622578,0.9999999999,1.0,0.9766810204684492,0.1796,0.5116159336892985,0.9687497415103532,0.99544376
Какие процедуры предусмотрены банком для обработки жалоб клиентов?,"[""['Банк имеет установленные процедуры для обработки и рассмотрения жалоб клиентов, включая регистрацию жалобы, ее анализ и предоставление ответа клиенту в установленные сроки.']""]","Банк следует четко установленным процедурам для обработки жалоб клиентов, которые включают регистрацию жалобы, ее тщательный анализ и предоставление ответа клиенту в соответствии с установленными сроками.","Процедуры, предусмотренные банком для обработки жалоб клиентов, включают следующие шаги:

1. Клиент должен обратиться в банк через дистанционное обслуживание и предъявить претензию по оспариваемым операциям.
2. Оператор может задать вопросы, относящиеся к оспариваемым операциям.
3. Клиент должен оформить заявление на отказ от операций и приложить любые документы, которые доказывают, что в определенный момент он не мог совершить эти операции.
4. Банк имеет право отображать информационную, справочную, аналитическую, рекламную и другую информацию в Интернет-банке, Мобильном банке и Мобильных приложениях Банка.
5. Клиент соглашается, что аффилированные лица Банка, являющиеся его партнерами, имеют право предоставлять ему информацию о продуктах и услугах, предлагаемых Банком и/или приобретенных у Банка, включая информацию по заключаемым и/или заключенным с Банком договорам.",1.0,0.9748406088642896,0.9999999999,1.0,0.8976728357561479,0.0035,0.08122654925242645,0.8878199873583444,0.9826962
Что происходит с депозитами в случае смерти?,"[""['В случае смерти клиента банк замораживает депозиты до решения вопросов наследства в соответствии с законодательством.']""]","После смерти клиента банк замораживает все его депозиты и удерживает их до тех пор, пока не будут решены вопросы наследства в соответствии с действующим законодательством.","Если владелец депозита умирает, то его депозит будет закрыт, а проценты пересчитаны в соответствии с условиями договора. Банк также может направить средства наследникам по реквизитам, указанным в заявлении на получение наследства.",1.0,0.9734916844100936,0.9999999999,1.0,0.9156690600841092,0.0,0.09045800804928127,0.9081384942918552,0.9907097
Могу я отказаться от получения уведомлений от банка и как это влияет на его обслуживание?,"[""['Клиенты имеют право отказаться от получения определенных типов уведомлений от банка, однако это может повлиять на их способность получать своевременную информацию о изменениях условий, сбоях в системе или других важных обновлениях.']""]","Клиенты могут отказаться от получения определенных типов уведомлений от банка, но это может привести к тому, что они не будут получать важные обновления и информацию своевременно, что может повлиять на их способность управлять своими счетами и услугами эффективно.","Да, вы можете отказаться от получения уведомлений от банка. Это не повлияет на его обслуживание, так как банк будет продолжать предоставлять услуги в соответствии с условиями вашего договора. Однако, важно понимать, что отказ от получения уведомлений может привести к тому, что вы пропустите важную информацию о ваших финансовых операциях или других услугах, предлагаемых банком. Поэтому рекомендуется ознакомиться с условиями вашего договора и выбрать наиболее подходящий для вас способ получения уведомлений.",1.0,0.9500654389774648,0.9999999999,1.0,0.9422900350279416,0.0636,0.28207354370728693,0.9370627498950976,0.9890451
Как я могу увеличить лимит по своей кредитной карте?,"[""['Для увеличения кредитного лимита клиенты должны подать заявление через мобильное приложение или веб-сайт банка, после чего банк рассмотрит их кредитную историю и текущую финансовую ситуацию.']""]","Чтобы увеличить кредитный лимит, клиентам необходимо подать соответствующее заявление через мобильное приложение или веб-сайт банка. Банк затем оценит их кредитную историю и текущую финансовую ситуацию перед принятием решения.","Для увеличения лимита по вашей кредитной карте необходимо связаться со службой поддержки клиентов банка Tinkoff и запросить эту услугу. Обычно это можно сделать через приложение или сайт банка. Однако, перед тем как подавать заявку на увеличение лимита, убедитесь, что вы полностью понимаете условия использования кредитной карты и можете обеспечить своевременное погашение задолженности.",1.0,0.9495684340754348,0.9999999999,1.0,0.9240022680356924,0.0,0.11440077957645223,0.8234545068880613,0.9873097
"Каковы условия отмены банковской операции, например, перевода средств или платежа?","[""['Клиенты могут отменить определенные банковские операции, если они не были еще обработаны банком. Условия отмены операций установлены в пользовательском соглашении и зависят от типа операции.']""]","Условия отмены банковской операции зависят от того, была ли операция уже обработана банком. Для операций, которые еще не обработаны, клиенты могут инициировать отмену, следуя процедурам, описанным в пользовательском соглашении и в зависимости от типа операции.","Для отмены банковской операции, такой как перевод средств или платеж, необходимо обратиться в банк через дистанционное обслуживание и предъявить претензию по оспариваемым операциям. Оператор может задать вопросы, связанные с оспариваемыми операциями. Затем следует оформить заявление на отказ от операций и приложить документы, подтверждающие невозможность проведения этих операций в определенный момент времени.",1.0,0.9554161737593936,0.9999999999,1.0,0.9129606328465322,0.0,0.12588532539582942,0.8883185035322776,0.9875755
Какие услуги доступны клиентам через Интернет-банк?,"[""['Через Интернет-банк клиенты могут управлять своими счетами, осуществлять платежи и переводы, а также получать детальную информацию о своих финансовых операциях.']""]","Интернет-банк предоставляет клиентам возможности управления их счетами, осуществления платежей и переводов, а также доступ к подробной информации о всех их финансовых операциях.","Через Интернет-банк клиенты могут осуществлять различные операции, такие как просмотр баланса счета, оплата счетов, перевод денег другим клиентам и многое другое. Также через Интернет-банк можно управлять своими лимитами и настройками безопасности.",1.0,0.9576373133455108,0.9999999999,1.0,0.956804094328552,0.0,0.12298461146434339,0.9046401257859776,0.9881166
"Я не пользовалась кредиткой год, но у меня там лежат мои 800 рублей, я могу их как-то вернуть?","['[\'""8. Расторжение Договора кредитной карты\\n                8.1. Банк вправе в любой момент расторгнуть Договор кредитной карты в одностороннем порядке в случаях, предусмотренных \\n                законодательством Российской Федерации, а также:\\n                • в случае если Держатель не пользовался Кредитной картой более, чем 6 (шесть) месяцев при отсутствии \\n                Задолженности по Договору кредитной карты;\\n                В этих случаях Банк блокирует все Кредитные карты/Токены, выпущенные в рамках Договора кредитной карты. Договор \\n                кредитной карты считается расторгнутым со дня формирования Банком Заключительного счета, который направляется \\n                Клиенту. Если в момент расторжения Договора кредитной карты Задолженность Клиента перед Банком отсутствует, Банк \\n                вправе расторгнуть Договор кредитной карты без направления Заключительного счета, информируя Клиента о своем \\n                решении любым способом по усмотрению Банка.\\n                8.5. В случае, если при расторжении Договора кредитной карты в Банке находятся денежные средства Клиента, излишне \\n                перечисленные им при погашении Задолженности, Банк осуществляет возврат таких денежных средств по распоряжению \\n                Клиента почтовым переводом или иным способом, указанном в распоряжении Клиента. При этом Банк вправе удержать \\n                из суммы такого перевода комиссию за перевод денежных средств в размере, предусмотренном Тарифами на услуги \\n                по переводам, платежам и дополнительные услуги с использованием каналов Дистанционного обслуживания.\\n                8.6. В случае неполучения Банком распоряжения Клиента о переводе денежных средств в течение 120 (ста двадцати) дней \\n                со дня обработки Банком последней операции Клиента/Держателя и, если остаток денежных средств не превышает \\n                1000 руб., указанный остаток считается безвозмездно переданным Банку. \\n                В случае неполучения Банком распоряжения Клиента о переводе денежных средств в течение 3 (трех) лет со дня обработки \\n                Банком последней операции Клиента/Держателя указанные денежные средства считаются безвозмездно переданными \\n                Банку.\\n                \']']","Согласно пунуту 8.6 - вы не можете вернуть ваши деньги, так как не дали распоряжение Банку о переводе денежных средств в течение 120 дней.","Да, вы можете вернуть свои деньги, которые остались на вашей кредитной карте Tinkoff. Для этого вам нужно связаться с банком и запросить возврат этих средств. Вы можете сделать это через онлайн-банкинг или позвонив в службу поддержки клиентов. После того как банк подтвердит ваш запрос на возврат, деньги будут переведены на ваш счет в течение нескольких рабочих дней.",,0.9027188037293148,0.9999999999,0.0769230769230769,0.8752307449243282,0.0,0.1669946277621056,0.7983646409216595,0.9799127
