question,contexts,ground_truth,answer,faithfulness,answer_relevancy,context_precision,context_relevancy,answer_similarity,bleu_score,cos-sim-TF-IDF,sim-spacy,cos-sim-BertModel,human
Можно ли не расписываться на карте?,"[""['После получения карты поставьте свою подпись в прямоугольнике, расположенном на оборотной стороне карты. При отсутствии подписи карта может быть не принята к оплате в торгово-сервисном предприятии, а также повышается риск использования карты злоумышленниками в случае ее утраты/кражи.']""]","При отсутствии подписи карта может быть не принята к оплате в торгово-сервисном предприятии, а также повышается риск использования карты злоумышленниками в случае ее утраты/кражи.","Не указано, можно ли не расписываться на карте.",,0.0,0.9999999999,1.0,0.8111009688189361,0.0,0.0770700617587685,0.4450123047022052,0.9621506,0.0
"Мой друг попросил меня дать свою карту для оплаты и потом вернуть, это не опасно?","[""['Никогда не принимайте рекомендации, советы, помощь от третьих лиц при пользовании картой, особенно при снятии наличных денежных средств в банкоматах. В случае возникновения затруднений при совершении операции обратитесь Банк посредством дистанционного обслуживания. Обращайте внимание на расположение банкоматов. Старайтесь не пользоваться банкоматами, расположенными в плохо освещенных и безлюдных местах', 'Не передавайте карту другим лицам, в т.ч. родственникам и знакомым для проведения транзакций. С целью исключения Ваших потерь от несанкционированного использования Вашей карты (копирования информации с Вашей карты для ее дальнейшего мошеннического использования): при совершении операции оплаты с использованием карты никогда не выпускайте Вашу карту из поля зрения и требуйте от обслуживающего Вас лица, чтобы все операции с использованием карты совершались в Вашем присутствии.']""]","Не передавайте карту другим лицам, в т.ч. родственникам и знакомым для проведения транзакций и никогда не принимайте рекомендации, советы, помощь от третьих лиц при пользовании картой, особенно при снятии наличных денежных средств в банкоматах.","Да, использование карты будет безопасным, если следовать простым правилам, таким как подписание карты, обращение с ней бережно, хранение в безопасном месте и не передавать ее другим лицам. Однако, важно также внимательно ознакомиться с разделом ""Что такое ПИН-код и как обеспечить его конфиденциальность"".",,0.8412359829725059,0.9999999999,1.0,0.863961988332365,0.0,0.058044396722295,0.8457904259134753,0.9889613,0.0
Безопасно ли хранить пинкод в заметках в телефоне?,"[""['Категорически запрещается записывать ПИН-код на карте. Постарайтесь не записывать ПИН-код, запомните его. Если же Вы предпочитаете записать свой ПИН-код, никогда не указывайте, что это ПИН-код и не храните документ с записанным ПИН-кодом рядом с картой.']""]","Да, однако не указывайте в названии заметки, что это ПИН-код от Вашей карты.","Нет, не рекомендуется хранить пинкод в заметках в телефоне.",,0.0,0.9999999999,0.0,0.886985558979818,0.0,0.05612175491366,0.5430765055640308,0.971645,0.0
Я потеряла карту,"[""[' Вы потеряли карту или ее украли\\nПрежде всего, как можно быстрее, сообщите о случившемся в Банк посредством дистанционного обслуживания \\nи заблокируйте карту. Заблокировать карту можно по телефону, в интернет-банке или в мобильном приложении Банка. \\nЧем раньше Вы это сделаете, тем меньше вероятность несанкционированного использования карты злоумышленниками. \\nРазблокировать карту нельзя — можно только перевыпустить. Если вы не уверены, что карту украли, не спешите ее \\nблокировать, установите лимит «0» на операции и запретите покупки через Интернет, если карта будет найдена лимиты \\nможно изменить.\\nНапоминаем Вам, что в соответствии с Общими условиями выпуска и обслуживания кредитных карт и Общими \\nусловиями открытия, ведения и закрытия счетов физических лиц, а также выпуска и обслуживания расчетных карт Ваша \\nответственность за дальнейшее использование карты прекращается, после осуществления блокировки, если не станет \\nизвестно, что незаконное использование карты имело место с Вашего согласия.\\nЕсли карта была у Вас украдена на территории РФ, после блокировки карты заявите о случившемся в полицию. При краже \\nкарты за границей, заявите в полицию или в консульский отдел посольства Российской Федерации в стране, на территории \\nкоторой произошла кража. Пожалуйста, сохраняйте копию протокола (квитанцию о заявлении) для последующего \\nпредъявления в Банк.']""]","Если вы не уверены, что карту украли, не спешите ее блокировать, установите лимит «0» на операции и запретите покупки через Интернет, если карта будет найдена лимиты можно изменить. В случае, если вы полагаете, что Вашу карту всё-таки украли, то как можно быстрее, сообщите о случившемся в Банк посредством дистанционного обслуживания и заблокируйте карту. Это возможно сделать по телефону, в интернет-банке или в мобильном приложении Банка.","Если вы потеряли карту, вам следует немедленно заблокировать ее через дистанционное обслуживание и сообщить об этом в Банк. Также обратитесь к своему оператору сотовой связи для блокировки SIM-карты, если у вас есть мобильный телефон, на котором установлено приложение банка. Если у вас возникли претензии по списаниям, отраженным в выписке по карточному счету, обратитесь в банк в сроки, указанные в общих условиях выпуска и обслуживания кредитных карт и общих условиях открытия, ведения и закрытия счетов физических лиц, а также выпуска и обслуживания расчетных карт. Оформите заявление на отказ от операций и приложите документы, которые доказывают, что в определенный момент вы не могли совершить эти операции.",0.5,0.8707339337625811,0.9999999999,0.3,0.9101989357551722,0.0,0.2008967327916083,0.90301598416976,0.99118406,0.5
"Почему при использовании карты важно не расписываться на квитанциях/чеках до того, как вы проверите правильность указанной суммы?","[""['Проверяйте правильность суммы, указанной на платежном чеке. Поставив подпись на платежном чеке, Вы соглашаетесь со списанием указанной на нем суммы с Вашего карточного счета.']""]","Важно проверять правильность суммы перед подписанием квитанции/чека, потому что после подписи вы соглашаетесь с этой суммой, и она будет списана с вашего счета.","Подпись на квитанциях/чеках до проверки правильности указанной суммы может привести к тому, что вы подпишетесь под неправильной суммой. Это может повлечь за собой финансовые потери или другие проблемы. Поэтому важно сначала проверить сумму, а затем уже подписывать квитанцию/чек.",,0.920934461691638,0.9999999999,0.0,0.9541301302329532,0.0,0.0959801718793792,0.860726346229517,0.9868867,0.5
"Что делать, если я потеряла телефон, на котором было установлено мобильное приложение банка?","[""['При утрате Мобильного телефона, используемого с абонентским номером подвижной радиотелефонной связи, на который установлено Мобильное приложение Банка, Вам следует срочно обратиться к своему оператору сотовой связи для блокировки SIM-карты и в Банк посредством дистанционного обслуживания для блокировки доступа в мобильное приложение Банка и удаления данных карты с Мобильного телефона.']""]","Если вы потеряли телефон с установленным мобильным приложением банка, необходимо:

Срочно обратиться к оператору сотовой связи для блокировки SIM-карты.
Обратиться в банк через дистанционное обслуживание для блокировки доступа в мобильное приложение и удаления данных карты с телефона.","Если вы потеряли телефон, на котором было установлено мобильное приложение банка, вам следует немедленно связаться со службой поддержки вашего банка и сообщить им о произошедшем. Они помогут вам заблокировать доступ к вашему счету и предотвратить возможное мошенничество. Также рекомендуется сменить пароль от своего аккаунта в банке и проверить выписку по своему счету на предмет подозрительных транзакций.",1.0,0.9461742843669791,0.9999999999,1.0,0.9328930551192192,0.0,0.0919707945639699,0.7717608400806639,0.98812765,0.5
Можно ли использовать интернет-кафе и другие общедоступные места для совершения операций по карте в интернете? Объясните причину.,"[""['Избегайте осуществления Интернет-операций с использованием карты в местах, где услуги Интернет являются общедоступными, например, в Интернет-кафе.']""]","Нет, не рекомендуется использовать интернет-кафе и другие общедоступные места для совершения операций по карте в интернете. Причина в том, что такие общедоступные сети являются менее безопасными, и есть риск перехвата данных карты злоумышленниками.","Нет, нельзя использовать интернет-кафе и другие общедоступные места для совершения операций по карте в интернете. Это связано с риском компрометации личных данных и финансовых средств клиента. Рекомендуется использовать только надежные и безопасные способы оплаты, такие как домашнее подключение к интернету или использование защищенных мобильных приложений.",1.0,0.9623675057179012,0.9999999999,1.0,0.9568164491977672,0.2703,0.3354797214096927,0.9207741638746246,0.98985064,1.0
"Что делать, если я получил SMS-оповещение о операции по карте, которую я не совершал?","[""['Если Вы уверены, что операция не могла быть совершена Вами, то как можно быстрее сообщите об этом в Банк посредством дистанционного обслуживания и заблокируйте карту.']""]","Если вы получили SMS-оповещение о операции, которую не совершали, нужно как можно быстрее сообщить об этом в банк через дистанционное обслуживание и заблокировать карту.","Проверьте наличие карты. Если карта у Вас, то возможно, данные Вашей карты стали известны третьим лицам. Пожалуйста, учитывайте, что иногда SMS-сообщения могут доставляться с задержкой, поэтому вспомните соответствует ли текст в SMS-сообщении операциям, которые Вы совершили по карте за последнее время. Если Вы уверены, что не совершали данную операцию, то свяжитесь с Банком и оформите претензию.",,0.8663048845119636,0.9999999999,1.0,0.9182480770736752,0.0,0.1202386631095511,0.8209556924924024,0.98076063,1.0
Как обезопасить себя от съема данных карты в банкомате злоумышленниками? Приведи два способа.,"[""['Поэтому, при пользовании банкоматом не ленитесь внимательно осмотреть его и убедиться в отсутствии каких-либо «накладок» и посторонних устройств.', 'Пожалуйста, примите все меры, чтобы вводимый Вами ПИН-код был не заметен для окружающих.']""]","Чтобы обезопасить себя от съема данных карты в банкомате:

Внимательно осматривайте банкомат перед использованием на наличие подозрительных накладок и посторонних устройств.
Прикрывайте рукой клавиатуру при вводе ПИН-кода, чтобы его не могли увидеть окружающие.","Для того чтобы обезопасить себя от съема данных карты в банкомате злоумышленниками, можно следовать следующим двум способам:

1. Обращаться с картой аккуратно и бережно, хранить ее в безопасном месте, не оставлять в автомобиле, номере гостиницы или других местах, где посторонние могут взять карту и скопировать информацию.
2. Никогда не принимать рекомендации, советы или помощь от третьих лиц при использовании карты, особенно при снятии наличных денежных средств в банкоматах. В случае возникновения затруднений при совершении операции следует обратиться в Банк посредством дистанционного обслуживания.",1.0,0.9714790304805794,0.9999999999,1.0,0.9363545013169468,0.0434,0.1821835116946973,0.9267200691918126,0.98520696,0.5
"Правда ли, что при бронировании гостиницы по карте мне необходимо сообщить все реквизиты карты, включая ПИН-код? Если нет, то что именно требуется сообщить?","[""['При бронировании номера в гостинице по карте Вас попросят сообщить свое имя, номер карты, срок ее действия (иногда, дополнительно — трехзначный код безопасности, напечатанный на обратной стороне карты на полосе для подписи) и срок Вашего пребывания.']""]","Нет, неправда. При бронировании гостиницы по карте не требуется сообщать ПИН-код. Обычно для бронирования запрашивают ваше имя, номер карты, срок ее действия, иногда трехзначный код безопасности (CVV/CVC) с оборотной стороны карты и планируемый срок пребывания.","При бронировании гостиницы по карте вам потребуется сообщить следующие реквизиты: ваше имя, номер карты, срок ее действия и, возможно, трехзначный код безопасности, напечатанный на обратной стороне карты на полосе для подписи.",,0.916637377213744,0.9999999999,1.0,0.939711081186933,0.2542,0.4002567209666999,0.890917847872311,0.9934485,1.0
"Если я из другой страны и у меня нет паспорта РФ, что мне делать?","[""['\\n                     1. Документы и сведения, получаемые в целях идентификации Клиентов-физических лиц, а также в целях обслуживания таких Клиентов в рамках Универсального договора\\n                     1.4. Реквизиты документа, удостоверяющего личность: серия (при наличии) и номер документа, дата выдачи документа, наименование органа, выдавшего документ (при наличии кода подразделения может не устанавливаться), и код подразделения (при наличии).\\n                     1.4.2.для иностранных граждан:\\n                     •паспорт иностранного гражданина;\\n                     •дипломатический паспорт, служебный паспорт, удостоверяющие личность иностранного гражданина.', '.5.Документ, подтверждающий право иностранного гражданина или лица без гражданства на пребывание (проживание) в Российской Федерации (миграционной карты в случае отсутствия иных документов), в случае если наличие таких документов обязательно в соответствии с международными договорами Российской Федерации и законодательством Российской Федерации;Документами, подтверждающими право иностранного гражданина или лица без гражданства на пребывание (проживание) в РФ, являются:\\n                    •миграционная карта в случае отсутствия иных документов;\\n                    •вид на жительство;\\n                    •разрешение на временное проживание;\\n                    •виза;\\n                    •иной документ, подтверждающий в соответствии с международными договорами Российской Федерации и законодательством РФ право иностранного гражданина или лица без гражданства на пребывание (проживание) в РФ.\\n']""]","
                        Если вы из другой страны, то для заключения договора вам неообходимы документы, удостоверяющие Вашу личность. Для иностранных граждан это:
                            •паспорт иностранного гражданина;
                            •дипломатический паспорт, служебный паспорт, удостоверяющие личность иностранного гражданина.
                        Также необходимы документы, подтверждающие право иностранного гражданина (проживание) в Российской Федерации (миграционной карты в случае отсутствия иных документов), в случае если наличие таких документов обязательно в соответствии с международными договорами Российской Федерации и законодательством Российской Федерации;Документами, подтверждающими право иностранного гражданина или лица без гражданства на пребывание (проживание) в РФ, являются:
                            •миграционная карта в случае отсутствия иных документов;
                            •вид на жительство;
                            •разрешение на временное проживание;
                            •виза;
                            •иной документ, подтверждающий в соответствии с международными договорами Российской Федерации и законодательством РФ право иностранного гражданина или лица без гражданства на пребывание (проживание) в РФ. ","Если вы являетесь лицом без гражданства и находитесь в России, вам следует обратиться к соответствующим органам для получения документа, удостоверяющего вашу личность. В тексте упоминаются различные документы, которые могут быть признаны в качестве такого документа, включая разрешение на временное проживание, вид на жительство, удостоверение беженца и другие. Вам следует связаться с миграционной службой или другими компетентными органами для получения дополнительной информации и помощи.",1.0,0.0,0.9999999999,0.1666666666666666,0.9362813727272564,0.0,0.1695165951574498,0.8540229340323396,0.985457,0.0
В течении скольких дней действительна выписка из ЕГРЮЛ?,"[""['\\n                    2.2. Выписка из Единого государственного реестра юридических лиц (ЕГРЮЛ). Банком может быть принята копия \\n                    выписки, заверенная регистрирующим органом. Выписка считается действительной для предоставления в Банк \\n                    в течение 30 (тридцати) календарных дней с даты ее выдачи и должна содержать актуальные сведения на дату  \\n                    ее предоставления;']""]",Выписка из Единого государственного реестра юридических лиц (ЕГРЮЛ) действительна в течении 30 дней с даты ее выдачи.,Выписка из ЕГРЮЛ действительна в течение 30 календарных дней с даты ее выдачи.,1.0,0.9686300963169532,0.9999999999,0.25,0.9478726531535624,0.2818,0.5476747268645816,0.9303222532030372,0.97988063,1.0
Нужно ли ИП указывать свой сайт для предприятия?,"[""['\\n                    3. Документы и сведения, предоставляемые Клиентом-индивидуальным предпринимателем: \\n                    3.5. Сведения о доменном имени, указателе страницы сайта в сети «Интернет», с использованием которых Клиентом \\nоказываются услуги (при наличии);\\n                    ']""]","Да, индивидуальному предпринимателю необходимо указать сведения о доменном имени, указателе страницы сайта в сети «Интернет».","Да, ИП должен указывать свой сайт для предприятия.",0.0,0.954504893600419,0.9999999999,0.6666666666666666,0.9293778285795772,0.0,0.0522498535000081,0.6710369124023698,0.95705885,1.0
Может ли Банк запросить дополнительные документы - не из списка обязательных?,"[""['\\n                     26. Банк может запросить у Клиента, а Клиент обязуется предоставить по запросу Банка дополнительные документы \\n                    и сведения, как предусмотренные, так и не предусмотренные настоящим Перечнем, в том числе в целях надлежащей \\n                    идентификации Клиента, его представителя, выгодоприобретателя и бенефициарного владельца в соответствии \\n                    с требованиями действующего законодательства Российской Федерации, нормативных актов Банка России, а также \\n                    требованиями Банка. Банк вправе не запрашивать отдельные документы и сведения, предусмотренные настоящим \\n                    Перечнем, в случаях, установленных внутренними правилами Банка.']""]","Да, Банк может запросить у Вас дополнительные не предусмотренные Перечнем документы.","Да, Банк имеет право дополнительно запросить оборотно-сальдовую ведомость по всем счетам бухгалтерского учета и/или регистры бухгалтерского учета.",,0.962073292103936,0.9999999999,0.25,0.9083553520082734,0.0,0.1148731113070459,0.6234334224396875,0.97556144,1.0
Какие документы нужно предоставить физическому лицу для открытия счета?,"[""['1. Документы и сведения, получаемые в целях идентификации Клиентов-физических лиц, а также в целях обслуживания таких Клиентов в рамках Универсального договора']""]","Физическому лицу для открытия счета необходимо предоставить документ, удостоверяющий личность (паспорт или иной документ из списка в п.1.4), документ, подтверждающий регистрацию или место пребывания, ИНН, СНИЛС и контактную информацию.","Для открытия счета физическому лицу необходимо предоставить следующие документы:
- Документы, указанные в Перечне, в зависимости от соответствующей категории Клиента (физическое лицо, юридическое лицо и т.п.).
- Договор, на основании которого осуществляется доверительное управление.",,0.9911413762475206,0.9999999999,1.0,0.9445031962922276,0.0,0.120016741648387,0.9016171718819584,0.9814241,0.0
Какие документы необходимо предоставить юридическому лицу для открытия счета в Банке? Можно ли предоставить сканы документов или нужны оригиналы?,"[""['2.1. Учредительные документы юридического лица...', '2.2. Выписка из Единого государственного реестра юридических лиц (ЕГРЮЛ)...', '2.3. Документ об избрании единоличного исполнительного органа юридического лица...']""]","Юридическому лицу необходимо предоставить учредительные документы, выписку из ЕГРЮЛ, документ об избрании руководителя, документы, подтверждающие личность руководителя и лиц, имеющих право подписи. Документы можно предоставить в копиях, заверенных нотариально, регистрирующим органом, руководителем или сотрудником Банка при наличии оригиналов.","Для открытия счета в Банке юридическому лицу необходимо предоставить следующие документы:
- Учредительные документы юридического лица: Устав юридического лица и/или Учредительный договор. Банк может принять копии этих документов, заверенные регистрирующим органом.
- Выписку из Единого государственного реестра юридических лиц (ЕГРЮЛ). Банк может принять копию выписки, заверенную регистрирующим органом.
Оригиналы документов не требуются, достаточно предоставить их копии, заверенные соответствующими органами.",1.0,0.9497144929489229,0.9999999999,0.0,0.9519063392702986,0.0,0.242236614518861,0.9180556960489996,0.9881759,0.5
Можно ли открыть счет индивидуальному предпринимателю – иностранному гражданину? Какие документы для этого нужны?,"[""['3.1. Идентификация индивидуального предпринимателя осуществляется на основании документов и сведений, указанных в пункте 1.4 настоящего Перечня', '3.2. Документ, подтверждающий право иностранного гражданина или лица без гражданства на пребывание (проживание) в Российской Федерации...']""]","Да, индивидуальному предпринимателю-иностранному гражданину можно открыть счет. Для этого нужно предоставить документ, удостоверяющий личность, документ, подтверждающий право пребывания/проживания в РФ (напр. миграционную карту), ИНН, СНИЛС, выписку из ЕГРИП и контактную информацию.","Да, согласно представленному контексту, индивидуальный предприниматель – иностранный гражданин может открыть счет в банке Российской Федерации. Для этого ему необходимо предоставить следующие документы: разрешение Национального (Центрального) банка иностранного государства на открытие счета (с заверенным переводом на русский язык), если такое разрешение требуется в соответствии с международными договорами с участием Российской Федерации или законодательством иностранного государства; документ, подтверждающий полномочия руководителя ЮЛ-нерезидента (единоличного исполнительного органа ЮЛ-нерезидента); документ, удостоверяющий личность лица (лиц), наделенного (ых) правом подписи и руководителя ЮЛ-нерезидента, а также лица (лиц) уполномоченного (ых) распоряжаться денежными средствами, находящимися на счете ЮЛ-нерезидента, используя аналог собственноручной подписи, представителя ЮЛ-нерезидента, и указанные в пункте 1.4 настоящего Перечня. Иностранные граждане или лица без гражданства, являющиеся представителями ЮЛ-нерезидента, предоставляют копию документа, подтверждающего право такого лица на пребывание (проживание) в Российской Федерации (миграционной карты в случае отсутствия иных документов), в случае если наличие таких документов обязательно в соответствии с международными договорами Российской Федерации и законодательством Российской Федерации.",,0.942691083190578,0.9999999999,1.0,0.9423279283868408,0.0,0.0818964907653699,0.8975744183875073,0.9696982,0.5
"Какие документы потребуются, если открывать счет для нотариуса, занимающегося частной практикой? Может ли нотариус быть иностранцем при этом?","[""['5.1. Документ, удостоверяющий личность и указанный в пункте 1.4 настоящего Перечня', '5.2. Документ, подтверждающий наделение нотариуса полномочиями (назначение на должность), выдаваемый органами юстиции субъектов Российской Федерации, в соответствии с законодательством Российской Федерации']""]","Для открытия счета нотариусу, занимающемуся частной практикой, требуется предоставить документ, удостоверяющий личность, документ о назначении на должность нотариуса от органов юстиции, регистрационные документы, финансовые документы и контактные данные. Нотариус может быть иностранцем, в этом случае дополнительно потребуется документ, подтверждающий право на пребывание/проживание в РФ.","Для открытия счета нотариусу, занимающемуся частной практикой, потребуется предоставить следующие документы:
   - Документ, удостоверяющий личность и указанный в пункте 1.4 настоящего Перечня;
   - Документ, подтверждающий наделение нотариуса полномочиями (назначение на должность), выдаваемый органами юстиции субъектов Российской Федерации, в соответствии с законодательством Российской Федерации;
   - Адрес места жительства (регистрации) или места пребывания (если его нельзя установить из документа, удостоверяющего личность, а также если адрес места жительства (регистрации) или места пребывания не совпадают);
   - Контактная информация (например, номер телефона, факса, адрес электронной почты, почтовый адрес (при наличии);
   - Выписка из ЕГРИП. Банком может быть принята копия выписки, заверенная регистрирующим органом. Выписка считается действительной для предоставления в Банк в течение 30 (тридцати) календарных дней с даты ее выдачи и должна содержать актуальные сведения на дату ее предоставления;
   - Информация о страховом номере индивидуального лицевого счета застрахованного лица в системе обязательного пенсионного страхования (при необходимости);
   - Сведения о целях установления и предполагаемом характере деловых отношений с Банком, сведения о целях финансово-хозяйственной деятельности (по форме Банка). Сведения о целях установления и предполагаемом характере деловых отношений с Банком, а также сведения о целях финансово-хозяйственной деятельности клиента устанавливаются однократно при приеме Клиента на обслуживание и обновляются при возникновении сомнений в их достоверности.

Ответ на второй вопрос: Да, нотариус может быть иностранцем при открытии счета.",0.6666666666666666,0.9242301867924516,0.9999999999,1.0,0.951314390130774,0.0043,0.2067392842034322,0.9275864290263992,0.9870274,1.0
"Как узнать, кто является бенефициарным владельцем юридического лица? Какие документы для этого нужны?","[""['12. Идентификация бенефициарного(ых) владельца(ев) осуществляется на основании следующий документов и сведений...']""]","Для идентификации бенефициарного владельца юридического лица необходимо предоставить документы, удостоверяющие личность бенефициара, документ о регистрации/пребывании в РФ (если бенефициар - иностранец), ИНН, адрес регистрации и контактные данные. Также можно заполнить анкету бенефициарного владельца по форме Банка.","Для того чтобы узнать, кто является бенефициарным владельцем юридического лица, необходимо предоставить следующие документы и сведения:
- Документы, удостоверяющие личность и указанные в пункте 1.4 настоящего Перечня;
- В отношении физического лица, которое является иностранными гражданами или лицами без гражданства – документ, подтверждающий право иностранного гражданина или лица без гражданства на пребывание (проживание) в Российской Федерации (миграционной карты в случае отсутствия иных документов), в случае если наличие таких документов обязательно в соответствии с международными договорами Российской Федерации и законодательством Российской Федерации, и указанные в пункте 1.5 настоящего Перечня;
- Сведения об идентификационном номере налогоплательщика (при наличии);
- Адрес места жительства (регистрации) или места пребывания (если его нельзя установить из документа, удостоверяющего личность, а также если адрес места жительства (регистрации) или места пребывания не совпадают);
- Контактная информация (например, номер телефона, факса, адрес электронной почты, почтовый адрес (при наличии).
Идентификация бенефициарных владельцев может осуществляться на основании Анкеты физического лица – бенефициарного владельца по форме Банка, подписанной Клиентом (в том числе при наличии бенефициарного владельца, отличного от Клиента-физического лица).",1.0,0.9378680521164064,0.9999999999,1.0,0.9676002580860608,0.0028,0.248484602908461,0.8510229756856432,0.9858975,0.5
Расскажи про термины 'Договор страхования' и 'КАСКО',"[""['1. Термины и определения     \\n                    Договор страхования — договор, по которому одна сторона (Страховщик) обязуется за обусловленную договором \\n                    плату (страховую премию) при наступлении предусмотренного в договоре события (страхового случая) осуществить \\n                    другой стороне (страхователю) или иному лицу, в пользу которого заключен договор (выгодоприобретателю), \\n                    страховое возмещение в пределах определенной договором суммы (страховой суммы).', 'КАСКО — комбинированное страхование транспортных средств и сопутствующих рисков.']""]"," Да, конечно! Договор страхования — это договор, по которому одна сторона (Страховщик) обязуется за обусловленную договором 
                    плату (страховую премию) при наступлении предусмотренного в договоре события (страхового случая) осуществить 
                    другой стороне (страхователю) или иному лицу, в пользу которого заключен договор (выгодоприобретателю), 
                    страховое возмещение в пределах определенной договором суммы (страховой суммы). 
                    КАСКО — это комбинированное страхование транспортных средств и сопутствующих рисков.","Договор страхования - это соглашение между страхователем и страховщиком, в котором определяются условия и размер выплаты страхового возмещения при наступлении страхового случая. В контексте данного текста, речь идет о договоре ОСАГО и договоре КАСКО. ОСАГО - это обязательное страхование гражданской ответственности владельцев транспортных средств, а КАСКО - это добровольное страхование автомобиля от различных рисков, включая угон и повреждение.",0.6666666666666666,0.8755394039251868,0.9999999999,0.25,0.9379796627785896,0.0,0.2438560232788696,0.875033437695285,0.9860011,0.5
"Какой минимум страховой выплаты мне вернут, если моя страховая сумма = 50 000 долларов?","[' \n                    2.19.   При добровольном страховании непредвиденных расходов путешественников страховая сумма в договоре \n                    страхования может быть установлена в рублях или иностранной валюте в рублевом эквиваленте по официальному \n                    курсу иностранных валют ЦБ РФ на дату заключения Договора страхования, но не менее чем 66,7 руб. за 1 у.е.  при \n                    страховой сумме 30 000 у.е., 57,2 руб. за 1 у.е. при страховой сумме 35 000 у.е., 50 руб. за 1 у.е. при страховой сумме \n                    50 000 у.е., 26,7 руб. за 1 у.е. при страховой сумме 75 000 у.е.']"," 
                    Минимальная страховая выплата, которую вам вернут, если ваша страховая сумма составляет 50 000 долларов, составляет 50 рублей за 1 доллар США. Минимальная выплата составит 2 500 000 рублей.
                    Обратите внимание, что это минимальная выплата, которую вы получите. Фактическая сумма выплаты может варьироваться в зависимости от условий вашего договора.
        ",Я не знаю ответа на этот вопрос.,,0.0,0.9999999999,0.2,0.7529135574316259,0.0,0.0,0.7053536494303466,0.8882435,0.0
"При принятии пользовательских соглашений, кому еще попадают мои данные?","[""['\\n                    5. Персональные данные     \\n                        5.1.       Пользователь подтверждает, что с использованием Дистанционных каналов взаимодействия дает Страховщику, \\n                        аффилированным лицам страховщика, Страховому агенту или Страховому брокеру, а также лицам, \\n                        предоставляющим услуги по использованию их информационных возможностей для целей заключения договоров \\n                        страхования, хранения документов, в том числе, облачных сервисов, серверов, программных продуктов, согласие на \\n                        обработку его персональных данных с целью осуществления дистанционного взаимодействия с последними при \\n                        использовании их Сайта и/или сайтов в сети Интернет или при помощи ПО Страховщика и в целях осуществления \\n                        маркетинговых коммуникаций перечисленных лиц с Пользователем.  \\n        ']""]","
                    Согласно пункту 5.1 пользовательского соглашения, ваши персональные данные могут быть переданы следующим сторонам:
                        • Аффилированные лица страховщика
                        • Страховой агент
                        • Страховой брокер
                        • Лица, предоставляющие услуги по использованию их информационных возможностей для целей заключения договоров страхования, хранения документов, в том числе облачных сервисов, серверов, программных продуктов
","Мои данные могут попасть другим лицам, включая Банк и его аффилированные лица, которые являются партнерами Банка. Они могут обмениваться информацией о клиенте для целей обслуживания клиента, включая договоры, заключенные или заключаемые клиентом с Банком и указанными лицами.",1.0,0.0,0.9999999999,0.25,0.8811074518909765,0.0,0.1114562481521564,0.7252403434042397,0.982407,0.5
Зачем страховщик ведет аудио и видеозапись при взаимодействии с клиентом? Как долго эти записи хранятся?,"[""['При заключении Договоров страхования, а также при ином обращении Клиента или Пользователя к Страховщику или его представителям Страховщик вправе осуществлять наблюдение, фотографирование, аудио- и видеозапись, включая запись телефонных разговоров, а также копирование и хранение переписок между Пользователем и Страховщиком (его представителями) по электронной почте или в мессенджерах, без дополнительного уведомления Клиента (Пользователя) о такой записи. Клиент соглашается, что Страховщик вправе хранить такие записи в течение 5 (пяти) лет с момента прекращения отношений с Клиентом (Пользователем), с целью улучшения качества обслуживания, исполнения Договора страхования, а также использовать их при проведении любых расследований в связи с Договором страхования.']""]","Страховщик ведет аудио, видеозапись, фотографирование, копирует переписку с клиентом без дополнительного уведомления с целью улучшения качества обслуживания, исполнения договора страхования, а также для использования этих записей при проведении расследований, связанных с договором. Такие записи страховщик вправе хранить в течение 5 лет с момента прекращения отношений с клиентом.",Страховщик ведет аудио и видеозапись при взаимодействии с клиентом для улучшения качества обслуживания и разрешения возможных споров или претензий. Эти записи хранятся в течение 5 лет после прекращения отношений со страхователем.,1.0,0.9375101110160924,0.9999999999,1.0,0.9771243988369358,0.0837,0.3493898905422456,0.966309257121466,0.9905711,1.0
В каких случаях застрахованному могут быть оплачены планируемые расходы по страховому случаю до предоставления подтверждающих документов? Какие ограничения есть по размеру таких выплат?,"[""['По договорам добровольного страхования непредвиденных расходов путешественников по предварительному согласованию со Страховщиком Застрахованному могут оплачиваться планируемые расходы по предусмотренным договором страхования страховым событиям, предусматривающим возмещение расходов на оказание Экстренной или Неотложной амбулаторной и/или стационарной помощи, с условием предоставления Застрахованным документов, подтверждающих такие расходы Страховщику непосредственно после их несения (чеки, платежные документы и пр.). В случае если в результате страхового случая Застрахованным лицом были понесены соответствующие расходы на оказание Экстренной или Неотложной амбулаторной и/или стационарной помощи, в том числе, предварительно согласованные Страховщиком, но не были предоставлены документы, подтверждающие их оплату, Страховщик возмещает расходы в размере не более 200 у.е. (если страховая сумма установлена в валюте, отличной от российского рубля) или 10 000 российских рублей (если страховая сумма установлена в российских рублях), за один страховой случай.']""]","По договорам добровольного страхования непредвиденных расходов путешественников застрахованному могут быть оплачены планируемые расходы по страховым случаям, предусматривающим возмещение расходов на экстренную/неотложную амбулаторную или стационарную помощь, по предварительному согласованию со страховщиком. Условие - предоставление подтверждающих документов сразу после несения расходов. Если документы не предоставлены, то страховщик возмещает расходы в размере не более 200 у.е. (если страховая сумма в валюте) или 10 000 рублей (если в рублях) за один случай.",Я не знаю ответа на этот вопрос.,,0.0,0.9999999999,1.0,0.7790729460697026,0.0,0.0733486482633335,0.7263623919939729,0.8735191,0.0
Куда пользователь может направить обращение при возникновении вопросов или спора со страховщиком?,"[""['При возникновении вопросов или спора можно отправить обращение:\\n\\nв АО «Тинькофф Страхование» по почте по адресу: 127287, Российская Федерация, г. Москва, ул. 2-я Хуторская, дом 38А, строение 26, либо путем заполнения соответствующей формы на сайте Страховщика;\\nк финансовому уполномоченному путем регистрации обращения на сайте — finombudsman.ru или по почтовому адресу: 119017, г. Москва, Старомонетный пер., дом 3;\\nво Всероссийский союз страховщиков на сайте — ins-union.ru, приложив к обращению необходимые документы и сведения, либо на почтовый адрес: 115093, г. Москва, ул. Люсиновская, д. 27, стр. 3;\\nв Центральный Банк Российской Федерации (Банк России) через интернет-приемную на официальном сайте — cbr.ru, приложив к обращению необходимые документы и сведения, либо на почтовый адрес: 107016, г. Москва, ул. Неглинная, д. 12.']""]","При возникновении вопросов или спора с АО 'Тинькофф Страхование' пользователь может направить обращение:

 - В АО 'Тинькофф Страхование' по почте или через форму на сайте;
 - Финансовому уполномоченному на сайте finombudsman.ru или почтовым адресом;
 - Во Всероссийский союз страховщиков на сайте ins-union.ru или почтовым адресом;
В Центральный Банк РФ через интернет-приемную на сайте cbr.ru или почтовым адресом.","Пользователь может направить обращение при возникновении вопросов или спора со страховщиком через официальный Сайт Страховщика, его страхового агента, страхового брокера в информационно-телекоммуникационной сети ""Интернет"" или мобильные приложения Страховщика, страхового агента, страхового брокера, а также аффилированных лиц Страховщика (Дистанционные каналы взаимодействия).",0.2857142857142857,0.9791878990095318,0.9999999999,1.0,0.9157631142343288,0.051,0.1370798331629956,0.9062800226685328,0.9830452,0.0
Где можно ознакомиться с дополнительной информацией и документами о деятельности АО 'Тинькофф Страхование'?,"[""['Дополнительная информация и документы о деятельности Страховщика в соответствии с п. 6.1 Закона РФ от 27.11.1992 N 4015-1 «Об организации страхового дела в Российской Федерации» и п. 2.1.1. «Базового стандарта защиты прав и интересов физических и юридических лиц — получателей финансовых услуг, оказываемых членами саморегулируемых организаций, объединяющих страховые организации» размещены по ссылкам: tinkoffinsurance.ru/about, tinkoffinsurance.ru/about/documents.']""]",Дополнительная информация и документы о деятельности АО 'Тинькофф Страхование' в соответствии с законом 'Об организации страхового дела в РФ' и базовым стандартом защиты прав получателей финансовых услуг размещены на сайте страховщика по ссылкам tinkoffinsurance.ru/about и tinkoffinsurance.ru/about/documents.,Дополнительную информацию и документы о деятельности АО 'Тинькофф Страхование' можно найти на официальном сайте компании.,,0.9912383201457676,0.9999999999,1.0,0.9507005538995924,0.1663,0.1897549141304679,0.907349198071736,0.979832,0.5
Что означает 'Партия' и вообще 'Слиток' для драгоценных металлов?,"[""['\\n                    Партия — приобретенные Клиентом Слитки в количестве, превышающем 1 (одну) штуку, и подлежащие доставке Клиенту, \\n                    в рамках одной Заявки', ' Слиток — аффинированный драгоценный металл: золото, серебро, платина и палладий в виде слитков (стандартных, \\n                    мерных), соответствующих установленным в Российской Федерации стандартам или международным стандартам качества, \\n                    изготовленных и маркированных организацией, осуществляющей аффинаж драгоценного металла. Слиток в рамках \\n                    предоставления Сервиса доставляется / принимается на хранение в ненарушенной Упаковке с приложением Сертификата-\\n                    ярлыка (при наличии) и Сертификата качества слитка']""]","Давайте разберемся! 
                    Партия — это приобретенные клиентом слитки в количестве, превышающем 1 штуку, и подлежащие доставке клиенту, в рамках одной заявки.
                    Слиток — это аффинированный драгоценный металл: золото, серебро, платина и палладий в виде слитков (стандартных, 
                    мерных), соответствующих установленным в Российской Федерации стандартам или международным стандартам качества, 
                    изготовленных и маркированных организацией, осуществляющей аффинаж драгоценного металла. Слиток в рамках 
                    предоставления Сервиса доставляется / принимается на хранение в ненарушенной Упаковке с приложением Сертификата-
                    ярлыка (при наличии) и Сертификата качества слитка.
        ","Партия - это приобретенные Клиентом Слитки в количестве, превышающем 1 штуку, и подлежащие доставке Клиенту, в рамках одной Заявки. Слиток - это физический объект драгоценного металла, который может быть представлен в виде слитка или монеты. Сертификат-ярлык - это документ, вложенный внутрь заводской упаковки Слитка, содержащий основные сведения о Слитке - номере (шифре) Слитка, соответствии драгоценного металла стандартам качества, лигатурной массе, пробе драгоценного металла, дате выпуска, произведенный/заверенный предприятием-изготовителем Слитка. Сертификат качества слитка - это документ о качестве драгоценного металла, содержащий сведения о соответствии драгоценного металла стандартам качества, технические характеристики и параметры Слитка, информацию о химическом составе, произведенный/заверенный предприятием-изготовителем Слитка.",1.0,0.8679174669468654,0.9999999999,1.0,0.9356292356142764,0.1024,0.3044563690923861,0.9733204529831502,0.99447334,1.0
Меня действительно должны фотографировать после полкчения слитка? Какой это пункт в соглашении?,"[""['\\n                    2.13.12. После подтверждения получения Клиентом/Доверенным лицом Слитка Представитель фотографирует Клиента/\\n                    Доверенное лицо с полученным Слитком в ненарушенной заводской упаковке и документом, удостоверяющим личность \\n                    Клиента/Доверенного лица']""]","Да, Вас действительно должнен сфотографировать Представитель в соответсвии с пунктом 2.13.12.",Я не знаю ответа на этот вопрос.,,0.0,0.9999999999,1.0,0.7776160040370742,0.0,0.0,0.5650707435020459,0.9286872,0.0
Какие условия хранения?,"[""[' \\n                    2.14.9. Условия хранения: температура воздуха от +17 до +25 °С, атмосферное давление от 740 до 760 мм рт. ст., относительная \\n                    влажность воздуха от 30 до 60%']""]","
                    В соответсвии с пунктом 2.14.9. условия хранения слитка слудующие: 
                        - температура воздуха от +17 до +25 °С,
                        - атмосферное давление от 740 до 760 мм рт. ст.,
                        - относительная влажность воздуха от 30 до 60% ","Условия хранения включают температуру воздуха от +17 до +25 °С, атмосферное давление от 740 до 760 мм рт. ст. и относительную влажность воздуха от 30 до 60%.",1.0,0.9654765921372194,0.9999999999,0.75,0.9328190285608652,0.4266,0.7876386456756866,0.9350238728998432,0.9907735,1.0
Что такое 'Сертификат качества слитка'?,"[""['Сертификат качества слитка — документ о качестве драгоценного металла, содержащий сведения о соответствии драгоценного металла стандартам качества, технические характеристики и параметры Слитка, информацию о химическом составе, произведенный/заверенный предприятием-изготовителем Слитка.']""]","Сертификат качества слитка - это документ, выданный изготовителем слитка драгоценного металла, который содержит информацию о соответствии металла стандартам качества, его технические характеристики, параметры и химический состав.","Сертификат качества слитка - это документ о качестве драгоценного металла, содержащий сведения о соответствии драгоценного металла стандартам качества, технические характеристики и параметры Слитка, информацию о химическом составе, произведенный/заверенный предприятием-изготовителем Слитка.",1.0,0.8294047310243303,0.9999999999,1.0,0.9900962969625234,0.2041,0.6437604363703394,0.9593249549991246,0.99469864,1.0
На какой срок выдается эта доверенность? Можно ли ее передоверить другому лицу?,"[""['Датой выдачи доверенности считается дата предоставления Представляемым Банку данных своего представителя. Доверенность выдана сроком на 1 (один) год, полномочия по настоящей доверенности не могут быть передоверены другим лицам.']""]",Доверенность выдается сроком на 1 год. Полномочия по этой доверенности нельзя передоверять другим лицам.,Из предоставленного контекста невозможно определить срок действия данной доверенности или возможность ее передоверия другому лицу.,,0.0,0.9999999999,1.0,0.8925113601003222,0.0,0.0375853783499906,0.8088405771579779,0.9777005,0.5
"Как клиент может получить сертификат качества слитка, который он передал на хранение в банк?","[""['По требованию Клиента Банк предоставляет Клиенту заверенную Банком копию Сертификата качества слитка, переданного на ответственное хранение.']""]","По требованию клиента банк предоставляет ему заверенную копию сертификата качества слитка, который клиент передал на ответственное хранение в банке.","Клиент может получить сертификат качества слитка, который он передал на хранение в банк, в процессе вскрытия сейф-пакета и изъятия слитка.",,0.9969659244694004,0.9999999999,1.0,0.9473002748198188,0.0,0.3184599330047996,0.8707848059072355,0.98428416,0.0
Какие условия хранения слитков в банке? Где их хранят?,"[""['Хранение Банком Слитка Клиента осуществляется в хранилище 5 (Пятого) класса устойчивости к взлому, оборудованном системой видеонаблюдения и охранно-пожарной и тревожной сигнализации с выводом сигнала на пункт централизованной охраны, с осуществлением физической круглосуточной специализированной охраны хранилища.', 'Условия хранения: температура воздуха от +17 до +25 °С, атмосферное давление от 740 до 760 мм рт. ст., относительная влажность воздуха от 30 до 60%.']""]","Слитки хранятся в специальном хранилище 5 класса устойчивости к взлому, оборудованном системами видеонаблюдения, охранно-пожарной и тревожной сигнализацией, а также круглосуточной охраной. Условия хранения: температура +17...+25°С, атмосферное давление 740-760 мм рт.ст., влажность 30-60%.","Слитки в банке хранятся в специальном помещении для совершения операций с ценностями. Это помещение должно быть оборудовано системой видеонаблюдения, охранно-пожарной и тревожной сигнализацией, а также иметь физическую круглосуточную охрану. Условия хранения включают температуру воздуха от +17 до +25 °C, атмосферное давление от 740 до 760 мм рт. ст. и относительную влажность воздуха от 30 до 60%.",0.6666666666666666,0.944734900498548,0.9999999999,1.0,0.957762570843683,0.1188,0.3532010823096977,0.949122969497377,0.9886213,1.0
"Можно ли вернуть слиток в банк, если при получении были обнаружены его повреждения? Как это сделать?","[""['В случае обнаружения при приеме Слитка с ответственного хранения от Представителя нарушения целостности заводской упаковки Слитка, несоответствия нанесенной на Слиток маркировки данным, указанным в Сертификате качества слитка и/или Сертификате-ярлыке, отсутствия либо повреждения Сертификата качества слитка и/или Слитка (наличие на поверхности Слитка наплывов / заусенцев / царапин / жировых пятен / посторонних включений) Клиентом/Доверенным лицом и Представителем оформляется в двух экземплярах Рекламационный акт по форме Приложения № 3 к настоящим Правилам, в котором фиксируются указанные выше нарушения / несоответствия / повреждения. В случае наличия указанных выше нарушений / несоответствий / повреждений Слиток вместе с Сертификатом качества слитка и Сертификатом-ярлыком вкладываются Клиентом/Доверенным лицом в порожний сейф-пакет и запечатываются, после чего сейф-пакет помещается в Устройство для перевозки слитка с дальнейшим опломбированием номерной разовой пломбой. Номер сейф-пакета, а также номерной разовой пломбы отражаются в Рекламационном акте.']""]","Да, если при получении слитка с хранения были обнаружены его повреждения или нарушения упаковки, несоответствия маркировки и т.п., то клиент/доверенное лицо вместе с представителем банка оформляют рекламационный акт в двух экземплярах. В этом акте фиксируются все нарушения. После этого слиток вместе с сертификатами запечатывают в новый сейф-пакет и опломбировывают, указав номера на рекламационном акте. Затем слиток возвращается обратно в банк.","Да, согласно представленному контексту, клиент может вернуть поврежденный слиток в банк. Однако банк не несет ответственности за повреждения слитка, заводской упаковки, сертификата-ярлыка и сертификата качества слитка, которые могут возникнуть в результате неосторожных действий клиента или доверенного лица при вскрытии сейф-пакета и принятии слитка.",,0.9500766508158036,0.9999999999,1.0,0.9121587237070592,0.0,0.1518981138611669,0.9123672858289776,0.9925633,0.5
Кто может стать доверенным лицом?,"[""['Доверенное лицо — физическое лицо, уполномоченное Клиентом, которому предоставлено право на представление интересов Клиента и осуществление действий от его имени в рамках Сервиса на основании доверенности, оформленной посредством Дистанционного обслуживания в соответствии с п. 5.3 настоящих Правил по форме Приложения № 5 к настоящим Правилам.']""]","Доверенным лицом клиента может стать любое физическое лицо, которому клиент предоставит полномочия представлять его интересы в рамках сервиса покупки/продажи слитков драгоценных металлов. Доверенность на это лицо оформляется клиентом посредством дистанционного обслуживания в банке по форме из Приложения №5 к Правилам.","Доверенным лицом может стать юридическое лицо или индивидуальный предприниматель, если они имеют необходимые полномочия и документы, подтверждающие их статус.",0.0,0.9630692365627728,0.9999999999,1.0,0.8913991076271883,0.0,0.1554560551962795,0.7574238415364688,0.98560816,0.5
Можно ли поменять доверенное лицо? Как это сделать?,"[""['Клиент может отменить выданную доверенность путем обращения в Банк посредством Дистанционного обслуживания в любое время, но не позднее одного дня до планируемой даты встречи с представителем Клиента.']""]","Да, клиент может отменить ранее выданную доверенность на доверенное лицо. Для этого он должен обратиться в банк посредством дистанционного обслуживания не позднее чем за 1 день до планируемой даты встречи с действующим доверенным лицом.","Да, можно поменять доверенное лицо. Для этого необходимо обратиться в Банк посредством Дистанционного обслуживания и отменить выданную доверенность.",,0.9918710676337826,0.9999999999,1.0,0.9322854747164582,0.0943,0.4288373629399113,0.919913808645056,0.9852479,0.5
Как происходит покупка слитка банком? Есть ли какие-то особые условия?,"[""['Банк приобретает у Клиента только Слитки, находящиеся на ответственном хранении в Банке.', 'Клиент, обращаясь с Заявкой, подтверждает, что на момент заключения договора купли-продажи Слиток принадлежит на праве собственности Клиенту, не продан, не является предметом залога, не обременен правами третьих лиц, в споре, под арестом и иным запрещением не состоит.']""]","Банк осуществляет покупку слитков драгоценных металлов только у тех клиентов, чьи слитки находятся на ответственном хранении в самом банке. При подаче заявки на продажу слитка клиент должен подтвердить, что на момент продажи слиток принадлежит ему на праве собственности, не продан, не заложен, не арестован и не обременен правами третьих лиц.","Из предоставленного контекста нельзя однозначно определить, есть ли какие-то особые условия для покупки слитка банком. Однако, можно отметить, что процесс покупки слитка включает в себя согласование наименования драгоценного металла, количества, вида и массы слитка, цены за 1 грамм драгоценного металла, итоговой стоимости приобретаемого слитка, места нахождения (адреса) клиента/доверенного лица, времени доставки, а также необходимость или отсутствие необходимости дальнейшей передачи приобретенного слитка на ответственное хранение в банк.",,0.0,0.9999999999,1.0,0.9294446639969838,0.0,0.0818201515463145,0.8930443357303292,0.98465884,0.0
Что такое накопительный счет и как начисляются проценты?,"[""['\\n                    3.1. Начисление процентов на остаток средств по Счету вклада/Накопительному счету производится со дня, следующего \\n                    за днем зачисления денежных средств на Счет вклада/Накопительный счет Клиента, до дня окончания срока Вклада \\n                    (включительно) либо до их списания со Счета вклада/Накопительного счета по иным основаниям.', ' \\n                    3.3. Клиент имеет возможность по согласованию с Банком посредством Дистанционного обслуживания изменить Тарифный \\n                    план Вклада на Тарифный план для мультивалютного Вклада. При смене Тарифного плана изменения в части процентной \\n                    ставки по Счету вклада, изначально открытого в рамках текущего Договора вклада, не распространяются до конца срока \\n                    размещения, установленного предыдущим Тарифным планом. Процентные ставки по валютам, отличным от валюты \\n                    измененного Тарифного плана, устанавливаются новым Тарифным планом.\\n                    3.4. При начислении процентов в расчет принимается величина процентной ставки (в процентах годовых) и фактическое \\n                    количество календарных дней, на которое привлечены денежные средства. При этом за базу берется действительное \\n                    число календарных дней в году (365 или 366 дней соответственно).\\n                    ', ' \\n                    Накопительный счет — счет, на котором учитываются денежные средства Клиента, предусматривающий начисление \\n                    процентов на остаток денежных средств, в соответствии с Договором накопительного счета.']""]","
                    Накопительный счет - это счет, на котором учитываются денежные средства клиента и на который начисляются проценты на остаток денежных средств. Проценты начисляются в соответствии с условиями договора накопительного счета.
                    Проценты на накопительном счете начисляются со дня, следующего за днем зачисления денежных средств на счет, до дня окончания срока вклада (включительно) либо до их списания со счета по другим основаниям.

                    При начислении процентов учитываются:
                    • Величина процентной ставки (в процентах годовых)
                    • Фактическое количество календарных дней, на которое привлечены денежные средства

                    За базу берется действительное число календарных дней в году (365 или 366 дней соответственно).","Накопительный счет - это счет, на котором учитываются денежные средства клиента, и на остаток этих средств начисляются проценты в соответствии с договором накопительного счета. Проценты начисляются в зависимости от общих условий, которые являются неотъемлемой частью договора накопительного счета.",1.0,0.9533663662243724,0.9999999999,0.3333333333333333,0.950453904555807,0.1528,0.4532370448226164,0.9514922999292984,0.98954797,0.5
Можно ли открыть вклад в 12 лет?,"[""['1.2. Банк не заключает Договор вклада (Договор накопительного счета) с лицами, не достигшими возраста 14 лет']""]","Нет, Банк не заключает договор вклада с лицами, не достигшими возраста 14 лет.","Нет, согласно представленному контексту, Банк не заключает договор вклада с лицами, не достигшими возраста 14 лет.",,0.888753572107516,0.9999999999,1.0,0.9794158981641196,0.7388,0.8382122294718499,0.8963797626745021,0.9928892,1.0
Могу ли я открыть несколько вкладов и пополнять их?,"[""['\\n                    4.1. Клиент имеет право:\\n                    4.1.1. Предъявить Банку требование о досрочном полном или частичном изъятии Вклада.\\n                    4.1.2. Вносить дополнительные денежные средства во Вклад/Накопительный счет, если данная возможность установлена \\n                    Тарифным планом.\\n                    4.1.3. Разместить несколько Вкладов (открыть несколько Счетов вклада/Накопительных счетов на условиях, устанавливаемых \\n                    Договором вклада (Договором накопительного счета), Тарифами:\\n                    • через Дистанционное обслуживание;\\n                    • в офисе Банка в часы работы операционного подразделения Банка.\\n']""]"," 
                    Да, вы можете открыть несколько вкладов и пополнять их.
                    Согласно пункту 4.1.3 приведенного контекста, клиент имеет право разместить несколько вкладов (открыть несколько счетов вклада/накопительных счетов) на условиях, устанавливаемых договором вклада (договором накопительного счета) и тарифами.
                    Вы можете открыть несколько вкладов как через дистанционное обслуживание, так и в офисе банка в часы работы операционного подразделения банка.","Да, согласно представленному контексту, клиент имеет право разместить несколько вкладов и пополнять их, если такая возможность установлена тарифным планом.",,0.9023811112009398,0.9999999999,0.375,0.9107031272514992,0.1166,0.2516539393490137,0.8339397702020999,0.97382385,1.0
Для получения страховой выплаты в случае несчастного случая с летальным исходом нужна ли справка из психушки?,"[""['\\n                    6.1. По риску Смерть в результате Несчастного случая должны быть предоставлены следующие документы:\\n                    j. Справка из психоневрологического диспансера и наркологического диспансера']""]","Да, в таком случае необходимы справки из психоневрологического диспансера и наркологического диспансера.","Нет, справка из психушки не требуется для получения страховой выплаты в случае несчастного случая с летальным исходом.",,0.0,0.9999999999,0.6666666666666666,0.855506374446696,0.0,0.0815059868623371,0.8111485674851496,0.9788718,0.0
Дают ли кредит на автомобиль?,"[""['3.1. Банк предоставляет Клиенту Кредит на потребительские цели, в том числе на приобретение Товара и/или Автомобиля, в соответствии с законодательством Российской Федерации.']""]","Да, в соответсвии с пунктом 3.1. Банк предоставляет Клиенту Кредит на потребительские цели, , в том числе на приобретение автомобиля.",Нет информации о кредитовании автомобилей в данном контексте.,,0.0,0.9999999999,1.0,0.8642326652142021,0.0,0.0,0.6863643504479243,0.96576643,0.0
Распростроняется ли страховое покрытие на смерть в алкогольном опьянении?,"[""[' \\n                    Страховое покрытие по рискам «Смерть» и «Инвалидность» не распространяется на события, произошедшие в результате \\n                    и/или в период:\\n                    a. действий, совершенных Застрахованным лицом в состоянии алкогольного, наркотического и/или токсического \\n                    опьянения; в результате употребления им наркотических, сильнодействующих лекарственных препаратов \\n                    и психотропных веществ без предписания врача (или по предписанию врача, но с нарушением указанной  \\n                    им дозировки); болезни Застрахованного лица, прямо связанной с наркоманией, токсикоманией, хроническим \\n                    алкоголизмом\\n                    ']""]","Нет, страховое покрытие не распространяется на смерть в алкогольном опьянении.",Да,0.0,0.0,0.9999999999,0.5,0.7553896369942008,0.0,0.0,0.0,0.5232076,0.0
"Может ли Банк изменить Тарифный план по кредитной карте, и какие условия должны быть соблюдены для этого?","[""['\\n                    Банк вправе в одностороннем порядке изменить Тарифный план, применяемый\\nв рамках Договора, и/или заменить его на другой Тарифный план, в том числе при заключении Договора и/или\\nна определенный период времени по усмотрению Банка, с целью уменьшения процентной ставки по кредиту\\nи/или улучшения иных условий обслуживания при условии, что это не повлечет возникновение новых или увеличение размера существующих денежных обязательств Клиента\\n                    ']""]","Да, Банк может изменить Тарифный план по кредитной карте в одностороннем порядке, но при условии, что это не приведет к возникновению новых или увеличению уже существующих денежных обязательств клиента ","Да, Банк может изменить Тарифный план по кредитной карте. Для этого необходимо заявление клиента и согласие банка. Банк также имеет право изменить Тарифный план в одностороннем порядке, например, для уменьшения процентной ставки или улучшения других условий обслуживания. Однако это должно быть сделано таким образом, чтобы не повлечь возникновение новых или увеличение размера существующих денежных обязательств клиента.",1.0,0.9696234933777657,0.9999999999,1.0,0.9602527460386844,0.1402,0.4275629096840619,0.9661795224393158,0.9880143,1.0
Можно ли внести частичное досрочное погашение кредита? И как это повлияет на остаток задолженности?,"[""['«Клиент имеет право досрочно погасить Задолженность с уплатой Банку суммы непогашенного Кредита и начисленных процентов, а также (если применимо) комиссий и плат, предусмотренных Тарифным планом, в любой момент путем зачисления необходимой суммы денежных средств на Картсчет (Счет) и извещения Банка о необходимости проведения досрочного погашения. В случае частичного досрочного погашения уменьшается срок Кредита или сумма Регулярного платежа по выбору Клиента, при этом Клиент не освобождается от оплаты ближайшего Регулярного платежа, а также применимых комиссий и плат, предусмотренных Тарифным планом.», «При обращении Клиента в Банк для совершения частичного досрочного погашения до или в дату оплаты ближайшего Регулярного платежа Клиенту может быть предложено совершить частичное досрочное погашение с погашением ближайшего Регулярного платежа и последующим уменьшением срока Кредита или суммы Регулярного платежа по выбору Клиента.»']""]","Да, Клиент имеет право совершить частичное досрочное погашение кредита. При этом по выбору Клиента уменьшится либо срок кредита, либо сумма регулярного платежа. Однако Клиент не освобождается от оплаты ближайшего регулярного платежа и применимых комиссий.","Да, клиент имеет право внести частичное досрочное погашение кредита. Это повлияет на остаток задолженности, так как уменьшится срок кредита или сумма регулярного платежа по выбору клиента. Однако клиент не освобождается от оплаты ближайшего регулярного платежа, а также применимых комиссий и плат, предусмотренных тарифным планом.",1.0,0.9485546790438848,0.9999999999,1.0,0.980029240357961,0.207,0.6392248428979104,0.9542427979524252,0.9960008,1.0
Что будет в случае просрочки платежа по кредиту? И какой штраф может быть начислен?,"[""['«В случае неоплаты платежа Клиент должен уплатить штраф за неоплату Минимального платежа согласно Тарифному плану. Банк рассматривает любой поступивший платеж Клиента как признание Клиентом данного штрафа в размере поступившего платежа, но не более суммы штрафа, определенного в соответствии с Тарифами.»']""]","В случае неоплаты минимального платежа по кредиту, Клиент должен уплатить штраф в соответствии с Тарифным планом. Размер штрафа определяется Тарифами, и любой поступивший от Клиента платеж Банк будет рассматривать как оплату штрафа в пределах установленной суммы.","В случае просрочки платежа по кредиту могут быть начислены штрафы. Конкретный размер штрафа зависит от условий договора между заемщиком и банком. Банк имеет право приостановить начисление процентов, комиссий, плат и штрафов по кредитной линии с даты формирования Заключительного требования.",1.0,0.9474062936687472,0.9999999999,1.0,0.9171772531980106,0.0,0.1716025003666434,0.8907608354623291,0.9906881,1.0
Можно ли на время приостановить выплаты по кредиту? И как это повлияет на начисление процентов?,"[""['«На основании обращения Клиента и по согласованию с Банком на период от 1 (одного) до 12 (двенадцати) месяцев возможно приостановление обязанности Клиента по погашению Задолженности, по оплате Регулярных платежей и/или иных платежей. В указанный период Банк вправе приостановить начисление процентов и иных сумм, предусмотренных Договором реструктуризации задолженности.»']""]","Да, на основании обращения Клиента и по согласованию с Банком возможно приостановить обязанность по погашению задолженности и оплате платежей на срок от 1 до 12 месяцев. В этот период Банк вправе также приостановить начисление процентов и иных сумм по кредиту.","Да, на основании обращения клиента и по согласованию с банком возможно приостановить выплаты по кредиту на период от 1 до 12 месяцев. В этот период банк может приостановить начисление процентов и других сумм, предусмотренных кредитным договором. Однако, оставшийся срок возврата кредита будет продлен на согласованный период приостановления выплат.",0.6,0.9578066272149304,0.9999999999,1.0,0.9765005090976224,0.3024,0.5990986706924011,0.9356004701698976,0.9939933,1.0
Я хочу оформить дополнительную карту на супругу. Как это сделать? И будет ли она иметь доступ к общему лимиту по кредитке?,"[""['«3.2. По заявлению Клиента, переданному в Банк на бумажном носителе или через Дистанционное обслуживание, в рамках Договора кредитной карты Банком может быть выпущена одна или несколько дополнительных Кредитных карт.»', '«3.5. Клиент вправе установить лимит для проведения расходных операций с использованием Кредитной карты.»']""]","Вы можете оформить дополнительную кредитную карту на супругу, подав заявление в банк на бумажном носителе или через дистанционное обслуживание. Дополнительная карта будет иметь доступ к общему лимиту задолженности по вашей основной кредитной карте, однако вы можете установить отдельный лимит для расходных операций по дополнительной карте.","Я не знаю, как оформить дополнительную карту на супругу. Однако, я могу сказать, что она будет иметь доступ к общему лимиту по кредитке.",,0.0,0.9999999999,1.0,0.9282843402325665,0.1268,0.2844359670117945,0.7728956159430909,0.9720001,0.0
"А что если я потеряю карту? Сколько у меня есть времени, чтобы ее заблокировать? И как вообще это делается? Через приложение или звонить надо?","[""['«6.1. При обнаружении утери, кражи или порчи Кредитной карты и/или возникновения подозрений, что Кредитная карта или ее реквизиты, а также ПИН-код, QR-код, Коды доступа, Аутентификационные данные, Абонентский номер, Абонентское устройство могли быть утрачены или похищены, а также в случае изъятия Кредитной карты в банкомате или торгово-сервисном предприятии и в случае изменения имени или фамилии Держателя Клиент должен незамедлительно уведомить Банк по телефонам 8 800 555-10-10 или +7 495 645-59-19 (круглосуточно) и заблокировать Кредитную карту и/или Интернет-Банк и/или Мобильный банк, а также подать заявление о досрочном перевыпуске Кредитной карты.»']""]","В случае утери или кражи кредитной карты, вы должны незамедлительно уведомить банк по телефонам горячей линии 8 800 555-10-10 или +7 495 645-59-19 (круглосуточно) и заблокировать карту. Также необходимо подать заявление на досрочный перевыпуск новой карты. Чем быстрее вы заблокируете карту, тем меньше риск несанкционированного использования.","Если вы потеряете карту, вам нужно как можно скорее сообщить об этом в Банк через дистанционное обслуживание и заблокировать карту. Для этого вы можете использовать мобильное приложение банка или позвонить в банк.",,0.8887862880959237,0.9999999999,1.0,0.915141012552633,0.0,0.1772402042637604,0.7864669445254271,0.98892456,1.0
"Прочитал тут у вас про блокировку карточки. А если я её забуду забрать в банкомате, что тогда делать?","[""['«6.1. [...] а также в случае изъятия Кредитной карты в банкомате или торгово-сервисном предприятии и в случае изменения имени или фамилии Держателя Клиент должен незамедлительно уведомить Банк по телефонам 8 800 555-10-10 или +7 495 645-59-19 (круглосуточно) и заблокировать Кредитную карту и/или Интернет-Банк и/или Мобильный банк, а также подать заявление о досрочном перевыпуске Кредитной карты.»']""]","Если вы забыли карту в банкомате, вам необходимо незамедлительно сообщить об этом в банк по телефонам горячей линии 8 800 555-10-10 или +7 495 645-59-19 и заблокировать кредитную карту, а также подать заявление на ее досрочный перевыпуск. Это позволит предотвратить возможное несанкционированное использование забытой карты третьими лицами.","Если карта была у Вас украдена на территории РФ, после блокировки карты заявите о случившемся в полицию. При краже карты за границей, заявите в полицию или в консульский отдел посольства Российской Федерации в стране, на территории которой произошла кража. Пожалуйста, сохраняйте копию протокола (квитанцию о заявлении) для последующего предъявления в Банк.",0.6666666666666666,0.8548302553308774,0.9999999999,1.0,0.8829073497148182,0.0,0.0753225678793819,0.6844619556449981,0.98753715,0.0
"А есть ли какие-то льготные условия, если я захочу приостановить выплаты по кредитке на какое-то время? Например, на ремонт или что-то в этом роде?","[""['«5.15. На основании обращения Клиента и по согласованию с Банком на период от 1 (одного) до 12 (двенадцати) месяцев возможно приостановление обязанности Клиента по погашению Задолженности, по оплате Минимальных платежей, Регулярных платежей и/или иных платежей. В указанный период Банк вправе приостановить начисление процентов и иных сумм, предусмотренных Договором кредитной карты.»']""]","Да, в документе указано, что по обращению клиента и по согласованию с банком возможно приостановление обязанности по погашению задолженности, выплате минимальных и регулярных платежей на срок от 1 до 12 месяцев. В этот период банк также может приостановить начисление процентов и других сумм по кредитной карте. Таким образом, вы можете получить льготный период для ремонта или других нужд, обратившись в банк с соответствующим заявлением.","Да, согласно представленному контексту, на основании обращения клиента и по согласованию с банком возможно приостановление обязанности клиента по погашению задолженности, оплате регулярных платежей и других платежей на период от 1 до 12 месяцев. В этот период банк также может приостановить начисление процентов и других сумм, предусмотренных кредитным договором. Оставшийся срок возврата кредита будет продлен на согласованный период приостановления обязанности клиента по погашению задолженности.",1.0,0.8955071858093978,0.9999999999,1.0,0.967630560284261,0.4068,0.5609635693211986,0.97532179135408,0.9955908,1.0
Какие процедуры предусмотрены банком для обработки жалоб клиентов?,"[""['Банк имеет установленные процедуры для обработки и рассмотрения жалоб клиентов, включая регистрацию жалобы, ее анализ и предоставление ответа клиенту в установленные сроки.']""]","Банк следует четко установленным процедурам для обработки жалоб клиентов, которые включают регистрацию жалобы, ее тщательный анализ и предоставление ответа клиенту в соответствии с установленными сроками.","Банк предоставляет процедуры для обработки жалоб клиентов, включая возможность запросить оборотно-сальдовую ведомость по всем счетам бухгалтерского учета и/или регистры бухгалтерского учета. Также банк требует предоставления письма по форме банка с указанием пояснений по каждому документу о причинах невозможности его представления.",,0.9885824891360304,0.9999999999,1.0,0.911743503614324,0.0573,0.100199796187338,0.8316548259066517,0.9897809,1.0
Что происходит с депозитами в случае смерти?,"[""['В случае смерти клиента банк замораживает депозиты до решения вопросов наследства в соответствии с законодательством.']""]","После смерти клиента банк замораживает все его депозиты и удерживает их до тех пор, пока не будут решены вопросы наследства в соответствии с действующим законодательством.","В случае смерти депозита, банк прекращает начисление процентов, пересчитывает проценты в соответствии с Тарифным планом в порядке досрочного изъятия, направляет средства наследникам по реквизитам, указанным в заявлении на получение наследства, закрывает все счета вклада/накопительные счета и картсчета, расторгает договор вклада (договор накопительного счета).",,0.8657581647288929,0.9999999999,1.0,0.9156475726769596,0.0,0.0848810103543429,0.8178365460340404,0.9831811,0.5
Могу я отказаться от получения уведомлений от банка и как это влияет на его обслуживание?,"[""['Клиенты имеют право отказаться от получения определенных типов уведомлений от банка, однако это может повлиять на их способность получать своевременную информацию о изменениях условий, сбоях в системе или других важных обновлениях.']""]","Клиенты могут отказаться от получения определенных типов уведомлений от банка, но это может привести к тому, что они не будут получать важные обновления и информацию своевременно, что может повлиять на их способность управлять своими счетами и услугами эффективно.","Да, вы можете отказаться от получения уведомлений от банка. Это не повлияет на его обслуживание, но может ограничить доступ к некоторым функциям и информации.",,0.9528511260637368,0.9999999999,1.0,0.9348757985813996,0.0,0.2937992132518041,0.8936268683840751,0.9845009,1.0
Как я могу увеличить лимит по своей кредитной карте?,"[""['Для увеличения кредитного лимита клиенты должны подать заявление через мобильное приложение или веб-сайт банка, после чего банк рассмотрит их кредитную историю и текущую финансовую ситуацию.']""]","Чтобы увеличить кредитный лимит, клиентам необходимо подать соответствующее заявление через мобильное приложение или веб-сайт банка. Банк затем оценит их кредитную историю и текущую финансовую ситуацию перед принятием решения.","Я не знаю, как увеличить лимит по кредитной карте, так как эта информация может различаться в зависимости от банка и условий вашей кредитной карты. Пожалуйста, свяжитесь с вашим банком для получения подробной информации о том, как увеличить лимит по вашей кредитной карте.",,0.0,0.9999999999,1.0,0.8952597848019886,0.0,0.0665474550887193,0.7691236408074792,0.9829734,0.0
"Каковы условия отмены банковской операции, например, перевода средств или платежа?","[""['Клиенты могут отменить определенные банковские операции, если они не были еще обработаны банком. Условия отмены операций установлены в пользовательском соглашении и зависят от типа операции.']""]","Условия отмены банковской операции зависят от того, была ли операция уже обработана банком. Для операций, которые еще не обработаны, клиенты могут инициировать отмену, следуя процедурам, описанным в пользовательском соглашении и в зависимости от типа операции.",Я не знаю ответа на этот вопрос.,,0.0,0.9999999999,1.0,0.7657025704811461,0.0,0.0362059353678049,0.6128800695556941,0.9007785,0.0
Какие услуги доступны клиентам через Интернет-банк?,"[""['Через Интернет-банк клиенты могут управлять своими счетами, осуществлять платежи и переводы, а также получать детальную информацию о своих финансовых операциях.']""]","Интернет-банк предоставляет клиентам возможности управления их счетами, осуществления платежей и переводов, а также доступ к подробной информации о всех их финансовых операциях.","Из предоставленного контекста невозможно точно определить, какие именно услуги доступны клиентам через Интернет-банк.",,0.0,0.9999999999,1.0,0.8918674618396748,0.0,0.0971572355042035,0.7151490848217378,0.9841806,0.0
"Я не пользовалась кредиткой год, но у меня там лежат мои 800 рублей, я могу их как-то вернуть?","['[\'""8. Расторжение Договора кредитной карты\\n                8.1. Банк вправе в любой момент расторгнуть Договор кредитной карты в одностороннем порядке в случаях, предусмотренных \\n                законодательством Российской Федерации, а также:\\n                • в случае если Держатель не пользовался Кредитной картой более, чем 6 (шесть) месяцев при отсутствии \\n                Задолженности по Договору кредитной карты;\\n                В этих случаях Банк блокирует все Кредитные карты/Токены, выпущенные в рамках Договора кредитной карты. Договор \\n                кредитной карты считается расторгнутым со дня формирования Банком Заключительного счета, который направляется \\n                Клиенту. Если в момент расторжения Договора кредитной карты Задолженность Клиента перед Банком отсутствует, Банк \\n                вправе расторгнуть Договор кредитной карты без направления Заключительного счета, информируя Клиента о своем \\n                решении любым способом по усмотрению Банка.\\n                8.5. В случае, если при расторжении Договора кредитной карты в Банке находятся денежные средства Клиента, излишне \\n                перечисленные им при погашении Задолженности, Банк осуществляет возврат таких денежных средств по распоряжению \\n                Клиента почтовым переводом или иным способом, указанном в распоряжении Клиента. При этом Банк вправе удержать \\n                из суммы такого перевода комиссию за перевод денежных средств в размере, предусмотренном Тарифами на услуги \\n                по переводам, платежам и дополнительные услуги с использованием каналов Дистанционного обслуживания.\\n                8.6. В случае неполучения Банком распоряжения Клиента о переводе денежных средств в течение 120 (ста двадцати) дней \\n                со дня обработки Банком последней операции Клиента/Держателя и, если остаток денежных средств не превышает \\n                1000 руб., указанный остаток считается безвозмездно переданным Банку. \\n                В случае неполучения Банком распоряжения Клиента о переводе денежных средств в течение 3 (трех) лет со дня обработки \\n                Банком последней операции Клиента/Держателя указанные денежные средства считаются безвозмездно переданными \\n                Банку.\\n                \']']","Согласно пунуту 8.6 - вы не можете вернуть ваши деньги, так как не дали распоряжение Банку о переводе денежных средств в течение 120 дней.","Да, вы можете вернуть свои 800 рублей, которые остались на вашей кредитной карте. Для этого вам нужно написать заявление в банк и указать способ возврата денег. Банк может удержать комиссию за перевод денежных средств.",,0.9468790246623592,0.9999999999,0.0769230769230769,0.873981813749266,0.0,0.1019987376764235,0.7979307719189946,0.9846131,0.0
