question,contexts,ground_truth,answer,faithfulness,answer_relevancy,context_precision,context_relevancy,answer_similarity,bleu_score,cos-sim-TF-IDF,cos-sim-BertModel,sim-spacy,Human_score
Можно ли не расписываться на карте?,"[""['После получения карты поставьте свою подпись в прямоугольнике, расположенном на оборотной стороне карты. При отсутствии подписи карта может быть не принята к оплате в торгово-сервисном предприятии, а также повышается риск использования карты злоумышленниками в случае ее утраты/кражи.']""]","При отсутствии подписи карта может быть не принята к оплате в торгово-сервисном предприятии, а также повышается риск использования карты злоумышленниками в случае ее утраты/кражи.","Из предоставленного контекста следует, что после получения карты необходимо расписаться в прямоугольнике на оборотной стороне карты. Без подписи карта может быть не принята к оплате, а также повышается риск использования карты злоумышленниками в случае ее утраты или кражи. Поэтому, чтобы использование карты было безопасным, необходимо поставить свою подпись на карте.",0.75,0.8674689997593347,0.9999999999,1.0,0.9320794166858588,0.2111,0.4038333586043159,0.9853159,0.9458649271147646,0.0
"Мой друг попросил меня дать свою карту для оплаты и потом вернуть, это не опасно?","[""['Никогда не принимайте рекомендации, советы, помощь от третьих лиц при пользовании картой, особенно при снятии наличных денежных средств в банкоматах. В случае возникновения затруднений при совершении операции обратитесь Банк посредством дистанционного обслуживания. Обращайте внимание на расположение банкоматов. Старайтесь не пользоваться банкоматами, расположенными в плохо освещенных и безлюдных местах', 'Не передавайте карту другим лицам, в т.ч. родственникам и знакомым для проведения транзакций. С целью исключения Ваших потерь от несанкционированного использования Вашей карты (копирования информации с Вашей карты для ее дальнейшего мошеннического использования): при совершении операции оплаты с использованием карты никогда не выпускайте Вашу карту из поля зрения и требуйте от обслуживающего Вас лица, чтобы все операции с использованием карты совершались в Вашем присутствии.']""]","Не передавайте карту другим лицам, в т.ч. родственникам и знакомым для проведения транзакций и никогда не принимайте рекомендации, советы, помощь от третьих лиц при пользовании картой, особенно при снятии наличных денежных средств в банкоматах.","Использование карты должно быть безопасным, если вы следуете простым правилам безопасности. Не рекомендуется передавать карту другим лицам, включая друзей, для проведения транзакций. Это может повысить риск несанкционированного использования карты. В случае возникновения затруднений при пользовании картой, обратитесь в банк.",,0.8475010026926579,0.9999999999,1.0,0.9314721963806536,0.0,0.2077625217125413,0.99190366,0.8980875602016624,0.5
Безопасно ли хранить пинкод в заметках в телефоне?,"[""['Категорически запрещается записывать ПИН-код на карте. Постарайтесь не записывать ПИН-код, запомните его. Если же Вы предпочитаете записать свой ПИН-код, никогда не указывайте, что это ПИН-код и не храните документ с записанным ПИН-кодом рядом с картой.']""]","Да, однако не указывайте в названии заметки, что это ПИН-код от Вашей карты.","Хранение пин-кода в заметках на телефоне не является безопасным действием, так как это может привести к его компрометации. Рекомендуется не записывать пин-коды на устройствах, которые могут быть доступны другим лицам. Лучше запомнить пин-код или хранить его в надежном и защищенном месте, отдельно от банковской карты.",1.0,0.9090194199749924,0.9999999999,1.0,0.877614310292746,0.0,0.2084293419683909,0.9556809,0.7233436610725817,0.5
Я потеряла карту,"[""[' Вы потеряли карту или ее украли\\nПрежде всего, как можно быстрее, сообщите о случившемся в Банк посредством дистанционного обслуживания \\nи заблокируйте карту. Заблокировать карту можно по телефону, в интернет-банке или в мобильном приложении Банка. \\nЧем раньше Вы это сделаете, тем меньше вероятность несанкционированного использования карты злоумышленниками. \\nРазблокировать карту нельзя — можно только перевыпустить. Если вы не уверены, что карту украли, не спешите ее \\nблокировать, установите лимит «0» на операции и запретите покупки через Интернет, если карта будет найдена лимиты \\nможно изменить.\\nНапоминаем Вам, что в соответствии с Общими условиями выпуска и обслуживания кредитных карт и Общими \\nусловиями открытия, ведения и закрытия счетов физических лиц, а также выпуска и обслуживания расчетных карт Ваша \\nответственность за дальнейшее использование карты прекращается, после осуществления блокировки, если не станет \\nизвестно, что незаконное использование карты имело место с Вашего согласия.\\nЕсли карта была у Вас украдена на территории РФ, после блокировки карты заявите о случившемся в полицию. При краже \\nкарты за границей, заявите в полицию или в консульский отдел посольства Российской Федерации в стране, на территории \\nкоторой произошла кража. Пожалуйста, сохраняйте копию протокола (квитанцию о заявлении) для последующего \\nпредъявления в Банк.']""]","Если вы не уверены, что карту украли, не спешите ее блокировать, установите лимит «0» на операции и запретите покупки через Интернет, если карта будет найдена лимиты можно изменить. В случае, если вы полагаете, что Вашу карту всё-таки украли, то как можно быстрее, сообщите о случившемся в Банк посредством дистанционного обслуживания и заблокируйте карту. Это возможно сделать по телефону, в интернет-банке или в мобильном приложении Банка.","При обнаружении утери или кражи вашей карты Tinkoff, вы должны незамедлительно уведомить Банк по телефонам 8 800 555-25-50 или +7 495 645-59-19 (круглосуточно) и заблокировать карту. Также необходимо подать заявление о досрочном перевыпуске карты. По факту устного заявления Банк примет меры только по блокированию карты. Если карта будет найдена, необходимо вернуть ее в Банк, но использование данной карты в дальнейшем запрещается.",1.0,0.8031915819460108,0.9999999999,0.1,0.8946583061334751,0.0,0.1433047695303838,0.9914159,0.9057607349593538,0.0
"Почему при использовании карты важно не расписываться на квитанциях/чеках до того, как вы проверите правильность указанной суммы?","[""['Проверяйте правильность суммы, указанной на платежном чеке. Поставив подпись на платежном чеке, Вы соглашаетесь со списанием указанной на нем суммы с Вашего карточного счета.']""]","Важно проверять правильность суммы перед подписанием квитанции/чека, потому что после подписи вы соглашаетесь с этой суммой, и она будет списана с вашего счета.","При использовании карты важно не расписываться на квитанциях/чеках до того, как вы проверите правильность указанной суммы, так как ваша подпись подтверждает факт совершения операции. Проверьте информацию на квитанции или чеке перед тем, как поставить свою подпись, чтобы избежать возможных ошибок или недоразумений.",,0.9145910850476116,0.9999999999,1.0,0.9421978343941596,0.0,0.0991437442146623,0.9778598,0.9388784579921712,1.0
"Что делать, если я потеряла телефон, на котором было установлено мобильное приложение банка?","[""['При утрате Мобильного телефона, используемого с абонентским номером подвижной радиотелефонной связи, на который установлено Мобильное приложение Банка, Вам следует срочно обратиться к своему оператору сотовой связи для блокировки SIM-карты и в Банк посредством дистанционного обслуживания для блокировки доступа в мобильное приложение Банка и удаления данных карты с Мобильного телефона.']""]","Если вы потеряли телефон с установленным мобильным приложением банка, необходимо:

Срочно обратиться к оператору сотовой связи для блокировки SIM-карты.
Обратиться в банк через дистанционное обслуживание для блокировки доступа в мобильное приложение и удаления данных карты с телефона.","Если вы потеряли телефон, на котором было установлено мобильное приложение банка Tinkoff, вам следует немедленно обратиться к вашему оператору сотовой связи для блокировки SIM-карты и связаться с банком через дистанционное обслуживание для блокировки доступа в мобильное приложение банка и удаления данных карты с утерянного телефона.",1.0,0.9590670756744044,0.9999999999,1.0,0.9671857026479144,0.3682,0.6475981982046948,0.9959761,0.9790784826555752,1.0
Можно ли использовать интернет-кафе и другие общедоступные места для совершения операций по карте в интернете? Объясните причину.,"[""['Избегайте осуществления Интернет-операций с использованием карты в местах, где услуги Интернет являются общедоступными, например, в Интернет-кафе.']""]","Нет, не рекомендуется использовать интернет-кафе и другие общедоступные места для совершения операций по карте в интернете. Причина в том, что такие общедоступные сети являются менее безопасными, и есть риск перехвата данных карты злоумышленниками.","Для безопасности рекомендуется избегать совершения операций по карте в интернете в общедоступных местах, таких как интернет-кафе. Важно использовать проверенные интернет-магазины, где вы уверены в надежности. При оплате покупок в сети Интернет необходимо вводить трехзначный код безопасности CVC2/CVV2 для повышения безопасности операций. Не передавайте реквизиты вашей банковской карты другим лицам, за исключением использования автоматизированных систем MOTO и систем интернет-коммерции.",1.0,0.8985000800961127,0.9999999999,1.0,0.9182279767767496,0.0613,0.2248345538058797,0.9862348,0.9153961170646748,1.0
"Что делать, если я получил SMS-оповещение о операции по карте, которую я не совершал?","[""['Если Вы уверены, что операция не могла быть совершена Вами, то как можно быстрее сообщите об этом в Банк посредством дистанционного обслуживания и заблокируйте карту.']""]","Если вы получили SMS-оповещение о операции, которую не совершали, нужно как можно быстрее сообщить об этом в банк через дистанционное обслуживание и заблокировать карту.","Если вы получили SMS-оповещение о операции по карте, которую вы не совершали, вам следует как можно быстрее связаться с Банком через дистанционное обслуживание и заблокировать карту. Это можно сделать по телефону, в интернет-банке или в мобильном приложении Банка. Чем раньше будет заблокирована карта, тем меньше вероятность несанкционированного использования ее злоумышленниками. Необходимо также запомнить, что при операциях в сети Интернет или заказах по телефону может быть указана информация о стране или городе, отличном от вашего места проживания. При обнаружении подозрительных операций немедленно сообщите об этом в Банк и следуйте их рекомендациям.",1.0,0.9774982238627414,0.9999999999,1.0,0.9566729417206732,0.0301,0.3331709109399265,0.9742565,0.8742463455999112,1.0
Как обезопасить себя от съема данных карты в банкомате злоумышленниками? Приведи два способа.,"[""['Поэтому, при пользовании банкоматом не ленитесь внимательно осмотреть его и убедиться в отсутствии каких-либо «накладок» и посторонних устройств.', 'Пожалуйста, примите все меры, чтобы вводимый Вами ПИН-код был не заметен для окружающих.']""]","Чтобы обезопасить себя от съема данных карты в банкомате:

Внимательно осматривайте банкомат перед использованием на наличие подозрительных накладок и посторонних устройств.
Прикрывайте рукой клавиатуру при вводе ПИН-кода, чтобы его не могли увидеть окружающие.","Для обезопасить себя от съема данных карты в банкомате злоумышленниками, следует соблюдать следующие способы:
1. При использовании банкомата, внимательно осмотрите его на наличие подозрительных устройств, таких как накладки на клавиатуру или приемное устройство карты. В случае обнаружения подозрительных элементов, откажитесь от использования данного банкомата.
2. Не допускайте, чтобы ваш ПИН-код был виден окружающим. Убедитесь, что никто не подглядывает, когда вы вводите ПИН-код.

Соблюдение этих простых правил поможет обезопасить вас от возможного мошенничества при использовании карты в банкомате.",1.0,0.9656038330891578,0.9999999999,1.0,0.9691438555427362,0.0613,0.3518489113190838,0.9862733,0.9549827932476492,0.0
"Правда ли, что при бронировании гостиницы по карте мне необходимо сообщить все реквизиты карты, включая ПИН-код? Если нет, то что именно требуется сообщить?","[""['При бронировании номера в гостинице по карте Вас попросят сообщить свое имя, номер карты, срок ее действия (иногда, дополнительно — трехзначный код безопасности, напечатанный на обратной стороне карты на полосе для подписи) и срок Вашего пребывания.']""]","Нет, неправда. При бронировании гостиницы по карте не требуется сообщать ПИН-код. Обычно для бронирования запрашивают ваше имя, номер карты, срок ее действия, иногда трехзначный код безопасности (CVV/CVC) с оборотной стороны карты и планируемый срок пребывания.","При бронировании номера в гостинице по карте необходимо сообщить свое имя, номер карты, срок ее действия, трехзначный код безопасности (на обратной стороне карты), а также срок пребывания. Не требуется сообщать ПИН-код карты. В случае изменения планов, следует отменить заказ в соответствии с правилами отмены бронирования. При бронировании гостиницы на карте блокируется сумма, равная стоимости проживания, которая может оставаться недоступной для использования в течение 30 дней после блокировки.",,0.9191696686304272,0.9999999999,1.0,0.9477507895552852,0.0971,0.4535678207097079,0.98832726,0.9383942303731806,0.5
"Если я из другой страны и у меня нет паспорта РФ, что мне делать?","[""['\\n                     1. Документы и сведения, получаемые в целях идентификации Клиентов-физических лиц, а также в целях обслуживания таких Клиентов в рамках Универсального договора\\n                     1.4. Реквизиты документа, удостоверяющего личность: серия (при наличии) и номер документа, дата выдачи документа, наименование органа, выдавшего документ (при наличии кода подразделения может не устанавливаться), и код подразделения (при наличии).\\n                     1.4.2.для иностранных граждан:\\n                     •паспорт иностранного гражданина;\\n                     •дипломатический паспорт, служебный паспорт, удостоверяющие личность иностранного гражданина.', '.5.Документ, подтверждающий право иностранного гражданина или лица без гражданства на пребывание (проживание) в Российской Федерации (миграционной карты в случае отсутствия иных документов), в случае если наличие таких документов обязательно в соответствии с международными договорами Российской Федерации и законодательством Российской Федерации;Документами, подтверждающими право иностранного гражданина или лица без гражданства на пребывание (проживание) в РФ, являются:\\n                    •миграционная карта в случае отсутствия иных документов;\\n                    •вид на жительство;\\n                    •разрешение на временное проживание;\\n                    •виза;\\n                    •иной документ, подтверждающий в соответствии с международными договорами Российской Федерации и законодательством РФ право иностранного гражданина или лица без гражданства на пребывание (проживание) в РФ.\\n']""]","
                        Если вы из другой страны, то для заключения договора вам неообходимы документы, удостоверяющие Вашу личность. Для иностранных граждан это:
                            •паспорт иностранного гражданина;
                            •дипломатический паспорт, служебный паспорт, удостоверяющие личность иностранного гражданина.
                        Также необходимы документы, подтверждающие право иностранного гражданина (проживание) в Российской Федерации (миграционной карты в случае отсутствия иных документов), в случае если наличие таких документов обязательно в соответствии с международными договорами Российской Федерации и законодательством Российской Федерации;Документами, подтверждающими право иностранного гражданина или лица без гражданства на пребывание (проживание) в РФ, являются:
                            •миграционная карта в случае отсутствия иных документов;
                            •вид на жительство;
                            •разрешение на временное проживание;
                            •виза;
                            •иной документ, подтверждающий в соответствии с международными договорами Российской Федерации и законодательством РФ право иностранного гражданина или лица без гражданства на пребывание (проживание) в РФ. ","Из предоставленного контекста следует, что для иностранных граждан, у которых нет паспорта РФ, могут быть приняты следующие документы, удостоверяющие личность: паспорт иностранного гражданина, дипломатический паспорт, служебный паспорт. Для получения точной информации рекомендуется обратиться в банк Tinkoff для консультации.",,0.9073182339528284,0.9999999999,0.1666666666666666,0.9435810059782924,0.0,0.2319829169011242,0.98665893,0.8002155883775305,0.0
В течении скольких дней действительна выписка из ЕГРЮЛ?,"[""['\\n                    2.2. Выписка из Единого государственного реестра юридических лиц (ЕГРЮЛ). Банком может быть принята копия \\n                    выписки, заверенная регистрирующим органом. Выписка считается действительной для предоставления в Банк \\n                    в течение 30 (тридцати) календарных дней с даты ее выдачи и должна содержать актуальные сведения на дату  \\n                    ее предоставления;']""]",Выписка из Единого государственного реестра юридических лиц (ЕГРЮЛ) действительна в течении 30 дней с даты ее выдачи.,Выписка из ЕГРИП считается действительной для предоставления в банк в течение 30 (тридцати) календарных дней с даты ее выдачи и должна содержать актуальные сведения на дату ее предоставления.,1.0,0.941778906892164,0.9999999999,0.25,0.9205139669275696,0.0958,0.2482130230105937,0.9796869,0.7865334900011052,1.0
Нужно ли ИП указывать свой сайт для предприятия?,"[""['\\n                    3. Документы и сведения, предоставляемые Клиентом-индивидуальным предпринимателем: \\n                    3.5. Сведения о доменном имени, указателе страницы сайта в сети «Интернет», с использованием которых Клиентом \\nоказываются услуги (при наличии);\\n                    ']""]","Да, индивидуальному предпринимателю необходимо указать сведения о доменном имени, указателе страницы сайта в сети «Интернет».","Из предоставленного контекста не следует, что ИП обязан указывать свой сайт для предприятия при заключении пользовательского соглашения с банком Tinkoff. В таком случае рекомендуется обратиться в банк для получения более точной информации о необходимости указания сайта при предоставлении документов для присоединения к условиям Универсального договора.",,0.0,0.9999999999,0.6666666666666666,0.8768386626659999,0.0,0.0207692621315667,0.9785979,0.8101010293618474,0.0
Может ли Банк запросить дополнительные документы - не из списка обязательных?,"[""['\\n                     26. Банк может запросить у Клиента, а Клиент обязуется предоставить по запросу Банка дополнительные документы \\n                    и сведения, как предусмотренные, так и не предусмотренные настоящим Перечнем, в том числе в целях надлежащей \\n                    идентификации Клиента, его представителя, выгодоприобретателя и бенефициарного владельца в соответствии \\n                    с требованиями действующего законодательства Российской Федерации, нормативных актов Банка России, а также \\n                    требованиями Банка. Банк вправе не запрашивать отдельные документы и сведения, предусмотренные настоящим \\n                    Перечнем, в случаях, установленных внутренними правилами Банка.']""]","Да, Банк может запросить у Вас дополнительные не предусмотренные Перечнем документы.","Да, Банк Tinkoff вправе запросить дополнительные документы и сведения, как предусмотренные, так и не предусмотренные в перечне, в целях надлежащей идентификации Клиента, его представителя, выгодоприобретателя и бенефициарного владельца в соответствии с требованиями законодательства и нормативных актов. Банк также может запросить дополнительные документы в случаях, установленных внутренними правилами.",,0.9365479031211292,0.9999999999,0.25,0.8947347953851722,0.0,0.4420059604149294,0.96537614,0.8272266890517311,1.0
Какие документы нужно предоставить физическому лицу для открытия счета?,"[""['1. Документы и сведения, получаемые в целях идентификации Клиентов-физических лиц, а также в целях обслуживания таких Клиентов в рамках Универсального договора']""]","Физическому лицу для открытия счета необходимо предоставить документ, удостоверяющий личность (паспорт или иной документ из списка в п.1.4), документ, подтверждающий регистрацию или место пребывания, ИНН, СНИЛС и контактную информацию.","Для открытия счета физическому лицу необходимо предоставить следующие документы:
1. Документы, удостоверяющие личность (паспорт или иной документ, указанный в перечне).
2. В случае иностранных граждан или лиц без гражданства - документ, подтверждающий право на пребывание в Российской Федерации.
3. Документы-основания участия бенефициара(ов) в отношениях по договору счета.
Дополнительные требования могут быть предусмотрены в зависимости от организационно-правовой формы и законодательства РФ.",1.0,0.9911397536587442,0.9999999999,1.0,0.948630257676084,0.0458,0.3216240610513365,0.9820626,0.9603996269185532,0.5
Какие документы необходимо предоставить юридическому лицу для открытия счета в Банке? Можно ли предоставить сканы документов или нужны оригиналы?,"[""['2.1. Учредительные документы юридического лица...', '2.2. Выписка из Единого государственного реестра юридических лиц (ЕГРЮЛ)...', '2.3. Документ об избрании единоличного исполнительного органа юридического лица...']""]","Юридическому лицу необходимо предоставить учредительные документы, выписку из ЕГРЮЛ, документ об избрании руководителя, документы, подтверждающие личность руководителя и лиц, имеющих право подписи. Документы можно предоставить в копиях, заверенных нотариально, регистрирующим органом, руководителем или сотрудником Банка при наличии оригиналов.","Для юридического лица необходимо предоставить следующие документы для открытия счета в банке Tinkoff:
1. Учредительные документы юридического лица: Устав и/или Учредительный договор.
2. Сведения о договорах о привлечении банковского платежного агента, о договорах об осуществлении деятельности по приему платежей физических лиц и другие документы в зависимости от организационно-правовой формы.
3. Документы-основания участия бенефициара или бенефициаров в отношениях по договору номинального счета.

Относительно предоставления сканов документов или оригиналов, рекомендуется уточнить этот вопрос у представителей банка Tinkoff, так как это может зависеть от конкретной ситуации.",1.0,0.9353609423494152,0.9999999999,0.0,0.90460184311049,0.0,0.2017527626327761,0.98815924,0.8596512639802957,0.5
Можно ли открыть счет индивидуальному предпринимателю – иностранному гражданину? Какие документы для этого нужны?,"[""['3.1. Идентификация индивидуального предпринимателя осуществляется на основании документов и сведений, указанных в пункте 1.4 настоящего Перечня', '3.2. Документ, подтверждающий право иностранного гражданина или лица без гражданства на пребывание (проживание) в Российской Федерации...']""]","Да, индивидуальному предпринимателю-иностранному гражданину можно открыть счет. Для этого нужно предоставить документ, удостоверяющий личность, документ, подтверждающий право пребывания/проживания в РФ (напр. миграционную карту), ИНН, СНИЛС, выписку из ЕГРИП и контактную информацию.","Для открытия счета в банке Tinkoff индивидуальному предпринимателю – иностранному гражданину требуется предоставить следующие документы:
1. Документ, подтверждающий право иностранного гражданина на пребывание в Российской Федерации.
2. Лицензии или разрешения на осуществление деятельности, подлежащей лицензированию, если применимо.
3. Информация о страховом номере индивидуального лицевого счета застрахованного лица.
4. Адрес места жительства или места пребывания.
5. Контактная информация.
6. Выписка из ЕГРИП.

Дополнительно, предоставление миграционной карты и документов, подтверждающих право пребывания в России, может быть необходимо в зависимости от законодательства РФ. Для более точной информации рекомендуется обратиться в банк Tinkoff.",0.875,0.9455316497892736,0.9999999999,1.0,0.9376468614601348,0.0,0.1895406515716191,0.9759791,0.9048238220638776,1.0
"Какие документы потребуются, если открывать счет для нотариуса, занимающегося частной практикой? Может ли нотариус быть иностранцем при этом?","[""['5.1. Документ, удостоверяющий личность и указанный в пункте 1.4 настоящего Перечня', '5.2. Документ, подтверждающий наделение нотариуса полномочиями (назначение на должность), выдаваемый органами юстиции субъектов Российской Федерации, в соответствии с законодательством Российской Федерации']""]","Для открытия счета нотариусу, занимающемуся частной практикой, требуется предоставить документ, удостоверяющий личность, документ о назначении на должность нотариуса от органов юстиции, регистрационные документы, финансовые документы и контактные данные. Нотариус может быть иностранцем, в этом случае дополнительно потребуется документ, подтверждающий право на пребывание/проживание в РФ.","Для открытия счета для нотариуса, занимающегося частной практикой, потребуются следующие документы:
- Документ, удостоверяющий личность (пункт 5.1)
- Документ, подтверждающий наделение нотариуса полномочиями (пункт 5.2)
- Адрес места жительства или места пребывания (пункт 5.3)
- Контактная информация (пункт 5.4)
- Выписка из ЕГРИП (пункт 5.5)
- Сведения о целях установления и предполагаемом характере деловых отношений с Банком (пункт 5.7)
- Сведения о целях финансово-хозяйственной деятельности (по форме Банка, пункт 5.7)

Если нотариус является иностранным гражданином, к вышеперечисленным документам необходимо дополнительно предоставить миграционную карту и/или документ, подтверждающий право на пребывание в Российской Федерации (пункт 8).",,0.9641886386588476,0.9999999999,0.0,0.95778477828951,0.0311,0.2202490334895365,0.98786926,0.9499432202916196,1.0
"Как узнать, кто является бенефициарным владельцем юридического лица? Какие документы для этого нужны?","[""['12. Идентификация бенефициарного(ых) владельца(ев) осуществляется на основании следующий документов и сведений...']""]","Для идентификации бенефициарного владельца юридического лица необходимо предоставить документы, удостоверяющие личность бенефициара, документ о регистрации/пребывании в РФ (если бенефициар - иностранец), ИНН, адрес регистрации и контактные данные. Также можно заполнить анкету бенефициарного владельца по форме Банка.","Для определения бенефициарного владельца юридического лица необходимо предоставить следующие документы и сведения:
1. Документы, удостоверяющие личность в соответствии с Перечнем.
2. В случае, если бенефициарный владелец является иностранным гражданином или лицом без гражданства, документ, подтверждающий право пребывания в Российской Федерации.
3. Идентификационный номер налогоплательщика, если имеется.
4. Адрес места жительства или пребывания.
5. Контактная информация.

Дополнительно, идентификация бенефициарного владельца может быть осуществлена на основании Анкеты физического лица — бенефициарного владельца по форме Банка, подписанной Клиентом. Если возникают сомнения в достоверности информации или бенефициарный владелец является иностранным гражданином, идентификация осуществляется исключительно на основании указанных документов и сведений.",1.0,0.9486719923581374,0.9999999999,1.0,0.9710626329326244,0.0413,0.2777146936139938,0.9868207,0.8750611199166185,0.5
Расскажи про термины 'Договор страхования' и 'КАСКО',"[""['1. Термины и определения     \\n                    Договор страхования — договор, по которому одна сторона (Страховщик) обязуется за обусловленную договором \\n                    плату (страховую премию) при наступлении предусмотренного в договоре события (страхового случая) осуществить \\n                    другой стороне (страхователю) или иному лицу, в пользу которого заключен договор (выгодоприобретателю), \\n                    страховое возмещение в пределах определенной договором суммы (страховой суммы).', 'КАСКО — комбинированное страхование транспортных средств и сопутствующих рисков.']""]"," Да, конечно! Договор страхования — это договор, по которому одна сторона (Страховщик) обязуется за обусловленную договором 
                    плату (страховую премию) при наступлении предусмотренного в договоре события (страхового случая) осуществить 
                    другой стороне (страхователю) или иному лицу, в пользу которого заключен договор (выгодоприобретателю), 
                    страховое возмещение в пределах определенной договором суммы (страховой суммы). 
                    КАСКО — это комбинированное страхование транспортных средств и сопутствующих рисков.","Договор страхования - это договор, по которому страховщик обязуется выплатить страховое возмещение страхователю или выгодоприобретателю в случае наступления страхового случая, при условии уплаты страховой премии. КАСК - это комбинированное страхование транспортных средств и сопутствующих рисков.",1.0,0.885094600093803,0.9999999999,0.25,0.963493231286326,0.1802,0.4729112879252845,0.987133,0.9296509084048244,1.0
"Какой минимум страховой выплаты мне вернут, если моя страховая сумма = 50 000 долларов?","[' \n                    2.19.   При добровольном страховании непредвиденных расходов путешественников страховая сумма в договоре \n                    страхования может быть установлена в рублях или иностранной валюте в рублевом эквиваленте по официальному \n                    курсу иностранных валют ЦБ РФ на дату заключения Договора страхования, но не менее чем 66,7 руб. за 1 у.е.  при \n                    страховой сумме 30 000 у.е., 57,2 руб. за 1 у.е. при страховой сумме 35 000 у.е., 50 руб. за 1 у.е. при страховой сумме \n                    50 000 у.е., 26,7 руб. за 1 у.е. при страховой сумме 75 000 у.е.']"," 
                    Минимальная страховая выплата, которую вам вернут, если ваша страховая сумма составляет 50 000 долларов, составляет 50 рублей за 1 доллар США. Минимальная выплата составит 2 500 000 рублей.
                    Обратите внимание, что это минимальная выплата, которую вы получите. Фактическая сумма выплаты может варьироваться в зависимости от условий вашего договора.
        ",Из предоставленного контекста не удалось найти информацию о минимальной страховой выплате в размере 50 000 долларов. Рекомендуем обратиться в банк Tinkoff для получения точной информации по вашему вопросу.,,0.0,0.9999999999,0.2,0.9130141457686488,0.0,0.0639777071574672,0.9770196,0.9044484478747848,0.0
"При принятии пользовательских соглашений, кому еще попадают мои данные?","[""['\\n                    5. Персональные данные     \\n                        5.1.       Пользователь подтверждает, что с использованием Дистанционных каналов взаимодействия дает Страховщику, \\n                        аффилированным лицам страховщика, Страховому агенту или Страховому брокеру, а также лицам, \\n                        предоставляющим услуги по использованию их информационных возможностей для целей заключения договоров \\n                        страхования, хранения документов, в том числе, облачных сервисов, серверов, программных продуктов, согласие на \\n                        обработку его персональных данных с целью осуществления дистанционного взаимодействия с последними при \\n                        использовании их Сайта и/или сайтов в сети Интернет или при помощи ПО Страховщика и в целях осуществления \\n                        маркетинговых коммуникаций перечисленных лиц с Пользователем.  \\n        ']""]","
                    Согласно пункту 5.1 пользовательского соглашения, ваши персональные данные могут быть переданы следующим сторонам:
                        • Аффилированные лица страховщика
                        • Страховой агент
                        • Страховой брокер
                        • Лица, предоставляющие услуги по использованию их информационных возможностей для целей заключения договоров страхования, хранения документов, в том числе облачных сервисов, серверов, программных продуктов
","По условиям пользовательского соглашения банка Tinkoff, ваши данные могут быть предоставлены следующим лицам: страховщику, аффилированным лицам страховщика, страховому агенту, страховому брокеру и лицам, предоставляющим услуги для заключения договоров страхования. Ваши персональные данные могут использоваться для дистанционного взаимодействия, хранения документов, маркетинговых коммуникаций и других целей, указанных в соглашении. Пожалуйста, обратитесь в банк для получения дополнительной информации о том, кому еще могут быть переданы ваши данные.",0.6666666666666666,0.8804972983953873,0.9999999999,0.25,0.9113155125344232,0.0,0.3052771196725603,0.990635,0.9423684913587528,1.0
Зачем страховщик ведет аудио и видеозапись при взаимодействии с клиентом? Как долго эти записи хранятся?,"[""['При заключении Договоров страхования, а также при ином обращении Клиента или Пользователя к Страховщику или его представителям Страховщик вправе осуществлять наблюдение, фотографирование, аудио- и видеозапись, включая запись телефонных разговоров, а также копирование и хранение переписок между Пользователем и Страховщиком (его представителями) по электронной почте или в мессенджерах, без дополнительного уведомления Клиента (Пользователя) о такой записи. Клиент соглашается, что Страховщик вправе хранить такие записи в течение 5 (пяти) лет с момента прекращения отношений с Клиентом (Пользователем), с целью улучшения качества обслуживания, исполнения Договора страхования, а также использовать их при проведении любых расследований в связи с Договором страхования.']""]","Страховщик ведет аудио, видеозапись, фотографирование, копирует переписку с клиентом без дополнительного уведомления с целью улучшения качества обслуживания, исполнения договора страхования, а также для использования этих записей при проведении расследований, связанных с договором. Такие записи страховщик вправе хранить в течение 5 лет с момента прекращения отношений с клиентом.","Страховщик ведет аудио и видеозапись при взаимодействии с клиентом без дополнительного уведомления клиента с целью улучшения качества обслуживания, исполнения договора страхования и проведения расследований. Такие записи хранятся в течение 5 лет с момента прекращения отношений с клиентом.",1.0,0.936179558012404,0.9999999999,1.0,0.9838395188923978,0.4074,0.6351701741561033,0.99517566,0.9640726134149212,0.0
В каких случаях застрахованному могут быть оплачены планируемые расходы по страховому случаю до предоставления подтверждающих документов? Какие ограничения есть по размеру таких выплат?,"[""['По договорам добровольного страхования непредвиденных расходов путешественников по предварительному согласованию со Страховщиком Застрахованному могут оплачиваться планируемые расходы по предусмотренным договором страхования страховым событиям, предусматривающим возмещение расходов на оказание Экстренной или Неотложной амбулаторной и/или стационарной помощи, с условием предоставления Застрахованным документов, подтверждающих такие расходы Страховщику непосредственно после их несения (чеки, платежные документы и пр.). В случае если в результате страхового случая Застрахованным лицом были понесены соответствующие расходы на оказание Экстренной или Неотложной амбулаторной и/или стационарной помощи, в том числе, предварительно согласованные Страховщиком, но не были предоставлены документы, подтверждающие их оплату, Страховщик возмещает расходы в размере не более 200 у.е. (если страховая сумма установлена в валюте, отличной от российского рубля) или 10 000 российских рублей (если страховая сумма установлена в российских рублях), за один страховой случай.']""]","По договорам добровольного страхования непредвиденных расходов путешественников застрахованному могут быть оплачены планируемые расходы по страховым случаям, предусматривающим возмещение расходов на экстренную/неотложную амбулаторную или стационарную помощь, по предварительному согласованию со страховщиком. Условие - предоставление подтверждающих документов сразу после несения расходов. Если документы не предоставлены, то страховщик возмещает расходы в размере не более 200 у.е. (если страховая сумма в валюте) или 10 000 рублей (если в рублях) за один случай.","По договорам добровольного страхования непредвиденных расходов путешественников Застрахованному могут оплачиваться планируемые расходы по предусмотренным страховым событиям под условием предоставления документов, подтверждающих такие расходы, непосредственно после их несения (например, чеки, платежные документы). Однако, в случае если не были предоставлены документы, подтверждающие оплату, размер таких выплат ограничен и составляет не более 200 у.е. (для страховой суммы в другой валюте) или 10 000 российских рублей (для страховой суммы в российских рублях) за один страховой случай.",1.0,0.837931402043211,0.9999999999,1.0,0.9668384926709828,0.1923,0.3989827291968586,0.9955871,0.9753511482371928,1.0
Куда пользователь может направить обращение при возникновении вопросов или спора со страховщиком?,"[""['При возникновении вопросов или спора можно отправить обращение:\\n\\nв АО «Тинькофф Страхование» по почте по адресу: 127287, Российская Федерация, г. Москва, ул. 2-я Хуторская, дом 38А, строение 26, либо путем заполнения соответствующей формы на сайте Страховщика;\\nк финансовому уполномоченному путем регистрации обращения на сайте — finombudsman.ru или по почтовому адресу: 119017, г. Москва, Старомонетный пер., дом 3;\\nво Всероссийский союз страховщиков на сайте — ins-union.ru, приложив к обращению необходимые документы и сведения, либо на почтовый адрес: 115093, г. Москва, ул. Люсиновская, д. 27, стр. 3;\\nв Центральный Банк Российской Федерации (Банк России) через интернет-приемную на официальном сайте — cbr.ru, приложив к обращению необходимые документы и сведения, либо на почтовый адрес: 107016, г. Москва, ул. Неглинная, д. 12.']""]","При возникновении вопросов или спора с АО 'Тинькофф Страхование' пользователь может направить обращение:

 - В АО 'Тинькофф Страхование' по почте или через форму на сайте;
 - Финансовому уполномоченному на сайте finombudsman.ru или почтовым адресом;
 - Во Всероссийский союз страховщиков на сайте ins-union.ru или почтовым адресом;
В Центральный Банк РФ через интернет-приемную на сайте cbr.ru или почтовым адресом.",При возникновении вопросов или спора со страховщиком пользователь может обратиться в судебный орган в соответствии с действующим законодательством Российской Федерации.,,0.9897942199711088,0.9999999999,1.0,0.9063584962825778,0.0709,0.1438210904978497,0.9671361,0.8567357698947967,0.5
Где можно ознакомиться с дополнительной информацией и документами о деятельности АО 'Тинькофф Страхование'?,"[""['Дополнительная информация и документы о деятельности Страховщика в соответствии с п. 6.1 Закона РФ от 27.11.1992 N 4015-1 «Об организации страхового дела в Российской Федерации» и п. 2.1.1. «Базового стандарта защиты прав и интересов физических и юридических лиц — получателей финансовых услуг, оказываемых членами саморегулируемых организаций, объединяющих страховые организации» размещены по ссылкам: tinkoffinsurance.ru/about, tinkoffinsurance.ru/about/documents.']""]",Дополнительная информация и документы о деятельности АО 'Тинькофф Страхование' в соответствии с законом 'Об организации страхового дела в РФ' и базовым стандартом защиты прав получателей финансовых услуг размещены на сайте страховщика по ссылкам tinkoffinsurance.ru/about и tinkoffinsurance.ru/about/documents.,"Вы можете ознакомиться с дополнительной информацией и документами о деятельности АО ""Тинькофф Страхование"" по следующим ссылкам: tinkoﬃnsurance.ru/about и tinkoﬃnsurance.ru/about/documents. Также рекомендуется изучить Базовый стандарт защиты прав и интересов физических и юридических лиц, Базовый стандарт совершения страховыми организациями операций на финансовом рынке, и Внутренний стандарт Всероссийского союза страховщиков. Если у вас возникнут дополнительные вопросы, рекомендуется обратиться в банк для получения более подробной информации.",0.6666666666666666,0.0,0.9999999999,1.0,0.9606986813566328,0.0,0.2024574898125815,0.9861805,0.9066925657927752,1.0
Что означает 'Партия' и вообще 'Слиток' для драгоценных металлов?,"[""['\\n                    Партия — приобретенные Клиентом Слитки в количестве, превышающем 1 (одну) штуку, и подлежащие доставке Клиенту, \\n                    в рамках одной Заявки', ' Слиток — аффинированный драгоценный металл: золото, серебро, платина и палладий в виде слитков (стандартных, \\n                    мерных), соответствующих установленным в Российской Федерации стандартам или международным стандартам качества, \\n                    изготовленных и маркированных организацией, осуществляющей аффинаж драгоценного металла. Слиток в рамках \\n                    предоставления Сервиса доставляется / принимается на хранение в ненарушенной Упаковке с приложением Сертификата-\\n                    ярлыка (при наличии) и Сертификата качества слитка']""]","Давайте разберемся! 
                    Партия — это приобретенные клиентом слитки в количестве, превышающем 1 штуку, и подлежащие доставке клиенту, в рамках одной заявки.
                    Слиток — это аффинированный драгоценный металл: золото, серебро, платина и палладий в виде слитков (стандартных, 
                    мерных), соответствующих установленным в Российской Федерации стандартам или международным стандартам качества, 
                    изготовленных и маркированных организацией, осуществляющей аффинаж драгоценного металла. Слиток в рамках 
                    предоставления Сервиса доставляется / принимается на хранение в ненарушенной Упаковке с приложением Сертификата-
                    ярлыка (при наличии) и Сертификата качества слитка.
        ","По определению из предоставленного контекста, ""Партия"" означает приобретенные клиентом слитки в количестве, превышающем 1 штуку, и подлежащие доставке клиенту в рамках одной заявки. Таким образом, ""Партия"" представляет собой группу слитков, которые клиент заказал одновременно и которые будут доставлены ему вместе.",1.0,0.8986356883402798,0.9999999999,1.0,0.9138125156465688,0.1566,0.1793983131845484,0.9894785,0.7713882628360584,0.5
Меня действительно должны фотографировать после полкчения слитка? Какой это пункт в соглашении?,"[""['\\n                    2.13.12. После подтверждения получения Клиентом/Доверенным лицом Слитка Представитель фотографирует Клиента/\\n                    Доверенное лицо с полученным Слитком в ненарушенной заводской упаковке и документом, удостоверяющим личность \\n                    Клиента/Доверенного лица']""]","Да, Вас действительно должнен сфотографировать Представитель в соответсвии с пунктом 2.13.12.","Да, согласно пункту 2.13.12 Правил оказания сервиса «Покупка/продажа слитков драгоценных металлов», после подтверждения получения клиентом слитка представитель банка фотографирует клиента с полученным слитком в ненарушенной заводской упаковке и документом, удостоверяющим личность клиента.",1.0,0.8606430287598538,0.9999999999,0.5,0.8651840966323607,0.0,0.1283341565075625,0.9765196,0.6407544650336647,1.0
Какие условия хранения?,"[""[' \\n                    2.14.9. Условия хранения: температура воздуха от +17 до +25 °С, атмосферное давление от 740 до 760 мм рт. ст., относительная \\n                    влажность воздуха от 30 до 60%']""]","
                    В соответсвии с пунктом 2.14.9. условия хранения слитка слудующие: 
                        - температура воздуха от +17 до +25 °С,
                        - атмосферное давление от 740 до 760 мм рт. ст.,
                        - относительная влажность воздуха от 30 до 60% ","Условия хранения слитка в банке Tinkoff включают в себя следующие параметры: температура воздуха должна быть от +17 до +25 °С, атмосферное давление от 740 до 760 мм рт. ст., относительная влажность воздуха от 30 до 60%. Слиток хранится в хранилище 5 класса устойчивости к взлому, оборудованном системой видеонаблюдения и охранно-пожарной и тревожной сигнализации. Банк имеет право изменить условия и место хранения слитка с согласия клиента или в случае опасности порчи или гибели без уведомления клиента.",0.6,0.878363346353936,0.9999999999,0.75,0.9280374847728872,0.1582,0.5399841606349108,0.9757185,0.9024970961891948,1.0
Что такое 'Сертификат качества слитка'?,"[""['Сертификат качества слитка — документ о качестве драгоценного металла, содержащий сведения о соответствии драгоценного металла стандартам качества, технические характеристики и параметры Слитка, информацию о химическом составе, произведенный/заверенный предприятием-изготовителем Слитка.']""]","Сертификат качества слитка - это документ, выданный изготовителем слитка драгоценного металла, который содержит информацию о соответствии металла стандартам качества, его технические характеристики, параметры и химический состав.","Сертификат качества слитка является документом, содержащим информацию о качестве драгоценного металла, его технические характеристики, параметры, химический состав, дату выпуска и другие данные, подтверждающие соответствие стандартам качества. Этот документ производится или заверяется предприятием-изготовителем слитка и прилагается к упаковке слитка. Важно сохранить сертификат качества слитка, так как его утрата или повреждение может привести к признанию слитка ненадлежащего качества. При приеме слитка необходимо проверить целостность упаковки, соответствие маркировки на слитке данным в сертификате, а также отсутствие повреждений и дефектов на поверхности слитка.",1.0,0.9604165589755164,0.9999999999,1.0,0.9713034721753674,0.0,0.4777943949581597,0.98967147,0.8848498002726245,1.0
На какой срок выдается эта доверенность? Можно ли ее передоверить другому лицу?,"[""['Датой выдачи доверенности считается дата предоставления Представляемым Банку данных своего представителя. Доверенность выдана сроком на 1 (один) год, полномочия по настоящей доверенности не могут быть передоверены другим лицам.']""]",Доверенность выдается сроком на 1 год. Полномочия по этой доверенности нельзя передоверять другим лицам.,Доверенность выдается на срок 1 год и не может быть передоверена другому лицу.,1.0,0.98036241686559,0.9999999999,1.0,0.9731899358037585,0.0,0.2030055941109282,0.9820461,0.9305141021200332,1.0
"Как клиент может получить сертификат качества слитка, который он передал на хранение в банк?","[""['По требованию Клиента Банк предоставляет Клиенту заверенную Банком копию Сертификата качества слитка, переданного на ответственное хранение.']""]","По требованию клиента банк предоставляет ему заверенную копию сертификата качества слитка, который клиент передал на ответственное хранение в банке.","Для получения сертификата качества слитка, который был передан на хранение в банк Tinkoff, клиент может обратиться в банк и запросить заверенную копию сертификата качества слитка. Банк обязуется предоставить клиенту заверенную копию сертификата качества слитка по требованию.",,0.9602408162804992,0.9999999999,1.0,0.9491187267326744,0.1122,0.5318804209032112,0.98516375,0.8826961896863291,1.0
Какие условия хранения слитков в банке? Где их хранят?,"[""['Хранение Банком Слитка Клиента осуществляется в хранилище 5 (Пятого) класса устойчивости к взлому, оборудованном системой видеонаблюдения и охранно-пожарной и тревожной сигнализации с выводом сигнала на пункт централизованной охраны, с осуществлением физической круглосуточной специализированной охраны хранилища.', 'Условия хранения: температура воздуха от +17 до +25 °С, атмосферное давление от 740 до 760 мм рт. ст., относительная влажность воздуха от 30 до 60%.']""]","Слитки хранятся в специальном хранилище 5 класса устойчивости к взлому, оборудованном системами видеонаблюдения, охранно-пожарной и тревожной сигнализацией, а также круглосуточной охраной. Условия хранения: температура +17...+25°С, атмосферное давление 740-760 мм рт.ст., влажность 30-60%.","Условия хранения слитков в банке Tinkoff включают в себя следующее:
- Срок хранения слитка у банка составляет до момента его востребования.
- Слиток хранится в хранилище 5 класса устойчивости к взлому, оборудованном системой видеонаблюдения и охранно-пожарной сигнализации.
- Условия хранения включают температуру воздуха от +17 до +25 °C, атмосферное давление от 740 до 760 мм рт. ст. и относительную влажность воздуха от 30 до 60%.
- Банк имеет право изменить условия и место хранения слитка с письменного согласия клиента или в случае опасности порчи или гибели слитка без уведомления клиента в случае обстоятельств непреодолимой силы.",0.5,0.9365810402232206,0.9999999999,1.0,0.9347932961419227,0.031,0.2850504291421325,0.9834117,0.917263691214442,1.0
"Можно ли вернуть слиток в банк, если при получении были обнаружены его повреждения? Как это сделать?","[""['В случае обнаружения при приеме Слитка с ответственного хранения от Представителя нарушения целостности заводской упаковки Слитка, несоответствия нанесенной на Слиток маркировки данным, указанным в Сертификате качества слитка и/или Сертификате-ярлыке, отсутствия либо повреждения Сертификата качества слитка и/или Слитка (наличие на поверхности Слитка наплывов / заусенцев / царапин / жировых пятен / посторонних включений) Клиентом/Доверенным лицом и Представителем оформляется в двух экземплярах Рекламационный акт по форме Приложения № 3 к настоящим Правилам, в котором фиксируются указанные выше нарушения / несоответствия / повреждения. В случае наличия указанных выше нарушений / несоответствий / повреждений Слиток вместе с Сертификатом качества слитка и Сертификатом-ярлыком вкладываются Клиентом/Доверенным лицом в порожний сейф-пакет и запечатываются, после чего сейф-пакет помещается в Устройство для перевозки слитка с дальнейшим опломбированием номерной разовой пломбой. Номер сейф-пакета, а также номерной разовой пломбы отражаются в Рекламационном акте.']""]","Да, если при получении слитка с хранения были обнаружены его повреждения или нарушения упаковки, несоответствия маркировки и т.п., то клиент/доверенное лицо вместе с представителем банка оформляют рекламационный акт в двух экземплярах. В этом акте фиксируются все нарушения. После этого слиток вместе с сертификатами запечатывают в новый сейф-пакет и опломбировывают, указав номера на рекламационном акте. Затем слиток возвращается обратно в банк.","Для возврата слитка в банк в случае обнаружения повреждений при получении необходимо оформить Рекламационный акт в соответствии с пунктом 2.13.8 Правил оказания сервиса «Покупка/продажа слитков драгоценных металлов». После оформления акта сейф-пакет со слитком следует вернуть в банк. Клиент должен проверить целостность и соответствие номера сейф-пакета со слитком номеру, указанному в Описи, и подписать Опись. В случае повреждений слитка, заводской упаковки или сертификатов, банк не несет ответственности, поэтому важно тщательно проверить целостность при получении.",0.0,0.8772002340700942,0.9999999999,1.0,0.9382456236141812,0.0,0.1500349883723737,0.99336374,0.9230306997706812,0.0
Кто может стать доверенным лицом?,"[""['Доверенное лицо — физическое лицо, уполномоченное Клиентом, которому предоставлено право на представление интересов Клиента и осуществление действий от его имени в рамках Сервиса на основании доверенности, оформленной посредством Дистанционного обслуживания в соответствии с п. 5.3 настоящих Правил по форме Приложения № 5 к настоящим Правилам.']""]","Доверенным лицом клиента может стать любое физическое лицо, которому клиент предоставит полномочия представлять его интересы в рамках сервиса покупки/продажи слитков драгоценных металлов. Доверенность на это лицо оформляется клиентом посредством дистанционного обслуживания в банке по форме из Приложения №5 к Правилам.","Доверенным лицом может стать представитель клиента, который уполномочен представлять интересы клиента и совершать действия от его имени в рамках сервиса ""Покупка/продажа слитков драгоценных металлов"". Доверенность должна быть оформлена в соответствии с требованиями законодательства и содержать прямое указание на необходимые для совершения сделки полномочия представителя.",1.0,0.9131085209186188,0.9999999999,1.0,0.9663820839668048,0.0,0.2702068592217047,0.9946852,0.9226563080202552,1.0
Можно ли поменять доверенное лицо? Как это сделать?,"[""['Клиент может отменить выданную доверенность путем обращения в Банк посредством Дистанционного обслуживания в любое время, но не позднее одного дня до планируемой даты встречи с представителем Клиента.']""]","Да, клиент может отменить ранее выданную доверенность на доверенное лицо. Для этого он должен обратиться в банк посредством дистанционного обслуживания не позднее чем за 1 день до планируемой даты встречи с действующим доверенным лицом.","Для изменения доверенного лица в рамках сервиса «Покупка/продажа слитков драгоценных металлов» необходимо обратиться в Банк через Дистанционное обслуживание. Клиент может отменить выданную доверенность любое время, но не позднее чем за один день до планируемой встречи с представителем.",,0.9105712944467363,0.9999999999,1.0,0.9338186884452212,0.1285,0.3237359211445573,0.99381626,0.8716709466466622,1.0
Как происходит покупка слитка банком? Есть ли какие-то особые условия?,"[""['Банк приобретает у Клиента только Слитки, находящиеся на ответственном хранении в Банке.', 'Клиент, обращаясь с Заявкой, подтверждает, что на момент заключения договора купли-продажи Слиток принадлежит на праве собственности Клиенту, не продан, не является предметом залога, не обременен правами третьих лиц, в споре, под арестом и иным запрещением не состоит.']""]","Банк осуществляет покупку слитков драгоценных металлов только у тех клиентов, чьи слитки находятся на ответственном хранении в самом банке. При подаче заявки на продажу слитка клиент должен подтвердить, что на момент продажи слиток принадлежит ему на праве собственности, не продан, не заложен, не арестован и не обременен правами третьих лиц.","Для совершения покупки слитка банком Tinkoff необходимо оформить Заявку на покупку, подтвердить свое согласие с условиями сделки, подписать соответствующие документы, а также предоставить необходимую информацию о слитке, который будет приобретен. После согласования условий сделки банк зачислит стоимость слитка на картсчет клиента. Важно отметить, что прием слитка банком производится с соблюдением определенных процедур и проверок качества и целостности слитка.",0.0,0.915300586649801,0.9999999999,1.0,0.9100534044438952,0.0,0.136413615440903,0.9870612,0.9447991897828276,1.0
Что такое накопительный счет и как начисляются проценты?,"[""['\\n                    3.1. Начисление процентов на остаток средств по Счету вклада/Накопительному счету производится со дня, следующего \\n                    за днем зачисления денежных средств на Счет вклада/Накопительный счет Клиента, до дня окончания срока Вклада \\n                    (включительно) либо до их списания со Счета вклада/Накопительного счета по иным основаниям.', ' \\n                    3.3. Клиент имеет возможность по согласованию с Банком посредством Дистанционного обслуживания изменить Тарифный \\n                    план Вклада на Тарифный план для мультивалютного Вклада. При смене Тарифного плана изменения в части процентной \\n                    ставки по Счету вклада, изначально открытого в рамках текущего Договора вклада, не распространяются до конца срока \\n                    размещения, установленного предыдущим Тарифным планом. Процентные ставки по валютам, отличным от валюты \\n                    измененного Тарифного плана, устанавливаются новым Тарифным планом.\\n                    3.4. При начислении процентов в расчет принимается величина процентной ставки (в процентах годовых) и фактическое \\n                    количество календарных дней, на которое привлечены денежные средства. При этом за базу берется действительное \\n                    число календарных дней в году (365 или 366 дней соответственно).\\n                    ', ' \\n                    Накопительный счет — счет, на котором учитываются денежные средства Клиента, предусматривающий начисление \\n                    процентов на остаток денежных средств, в соответствии с Договором накопительного счета.']""]","
                    Накопительный счет - это счет, на котором учитываются денежные средства клиента и на который начисляются проценты на остаток денежных средств. Проценты начисляются в соответствии с условиями договора накопительного счета.
                    Проценты на накопительном счете начисляются со дня, следующего за днем зачисления денежных средств на счет, до дня окончания срока вклада (включительно) либо до их списания со счета по другим основаниям.

                    При начислении процентов учитываются:
                    • Величина процентной ставки (в процентах годовых)
                    • Фактическое количество календарных дней, на которое привлечены денежные средства

                    За базу берется действительное число календарных дней в году (365 или 366 дней соответственно).","На накопительный счет в банке Tinkoff можно вносить денежные средства, и начисление процентов на остаток средств происходит с дня, следующего за днем зачисления средств, до дня окончания срока вклада или до списания средств по другим основаниям. Проценты начисляются с учетом процентной ставки (в процентах годовых) и фактического количества календарных дней, на которое привлечены денежные средства, при этом используется действительное число календарных дней в году (365 или 366 дней). При досрочном изъятии вклада производится перерасчет процентов за весь период фактического хранения.",1.0,0.8978089447260157,0.9999999999,0.3333333333333333,0.9033883489851752,0.2768,0.5918388008707555,0.9949704,0.9807235143453537,1.0
Можно ли открыть вклад в 12 лет?,"[""['1.2. Банк не заключает Договор вклада (Договор накопительного счета) с лицами, не достигшими возраста 14 лет']""]","Нет, Банк не заключает договор вклада с лицами, не достигшими возраста 14 лет.","Договор вклада (Договор накопительного счета) с банком Tinkoff может быть заключен лицами, достигшими возраста 14 лет. Поэтому открыть вклад в 12 лет в данном банке невозможно.",,0.8919078382947663,0.9999999999,1.0,0.9044634554556228,0.0818,0.3092933946034364,0.96765304,0.911239517625646,1.0
Могу ли я открыть несколько вкладов и пополнять их?,"[""['\\n                    4.1. Клиент имеет право:\\n                    4.1.1. Предъявить Банку требование о досрочном полном или частичном изъятии Вклада.\\n                    4.1.2. Вносить дополнительные денежные средства во Вклад/Накопительный счет, если данная возможность установлена \\n                    Тарифным планом.\\n                    4.1.3. Разместить несколько Вкладов (открыть несколько Счетов вклада/Накопительных счетов на условиях, устанавливаемых \\n                    Договором вклада (Договором накопительного счета), Тарифами:\\n                    • через Дистанционное обслуживание;\\n                    • в офисе Банка в часы работы операционного подразделения Банка.\\n']""]"," 
                    Да, вы можете открыть несколько вкладов и пополнять их.
                    Согласно пункту 4.1.3 приведенного контекста, клиент имеет право разместить несколько вкладов (открыть несколько счетов вклада/накопительных счетов) на условиях, устанавливаемых договором вклада (договором накопительного счета) и тарифами.
                    Вы можете открыть несколько вкладов как через дистанционное обслуживание, так и в офисе банка в часы работы операционного подразделения банка.","Да, вы можете разместить несколько вкладов в банке Tinkoff и пополнять их. У вас есть право открыть несколько счетов вклада на условиях, установленных договором вклада, через дистанционное обслуживание или в офисе банка. Пополнение вкладов также возможно в соответствии с условиями тарифного плана для данного вида вклада.",1.0,0.9352230719188538,0.9999999999,0.375,0.9282006600823496,0.0,0.5363526715086903,0.9899039,0.9563900293172334,1.0
Для получения страховой выплаты в случае несчастного случая с летальным исходом нужна ли справка из психушки?,"[""['\\n                    6.1. По риску Смерть в результате Несчастного случая должны быть предоставлены следующие документы:\\n                    j. Справка из психоневрологического диспансера и наркологического диспансера']""]","Да, в таком случае необходимы справки из психоневрологического диспансера и наркологического диспансера.","Для получения страховой выплаты в случае несчастного случая с летальным исходом не требуется предоставление справки из психоневрологического диспансера и наркологического диспансера. Необходимо предоставить следующие документы: 
- Свидетельство о смерти
- Решение суда о признании умершего
- Протокол патологоанатомического вскрытия, медицинское свидетельство о смерти
- Результаты химико-токсикологического исследования
- Документы компетентных органов, подтверждающие обстоятельства страхового случая
- Водительское удостоверение (при дорожно-транспортном происшествии)
- Акт о несчастном случае на производстве (при несчастном случае на производстве)
- Справка с датой первичной диагностики травмы
- Выписка из амбулаторной карты
- Документ, удостоверяющий личность и полномочия Выгодоприобретателя или его представителя.",1.0,0.9159783564536258,0.9999999999,0.6666666666666666,0.8501403869291412,0.0005,0.2277913840990156,0.957761,0.8582098899017302,1.0
Дают ли кредит на автомобиль?,"[""['3.1. Банк предоставляет Клиенту Кредит на потребительские цели, в том числе на приобретение Товара и/или Автомобиля, в соответствии с законодательством Российской Федерации.']""]","Да, в соответсвии с пунктом 3.1. Банк предоставляет Клиенту Кредит на потребительские цели, , в том числе на приобретение автомобиля.","Да, банк Tinkoff предоставляет кредиты на автомобили в соответствии с законодательством Российской Федерации. Кредит предоставляется на сумму и на срок, указанные в заявлении клиента или согласованные сторонами до предоставления кредита. Погашение задолженности осуществляется ежемесячно равными платежами, при этом клиент должен обеспечить наличие необходимой суммы на счете не позднее даты оплаты. В случае отказа от исполнения договора купли-продажи автомобиля или его возврата, клиент должен уведомить банк о таком отказе и обеспечить возврат денежных средств на счет для досрочного погашения задолженности.",1.0,0.929021620439272,0.9999999999,1.0,0.8964079201771009,0.0,0.2427024634720895,0.96629745,0.9052471258183152,1.0
Распростроняется ли страховое покрытие на смерть в алкогольном опьянении?,"[""[' \\n                    Страховое покрытие по рискам «Смерть» и «Инвалидность» не распространяется на события, произошедшие в результате \\n                    и/или в период:\\n                    a. действий, совершенных Застрахованным лицом в состоянии алкогольного, наркотического и/или токсического \\n                    опьянения; в результате употребления им наркотических, сильнодействующих лекарственных препаратов \\n                    и психотропных веществ без предписания врача (или по предписанию врача, но с нарушением указанной  \\n                    им дозировки); болезни Застрахованного лица, прямо связанной с наркоманией, токсикоманией, хроническим \\n                    алкоголизмом\\n                    ']""]","Нет, страховое покрытие не распространяется на смерть в алкогольном опьянении.","Страховое покрытие по риску ""Смерть"" и ""Инвалидность"" не распространяется на случаи смерти, которая произошла в состоянии алкогольного, наркотического и/или токсического опьянения, а также в результате употребления наркотических или сильнодействующих лекарственных препаратов без предписания врача.",,0.8873655500763324,0.9999999999,0.5,0.9290738997266522,0.0,0.2294058572527716,0.96432996,0.8277504545910127,1.0
"Может ли Банк изменить Тарифный план по кредитной карте, и какие условия должны быть соблюдены для этого?","[""['\\n                    Банк вправе в одностороннем порядке изменить Тарифный план, применяемый\\nв рамках Договора, и/или заменить его на другой Тарифный план, в том числе при заключении Договора и/или\\nна определенный период времени по усмотрению Банка, с целью уменьшения процентной ставки по кредиту\\nи/или улучшения иных условий обслуживания при условии, что это не повлечет возникновение новых или увеличение размера существующих денежных обязательств Клиента\\n                    ']""]","Да, Банк может изменить Тарифный план по кредитной карте в одностороннем порядке, но при условии, что это не приведет к возникновению новых или увеличению уже существующих денежных обязательств клиента ","Да, банк Tinkoff может изменить Тарифный план по кредитной карте в одностороннем порядке с согласия клиента. Условия изменения Тарифного плана могут включать уменьшение процентной ставки по кредиту и/или улучшение других условий обслуживания без увеличения денежных обязательств клиента. Банк обязан уведомить клиента о таких изменениях посредством Дистанционного обслуживания не позднее дня введения нового Тарифного плана.",0.3333333333333333,0.8761579036097856,0.9999999999,1.0,0.941574137134263,0.1334,0.3206946970082963,0.9799302,0.942454015987778,1.0
Можно ли внести частичное досрочное погашение кредита? И как это повлияет на остаток задолженности?,"[""['«Клиент имеет право досрочно погасить Задолженность с уплатой Банку суммы непогашенного Кредита и начисленных процентов, а также (если применимо) комиссий и плат, предусмотренных Тарифным планом, в любой момент путем зачисления необходимой суммы денежных средств на Картсчет (Счет) и извещения Банка о необходимости проведения досрочного погашения. В случае частичного досрочного погашения уменьшается срок Кредита или сумма Регулярного платежа по выбору Клиента, при этом Клиент не освобождается от оплаты ближайшего Регулярного платежа, а также применимых комиссий и плат, предусмотренных Тарифным планом.», «При обращении Клиента в Банк для совершения частичного досрочного погашения до или в дату оплаты ближайшего Регулярного платежа Клиенту может быть предложено совершить частичное досрочное погашение с погашением ближайшего Регулярного платежа и последующим уменьшением срока Кредита или суммы Регулярного платежа по выбору Клиента.»']""]","Да, Клиент имеет право совершить частичное досрочное погашение кредита. При этом по выбору Клиента уменьшится либо срок кредита, либо сумма регулярного платежа. Однако Клиент не освобождается от оплаты ближайшего регулярного платежа и применимых комиссий.","Да, вы можете внести частичное досрочное погашение кредита в любой момент путем зачисления необходимой суммы на ваш Картсчет и уведомления банка о желании провести досрочное погашение. При частичном досрочном погашении уменьшится срок кредита или сумма регулярного платежа по вашему выбору. Проценты, начисленные после даты частичного досрочного погашения до установленной даты оплаты ближайшего регулярного платежа, включаются в следующий регулярный платеж. При полном погашении ближайшего регулярного платежа, все комиссии и платы будут направлены на их досрочную оплату. В случае обращения в банк для частичного досрочного погашения до или в дату оплаты ближайшего регулярного платежа, вам может быть предложено совершить частичное досрочное погашение с погашением ближайшего регулярного платежа и последующим уменьшением срока кредита или суммы регулярного платежа по вашему выбору.",1.0,0.959219141563131,0.9999999999,1.0,0.9394064899957426,0.016,0.3952531573271154,0.9876411,0.9057936365406402,1.0
Что будет в случае просрочки платежа по кредиту? И какой штраф может быть начислен?,"[""['«В случае неоплаты платежа Клиент должен уплатить штраф за неоплату Минимального платежа согласно Тарифному плану. Банк рассматривает любой поступивший платеж Клиента как признание Клиентом данного штрафа в размере поступившего платежа, но не более суммы штрафа, определенного в соответствии с Тарифами.»']""]","В случае неоплаты минимального платежа по кредиту, Клиент должен уплатить штраф в соответствии с Тарифным планом. Размер штрафа определяется Тарифами, и любой поступивший от Клиента платеж Банк будет рассматривать как оплату штрафа в пределах установленной суммы.","В случае просрочки платежа по кредиту в банке Tinkoff могут быть применены следующие меры:
- Обращение взыскания на предмет залога при просрочке очередного регулярного платежа более чем на 15 календарных дней.
- Потребование досрочного возврата кредита, начисленных процентов, штрафов и пеней в случае неисполнения или ненадлежащего исполнения обязательств клиентом.
- Уступка прав по кредитному договору.
- Другие меры, предусмотренные законодательством Российской Федерации.

Для получения подробной информации рекомендуется обратиться в банк Tinkoff.",0.8,0.9232254776515748,0.9999999999,1.0,0.8733468786156119,0.0,0.0894864420743706,0.97605807,0.8449736697772785,1.0
Можно ли на время приостановить выплаты по кредиту? И как это повлияет на начисление процентов?,"[""['«На основании обращения Клиента и по согласованию с Банком на период от 1 (одного) до 12 (двенадцати) месяцев возможно приостановление обязанности Клиента по погашению Задолженности, по оплате Регулярных платежей и/или иных платежей. В указанный период Банк вправе приостановить начисление процентов и иных сумм, предусмотренных Договором реструктуризации задолженности.»']""]","Да, на основании обращения Клиента и по согласованию с Банком возможно приостановить обязанность по погашению задолженности и оплате платежей на срок от 1 до 12 месяцев. В этот период Банк вправе также приостановить начисление процентов и иных сумм по кредиту.","Да, можно на время приостановить выплаты по кредиту на период от 1 до 12 месяцев. В этот период банк также может приостановить начисление процентов и других сумм, предусмотренных кредитным договором. Оставшийся срок возврата кредита будет продлен на согласованный период приостановления обязанности по погашению задолженности и оплате регулярных платежей.",1.0,0.9740604209466278,0.9999999999,1.0,0.9577075242508932,0.279,0.566260886018281,0.993785,0.9268146880849916,0.5
Я хочу оформить дополнительную карту на супругу. Как это сделать? И будет ли она иметь доступ к общему лимиту по кредитке?,"[""['«3.2. По заявлению Клиента, переданному в Банк на бумажном носителе или через Дистанционное обслуживание, в рамках Договора кредитной карты Банком может быть выпущена одна или несколько дополнительных Кредитных карт.»', '«3.5. Клиент вправе установить лимит для проведения расходных операций с использованием Кредитной карты.»']""]","Вы можете оформить дополнительную кредитную карту на супругу, подав заявление в банк на бумажном носителе или через дистанционное обслуживание. Дополнительная карта будет иметь доступ к общему лимиту задолженности по вашей основной кредитной карте, однако вы можете установить отдельный лимит для расходных операций по дополнительной карте.","Для оформления дополнительной карты на супругу необходимо обратиться в банк Tinkoff и подать заявление через Дистанционное обслуживание или на бумажном носителе. Дополнительная карта будет выпущена для использования супругом, достигшим 18-летнего возраста. Она будет иметь доступ к общему лимиту по кредитке, который может быть установлен клиентом для проведения расходных операций.",1.0,0.921794133193602,0.9999999999,1.0,0.9439297709374848,0.1517,0.3745191423029957,0.9959136,0.935765851442928,1.0
"А что если я потеряю карту? Сколько у меня есть времени, чтобы ее заблокировать? И как вообще это делается? Через приложение или звонить надо?","[""['«6.1. При обнаружении утери, кражи или порчи Кредитной карты и/или возникновения подозрений, что Кредитная карта или ее реквизиты, а также ПИН-код, QR-код, Коды доступа, Аутентификационные данные, Абонентский номер, Абонентское устройство могли быть утрачены или похищены, а также в случае изъятия Кредитной карты в банкомате или торгово-сервисном предприятии и в случае изменения имени или фамилии Держателя Клиент должен незамедлительно уведомить Банк по телефонам 8 800 555-10-10 или +7 495 645-59-19 (круглосуточно) и заблокировать Кредитную карту и/или Интернет-Банк и/или Мобильный банк, а также подать заявление о досрочном перевыпуске Кредитной карты.»']""]","В случае утери или кражи кредитной карты, вы должны незамедлительно уведомить банк по телефонам горячей линии 8 800 555-10-10 или +7 495 645-59-19 (круглосуточно) и заблокировать карту. Также необходимо подать заявление на досрочный перевыпуск новой карты. Чем быстрее вы заблокируете карту, тем меньше риск несанкционированного использования.","При обнаружении утери или кражи карты Tinkoff, вам необходимо незамедлительно уведомить банк по телефонам 8 800 555-25-50 или +7 495 645-59-19 (круглосуточно) и заблокировать карту. Это можно сделать как через звонок, так и через приложение. Банк примет меры по блокированию карты и поддержке по данному вопросу.",1.0,0.8454234673868868,0.9999999999,1.0,0.9571663701095594,0.2626,0.3520886263843412,0.99233496,0.8378417425194958,1.0
"Прочитал тут у вас про блокировку карточки. А если я её забуду забрать в банкомате, что тогда делать?","[""['«6.1. [...] а также в случае изъятия Кредитной карты в банкомате или торгово-сервисном предприятии и в случае изменения имени или фамилии Держателя Клиент должен незамедлительно уведомить Банк по телефонам 8 800 555-10-10 или +7 495 645-59-19 (круглосуточно) и заблокировать Кредитную карту и/или Интернет-Банк и/или Мобильный банк, а также подать заявление о досрочном перевыпуске Кредитной карты.»']""]","Если вы забыли карту в банкомате, вам необходимо незамедлительно сообщить об этом в банк по телефонам горячей линии 8 800 555-10-10 или +7 495 645-59-19 и заблокировать кредитную карту, а также подать заявление на ее досрочный перевыпуск. Это позволит предотвратить возможное несанкционированное использование забытой карты третьими лицами.","Если вы забудете забрать карту из банкомата, вам необходимо обратиться в банк посредством дистанционного обслуживания. Если карта удержана банкоматом стороннего банка, вам следует обратиться в банк, обслуживающий банкомат. В случае технического сбоя или задержки с извлечением карты, вы можете получить ее, предъявив документ, удостоверяющий личность. Некоторые сторонние банки могут потребовать письменный запрос из банка, выпустившего карту. Помните, что сторонний банк вправе не возвращать карту, если она была заблокирована ранее или банком, выпустившим карту.",1.0,0.8998298455543897,0.9999999999,1.0,0.9177661221485282,0.0,0.1973575470338507,0.983254,0.9288284788200644,1.0
"А есть ли какие-то льготные условия, если я захочу приостановить выплаты по кредитке на какое-то время? Например, на ремонт или что-то в этом роде?","[""['«5.15. На основании обращения Клиента и по согласованию с Банком на период от 1 (одного) до 12 (двенадцати) месяцев возможно приостановление обязанности Клиента по погашению Задолженности, по оплате Минимальных платежей, Регулярных платежей и/или иных платежей. В указанный период Банк вправе приостановить начисление процентов и иных сумм, предусмотренных Договором кредитной карты.»']""]","Да, в документе указано, что по обращению клиента и по согласованию с банком возможно приостановление обязанности по погашению задолженности, выплате минимальных и регулярных платежей на срок от 1 до 12 месяцев. В этот период банк также может приостановить начисление процентов и других сумм по кредитной карте. Таким образом, вы можете получить льготный период для ремонта или других нужд, обратившись в банк с соответствующим заявлением.","Да, согласно условиям банка Tinkoff, вы можете запросить приостановление обязанности по погашению задолженности, оплате регулярных платежей и других платежей на период от 1 до 12 месяцев. В этот период банк может также приостановить начисление процентов и других сумм. Оставшийся срок возврата кредита будет продлен на согласованный период приостановления обязанности по погашению задолженности и платежей. Вам следует обратиться в банк для согласования данной процедуры.",1.0,0.8819821371739517,0.9999999999,1.0,0.9571125471004668,0.2799,0.5207777214778986,0.9962025,0.9598133137646524,0.5
Какие процедуры предусмотрены банком для обработки жалоб клиентов?,"[""['Банк имеет установленные процедуры для обработки и рассмотрения жалоб клиентов, включая регистрацию жалобы, ее анализ и предоставление ответа клиенту в установленные сроки.']""]","Банк следует четко установленным процедурам для обработки жалоб клиентов, которые включают регистрацию жалобы, ее тщательный анализ и предоставление ответа клиенту в соответствии с установленными сроками.","Банк Tinkoff предусматривает следующие процедуры для обработки жалоб клиентов:
- Рассмотрение претензий клиента по оспариванию операций в течение 30 дней для операций на территории РФ и 60 дней для операций за пределами РФ после получения письменного заявления и необходимых документов.
- Блокирование действия кредитной карты или токена при отказе клиента от присоединения к общим условиям, неисполнении обязательств или подозрениях на несанкционированное использование.
- Отказ в проведении операции или блокирование карты без уведомления клиента, если не поступил необходимый документ для проведения операции или операция противоречит законодательству.
- Начисление штрафа в случае установления причастности клиента к оспариваемой операции или нарушения общих условий использования кредитной карты.

Если у вас возникли дополнительные вопросы по процедурам обработки жалоб, рекомендуем обратиться в банк Tinkoff для получения более подробной информации.",1.0,0.9653532931472056,0.9999999999,1.0,0.8823611461446544,0.0,0.1109721676007462,0.9797945,0.8162507287395371,0.5
Что происходит с депозитами в случае смерти?,"[""['В случае смерти клиента банк замораживает депозиты до решения вопросов наследства в соответствии с законодательством.']""]","После смерти клиента банк замораживает все его депозиты и удерживает их до тех пор, пока не будут решены вопросы наследства в соответствии с действующим законодательством.","Из предоставленного контекста мы видим, что в рамках программы страхования заемщикам предусматривается страховая защита на случай смерти застрахованного лица. В случае смерти застрахованного лица, страховая сумма устанавливается в размере 100% от суммы выданного кредита застрахованному лицу. После производства страховой выплаты, действие страхового покрытия по программе страхования в отношении конкретного застрахованного лица прекращается.

Таким образом, депозиты в случае смерти застрахованного лица будут покрываться страховой суммой, установленной в отношении данного лица.",0.25,0.8775776426017332,0.9999999999,1.0,0.8579598784667501,0.0,0.0662179243085129,0.9689904,0.6898652167268207,0.5
Могу я отказаться от получения уведомлений от банка и как это влияет на его обслуживание?,"[""['Клиенты имеют право отказаться от получения определенных типов уведомлений от банка, однако это может повлиять на их способность получать своевременную информацию о изменениях условий, сбоях в системе или других важных обновлениях.']""]","Клиенты могут отказаться от получения определенных типов уведомлений от банка, но это может привести к тому, что они не будут получать важные обновления и информацию своевременно, что может повлиять на их способность управлять своими счетами и услугами эффективно.","Из предоставленного контекста не ясно, есть ли возможность отказаться от получения уведомлений от банка Tinkoff и как это может повлиять на обслуживание. Рекомендую обратиться в банк для получения точной информации по этому вопросу.",,0.0,0.9999999999,1.0,0.9059754665548796,0.0,0.2535443201746521,0.98928046,0.8743821234789056,1.0
Как я могу увеличить лимит по своей кредитной карте?,"[""['Для увеличения кредитного лимита клиенты должны подать заявление через мобильное приложение или веб-сайт банка, после чего банк рассмотрит их кредитную историю и текущую финансовую ситуацию.']""]","Чтобы увеличить кредитный лимит, клиентам необходимо подать соответствующее заявление через мобильное приложение или веб-сайт банка. Банк затем оценит их кредитную историю и текущую финансовую ситуацию перед принятием решения.",Для увеличения лимита по вашей кредитной карте вы можете обратиться в банк посредством Дистанционного обслуживания с требованием увеличить лимит. Банк устанавливает и изменяет лимит кредитной линии по собственному усмотрению и может изменить его в одностороннем порядке. Вы также можете запросить уменьшение лимита до предыдущего значения после его увеличения.,1.0,0.985840131367904,0.9999999999,1.0,0.9110347733093012,0.0,0.06536020366675,0.9820508,0.836299776893293,1.0
"Каковы условия отмены банковской операции, например, перевода средств или платежа?","[""['Клиенты могут отменить определенные банковские операции, если они не были еще обработаны банком. Условия отмены операций установлены в пользовательском соглашении и зависят от типа операции.']""]","Условия отмены банковской операции зависят от того, была ли операция уже обработана банком. Для операций, которые еще не обработаны, клиенты могут инициировать отмену, следуя процедурам, описанным в пользовательском соглашении и в зависимости от типа операции.","Для отмены банковской операции, например, перевода средств или платежа, банк Tinkoff имеет право отказаться от выполнения операции в следующих случаях:
1. В случаях, предусмотренных законодательством Российской Федерации.
2. Если совершение операции ограничено по независящим от банка обстоятельствам.
3. Если возникли подозрения, что операция связана с предпринимательской деятельностью клиента или его представителя.
4. Если права клиента по распоряжению денежными средствами на карточном счете ограничены.
5. Если держатель не исполнил обязательства, предусмотренные общими условиями банка.

Банк вправе отменить ошибочные операции без уведомления клиента и заблокировать доступ к дистанционному обслуживанию в случае необходимости. Дополнительные условия и причины отказа могут быть предусмотрены законодательством и внутренними правилами банка Tinkoff.",0.8333333333333334,0.894931072914873,0.9999999999,1.0,0.9000399934719205,0.0,0.1591976186528128,0.9812777,0.8141724527666861,1.0
Какие услуги доступны клиентам через Интернет-банк?,"[""['Через Интернет-банк клиенты могут управлять своими счетами, осуществлять платежи и переводы, а также получать детальную информацию о своих финансовых операциях.']""]","Интернет-банк предоставляет клиентам возможности управления их счетами, осуществления платежей и переводов, а также доступ к подробной информации о всех их финансовых операциях.","Через Интернет-банк клиенты банка Tinkoff могут воспользоваться услугами для получения информации и совершения операций. Клиент может также изменить свои аутентификационные данные в соответствии с условиями. Помимо Интернет-банка, клиенты могут осуществлять операции через Мобильный банк, мобильные приложения банка и другие каналы обслуживания в Интернете.",0.3333333333333333,0.9620279412800788,0.9999999999,1.0,0.9193824493445736,0.0,0.0974536872665753,0.97862345,0.9112331082517732,0.0
"Я не пользовалась кредиткой год, но у меня там лежат мои 800 рублей, я могу их как-то вернуть?","['[\'""8. Расторжение Договора кредитной карты\\n                8.1. Банк вправе в любой момент расторгнуть Договор кредитной карты в одностороннем порядке в случаях, предусмотренных \\n                законодательством Российской Федерации, а также:\\n                • в случае если Держатель не пользовался Кредитной картой более, чем 6 (шесть) месяцев при отсутствии \\n                Задолженности по Договору кредитной карты;\\n                В этих случаях Банк блокирует все Кредитные карты/Токены, выпущенные в рамках Договора кредитной карты. Договор \\n                кредитной карты считается расторгнутым со дня формирования Банком Заключительного счета, который направляется \\n                Клиенту. Если в момент расторжения Договора кредитной карты Задолженность Клиента перед Банком отсутствует, Банк \\n                вправе расторгнуть Договор кредитной карты без направления Заключительного счета, информируя Клиента о своем \\n                решении любым способом по усмотрению Банка.\\n                8.5. В случае, если при расторжении Договора кредитной карты в Банке находятся денежные средства Клиента, излишне \\n                перечисленные им при погашении Задолженности, Банк осуществляет возврат таких денежных средств по распоряжению \\n                Клиента почтовым переводом или иным способом, указанном в распоряжении Клиента. При этом Банк вправе удержать \\n                из суммы такого перевода комиссию за перевод денежных средств в размере, предусмотренном Тарифами на услуги \\n                по переводам, платежам и дополнительные услуги с использованием каналов Дистанционного обслуживания.\\n                8.6. В случае неполучения Банком распоряжения Клиента о переводе денежных средств в течение 120 (ста двадцати) дней \\n                со дня обработки Банком последней операции Клиента/Держателя и, если остаток денежных средств не превышает \\n                1000 руб., указанный остаток считается безвозмездно переданным Банку. \\n                В случае неполучения Банком распоряжения Клиента о переводе денежных средств в течение 3 (трех) лет со дня обработки \\n                Банком последней операции Клиента/Держателя указанные денежные средства считаются безвозмездно переданными \\n                Банку.\\n                \']']","Согласно пунуту 8.6 - вы не можете вернуть ваши деньги, так как не дали распоряжение Банку о переводе денежных средств в течение 120 дней.","Для возврата денежных средств, оставшихся на кредитной карте после погашения задолженности, необходимо обратиться в банк Tinkoff. В соответствии с условиями пользовательского соглашения, банк осуществляет возврат излишне перечисленных средств по распоряжению клиента почтовым переводом или иным способом, указанным клиентом. Банк также вправе удержать комиссию за перевод средств в соответствии с тарифами на услуги по переводам. По истечении определенного срока без получения распоряжения клиента о возврате средств, банк вправе считать оставшиеся на карте средства безвозмездно переданными.",1.0,0.0,0.9999999999,0.0769230769230769,0.8639884447381947,0.0,0.0542498281144334,0.95851445,0.8395083461393255,0.0
