question,contexts,ground_truth,answer,faithfulness,answer_relevancy,context_precision,context_relevancy,answer_similarity,bleu_score,cos-sim-TF-IDF,sim-spacy,cos-sim-BertModel
Можно ли не расписываться на карте?,"[""['После получения карты поставьте свою подпись в прямоугольнике, расположенном на оборотной стороне карты. При отсутствии подписи карта может быть не принята к оплате в торгово-сервисном предприятии, а также повышается риск использования карты злоумышленниками в случае ее утраты/кражи.']""]","При отсутствии подписи карта может быть не принята к оплате в торгово-сервисном предприятии, а также повышается риск использования карты злоумышленниками в случае ее утраты/кражи.","Нет, согласно представленному контексту, карта недействительна без подписи держателя на полосе для подписи.",,0.8557958947203147,0.9999999999,1.0,0.8792580322620562,0.0,0.09359350353245702,0.7118366604115741,0.9802726
"Мой друг попросил меня дать свою карту для оплаты и потом вернуть, это не опасно?","[""['Никогда не принимайте рекомендации, советы, помощь от третьих лиц при пользовании картой, особенно при снятии наличных денежных средств в банкоматах. В случае возникновения затруднений при совершении операции обратитесь Банк посредством дистанционного обслуживания. Обращайте внимание на расположение банкоматов. Старайтесь не пользоваться банкоматами, расположенными в плохо освещенных и безлюдных местах', 'Не передавайте карту другим лицам, в т.ч. родственникам и знакомым для проведения транзакций. С целью исключения Ваших потерь от несанкционированного использования Вашей карты (копирования информации с Вашей карты для ее дальнейшего мошеннического использования): при совершении операции оплаты с использованием карты никогда не выпускайте Вашу карту из поля зрения и требуйте от обслуживающего Вас лица, чтобы все операции с использованием карты совершались в Вашем присутствии.']""]","Не передавайте карту другим лицам, в т.ч. родственникам и знакомым для проведения транзакций и никогда не принимайте рекомендации, советы, помощь от третьих лиц при пользовании картой, особенно при снятии наличных денежных средств в банкоматах.","Использование карты будет безопасным, если Вы постараетесь следовать простым правилам, приведенным в этом разделе. Пожалуйста, не забудьте также внимательно ознакомиться с разделом «Что такое ПИН-код и как обеспечить его конфиденциальность». Обращайтесь с картой также аккуратно и бережно, как и с наличными денежными средствами. Храните карту в безопасном месте, не оставляйте ее в автомобиле, в номере гостиницы, а также в местах, где посторонние имеют возможность взять карту, скопировать информацию, указанную на карте. Никогда не принимайте рекомендации, советы, помощь от третьих лиц при пользовании картой, особенно при снятии наличных денежных средств в банкоматах. В случае возникновения затруднений при совершении операции обратитесь Банк посредством дистанционного обслуживания. Обращайте внимание на расположение банкоматов. Старайтесь не пользоваться банкоматами, расположенными в плохо освещенных и безлюдных местах. Не передавайте карту другим лицам, в том числе родственникам и знакомым для проведения транзакций. С целью исключения Ваших потерь от несанкционированного использования Вашей карты (копирования информации с Вашей карты для ее дальнейшего мошеннического использования): при совершении операции оплаты с использованием карты никогда не выпускайте Вашу карту из поля зрения и требуйте от обслуживающего Вас лица, чтобы все операции с использованием карты совершались в Вашем присутствии.",,0.0,0.9999999999,1.0,0.9115969641127376,0.0097,0.4413928791316737,0.912587403832358,0.98476505
Безопасно ли хранить пинкод в заметках в телефоне?,"[""['Категорически запрещается записывать ПИН-код на карте. Постарайтесь не записывать ПИН-код, запомните его. Если же Вы предпочитаете записать свой ПИН-код, никогда не указывайте, что это ПИН-код и не храните документ с записанным ПИН-кодом рядом с картой.']""]","Да, однако не указывайте в названии заметки, что это ПИН-код от Вашей карты.","Нет, не рекомендуется хранить пин-код в заметках в телефоне. Это может привести к несанкционированному доступу к вашим финансовым данным и повышает риск кражи личных данных. Следуйте советам по обеспечению конфиденциальности ПИН-кода, чтобы защитить свои финансы.",,0.0,0.9999999999,1.0,0.8856544899689439,0.0,0.13793680603009006,0.7081583911472232,0.9617758
Я потеряла карту,"[""[' Вы потеряли карту или ее украли\\nПрежде всего, как можно быстрее, сообщите о случившемся в Банк посредством дистанционного обслуживания \\nи заблокируйте карту. Заблокировать карту можно по телефону, в интернет-банке или в мобильном приложении Банка. \\nЧем раньше Вы это сделаете, тем меньше вероятность несанкционированного использования карты злоумышленниками. \\nРазблокировать карту нельзя — можно только перевыпустить. Если вы не уверены, что карту украли, не спешите ее \\nблокировать, установите лимит «0» на операции и запретите покупки через Интернет, если карта будет найдена лимиты \\nможно изменить.\\nНапоминаем Вам, что в соответствии с Общими условиями выпуска и обслуживания кредитных карт и Общими \\nусловиями открытия, ведения и закрытия счетов физических лиц, а также выпуска и обслуживания расчетных карт Ваша \\nответственность за дальнейшее использование карты прекращается, после осуществления блокировки, если не станет \\nизвестно, что незаконное использование карты имело место с Вашего согласия.\\nЕсли карта была у Вас украдена на территории РФ, после блокировки карты заявите о случившемся в полицию. При краже \\nкарты за границей, заявите в полицию или в консульский отдел посольства Российской Федерации в стране, на территории \\nкоторой произошла кража. Пожалуйста, сохраняйте копию протокола (квитанцию о заявлении) для последующего \\nпредъявления в Банк.']""]","Если вы не уверены, что карту украли, не спешите ее блокировать, установите лимит «0» на операции и запретите покупки через Интернет, если карта будет найдена лимиты можно изменить. В случае, если вы полагаете, что Вашу карту всё-таки украли, то как можно быстрее, сообщите о случившемся в Банк посредством дистанционного обслуживания и заблокируйте карту. Это возможно сделать по телефону, в интернет-банке или в мобильном приложении Банка.","Если вы потеряли карту, вам следует немедленно заблокировать ее через приложение или сайт банка, а также сообщить о случившемся в полицию. Если карта была украдена за границей, также обратитесь в полицию или консульский отдел посольства Российской Федерации в стране, где произошла кража. Сохраните копию протокола (квитанцию о заявлении) для последующего предъявления в Банк. Если карта была изъята в торгово-сервисном предприятии или учреждении банка, потребуйте составления акта об изъятии с указанием даты, времени и причины изъятия, а также подписью сотрудника предприятия/банка, изъявшего карту. После этого срочно проинформируйте об изъятии Банк посредством дистанционного обслуживания. Если карта была удержана банкоматом, обратитесь в банк посредством дистанционного обслуживания. Если карта была удержана банкоматом стороннего банка, обратитесь в банк, обслуживающий банкомат, и, если удержание карты произошло по причине технического сбоя или из-за промедления с извлечением карты из приемного устройства банкомата, карта может быть выдана вам при предъявлении документа, удостоверяющего личность. Некоторые сторонние банки для выдачи удержанной банкоматом карты могут потребовать письменный запрос из банка, выпустившего карту. В этом случае обратитесь в банк, выпустивший карту. Помните, что сторонний банк, обслуживающий банкомат, вправе не возвращать карту, если она была заблокирована вами ранее или банком, выпустившим карту. Если банкомат не выдал запрашиваемую сумму денежных средств либо выдал, отличную от запрашиваемой суммы, вам следует сообщить об этом в Банк посредством дистанционного обслуживания и оформить претензию. Сотрудник Банка поможет вам в этом.",,0.0,0.9999999999,0.1,0.9056666202827104,0.0106,0.2822050254382669,0.9334906414503714,0.9925323
"Почему при использовании карты важно не расписываться на квитанциях/чеках до того, как вы проверите правильность указанной суммы?","[""['Проверяйте правильность суммы, указанной на платежном чеке. Поставив подпись на платежном чеке, Вы соглашаетесь со списанием указанной на нем суммы с Вашего карточного счета.']""]","Важно проверять правильность суммы перед подписанием квитанции/чека, потому что после подписи вы соглашаетесь с этой суммой, и она будет списана с вашего счета.","Подписывая квитанции или чеки до проверки правильности указанной суммы, вы можете стать жертвой мошенничества. Если сумма на квитанции или чеке не соответствует фактической сумме покупки, вы можете случайно подписать документ, который содержит неверную информацию. Это может привести к нежелательным финансовым последствиям. Поэтому важно проверять правильность указанной суммы перед тем, как подписывать квитанции или чеки.",1.0,0.9410578298193064,0.9999999999,1.0,0.93353203883616,0.0,0.1653754365578396,0.9040029456559904,0.9626525
"Что делать, если я потеряла телефон, на котором было установлено мобильное приложение банка?","[""['При утрате Мобильного телефона, используемого с абонентским номером подвижной радиотелефонной связи, на который установлено Мобильное приложение Банка, Вам следует срочно обратиться к своему оператору сотовой связи для блокировки SIM-карты и в Банк посредством дистанционного обслуживания для блокировки доступа в мобильное приложение Банка и удаления данных карты с Мобильного телефона.']""]","Если вы потеряли телефон с установленным мобильным приложением банка, необходимо:

Срочно обратиться к оператору сотовой связи для блокировки SIM-карты.
Обратиться в банк через дистанционное обслуживание для блокировки доступа в мобильное приложение и удаления данных карты с телефона.","Если вы потеряли телефон, на котором было установлено мобильное приложение банка Tinkoff, вам следует немедленно связаться с банком и сообщить о потере устройства. Банк может помочь вам заблокировать доступ к вашему аккаунту и предотвратить возможные несанкционированные операции. Также рекомендуется сменить пароль для вашего аккаунта после восстановления доступа к нему.",1.0,0.9590646248185184,0.9999999999,1.0,0.9246612184554162,0.0,0.15182242704716892,0.802453706683331,0.9894642
Можно ли использовать интернет-кафе и другие общедоступные места для совершения операций по карте в интернете? Объясните причину.,"[""['Избегайте осуществления Интернет-операций с использованием карты в местах, где услуги Интернет являются общедоступными, например, в Интернет-кафе.']""]","Нет, не рекомендуется использовать интернет-кафе и другие общедоступные места для совершения операций по карте в интернете. Причина в том, что такие общедоступные сети являются менее безопасными, и есть риск перехвата данных карты злоумышленниками.","Нет, вы не можете использовать интернет-кафе и другие общедоступные места для совершения операций по карте в интернете. Это связано с безопасностью и защитой ваших личных данных. Операции по карте должны проводиться в безопасной среде, где вы можете быть уверены в конфиденциальности своих данных.",1.0,0.9529143894073232,0.9999999999,1.0,0.9564332020656888,0.2872,0.3327650760148249,0.8948195383923833,0.99140805
"Что делать, если я получил SMS-оповещение о операции по карте, которую я не совершал?","[""['Если Вы уверены, что операция не могла быть совершена Вами, то как можно быстрее сообщите об этом в Банк посредством дистанционного обслуживания и заблокируйте карту.']""]","Если вы получили SMS-оповещение о операции, которую не совершали, нужно как можно быстрее сообщить об этом в банк через дистанционное обслуживание и заблокировать карту.","Если вы получили SMS-оповещение о операции по карте, которую вы не совершали, вам следует проверить наличие карты. Если карта у вас, возможно, данные вашей карты стали известны третьим лицам. Пожалуйста, учитывайте, что иногда SMS-сообщения могут доставляться с задержкой, поэтому вспомните, соответствует ли текст в SMS-сообщении операциям, которые вы совершили по карте за последнее время. Если вы уверены, что не совершали данную операцию, вам следует связаться с банком для проверки и блокировки карты.",,0.9774982238627414,0.9999999999,1.0,0.9396009842769676,0.0251,0.22887798141790805,0.8288664579278532,0.9792441
Как обезопасить себя от съема данных карты в банкомате злоумышленниками? Приведи два способа.,"[""['Поэтому, при пользовании банкоматом не ленитесь внимательно осмотреть его и убедиться в отсутствии каких-либо «накладок» и посторонних устройств.', 'Пожалуйста, примите все меры, чтобы вводимый Вами ПИН-код был не заметен для окружающих.']""]","Чтобы обезопасить себя от съема данных карты в банкомате:

Внимательно осматривайте банкомат перед использованием на наличие подозрительных накладок и посторонних устройств.
Прикрывайте рукой клавиатуру при вводе ПИН-кода, чтобы его не могли увидеть окружающие.","Для того чтобы обезопасить себя от съема данных карты в банкомате злоумышленниками, можно следовать следующим рекомендациям:

1. Осмотрите банкомат перед использованием. Проверьте, нет ли на нем каких-либо накладок или посторонних устройств. Если вы заметили что-то подозрительное, откажитесь от использования этого банкомата.

2. Не вводите свой ПИН-код в присутствии других людей. Старайтесь, чтобы вводимый вами ПИН-код был не заметен для окружающих.

3. Будьте внимательны при использовании интернет-магазинов. Старайтесь пользоваться проверенными интернет-магазинами, в надежности которых вы уверены.",1.0,0.9582831195150908,0.9999999999,1.0,0.9672652221396216,0.0633,0.2826576605544967,0.8899155681702148,0.98712456
"Правда ли, что при бронировании гостиницы по карте мне необходимо сообщить все реквизиты карты, включая ПИН-код? Если нет, то что именно требуется сообщить?","[""['При бронировании номера в гостинице по карте Вас попросят сообщить свое имя, номер карты, срок ее действия (иногда, дополнительно — трехзначный код безопасности, напечатанный на обратной стороне карты на полосе для подписи) и срок Вашего пребывания.']""]","Нет, неправда. При бронировании гостиницы по карте не требуется сообщать ПИН-код. Обычно для бронирования запрашивают ваше имя, номер карты, срок ее действия, иногда трехзначный код безопасности (CVV/CVC) с оборотной стороны карты и планируемый срок пребывания.","При бронировании номера в гостинице по карте Вам потребуется сообщить свое имя, номер карты, срок ее действия (иногда, дополнительно — трехзначный код безопасности, напечатанный на обратной стороне карты на полосе для подписи) и срок Вашего пребывания.",,0.9197987786968534,0.9999999999,1.0,0.9428311182908844,0.1478,0.41005058210745426,0.9123660311760148,0.9921065
"Если я из другой страны и у меня нет паспорта РФ, что мне делать?","[""['\\n                     1. Документы и сведения, получаемые в целях идентификации Клиентов-физических лиц, а также в целях обслуживания таких Клиентов в рамках Универсального договора\\n                     1.4. Реквизиты документа, удостоверяющего личность: серия (при наличии) и номер документа, дата выдачи документа, наименование органа, выдавшего документ (при наличии кода подразделения может не устанавливаться), и код подразделения (при наличии).\\n                     1.4.2.для иностранных граждан:\\n                     •паспорт иностранного гражданина;\\n                     •дипломатический паспорт, служебный паспорт, удостоверяющие личность иностранного гражданина.', '.5.Документ, подтверждающий право иностранного гражданина или лица без гражданства на пребывание (проживание) в Российской Федерации (миграционной карты в случае отсутствия иных документов), в случае если наличие таких документов обязательно в соответствии с международными договорами Российской Федерации и законодательством Российской Федерации;Документами, подтверждающими право иностранного гражданина или лица без гражданства на пребывание (проживание) в РФ, являются:\\n                    •миграционная карта в случае отсутствия иных документов;\\n                    •вид на жительство;\\n                    •разрешение на временное проживание;\\n                    •виза;\\n                    •иной документ, подтверждающий в соответствии с международными договорами Российской Федерации и законодательством РФ право иностранного гражданина или лица без гражданства на пребывание (проживание) в РФ.\\n']""]","
                        Если вы из другой страны, то для заключения договора вам неообходимы документы, удостоверяющие Вашу личность. Для иностранных граждан это:
                            •паспорт иностранного гражданина;
                            •дипломатический паспорт, служебный паспорт, удостоверяющие личность иностранного гражданина.
                        Также необходимы документы, подтверждающие право иностранного гражданина (проживание) в Российской Федерации (миграционной карты в случае отсутствия иных документов), в случае если наличие таких документов обязательно в соответствии с международными договорами Российской Федерации и законодательством Российской Федерации;Документами, подтверждающими право иностранного гражданина или лица без гражданства на пребывание (проживание) в РФ, являются:
                            •миграционная карта в случае отсутствия иных документов;
                            •вид на жительство;
                            •разрешение на временное проживание;
                            •виза;
                            •иной документ, подтверждающий в соответствии с международными договорами Российской Федерации и законодательством РФ право иностранного гражданина или лица без гражданства на пребывание (проживание) в РФ. ","Если вы находитесь в другой стране и у вас нет паспорта РФ, вам следует обратиться в полицию или консульский отдел посольства Российской Федерации в стране, где произошла кража. Пожалуйста, сохраните копию протокола (квитанцию о заявлении) для последующего предъявления в Банк. Если карта была удержана банкоматом, обратитесь в банк, выпустивший карту, и, если удержание карты произошло по причине технического сбоя или из-за промедления с извлечением карты из приемного устройства банкомата, карта может быть выдана вам при предъявлении документа, удостоверяющего личность.",0.0,0.0,0.9999999999,0.1666666666666666,0.8694836714736061,0.0,0.13810803292357587,0.8185374753604167,0.9832855
В течении скольких дней действительна выписка из ЕГРЮЛ?,"[""['\\n                    2.2. Выписка из Единого государственного реестра юридических лиц (ЕГРЮЛ). Банком может быть принята копия \\n                    выписки, заверенная регистрирующим органом. Выписка считается действительной для предоставления в Банк \\n                    в течение 30 (тридцати) календарных дней с даты ее выдачи и должна содержать актуальные сведения на дату  \\n                    ее предоставления;']""]",Выписка из Единого государственного реестра юридических лиц (ЕГРЮЛ) действительна в течении 30 дней с даты ее выдачи.,Выписка из ЕГРЮЛ действительна в течение 30 календарных дней с даты ее выдачи.,1.0,0.971801912485207,0.9999999999,0.25,0.9480908907911868,0.2818,0.5476747268645816,0.9303222532030372,0.97988063
Нужно ли ИП указывать свой сайт для предприятия?,"[""['\\n                    3. Документы и сведения, предоставляемые Клиентом-индивидуальным предпринимателем: \\n                    3.5. Сведения о доменном имени, указателе страницы сайта в сети «Интернет», с использованием которых Клиентом \\nоказываются услуги (при наличии);\\n                    ']""]","Да, индивидуальному предпринимателю необходимо указать сведения о доменном имени, указателе страницы сайта в сети «Интернет».","Из предоставленного контекста не следует, что индивидуальному предпринимателю необходимо указывать свой сайт для предприятия.",,0.9593050455821196,0.9999999999,0.6666666666666666,0.9132273692844276,0.0,0.12647323090177526,0.7177985248049582,0.9896487
Может ли Банк запросить дополнительные документы - не из списка обязательных?,"[""['\\n                     26. Банк может запросить у Клиента, а Клиент обязуется предоставить по запросу Банка дополнительные документы \\n                    и сведения, как предусмотренные, так и не предусмотренные настоящим Перечнем, в том числе в целях надлежащей \\n                    идентификации Клиента, его представителя, выгодоприобретателя и бенефициарного владельца в соответствии \\n                    с требованиями действующего законодательства Российской Федерации, нормативных актов Банка России, а также \\n                    требованиями Банка. Банк вправе не запрашивать отдельные документы и сведения, предусмотренные настоящим \\n                    Перечнем, в случаях, установленных внутренними правилами Банка.']""]","Да, Банк может запросить у Вас дополнительные не предусмотренные Перечнем документы.","Да, Банк может запросить у клиента дополнительные документы, не из списка обязательных, в целях надлежащей идентификации клиента, его представителя, выгодоприобретателя и бенефициарного владельца в соответствии с требованиями действующего законодательства Российской Федерации, нормативных актов Банка России, а также требованиями Банка. Банк вправе не запрашивать отдельные документы и сведения, предусмотренные настоящим Перечнем, в случаях, установленных внутренними правилами Банка.",1.0,0.9464817434597044,0.9999999999,0.25,0.91862942291292,0.0066,0.3471584278077614,0.7695683320660042,0.9591777
Какие документы нужно предоставить физическому лицу для открытия счета?,"[""['1. Документы и сведения, получаемые в целях идентификации Клиентов-физических лиц, а также в целях обслуживания таких Клиентов в рамках Универсального договора']""]","Физическому лицу для открытия счета необходимо предоставить документ, удостоверяющий личность (паспорт или иной документ из списка в п.1.4), документ, подтверждающий регистрацию или место пребывания, ИНН, СНИЛС и контактную информацию.","Для открытия счета физическому лицу необходимо предоставить документы и сведения, указанные в Перечне документов и сведений, предоставляемых Клиентом (представителем Клиента) для присоединения к условиям Универсального договора.",,0.9814992047945742,0.9999999999,1.0,0.9424830509691088,0.0,0.1678416463164349,0.897881600049615,0.9833087
Какие документы необходимо предоставить юридическому лицу для открытия счета в Банке? Можно ли предоставить сканы документов или нужны оригиналы?,"[""['2.1. Учредительные документы юридического лица...', '2.2. Выписка из Единого государственного реестра юридических лиц (ЕГРЮЛ)...', '2.3. Документ об избрании единоличного исполнительного органа юридического лица...']""]","Юридическому лицу необходимо предоставить учредительные документы, выписку из ЕГРЮЛ, документ об избрании руководителя, документы, подтверждающие личность руководителя и лиц, имеющих право подписи. Документы можно предоставить в копиях, заверенных нотариально, регистрирующим органом, руководителем или сотрудником Банка при наличии оригиналов.","Для открытия счета в Банке юридическому лицу необходимо предоставить следующие документы:

1. Учредительные документы юридического лица, заверенные регистрирующим органом. Учредительные документы предоставляются в виде последней актуальной и действующей на дату предоставления в Банк редакции.

2. Выписка из Единого государственного реестра юридических лиц (ЕГРЮЛ), заверенная регистрирующим органом. Выписка считается действительной для предоставления в Банк в течение 30 календарных дней с даты ее выдачи и должна содержать актуальные сведения на дату ее предоставления.

3. Документ об избрании единоличного исполнительного органа юридического лица. Предоставляется решение (протокол) того органа управления (собрание учредителей/акционеров, совет директоров и т.д.), который, в соответствии с Уставом юридического лица, уполномочен назначать руководителя. Должность руководителя в документе о его избрании должна соответствовать должности согласно Уставу юридического лица.

Документы могут быть предоставлены как в оригинале, так и в виде сканов, заверенных регистрирующим органом.",1.0,0.9496303523154956,0.9999999999,1.0,0.9568569424141014,0.0,0.2632369623701666,0.9270108017128208,0.9851833
Можно ли открыть счет индивидуальному предпринимателю – иностранному гражданину? Какие документы для этого нужны?,"[""['3.1. Идентификация индивидуального предпринимателя осуществляется на основании документов и сведений, указанных в пункте 1.4 настоящего Перечня', '3.2. Документ, подтверждающий право иностранного гражданина или лица без гражданства на пребывание (проживание) в Российской Федерации...']""]","Да, индивидуальному предпринимателю-иностранному гражданину можно открыть счет. Для этого нужно предоставить документ, удостоверяющий личность, документ, подтверждающий право пребывания/проживания в РФ (напр. миграционную карту), ИНН, СНИЛС, выписку из ЕГРИП и контактную информацию.","Да, индивидуальный предприниматель – иностранный гражданин может открыть счет в банке Tinkoff. Для этого ему необходимо предоставить следующие документы:

1. Документы, удостоверяющие личность иностранного гражданина в соответствии с законодательством Российской Федерации и международным договором Российской Федерации.
2. Документы, удостоверяющие личность лиц без гражданства в соответствии с законодательством Российской Федерации и международным договором Российской Федерации.
3. Документ, подтверждающий право иностранного гражданина или лица без гражданства на пребывание (проживание) в Российской Федерации.
4. Адрес места жительства (регистрации) или места пребывания.
5. Идентификационный номер налогоплательщика (при наличии).
6. Информация о страховом номере индивидуального лицевого счета застрахованного лица в системе обязательного пенсионного страхования (при необходимости).
7. Контактная информация (например, номер телефона, факса, адрес электронной почты, почтовый адрес, при его наличии).",0.6666666666666666,0.9331957989195528,0.9999999999,0.0,0.9391486115679726,0.0,0.09575105150629708,0.8691308766901528,0.94369763
"Какие документы потребуются, если открывать счет для нотариуса, занимающегося частной практикой? Может ли нотариус быть иностранцем при этом?","[""['5.1. Документ, удостоверяющий личность и указанный в пункте 1.4 настоящего Перечня', '5.2. Документ, подтверждающий наделение нотариуса полномочиями (назначение на должность), выдаваемый органами юстиции субъектов Российской Федерации, в соответствии с законодательством Российской Федерации']""]","Для открытия счета нотариусу, занимающемуся частной практикой, требуется предоставить документ, удостоверяющий личность, документ о назначении на должность нотариуса от органов юстиции, регистрационные документы, финансовые документы и контактные данные. Нотариус может быть иностранцем, в этом случае дополнительно потребуется документ, подтверждающий право на пребывание/проживание в РФ.","Для открытия счета нотариуса, занимающегося частной практикой, потребуются следующие документы:

1. Документ, удостоверяющий личность и указанный в пункте 1.4 настоящего Перечня.
2. Документ, подтверждающий наделение нотариуса полномочиями (назначение на должность), выдаваемый органами юстиции субъектов Российской Федерации, в соответствии с законодательством Российской Федерации.
3. Адрес места жительства (регистрации) или места пребывания (если его нельзя установить из документа, удостоверяющего личность, а также если адрес места жительства (регистрации) или места пребывания не совпадают).
4. Контактная информация (например, номер телефона, факса, адрес электронной почты, почтовый адрес (при наличии).
5. Выписка из ЕГРИП. Банком может быть принята копия выписки, заверенная регистрирующим органом. Выписка считается действительной для предоставления в Банк в течение 30 (тридцати) календарных дней с даты ее выдачи и должна содержать актуальные сведения на дату ее предоставления.
6. Информация о страховом номере индивидуального лицевого счета застрахованного лица в системе обязательного пенсионного страхования (при необходимости).
7. Сведения о целях установления и предполагаемом характере деловых отношений с Банком, сведения о целях финансово-хозяйственной деятельности (по форме Банка). Сведения о целях установления и предполагаемом характере деловых отношений с Банком, а также сведения о целях финансово-хозяйственной деятельности клиента устанавливаются однократно при приеме Клиента на обслуживание и обновляются при возникновении сомнений в их достоверности.
8. Сведения о деловой репутации (отзывы (в произвольной письменной форме) о Клиенте от других клиентов Банка, имеющих деловые отношения с Клиентом; и (или) отзывы (в произвольной письменной форме) от других кредитных организаций).

Нотариус может быть иностранцем при этом.",,0.9622788045854258,0.9999999999,1.0,0.9571187322768556,0.0,0.17596962844354536,0.9251979675377044,0.98508596
"Как узнать, кто является бенефициарным владельцем юридического лица? Какие документы для этого нужны?","[""['12. Идентификация бенефициарного(ых) владельца(ев) осуществляется на основании следующий документов и сведений...']""]","Для идентификации бенефициарного владельца юридического лица необходимо предоставить документы, удостоверяющие личность бенефициара, документ о регистрации/пребывании в РФ (если бенефициар - иностранец), ИНН, адрес регистрации и контактные данные. Также можно заполнить анкету бенефициарного владельца по форме Банка.","Для того чтобы узнать, кто является бенефициарным владельцем юридического лица, необходимо обратиться к документам, указанным в пункте 12 Перечня документов и сведений, предоставляемых Клиентом (представителем Клиента) для присоединения к условиям Универсального договора. Эти документы включают:

1. Документы, удостоверяющие личность и указанные в пункте 1.4 настоящего Перечня.
2. Документ, подтверждающий право иностранного гражданина или лица без гражданства на пребывание (проживание) в Российской Федерации (миграционной карты в случае отсутствия иных документов), если наличие таких документов обязательно в соответствии с международными договорами Российской Федерации и законодательством Российской Федерации, и указанные в пункте 1.5 настоящего Перечня.
3. Сведения об идентификационном номере налогоплательщика (при наличии).
4. Адрес места жительства (регистрации) или места пребывания (если его нельзя установить из документа, удостоверяющего личность, а также если адрес места жительства (регистрации) или места пребывания не совпадают).
5. Контактная информация (например, номер телефона, факса, адрес электронной почты, почтовый адрес (при наличии).

Идентификация бенефициарных владельцев может осуществляться на основании Анкеты физического лица — бенефициарного владельца по форме Банка, подписанной Клиентом (в том числе при наличии бенефициарного владельца, отличного от Клиента-физического лица).

В случае если бенефициарный владелец является иностранным гражданином или лицом без гражданства, или в отношении полученных сведений и/или документов возникают сомнения в достоверности и точности ранее полученной информации, идентификация осуществляется исключительно на основании указанных выше документов.",,0.9646230183270968,0.9999999999,1.0,0.9576847584180488,0.0008,0.2097562826312925,0.8578471606502808,0.9882691
Расскажи про термины 'Договор страхования' и 'КАСКО',"[""['1. Термины и определения     \\n                    Договор страхования — договор, по которому одна сторона (Страховщик) обязуется за обусловленную договором \\n                    плату (страховую премию) при наступлении предусмотренного в договоре события (страхового случая) осуществить \\n                    другой стороне (страхователю) или иному лицу, в пользу которого заключен договор (выгодоприобретателю), \\n                    страховое возмещение в пределах определенной договором суммы (страховой суммы).', 'КАСКО — комбинированное страхование транспортных средств и сопутствующих рисков.']""]"," Да, конечно! Договор страхования — это договор, по которому одна сторона (Страховщик) обязуется за обусловленную договором 
                    плату (страховую премию) при наступлении предусмотренного в договоре события (страхового случая) осуществить 
                    другой стороне (страхователю) или иному лицу, в пользу которого заключен договор (выгодоприобретателю), 
                    страховое возмещение в пределах определенной договором суммы (страховой суммы). 
                    КАСКО — это комбинированное страхование транспортных средств и сопутствующих рисков.","Договор страхования - это соглашение между страхователем и страховщиком, в котором страхователь обязуется уплатить страховую премию, а страховщик обязуется выплатить страховое возмещение при наступлении страхового случая. Договор страхования может быть заключен на различные виды страхования, включая ОСАГО и КАСКО.

КАСКО - это сокращение от ""Комплексное Автомобильное Страхование, Кроме Ответственности"". Это вид добровольного страхования, который покрывает ущерб, причиненный автомобилю в результате различных событий, таких как авария, угон, стихийные бедствия и т.д. КАСКО не покрывает ущерб, причиненный в результате ДТП по вине страхователя.",1.0,0.8540217503546117,0.9999999999,0.25,0.94327439970701,0.0,0.2605477443077205,0.9374636007005764,0.9840065
"Какой минимум страховой выплаты мне вернут, если моя страховая сумма = 50 000 долларов?","[' \n                    2.19.   При добровольном страховании непредвиденных расходов путешественников страховая сумма в договоре \n                    страхования может быть установлена в рублях или иностранной валюте в рублевом эквиваленте по официальному \n                    курсу иностранных валют ЦБ РФ на дату заключения Договора страхования, но не менее чем 66,7 руб. за 1 у.е.  при \n                    страховой сумме 30 000 у.е., 57,2 руб. за 1 у.е. при страховой сумме 35 000 у.е., 50 руб. за 1 у.е. при страховой сумме \n                    50 000 у.е., 26,7 руб. за 1 у.е. при страховой сумме 75 000 у.е.']"," 
                    Минимальная страховая выплата, которую вам вернут, если ваша страховая сумма составляет 50 000 долларов, составляет 50 рублей за 1 доллар США. Минимальная выплата составит 2 500 000 рублей.
                    Обратите внимание, что это минимальная выплата, которую вы получите. Фактическая сумма выплаты может варьироваться в зависимости от условий вашего договора.
        ","Минимальная сумма страховой выплаты, которую вам вернут при страховой сумме 50 000 долларов, составляет 50 долларов за 1 у.е.",1.0,0.957621773225404,0.9999999999,0.2,0.9335789319002022,0.096,0.377800406421494,0.8800290037892465,0.9786681
"При принятии пользовательских соглашений, кому еще попадают мои данные?","[""['\\n                    5. Персональные данные     \\n                        5.1.       Пользователь подтверждает, что с использованием Дистанционных каналов взаимодействия дает Страховщику, \\n                        аффилированным лицам страховщика, Страховому агенту или Страховому брокеру, а также лицам, \\n                        предоставляющим услуги по использованию их информационных возможностей для целей заключения договоров \\n                        страхования, хранения документов, в том числе, облачных сервисов, серверов, программных продуктов, согласие на \\n                        обработку его персональных данных с целью осуществления дистанционного взаимодействия с последними при \\n                        использовании их Сайта и/или сайтов в сети Интернет или при помощи ПО Страховщика и в целях осуществления \\n                        маркетинговых коммуникаций перечисленных лиц с Пользователем.  \\n        ']""]","
                    Согласно пункту 5.1 пользовательского соглашения, ваши персональные данные могут быть переданы следующим сторонам:
                        • Аффилированные лица страховщика
                        • Страховой агент
                        • Страховой брокер
                        • Лица, предоставляющие услуги по использованию их информационных возможностей для целей заключения договоров страхования, хранения документов, в том числе облачных сервисов, серверов, программных продуктов
","Ваши данные могут быть переданы Страховщику, а также аффилированным лицам страховщика, Страховому агенту или Страховому брокеру, а также лицам, предоставляющим услуги по использованию их информационных возможностей для целей заключения договоров страхования, хранения документов, в том числе, облачных сервисов, серверов, программных продуктов.",1.0,0.0,0.9999999999,0.25,0.9273976341866054,0.3999,0.41576154424210404,0.9633914076834204,0.99459106
Зачем страховщик ведет аудио и видеозапись при взаимодействии с клиентом? Как долго эти записи хранятся?,"[""['При заключении Договоров страхования, а также при ином обращении Клиента или Пользователя к Страховщику или его представителям Страховщик вправе осуществлять наблюдение, фотографирование, аудио- и видеозапись, включая запись телефонных разговоров, а также копирование и хранение переписок между Пользователем и Страховщиком (его представителями) по электронной почте или в мессенджерах, без дополнительного уведомления Клиента (Пользователя) о такой записи. Клиент соглашается, что Страховщик вправе хранить такие записи в течение 5 (пяти) лет с момента прекращения отношений с Клиентом (Пользователем), с целью улучшения качества обслуживания, исполнения Договора страхования, а также использовать их при проведении любых расследований в связи с Договором страхования.']""]","Страховщик ведет аудио, видеозапись, фотографирование, копирует переписку с клиентом без дополнительного уведомления с целью улучшения качества обслуживания, исполнения договора страхования, а также для использования этих записей при проведении расследований, связанных с договором. Такие записи страховщик вправе хранить в течение 5 лет с момента прекращения отношений с клиентом.",Затрудняюсь ответить,,0.0,0.9999999999,1.0,0.7510959498785996,0.0,0.0,0.1515048929689943,0.89260644
В каких случаях застрахованному могут быть оплачены планируемые расходы по страховому случаю до предоставления подтверждающих документов? Какие ограничения есть по размеру таких выплат?,"[""['По договорам добровольного страхования непредвиденных расходов путешественников по предварительному согласованию со Страховщиком Застрахованному могут оплачиваться планируемые расходы по предусмотренным договором страхования страховым событиям, предусматривающим возмещение расходов на оказание Экстренной или Неотложной амбулаторной и/или стационарной помощи, с условием предоставления Застрахованным документов, подтверждающих такие расходы Страховщику непосредственно после их несения (чеки, платежные документы и пр.). В случае если в результате страхового случая Застрахованным лицом были понесены соответствующие расходы на оказание Экстренной или Неотложной амбулаторной и/или стационарной помощи, в том числе, предварительно согласованные Страховщиком, но не были предоставлены документы, подтверждающие их оплату, Страховщик возмещает расходы в размере не более 200 у.е. (если страховая сумма установлена в валюте, отличной от российского рубля) или 10 000 российских рублей (если страховая сумма установлена в российских рублях), за один страховой случай.']""]","По договорам добровольного страхования непредвиденных расходов путешественников застрахованному могут быть оплачены планируемые расходы по страховым случаям, предусматривающим возмещение расходов на экстренную/неотложную амбулаторную или стационарную помощь, по предварительному согласованию со страховщиком. Условие - предоставление подтверждающих документов сразу после несения расходов. Если документы не предоставлены, то страховщик возмещает расходы в размере не более 200 у.е. (если страховая сумма в валюте) или 10 000 рублей (если в рублях) за один случай.","Извлеченный контекст не содержит информации о том, в каких случаях застрахованному могут быть оплачены планируемые расходы по страховому случаю до предоставления подтверждающих документов. Также нет ограничений по размеру таких выплат.",,0.0,0.9999999999,1.0,0.8971863518784787,0.0907,0.2030914096888562,0.898106323761342,0.98258644
Куда пользователь может направить обращение при возникновении вопросов или спора со страховщиком?,"[""['При возникновении вопросов или спора можно отправить обращение:\\n\\nв АО «Тинькофф Страхование» по почте по адресу: 127287, Российская Федерация, г. Москва, ул. 2-я Хуторская, дом 38А, строение 26, либо путем заполнения соответствующей формы на сайте Страховщика;\\nк финансовому уполномоченному путем регистрации обращения на сайте — finombudsman.ru или по почтовому адресу: 119017, г. Москва, Старомонетный пер., дом 3;\\nво Всероссийский союз страховщиков на сайте — ins-union.ru, приложив к обращению необходимые документы и сведения, либо на почтовый адрес: 115093, г. Москва, ул. Люсиновская, д. 27, стр. 3;\\nв Центральный Банк Российской Федерации (Банк России) через интернет-приемную на официальном сайте — cbr.ru, приложив к обращению необходимые документы и сведения, либо на почтовый адрес: 107016, г. Москва, ул. Неглинная, д. 12.']""]","При возникновении вопросов или спора с АО 'Тинькофф Страхование' пользователь может направить обращение:

 - В АО 'Тинькофф Страхование' по почте или через форму на сайте;
 - Финансовому уполномоченному на сайте finombudsman.ru или почтовым адресом;
 - Во Всероссийский союз страховщиков на сайте ins-union.ru или почтовым адресом;
В Центральный Банк РФ через интернет-приемную на сайте cbr.ru или почтовым адресом.",Пользователь может направить обращение при возникновении вопросов или спора со страховщиком в службу поддержки банка Tinkoff.,1.0,0.99358008083988,0.9999999999,1.0,0.9246381815998004,0.0474,0.19339008634243302,0.7538690629209136,0.9559738
Где можно ознакомиться с дополнительной информацией и документами о деятельности АО 'Тинькофф Страхование'?,"[""['Дополнительная информация и документы о деятельности Страховщика в соответствии с п. 6.1 Закона РФ от 27.11.1992 N 4015-1 «Об организации страхового дела в Российской Федерации» и п. 2.1.1. «Базового стандарта защиты прав и интересов физических и юридических лиц — получателей финансовых услуг, оказываемых членами саморегулируемых организаций, объединяющих страховые организации» размещены по ссылкам: tinkoffinsurance.ru/about, tinkoffinsurance.ru/about/documents.']""]",Дополнительная информация и документы о деятельности АО 'Тинькофф Страхование' в соответствии с законом 'Об организации страхового дела в РФ' и базовым стандартом защиты прав получателей финансовых услуг размещены на сайте страховщика по ссылкам tinkoffinsurance.ru/about и tinkoffinsurance.ru/about/documents.,"Дополнительная информация и документы о деятельности АО 'Тинькофф Страхование' размещены по ссылкам: tinkoﬃnsurance.ru/about, tinkoﬃnsurance.ru/about/documents.",1.0,0.9767817000132908,0.9999999999,1.0,0.9673926501230412,0.2261,0.4710356215056505,0.9024559905349576,0.9727463
Что означает 'Партия' и вообще 'Слиток' для драгоценных металлов?,"[""['\\n                    Партия — приобретенные Клиентом Слитки в количестве, превышающем 1 (одну) штуку, и подлежащие доставке Клиенту, \\n                    в рамках одной Заявки', ' Слиток — аффинированный драгоценный металл: золото, серебро, платина и палладий в виде слитков (стандартных, \\n                    мерных), соответствующих установленным в Российской Федерации стандартам или международным стандартам качества, \\n                    изготовленных и маркированных организацией, осуществляющей аффинаж драгоценного металла. Слиток в рамках \\n                    предоставления Сервиса доставляется / принимается на хранение в ненарушенной Упаковке с приложением Сертификата-\\n                    ярлыка (при наличии) и Сертификата качества слитка']""]","Давайте разберемся! 
                    Партия — это приобретенные клиентом слитки в количестве, превышающем 1 штуку, и подлежащие доставке клиенту, в рамках одной заявки.
                    Слиток — это аффинированный драгоценный металл: золото, серебро, платина и палладий в виде слитков (стандартных, 
                    мерных), соответствующих установленным в Российской Федерации стандартам или международным стандартам качества, 
                    изготовленных и маркированных организацией, осуществляющей аффинаж драгоценного металла. Слиток в рамках 
                    предоставления Сервиса доставляется / принимается на хранение в ненарушенной Упаковке с приложением Сертификата-
                    ярлыка (при наличии) и Сертификата качества слитка.
        ","""Партия"" в контексте пользовательского соглашения для банка Tinkoff относится к группе драгоценных металлов, которые были приобретены клиентом в количестве, превышающем одну штуку, и подлежат доставке клиенту.",,0.8701665361083911,0.9999999999,1.0,0.877642836107009,0.0,0.09729127476708424,0.8883289537255574,0.9778157
Меня действительно должны фотографировать после полкчения слитка? Какой это пункт в соглашении?,"[""['\\n                    2.13.12. После подтверждения получения Клиентом/Доверенным лицом Слитка Представитель фотографирует Клиента/\\n                    Доверенное лицо с полученным Слитком в ненарушенной заводской упаковке и документом, удостоверяющим личность \\n                    Клиента/Доверенного лица']""]","Да, Вас действительно должнен сфотографировать Представитель в соответсвии с пунктом 2.13.12.","Нет, вас не должны фотографировать после получения слитка. Этот пункт отсутствует в представленном контексте.",,0.0,0.9999999999,1.0,0.8496330244695137,0.0,0.04642927873353421,0.7300364525376493,0.9838323
Какие условия хранения?,"[""[' \\n                    2.14.9. Условия хранения: температура воздуха от +17 до +25 °С, атмосферное давление от 740 до 760 мм рт. ст., относительная \\n                    влажность воздуха от 30 до 60%']""]","
                    В соответсвии с пунктом 2.14.9. условия хранения слитка слудующие: 
                        - температура воздуха от +17 до +25 °С,
                        - атмосферное давление от 740 до 760 мм рт. ст.,
                        - относительная влажность воздуха от 30 до 60% ","Условия хранения Слитка Клиента осуществляются в хранилище 5 (Пятого) класса устойчивости к взлому, оборудованном системой видеонаблюдения и охранно-пожарной и тревожной сигнализацией с выводом сигнала на пункт централизованной охраны, с осуществлением физической круглосуточной специализированной охраны хранилища. Температура воздуха должна быть от +17 до +25 °С, атмосферное давление от 740 до 760 мм рт. ст., относительная влажность воздуха от 30 до 60%.",0.5,0.8922545668819142,0.9999999999,0.75,0.9218970759590832,0.229,0.5744916637575389,0.8817888077634325,0.97200847
Что такое 'Сертификат качества слитка'?,"[""['Сертификат качества слитка — документ о качестве драгоценного металла, содержащий сведения о соответствии драгоценного металла стандартам качества, технические характеристики и параметры Слитка, информацию о химическом составе, произведенный/заверенный предприятием-изготовителем Слитка.']""]","Сертификат качества слитка - это документ, выданный изготовителем слитка драгоценного металла, который содержит информацию о соответствии металла стандартам качества, его технические характеристики, параметры и химический состав.","Сертификат качества слитка - это документ, содержащий сведения о соответствии драгоценного металла стандартам качества, технические характеристики и параметры слитка, информацию о химическом составе, произведенный/заверенный предприятием-изготовителем слитка.",1.0,0.9728454496724126,0.9999999999,1.0,0.9929065096469204,0.2785,0.6252378921336114,0.948928121060123,0.9947059
На какой срок выдается эта доверенность? Можно ли ее передоверить другому лицу?,"[""['Датой выдачи доверенности считается дата предоставления Представляемым Банку данных своего представителя. Доверенность выдана сроком на 1 (один) год, полномочия по настоящей доверенности не могут быть передоверены другим лицам.']""]",Доверенность выдается сроком на 1 год. Полномочия по этой доверенности нельзя передоверять другим лицам.,Из предоставленного контекста невозможно определить срок действия данной доверенности. Также нет информации о возможности ее передоверия другому лицу.,,0.0,0.9999999999,1.0,0.8906252626115719,0.0,0.0352348384873934,0.7721997699861651,0.9782468
"Как клиент может получить сертификат качества слитка, который он передал на хранение в банк?","[""['По требованию Клиента Банк предоставляет Клиенту заверенную Банком копию Сертификата качества слитка, переданного на ответственное хранение.']""]","По требованию клиента банк предоставляет ему заверенную копию сертификата качества слитка, который клиент передал на ответственное хранение в банке.","Клиент может получить заверенную Банком копию Сертификата качества слитка, переданного на ответственное хранение в банк, по требованию.",,0.8584438256874902,0.9999999999,1.0,0.9807041005217294,0.162,0.5507796339456278,0.9102421137606976,0.9945052
Какие условия хранения слитков в банке? Где их хранят?,"[""['Хранение Банком Слитка Клиента осуществляется в хранилище 5 (Пятого) класса устойчивости к взлому, оборудованном системой видеонаблюдения и охранно-пожарной и тревожной сигнализации с выводом сигнала на пункт централизованной охраны, с осуществлением физической круглосуточной специализированной охраны хранилища.', 'Условия хранения: температура воздуха от +17 до +25 °С, атмосферное давление от 740 до 760 мм рт. ст., относительная влажность воздуха от 30 до 60%.']""]","Слитки хранятся в специальном хранилище 5 класса устойчивости к взлому, оборудованном системами видеонаблюдения, охранно-пожарной и тревожной сигнализацией, а также круглосуточной охраной. Условия хранения: температура +17...+25°С, атмосферное давление 740-760 мм рт.ст., влажность 30-60%.","Слитки в банке Tinkoff хранятся в специальном хранилище 5 класса устойчивости к взлому, оборудованном системой видеонаблюдения и охранно-пожарной и тревожной сигнализацией с выводом сигнала на пункт централизованной охраны, с осуществлением физической круглосуточной специализированной охраны хранилища. Условия хранения включают температуру воздуха от +17 до +25 °C, атмосферное давление от 740 до 760 мм рт. ст., относительную влажность воздуха от 30 до 60%.",0.8571428571428571,0.9343108544493872,0.9999999999,1.0,0.9579284029607826,0.147,0.447622796027797,0.9714317442518134,0.98952645
"Можно ли вернуть слиток в банк, если при получении были обнаружены его повреждения? Как это сделать?","[""['В случае обнаружения при приеме Слитка с ответственного хранения от Представителя нарушения целостности заводской упаковки Слитка, несоответствия нанесенной на Слиток маркировки данным, указанным в Сертификате качества слитка и/или Сертификате-ярлыке, отсутствия либо повреждения Сертификата качества слитка и/или Слитка (наличие на поверхности Слитка наплывов / заусенцев / царапин / жировых пятен / посторонних включений) Клиентом/Доверенным лицом и Представителем оформляется в двух экземплярах Рекламационный акт по форме Приложения № 3 к настоящим Правилам, в котором фиксируются указанные выше нарушения / несоответствия / повреждения. В случае наличия указанных выше нарушений / несоответствий / повреждений Слиток вместе с Сертификатом качества слитка и Сертификатом-ярлыком вкладываются Клиентом/Доверенным лицом в порожний сейф-пакет и запечатываются, после чего сейф-пакет помещается в Устройство для перевозки слитка с дальнейшим опломбированием номерной разовой пломбой. Номер сейф-пакета, а также номерной разовой пломбы отражаются в Рекламационном акте.']""]","Да, если при получении слитка с хранения были обнаружены его повреждения или нарушения упаковки, несоответствия маркировки и т.п., то клиент/доверенное лицо вместе с представителем банка оформляют рекламационный акт в двух экземплярах. В этом акте фиксируются все нарушения. После этого слиток вместе с сертификатами запечатывают в новый сейф-пакет и опломбировывают, указав номера на рекламационном акте. Затем слиток возвращается обратно в банк.","Да, в случае обнаружения повреждений при получении слитка, клиент может вернуть его в банк. Для этого необходимо оформить Рекламационный акт, в котором указываются сведения о выявленных нарушениях, несоответствиях или повреждениях. Один экземпляр Рекламационного акта остается у клиента или его доверенного лица, другой передается представителю банка для предоставления в банк. Если клиент отказывается от приема приобретенных слитков, заявка отменяется. Банк обязан связаться с клиентом и предоставить новый слиток или вернуть старый слиток в течение 5 рабочих дней после рассмотрения Рекламационного акта, если нарушения, указанные в акте, не были подтверждены по итогам проверки банка.",0.6,0.9051743000214416,0.9999999999,1.0,0.9370550198720894,0.0,0.2566085331575169,0.9596861394862076,0.9924525
Кто может стать доверенным лицом?,"[""['Доверенное лицо — физическое лицо, уполномоченное Клиентом, которому предоставлено право на представление интересов Клиента и осуществление действий от его имени в рамках Сервиса на основании доверенности, оформленной посредством Дистанционного обслуживания в соответствии с п. 5.3 настоящих Правил по форме Приложения № 5 к настоящим Правилам.']""]","Доверенным лицом клиента может стать любое физическое лицо, которому клиент предоставит полномочия представлять его интересы в рамках сервиса покупки/продажи слитков драгоценных металлов. Доверенность на это лицо оформляется клиентом посредством дистанционного обслуживания в банке по форме из Приложения №5 к Правилам.","В данном контексте нет информации о том, кто может стать доверенным лицом.",,0.0,0.9999999999,1.0,0.8578187145450696,0.0,0.11747639061044034,0.7219404425066935,0.9623762
Можно ли поменять доверенное лицо? Как это сделать?,"[""['Клиент может отменить выданную доверенность путем обращения в Банк посредством Дистанционного обслуживания в любое время, но не позднее одного дня до планируемой даты встречи с представителем Клиента.']""]","Да, клиент может отменить ранее выданную доверенность на доверенное лицо. Для этого он должен обратиться в банк посредством дистанционного обслуживания не позднее чем за 1 день до планируемой даты встречи с действующим доверенным лицом.","Из предоставленного контекста нельзя однозначно определить, можно ли поменять доверенное лицо и как это сделать. Для получения более точной информации рекомендую обратиться к официальному сайту банка Tinkoff или связаться с представителями банка напрямую.",,0.0,0.9999999999,1.0,0.8792241834964876,0.0,0.06859502003665312,0.8876972975599482,0.987311
Как происходит покупка слитка банком? Есть ли какие-то особые условия?,"[""['Банк приобретает у Клиента только Слитки, находящиеся на ответственном хранении в Банке.', 'Клиент, обращаясь с Заявкой, подтверждает, что на момент заключения договора купли-продажи Слиток принадлежит на праве собственности Клиенту, не продан, не является предметом залога, не обременен правами третьих лиц, в споре, под арестом и иным запрещением не состоит.']""]","Банк осуществляет покупку слитков драгоценных металлов только у тех клиентов, чьи слитки находятся на ответственном хранении в самом банке. При подаче заявки на продажу слитка клиент должен подтвердить, что на момент продажи слиток принадлежит ему на праве собственности, не продан, не заложен, не арестован и не обременен правами третьих лиц.","Покупка слитка банком Tinkoff происходит в соответствии с разделом 3 Правил или с момента передачи слитка в залог Банку на основании договора залога, заключенного между Банком и Клиентом, и подписания Сторонами Акта приема-передачи. Особых условий для покупки слитка банком нет.",0.5,0.9433965716837598,0.9999999999,1.0,0.9070387753480936,0.0,0.06824959801587724,0.8254432811879434,0.9826301
Что такое накопительный счет и как начисляются проценты?,"[""['\\n                    3.1. Начисление процентов на остаток средств по Счету вклада/Накопительному счету производится со дня, следующего \\n                    за днем зачисления денежных средств на Счет вклада/Накопительный счет Клиента, до дня окончания срока Вклада \\n                    (включительно) либо до их списания со Счета вклада/Накопительного счета по иным основаниям.', ' \\n                    3.3. Клиент имеет возможность по согласованию с Банком посредством Дистанционного обслуживания изменить Тарифный \\n                    план Вклада на Тарифный план для мультивалютного Вклада. При смене Тарифного плана изменения в части процентной \\n                    ставки по Счету вклада, изначально открытого в рамках текущего Договора вклада, не распространяются до конца срока \\n                    размещения, установленного предыдущим Тарифным планом. Процентные ставки по валютам, отличным от валюты \\n                    измененного Тарифного плана, устанавливаются новым Тарифным планом.\\n                    3.4. При начислении процентов в расчет принимается величина процентной ставки (в процентах годовых) и фактическое \\n                    количество календарных дней, на которое привлечены денежные средства. При этом за базу берется действительное \\n                    число календарных дней в году (365 или 366 дней соответственно).\\n                    ', ' \\n                    Накопительный счет — счет, на котором учитываются денежные средства Клиента, предусматривающий начисление \\n                    процентов на остаток денежных средств, в соответствии с Договором накопительного счета.']""]","
                    Накопительный счет - это счет, на котором учитываются денежные средства клиента и на который начисляются проценты на остаток денежных средств. Проценты начисляются в соответствии с условиями договора накопительного счета.
                    Проценты на накопительном счете начисляются со дня, следующего за днем зачисления денежных средств на счет, до дня окончания срока вклада (включительно) либо до их списания со счета по другим основаниям.

                    При начислении процентов учитываются:
                    • Величина процентной ставки (в процентах годовых)
                    • Фактическое количество календарных дней, на которое привлечены денежные средства

                    За базу берется действительное число календарных дней в году (365 или 366 дней соответственно).","Накопительный счет - это банковский продукт, который позволяет клиентам накапливать и сохранять свои средства. Проценты на остаток по счету начисляются в соответствии с условиями договора. Обычно проценты начисляются ежемесячно на остаток средств на счете и могут зависеть от суммы и срока хранения денег на счете. В некоторых случаях проценты могут быть фиксированными или изменяться в зависимости от рыночных условий. Для получения подробной информации о накопительном счете и условиях его использования рекомендуется обратиться к банку Tinkoff или ознакомиться с соответствующими документами.",1.0,0.9528201181220068,0.9999999999,0.3333333333333333,0.9306212062257389,0.0875,0.33311185842605207,0.9208019139280156,0.9923323
Можно ли открыть вклад в 12 лет?,"[""['1.2. Банк не заключает Договор вклада (Договор накопительного счета) с лицами, не достигшими возраста 14 лет']""]","Нет, Банк не заключает договор вклада с лицами, не достигшими возраста 14 лет.","Нет, согласно условиям, установленным банком Tinkoff, договор вклада не может быть заключен с лицами, не достигшими возраста 14 лет.",,0.8573256342157952,0.9999999999,1.0,0.9535376912516952,0.345,0.5698344537068067,0.8580042159291809,0.9851134
Могу ли я открыть несколько вкладов и пополнять их?,"[""['\\n                    4.1. Клиент имеет право:\\n                    4.1.1. Предъявить Банку требование о досрочном полном или частичном изъятии Вклада.\\n                    4.1.2. Вносить дополнительные денежные средства во Вклад/Накопительный счет, если данная возможность установлена \\n                    Тарифным планом.\\n                    4.1.3. Разместить несколько Вкладов (открыть несколько Счетов вклада/Накопительных счетов на условиях, устанавливаемых \\n                    Договором вклада (Договором накопительного счета), Тарифами:\\n                    • через Дистанционное обслуживание;\\n                    • в офисе Банка в часы работы операционного подразделения Банка.\\n']""]"," 
                    Да, вы можете открыть несколько вкладов и пополнять их.
                    Согласно пункту 4.1.3 приведенного контекста, клиент имеет право разместить несколько вкладов (открыть несколько счетов вклада/накопительных счетов) на условиях, устанавливаемых договором вклада (договором накопительного счета) и тарифами.
                    Вы можете открыть несколько вкладов как через дистанционное обслуживание, так и в офисе банка в часы работы операционного подразделения банка.","Да, согласно условиям договора вклада, клиент может открыть несколько вкладов и пополнять их. Однако, при открытии каждого нового вклада необходимо подавать новую заявку и предоставлять необходимые документы для его открытия.",1.0,0.9305273789319204,0.9999999999,0.375,0.923923742786743,0.0925,0.2435841809633208,0.9143679072885346,0.9843754
Для получения страховой выплаты в случае несчастного случая с летальным исходом нужна ли справка из психушки?,"[""['\\n                    6.1. По риску Смерть в результате Несчастного случая должны быть предоставлены следующие документы:\\n                    j. Справка из психоневрологического диспансера и наркологического диспансера']""]","Да, в таком случае необходимы справки из психоневрологического диспансера и наркологического диспансера.","Нет, справка из психушки не требуется для получения страховой выплаты в случае несчастного случая с летальным исходом.",,0.0,0.9999999999,0.6666666666666666,0.8551683023140721,0.0,0.08150598686233711,0.8111485674851496,0.9788718
Дают ли кредит на автомобиль?,"[""['3.1. Банк предоставляет Клиенту Кредит на потребительские цели, в том числе на приобретение Товара и/или Автомобиля, в соответствии с законодательством Российской Федерации.']""]","Да, в соответсвии с пунктом 3.1. Банк предоставляет Клиенту Кредит на потребительские цели, , в том числе на приобретение автомобиля.","Нет, в данном контексте не упоминается возможность получения кредита на автомобиль.",,0.0,0.9999999999,1.0,0.8698126123967505,0.0,0.0847185451775415,0.6773906729777903,0.98218495
Распростроняется ли страховое покрытие на смерть в алкогольном опьянении?,"[""[' \\n                    Страховое покрытие по рискам «Смерть» и «Инвалидность» не распространяется на события, произошедшие в результате \\n                    и/или в период:\\n                    a. действий, совершенных Застрахованным лицом в состоянии алкогольного, наркотического и/или токсического \\n                    опьянения; в результате употребления им наркотических, сильнодействующих лекарственных препаратов \\n                    и психотропных веществ без предписания врача (или по предписанию врача, но с нарушением указанной  \\n                    им дозировки); болезни Застрахованного лица, прямо связанной с наркоманией, токсикоманией, хроническим \\n                    алкоголизмом\\n                    ']""]","Нет, страховое покрытие не распространяется на смерть в алкогольном опьянении.",Затрудняюсь ответить,,0.0,0.9999999999,0.5,0.7617096670301733,0.0,0.0,0.2765097933424696,0.92678815
"Может ли Банк изменить Тарифный план по кредитной карте, и какие условия должны быть соблюдены для этого?","[""['\\n                    Банк вправе в одностороннем порядке изменить Тарифный план, применяемый\\nв рамках Договора, и/или заменить его на другой Тарифный план, в том числе при заключении Договора и/или\\nна определенный период времени по усмотрению Банка, с целью уменьшения процентной ставки по кредиту\\nи/или улучшения иных условий обслуживания при условии, что это не повлечет возникновение новых или увеличение размера существующих денежных обязательств Клиента\\n                    ']""]","Да, Банк может изменить Тарифный план по кредитной карте в одностороннем порядке, но при условии, что это не приведет к возникновению новых или увеличению уже существующих денежных обязательств клиента ","Да, Банк может изменить Тарифный план по кредитной карте. Для этого Банк должен уведомить Клиента о предстоящих изменениях не позднее дня, предшествующего дню изменений. Изменения не должны повлечь возникновение новых или увеличение размера существующих денежных обязательств Клиента, а также уменьшить или прекратить взимание плат и штрафов по Договору. Банк также вправе в любое время осуществить возврат к Тарифному плану, согласованному с Клиентом при заключении Договора или действовавшему до соответствующих изменений.",0.6666666666666666,0.9706013720519308,0.9999999999,1.0,0.9497423699352552,0.0777,0.3486678188379934,0.939780635466854,0.97836727
Можно ли внести частичное досрочное погашение кредита? И как это повлияет на остаток задолженности?,"[""['«Клиент имеет право досрочно погасить Задолженность с уплатой Банку суммы непогашенного Кредита и начисленных процентов, а также (если применимо) комиссий и плат, предусмотренных Тарифным планом, в любой момент путем зачисления необходимой суммы денежных средств на Картсчет (Счет) и извещения Банка о необходимости проведения досрочного погашения. В случае частичного досрочного погашения уменьшается срок Кредита или сумма Регулярного платежа по выбору Клиента, при этом Клиент не освобождается от оплаты ближайшего Регулярного платежа, а также применимых комиссий и плат, предусмотренных Тарифным планом.», «При обращении Клиента в Банк для совершения частичного досрочного погашения до или в дату оплаты ближайшего Регулярного платежа Клиенту может быть предложено совершить частичное досрочное погашение с погашением ближайшего Регулярного платежа и последующим уменьшением срока Кредита или суммы Регулярного платежа по выбору Клиента.»']""]","Да, Клиент имеет право совершить частичное досрочное погашение кредита. При этом по выбору Клиента уменьшится либо срок кредита, либо сумма регулярного платежа. Однако Клиент не освобождается от оплаты ближайшего регулярного платежа и применимых комиссий.","Да, в банке Tinkoff возможно частичное досрочное погашение кредита. При этом, срок кредита или сумма регулярного платежа могут быть уменьшены по выбору клиента. Однако, клиент не освобождается от оплаты ближайшего регулярного платежа, а также применимых комиссий и плат, предусмотренных тарифным планом. Если клиент обратится в банк для совершения частичного досрочного погашения до или в дату оплаты ближайшего регулярного платежа, ему может быть предложено совершить частичное досрочное погашение с погашением ближайшего регулярного платежа и последующим уменьшением срока кредита или суммы регулярного платежа по выбору клиента. При этом к оплате предъявляются только начисленные до даты такого частичного досрочного погашения проценты и сумма непогашенного кредита, входящая в состав ближайшего регулярного платежа, а оплачиваемые совместно с ближайшим регулярным платежом комиссии и платы, предусмотренные тарифным планом, направляются на их досрочную (предварительную) оплату. Проценты, начисленные за пользование кредитом с даты частичного досрочного погашения до установленной даты оплаты погашенного ближайшего регулярного платежа, включаются в следующий регулярный платеж. При полном погашении суммы ближайшего регулярного платежа, а также применимых комиссий и плат, предусмотренных тарифным планом, в результате такого частичного досрочного погашения клиенту не предъявляется требование об их оплате. При неполном погашении суммы ближайшего регулярного платежа, а также применимых комиссий и плат, предусмотренных тарифным планом, в результате такого частичного досрочного погашения клиент не освобождается от оплаты в установленную дату оплаты регулярного платежа соответствующей части суммы.",1.0,0.9177275714570756,0.9999999999,1.0,0.9455069742499542,0.0019,0.4807279380128159,0.9262528692235696,0.9858655
Что будет в случае просрочки платежа по кредиту? И какой штраф может быть начислен?,"[""['«В случае неоплаты платежа Клиент должен уплатить штраф за неоплату Минимального платежа согласно Тарифному плану. Банк рассматривает любой поступивший платеж Клиента как признание Клиентом данного штрафа в размере поступившего платежа, но не более суммы штрафа, определенного в соответствии с Тарифами.»']""]","В случае неоплаты минимального платежа по кредиту, Клиент должен уплатить штраф в соответствии с Тарифным планом. Размер штрафа определяется Тарифами, и любой поступивший от Клиента платеж Банк будет рассматривать как оплату штрафа в пределах установленной суммы.",В случае просрочки платежа по кредиту банк начислит штраф. Размер штрафа зависит от условий договора и тарифного плана. Для получения более подробной информации о размере штрафа рекомендуется обратиться к своему банку или ознакомиться с условиями договора.,1.0,0.0,0.9999999999,1.0,0.9347793816243756,0.0,0.2165200585074495,0.9280182026080904,0.9902844
Можно ли на время приостановить выплаты по кредиту? И как это повлияет на начисление процентов?,"[""['«На основании обращения Клиента и по согласованию с Банком на период от 1 (одного) до 12 (двенадцати) месяцев возможно приостановление обязанности Клиента по погашению Задолженности, по оплате Регулярных платежей и/или иных платежей. В указанный период Банк вправе приостановить начисление процентов и иных сумм, предусмотренных Договором реструктуризации задолженности.»']""]","Да, на основании обращения Клиента и по согласованию с Банком возможно приостановить обязанность по погашению задолженности и оплате платежей на срок от 1 до 12 месяцев. В этот период Банк вправе также приостановить начисление процентов и иных сумм по кредиту.","Да, в соответствии с условиями кредитного договора, клиент имеет право временно приостановить выплаты по кредиту. Однако, это может повлиять на начисление процентов, так как проценты начисляются на остаток задолженности по кредиту. Если клиент приостанавливает выплаты, то проценты будут начисляться только на сумму непогашенной задолженности.",1.0,0.928765349215411,0.9999999999,1.0,0.9436520364563185,0.0,0.2675228677060022,0.9437280178501828,0.98853946
Я хочу оформить дополнительную карту на супругу. Как это сделать? И будет ли она иметь доступ к общему лимиту по кредитке?,"[""['«3.2. По заявлению Клиента, переданному в Банк на бумажном носителе или через Дистанционное обслуживание, в рамках Договора кредитной карты Банком может быть выпущена одна или несколько дополнительных Кредитных карт.»', '«3.5. Клиент вправе установить лимит для проведения расходных операций с использованием Кредитной карты.»']""]","Вы можете оформить дополнительную кредитную карту на супругу, подав заявление в банк на бумажном носителе или через дистанционное обслуживание. Дополнительная карта будет иметь доступ к общему лимиту задолженности по вашей основной кредитной карте, однако вы можете установить отдельный лимит для расходных операций по дополнительной карте.","Для оформления дополнительной карты на супругу, вам необходимо обратиться в банк Tinkoff и подать соответствующую заявку. Однако, доступ к общему лимиту по кредитке не гарантируется, и решение об этом будет принимать банк.",,0.9064999369742884,0.9999999999,0.0,0.936627651798156,0.0745,0.22085278528994337,0.8907531178893381,0.9850563
"А что если я потеряю карту? Сколько у меня есть времени, чтобы ее заблокировать? И как вообще это делается? Через приложение или звонить надо?","[""['«6.1. При обнаружении утери, кражи или порчи Кредитной карты и/или возникновения подозрений, что Кредитная карта или ее реквизиты, а также ПИН-код, QR-код, Коды доступа, Аутентификационные данные, Абонентский номер, Абонентское устройство могли быть утрачены или похищены, а также в случае изъятия Кредитной карты в банкомате или торгово-сервисном предприятии и в случае изменения имени или фамилии Держателя Клиент должен незамедлительно уведомить Банк по телефонам 8 800 555-10-10 или +7 495 645-59-19 (круглосуточно) и заблокировать Кредитную карту и/или Интернет-Банк и/или Мобильный банк, а также подать заявление о досрочном перевыпуске Кредитной карты.»']""]","В случае утери или кражи кредитной карты, вы должны незамедлительно уведомить банк по телефонам горячей линии 8 800 555-10-10 или +7 495 645-59-19 (круглосуточно) и заблокировать карту. Также необходимо подать заявление на досрочный перевыпуск новой карты. Чем быстрее вы заблокируете карту, тем меньше риск несанкционированного использования.","Если вы потеряли карту или ее украли, вам следует немедленно сообщить об этом в банк и заблокировать карту. Блокировку можно осуществить по телефону, через интернет-банк или мобильное приложение банка. Чем раньше вы это сделаете, тем меньше вероятность несанкционированного использования карты злоумышленниками. Разблокировать карту нельзя, можно только перевыпустить. Если вы не уверены, что карту украли, не спешите ее блокировать, установите лимит ""0"" на операции и запретите покупки через Интернет. Обратите внимание, что ваша ответственность за дальнейшее использование карты прекращается после осуществления блокировки, если не станет известно, что незаконное использование карты имело место с вашего согласия.",1.0,0.8870492409211668,0.9999999999,1.0,0.9279884678428284,0.0,0.23459205298506097,0.8341664469562711,0.9788514
"Прочитал тут у вас про блокировку карточки. А если я её забуду забрать в банкомате, что тогда делать?","[""['«6.1. [...] а также в случае изъятия Кредитной карты в банкомате или торгово-сервисном предприятии и в случае изменения имени или фамилии Держателя Клиент должен незамедлительно уведомить Банк по телефонам 8 800 555-10-10 или +7 495 645-59-19 (круглосуточно) и заблокировать Кредитную карту и/или Интернет-Банк и/или Мобильный банк, а также подать заявление о досрочном перевыпуске Кредитной карты.»']""]","Если вы забыли карту в банкомате, вам необходимо незамедлительно сообщить об этом в банк по телефонам горячей линии 8 800 555-10-10 или +7 495 645-59-19 и заблокировать кредитную карту, а также подать заявление на ее досрочный перевыпуск. Это позволит предотвратить возможное несанкционированное использование забытой карты третьими лицами.","Если карта была у Вас украдена на территории РФ, после блокировки карты заявите о случившемся в полицию. При краже карты за границей, заявите в полицию или в консульский отдел посольства Российской Федерации в стране, на территории которой произошла кража. Пожалуйста, сохраняйте копию протокола (квитанцию о заявлении) для последующего предъявления в Банк.",,0.8561615546855426,0.9999999999,1.0,0.8829988467209439,0.0,0.07532256787938195,0.6844619556449981,0.98753715
"А есть ли какие-то льготные условия, если я захочу приостановить выплаты по кредитке на какое-то время? Например, на ремонт или что-то в этом роде?","[""['«5.15. На основании обращения Клиента и по согласованию с Банком на период от 1 (одного) до 12 (двенадцати) месяцев возможно приостановление обязанности Клиента по погашению Задолженности, по оплате Минимальных платежей, Регулярных платежей и/или иных платежей. В указанный период Банк вправе приостановить начисление процентов и иных сумм, предусмотренных Договором кредитной карты.»']""]","Да, в документе указано, что по обращению клиента и по согласованию с банком возможно приостановление обязанности по погашению задолженности, выплате минимальных и регулярных платежей на срок от 1 до 12 месяцев. В этот период банк также может приостановить начисление процентов и других сумм по кредитной карте. Таким образом, вы можете получить льготный период для ремонта или других нужд, обратившись в банк с соответствующим заявлением.",Из предоставленного контекста нельзя сделать вывод о наличии льготных условий для приостановки выплат по кредитной карте на определенное время.,,0.0,0.9999999999,1.0,0.8950238863104084,0.0,0.12934414844528463,0.892680980388106,0.9787078
Какие процедуры предусмотрены банком для обработки жалоб клиентов?,"[""['Банк имеет установленные процедуры для обработки и рассмотрения жалоб клиентов, включая регистрацию жалобы, ее анализ и предоставление ответа клиенту в установленные сроки.']""]","Банк следует четко установленным процедурам для обработки жалоб клиентов, которые включают регистрацию жалобы, ее тщательный анализ и предоставление ответа клиенту в соответствии с установленными сроками.",Процедуры для обработки жалоб клиентов в банке Tinkoff не упоминаются в данном контексте.,,0.0,0.9999999999,1.0,0.8725188473492242,0.0,0.15062977551743595,0.6514152142910561,0.97611403
Что происходит с депозитами в случае смерти?,"[""['В случае смерти клиента банк замораживает депозиты до решения вопросов наследства в соответствии с законодательством.']""]","После смерти клиента банк замораживает все его депозиты и удерживает их до тех пор, пока не будут решены вопросы наследства в соответствии с действующим законодательством.","Извлеченный контекст не содержит информации о том, что происходит с депозитами в случае смерти. Пожалуйста, уточните ваш вопрос.",,0.0,0.9999999999,1.0,0.8589755730170943,0.0,0.05900563581674297,0.83956788574535,0.98622584
Могу я отказаться от получения уведомлений от банка и как это влияет на его обслуживание?,"[""['Клиенты имеют право отказаться от получения определенных типов уведомлений от банка, однако это может повлиять на их способность получать своевременную информацию о изменениях условий, сбоях в системе или других важных обновлениях.']""]","Клиенты могут отказаться от получения определенных типов уведомлений от банка, но это может привести к тому, что они не будут получать важные обновления и информацию своевременно, что может повлиять на их способность управлять своими счетами и услугами эффективно.","Вы можете отказаться от получения уведомлений от банка Tinkoff, но это может повлиять на качество обслуживания, так как банк может использовать уведомления для информирования вас о важных операциях и событиях, связанных с вашим счетом или картой. Если вы решите отказаться от уведомлений, рекомендуется регулярно проверять свой счет через онлайн-банкинг или другие доступные каналы связи с банком.",0.8,0.9305834457513368,0.9999999999,1.0,0.9262258793555838,0.0,0.23586928756162454,0.93610759205049,0.99126124
Как я могу увеличить лимит по своей кредитной карте?,"[""['Для увеличения кредитного лимита клиенты должны подать заявление через мобильное приложение или веб-сайт банка, после чего банк рассмотрит их кредитную историю и текущую финансовую ситуацию.']""]","Чтобы увеличить кредитный лимит, клиентам необходимо подать соответствующее заявление через мобильное приложение или веб-сайт банка. Банк затем оценит их кредитную историю и текущую финансовую ситуацию перед принятием решения.","Для увеличения лимита по вашей кредитной карте необходимо связаться с банком Tinkoff и запросить соответствующую услугу. Информацию о том, как это сделать, можно найти на официальном сайте банка или позвонив в службу поддержки клиентов.",,0.9495678083951248,0.9999999999,1.0,0.904321841587168,0.0,0.05522549742135825,0.8449863476833792,0.9897274
"Каковы условия отмены банковской операции, например, перевода средств или платежа?","[""['Клиенты могут отменить определенные банковские операции, если они не были еще обработаны банком. Условия отмены операций установлены в пользовательском соглашении и зависят от типа операции.']""]","Условия отмены банковской операции зависят от того, была ли операция уже обработана банком. Для операций, которые еще не обработаны, клиенты могут инициировать отмену, следуя процедурам, описанным в пользовательском соглашении и в зависимости от типа операции.","Условия отмены банковской операции, например, перевода средств или платежа, не указаны в предоставленном контексте. Для получения подробной информации о условиях отмены операций, пожалуйста, обратитесь к соответствующим документам или свяжитесь с банком Tinkoff.",,0.0,0.9999999999,1.0,0.9157114812559578,0.0,0.17763824561957992,0.7929412130330747,0.9923482
Какие услуги доступны клиентам через Интернет-банк?,"[""['Через Интернет-банк клиенты могут управлять своими счетами, осуществлять платежи и переводы, а также получать детальную информацию о своих финансовых операциях.']""]","Интернет-банк предоставляет клиентам возможности управления их счетами, осуществления платежей и переводов, а также доступ к подробной информации о всех их финансовых операциях.","Клиенты могут осуществлять взаимодействие с Банком и его партнерами через Интернет-банк, включая обмен информацией и совершение отдельных операций по сети Интернет.",1.0,0.9217828480843194,0.9999999999,1.0,0.9417405186951324,0.0,0.07886395848670669,0.8636640102978581,0.9888659
"Я не пользовалась кредиткой год, но у меня там лежат мои 800 рублей, я могу их как-то вернуть?","['[\'""8. Расторжение Договора кредитной карты\\n                8.1. Банк вправе в любой момент расторгнуть Договор кредитной карты в одностороннем порядке в случаях, предусмотренных \\n                законодательством Российской Федерации, а также:\\n                • в случае если Держатель не пользовался Кредитной картой более, чем 6 (шесть) месяцев при отсутствии \\n                Задолженности по Договору кредитной карты;\\n                В этих случаях Банк блокирует все Кредитные карты/Токены, выпущенные в рамках Договора кредитной карты. Договор \\n                кредитной карты считается расторгнутым со дня формирования Банком Заключительного счета, который направляется \\n                Клиенту. Если в момент расторжения Договора кредитной карты Задолженность Клиента перед Банком отсутствует, Банк \\n                вправе расторгнуть Договор кредитной карты без направления Заключительного счета, информируя Клиента о своем \\n                решении любым способом по усмотрению Банка.\\n                8.5. В случае, если при расторжении Договора кредитной карты в Банке находятся денежные средства Клиента, излишне \\n                перечисленные им при погашении Задолженности, Банк осуществляет возврат таких денежных средств по распоряжению \\n                Клиента почтовым переводом или иным способом, указанном в распоряжении Клиента. При этом Банк вправе удержать \\n                из суммы такого перевода комиссию за перевод денежных средств в размере, предусмотренном Тарифами на услуги \\n                по переводам, платежам и дополнительные услуги с использованием каналов Дистанционного обслуживания.\\n                8.6. В случае неполучения Банком распоряжения Клиента о переводе денежных средств в течение 120 (ста двадцати) дней \\n                со дня обработки Банком последней операции Клиента/Держателя и, если остаток денежных средств не превышает \\n                1000 руб., указанный остаток считается безвозмездно переданным Банку. \\n                В случае неполучения Банком распоряжения Клиента о переводе денежных средств в течение 3 (трех) лет со дня обработки \\n                Банком последней операции Клиента/Держателя указанные денежные средства считаются безвозмездно переданными \\n                Банку.\\n                \']']","Согласно пунуту 8.6 - вы не можете вернуть ваши деньги, так как не дали распоряжение Банку о переводе денежных средств в течение 120 дней.","Из предоставленного контекста неясно, относится ли ваш вопрос к кредитной карте или к какому-либо другому продукту или услуге банка Tinkoff. Для получения точного ответа на ваш вопрос, пожалуйста, свяжитесь с банком Tinkoff напрямую или обратитесь к их официальным источникам информации.",,0.0,0.9999999999,0.0769230769230769,0.8243044627401257,0.0,0.0,0.714555178582124,0.9721516
