question,contexts,ground_truth,answer
Можно ли не расписываться на карте?,"['После получения карты поставьте свою подпись в прямоугольнике, расположенном на оборотной стороне карты. При отсутствии подписи карта может быть не принята к оплате в торгово-сервисном предприятии, а также повышается риск использования карты злоумышленниками в случае ее утраты/кражи.']","При отсутствии подписи карта может быть не принята к оплате в торгово-сервисном предприятии, а также повышается риск использования карты злоумышленниками в случае ее утраты/кражи.","Да, для безопасного использования карты важно поставить свою подпись на оборотной стороне карты. Без подписи карта может не быть принята к оплате в торгово-сервисном предприятии, а также повышается риск использования карты злоумышленниками в случае ее утраты или кражи."
"Мой друг попросил меня дать свою карту для оплаты и потом вернуть, это не опасно?","['Никогда не принимайте рекомендации, советы, помощь от третьих лиц при пользовании картой, особенно при снятии наличных денежных средств в банкоматах. В случае возникновения затруднений при совершении операции обратитесь Банк посредством дистанционного обслуживания. Обращайте внимание на расположение банкоматов. Старайтесь не пользоваться банкоматами, расположенными в плохо освещенных и безлюдных местах', 'Не передавайте карту другим лицам, в т.ч. родственникам и знакомым для проведения транзакций. С целью исключения Ваших потерь от несанкционированного использования Вашей карты (копирования информации с Вашей карты для ее дальнейшего мошеннического использования): при совершении операции оплаты с использованием карты никогда не выпускайте Вашу карту из поля зрения и требуйте от обслуживающего Вас лица, чтобы все операции с использованием карты совершались в Вашем присутствии.']","Не передавайте карту другим лицам, в т.ч. родственникам и знакомым для проведения транзакций и никогда не принимайте рекомендации, советы, помощь от третьих лиц при пользовании картой, особенно при снятии наличных денежных средств в банкоматах.","Использование карты другим лицом для оплаты и последующего возврата может быть опасным, так как это нарушает правила безопасности использования карты. Поэтому рекомендуется не передавать карту другим лицам для проведения транзакций, даже если это ваш друг. Чтобы избежать рисков несанкционированного использования карты, следует соблюдать меры безопасности, описанные в пользовательском соглашении, такие как не передавать карту третьим лицам, следить за операциями с картой и не доверять ее использование другим людям. Если у вас возникли сомнения или вопросы относительно безопасности использования карты, рекомендуется обратиться в Банк для получения дополнительной информации."
Безопасно ли хранить пинкод в заметках в телефоне?,"['Категорически запрещается записывать ПИН-код на карте. Постарайтесь не записывать ПИН-код, запомните его. Если же Вы предпочитаете записать свой ПИН-код, никогда не указывайте, что это ПИН-код и не храните документ с записанным ПИН-кодом рядом с картой.']","Да, однако не указывайте в названии заметки, что это ПИН-код от Вашей карты.","Хранить пин-код в заметках в телефоне не является безопасным действием, так как это может привести к утечке конфиденциальной информации. Рекомендуется запомнить пин-код или хранить его в надежном месте, но не записывать его вместе с картой или в телефоне. Когда вводите пин-код, убедитесь, что вас никто не видит, чтобы избежать его компрометации. Кроме того, не передавайте пин-код третьим лицам, даже родственникам или знакомым. В случае утери или кражи карты, обязательно свяжитесь с банком для блокировки карты и получения дальнейших инструкций."
Я потеряла карту,"[' Вы потеряли карту или ее украли\nПрежде всего, как можно быстрее, сообщите о случившемся в Банк посредством дистанционного обслуживания \nи заблокируйте карту. Заблокировать карту можно по телефону, в интернет-банке или в мобильном приложении Банка. \nЧем раньше Вы это сделаете, тем меньше вероятность несанкционированного использования карты злоумышленниками. \nРазблокировать карту нельзя — можно только перевыпустить. Если вы не уверены, что карту украли, не спешите ее \nблокировать, установите лимит «0» на операции и запретите покупки через Интернет, если карта будет найдена лимиты \nможно изменить.\nНапоминаем Вам, что в соответствии с Общими условиями выпуска и обслуживания кредитных карт и Общими \nусловиями открытия, ведения и закрытия счетов физических лиц, а также выпуска и обслуживания расчетных карт Ваша \nответственность за дальнейшее использование карты прекращается, после осуществления блокировки, если не станет \nизвестно, что незаконное использование карты имело место с Вашего согласия.\nЕсли карта была у Вас украдена на территории РФ, после блокировки карты заявите о случившемся в полицию. При краже \nкарты за границей, заявите в полицию или в консульский отдел посольства Российской Федерации в стране, на территории \nкоторой произошла кража. Пожалуйста, сохраняйте копию протокола (квитанцию о заявлении) для последующего \nпредъявления в Банк.']","Если вы не уверены, что карту украли, не спешите ее блокировать, установите лимит «0» на операции и запретите покупки через Интернет, если карта будет найдена лимиты можно изменить. В случае, если вы полагаете, что Вашу карту всё-таки украли, то как можно быстрее, сообщите о случившемся в Банк посредством дистанционного обслуживания и заблокируйте карту. Это возможно сделать по телефону, в интернет-банке или в мобильном приложении Банка.","Если вы потеряли карту, вам необходимо незамедлительно уведомить Банк Tinkoff по телефонам 8 800 555-25-50 или +7 495 645-59-19 (круглосуточно) и заблокировать карту. Также вы должны подать заявление о досрочном перевыпуске карты. При этом после устного заявления Банк примет меры только по блокированию карты. Если потерянная карта будет найдена, обязательно верните ее в Банк, так как использование найденной карты в дальнейшем запрещено."
"Почему при использовании карты важно не расписываться на квитанциях/чеках до того, как вы проверите правильность указанной суммы?","['Проверяйте правильность суммы, указанной на платежном чеке. Поставив подпись на платежном чеке, Вы соглашаетесь со списанием указанной на нем суммы с Вашего карточного счета.']","Важно проверять правильность суммы перед подписанием квитанции/чека, потому что после подписи вы соглашаетесь с этой суммой, и она будет списана с вашего счета.","При использовании карты важно не расписываться на квитанциях/чеках до того, как вы проверите правильность указанной суммы, так как ваша подпись подтверждает факт совершения операции. Пожалуйста, перед тем, как поставить свою подпись, проверьте правильность информации на квитанции или чеке. В случае если операция проводится с использованием электронного терминала, кассир может предложить вам самостоятельно вставить карту в терминал и ввести ПИН-код на выносной клавиатуре электронного терминала. Операция по карте должна проводиться в вашем присутствии."
"Что делать, если я потеряла телефон, на котором было установлено мобильное приложение банка?","['При утрате Мобильного телефона, используемого с абонентским номером подвижной радиотелефонной связи, на который установлено Мобильное приложение Банка, Вам следует срочно обратиться к своему оператору сотовой связи для блокировки SIM-карты и в Банк посредством дистанционного обслуживания для блокировки доступа в мобильное приложение Банка и удаления данных карты с Мобильного телефона.']","Если вы потеряли телефон с установленным мобильным приложением банка, необходимо:

Срочно обратиться к оператору сотовой связи для блокировки SIM-карты.
Обратиться в банк через дистанционное обслуживание для блокировки доступа в мобильное приложение и удаления данных карты с телефона.","Если вы потеряли телефон, на котором было установлено мобильное приложение банка Tinkoff, вам следует срочно обратиться к вашему оператору сотовой связи для блокировки SIM-карты и в банк через дистанционное обслуживание для блокировки доступа в мобильное приложение банка и удаления данных карты с мобильного телефона."
Можно ли использовать интернет-кафе и другие общедоступные места для совершения операций по карте в интернете? Объясните причину.,"['Избегайте осуществления Интернет-операций с использованием карты в местах, где услуги Интернет являются общедоступными, например, в Интернет-кафе.']","Нет, не рекомендуется использовать интернет-кафе и другие общедоступные места для совершения операций по карте в интернете. Причина в том, что такие общедоступные сети являются менее безопасными, и есть риск перехвата данных карты злоумышленниками.","Для безопасности рекомендуется избегать совершения операций по карте в интернете в общедоступных местах, таких как интернет-кафе. Лучше использовать проверенные интернет-магазины, в которых вы уверены. При оплате покупок в сети Интернет следует вводить трехзначный код безопасности CVC2/CVV2 для повышения безопасности операций. Необходимо также предоставлять реквизиты карты только в защищенных режимах, внимательно следить за безопасностью при вводе ПИН-кода и не сообщать его третьим лицам. В случае затруднений или вопросов, рекомендуется обращаться в Банк через дистанционное обслуживание."
"Что делать, если я получил SMS-оповещение о операции по карте, которую я не совершал?","['Если Вы уверены, что операция не могла быть совершена Вами, то как можно быстрее сообщите об этом в Банк посредством дистанционного обслуживания и заблокируйте карту.']","Если вы получили SMS-оповещение о операции, которую не совершали, нужно как можно быстрее сообщить об этом в банк через дистанционное обслуживание и заблокировать карту.","Если вы получили SMS-оповещение о операции по карте, которую вы не совершали, следует как можно быстрее сообщить об этом в Банк посредством дистанционного обслуживания и заблокировать карту. Это можно сделать по телефону, в интернет-банке или в мобильном приложении Банка. Чем раньше вы заблокируете карту, тем меньше вероятность несанкционированного использования карты злоумышленниками. Не спешите блокировать карту, если вы не уверены, что она была украдена, установите лимит ""0"" на операции и запретите покупки через интернет. Необходимо также помнить, что ваша ответственность за дальнейшее использование карты прекращается после блокировки, если не станет известно, что незаконное использование карты имело место с вашего согласия. В случае кражи карты на территории РФ, после блокировки карты следует заявить в полицию. При краже карты за границей, следует обратиться в полицию или в консульский отдел посольства Российской Федерации в соответствующей стране и сохранить копию протокола для последующего предъявления в Банк."
Как обезопасить себя от съема данных карты в банкомате злоумышленниками? Приведи два способа.,"['Поэтому, при пользовании банкоматом не ленитесь внимательно осмотреть его и убедиться в отсутствии каких-либо «накладок» и посторонних устройств.', 'Пожалуйста, примите все меры, чтобы вводимый Вами ПИН-код был не заметен для окружающих.']","Чтобы обезопасить себя от съема данных карты в банкомате:

Внимательно осматривайте банкомат перед использованием на наличие подозрительных накладок и посторонних устройств.
Прикрывайте рукой клавиатуру при вводе ПИН-кода, чтобы его не могли увидеть окружающие.","Чтобы обезопасить себя от съема данных карты в банкомате злоумышленниками, рекомендуется:

1. Не передавать карту другим лицам для проведения транзакций, чтобы исключить возможность несанкционированного использования.
2. Внимательно осматривать банкомат перед использованием, чтобы убедиться в отсутствии подозрительных устройств, таких как прозрачные пленки или жесткие накладки, которые могут фиксировать вводимый ПИН-код."
"Правда ли, что при бронировании гостиницы по карте мне необходимо сообщить все реквизиты карты, включая ПИН-код? Если нет, то что именно требуется сообщить?","['При бронировании номера в гостинице по карте Вас попросят сообщить свое имя, номер карты, срок ее действия (иногда, дополнительно — трехзначный код безопасности, напечатанный на обратной стороне карты на полосе для подписи) и срок Вашего пребывания.']","Нет, неправда. При бронировании гостиницы по карте не требуется сообщать ПИН-код. Обычно для бронирования запрашивают ваше имя, номер карты, срок ее действия, иногда трехзначный код безопасности (CVV/CVC) с оборотной стороны карты и планируемый срок пребывания.","При бронировании гостиницы по карте необходимо сообщить следующие реквизиты: ваше имя, номер карты, срок ее действия, трехзначный код безопасности (CVV/CVC), срок вашего пребывания. Необходимо также запрашивать код подтверждения бронирования и уточнять стоимость проживания. При проверке подлинности карты может быть произведен авторизационный запрос на незначительную сумму, которая не будет списана с карты и станет доступна для использования через 30 дней. При отмене бронирования необходимо соблюдать сроки и правила отмены, чтобы избежать списания средств с вашего счета."
"Если я из другой страны и у меня нет паспорта РФ, что мне делать?","['\n                     1. Документы и сведения, получаемые в целях идентификации Клиентов-физических лиц, а также в целях обслуживания таких Клиентов в рамках Универсального договора\n                     1.4. Реквизиты документа, удостоверяющего личность: серия (при наличии) и номер документа, дата выдачи документа, наименование органа, выдавшего документ (при наличии кода подразделения может не устанавливаться), и код подразделения (при наличии).\n                     1.4.2.для иностранных граждан:\n                     •паспорт иностранного гражданина;\n                     •дипломатический паспорт, служебный паспорт, удостоверяющие личность иностранного гражданина.', '.5.Документ, подтверждающий право иностранного гражданина или лица без гражданства на пребывание (проживание) в Российской Федерации (миграционной карты в случае отсутствия иных документов), в случае если наличие таких документов обязательно в соответствии с международными договорами Российской Федерации и законодательством Российской Федерации;Документами, подтверждающими право иностранного гражданина или лица без гражданства на пребывание (проживание) в РФ, являются:\n                    •миграционная карта в случае отсутствия иных документов;\n                    •вид на жительство;\n                    •разрешение на временное проживание;\n                    •виза;\n                    •иной документ, подтверждающий в соответствии с международными договорами Российской Федерации и законодательством РФ право иностранного гражданина или лица без гражданства на пребывание (проживание) в РФ.\n']","
                        Если вы из другой страны, то для заключения договора вам неообходимы документы, удостоверяющие Вашу личность. Для иностранных граждан это:
                            •паспорт иностранного гражданина;
                            •дипломатический паспорт, служебный паспорт, удостоверяющие личность иностранного гражданина.
                        Также необходимы документы, подтверждающие право иностранного гражданина (проживание) в Российской Федерации (миграционной карты в случае отсутствия иных документов), в случае если наличие таких документов обязательно в соответствии с международными договорами Российской Федерации и законодательством Российской Федерации;Документами, подтверждающими право иностранного гражданина или лица без гражданства на пребывание (проживание) в РФ, являются:
                            •миграционная карта в случае отсутствия иных документов;
                            •вид на жительство;
                            •разрешение на временное проживание;
                            •виза;
                            •иной документ, подтверждающий в соответствии с международными договорами Российской Федерации и законодательством РФ право иностранного гражданина или лица без гражданства на пребывание (проживание) в РФ. ","Для того, чтобы открыть счет в банке Tinkoff, если у вас нет паспорта РФ, необходимо предоставить иные документы, удостоверяющие личность иностранного гражданина, такие как паспорт иностранного гражданина или другие документы, признаваемые в соответствии с законодательством Российской Федерации. Если у вас нет паспорта РФ, вам следует обратиться в банк Tinkoff для получения консультации по необходимым документам для открытия счета."
В течении скольких дней действительна выписка из ЕГРЮЛ?,"['\n                    2.2. Выписка из Единого государственного реестра юридических лиц (ЕГРЮЛ). Банком может быть принята копия \n                    выписки, заверенная регистрирующим органом. Выписка считается действительной для предоставления в Банк \n                    в течение 30 (тридцати) календарных дней с даты ее выдачи и должна содержать актуальные сведения на дату  \n                    ее предоставления;']",Выписка из Единого государственного реестра юридических лиц (ЕГРЮЛ) действительна в течении 30 дней с даты ее выдачи.,Выписка из ЕГРЮЛ считается действительной для предоставления в банк Tinkoff в течение 30 (тридцати) календарных дней с даты ее выдачи.
Нужно ли ИП указывать свой сайт для предприятия?,"['\n                    3. Документы и сведения, предоставляемые Клиентом-индивидуальным предпринимателем: \n                    3.5. Сведения о доменном имени, указателе страницы сайта в сети «Интернет», с использованием которых Клиентом \nоказываются услуги (при наличии);\n                    ']","Да, индивидуальному предпринимателю необходимо указать сведения о доменном имени, указателе страницы сайта в сети «Интернет».","Для предпринимателей необходимо указать доменное имя и указатель страницы сайта в сети ""Интернет"", с использованием которых предприниматель оказывает услуги, если такие сайт имеется."
Может ли Банк запросить дополнительные документы - не из списка обязательных?,"['\n                     26. Банк может запросить у Клиента, а Клиент обязуется предоставить по запросу Банка дополнительные документы \n                    и сведения, как предусмотренные, так и не предусмотренные настоящим Перечнем, в том числе в целях надлежащей \n                    идентификации Клиента, его представителя, выгодоприобретателя и бенефициарного владельца в соответствии \n                    с требованиями действующего законодательства Российской Федерации, нормативных актов Банка России, а также \n                    требованиями Банка. Банк вправе не запрашивать отдельные документы и сведения, предусмотренные настоящим \n                    Перечнем, в случаях, установленных внутренними правилами Банка.']","Да, Банк может запросить у Вас дополнительные не предусмотренные Перечнем документы.","Да, Банк может запросить дополнительные документы и сведения, даже не из списка обязательных. Это делается в целях надлежащей идентификации Клиента, его представителя, выгодоприобретателя и бенефициарного владельца в соответствии с требованиями действующего законодательства Российской Федерации, нормативных актов Банка России, а также требованиями самого Банка. Банк может не запрашивать отдельные документы, предусмотренные обязательным списком, в случаях, установленных внутренними правилами Банка."
Какие документы нужно предоставить физическому лицу для открытия счета?,"['1. Документы и сведения, получаемые в целях идентификации Клиентов-физических лиц, а также в целях обслуживания таких Клиентов в рамках Универсального договора']","Физическому лицу для открытия счета необходимо предоставить документ, удостоверяющий личность (паспорт или иной документ из списка в п.1.4), документ, подтверждающий регистрацию или место пребывания, ИНН, СНИЛС и контактную информацию.","Для открытия счета в банке Tinkoff физическое лицо должно предоставить следующие документы:
- Сведения и документы, зависящие от организационно-правовой формы;
- Документы-основания участия бенефициара в отношениях по договору;
- Документы, удостоверяющие личность;
- Документ, подтверждающий право иностранного гражданина на пребывание в Российской Федерации (если применимо);
- Дополнительные документы, если физическое лицо является иностранным гражданином и занимается частной практикой.

Если у вас есть дополнительные вопросы или нужна более подробная информация, обратитесь в банк Tinkoff."
Какие документы необходимо предоставить юридическому лицу для открытия счета в Банке? Можно ли предоставить сканы документов или нужны оригиналы?,"['2.1. Учредительные документы юридического лица...', '2.2. Выписка из Единого государственного реестра юридических лиц (ЕГРЮЛ)...', '2.3. Документ об избрании единоличного исполнительного органа юридического лица...']","Юридическому лицу необходимо предоставить учредительные документы, выписку из ЕГРЮЛ, документ об избрании руководителя, документы, подтверждающие личность руководителя и лиц, имеющих право подписи. Документы можно предоставить в копиях, заверенных нотариально, регистрирующим органом, руководителем или сотрудником Банка при наличии оригиналов.","Для открытия счета в Банке Tinkoff юридическому лицу необходимо предоставить следующие документы:
1. Учредительные документы юридического лица (Устав и/или Учредительный договор);
2. Сведения о договорах с банковским платежным агентом или субагентом;
3. Документы-основания участия бенефициара в отношениях по договору счета;
4. Документы, удостоверяющие личность бенефициарного владельца;
5. Миграционную карту для иностранных граждан.

Касательно предоставления документов, оригиналы или сканы могут быть предоставлены в Банк в соответствии с их требованиями."
Можно ли открыть счет индивидуальному предпринимателю – иностранному гражданину? Какие документы для этого нужны?,"['3.1. Идентификация индивидуального предпринимателя осуществляется на основании документов и сведений, указанных в пункте 1.4 настоящего Перечня', '3.2. Документ, подтверждающий право иностранного гражданина или лица без гражданства на пребывание (проживание) в Российской Федерации...']","Да, индивидуальному предпринимателю-иностранному гражданину можно открыть счет. Для этого нужно предоставить документ, удостоверяющий личность, документ, подтверждающий право пребывания/проживания в РФ (напр. миграционную карту), ИНН, СНИЛС, выписку из ЕГРИП и контактную информацию.","Для открытия счета индивидуальному предпринимателю – иностранному гражданину необходимо предоставить следующие документы:
1. Документы, удостоверяющие личность и указанные в соответствующем перечне.
2. В случае, если физическое лицо является иностранным гражданином, необходимо предоставить документ, подтверждающий право на пребывание (проживание) в Российской Федерации.
3. Лицензии или разрешения на осуществление деятельности, подлежащей лицензированию.
4. Информация о страховом номере индивидуального лицевого счета застрахованного лица (при необходимости).
5. Адрес места жительства (регистрации) или места пребывания.
6. Контактная информация.
7. Выписка из ЕГРИП.

Если у вас возникнут дополнительные вопросы или требуется более подробная информация, рекомендуем обратиться в банк Tinkoff для консультации."
"Какие документы потребуются, если открывать счет для нотариуса, занимающегося частной практикой? Может ли нотариус быть иностранцем при этом?","['5.1. Документ, удостоверяющий личность и указанный в пункте 1.4 настоящего Перечня', '5.2. Документ, подтверждающий наделение нотариуса полномочиями (назначение на должность), выдаваемый органами юстиции субъектов Российской Федерации, в соответствии с законодательством Российской Федерации']","Для открытия счета нотариусу, занимающемуся частной практикой, требуется предоставить документ, удостоверяющий личность, документ о назначении на должность нотариуса от органов юстиции, регистрационные документы, финансовые документы и контактные данные. Нотариус может быть иностранцем, в этом случае дополнительно потребуется документ, подтверждающий право на пребывание/проживание в РФ.","Для открытия счета для нотариуса, занимающегося частной практикой, потребуются следующие документы:

1. Документ, удостоверяющий личность.
2. Документ, подтверждающий наделение нотариуса полномочиями.
3. Адрес места жительства или места пребывания.
4. Контактная информация.
5. Выписка из ЕГРИП.
6. Информация о страховом номере индивидуального лицевого счета.
7. Сведения о целях установления и предполагаемом характере деловых отношений с банком.
8. Сведения о деловой репутации.

Если нотариус является иностранным гражданином, то дополнительно к вышеперечисленным документам потребуется предоставить миграционную карту или другой документ, подтверждающий право на пребывание в Российской Федерации."
"Как узнать, кто является бенефициарным владельцем юридического лица? Какие документы для этого нужны?",['12. Идентификация бенефициарного(ых) владельца(ев) осуществляется на основании следующий документов и сведений...'],"Для идентификации бенефициарного владельца юридического лица необходимо предоставить документы, удостоверяющие личность бенефициара, документ о регистрации/пребывании в РФ (если бенефициар - иностранец), ИНН, адрес регистрации и контактные данные. Также можно заполнить анкету бенефициарного владельца по форме Банка.","Для узнавания информации о бенефициарном владельце юридического лица необходимо предоставить следующие документы и сведения:
1. Документы, удостоверяющие личность.
2. Документы, подтверждающие право иностранного гражданина или лица без гражданства на пребывание в Российской Федерации.
3. Идентификационный номер налогоплательщика.
4. Адрес места жительства или места пребывания.
5. Контактная информация.

Идентификация бенефициарных владельцев может осуществляться на основании заполненной анкеты физического лица - бенефициарного владельца по форме Банка, подписанной клиентом. Если бенефициарный владелец является иностранным гражданином или лицом без гражданства, идентификация осуществляется на основании указанных документов и сведений.

Если у вас возникают дополнительные вопросы или необходима более подробная информация, рекомендуем обратиться в банк Tinkoff для получения консультации."
Расскажи про термины 'Договор страхования' и 'КАСКО',"['1. Термины и определения     \n                    Договор страхования — договор, по которому одна сторона (Страховщик) обязуется за обусловленную договором \n                    плату (страховую премию) при наступлении предусмотренного в договоре события (страхового случая) осуществить \n                    другой стороне (страхователю) или иному лицу, в пользу которого заключен договор (выгодоприобретателю), \n                    страховое возмещение в пределах определенной договором суммы (страховой суммы).', 'КАСКО — комбинированное страхование транспортных средств и сопутствующих рисков.']"," Да, конечно! Договор страхования — это договор, по которому одна сторона (Страховщик) обязуется за обусловленную договором 
                    плату (страховую премию) при наступлении предусмотренного в договоре события (страхового случая) осуществить 
                    другой стороне (страхователю) или иному лицу, в пользу которого заключен договор (выгодоприобретателю), 
                    страховое возмещение в пределах определенной договором суммы (страховой суммы). 
                    КАСКО — это комбинированное страхование транспортных средств и сопутствующих рисков.","Договор страхования - это соглашение между страховщиком и страхователем, по которому страховщик обязуется выплатить страховое возмещение в случае наступления страхового случая в пределах определенной суммы (страховой суммы). Страхователь, застрахованное лицо или выгодоприобретатель могут быть участниками договора страхования.

КАСКО - это комбинированное страхование транспортных средств и сопутствующих рисков. Это вид страхования, который обеспечивает защиту от различных рисков, таких как угон, повреждение автомобиля, столкновение и другие непредвиденные события.

Если у вас возникнут дополнительные вопросы по этим терминам или условиям страхования, рекомендую обратиться в банк Tinkoff для получения более подробной информации."
"Какой минимум страховой выплаты мне вернут, если моя страховая сумма = 50 000 долларов?"," 
                    2.19.   При добровольном страховании непредвиденных расходов путешественников страховая сумма в договоре 
                    страхования может быть установлена в рублях или иностранной валюте в рублевом эквиваленте по официальному 
                    курсу иностранных валют ЦБ РФ на дату заключения Договора страхования, но не менее чем 66,7 руб. за 1 у.е.  при 
                    страховой сумме 30 000 у.е., 57,2 руб. за 1 у.е. при страховой сумме 35 000 у.е., 50 руб. за 1 у.е. при страховой сумме 
                    50 000 у.е., 26,7 руб. за 1 у.е. при страховой сумме 75 000 у.е."," 
                    Минимальная страховая выплата, которую вам вернут, если ваша страховая сумма составляет 50 000 долларов, составляет 50 рублей за 1 доллар США. Минимальная выплата составит 2 500 000 рублей.
                    Обратите внимание, что это минимальная выплата, которую вы получите. Фактическая сумма выплаты может варьироваться в зависимости от условий вашего договора.
        ",Минимальная страховая выплата составит 75% от Первоначальной суммы кредита Застрахованного лица по Кредитному договору.
"При принятии пользовательских соглашений, кому еще попадают мои данные?","['\n                    5. Персональные данные     \n                        5.1.       Пользователь подтверждает, что с использованием Дистанционных каналов взаимодействия дает Страховщику, \n                        аффилированным лицам страховщика, Страховому агенту или Страховому брокеру, а также лицам, \n                        предоставляющим услуги по использованию их информационных возможностей для целей заключения договоров \n                        страхования, хранения документов, в том числе, облачных сервисов, серверов, программных продуктов, согласие на \n                        обработку его персональных данных с целью осуществления дистанционного взаимодействия с последними при \n                        использовании их Сайта и/или сайтов в сети Интернет или при помощи ПО Страховщика и в целях осуществления \n                        маркетинговых коммуникаций перечисленных лиц с Пользователем.  \n        ']","
                    Согласно пункту 5.1 пользовательского соглашения, ваши персональные данные могут быть переданы следующим сторонам:
                        • Аффилированные лица страховщика
                        • Страховой агент
                        • Страховой брокер
                        • Лица, предоставляющие услуги по использованию их информационных возможностей для целей заключения договоров страхования, хранения документов, в том числе облачных сервисов, серверов, программных продуктов
","При принятии пользовательских соглашений, ваши данные могут попасть к страховщику, аффилированным лицам страховщика, страховому агенту или страховому брокеру, а также лицам, предоставляющим услуги по использованию их информационных возможностей для целей заключения договоров страхования, хранения документов и осуществления маркетинговых коммуникаций. Предоставленные вами персональные данные третьих лиц передаются с вашего согласия на обработку их персональных данных страховщиком и другими указанными лицами. В случае отзыва согласия на обработку персональных данных, обработка должна быть прекращена, и данные должны быть уничтожены в определенные сроки после уведомления о отзыве согласия."
Зачем страховщик ведет аудио и видеозапись при взаимодействии с клиентом? Как долго эти записи хранятся?,"['При заключении Договоров страхования, а также при ином обращении Клиента или Пользователя к Страховщику или его представителям Страховщик вправе осуществлять наблюдение, фотографирование, аудио- и видеозапись, включая запись телефонных разговоров, а также копирование и хранение переписок между Пользователем и Страховщиком (его представителями) по электронной почте или в мессенджерах, без дополнительного уведомления Клиента (Пользователя) о такой записи. Клиент соглашается, что Страховщик вправе хранить такие записи в течение 5 (пяти) лет с момента прекращения отношений с Клиентом (Пользователем), с целью улучшения качества обслуживания, исполнения Договора страхования, а также использовать их при проведении любых расследований в связи с Договором страхования.']","Страховщик ведет аудио, видеозапись, фотографирование, копирует переписку с клиентом без дополнительного уведомления с целью улучшения качества обслуживания, исполнения договора страхования, а также для использования этих записей при проведении расследований, связанных с договором. Такие записи страховщик вправе хранить в течение 5 лет с момента прекращения отношений с клиентом.","Страховщик ведет аудио и видеозапись при взаимодействии с клиентом с целью улучшения качества обслуживания, исключения риска совершения несанкционированных операций, а также использования записей при проведении любых расследований в связи с договором страхования. Эти записи хранятся в течение 5 лет с момента прекращения отношений с клиентом."
В каких случаях застрахованному могут быть оплачены планируемые расходы по страховому случаю до предоставления подтверждающих документов? Какие ограничения есть по размеру таких выплат?,"['По договорам добровольного страхования непредвиденных расходов путешественников по предварительному согласованию со Страховщиком Застрахованному могут оплачиваться планируемые расходы по предусмотренным договором страхования страховым событиям, предусматривающим возмещение расходов на оказание Экстренной или Неотложной амбулаторной и/или стационарной помощи, с условием предоставления Застрахованным документов, подтверждающих такие расходы Страховщику непосредственно после их несения (чеки, платежные документы и пр.). В случае если в результате страхового случая Застрахованным лицом были понесены соответствующие расходы на оказание Экстренной или Неотложной амбулаторной и/или стационарной помощи, в том числе, предварительно согласованные Страховщиком, но не были предоставлены документы, подтверждающие их оплату, Страховщик возмещает расходы в размере не более 200 у.е. (если страховая сумма установлена в валюте, отличной от российского рубля) или 10 000 российских рублей (если страховая сумма установлена в российских рублях), за один страховой случай.']","По договорам добровольного страхования непредвиденных расходов путешественников застрахованному могут быть оплачены планируемые расходы по страховым случаям, предусматривающим возмещение расходов на экстренную/неотложную амбулаторную или стационарную помощь, по предварительному согласованию со страховщиком. Условие - предоставление подтверждающих документов сразу после несения расходов. Если документы не предоставлены, то страховщик возмещает расходы в размере не более 200 у.е. (если страховая сумма в валюте) или 10 000 рублей (если в рублях) за один случай.","Застрахованному могут быть оплачены планируемые расходы по страховому случаю до предоставления подтверждающих документов только при условии предварительного согласования со Страховщиком. Однако, в случае если не были предоставлены документы, подтверждающие оплату таких расходов, размер выплаты ограничивается суммой не более 200 у.е. или 10 000 российских рублей за один страховой случай."
Куда пользователь может направить обращение при возникновении вопросов или спора со страховщиком?,"['При возникновении вопросов или спора можно отправить обращение:\n\nв АО «Тинькофф Страхование» по почте по адресу: 127287, Российская Федерация, г. Москва, ул. 2-я Хуторская, дом 38А, строение 26, либо путем заполнения соответствующей формы на сайте Страховщика;\nк финансовому уполномоченному путем регистрации обращения на сайте — finombudsman.ru или по почтовому адресу: 119017, г. Москва, Старомонетный пер., дом 3;\nво Всероссийский союз страховщиков на сайте — ins-union.ru, приложив к обращению необходимые документы и сведения, либо на почтовый адрес: 115093, г. Москва, ул. Люсиновская, д. 27, стр. 3;\nв Центральный Банк Российской Федерации (Банк России) через интернет-приемную на официальном сайте — cbr.ru, приложив к обращению необходимые документы и сведения, либо на почтовый адрес: 107016, г. Москва, ул. Неглинная, д. 12.']","При возникновении вопросов или спора с АО 'Тинькофф Страхование' пользователь может направить обращение:

 - В АО 'Тинькофф Страхование' по почте или через форму на сайте;
 - Финансовому уполномоченному на сайте finombudsman.ru или почтовым адресом;
 - Во Всероссийский союз страховщиков на сайте ins-union.ru или почтовым адресом;
В Центральный Банк РФ через интернет-приемную на сайте cbr.ru или почтовым адресом.","Пользователь может направить обращение при возникновении вопросов или спора со страховщиком через Дистанционные каналы взаимодействия, такие как официальный сайт страховщика, страховой агент, страховой брокер в информационно-телекоммуникационной сети «Интернет» или мобильные приложения страховщика. В случае возникновения споров, они подлежат разрешению в соответствии с действующим законодательством Российской Федерации и рассмотрению в судебном порядке."
Где можно ознакомиться с дополнительной информацией и документами о деятельности АО 'Тинькофф Страхование'?,"['Дополнительная информация и документы о деятельности Страховщика в соответствии с п. 6.1 Закона РФ от 27.11.1992 N 4015-1 «Об организации страхового дела в Российской Федерации» и п. 2.1.1. «Базового стандарта защиты прав и интересов физических и юридических лиц — получателей финансовых услуг, оказываемых членами саморегулируемых организаций, объединяющих страховые организации» размещены по ссылкам: tinkoffinsurance.ru/about, tinkoffinsurance.ru/about/documents.']",Дополнительная информация и документы о деятельности АО 'Тинькофф Страхование' в соответствии с законом 'Об организации страхового дела в РФ' и базовым стандартом защиты прав получателей финансовых услуг размещены на сайте страховщика по ссылкам tinkoffinsurance.ru/about и tinkoffinsurance.ru/about/documents.,"Вы можете ознакомиться с дополнительной информацией и документами о деятельности АО ""Тинькофф Страхование"" на сайте tinkoﬃnsurance.ru/about и tinkoﬃnsurance.ru/about/documents."
Что означает 'Партия' и вообще 'Слиток' для драгоценных металлов?,"['\n                    Партия — приобретенные Клиентом Слитки в количестве, превышающем 1 (одну) штуку, и подлежащие доставке Клиенту, \n                    в рамках одной Заявки', ' Слиток — аффинированный драгоценный металл: золото, серебро, платина и палладий в виде слитков (стандартных, \n                    мерных), соответствующих установленным в Российской Федерации стандартам или международным стандартам качества, \n                    изготовленных и маркированных организацией, осуществляющей аффинаж драгоценного металла. Слиток в рамках \n                    предоставления Сервиса доставляется / принимается на хранение в ненарушенной Упаковке с приложением Сертификата-\n                    ярлыка (при наличии) и Сертификата качества слитка']","Давайте разберемся! 
                    Партия — это приобретенные клиентом слитки в количестве, превышающем 1 штуку, и подлежащие доставке клиенту, в рамках одной заявки.
                    Слиток — это аффинированный драгоценный металл: золото, серебро, платина и палладий в виде слитков (стандартных, 
                    мерных), соответствующих установленным в Российской Федерации стандартам или международным стандартам качества, 
                    изготовленных и маркированных организацией, осуществляющей аффинаж драгоценного металла. Слиток в рамках 
                    предоставления Сервиса доставляется / принимается на хранение в ненарушенной Упаковке с приложением Сертификата-
                    ярлыка (при наличии) и Сертификата качества слитка.
        ","Партия в данном контексте означает приобретенные Клиентом Слитки в количестве, превышающем 1 (одну) штуку, и подлежащие доставке Клиенту, в рамках одной Заявки. Слиток же представляет собой драгоценный металл, который может быть приобретен или продан клиентом через банк Tinkoff."
Меня действительно должны фотографировать после полкчения слитка? Какой это пункт в соглашении?,"['\n                    2.13.12. После подтверждения получения Клиентом/Доверенным лицом Слитка Представитель фотографирует Клиента/\n                    Доверенное лицо с полученным Слитком в ненарушенной заводской упаковке и документом, удостоверяющим личность \n                    Клиента/Доверенного лица']","Да, Вас действительно должнен сфотографировать Представитель в соответсвии с пунктом 2.13.12.","Да, в соответствии с пунктом 2.13.12 пользователь должен быть фотографирован после получения слитка в ненарушенной заводской упаковке."
Какие условия хранения?,"[' \n                    2.14.9. Условия хранения: температура воздуха от +17 до +25 °С, атмосферное давление от 740 до 760 мм рт. ст., относительная \n                    влажность воздуха от 30 до 60%']","
                    В соответсвии с пунктом 2.14.9. условия хранения слитка слудующие: 
                        - температура воздуха от +17 до +25 °С,
                        - атмосферное давление от 740 до 760 мм рт. ст.,
                        - относительная влажность воздуха от 30 до 60% ","Согласно условиям хранения банка Tinkoff, слиток драгоценных металлов хранится в хранилище 5 класса устойчивости к взлому, оборудованном системой видеонаблюдения, охранно-пожарной и тревожной сигнализацией. Температура воздуха должна быть от +17 до +25 °C, атмосферное давление от 740 до 760 мм рт. ст., относительная влажность воздуха от 30 до 60%. Слиток хранится до востребования клиента и место хранения может быть изменено с согласия клиента или в случае обстоятельств непреодолимой силы без письменного уведомления."
Что такое 'Сертификат качества слитка'?,"['Сертификат качества слитка — документ о качестве драгоценного металла, содержащий сведения о соответствии драгоценного металла стандартам качества, технические характеристики и параметры Слитка, информацию о химическом составе, произведенный/заверенный предприятием-изготовителем Слитка.']","Сертификат качества слитка - это документ, выданный изготовителем слитка драгоценного металла, который содержит информацию о соответствии металла стандартам качества, его технические характеристики, параметры и химический состав.","Сертификат качества слитка - это документ, содержащий информацию о качестве драгоценного металла, его технические характеристики, параметры, химический состав, а также данные о соответствии стандартам качества. Этот сертификат выдается предприятием-изготовителем слитка и является подтверждением качества драгоценного металла. Клиент обязан сохранить полученный сертификат, так как его наличие позволяет убедиться в надлежащем качестве слитка. При утрате или повреждении сертификата, а также при обнаружении несоответствий при приеме слитка, возможно признание слитка ненадлежащего качества."
На какой срок выдается эта доверенность? Можно ли ее передоверить другому лицу?,"['Датой выдачи доверенности считается дата предоставления Представляемым Банку данных своего представителя. Доверенность выдана сроком на 1 (один) год, полномочия по настоящей доверенности не могут быть передоверены другим лицам.']",Доверенность выдается сроком на 1 год. Полномочия по этой доверенности нельзя передоверять другим лицам.,"Доверенность выдается на срок 1 год, полномочия по доверенности не могут быть передоверены другим лицам."
"Как клиент может получить сертификат качества слитка, который он передал на хранение в банк?","['По требованию Клиента Банк предоставляет Клиенту заверенную Банком копию Сертификата качества слитка, переданного на ответственное хранение.']","По требованию клиента банк предоставляет ему заверенную копию сертификата качества слитка, который клиент передал на ответственное хранение в банке.","Клиент может получить сертификат качества слитка, который он передал на хранение в банк, по требованию. В случае передачи слитка на ответственное хранение в банк, клиент при подтверждении заявки подписывает акт-приема передачи, и в рамках настоящих правил банк обязуется предоставить клиенту заверенную копию сертификата качества слитка, переданного на ответственное хранение. Факт приема-передачи слитка на ответственное хранение подтверждается актом приема-передачи, который подписывается сторонами."
Какие условия хранения слитков в банке? Где их хранят?,"['Хранение Банком Слитка Клиента осуществляется в хранилище 5 (Пятого) класса устойчивости к взлому, оборудованном системой видеонаблюдения и охранно-пожарной и тревожной сигнализации с выводом сигнала на пункт централизованной охраны, с осуществлением физической круглосуточной специализированной охраны хранилища.', 'Условия хранения: температура воздуха от +17 до +25 °С, атмосферное давление от 740 до 760 мм рт. ст., относительная влажность воздуха от 30 до 60%.']","Слитки хранятся в специальном хранилище 5 класса устойчивости к взлому, оборудованном системами видеонаблюдения, охранно-пожарной и тревожной сигнализацией, а также круглосуточной охраной. Условия хранения: температура +17...+25°С, атмосферное давление 740-760 мм рт.ст., влажность 30-60%.","Слитки драгоценных металлов в банке Tinkoff хранятся в хранилище 5 класса безопасности. Условия хранения включают температуру воздуха от +17 до +25 °C, атмосферное давление от 740 до 760 мм рт. ст., и относительную влажность воздуха от 30 до 60%. Слитки хранятся в офисных помещениях, торговых центрах, частных домах и квартирах. Срок хранения слитков у банка - с момента подписания акта приема-передачи до момента востребования. В случае необходимости, банк может изменить условия и место хранения слитка с письменного согласия клиента или при обстоятельствах непреодолимой силы."
"Можно ли вернуть слиток в банк, если при получении были обнаружены его повреждения? Как это сделать?","['В случае обнаружения при приеме Слитка с ответственного хранения от Представителя нарушения целостности заводской упаковки Слитка, несоответствия нанесенной на Слиток маркировки данным, указанным в Сертификате качества слитка и/или Сертификате-ярлыке, отсутствия либо повреждения Сертификата качества слитка и/или Слитка (наличие на поверхности Слитка наплывов / заусенцев / царапин / жировых пятен / посторонних включений) Клиентом/Доверенным лицом и Представителем оформляется в двух экземплярах Рекламационный акт по форме Приложения № 3 к настоящим Правилам, в котором фиксируются указанные выше нарушения / несоответствия / повреждения. В случае наличия указанных выше нарушений / несоответствий / повреждений Слиток вместе с Сертификатом качества слитка и Сертификатом-ярлыком вкладываются Клиентом/Доверенным лицом в порожний сейф-пакет и запечатываются, после чего сейф-пакет помещается в Устройство для перевозки слитка с дальнейшим опломбированием номерной разовой пломбой. Номер сейф-пакета, а также номерной разовой пломбы отражаются в Рекламационном акте.']","Да, если при получении слитка с хранения были обнаружены его повреждения или нарушения упаковки, несоответствия маркировки и т.п., то клиент/доверенное лицо вместе с представителем банка оформляют рекламационный акт в двух экземплярах. В этом акте фиксируются все нарушения. После этого слиток вместе с сертификатами запечатывают в новый сейф-пакет и опломбировывают, указав номера на рекламационном акте. Затем слиток возвращается обратно в банк.","Для возврата слитка в банк в случае обнаружения повреждений при получении, необходимо оформить Рекламационный акт в соответствии с пунктом 2.13.8 Правил оказания сервиса «Покупка/продажа слитков драгоценных металлов». После оформления акта, слиток с повреждениями должен быть возвращен в банк. Клиент/Доверенное лицо должны проверить целостность и соответствие номера сейф-пакета со слитком номеру, указанному в Описи. При отсутствии нарушения целостности и соответствии номера сейф-пакета, клиент/доверенное лицо должны подписать Опись и вернуть ее представителю банка."
Кто может стать доверенным лицом?,"['Доверенное лицо — физическое лицо, уполномоченное Клиентом, которому предоставлено право на представление интересов Клиента и осуществление действий от его имени в рамках Сервиса на основании доверенности, оформленной посредством Дистанционного обслуживания в соответствии с п. 5.3 настоящих Правил по форме Приложения № 5 к настоящим Правилам.']","Доверенным лицом клиента может стать любое физическое лицо, которому клиент предоставит полномочия представлять его интересы в рамках сервиса покупки/продажи слитков драгоценных металлов. Доверенность на это лицо оформляется клиентом посредством дистанционного обслуживания в банке по форме из Приложения №5 к Правилам.","Доверенным лицом может стать представитель клиента, который обращается с заявкой в рамках сервиса ""Покупка/продажа слитков драгоценных металлов"" и предоставляет банку данные своего представителя. Доверенность уполномочивает представителя представлять интересы клиента и совершать различные действия от его имени в рамках указанного сервиса. Полномочия по доверенности не могут быть передоверены другим лицам, а срок действия доверенности составляет 1 год. Для оформления доверенности существуют определенные требования, включая указание необходимых полномочий представителя и заверение доверенности нотариусом в случае, если она состоит из более чем одного листа."
Можно ли поменять доверенное лицо? Как это сделать?,"['Клиент может отменить выданную доверенность путем обращения в Банк посредством Дистанционного обслуживания в любое время, но не позднее одного дня до планируемой даты встречи с представителем Клиента.']","Да, клиент может отменить ранее выданную доверенность на доверенное лицо. Для этого он должен обратиться в банк посредством дистанционного обслуживания не позднее чем за 1 день до планируемой даты встречи с действующим доверенным лицом.","Для изменения доверенного лица в рамках сервиса «Покупка/продажа слитков драгоценных металлов» вам необходимо обратиться в Банк посредством Дистанционного обслуживания. Вы можете отозвать выданную доверенность в любое время, но не позднее одного дня до планируемой даты встречи с представителем. При обращении вы должны предоставить данные нового представителя (фамилия, имя, отчество, дата рождения, серия и номер паспорта, кем и когда выдан)."
Как происходит покупка слитка банком? Есть ли какие-то особые условия?,"['Банк приобретает у Клиента только Слитки, находящиеся на ответственном хранении в Банке.', 'Клиент, обращаясь с Заявкой, подтверждает, что на момент заключения договора купли-продажи Слиток принадлежит на праве собственности Клиенту, не продан, не является предметом залога, не обременен правами третьих лиц, в споре, под арестом и иным запрещением не состоит.']","Банк осуществляет покупку слитков драгоценных металлов только у тех клиентов, чьи слитки находятся на ответственном хранении в самом банке. При подаче заявки на продажу слитка клиент должен подтвердить, что на момент продажи слиток принадлежит ему на праве собственности, не продан, не заложен, не арестован и не обременен правами третьих лиц.","Покупка слитка банком происходит следующим образом:
1. Банк приобретает у клиента только слитки, которые находятся на ответственном хранении в банке.
2. Заявки на совершение сделки купли-продажи слитка принимаются банком в рабочие дни с 10:00 до 17:00 по московскому времени через дистанционное обслуживание.
3. Клиент, обращаясь с заявкой, подтверждает, что слиток принадлежит ему на праве собственности, не продан, не является предметом залога и не обременен правами третьих лиц.
4. Масса слитка, его номер, цена за грамм драгоценного металла и итоговая стоимость согласовываются между клиентом и банком при оформлении заявки.
5. После согласования заявки банк направляет клиенту ключ простой электронной подписи и сообщение с информацией о слитке.
6. Клиент подтверждает свое согласие с заявкой, подписывает документы и банк зачисляет согласованную стоимость слитка на картсчет клиента.

Особых условий при покупке слитка банком не указано, однако важно следовать описанной процедуре согласования, подписания документов и зачисления стоимости на картсчет."
Что такое накопительный счет и как начисляются проценты?,"['\n                    3.1. Начисление процентов на остаток средств по Счету вклада/Накопительному счету производится со дня, следующего \n                    за днем зачисления денежных средств на Счет вклада/Накопительный счет Клиента, до дня окончания срока Вклада \n                    (включительно) либо до их списания со Счета вклада/Накопительного счета по иным основаниям.', ' \n                    3.3. Клиент имеет возможность по согласованию с Банком посредством Дистанционного обслуживания изменить Тарифный \n                    план Вклада на Тарифный план для мультивалютного Вклада. При смене Тарифного плана изменения в части процентной \n                    ставки по Счету вклада, изначально открытого в рамках текущего Договора вклада, не распространяются до конца срока \n                    размещения, установленного предыдущим Тарифным планом. Процентные ставки по валютам, отличным от валюты \n                    измененного Тарифного плана, устанавливаются новым Тарифным планом.\n                    3.4. При начислении процентов в расчет принимается величина процентной ставки (в процентах годовых) и фактическое \n                    количество календарных дней, на которое привлечены денежные средства. При этом за базу берется действительное \n                    число календарных дней в году (365 или 366 дней соответственно).\n                    ', ' \n                    Накопительный счет — счет, на котором учитываются денежные средства Клиента, предусматривающий начисление \n                    процентов на остаток денежных средств, в соответствии с Договором накопительного счета.']","
                    Накопительный счет - это счет, на котором учитываются денежные средства клиента и на который начисляются проценты на остаток денежных средств. Проценты начисляются в соответствии с условиями договора накопительного счета.
                    Проценты на накопительном счете начисляются со дня, следующего за днем зачисления денежных средств на счет, до дня окончания срока вклада (включительно) либо до их списания со счета по другим основаниям.

                    При начислении процентов учитываются:
                    • Величина процентной ставки (в процентах годовых)
                    • Фактическое количество календарных дней, на которое привлечены денежные средства

                    За базу берется действительное число календарных дней в году (365 или 366 дней соответственно).","Накопительный счет - это специальный счет, на который можно размещать денежные средства для накопления. Проценты начисляются на остаток средств по счету с дня, следующего за днем зачисления денег, и до дня окончания срока вклада или до списания средств по другим основаниям. При досрочном изъятии вклада производится перерасчет процентов за весь период фактического хранения средств."
Можно ли открыть вклад в 12 лет?,"['1.2. Банк не заключает Договор вклада (Договор накопительного счета) с лицами, не достигшими возраста 14 лет']","Нет, Банк не заключает договор вклада с лицами, не достигшими возраста 14 лет.","Договор вклада (Договор накопительного счета) с банком Tinkoff может быть заключен лицами, достигшими 14 лет. Следовательно, открыть вклад в 12 лет нельзя."
Могу ли я открыть несколько вкладов и пополнять их?,"['\n                    4.1. Клиент имеет право:\n                    4.1.1. Предъявить Банку требование о досрочном полном или частичном изъятии Вклада.\n                    4.1.2. Вносить дополнительные денежные средства во Вклад/Накопительный счет, если данная возможность установлена \n                    Тарифным планом.\n                    4.1.3. Разместить несколько Вкладов (открыть несколько Счетов вклада/Накопительных счетов на условиях, устанавливаемых \n                    Договором вклада (Договором накопительного счета), Тарифами:\n                    • через Дистанционное обслуживание;\n                    • в офисе Банка в часы работы операционного подразделения Банка.\n']"," 
                    Да, вы можете открыть несколько вкладов и пополнять их.
                    Согласно пункту 4.1.3 приведенного контекста, клиент имеет право разместить несколько вкладов (открыть несколько счетов вклада/накопительных счетов) на условиях, устанавливаемых договором вклада (договором накопительного счета) и тарифами.
                    Вы можете открыть несколько вкладов как через дистанционное обслуживание, так и в офисе банка в часы работы операционного подразделения банка.","Да, согласно контексту, вы можете разместить несколько вкладов (открыть несколько Счетов вклада) на условиях, устанавливаемых Договором вклада, через Дистанционное обслуживание или в офисе Банка в часы работы операционного подразделения. Также, у вас есть возможность вносить дополнительные денежные средства во вклад, если данная возможность установлена Тарифным планом."
Для получения страховой выплаты в случае несчастного случая с летальным исходом нужна ли справка из психушки?,['\n                    6.1. По риску Смерть в результате Несчастного случая должны быть предоставлены следующие документы:\n                    j. Справка из психоневрологического диспансера и наркологического диспансера'],"Да, в таком случае необходимы справки из психоневрологического диспансера и наркологического диспансера.","Для получения страховой выплаты в случае несчастного случая с летальным исходом не требуется предоставление справки из психоневрологического диспансера или наркологического диспансера. Необходимо предоставить следующие документы: свидетельство о смерти, решение суда о признании умершего, протокол патологоанатомического вскрытия, медицинское свидетельство о смерти с окончательной причиной смерти, результаты химико-токсикологического исследования, документы компетентных органов подтверждающие обстоятельства страхового случая, а также другие необходимые документы в зависимости от обстоятельств случая."
Дают ли кредит на автомобиль?,"['3.1. Банк предоставляет Клиенту Кредит на потребительские цели, в том числе на приобретение Товара и/или Автомобиля, в соответствии с законодательством Российской Федерации.']","Да, в соответсвии с пунктом 3.1. Банк предоставляет Клиенту Кредит на потребительские цели, , в том числе на приобретение автомобиля.","Да, банк Tinkoff предоставляет кредит на приобретение автомобиля в соответствии с законодательством Российской Федерации."
Распростроняется ли страховое покрытие на смерть в алкогольном опьянении?,"[' \n                    Страховое покрытие по рискам «Смерть» и «Инвалидность» не распространяется на события, произошедшие в результате \n                    и/или в период:\n                    a. действий, совершенных Застрахованным лицом в состоянии алкогольного, наркотического и/или токсического \n                    опьянения; в результате употребления им наркотических, сильнодействующих лекарственных препаратов \n                    и психотропных веществ без предписания врача (или по предписанию врача, но с нарушением указанной  \n                    им дозировки); болезни Застрахованного лица, прямо связанной с наркоманией, токсикоманией, хроническим \n                    алкоголизмом\n                    ']","Нет, страховое покрытие не распространяется на смерть в алкогольном опьянении.","Страховое покрытие по риску ""Смерть"" и ""Инвалидность"" не распространяется на случаи, если они произошли в результате действий, совершенных Застрахованным лицом в состоянии алкогольного опьянения."
"Может ли Банк изменить Тарифный план по кредитной карте, и какие условия должны быть соблюдены для этого?","['\n                    Банк вправе в одностороннем порядке изменить Тарифный план, применяемый\nв рамках Договора, и/или заменить его на другой Тарифный план, в том числе при заключении Договора и/или\nна определенный период времени по усмотрению Банка, с целью уменьшения процентной ставки по кредиту\nи/или улучшения иных условий обслуживания при условии, что это не повлечет возникновение новых или увеличение размера существующих денежных обязательств Клиента\n                    ']","Да, Банк может изменить Тарифный план по кредитной карте в одностороннем порядке, но при условии, что это не приведет к возникновению новых или увеличению уже существующих денежных обязательств клиента ","Да, Банк может изменить Тарифный план по кредитной карте. Для этого необходимо согласие Клиента, которое может быть получено устно с использованием Дистанционного обслуживания, письменно или молчаливо (например, совершение расходной операции с использованием кредитной карты). При этом изменения должны быть в рамках законодательства Российской Федерации и не должны повлечь за собой увеличение денежных обязательств Клиента. Банк также обязан уведомить Клиента о любых изменениях не позднее дня вступления изменений в силу через Дистанционное обслуживание."
Можно ли внести частичное досрочное погашение кредита? И как это повлияет на остаток задолженности?,"['«Клиент имеет право досрочно погасить Задолженность с уплатой Банку суммы непогашенного Кредита и начисленных процентов, а также (если применимо) комиссий и плат, предусмотренных Тарифным планом, в любой момент путем зачисления необходимой суммы денежных средств на Картсчет (Счет) и извещения Банка о необходимости проведения досрочного погашения. В случае частичного досрочного погашения уменьшается срок Кредита или сумма Регулярного платежа по выбору Клиента, при этом Клиент не освобождается от оплаты ближайшего Регулярного платежа, а также применимых комиссий и плат, предусмотренных Тарифным планом.», «При обращении Клиента в Банк для совершения частичного досрочного погашения до или в дату оплаты ближайшего Регулярного платежа Клиенту может быть предложено совершить частичное досрочное погашение с погашением ближайшего Регулярного платежа и последующим уменьшением срока Кредита или суммы Регулярного платежа по выбору Клиента.»']","Да, Клиент имеет право совершить частичное досрочное погашение кредита. При этом по выбору Клиента уменьшится либо срок кредита, либо сумма регулярного платежа. Однако Клиент не освобождается от оплаты ближайшего регулярного платежа и применимых комиссий.","Да, можно внести частичное досрочное погашение кредита. При этом уменьшается срок кредита или сумма регулярного платежа по выбору клиента. Клиент не освобождается от оплаты ближайшего регулярного платежа, а также применимых комиссий и плат, предусмотренных тарифным планом. При обращении клиента в банк для совершения частичного досрочного погашения до или в дату оплаты ближайшего регулярного платежа, ему может быть предложено совершить частичное досрочное погашение с погашением ближайшего регулярного платежа и последующим уменьшением срока кредита или суммы регулярного платежа по выбору клиента."
Что будет в случае просрочки платежа по кредиту? И какой штраф может быть начислен?,"['«В случае неоплаты платежа Клиент должен уплатить штраф за неоплату Минимального платежа согласно Тарифному плану. Банк рассматривает любой поступивший платеж Клиента как признание Клиентом данного штрафа в размере поступившего платежа, но не более суммы штрафа, определенного в соответствии с Тарифами.»']","В случае неоплаты минимального платежа по кредиту, Клиент должен уплатить штраф в соответствии с Тарифным планом. Размер штрафа определяется Тарифами, и любой поступивший от Клиента платеж Банк будет рассматривать как оплату штрафа в пределах установленной суммы.","При просрочке платежа по кредиту, банк Tinkoff может потребовать обращения взыскания на предмет залога в следующих случаях: 
- при просрочке очередного регулярного платежа более чем на 15 календарных дней;
- при неисполнении или ненадлежащем исполнении обязательств, предусмотренных кредитным договором;
- при наступлении угрозы наступления страхового случая, предусмотренного договором страхования недвижимости;
- при грубом нарушении правил использования предметом залога;
- в случае прекращения или ограничения права собственности на предмет залога по законодательству;
- если ипотека в пользу банка не была зарегистрирована по любой причине;
- в других случаях, предусмотренных законодательством Российской Федерации. 

Отдельно стоит отметить, что штрафы за неоплату платежа списываются с картсчета не позднее даты, следующей за датой поступления денежных средств на счет."
Можно ли на время приостановить выплаты по кредиту? И как это повлияет на начисление процентов?,"['«На основании обращения Клиента и по согласованию с Банком на период от 1 (одного) до 12 (двенадцати) месяцев возможно приостановление обязанности Клиента по погашению Задолженности, по оплате Регулярных платежей и/или иных платежей. В указанный период Банк вправе приостановить начисление процентов и иных сумм, предусмотренных Договором реструктуризации задолженности.»']","Да, на основании обращения Клиента и по согласованию с Банком возможно приостановить обязанность по погашению задолженности и оплате платежей на срок от 1 до 12 месяцев. В этот период Банк вправе также приостановить начисление процентов и иных сумм по кредиту.","Да, можно приостановить выплаты по кредиту на период от 1 до 12 месяцев согласовании с Банком. В указанный период Банк вправе приостановить начисление процентов и иных сумм, предусмотренных Кредитным договором. При этом оставшийся срок возврата Кредита продлевается на согласованный период приостановления обязанности Клиента по погашению Задолженности, по оплате Регулярных платежей и/или иных платежей."
Я хочу оформить дополнительную карту на супругу. Как это сделать? И будет ли она иметь доступ к общему лимиту по кредитке?,"['«3.2. По заявлению Клиента, переданному в Банк на бумажном носителе или через Дистанционное обслуживание, в рамках Договора кредитной карты Банком может быть выпущена одна или несколько дополнительных Кредитных карт.»', '«3.5. Клиент вправе установить лимит для проведения расходных операций с использованием Кредитной карты.»']","Вы можете оформить дополнительную кредитную карту на супругу, подав заявление в банк на бумажном носителе или через дистанционное обслуживание. Дополнительная карта будет иметь доступ к общему лимиту задолженности по вашей основной кредитной карте, однако вы можете установить отдельный лимит для расходных операций по дополнительной карте.","Для оформления дополнительной карты на супругу вам необходимо обратиться в банк Tinkoff и подать заявление на выпуск дополнительной Кредитной карты. При этом, согласно условиям банка, дополнительная карта может быть выпущена для использования Держателем, достигшим 18-летнего возраста. Держатель должен быть идентифицирован по сведениям и документам, предоставленным клиентом при подаче заявления. После получения дополнительной карты, супруга сможет использовать ее с установленным лимитом, который может быть установлен клиентом. Дополнительная карта на супругу не будет иметь доступ к общему лимиту по основной кредитной карте. Для более подробной информации и оформления дополнительной карты рекомендуется обратиться в отделение банка Tinkoff или воспользоваться дистанционными услугами банка."
"А что если я потеряю карту? Сколько у меня есть времени, чтобы ее заблокировать? И как вообще это делается? Через приложение или звонить надо?","['«6.1. При обнаружении утери, кражи или порчи Кредитной карты и/или возникновения подозрений, что Кредитная карта или ее реквизиты, а также ПИН-код, QR-код, Коды доступа, Аутентификационные данные, Абонентский номер, Абонентское устройство могли быть утрачены или похищены, а также в случае изъятия Кредитной карты в банкомате или торгово-сервисном предприятии и в случае изменения имени или фамилии Держателя Клиент должен незамедлительно уведомить Банк по телефонам 8 800 555-10-10 или +7 495 645-59-19 (круглосуточно) и заблокировать Кредитную карту и/или Интернет-Банк и/или Мобильный банк, а также подать заявление о досрочном перевыпуске Кредитной карты.»']","В случае утери или кражи кредитной карты, вы должны незамедлительно уведомить банк по телефонам горячей линии 8 800 555-10-10 или +7 495 645-59-19 (круглосуточно) и заблокировать карту. Также необходимо подать заявление на досрочный перевыпуск новой карты. Чем быстрее вы заблокируете карту, тем меньше риск несанкционированного использования.","Если вы потеряли карту банка Tinkoff, вам необходимо незамедлительно уведомить Банк по телефонам 8 800 555-25-50 или +7 495 645-59-19 (круглосуточно) и заблокировать карту. Это можно сделать как через звонок, так и через приложение Мобильного Банка. После блокировки карты, вам также следует подать заявление о досрочном перевыпуске карты."
"Прочитал тут у вас про блокировку карточки. А если я её забуду забрать в банкомате, что тогда делать?","['«6.1. [...] а также в случае изъятия Кредитной карты в банкомате или торгово-сервисном предприятии и в случае изменения имени или фамилии Держателя Клиент должен незамедлительно уведомить Банк по телефонам 8 800 555-10-10 или +7 495 645-59-19 (круглосуточно) и заблокировать Кредитную карту и/или Интернет-Банк и/или Мобильный банк, а также подать заявление о досрочном перевыпуске Кредитной карты.»']","Если вы забыли карту в банкомате, вам необходимо незамедлительно сообщить об этом в банк по телефонам горячей линии 8 800 555-10-10 или +7 495 645-59-19 и заблокировать кредитную карту, а также подать заявление на ее досрочный перевыпуск. Это позволит предотвратить возможное несанкционированное использование забытой карты третьими лицами.","Если Вы забыли забрать карту из банкомата, то Вам необходимо обратиться в банк посредством дистанционного обслуживания. Если карта была удержана банкоматом стороннего банка, то необходимо обратиться в банк, обслуживающий банкомат, и при наличии причин, таких как технический сбой или промедление с извлечением карты, карта может быть выдана при предъявлении документа, удостоверяющего личность. Некоторые сторонние банки могут потребовать письменный запрос из банка, выпустившего карту, для выдачи удержанной карты. Важно помнить, что сторонний банк вправе не возвращать карту, если она была заблокирована ранее или по другим причинам, указанным банком, выпустившим карту."
"А есть ли какие-то льготные условия, если я захочу приостановить выплаты по кредитке на какое-то время? Например, на ремонт или что-то в этом роде?","['«5.15. На основании обращения Клиента и по согласованию с Банком на период от 1 (одного) до 12 (двенадцати) месяцев возможно приостановление обязанности Клиента по погашению Задолженности, по оплате Минимальных платежей, Регулярных платежей и/или иных платежей. В указанный период Банк вправе приостановить начисление процентов и иных сумм, предусмотренных Договором кредитной карты.»']","Да, в документе указано, что по обращению клиента и по согласованию с банком возможно приостановление обязанности по погашению задолженности, выплате минимальных и регулярных платежей на срок от 1 до 12 месяцев. В этот период банк также может приостановить начисление процентов и других сумм по кредитной карте. Таким образом, вы можете получить льготный период для ремонта или других нужд, обратившись в банк с соответствующим заявлением.","Да, согласно документу ""Общие условия кредитования"" и ""Общие условия выпуска и обслуживания кредитных карт"" банка Tinkoff, при согласовании с Банком на период от 1 до 12 месяцев возможно приостановление обязанности Клиента по погашению Задолженности, по оплате Регулярных платежей и/или иных платежей. В указанный период Банк вправе приостановить начисление процентов и иных сумм, предусмотренных Кредитным договором. При этом оставшийся срок возврата Кредита продлевается на согласованный период приостановления обязанности Клиента по погашению Задолженности, по оплате Регулярных платежей и/или иных платежей."
Какие процедуры предусмотрены банком для обработки жалоб клиентов?,"['Банк имеет установленные процедуры для обработки и рассмотрения жалоб клиентов, включая регистрацию жалобы, ее анализ и предоставление ответа клиенту в установленные сроки.']","Банк следует четко установленным процедурам для обработки жалоб клиентов, которые включают регистрацию жалобы, ее тщательный анализ и предоставление ответа клиенту в соответствии с установленными сроками.","Банк Tinkoff предусматривает следующие процедуры для обработки жалоб клиентов:

1. Рассмотрение претензий Клиента по оспариванию операций в течение 30 (тридцати) дней по операциям, совершенным на территории РФ, и 60 (шестидесяти) дней по операциям, совершенным за пределами территории РФ, со дня получения письменного заявления Клиента и необходимых документов.

2. Отказ в рассмотрении претензии, если она предъявлена к совершенной операции после истечения одного дня с даты получения от Банка уведомления о ее совершении, или к комиссии после истечения 2 (двух) лет со дня ее начисления.

3. Блокирование действия Кредитной карты/Токена в различных ситуациях, таких как отказ Клиента от присоединения к общим условиям, неисполнение обязательств Держателем, подозрения на несанкционированное использование и другие случаи по усмотрению Банка.

Для более подробной информации рекомендуется обратиться в банк Tinkoff."
Что происходит с депозитами в случае смерти?,['В случае смерти клиента банк замораживает депозиты до решения вопросов наследства в соответствии с законодательством.'],"После смерти клиента банк замораживает все его депозиты и удерживает их до тех пор, пока не будут решены вопросы наследства в соответствии с действующим законодательством.","В случае смерти застрахованного лица в рамках Программы страхования заемщикам, предусмотренной в пользовательском соглашении банка Tinkoff, предоставляется страховая защита. Страховая сумма устанавливается в размере 100% от суммы выданного кредита застрахованному лицу. После производства страховой выплаты действие страхового покрытия по программе страхования в отношении конкретного застрахованного лица прекращается."
Могу я отказаться от получения уведомлений от банка и как это влияет на его обслуживание?,"['Клиенты имеют право отказаться от получения определенных типов уведомлений от банка, однако это может повлиять на их способность получать своевременную информацию о изменениях условий, сбоях в системе или других важных обновлениях.']","Клиенты могут отказаться от получения определенных типов уведомлений от банка, но это может привести к тому, что они не будут получать важные обновления и информацию своевременно, что может повлиять на их способность управлять своими счетами и услугами эффективно.","Да, вы можете отказаться от получения уведомлений от банка. Однако, это может повлиять на обслуживание, так как некоторые уведомления могут содержать важную информацию о вашем счете, операциях и изменениях в условиях обслуживания. Поэтому, рекомендуется внимательно оценить последствия отказа от уведомлений и, возможно, настроить их таким образом, чтобы получать только самую важную информацию. В случае дополнительных вопросов, рекомендуется обратиться в банк для получения консультации."
Как я могу увеличить лимит по своей кредитной карте?,"['Для увеличения кредитного лимита клиенты должны подать заявление через мобильное приложение или веб-сайт банка, после чего банк рассмотрит их кредитную историю и текущую финансовую ситуацию.']","Чтобы увеличить кредитный лимит, клиентам необходимо подать соответствующее заявление через мобильное приложение или веб-сайт банка. Банк затем оценит их кредитную историю и текущую финансовую ситуацию перед принятием решения.","Для увеличения лимита по кредитной карте вам необходимо обратиться в банк Tinkoff посредством Дистанционного обслуживания с требованием увеличить лимит. Банк может увеличить лимит кредитной линии по своему усмотрению, и вы имеете право запросить уменьшение лимита до предыдущего значения, если необходимо."
"Каковы условия отмены банковской операции, например, перевода средств или платежа?","['Клиенты могут отменить определенные банковские операции, если они не были еще обработаны банком. Условия отмены операций установлены в пользовательском соглашении и зависят от типа операции.']","Условия отмены банковской операции зависят от того, была ли операция уже обработана банком. Для операций, которые еще не обработаны, клиенты могут инициировать отмену, следуя процедурам, описанным в пользовательском соглашении и в зависимости от типа операции.","Для отмены банковской операции, например, перевода средств или платежа, банк Tinkoff имеет право отказаться от выполнения распоряжения Клиента о совершении операции в случаях, предусмотренных законодательством Российской Федерации. Также, банк может отказать в проведении операции, если совершение её ограничено по независящим от банка обстоятельствам, или если на момент операции отсутствует техническая возможность, или имеются основания подозревать доступ неуполномоченных третьих лиц к денежным средствам Клиента. Подобные случаи регулируются внутренними правилами банка Tinkoff и в соответствии с законодательством Российской Федерации."
Какие услуги доступны клиентам через Интернет-банк?,"['Через Интернет-банк клиенты могут управлять своими счетами, осуществлять платежи и переводы, а также получать детальную информацию о своих финансовых операциях.']","Интернет-банк предоставляет клиентам возможности управления их счетами, осуществления платежей и переводов, а также доступ к подробной информации о всех их финансовых операциях.","Клиенты могут воспользоваться услугами банка Tinkoff через Интернет-Банк, Мобильный Банк, Мобильные приложения банка и другие каналы обслуживания в Интернете для получения информации и совершения операций. Они также могут осуществлять различные операции через банкоматы, такие как пополнение и снятие наличных, платежи и переводы денежных средств, получение информации об остатке денежных средств на счете, обмен валюты и другие операции по усмотрению банка."
"Я не пользовалась кредиткой год, но у меня там лежат мои 800 рублей, я могу их как-то вернуть?","['""8. Расторжение Договора кредитной карты\n                8.1. Банк вправе в любой момент расторгнуть Договор кредитной карты в одностороннем порядке в случаях, предусмотренных \n                законодательством Российской Федерации, а также:\n                • в случае если Держатель не пользовался Кредитной картой более, чем 6 (шесть) месяцев при отсутствии \n                Задолженности по Договору кредитной карты;\n                В этих случаях Банк блокирует все Кредитные карты/Токены, выпущенные в рамках Договора кредитной карты. Договор \n                кредитной карты считается расторгнутым со дня формирования Банком Заключительного счета, который направляется \n                Клиенту. Если в момент расторжения Договора кредитной карты Задолженность Клиента перед Банком отсутствует, Банк \n                вправе расторгнуть Договор кредитной карты без направления Заключительного счета, информируя Клиента о своем \n                решении любым способом по усмотрению Банка.\n                8.5. В случае, если при расторжении Договора кредитной карты в Банке находятся денежные средства Клиента, излишне \n                перечисленные им при погашении Задолженности, Банк осуществляет возврат таких денежных средств по распоряжению \n                Клиента почтовым переводом или иным способом, указанном в распоряжении Клиента. При этом Банк вправе удержать \n                из суммы такого перевода комиссию за перевод денежных средств в размере, предусмотренном Тарифами на услуги \n                по переводам, платежам и дополнительные услуги с использованием каналов Дистанционного обслуживания.\n                8.6. В случае неполучения Банком распоряжения Клиента о переводе денежных средств в течение 120 (ста двадцати) дней \n                со дня обработки Банком последней операции Клиента/Держателя и, если остаток денежных средств не превышает \n                1000 руб., указанный остаток считается безвозмездно переданным Банку. \n                В случае неполучения Банком распоряжения Клиента о переводе денежных средств в течение 3 (трех) лет со дня обработки \n                Банком последней операции Клиента/Держателя указанные денежные средства считаются безвозмездно переданными \n                Банку.\n                ']","Согласно пунуту 8.6 - вы не можете вернуть ваши деньги, так как не дали распоряжение Банку о переводе денежных средств в течение 120 дней.","Да, вы можете вернуть свои 800 рублей из кредитки, если они остались на счете после погашения задолженности. Банк обязан вернуть вам излишне перечисленные денежные средства по вашему распоряжению, либо безвозмездно передать их обратно в случае неполучения вашего распоряжения в течение определенного срока. Вам следует обратиться в банк с запросом на возврат указанной суммы."
