question,contexts,ground_truth,answer
Можно ли не расписываться на карте?,"['После получения карты поставьте свою подпись в прямоугольнике, расположенном на оборотной стороне карты. При отсутствии подписи карта может быть не принята к оплате в торгово-сервисном предприятии, а также повышается риск использования карты злоумышленниками в случае ее утраты/кражи.']","При отсутствии подписи карта может быть не принята к оплате в торгово-сервисном предприятии, а также повышается риск использования карты злоумышленниками в случае ее утраты/кражи.","Да, при совершении операции оплаты покупки или услуги с использованием карты, обязательно нужно подписать квитанцию (слип) или чек. В случае если операция проводится с использованием электронного терминала, кассир может попросить вас самостоятельно вставить карту в терминал и ввести ПИН-код на выносной клавиатуре терминала. Операция по карте должна проводиться в вашем присутствии, и без вашей подписи карта может быть считаться недействительной, что может привести к отказу в обслуживании. Поэтому важно расписаться на карте при необходимости, чтобы подтвердить ваше участие в операции."
"Мой друг попросил меня дать свою карту для оплаты и потом вернуть, это не опасно?","['Никогда не принимайте рекомендации, советы, помощь от третьих лиц при пользовании картой, особенно при снятии наличных денежных средств в банкоматах. В случае возникновения затруднений при совершении операции обратитесь Банк посредством дистанционного обслуживания. Обращайте внимание на расположение банкоматов. Старайтесь не пользоваться банкоматами, расположенными в плохо освещенных и безлюдных местах', 'Не передавайте карту другим лицам, в т.ч. родственникам и знакомым для проведения транзакций. С целью исключения Ваших потерь от несанкционированного использования Вашей карты (копирования информации с Вашей карты для ее дальнейшего мошеннического использования): при совершении операции оплаты с использованием карты никогда не выпускайте Вашу карту из поля зрения и требуйте от обслуживающего Вас лица, чтобы все операции с использованием карты совершались в Вашем присутствии.']","Не передавайте карту другим лицам, в т.ч. родственникам и знакомым для проведения транзакций и никогда не принимайте рекомендации, советы, помощь от третьих лиц при пользовании картой, особенно при снятии наличных денежных средств в банкоматах.","Из предоставленного контекста следует, что передача карты другому лицу для оплаты может быть опасной, так как это может привести к несанкционированному использованию карты. В тексте указано, что не следует передавать карту другим лицам для проведения транзакций, чтобы исключить потери от возможного мошенничества. Также важно помнить, что при совершении операции оплаты с использованием карты необходимо не выпускать карту из поля зрения и требовать, чтобы все операции совершались в вашем присутствии. В случае возникновения затруднений при совершении операции, следует обращаться в Банк посредством дистанционного обслуживания. 

Следовательно, передавать свою карту другому лицу для оплаты и потом возвращать ее может быть опасно, так как это увеличивает риск несанкционированного использования карты. Рекомендуется избегать передачи карты другим лицам и совершать операции с использованием карты только при вашем присутствии, чтобы обеспечить безопасность и избежать возможных проблем."
Безопасно ли хранить пинкод в заметках в телефоне?,"['Категорически запрещается записывать ПИН-код на карте. Постарайтесь не записывать ПИН-код, запомните его. Если же Вы предпочитаете записать свой ПИН-код, никогда не указывайте, что это ПИН-код и не храните документ с записанным ПИН-кодом рядом с картой.']","Да, однако не указывайте в названии заметки, что это ПИН-код от Вашей карты.","Хранение пин-кода в заметках в телефоне не является безопасным действием. Согласно рекомендациям безопасности банка Tinkoff, необходимо обеспечить конфиденциальность пин-кода и не передавать его третьим лицам. При вводе пин-кода следует избегать наблюдения со стороны посторонних, также рекомендуется прикрывать клавиатуру банкомата при вводе пин-кода. Необходимо помнить, что никогда не следует сообщать свой пин-код по телефону, в электронных сообщениях или другим лицам, даже если они представляются сотрудниками банка. В случае утери пин-кода, следует обратиться в банк для получения помощи. В целях обеспечения безопасности операций с картой и конфиденциальности пин-кода, не рекомендуется хранить его в заметках на телефоне."
Я потеряла карту,"[' Вы потеряли карту или ее украли\nПрежде всего, как можно быстрее, сообщите о случившемся в Банк посредством дистанционного обслуживания \nи заблокируйте карту. Заблокировать карту можно по телефону, в интернет-банке или в мобильном приложении Банка. \nЧем раньше Вы это сделаете, тем меньше вероятность несанкционированного использования карты злоумышленниками. \nРазблокировать карту нельзя — можно только перевыпустить. Если вы не уверены, что карту украли, не спешите ее \nблокировать, установите лимит «0» на операции и запретите покупки через Интернет, если карта будет найдена лимиты \nможно изменить.\nНапоминаем Вам, что в соответствии с Общими условиями выпуска и обслуживания кредитных карт и Общими \nусловиями открытия, ведения и закрытия счетов физических лиц, а также выпуска и обслуживания расчетных карт Ваша \nответственность за дальнейшее использование карты прекращается, после осуществления блокировки, если не станет \nизвестно, что незаконное использование карты имело место с Вашего согласия.\nЕсли карта была у Вас украдена на территории РФ, после блокировки карты заявите о случившемся в полицию. При краже \nкарты за границей, заявите в полицию или в консульский отдел посольства Российской Федерации в стране, на территории \nкоторой произошла кража. Пожалуйста, сохраняйте копию протокола (квитанцию о заявлении) для последующего \nпредъявления в Банк.']","Если вы не уверены, что карту украли, не спешите ее блокировать, установите лимит «0» на операции и запретите покупки через Интернет, если карта будет найдена лимиты можно изменить. В случае, если вы полагаете, что Вашу карту всё-таки украли, то как можно быстрее, сообщите о случившемся в Банк посредством дистанционного обслуживания и заблокируйте карту. Это возможно сделать по телефону, в интернет-банке или в мобильном приложении Банка.","Если вы потеряли карту, важно немедленно заблокировать ее. Для этого вам необходимо потребовать составления акта об изъятии с указанием даты, времени и причины изъятия, а также подписью сотрудника предприятия/банка, изъявшего карту. После этого срочно проинформируйте об изъятии Банк посредством дистанционного обслуживания. Также необходимо убедиться, что данные вашей карты не стали известны третьим лицам, чтобы предотвратить возможные несанкционированные операции. Помните, что в случае утери карты важно обратиться в Банк для получения дальнейших инструкций и действий по восстановлению доступа к вашим средствам."
"Почему при использовании карты важно не расписываться на квитанциях/чеках до того, как вы проверите правильность указанной суммы?","['Проверяйте правильность суммы, указанной на платежном чеке. Поставив подпись на платежном чеке, Вы соглашаетесь со списанием указанной на нем суммы с Вашего карточного счета.']","Важно проверять правильность суммы перед подписанием квитанции/чека, потому что после подписи вы соглашаетесь с этой суммой, и она будет списана с вашего счета.","При использовании карты очень важно не расписываться на квитанциях или чеках до того, как вы проверите правильность указанной суммы. В случае совершения операции оплаты покупки или услуги с использованием карты, вы обязаны подписать квитанцию или чек, который представляет собой оттиск реквизитов карты. Ваша подпись подтверждает факт совершения операции, поэтому перед тем, как поставить свою подпись, необходимо тщательно проверить правильность информации на квитанции или чеке. В случае ошибок или расхождений между указанной суммой и фактической стоимостью покупки, следует отказаться от подписи и потребовать исправления. Никогда не подписывайте квитанцию или чек, если на них не указана сумма покупки или услуги. В случае возникновения сомнений или вопросов, рекомендуется обратиться к кассиру или персоналу магазина для уточнения информации. Помните, что ваша безопасность и правильность совершаемых операций имеют высокий приоритет, поэтому будьте внимательны и бдительны при использовании банковской карты."
"Что делать, если я потеряла телефон, на котором было установлено мобильное приложение банка?","['При утрате Мобильного телефона, используемого с абонентским номером подвижной радиотелефонной связи, на который установлено Мобильное приложение Банка, Вам следует срочно обратиться к своему оператору сотовой связи для блокировки SIM-карты и в Банк посредством дистанционного обслуживания для блокировки доступа в мобильное приложение Банка и удаления данных карты с Мобильного телефона.']","Если вы потеряли телефон с установленным мобильным приложением банка, необходимо:

Срочно обратиться к оператору сотовой связи для блокировки SIM-карты.
Обратиться в банк через дистанционное обслуживание для блокировки доступа в мобильное приложение и удаления данных карты с телефона.","При утрате мобильного телефона, на котором установлено мобильное приложение банка Tinkoff, следует принять несколько действий. В первую очередь, необходимо обратиться к оператору сотовой связи для блокировки SIM-карты, чтобы предотвратить возможное недобросовестное использование телефона и данных. Далее, важно связаться с банком Tinkoff через дистанционное обслуживание для блокировки доступа в мобильное приложение банка и удаления данных карты с утерянного телефона. При этом необходимо быть готовым предоставить необходимую информацию для идентификации клиента и безопасности данных. В случае утери телефона со встроенным приложением банка, следует следовать рекомендациям банка по безопасности и контролю операций по карте, а также обратиться в банк для получения дальнейших инструкций и поддержки в данной ситуации."
Можно ли использовать интернет-кафе и другие общедоступные места для совершения операций по карте в интернете? Объясните причину.,"['Избегайте осуществления Интернет-операций с использованием карты в местах, где услуги Интернет являются общедоступными, например, в Интернет-кафе.']","Нет, не рекомендуется использовать интернет-кафе и другие общедоступные места для совершения операций по карте в интернете. Причина в том, что такие общедоступные сети являются менее безопасными, и есть риск перехвата данных карты злоумышленниками.","Да, можно использовать интернет-кафе и другие общедоступные места для совершения операций по карте в интернете, но следует быть осторожным. Важно избегать осуществления Интернет-операций с использованием карты в местах, где услуги Интернет являются общедоступными, например, в интернет-кафе. Безопасность операций важна, поэтому старайтесь пользоваться проверенными интернет-магазинами, в которых вы уверены. При оплате покупок в сети Интернет вас попросят ввести трехзначный код безопасности CVC2/CVV2 для повышения безопасности операций. Не сообщайте реквизиты вашей банковской карты (номер карты, срок действия, трехзначный код безопасности, ПИН-код) никому, за исключением использования автоматизированных систем MOTO и систем интернет-коммерции. Всегда следите за безопасностью и конфиденциальностью ваших данных при совершении операций в интернете."
"Что делать, если я получил SMS-оповещение о операции по карте, которую я не совершал?","['Если Вы уверены, что операция не могла быть совершена Вами, то как можно быстрее сообщите об этом в Банк посредством дистанционного обслуживания и заблокируйте карту.']","Если вы получили SMS-оповещение о операции, которую не совершали, нужно как можно быстрее сообщить об этом в банк через дистанционное обслуживание и заблокировать карту.","Если вы получили SMS-оповещение о операции по карте, которую вы не совершали, то в первую очередь следует проверить наличие самой карты. Если у вас есть карта, то возможно, данные вашей карты стали известны третьим лицам. Помните, что SMS-сообщения могут иногда доставляться с задержкой, поэтому важно вспомнить, соответствует ли текст в SMS-сообщении операциям, которые вы совершили по карте за последнее время. Если вы уверены, что операция не могла быть совершена вами, то необходимо как можно быстрее сообщить об этом в Банк через дистанционное обслуживание и заблокировать карту. При получении SMS-сообщений о действиях, которые вы не совершали, немедленно обращайтесь в Банк. Также важно быть осторожными и не предоставлять свои персональные данные мошенникам, которые могут звонить от их имени. В случае подозрений в незаконной активации карты, следует обратиться в Банк по актуальным номерам телефонов, размещенным на сайте Банка. Если у вас возникли претензии по списаниям, отраженным в выписке по карточному счету, то вам необходимо обратиться в Банк посредством дистанционного обслуживания и предъявить претензию по оспариваемым операциям, оформив заявление на отказ от операций и предоставив необходимые документы."
Как обезопасить себя от съема данных карты в банкомате злоумышленниками? Приведи два способа.,"['Поэтому, при пользовании банкоматом не ленитесь внимательно осмотреть его и убедиться в отсутствии каких-либо «накладок» и посторонних устройств.', 'Пожалуйста, примите все меры, чтобы вводимый Вами ПИН-код был не заметен для окружающих.']","Чтобы обезопасить себя от съема данных карты в банкомате:

Внимательно осматривайте банкомат перед использованием на наличие подозрительных накладок и посторонних устройств.
Прикрывайте рукой клавиатуру при вводе ПИН-кода, чтобы его не могли увидеть окружающие.","Для обезопасить себя от съема данных карты в банкомате злоумышленниками, следует соблюдать следующие меры безопасности:

1. Не передавайте карту другим лицам для проведения транзакций, чтобы исключить возможность несанкционированного использования карты.
2. При совершении операции оплаты с использованием карты никогда не выпускайте карту из поля зрения, требуйте, чтобы все операции с картой совершались в вашем присутствии.

Также рекомендуется при вводе ПИН-кода прикрывать клавиатуру банкомата рукой, чтобы исключить возможность компрометации ПИН-кода при помощи видеокамер, установленных мошенниками. 

Если вы заметили что-либо подозрительное на банкомате, откажитесь от его использования. Не сообщайте свой ПИН-код при совершении операций через сайты интернета, по телефону или по электронной почте. Операции в сети интернет следует проводить в защищенном режиме с использованием одноразовых паролей.

Если возникли какие-либо вопросы или ситуации, связанные с безопасностью использования карты, рекомендуется обращаться в Банк посредством дистанционного обслуживания для получения дополнительной информации и поддержки."
"Правда ли, что при бронировании гостиницы по карте мне необходимо сообщить все реквизиты карты, включая ПИН-код? Если нет, то что именно требуется сообщить?","['При бронировании номера в гостинице по карте Вас попросят сообщить свое имя, номер карты, срок ее действия (иногда, дополнительно — трехзначный код безопасности, напечатанный на обратной стороне карты на полосе для подписи) и срок Вашего пребывания.']","Нет, неправда. При бронировании гостиницы по карте не требуется сообщать ПИН-код. Обычно для бронирования запрашивают ваше имя, номер карты, срок ее действия, иногда трехзначный код безопасности (CVV/CVC) с оборотной стороны карты и планируемый срок пребывания.","Для бронирования номера в гостинице по карте необходимо сообщить следующие реквизиты: ваше имя, номер карты, срок ее действия, и иногда трехзначный код безопасности, который находится на обратной стороне карты на полосе для подписи. При этом, ПИН-код карты не требуется сообщать при бронировании номера в гостинице. В случае изменения планов, важно отменить бронирование в соответствии с правилами отмены, чтобы избежать списания средств с вашей карты. Если возникнут дополнительные вопросы или необходима более подробная информация, рекомендуется обратиться в банк Tinkoff для консультации."
"Если я из другой страны и у меня нет паспорта РФ, что мне делать?","['\n                     1. Документы и сведения, получаемые в целях идентификации Клиентов-физических лиц, а также в целях обслуживания таких Клиентов в рамках Универсального договора\n                     1.4. Реквизиты документа, удостоверяющего личность: серия (при наличии) и номер документа, дата выдачи документа, наименование органа, выдавшего документ (при наличии кода подразделения может не устанавливаться), и код подразделения (при наличии).\n                     1.4.2.для иностранных граждан:\n                     •паспорт иностранного гражданина;\n                     •дипломатический паспорт, служебный паспорт, удостоверяющие личность иностранного гражданина.', '.5.Документ, подтверждающий право иностранного гражданина или лица без гражданства на пребывание (проживание) в Российской Федерации (миграционной карты в случае отсутствия иных документов), в случае если наличие таких документов обязательно в соответствии с международными договорами Российской Федерации и законодательством Российской Федерации;Документами, подтверждающими право иностранного гражданина или лица без гражданства на пребывание (проживание) в РФ, являются:\n                    •миграционная карта в случае отсутствия иных документов;\n                    •вид на жительство;\n                    •разрешение на временное проживание;\n                    •виза;\n                    •иной документ, подтверждающий в соответствии с международными договорами Российской Федерации и законодательством РФ право иностранного гражданина или лица без гражданства на пребывание (проживание) в РФ.\n']","
                        Если вы из другой страны, то для заключения договора вам неообходимы документы, удостоверяющие Вашу личность. Для иностранных граждан это:
                            •паспорт иностранного гражданина;
                            •дипломатический паспорт, служебный паспорт, удостоверяющие личность иностранного гражданина.
                        Также необходимы документы, подтверждающие право иностранного гражданина (проживание) в Российской Федерации (миграционной карты в случае отсутствия иных документов), в случае если наличие таких документов обязательно в соответствии с международными договорами Российской Федерации и законодательством Российской Федерации;Документами, подтверждающими право иностранного гражданина или лица без гражданства на пребывание (проживание) в РФ, являются:
                            •миграционная карта в случае отсутствия иных документов;
                            •вид на жительство;
                            •разрешение на временное проживание;
                            •виза;
                            •иной документ, подтверждающий в соответствии с международными договорами Российской Федерации и законодательством РФ право иностранного гражданина или лица без гражданства на пребывание (проживание) в РФ. ","Если вы находитесь в другой стране и у вас нет паспорта РФ, вам необходимо сообщить об этом в банк посредством дистанционного обслуживания и оформить претензию. Сотрудник банка поможет вам в этом процессе. Пожалуйста, обратитесь в банк для получения более подробной информации и инструкций по дальнейшим действиям."
В течении скольких дней действительна выписка из ЕГРЮЛ?,"['\n                    2.2. Выписка из Единого государственного реестра юридических лиц (ЕГРЮЛ). Банком может быть принята копия \n                    выписки, заверенная регистрирующим органом. Выписка считается действительной для предоставления в Банк \n                    в течение 30 (тридцати) календарных дней с даты ее выдачи и должна содержать актуальные сведения на дату  \n                    ее предоставления;']",Выписка из Единого государственного реестра юридических лиц (ЕГРЮЛ) действительна в течении 30 дней с даты ее выдачи.,Ответ: Выписка из ЕГРЮЛ считается действительной для предоставления в банк Tinkoff в течение 30 (тридцати) календарных дней с даты ее выдачи.
Нужно ли ИП указывать свой сайт для предприятия?,"['\n                    3. Документы и сведения, предоставляемые Клиентом-индивидуальным предпринимателем: \n                    3.5. Сведения о доменном имени, указателе страницы сайта в сети «Интернет», с использованием которых Клиентом \nоказываются услуги (при наличии);\n                    ']","Да, индивидуальному предпринимателю необходимо указать сведения о доменном имени, указателе страницы сайта в сети «Интернет».","Для юридических лиц и ИП, осуществляющих деятельность через сайт в сети ""Интернет"", требуется предоставить информацию о доменном имени и указателе страницы сайта. Поэтому, если ИП использует свой сайт для предприятия, то в соответствии с перечнем документов и сведений, необходимо предоставить информацию о доменном имени и указателе страницы сайта в сети ""Интернет"". Таким образом, для открытия банковского счета в банке Tinkoff важно указать информацию о сайте предприятия, если он используется в рамках деятельности."
Может ли Банк запросить дополнительные документы - не из списка обязательных?,"['\n                     26. Банк может запросить у Клиента, а Клиент обязуется предоставить по запросу Банка дополнительные документы \n                    и сведения, как предусмотренные, так и не предусмотренные настоящим Перечнем, в том числе в целях надлежащей \n                    идентификации Клиента, его представителя, выгодоприобретателя и бенефициарного владельца в соответствии \n                    с требованиями действующего законодательства Российской Федерации, нормативных актов Банка России, а также \n                    требованиями Банка. Банк вправе не запрашивать отдельные документы и сведения, предусмотренные настоящим \n                    Перечнем, в случаях, установленных внутренними правилами Банка.']","Да, Банк может запросить у Вас дополнительные не предусмотренные Перечнем документы.","Да, Банк имеет право запросить у Клиента дополнительные документы и сведения, как предусмотренные, так и не предусмотренные обязательным списком. Это может быть необходимо для надлежащей идентификации Клиента, его представителя, выгодоприобретателя и бенефициарного владельца в соответствии с законодательством и требованиями Банка. Банк вправе не запрашивать отдельные документы, предусмотренные обязательным списком, в случаях, установленных внутренними правилами Банка. Если у Клиента нет возможности предоставить определенный документ, то представление письма с пояснениями о причинах невозможности его предоставления может быть рассмотрено. В случае обоснованного отсутствия документов, Клиент может предоставить альтернативные источники информации для подтверждения своей деловой репутации."
Какие документы нужно предоставить физическому лицу для открытия счета?,"['1. Документы и сведения, получаемые в целях идентификации Клиентов-физических лиц, а также в целях обслуживания таких Клиентов в рамках Универсального договора']","Физическому лицу для открытия счета необходимо предоставить документ, удостоверяющий личность (паспорт или иной документ из списка в п.1.4), документ, подтверждающий регистрацию или место пребывания, ИНН, СНИЛС и контактную информацию.","Для открытия счета в банке Tinkoff физическому лицу необходимо предоставить следующие документы и сведения:

1. Сведения и документы, зависящие от организационно-правовой формы физического лица, включая информацию о договорах с банковскими агентами, платежными агентами и другими организациями.
2. Документы и сведения, предоставляемые для открытия номинального счета, включая документы-основания участия бенефициара.
3. Идентификационные документы, такие как удостоверение личности, в случае иностранных граждан - документы, подтверждающие право на пребывание в Российской Федерации.
4. Дополнительные документы и сведения, если физическое лицо занимается частной практикой и является иностранным гражданином.
5. Документы, указанные в перечне для открытия специального банковского счета, с учетом требований законодательства РФ.

Если у вас остались дополнительные вопросы или нужна более подробная информация, рекомендуем обратиться в банк Tinkoff для получения конкретных инструкций и требований."
Какие документы необходимо предоставить юридическому лицу для открытия счета в Банке? Можно ли предоставить сканы документов или нужны оригиналы?,"['2.1. Учредительные документы юридического лица...', '2.2. Выписка из Единого государственного реестра юридических лиц (ЕГРЮЛ)...', '2.3. Документ об избрании единоличного исполнительного органа юридического лица...']","Юридическому лицу необходимо предоставить учредительные документы, выписку из ЕГРЮЛ, документ об избрании руководителя, документы, подтверждающие личность руководителя и лиц, имеющих право подписи. Документы можно предоставить в копиях, заверенных нотариально, регистрирующим органом, руководителем или сотрудником Банка при наличии оригиналов.","Для юридического лица необходимо предоставить следующие документы для открытия счета в банке Tinkoff:
1. Учредительные документы юридического лица: Устав юридического лица и/или Учредительный договор (в зависимости от организационно-правовой формы юридического лица). Эти документы могут быть предоставлены в виде последней актуальной редакции или действующей редакции с листами изменений, зарегистрированными уполномоченным органом.
2. Сведения о договорах о привлечении банковского платежного агента (банковского платежного субагента), о договорах об осуществлении деятельности по приему платежей физических лиц.
3. Документы-основания участия бенефициара или бенефициаров в отношениях по договору номинального счета.
4. Идентификационные документы бенефициарного(ых) владельца(ев), такие как документы, удостоверяющие личность.
5. Адрес места жительства (регистрации) или места пребывания.
6. Информация о контактных данных, включая номер телефона, адрес электронной почты и т.д.

Относительно предоставления сканов документов или оригиналов, рекомендуется уточнить у банка Tinkoff, так как требования могут различаться в зависимости от конкретных обстоятельств и политики банка."
Можно ли открыть счет индивидуальному предпринимателю – иностранному гражданину? Какие документы для этого нужны?,"['3.1. Идентификация индивидуального предпринимателя осуществляется на основании документов и сведений, указанных в пункте 1.4 настоящего Перечня', '3.2. Документ, подтверждающий право иностранного гражданина или лица без гражданства на пребывание (проживание) в Российской Федерации...']","Да, индивидуальному предпринимателю-иностранному гражданину можно открыть счет. Для этого нужно предоставить документ, удостоверяющий личность, документ, подтверждающий право пребывания/проживания в РФ (напр. миграционную карту), ИНН, СНИЛС, выписку из ЕГРИП и контактную информацию.","Для открытия счета индивидуальному предпринимателю – иностранному гражданину необходимо предоставить определенные документы и сведения. В случае, если физическое лицо, являющееся иностранным гражданином, занимается частной практикой, оно должно дополнительно предоставить миграционную карту и/или документ, подтверждающий право иностранного гражданина на пребывание в Российской Федерации. Также необходимо учитывать требования законодательства РФ и предоставлять сведения и документы в зависимости от организационно-правовой формы.

В целом, для открытия счета индивидуальному предпринимателю – иностранному гражданину потребуется предоставить документы, подтверждающие личность, право пребывания в стране, учредительные документы (если применимо), а также другие документы, указанные в соответствующих разделах перечня документов и сведений. Важно учитывать все требования и следовать инструкциям банка Tinkoff для успешного открытия счета. Если у вас возникнут дополнительные вопросы или требуется более подробная информация, рекомендуется обратиться в банк для консультации."
"Какие документы потребуются, если открывать счет для нотариуса, занимающегося частной практикой? Может ли нотариус быть иностранцем при этом?","['5.1. Документ, удостоверяющий личность и указанный в пункте 1.4 настоящего Перечня', '5.2. Документ, подтверждающий наделение нотариуса полномочиями (назначение на должность), выдаваемый органами юстиции субъектов Российской Федерации, в соответствии с законодательством Российской Федерации']","Для открытия счета нотариусу, занимающемуся частной практикой, требуется предоставить документ, удостоверяющий личность, документ о назначении на должность нотариуса от органов юстиции, регистрационные документы, финансовые документы и контактные данные. Нотариус может быть иностранцем, в этом случае дополнительно потребуется документ, подтверждающий право на пребывание/проживание в РФ.","Для открытия счета для нотариуса, занимающегося частной практикой, потребуются следующие документы:
1. Документ, удостоверяющий личность нотариуса.
2. Документ, подтверждающий наделение нотариуса полномочиями, выдаваемый органами юстиции.
3. Адрес места жительства или места пребывания нотариуса.
4. Контактная информация (номер телефона, факс, адрес электронной почты).
5. Выписка из ЕГРИП.
6. Информация о страховом номере индивидуального лицевого счета застрахованного лица (при необходимости).
7. Сведения о целях установления и предполагаемом характере деловых отношений с банком.
8. Сведения о деловой репутации.

Если нотариус является иностранным гражданином, ему также необходимо предоставить:
1. Миграционную карту.
2. Документ, подтверждающий право иностранного гражданина или лица без гражданства на пребывание в Российской Федерации.

Таким образом, нотариус может быть иностранцем при открытии счета, при условии предоставления всех необходимых документов, как указано выше. Если у нотариуса есть документы, подтверждающие его право на пребывание в России, он может открыть счет в банке Tinkoff."
"Как узнать, кто является бенефициарным владельцем юридического лица? Какие документы для этого нужны?",['12. Идентификация бенефициарного(ых) владельца(ев) осуществляется на основании следующий документов и сведений...'],"Для идентификации бенефициарного владельца юридического лица необходимо предоставить документы, удостоверяющие личность бенефициара, документ о регистрации/пребывании в РФ (если бенефициар - иностранец), ИНН, адрес регистрации и контактные данные. Также можно заполнить анкету бенефициарного владельца по форме Банка.","Для того чтобы узнать, кто является бенефициарным владельцем юридического лица, необходимо предоставить следующие документы и сведения:

1. Документы, удостоверяющие личность бенефициарного владельца, включая документы, указанные в соответствующем перечне.
2. В случае если бенефициарный владелец является иностранным гражданином или лицом без гражданства, необходим документ, подтверждающий право на пребывание в Российской Федерации.
3. Анкета физического лица — бенефициарного владельца по форме Банка, подписанная Клиентом.
4. Дополнительные документы и сведения, которые могут быть запрошены Банком для идентификации бенефициарного владельца.

Если у вас возникли дополнительные вопросы или вам нужна более подробная информация, рекомендую обратиться в банк Tinkoff для консультации специалиста по данному вопросу."
Расскажи про термины 'Договор страхования' и 'КАСКО',"['1. Термины и определения     \n                    Договор страхования — договор, по которому одна сторона (Страховщик) обязуется за обусловленную договором \n                    плату (страховую премию) при наступлении предусмотренного в договоре события (страхового случая) осуществить \n                    другой стороне (страхователю) или иному лицу, в пользу которого заключен договор (выгодоприобретателю), \n                    страховое возмещение в пределах определенной договором суммы (страховой суммы).', 'КАСКО — комбинированное страхование транспортных средств и сопутствующих рисков.']"," Да, конечно! Договор страхования — это договор, по которому одна сторона (Страховщик) обязуется за обусловленную договором 
                    плату (страховую премию) при наступлении предусмотренного в договоре события (страхового случая) осуществить 
                    другой стороне (страхователю) или иному лицу, в пользу которого заключен договор (выгодоприобретателю), 
                    страховое возмещение в пределах определенной договором суммы (страховой суммы). 
                    КАСКО — это комбинированное страхование транспортных средств и сопутствующих рисков.","Договор страхования - это договор, по которому одна сторона (Страховщик) обязуется за обусловленную договором плату (страховую премию) при наступлении предусмотренного в договоре события (страхового случая) осуществить другой стороне (страхователю) или иному лицу, в пользу которого заключен договор (выгодоприобретателю), страховое возмещение в пределах определенной договором суммы (страховой суммы).

КАСК (комбинированное страхование транспортных средств и сопутствующих рисков) - это вид страхования, который предоставляет защиту от различных рисков, связанных с владением и использованием транспортного средства, включая повреждения, угоны и другие непредвиденные ситуации.

Таким образом, договор страхования является основным документом, определяющим права и обязанности сторон при страховании, а КАСК представляет собой конкретный вид страхования, охватывающий различные риски, связанные с транспортными средствами."
"Какой минимум страховой выплаты мне вернут, если моя страховая сумма = 50 000 долларов?"," 
                    2.19.   При добровольном страховании непредвиденных расходов путешественников страховая сумма в договоре 
                    страхования может быть установлена в рублях или иностранной валюте в рублевом эквиваленте по официальному 
                    курсу иностранных валют ЦБ РФ на дату заключения Договора страхования, но не менее чем 66,7 руб. за 1 у.е.  при 
                    страховой сумме 30 000 у.е., 57,2 руб. за 1 у.е. при страховой сумме 35 000 у.е., 50 руб. за 1 у.е. при страховой сумме 
                    50 000 у.е., 26,7 руб. за 1 у.е. при страховой сумме 75 000 у.е."," 
                    Минимальная страховая выплата, которую вам вернут, если ваша страховая сумма составляет 50 000 долларов, составляет 50 рублей за 1 доллар США. Минимальная выплата составит 2 500 000 рублей.
                    Обратите внимание, что это минимальная выплата, которую вы получите. Фактическая сумма выплаты может варьироваться в зависимости от условий вашего договора.
        ",Из предоставленного контекста я не могу точно определить минимум страховой выплаты по вашему вопросу. Рекомендую обратиться в банк Tinkoff для получения более точной информации о страховых выплатах и условиях договора страхования.
"При принятии пользовательских соглашений, кому еще попадают мои данные?","['\n                    5. Персональные данные     \n                        5.1.       Пользователь подтверждает, что с использованием Дистанционных каналов взаимодействия дает Страховщику, \n                        аффилированным лицам страховщика, Страховому агенту или Страховому брокеру, а также лицам, \n                        предоставляющим услуги по использованию их информационных возможностей для целей заключения договоров \n                        страхования, хранения документов, в том числе, облачных сервисов, серверов, программных продуктов, согласие на \n                        обработку его персональных данных с целью осуществления дистанционного взаимодействия с последними при \n                        использовании их Сайта и/или сайтов в сети Интернет или при помощи ПО Страховщика и в целях осуществления \n                        маркетинговых коммуникаций перечисленных лиц с Пользователем.  \n        ']","
                    Согласно пункту 5.1 пользовательского соглашения, ваши персональные данные могут быть переданы следующим сторонам:
                        • Аффилированные лица страховщика
                        • Страховой агент
                        • Страховой брокер
                        • Лица, предоставляющие услуги по использованию их информационных возможностей для целей заключения договоров страхования, хранения документов, в том числе облачных сервисов, серверов, программных продуктов
","При принятии пользовательских соглашений, ваши данные могут попасть к следующим лицам:
1. Страховщику, аффилированным лицам страховщика, Страховому агенту или Страховому брокеру.
2. Лицам, предоставляющим услуги по использованию их информационных возможностей для целей заключения договоров страхования, хранения документов, в том числе, облачных сервисов, серверов, программных продуктов.
3. Лицам, осуществляющим маркетинговые коммуникации с вами.

Вы даете согласие на обработку ваших персональных данных указанными лицами сроком на 15 лет. В случае отзыва согласия, обработка ваших данных должна быть прекращена и данные уничтожены в течение 1 года с момента отзыва согласия и прекращения отношений с АО «Тинькофф Страхование».

Если у вас остались дополнительные вопросы или нужна более подробная информация, рекомендую обратиться в банк Tinkoff для получения консультации специалиста."
Зачем страховщик ведет аудио и видеозапись при взаимодействии с клиентом? Как долго эти записи хранятся?,"['При заключении Договоров страхования, а также при ином обращении Клиента или Пользователя к Страховщику или его представителям Страховщик вправе осуществлять наблюдение, фотографирование, аудио- и видеозапись, включая запись телефонных разговоров, а также копирование и хранение переписок между Пользователем и Страховщиком (его представителями) по электронной почте или в мессенджерах, без дополнительного уведомления Клиента (Пользователя) о такой записи. Клиент соглашается, что Страховщик вправе хранить такие записи в течение 5 (пяти) лет с момента прекращения отношений с Клиентом (Пользователем), с целью улучшения качества обслуживания, исполнения Договора страхования, а также использовать их при проведении любых расследований в связи с Договором страхования.']","Страховщик ведет аудио, видеозапись, фотографирование, копирует переписку с клиентом без дополнительного уведомления с целью улучшения качества обслуживания, исполнения договора страхования, а также для использования этих записей при проведении расследований, связанных с договором. Такие записи страховщик вправе хранить в течение 5 лет с момента прекращения отношений с клиентом.","Страховщик ведет аудио и видеозапись при взаимодействии с клиентом с целью улучшения качества обслуживания, исполнения договора страхования и использования записей при проведении расследований в связи с договором страхования. Эти записи хранятся в течение 5 лет с момента прекращения отношений с клиентом."
В каких случаях застрахованному могут быть оплачены планируемые расходы по страховому случаю до предоставления подтверждающих документов? Какие ограничения есть по размеру таких выплат?,"['По договорам добровольного страхования непредвиденных расходов путешественников по предварительному согласованию со Страховщиком Застрахованному могут оплачиваться планируемые расходы по предусмотренным договором страхования страховым событиям, предусматривающим возмещение расходов на оказание Экстренной или Неотложной амбулаторной и/или стационарной помощи, с условием предоставления Застрахованным документов, подтверждающих такие расходы Страховщику непосредственно после их несения (чеки, платежные документы и пр.). В случае если в результате страхового случая Застрахованным лицом были понесены соответствующие расходы на оказание Экстренной или Неотложной амбулаторной и/или стационарной помощи, в том числе, предварительно согласованные Страховщиком, но не были предоставлены документы, подтверждающие их оплату, Страховщик возмещает расходы в размере не более 200 у.е. (если страховая сумма установлена в валюте, отличной от российского рубля) или 10 000 российских рублей (если страховая сумма установлена в российских рублях), за один страховой случай.']","По договорам добровольного страхования непредвиденных расходов путешественников застрахованному могут быть оплачены планируемые расходы по страховым случаям, предусматривающим возмещение расходов на экстренную/неотложную амбулаторную или стационарную помощь, по предварительному согласованию со страховщиком. Условие - предоставление подтверждающих документов сразу после несения расходов. Если документы не предоставлены, то страховщик возмещает расходы в размере не более 200 у.е. (если страховая сумма в валюте) или 10 000 рублей (если в рублях) за один случай.","Да, в соответствии с пользовательским соглашением банка Tinkoff, застрахованному могут быть оплачены планируемые расходы по страховому случаю до предоставления подтверждающих документов. Однако, есть ограничения по размеру таких выплат. Если в результате страхового случая застрахованным лицом были понесены расходы на оказание Экстренной или Неотложной амбулаторной и/или стационарной помощи, но не были предоставлены документы, подтверждающие оплату, страховщик возмещает расходы в размере не более 200 у.е. или 10 000 российских рублей за один страховой случай."
Куда пользователь может направить обращение при возникновении вопросов или спора со страховщиком?,"['При возникновении вопросов или спора можно отправить обращение:\n\nв АО «Тинькофф Страхование» по почте по адресу: 127287, Российская Федерация, г. Москва, ул. 2-я Хуторская, дом 38А, строение 26, либо путем заполнения соответствующей формы на сайте Страховщика;\nк финансовому уполномоченному путем регистрации обращения на сайте — finombudsman.ru или по почтовому адресу: 119017, г. Москва, Старомонетный пер., дом 3;\nво Всероссийский союз страховщиков на сайте — ins-union.ru, приложив к обращению необходимые документы и сведения, либо на почтовый адрес: 115093, г. Москва, ул. Люсиновская, д. 27, стр. 3;\nв Центральный Банк Российской Федерации (Банк России) через интернет-приемную на официальном сайте — cbr.ru, приложив к обращению необходимые документы и сведения, либо на почтовый адрес: 107016, г. Москва, ул. Неглинная, д. 12.']","При возникновении вопросов или спора с АО 'Тинькофф Страхование' пользователь может направить обращение:

 - В АО 'Тинькофф Страхование' по почте или через форму на сайте;
 - Финансовому уполномоченному на сайте finombudsman.ru или почтовым адресом;
 - Во Всероссийский союз страховщиков на сайте ins-union.ru или почтовым адресом;
В Центральный Банк РФ через интернет-приемную на сайте cbr.ru или почтовым адресом.","Пользователь может направить обращение при возникновении вопросов или спора со страховщиком в следующие места:

1. В АО «Тинькофф Страхование» по почте по адресу: 127287, Российская Федерация, г. Москва, ул. 2-я Хуторская, дом 38А, строение 26, либо путем заполнения соответствующей формы на сайте Страховщика.

2. К финансовому уполномоченному путем регистрации обращения на сайте — ﬁnombudsman.ru или по почтовому адресу: 119017, г. Москва, Старомонетный пер., дом 3.

3. Во Всероссийский союз страховщиков на сайте — ins-union.ru, приложив к обращению необходимые документы и сведения, либо на почтовый адрес: 115093, г. Москва, ул. Люсиновская, д. 27, стр. 3.

4. В Центральный Банк Российской Федерации (Банк России) через интернет-приемную на официальном сайте — cbr.ru, приложив к обращению необходимые документы и сведения, либо на почтовый адрес: 107016.

Эти места предоставляют пользователю возможность эффективно разрешить вопросы или споры со страховщиком."
Где можно ознакомиться с дополнительной информацией и документами о деятельности АО 'Тинькофф Страхование'?,"['Дополнительная информация и документы о деятельности Страховщика в соответствии с п. 6.1 Закона РФ от 27.11.1992 N 4015-1 «Об организации страхового дела в Российской Федерации» и п. 2.1.1. «Базового стандарта защиты прав и интересов физических и юридических лиц — получателей финансовых услуг, оказываемых членами саморегулируемых организаций, объединяющих страховые организации» размещены по ссылкам: tinkoffinsurance.ru/about, tinkoffinsurance.ru/about/documents.']",Дополнительная информация и документы о деятельности АО 'Тинькофф Страхование' в соответствии с законом 'Об организации страхового дела в РФ' и базовым стандартом защиты прав получателей финансовых услуг размещены на сайте страховщика по ссылкам tinkoffinsurance.ru/about и tinkoffinsurance.ru/about/documents.,"Вы можете ознакомиться с дополнительной информацией и документами о деятельности АО ""Тинькофф Страхование"" на их официальном сайте tinkoffinsurance.ru/about и tinkoffinsurance.ru/about/documents. Также вы можете обратиться в центральный офис компании по адресу: 127287, Российская Федерация, г. Москва, ул. 2-я Хуторская, дом 38А, строение 26. Если у вас возникнут дополнительные вопросы или споры, вы можете отправить обращение по почте на указанный адрес или заполнить соответствующую форму на сайте компании. Также возможно обратиться к финансовому уполномоченному, Всероссийскому союзу страховщиков или Центральному Банку Российской Федерации через интернет-приемную на их официальных сайтах или по почтовым адресам, указанным в документах."
Что означает 'Партия' и вообще 'Слиток' для драгоценных металлов?,"['\n                    Партия — приобретенные Клиентом Слитки в количестве, превышающем 1 (одну) штуку, и подлежащие доставке Клиенту, \n                    в рамках одной Заявки', ' Слиток — аффинированный драгоценный металл: золото, серебро, платина и палладий в виде слитков (стандартных, \n                    мерных), соответствующих установленным в Российской Федерации стандартам или международным стандартам качества, \n                    изготовленных и маркированных организацией, осуществляющей аффинаж драгоценного металла. Слиток в рамках \n                    предоставления Сервиса доставляется / принимается на хранение в ненарушенной Упаковке с приложением Сертификата-\n                    ярлыка (при наличии) и Сертификата качества слитка']","Давайте разберемся! 
                    Партия — это приобретенные клиентом слитки в количестве, превышающем 1 штуку, и подлежащие доставке клиенту, в рамках одной заявки.
                    Слиток — это аффинированный драгоценный металл: золото, серебро, платина и палладий в виде слитков (стандартных, 
                    мерных), соответствующих установленным в Российской Федерации стандартам или международным стандартам качества, 
                    изготовленных и маркированных организацией, осуществляющей аффинаж драгоценного металла. Слиток в рамках 
                    предоставления Сервиса доставляется / принимается на хранение в ненарушенной Упаковке с приложением Сертификата-
                    ярлыка (при наличии) и Сертификата качества слитка.
        ","Для ответа на ваш вопрос о том, что означает ""Партия"" и ""Слиток"" для драгоценных металлов, необходимо учитывать следующие части контекста:

1. Партия - это приобретенные клиентом слитки в количестве, превышающем 1 (одну) штуку, и подлежащие доставке клиенту в рамках одной заявки. Это означает, что партия представляет собой группу слитков, заказанных клиентом одновременно и требующих доставки.

2. Слиток - это аффинированный драгоценный металл в виде стандартных, мерных слитков, соответствующих установленным стандартам качества. Слиток представляет собой сам металлический блок, который может быть изготовлен и маркирован организацией, занимающейся аффинажем драгоценных металлов.

Исходя из этой информации, можно сделать вывод, что ""Партия"" обозначает группу слитков, а ""Слиток"" - это сам драгоценный металлический блок. ""Партия"" используется для обозначения количества слитков, превышающего одну штуку, которые одновременно приобретаются клиентом, в то время как ""Слиток"" является самим продуктом - драгоценным металлическим блоком.

Если у вас возникнут дополнительные вопросы или потребуется более подробная информация, рекомендуем обратиться в банк Tinkoff для получения консультации специалиста по данной теме."
Меня действительно должны фотографировать после полкчения слитка? Какой это пункт в соглашении?,"['\n                    2.13.12. После подтверждения получения Клиентом/Доверенным лицом Слитка Представитель фотографирует Клиента/\n                    Доверенное лицо с полученным Слитком в ненарушенной заводской упаковке и документом, удостоверяющим личность \n                    Клиента/Доверенного лица']","Да, Вас действительно должнен сфотографировать Представитель в соответсвии с пунктом 2.13.12.","Из предоставленного контекста не удалось найти конкретный пункт в пользовательском соглашении банка Tinkoff, который бы указывал на обязательность фотографирования клиента после получения слитка. В данном случае рекомендуется обратиться в банк Tinkoff для получения точной информации о данной процедуре и возможных положениях в пользовательском соглашении, касающихся фотографирования клиентов после получения слитка."
Какие условия хранения?,"[' \n                    2.14.9. Условия хранения: температура воздуха от +17 до +25 °С, атмосферное давление от 740 до 760 мм рт. ст., относительная \n                    влажность воздуха от 30 до 60%']","
                    В соответсвии с пунктом 2.14.9. условия хранения слитка слудующие: 
                        - температура воздуха от +17 до +25 °С,
                        - атмосферное давление от 740 до 760 мм рт. ст.,
                        - относительная влажность воздуха от 30 до 60% ","Для ответа на вопрос о условиях хранения слитков драгоценных металлов в банке Tinkoff можно обратиться к следующим частям контекста:

1. ""обязуется хранить и возвратить Клиенту/Доверенному лицу в сохранности принятый на хранение Слиток, Сертификат-ярлык (при наличии) и Сертификат качества слитка на условиях, установленных настоящими Правилами и действующим законодательством Российской Федерации."" - Здесь указывается, что банк обязуется хранить слиток в сохранности и возвращать его клиенту в том же состоянии.

2. ""2.14.7. Срок хранения Слитка Банком — с даты подписания, указанной в Акте приема-передачи, до востребования."" - Указывается, что банк хранит слиток с момента подписания акта приема-передачи до момента его востребования клиентом.

3. ""2.14.8. Хранение Банком Слитка Клиента осуществляется в хранилище 5 (Пятого) класса устойчивости к взлому, оборудованном системой видеонаблюдения и охранно-пожарной и тревожной сигнализации с выводом сигнала на пункт централизованной охраны, с осуществлением физической круглосуточной специализированной охраны хранилища."" - Здесь указаны условия хранения слитков: в хранилище 5 класса устойчивости к взлому с системой безопасности.

Исходя из этих частей контекста, можно сделать вывод, что банк Tinkoff предоставляет услугу хранения слитков драгоценных металлов в специально оборудованных хранилищах с высоким уровнем безопасности и обязуется сохранять слиток клиента до момента его востребования."
Что такое 'Сертификат качества слитка'?,"['Сертификат качества слитка — документ о качестве драгоценного металла, содержащий сведения о соответствии драгоценного металла стандартам качества, технические характеристики и параметры Слитка, информацию о химическом составе, произведенный/заверенный предприятием-изготовителем Слитка.']","Сертификат качества слитка - это документ, выданный изготовителем слитка драгоценного металла, который содержит информацию о соответствии металла стандартам качества, его технические характеристики, параметры и химический состав.","Сертификат качества слитка - это документ, содержащий информацию о качестве драгоценного металла, технические характеристики и параметры слитка, а также данные о химическом составе. Он выдается предприятием-изготовителем слитка и подтверждает соответствие драгоценного металла стандартам качества. Этот сертификат необходим при приеме слитка клиентом или его доверенным лицом. В случае утраты, порчи или нарушения целостности заводской упаковки слитка, сертификат качества может быть признан недействительным, что может повлиять на качество и ценность слитка. Клиент обязан сохранить полученный сертификат-ярлык и сертификат качества слитка для подтверждения подлинности и качества приобретенного драгоценного металла."
На какой срок выдается эта доверенность? Можно ли ее передоверить другому лицу?,"['Датой выдачи доверенности считается дата предоставления Представляемым Банку данных своего представителя. Доверенность выдана сроком на 1 (один) год, полномочия по настоящей доверенности не могут быть передоверены другим лицам.']",Доверенность выдается сроком на 1 год. Полномочия по этой доверенности нельзя передоверять другим лицам.,"Из контекста видно, что доверенность на обработку персональных данных в данном случае предоставляется на срок 15 лет. После этого срока, при отзыве согласия, данные должны быть уничтожены в течение 1 года. Однако, в тексте не указано, можно ли передоверить данную доверенность другому лицу. Для получения точной информации по этому вопросу, рекомендуется обратиться в банк Tinkoff для получения дополнительной информации."
"Как клиент может получить сертификат качества слитка, который он передал на хранение в банк?","['По требованию Клиента Банк предоставляет Клиенту заверенную Банком копию Сертификата качества слитка, переданного на ответственное хранение.']","По требованию клиента банк предоставляет ему заверенную копию сертификата качества слитка, который клиент передал на ответственное хранение в банке.","Для того чтобы получить сертификат качества слитка, который клиент передал на хранение в банк Tinkoff, необходимо обратиться в банк. В соответствии с правилами оказания сервиса ""Покупка/продажа слитков драгоценных металлов"", банк обязуется хранить слиток в сохранности и в случае необходимости предоставить клиенту заверенную копию сертификата качества слитка, переданного на ответственное хранение. Этот процесс осуществляется по требованию клиента и подтверждается актом приема-передачи, подписанным сторонами. Поэтому клиенту следует обратиться в банк Tinkoff для получения необходимой информации и копии сертификата качества слитка."
Какие условия хранения слитков в банке? Где их хранят?,"['Хранение Банком Слитка Клиента осуществляется в хранилище 5 (Пятого) класса устойчивости к взлому, оборудованном системой видеонаблюдения и охранно-пожарной и тревожной сигнализации с выводом сигнала на пункт централизованной охраны, с осуществлением физической круглосуточной специализированной охраны хранилища.', 'Условия хранения: температура воздуха от +17 до +25 °С, атмосферное давление от 740 до 760 мм рт. ст., относительная влажность воздуха от 30 до 60%.']","Слитки хранятся в специальном хранилище 5 класса устойчивости к взлому, оборудованном системами видеонаблюдения, охранно-пожарной и тревожной сигнализацией, а также круглосуточной охраной. Условия хранения: температура +17...+25°С, атмосферное давление 740-760 мм рт.ст., влажность 30-60%.","Для ответа на ваш вопрос о условиях хранения слитков в банке Tinkoff можно обратиться к следующим частям контекста:

1. Согласно п. 2.14.6 и 2.14.7 правил оказания сервиса «Покупка/продажа слитков драгоценных металлов», прием на хранение и выдача слитка с ответственного хранения осуществляется в помещении банка для совершения операций с ценностями. Срок хранения слитка банком составляет с даты подписания, указанной в акте приема-передачи, до востребования.

2. Условия хранения слитка в банке описаны в пункте 2.14.9 правил и включают в себя следующие параметры: температура воздуха от +17 до +25 °C, атмосферное давление от 740 до 760 мм рт. ст., относительная влажность воздуха от 30 до 60%.

Исходя из вышеперечисленных данных, можно сделать вывод, что слитки драгоценных металлов хранятся в хранилище 5 класса устойчивости к взлому, оборудованном системой видеонаблюдения и охранно-пожарной сигнализацией. Условия хранения обеспечивают оптимальные параметры температуры, давления и влажности для сохранности слитков.

Если у вас возникнут дополнительные вопросы или вам потребуется более подробная информация, рекомендуем обратиться в банк Tinkoff для получения консультации специалистов по данному вопросу."
"Можно ли вернуть слиток в банк, если при получении были обнаружены его повреждения? Как это сделать?","['В случае обнаружения при приеме Слитка с ответственного хранения от Представителя нарушения целостности заводской упаковки Слитка, несоответствия нанесенной на Слиток маркировки данным, указанным в Сертификате качества слитка и/или Сертификате-ярлыке, отсутствия либо повреждения Сертификата качества слитка и/или Слитка (наличие на поверхности Слитка наплывов / заусенцев / царапин / жировых пятен / посторонних включений) Клиентом/Доверенным лицом и Представителем оформляется в двух экземплярах Рекламационный акт по форме Приложения № 3 к настоящим Правилам, в котором фиксируются указанные выше нарушения / несоответствия / повреждения. В случае наличия указанных выше нарушений / несоответствий / повреждений Слиток вместе с Сертификатом качества слитка и Сертификатом-ярлыком вкладываются Клиентом/Доверенным лицом в порожний сейф-пакет и запечатываются, после чего сейф-пакет помещается в Устройство для перевозки слитка с дальнейшим опломбированием номерной разовой пломбой. Номер сейф-пакета, а также номерной разовой пломбы отражаются в Рекламационном акте.']","Да, если при получении слитка с хранения были обнаружены его повреждения или нарушения упаковки, несоответствия маркировки и т.п., то клиент/доверенное лицо вместе с представителем банка оформляют рекламационный акт в двух экземплярах. В этом акте фиксируются все нарушения. После этого слиток вместе с сертификатами запечатывают в новый сейф-пакет и опломбировывают, указав номера на рекламационном акте. Затем слиток возвращается обратно в банк.","Для ответа на ваш вопрос о возврате слитка в банк при обнаружении повреждений необходимо следовать следующей процедуре, описанной в документе ""Правила оказания сервиса «Покупка/продажа слитков драгоценных металлов»"":

1. При обнаружении нарушений целостности заводской упаковки слитка, несоответствия маркировки или повреждений при получении, клиент или его уполномоченное лицо обязаны оформить Рекламационный акт в двух экземплярах. В нем должны быть зафиксированы все обнаруженные нарушения/повреждения.

2. Слиток вместе с сертификатом качества и сертификатом-ярлыком должны быть помещены в порожний сейф-пакет, запечатанный и опломбированный. Номер сейф-пакета и пломбы отражаются в Рекламационном акте.

3. Один экземпляр Рекламационного акта остается у клиента, а другой передается представителю для предоставления в банк.

4. Рекламационный акт рассматривается банком в течение 5 рабочих дней с даты оформления. По его результатам, банк обязан связаться с клиентом и предоставить новый слиток или вернуть старый, если выявленные нарушения не подтвердились.

Таким образом, чтобы вернуть слиток в банк из-за обнаруженных повреждений, необходимо оформить Рекламационный акт и действовать в соответствии с описанной процедурой."
Кто может стать доверенным лицом?,"['Доверенное лицо — физическое лицо, уполномоченное Клиентом, которому предоставлено право на представление интересов Клиента и осуществление действий от его имени в рамках Сервиса на основании доверенности, оформленной посредством Дистанционного обслуживания в соответствии с п. 5.3 настоящих Правил по форме Приложения № 5 к настоящим Правилам.']","Доверенным лицом клиента может стать любое физическое лицо, которому клиент предоставит полномочия представлять его интересы в рамках сервиса покупки/продажи слитков драгоценных металлов. Доверенность на это лицо оформляется клиентом посредством дистанционного обслуживания в банке по форме из Приложения №5 к Правилам.","Доверенным лицом может стать лицо, которое имеет полномочия от страхователя или клиента на заключение договора страхования от его имени. В случае заключения договора страхования по доверенности, это лицо должно быть уведомлено страхователем о заключении договора по его поручению и иметь соответствующие полномочия. Полномочия доверенного лица могут быть подтверждены документально, например, доверенностью или иными средствами, удостоверяющими его право действовать от имени страхователя или клиента. Если в договоре страхования прямо предусмотрено продление его действия, то доверенное лицо также может иметь право продлить договор на новый срок при соблюдении условий продления, предусмотренных договором страхования. Если у клиента возникают вопросы относительно допустимости действий доверенного лица или условий его полномочий, рекомендуется обратиться в банк для получения консультации и разъяснений."
Можно ли поменять доверенное лицо? Как это сделать?,"['Клиент может отменить выданную доверенность путем обращения в Банк посредством Дистанционного обслуживания в любое время, но не позднее одного дня до планируемой даты встречи с представителем Клиента.']","Да, клиент может отменить ранее выданную доверенность на доверенное лицо. Для этого он должен обратиться в банк посредством дистанционного обслуживания не позднее чем за 1 день до планируемой даты встречи с действующим доверенным лицом.",Из предоставленного контекста не удается однозначно определить процедуру смены доверенного лица в банке Tinkoff. Рекомендуется обратиться в банк напрямую для получения точной информации и инструкций по данному вопросу.
Как происходит покупка слитка банком? Есть ли какие-то особые условия?,"['Банк приобретает у Клиента только Слитки, находящиеся на ответственном хранении в Банке.', 'Клиент, обращаясь с Заявкой, подтверждает, что на момент заключения договора купли-продажи Слиток принадлежит на праве собственности Клиенту, не продан, не является предметом залога, не обременен правами третьих лиц, в споре, под арестом и иным запрещением не состоит.']","Банк осуществляет покупку слитков драгоценных металлов только у тех клиентов, чьи слитки находятся на ответственном хранении в самом банке. При подаче заявки на продажу слитка клиент должен подтвердить, что на момент продажи слиток принадлежит ему на праве собственности, не продан, не заложен, не арестован и не обременен правами третьих лиц.","Покупка слитка банком происходит в соответствии с правилами и действующим законодательством Российской Федерации. Договор купли-продажи слитка заключается путем акцепта Банком оферты, содержащейся в Заявке, после чего происходит зачисление стоимости слитка на картсчет клиента. Право собственности на слиток переходит от клиента к банку с момента зачисления стоимости на картсчет клиента. Прием слитка банком производится по сертификату-ярлыку (при наличии) и сертификату качества слитка с проведением контрольного взвешивания и проверкой целостности упаковки, маркировки и отсутствия повреждений. Клиент должен подтвердить свое согласие с заявкой и подписать необходимые документы через дистанционное обслуживание. Зачисление согласованной стоимости слитка производится на картсчет клиента в дату подписания документов."
Что такое накопительный счет и как начисляются проценты?,"['\n                    3.1. Начисление процентов на остаток средств по Счету вклада/Накопительному счету производится со дня, следующего \n                    за днем зачисления денежных средств на Счет вклада/Накопительный счет Клиента, до дня окончания срока Вклада \n                    (включительно) либо до их списания со Счета вклада/Накопительного счета по иным основаниям.', ' \n                    3.3. Клиент имеет возможность по согласованию с Банком посредством Дистанционного обслуживания изменить Тарифный \n                    план Вклада на Тарифный план для мультивалютного Вклада. При смене Тарифного плана изменения в части процентной \n                    ставки по Счету вклада, изначально открытого в рамках текущего Договора вклада, не распространяются до конца срока \n                    размещения, установленного предыдущим Тарифным планом. Процентные ставки по валютам, отличным от валюты \n                    измененного Тарифного плана, устанавливаются новым Тарифным планом.\n                    3.4. При начислении процентов в расчет принимается величина процентной ставки (в процентах годовых) и фактическое \n                    количество календарных дней, на которое привлечены денежные средства. При этом за базу берется действительное \n                    число календарных дней в году (365 или 366 дней соответственно).\n                    ', ' \n                    Накопительный счет — счет, на котором учитываются денежные средства Клиента, предусматривающий начисление \n                    процентов на остаток денежных средств, в соответствии с Договором накопительного счета.']","
                    Накопительный счет - это счет, на котором учитываются денежные средства клиента и на который начисляются проценты на остаток денежных средств. Проценты начисляются в соответствии с условиями договора накопительного счета.
                    Проценты на накопительном счете начисляются со дня, следующего за днем зачисления денежных средств на счет, до дня окончания срока вклада (включительно) либо до их списания со счета по другим основаниям.

                    При начислении процентов учитываются:
                    • Величина процентной ставки (в процентах годовых)
                    • Фактическое количество календарных дней, на которое привлечены денежные средства

                    За базу берется действительное число календарных дней в году (365 или 366 дней соответственно).",Из предоставленного контекста не удалось найти информацию о накопительных счетах и начислении процентов. Рекомендуется обратиться в банк Tinkoff для получения более подробной информации на эту тему.
Можно ли открыть вклад в 12 лет?,"['1.2. Банк не заключает Договор вклада (Договор накопительного счета) с лицами, не достигшими возраста 14 лет']","Нет, Банк не заключает договор вклада с лицами, не достигшими возраста 14 лет.",Из предоставленного контекста не удалось найти информацию о возможности открытия вклада для лиц в возрасте 12 лет. Рекомендуется обратиться в банк Tinkoff для получения точной информации по данному вопросу.
Могу ли я открыть несколько вкладов и пополнять их?,"['\n                    4.1. Клиент имеет право:\n                    4.1.1. Предъявить Банку требование о досрочном полном или частичном изъятии Вклада.\n                    4.1.2. Вносить дополнительные денежные средства во Вклад/Накопительный счет, если данная возможность установлена \n                    Тарифным планом.\n                    4.1.3. Разместить несколько Вкладов (открыть несколько Счетов вклада/Накопительных счетов на условиях, устанавливаемых \n                    Договором вклада (Договором накопительного счета), Тарифами:\n                    • через Дистанционное обслуживание;\n                    • в офисе Банка в часы работы операционного подразделения Банка.\n']"," 
                    Да, вы можете открыть несколько вкладов и пополнять их.
                    Согласно пункту 4.1.3 приведенного контекста, клиент имеет право разместить несколько вкладов (открыть несколько счетов вклада/накопительных счетов) на условиях, устанавливаемых договором вклада (договором накопительного счета) и тарифами.
                    Вы можете открыть несколько вкладов как через дистанционное обслуживание, так и в офисе банка в часы работы операционного подразделения банка.","Из предоставленного контекста не удалось найти информацию, которая прямо отвечала бы на ваш вопрос о возможности открытия нескольких вкладов и их пополнения. Для получения точной информации по данному вопросу рекомендуется обратиться в банк Tinkoff напрямую. Банковские специалисты смогут подробно проконсультировать вас по всем возможностям открытия и управления вкладами в соответствии с условиями и правилами банка."
Для получения страховой выплаты в случае несчастного случая с летальным исходом нужна ли справка из психушки?,['\n                    6.1. По риску Смерть в результате Несчастного случая должны быть предоставлены следующие документы:\n                    j. Справка из психоневрологического диспансера и наркологического диспансера'],"Да, в таком случае необходимы справки из психоневрологического диспансера и наркологического диспансера.","Из предоставленного контекста не удается найти информацию о том, нужна ли справка из психушки для получения страховой выплаты в случае несчастного случая с летальным исходом. Рекомендуем обратиться в банк Tinkoff для получения точной информации по данному вопросу."
Дают ли кредит на автомобиль?,"['3.1. Банк предоставляет Клиенту Кредит на потребительские цели, в том числе на приобретение Товара и/или Автомобиля, в соответствии с законодательством Российской Федерации.']","Да, в соответсвии с пунктом 3.1. Банк предоставляет Клиенту Кредит на потребительские цели, , в том числе на приобретение автомобиля.","Из предоставленного контекста необходимо отметить следующую часть: ""С помощью карт Банка Вы можете воспользоваться услугой аренды автомобиля."" Данная информация позволяет сделать вывод о том, что банк Tinkoff предоставляет услугу аренды автомобиля с использованием их карт.

Следовательно, можно ответить на вопрос ""Дают ли кредит на автомобиль?"" следующим образом: ""Банк Tinkoff не предоставляет кредиты на покупку автомобилей, однако предоставляет услугу аренды автомобиля с использованием их карт.""

Если клиент заинтересован в получении кредита на автомобиль, рекомендуется обратиться в банк для получения подробной информации о доступных кредитных продуктах."
Распростроняется ли страховое покрытие на смерть в алкогольном опьянении?,"[' \n                    Страховое покрытие по рискам «Смерть» и «Инвалидность» не распространяется на события, произошедшие в результате \n                    и/или в период:\n                    a. действий, совершенных Застрахованным лицом в состоянии алкогольного, наркотического и/или токсического \n                    опьянения; в результате употребления им наркотических, сильнодействующих лекарственных препаратов \n                    и психотропных веществ без предписания врача (или по предписанию врача, но с нарушением указанной  \n                    им дозировки); болезни Застрахованного лица, прямо связанной с наркоманией, токсикоманией, хроническим \n                    алкоголизмом\n                    ']","Нет, страховое покрытие не распространяется на смерть в алкогольном опьянении.","Из предоставленного контекста не ясно, распространяется ли страховое покрытие на смерть в алкогольном опьянении. Для получения точного ответа на данный вопрос рекомендуется обратиться в банк Tinkoff для получения дополнительной информации от специалистов по страхованию."
"Может ли Банк изменить Тарифный план по кредитной карте, и какие условия должны быть соблюдены для этого?","['\n                    Банк вправе в одностороннем порядке изменить Тарифный план, применяемый\nв рамках Договора, и/или заменить его на другой Тарифный план, в том числе при заключении Договора и/или\nна определенный период времени по усмотрению Банка, с целью уменьшения процентной ставки по кредиту\nи/или улучшения иных условий обслуживания при условии, что это не повлечет возникновение новых или увеличение размера существующих денежных обязательств Клиента\n                    ']","Да, Банк может изменить Тарифный план по кредитной карте в одностороннем порядке, но при условии, что это не приведет к возникновению новых или увеличению уже существующих денежных обязательств клиента ","Для ответа на ваш вопрос о возможности изменения тарифного плана по кредитной карте Банком Tinkoff необходимо обратиться к Общим условиям выпуска и обслуживания кредитных карт. В этих условиях должны быть указаны правила и условия, согласно которым Банк имеет право изменить тарифный план. Также важно обратить внимание на условия вашего договора с Банком, чтобы узнать дополнительные детали и требования, которые должны быть соблюдены для изменения тарифного плана. Если у вас возникли дополнительные вопросы, рекомендуем обратиться в Банк для получения конкретной информации по вашему счету и карте."
Можно ли внести частичное досрочное погашение кредита? И как это повлияет на остаток задолженности?,"['«Клиент имеет право досрочно погасить Задолженность с уплатой Банку суммы непогашенного Кредита и начисленных процентов, а также (если применимо) комиссий и плат, предусмотренных Тарифным планом, в любой момент путем зачисления необходимой суммы денежных средств на Картсчет (Счет) и извещения Банка о необходимости проведения досрочного погашения. В случае частичного досрочного погашения уменьшается срок Кредита или сумма Регулярного платежа по выбору Клиента, при этом Клиент не освобождается от оплаты ближайшего Регулярного платежа, а также применимых комиссий и плат, предусмотренных Тарифным планом.», «При обращении Клиента в Банк для совершения частичного досрочного погашения до или в дату оплаты ближайшего Регулярного платежа Клиенту может быть предложено совершить частичное досрочное погашение с погашением ближайшего Регулярного платежа и последующим уменьшением срока Кредита или суммы Регулярного платежа по выбору Клиента.»']","Да, Клиент имеет право совершить частичное досрочное погашение кредита. При этом по выбору Клиента уменьшится либо срок кредита, либо сумма регулярного платежа. Однако Клиент не освобождается от оплаты ближайшего регулярного платежа и применимых комиссий.","Да, в соответствии с условиями пользовательского соглашения банка Tinkoff, клиент имеет право на частичное досрочное погашение задолженности по кредиту. При этом клиент должен уплатить банку сумму непогашенного кредита, начисленные проценты, а также комиссии и платы, предусмотренные тарифным планом. Частичное досрочное погашение может привести к уменьшению срока кредита или суммы регулярного платежа по выбору клиента. Однако клиент не освобождается от оплаты ближайшего регулярного платежа, а также применимых комиссий и плат, предусмотренных тарифным планом. При обращении в банк для совершения частичного досрочного погашения до или в дату оплаты ближайшего регулярного платежа клиенту может быть предложено совершить частичное досрочное погашение с погашением ближайшего регулярного платежа и последующим уменьшением срока кредита или суммы регулярного платежа по выбору клиента."
Что будет в случае просрочки платежа по кредиту? И какой штраф может быть начислен?,"['«В случае неоплаты платежа Клиент должен уплатить штраф за неоплату Минимального платежа согласно Тарифному плану. Банк рассматривает любой поступивший платеж Клиента как признание Клиентом данного штрафа в размере поступившего платежа, но не более суммы штрафа, определенного в соответствии с Тарифами.»']","В случае неоплаты минимального платежа по кредиту, Клиент должен уплатить штраф в соответствии с Тарифным планом. Размер штрафа определяется Тарифами, и любой поступивший от Клиента платеж Банк будет рассматривать как оплату штрафа в пределах установленной суммы.","При просрочке платежа по кредиту, вам необходимо связаться с Банком через дистанционное обслуживание и оформить претензию. Сотрудник Банка поможет вам в этом процессе. При этом, в случае просрочки платежа, может быть начислен штраф, который зависит от условий вашего кредитного договора. Рекомендуется внимательно изучить условия кредита, чтобы быть в курсе возможных штрафов и последствий просрочки. В случае возникновения вопросов или необходимости более подробной информации, рекомендуется обратиться в Банк для получения консультации."
Можно ли на время приостановить выплаты по кредиту? И как это повлияет на начисление процентов?,"['«На основании обращения Клиента и по согласованию с Банком на период от 1 (одного) до 12 (двенадцати) месяцев возможно приостановление обязанности Клиента по погашению Задолженности, по оплате Регулярных платежей и/или иных платежей. В указанный период Банк вправе приостановить начисление процентов и иных сумм, предусмотренных Договором реструктуризации задолженности.»']","Да, на основании обращения Клиента и по согласованию с Банком возможно приостановить обязанность по погашению задолженности и оплате платежей на срок от 1 до 12 месяцев. В этот период Банк вправе также приостановить начисление процентов и иных сумм по кредиту.","Для временного приостановления выплат по кредиту и изменения начисления процентов необходимо обратиться в Банк через дистанционное обслуживание и оформить претензию. Сотрудник Банка поможет вам в этом процессе. Пожалуйста, уточните все детали и условия сотрудников банка для точной информации по вашему конкретному случаю."
Я хочу оформить дополнительную карту на супругу. Как это сделать? И будет ли она иметь доступ к общему лимиту по кредитке?,"['«3.2. По заявлению Клиента, переданному в Банк на бумажном носителе или через Дистанционное обслуживание, в рамках Договора кредитной карты Банком может быть выпущена одна или несколько дополнительных Кредитных карт.»', '«3.5. Клиент вправе установить лимит для проведения расходных операций с использованием Кредитной карты.»']","Вы можете оформить дополнительную кредитную карту на супругу, подав заявление в банк на бумажном носителе или через дистанционное обслуживание. Дополнительная карта будет иметь доступ к общему лимиту задолженности по вашей основной кредитной карте, однако вы можете установить отдельный лимит для расходных операций по дополнительной карте.","Для оформления дополнительной карты на супругу вам необходимо обратиться в Банк через дистанционное обслуживание и оформить запрос на выдачу дополнительной карты. Сотрудник Банка поможет вам в этом процессе. После оформления карты, ваша супруга сможет иметь доступ к общему лимиту по кредитной карте, если это предусмотрено условиями вашего договора с банком. Важно уточнить эту информацию у сотрудника Банка во время оформления дополнительной карты."
"А что если я потеряю карту? Сколько у меня есть времени, чтобы ее заблокировать? И как вообще это делается? Через приложение или звонить надо?","['«6.1. При обнаружении утери, кражи или порчи Кредитной карты и/или возникновения подозрений, что Кредитная карта или ее реквизиты, а также ПИН-код, QR-код, Коды доступа, Аутентификационные данные, Абонентский номер, Абонентское устройство могли быть утрачены или похищены, а также в случае изъятия Кредитной карты в банкомате или торгово-сервисном предприятии и в случае изменения имени или фамилии Держателя Клиент должен незамедлительно уведомить Банк по телефонам 8 800 555-10-10 или +7 495 645-59-19 (круглосуточно) и заблокировать Кредитную карту и/или Интернет-Банк и/или Мобильный банк, а также подать заявление о досрочном перевыпуске Кредитной карты.»']","В случае утери или кражи кредитной карты, вы должны незамедлительно уведомить банк по телефонам горячей линии 8 800 555-10-10 или +7 495 645-59-19 (круглосуточно) и заблокировать карту. Также необходимо подать заявление на досрочный перевыпуск новой карты. Чем быстрее вы заблокируете карту, тем меньше риск несанкционированного использования.","Для того, чтобы заблокировать карту Tinkoff в случае ее потери, вам необходимо как можно быстрее сообщить о случившемся в Банк, используя дистанционное обслуживание. Карту можно заблокировать по телефону, через интернет-банк или мобильное приложение Банка. Чем раньше вы это сделаете, тем меньше вероятность несанкционированного использования карты злоумышленниками. Необходимо также установить лимиты на операции и снятие наличных по карте, чтобы минимизировать потенциальные финансовые потери. Если вы не уверены, что карта была украдена, можно установить лимит ""0"" на операции и запретить покупки через Интернет. После блокировки карты, вам следует обратиться в Банк для получения дальнейших инструкций. Не стоит пытаться разблокировать карту – ее можно только перевыпустить. В случае утери карты на территории РФ, рекомендуется также заявить об утрате в полицию. Если карта была украдена за границей, следует обратиться в полицию или консульский отдел посольства Российской Федерации в соответствующей стране."
"Прочитал тут у вас про блокировку карточки. А если я её забуду забрать в банкомате, что тогда делать?","['«6.1. [...] а также в случае изъятия Кредитной карты в банкомате или торгово-сервисном предприятии и в случае изменения имени или фамилии Держателя Клиент должен незамедлительно уведомить Банк по телефонам 8 800 555-10-10 или +7 495 645-59-19 (круглосуточно) и заблокировать Кредитную карту и/или Интернет-Банк и/или Мобильный банк, а также подать заявление о досрочном перевыпуске Кредитной карты.»']","Если вы забыли карту в банкомате, вам необходимо незамедлительно сообщить об этом в банк по телефонам горячей линии 8 800 555-10-10 или +7 495 645-59-19 и заблокировать кредитную карту, а также подать заявление на ее досрочный перевыпуск. Это позволит предотвратить возможное несанкционированное использование забытой карты третьими лицами.","Если вы забудете забрать карту из банкомата, следует немедленно обратиться в банк посредством дистанционного обслуживания. Если карта была удержана банкоматом стороннего банка, необходимо связаться с банком, обслуживающим данный банкомат. В случае технического сбоя или промедления с извлечением карты, она может быть выдана вам при предъявлении документа, удостоверяющего личность. Некоторые сторонние банки могут потребовать письменный запрос из банка, выпустившего карту, для возврата удержанной карты. Важно помнить, что сторонний банк вправе не вернуть карту, если она была заблокирована ранее или по другим причинам. Если возникли какие-либо сложности, рекомендуется обратиться в банк, который выпустил карту, для получения дополнительной поддержки."
"А есть ли какие-то льготные условия, если я захочу приостановить выплаты по кредитке на какое-то время? Например, на ремонт или что-то в этом роде?","['«5.15. На основании обращения Клиента и по согласованию с Банком на период от 1 (одного) до 12 (двенадцати) месяцев возможно приостановление обязанности Клиента по погашению Задолженности, по оплате Минимальных платежей, Регулярных платежей и/или иных платежей. В указанный период Банк вправе приостановить начисление процентов и иных сумм, предусмотренных Договором кредитной карты.»']","Да, в документе указано, что по обращению клиента и по согласованию с банком возможно приостановление обязанности по погашению задолженности, выплате минимальных и регулярных платежей на срок от 1 до 12 месяцев. В этот период банк также может приостановить начисление процентов и других сумм по кредитной карте. Таким образом, вы можете получить льготный период для ремонта или других нужд, обратившись в банк с соответствующим заявлением.","Да, согласно условиям банка Tinkoff, возможно приостановление обязанности клиента по погашению задолженности, минимальных платежей и/или иных платежей на период от 1 до 12 месяцев. В указанный период банк вправе приостановить начисление процентов и иных сумм, предусмотренных договором кредитной карты. Оставшийся срок возврата кредита продлевается на согласованный период приостановления обязанности клиента. Таким образом, клиент может обратиться в банк для согласования и уточнения условий приостановления выплат по кредитке на нужный ему период, например, на ремонт или другие цели."
Какие процедуры предусмотрены банком для обработки жалоб клиентов?,"['Банк имеет установленные процедуры для обработки и рассмотрения жалоб клиентов, включая регистрацию жалобы, ее анализ и предоставление ответа клиенту в установленные сроки.']","Банк следует четко установленным процедурам для обработки жалоб клиентов, которые включают регистрацию жалобы, ее тщательный анализ и предоставление ответа клиенту в соответствии с установленными сроками.","Для обработки жалоб клиентов банк Tinkoff предусматривает следующие процедуры:

1. Клиент должен предоставить любые документы, запрошенные банком, не позднее 3 (трех) рабочих дней с даты первого представления их в налоговый орган.
2. В случае отсутствия необходимых документов, клиент должен представить письмо по форме банка с пояснениями о причинах невозможности предоставления документов.
3. Возможно запросить оборотно-сальдовую ведомость по всем счетам бухгалтерского учета и/или регистры бухгалтерского учета.
4. В случае отсутствия возможности получения сведений в виде документов, перечисленных в предыдущих пунктах, предоставляются другие источники информации, такие как отзывы о клиенте от других клиентов банка или других кредитных организаций.
5. При необходимости обновления сведений о клиенте, эти данные могут быть перепроверены при возникновении сомнений в их достоверности.

Если у вас возникли дополнительные вопросы по процедурам обработки жалоб, рекомендую обратиться в банк Tinkoff для получения более подробной информации."
Что происходит с депозитами в случае смерти?,['В случае смерти клиента банк замораживает депозиты до решения вопросов наследства в соответствии с законодательством.'],"После смерти клиента банк замораживает все его депозиты и удерживает их до тех пор, пока не будут решены вопросы наследства в соответствии с действующим законодательством.","В случае смерти владельца депозита в банке Tinkoff, депозит может быть подвергнут процедуре наследования в соответствии с действующим законодательством Российской Федерации. Право собственности на депозит и все связанные с ним документы могут быть переданы наследникам умершего владельца депозита. Для получения подробной информации о процедуре наследования депозита в случае смерти владельца, рекомендуется обратиться в банк Tinkoff для консультации с специалистами по наследственным вопросам."
Могу я отказаться от получения уведомлений от банка и как это влияет на его обслуживание?,"['Клиенты имеют право отказаться от получения определенных типов уведомлений от банка, однако это может повлиять на их способность получать своевременную информацию о изменениях условий, сбоях в системе или других важных обновлениях.']","Клиенты могут отказаться от получения определенных типов уведомлений от банка, но это может привести к тому, что они не будут получать важные обновления и информацию своевременно, что может повлиять на их способность управлять своими счетами и услугами эффективно.","Для отказа от получения уведомлений от банка Tinkoff вам необходимо обратиться в банк через дистанционное обслуживание и сделать соответствующее заявление. Вы можете скачать образец заявления на сайте банка или запросить его у сотрудника. В заявлении укажите, что вы отказываетесь от получения уведомлений и предоставьте все необходимые документы. Отказ от уведомлений не должен негативно сказываться на обслуживании вашего счета или карты, однако уточните эту информацию у сотрудников банка для дополнительной уверенности."
Как я могу увеличить лимит по своей кредитной карте?,"['Для увеличения кредитного лимита клиенты должны подать заявление через мобильное приложение или веб-сайт банка, после чего банк рассмотрит их кредитную историю и текущую финансовую ситуацию.']","Чтобы увеличить кредитный лимит, клиентам необходимо подать соответствующее заявление через мобильное приложение или веб-сайт банка. Банк затем оценит их кредитную историю и текущую финансовую ситуацию перед принятием решения.","Для увеличения лимита по кредитной карте вам необходимо обратиться в Банк Tinkoff. Банк может рассмотреть ваш запрос на увеличение лимита, однако решение будет принято исходя из различных факторов, включая вашу кредитную историю, финансовое положение и другие обстоятельства. Чтобы подать запрос на увеличение лимита, вы можете воспользоваться дистанционным обслуживанием банка и следовать инструкциям сотрудника банка. Необходимо помнить, что банк оставляет за собой право отказать в увеличении лимита без объяснения причин, если по его мнению операция может противоречить законодательству РФ."
"Каковы условия отмены банковской операции, например, перевода средств или платежа?","['Клиенты могут отменить определенные банковские операции, если они не были еще обработаны банком. Условия отмены операций установлены в пользовательском соглашении и зависят от типа операции.']","Условия отмены банковской операции зависят от того, была ли операция уже обработана банком. Для операций, которые еще не обработаны, клиенты могут инициировать отмену, следуя процедурам, описанным в пользовательском соглашении и в зависимости от типа операции.","Для ответа на ваш вопрос о условиях отмены банковской операции, например, перевода средств или платежа, необходимо обратиться к пункту 5.1 и 5.2 контекста. В соответствии с указанными пунктами, банк имеет право расторгнуть Договор реструктуризации задолженности в одностороннем порядке в случаях, предусмотренных законодательством Российской Федерации, включая случаи выявления недостоверной информации, невыполнения клиентом обязательств или по усмотрению банка. При расторжении такого договора и наличии излишне перечисленных денежных средств, банк осуществляет их возврат клиенту по указанному адресу или иным согласованным способом. Банк также имеет право удержать комиссию за перевод денежных средств. В случае отсутствия распоряжения клиента о переводе денежных средств в течение определенного срока, они могут быть переданы банку. Если клиент не дает распоряжение в течение трех лет, то указанные денежные средства также считаются переданными банку. Таким образом, условия отмены банковской операции зависят от соблюдения условий договора и законодательства."
Какие услуги доступны клиентам через Интернет-банк?,"['Через Интернет-банк клиенты могут управлять своими счетами, осуществлять платежи и переводы, а также получать детальную информацию о своих финансовых операциях.']","Интернет-банк предоставляет клиентам возможности управления их счетами, осуществления платежей и переводов, а также доступ к подробной информации о всех их финансовых операциях.","Через Интернет-банк клиенты могут воспользоваться различными услугами банка, такими как:
- Получение информации о состоянии своих счетов и операциях
- Осуществление платежей и переводов денежных средств
- Обмен валюты
- Получение информации о доступных кредитах и услугах банка
- И другие операции по усмотрению банка

Также клиенты имеют возможность изменить аутентификационные данные для безопасного доступа к своим счетам через Интернет-банк. Важно помнить, что использование аутентификационных данных является надлежащей и достаточной идентификацией клиента, что подтверждает его право совершать операции через Интернет.

Если у клиента возникли вопросы по конкретным услугам Интернет-банка, рекомендуется обратиться в банк для получения более подробной информации."
"Я не пользовалась кредиткой год, но у меня там лежат мои 800 рублей, я могу их как-то вернуть?","['""8. Расторжение Договора кредитной карты\n                8.1. Банк вправе в любой момент расторгнуть Договор кредитной карты в одностороннем порядке в случаях, предусмотренных \n                законодательством Российской Федерации, а также:\n                • в случае если Держатель не пользовался Кредитной картой более, чем 6 (шесть) месяцев при отсутствии \n                Задолженности по Договору кредитной карты;\n                В этих случаях Банк блокирует все Кредитные карты/Токены, выпущенные в рамках Договора кредитной карты. Договор \n                кредитной карты считается расторгнутым со дня формирования Банком Заключительного счета, который направляется \n                Клиенту. Если в момент расторжения Договора кредитной карты Задолженность Клиента перед Банком отсутствует, Банк \n                вправе расторгнуть Договор кредитной карты без направления Заключительного счета, информируя Клиента о своем \n                решении любым способом по усмотрению Банка.\n                8.5. В случае, если при расторжении Договора кредитной карты в Банке находятся денежные средства Клиента, излишне \n                перечисленные им при погашении Задолженности, Банк осуществляет возврат таких денежных средств по распоряжению \n                Клиента почтовым переводом или иным способом, указанном в распоряжении Клиента. При этом Банк вправе удержать \n                из суммы такого перевода комиссию за перевод денежных средств в размере, предусмотренном Тарифами на услуги \n                по переводам, платежам и дополнительные услуги с использованием каналов Дистанционного обслуживания.\n                8.6. В случае неполучения Банком распоряжения Клиента о переводе денежных средств в течение 120 (ста двадцати) дней \n                со дня обработки Банком последней операции Клиента/Держателя и, если остаток денежных средств не превышает \n                1000 руб., указанный остаток считается безвозмездно переданным Банку. \n                В случае неполучения Банком распоряжения Клиента о переводе денежных средств в течение 3 (трех) лет со дня обработки \n                Банком последней операции Клиента/Держателя указанные денежные средства считаются безвозмездно переданными \n                Банку.\n                ']","Согласно пунуту 8.6 - вы не можете вернуть ваши деньги, так как не дали распоряжение Банку о переводе денежных средств в течение 120 дней.","Для возврата денежных средств, которые находятся на вашей кредитной карте, но которой вы не пользовались в течение года, вам необходимо связаться с Банком посредством дистанционного обслуживания и оформить претензию. Сотрудник Банка поможет вам в этом процессе. Пожалуйста, уточните у сотрудника банка все необходимые шаги для возврата указанной суммы на ваш счет."
