question,contexts,ground_truth,answer
Можно ли не расписываться на карте?,"['После получения карты поставьте свою подпись в прямоугольнике, расположенном на оборотной стороне карты. При отсутствии подписи карта может быть не принята к оплате в торгово-сервисном предприятии, а также повышается риск использования карты злоумышленниками в случае ее утраты/кражи.']","При отсутствии подписи карта может быть не принята к оплате в торгово-сервисном предприятии, а также повышается риск использования карты злоумышленниками в случае ее утраты/кражи.","Да, при совершении операции оплаты покупки или услуги с использованием карты, Вы обязаны подписать квитанцию (слип) или чек, что подтверждает факт совершения операции. Без вашей подписи на полосе для подписи карта может быть считаться недействительной, и вам может быть отказано в обслуживании. В этом случае кассир может попросить вас расписаться на карте, предварительно проверив удостоверяющие личность документы."
"Мой друг попросил меня дать свою карту для оплаты и потом вернуть, это не опасно?","['Никогда не принимайте рекомендации, советы, помощь от третьих лиц при пользовании картой, особенно при снятии наличных денежных средств в банкоматах. В случае возникновения затруднений при совершении операции обратитесь Банк посредством дистанционного обслуживания. Обращайте внимание на расположение банкоматов. Старайтесь не пользоваться банкоматами, расположенными в плохо освещенных и безлюдных местах', 'Не передавайте карту другим лицам, в т.ч. родственникам и знакомым для проведения транзакций. С целью исключения Ваших потерь от несанкционированного использования Вашей карты (копирования информации с Вашей карты для ее дальнейшего мошеннического использования): при совершении операции оплаты с использованием карты никогда не выпускайте Вашу карту из поля зрения и требуйте от обслуживающего Вас лица, чтобы все операции с использованием карты совершались в Вашем присутствии.']","Не передавайте карту другим лицам, в т.ч. родственникам и знакомым для проведения транзакций и никогда не принимайте рекомендации, советы, помощь от третьих лиц при пользовании картой, особенно при снятии наличных денежных средств в банкоматах.","Да, передавать свою карту другому лицу для оплаты и затем возвращать ее может быть опасно, согласно правилам безопасности использования карты. Важно помнить, что необходимо совершать операции с использованием карты только в вашем присутствии и не передавать карту третьим лицам, даже родственникам или знакомым. Также следует всегда проверять правильность операций и не оставлять карту в организациях торговли."
Безопасно ли хранить пинкод в заметках в телефоне?,"['Категорически запрещается записывать ПИН-код на карте. Постарайтесь не записывать ПИН-код, запомните его. Если же Вы предпочитаете записать свой ПИН-код, никогда не указывайте, что это ПИН-код и не храните документ с записанным ПИН-кодом рядом с картой.']","Да, однако не указывайте в названии заметки, что это ПИН-код от Вашей карты.","Хранение пин-кода в заметках на телефоне является крайне небезопасной практикой, поскольку в случае утери или кражи телефона злоумышленники могут получить доступ к вашей банковской карты. Пин-код является конфиденциальной информацией, которую необходимо хранить в надежном месте и не передавать третьим лицам. Рекомендуется запомнить пин-код или хранить его в защищенном виде, чтобы обеспечить безопасность ваших финансов."
Я потеряла карту,"[' Вы потеряли карту или ее украли\nПрежде всего, как можно быстрее, сообщите о случившемся в Банк посредством дистанционного обслуживания \nи заблокируйте карту. Заблокировать карту можно по телефону, в интернет-банке или в мобильном приложении Банка. \nЧем раньше Вы это сделаете, тем меньше вероятность несанкционированного использования карты злоумышленниками. \nРазблокировать карту нельзя — можно только перевыпустить. Если вы не уверены, что карту украли, не спешите ее \nблокировать, установите лимит «0» на операции и запретите покупки через Интернет, если карта будет найдена лимиты \nможно изменить.\nНапоминаем Вам, что в соответствии с Общими условиями выпуска и обслуживания кредитных карт и Общими \nусловиями открытия, ведения и закрытия счетов физических лиц, а также выпуска и обслуживания расчетных карт Ваша \nответственность за дальнейшее использование карты прекращается, после осуществления блокировки, если не станет \nизвестно, что незаконное использование карты имело место с Вашего согласия.\nЕсли карта была у Вас украдена на территории РФ, после блокировки карты заявите о случившемся в полицию. При краже \nкарты за границей, заявите в полицию или в консульский отдел посольства Российской Федерации в стране, на территории \nкоторой произошла кража. Пожалуйста, сохраняйте копию протокола (квитанцию о заявлении) для последующего \nпредъявления в Банк.']","Если вы не уверены, что карту украли, не спешите ее блокировать, установите лимит «0» на операции и запретите покупки через Интернет, если карта будет найдена лимиты можно изменить. В случае, если вы полагаете, что Вашу карту всё-таки украли, то как можно быстрее, сообщите о случившемся в Банк посредством дистанционного обслуживания и заблокируйте карту. Это возможно сделать по телефону, в интернет-банке или в мобильном приложении Банка.","Если вы потеряли карту, вам следует немедленно сообщить об этом в банк посредством дистанционного обслуживания и запросить блокировку карты. Это поможет предотвратить несанкционированное использование вашей карты злоумышленниками. После блокировки карты, вы можете запросить перевыпуск карты через банк. Если вы не уверены, что карта была украдена, вы можете установить лимит ""0"" на операции и запретить покупки через интернет. Как только вы обнаружите утерянную карту после блокировки, обратитесь в банк для получения дальнейших инструкций. В случае кражи карты в РФ, необходимо заявить об этом в полицию. В случае кражи за границей, обратитесь в полицию или консульский отдел посольства Российской Федерации в стране, где произошла кража, и сохраните копию протокола для предъявления в банк."
"Почему при использовании карты важно не расписываться на квитанциях/чеках до того, как вы проверите правильность указанной суммы?","['Проверяйте правильность суммы, указанной на платежном чеке. Поставив подпись на платежном чеке, Вы соглашаетесь со списанием указанной на нем суммы с Вашего карточного счета.']","Важно проверять правильность суммы перед подписанием квитанции/чека, потому что после подписи вы соглашаетесь с этой суммой, и она будет списана с вашего счета.","При использовании карты важно не расписываться на квитанциях/чеках до того, как вы проверите правильность указанной суммы, чтобы избежать возможных ошибок или мошенничества. Подписание чека означает ваше согласие со списанием указанной суммы с вашего карточного счета. Поэтому всегда уделяйте время на внимательную проверку суммы перед подписанием квитанции или чека, чтобы избежать неприятных ситуаций и убедиться в корректности операции."
"Что делать, если я потеряла телефон, на котором было установлено мобильное приложение банка?","['При утрате Мобильного телефона, используемого с абонентским номером подвижной радиотелефонной связи, на который установлено Мобильное приложение Банка, Вам следует срочно обратиться к своему оператору сотовой связи для блокировки SIM-карты и в Банк посредством дистанционного обслуживания для блокировки доступа в мобильное приложение Банка и удаления данных карты с Мобильного телефона.']","Если вы потеряли телефон с установленным мобильным приложением банка, необходимо:

Срочно обратиться к оператору сотовой связи для блокировки SIM-карты.
Обратиться в банк через дистанционное обслуживание для блокировки доступа в мобильное приложение и удаления данных карты с телефона.","Если вы потеряли телефон, на котором было установлено мобильное приложение банка Tinkoff, вам следует срочно обратиться к своему оператору сотовой связи для блокировки SIM-карты. После этого необходимо обратиться в банк через дистанционное обслуживание для блокировки доступа в мобильное приложение банка и удаления данных карты с телефона. Важно также сообщить об утере телефона в банк через дистанционное обслуживание и оформить претензию. Сотрудник банка поможет вам с этим процессом."
Можно ли использовать интернет-кафе и другие общедоступные места для совершения операций по карте в интернете? Объясните причину.,"['Избегайте осуществления Интернет-операций с использованием карты в местах, где услуги Интернет являются общедоступными, например, в Интернет-кафе.']","Нет, не рекомендуется использовать интернет-кафе и другие общедоступные места для совершения операций по карте в интернете. Причина в том, что такие общедоступные сети являются менее безопасными, и есть риск перехвата данных карты злоумышленниками.","Для совершения операций по карте в интернете не рекомендуется использовать общедоступные места, такие как интернет-кафе. Это связано с риском неправомерного доступа к вашим реквизитам и данным карты. Рекомендуется использовать проверенные интернет-магазины, где вы уверены в надежности и безопасности проведения операций. При совершении покупок в сети интернет также следует быть осторожным и не сообщать свои реквизиты банковской карты, за исключением случаев использования автоматизированных систем или систем интернет-коммерции. Код безопасности CVC2/CVV2 также следует вводить для повышения безопасности операций с использованием карты в интернете."
"Что делать, если я получил SMS-оповещение о операции по карте, которую я не совершал?","['Если Вы уверены, что операция не могла быть совершена Вами, то как можно быстрее сообщите об этом в Банк посредством дистанционного обслуживания и заблокируйте карту.']","Если вы получили SMS-оповещение о операции, которую не совершали, нужно как можно быстрее сообщить об этом в банк через дистанционное обслуживание и заблокировать карту.","Если вы получили SMS-оповещение о операции по карте, которую вы не совершали, то в первую очередь проверьте наличие вашей карты. Если у вас есть карта, то возможно, данные вашей карты стали известны третьим лицам. Пожалуйста, учитывайте, что иногда SMS-сообщения могут доставляться с задержкой, поэтому вспомните соответствует ли текст в SMS-сообщении операциям, которые вы совершили по карте за последнее время. Если вы уверены, что операция не могла быть совершена вами, то как можно быстрее сообщите об этом в банк посредством дистанционного обслуживания и заблокируйте карту. Не забывайте, что при операциях в сети Интернет или заказах по телефону в SMS-сообщении могут быть указаны страна/город, отличающиеся от места вашего проживания. В случае подозрений в сомнительных обращениях от имени банка, немедленно проинформируйте об этом банк."
Как обезопасить себя от съема данных карты в банкомате злоумышленниками? Приведи два способа.,"['Поэтому, при пользовании банкоматом не ленитесь внимательно осмотреть его и убедиться в отсутствии каких-либо «накладок» и посторонних устройств.', 'Пожалуйста, примите все меры, чтобы вводимый Вами ПИН-код был не заметен для окружающих.']","Чтобы обезопасить себя от съема данных карты в банкомате:

Внимательно осматривайте банкомат перед использованием на наличие подозрительных накладок и посторонних устройств.
Прикрывайте рукой клавиатуру при вводе ПИН-кода, чтобы его не могли увидеть окружающие.","Для обезопасить себя от съема данных карты в банкомате злоумышленниками, важно соблюдать следующие два способа:

1. Не передавайте карту другим лицам, в том числе родственникам и знакомым, для проведения транзакций. При совершении операции оплаты с использованием карты, никогда не выпускайте карту из поля зрения и требуйте, чтобы все операции с картой совершались в вашем присутствии. Также старайтесь избегать использования банкоматов, расположенных в плохо освещенных и безлюдных местах.

2. Обращайте внимание на окружающих в момент снятия наличных денежных средств в банкомате. Помните, что мошенники могут подсматривать ваш ПИН-код или отвлекать вас, чтобы другой мошенник мог забрать деньги с карты. Поэтому, старайтесь вводить ПИН-код так, чтобы его не могли увидеть посторонние, и не отвлекайтесь, пока не получите деньги и карту из банкомата."
"Правда ли, что при бронировании гостиницы по карте мне необходимо сообщить все реквизиты карты, включая ПИН-код? Если нет, то что именно требуется сообщить?","['При бронировании номера в гостинице по карте Вас попросят сообщить свое имя, номер карты, срок ее действия (иногда, дополнительно — трехзначный код безопасности, напечатанный на обратной стороне карты на полосе для подписи) и срок Вашего пребывания.']","Нет, неправда. При бронировании гостиницы по карте не требуется сообщать ПИН-код. Обычно для бронирования запрашивают ваше имя, номер карты, срок ее действия, иногда трехзначный код безопасности (CVV/CVC) с оборотной стороны карты и планируемый срок пребывания.","При бронировании гостиницы по карте вам необходимо сообщить следующие реквизиты: ваше имя, номер карты, срок ее действия, и иногда трехзначный код безопасности, который находится на обратной стороне карты на полосе для подписи. Не требуется сообщать ПИН-код карты при бронировании номера в гостинице."
"Если я из другой страны и у меня нет паспорта РФ, что мне делать?","['\n                     1. Документы и сведения, получаемые в целях идентификации Клиентов-физических лиц, а также в целях обслуживания таких Клиентов в рамках Универсального договора\n                     1.4. Реквизиты документа, удостоверяющего личность: серия (при наличии) и номер документа, дата выдачи документа, наименование органа, выдавшего документ (при наличии кода подразделения может не устанавливаться), и код подразделения (при наличии).\n                     1.4.2.для иностранных граждан:\n                     •паспорт иностранного гражданина;\n                     •дипломатический паспорт, служебный паспорт, удостоверяющие личность иностранного гражданина.', '.5.Документ, подтверждающий право иностранного гражданина или лица без гражданства на пребывание (проживание) в Российской Федерации (миграционной карты в случае отсутствия иных документов), в случае если наличие таких документов обязательно в соответствии с международными договорами Российской Федерации и законодательством Российской Федерации;Документами, подтверждающими право иностранного гражданина или лица без гражданства на пребывание (проживание) в РФ, являются:\n                    •миграционная карта в случае отсутствия иных документов;\n                    •вид на жительство;\n                    •разрешение на временное проживание;\n                    •виза;\n                    •иной документ, подтверждающий в соответствии с международными договорами Российской Федерации и законодательством РФ право иностранного гражданина или лица без гражданства на пребывание (проживание) в РФ.\n']","
                        Если вы из другой страны, то для заключения договора вам неообходимы документы, удостоверяющие Вашу личность. Для иностранных граждан это:
                            •паспорт иностранного гражданина;
                            •дипломатический паспорт, служебный паспорт, удостоверяющие личность иностранного гражданина.
                        Также необходимы документы, подтверждающие право иностранного гражданина (проживание) в Российской Федерации (миграционной карты в случае отсутствия иных документов), в случае если наличие таких документов обязательно в соответствии с международными договорами Российской Федерации и законодательством Российской Федерации;Документами, подтверждающими право иностранного гражданина или лица без гражданства на пребывание (проживание) в РФ, являются:
                            •миграционная карта в случае отсутствия иных документов;
                            •вид на жительство;
                            •разрешение на временное проживание;
                            •виза;
                            •иной документ, подтверждающий в соответствии с международными договорами Российской Федерации и законодательством РФ право иностранного гражданина или лица без гражданства на пребывание (проживание) в РФ. ","Если вы из другой страны и у вас нет паспорта РФ, вам необходимо сообщить об этом в Банк через дистанционное обслуживание и оформить претензию. Сотрудник Банка поможет вам в этом."
В течении скольких дней действительна выписка из ЕГРЮЛ?,"['\n                    2.2. Выписка из Единого государственного реестра юридических лиц (ЕГРЮЛ). Банком может быть принята копия \n                    выписки, заверенная регистрирующим органом. Выписка считается действительной для предоставления в Банк \n                    в течение 30 (тридцати) календарных дней с даты ее выдачи и должна содержать актуальные сведения на дату  \n                    ее предоставления;']",Выписка из Единого государственного реестра юридических лиц (ЕГРЮЛ) действительна в течении 30 дней с даты ее выдачи.,Выписка из ЕГРЮЛ считается действительной для предоставления в Банк в течение 30 (тридцати) календарных дней с даты ее выдачи и должна содержать актуальные сведения на дату ее предоставления.
Нужно ли ИП указывать свой сайт для предприятия?,"['\n                    3. Документы и сведения, предоставляемые Клиентом-индивидуальным предпринимателем: \n                    3.5. Сведения о доменном имени, указателе страницы сайта в сети «Интернет», с использованием которых Клиентом \nоказываются услуги (при наличии);\n                    ']","Да, индивидуальному предпринимателю необходимо указать сведения о доменном имени, указателе страницы сайта в сети «Интернет».","Да, ИП должен указать свой сайт для предприятия в сведениях о доменном имени и указателе страницы сайта в сети ""Интернет"", предоставляемых банку в соответствии с установленным порядком предоставления документов и сведений."
Может ли Банк запросить дополнительные документы - не из списка обязательных?,"['\n                     26. Банк может запросить у Клиента, а Клиент обязуется предоставить по запросу Банка дополнительные документы \n                    и сведения, как предусмотренные, так и не предусмотренные настоящим Перечнем, в том числе в целях надлежащей \n                    идентификации Клиента, его представителя, выгодоприобретателя и бенефициарного владельца в соответствии \n                    с требованиями действующего законодательства Российской Федерации, нормативных актов Банка России, а также \n                    требованиями Банка. Банк вправе не запрашивать отдельные документы и сведения, предусмотренные настоящим \n                    Перечнем, в случаях, установленных внутренними правилами Банка.']","Да, Банк может запросить у Вас дополнительные не предусмотренные Перечнем документы.","Да, банк Tinkoff имеет право запросить у клиента дополнительные документы и сведения, как предусмотренные, так и не предусмотренные в перечне, в том числе в целях надлежащей идентификации клиента, его представителя, выгодоприобретателя и бенефициарного владельца в соответствии с требованиями законодательства Российской Федерации, нормативных актов Банка России и требованиями самого банка. Банк имеет право не запрашивать отдельные документы и сведения, предусмотренные в перечне, в случаях, установленных внутренними правилами банка."
Какие документы нужно предоставить физическому лицу для открытия счета?,"['1. Документы и сведения, получаемые в целях идентификации Клиентов-физических лиц, а также в целях обслуживания таких Клиентов в рамках Универсального договора']","Физическому лицу для открытия счета необходимо предоставить документ, удостоверяющий личность (паспорт или иной документ из списка в п.1.4), документ, подтверждающий регистрацию или место пребывания, ИНН, СНИЛС и контактную информацию.","Для открытия счета физическому лицу необходимо предоставить следующие документы:
1. Документы, удостоверяющие личность, указанные в пункте 1.4 настоящего Перечня.
2. Сведения о финансовом положении, установленные пунктом 2.15 настоящего Перечня документов.
3. Сведения об источниках происхождения денежных средств и (или) иного имущества в случае реализации Банком права, предусмотренного Федеральным законом от 07.08.2001 № 115-ФЗ.

Эти документы и сведения необходимы для успешного открытия счета физическому лицу в банке Tinkoff."
Какие документы необходимо предоставить юридическому лицу для открытия счета в Банке? Можно ли предоставить сканы документов или нужны оригиналы?,"['2.1. Учредительные документы юридического лица...', '2.2. Выписка из Единого государственного реестра юридических лиц (ЕГРЮЛ)...', '2.3. Документ об избрании единоличного исполнительного органа юридического лица...']","Юридическому лицу необходимо предоставить учредительные документы, выписку из ЕГРЮЛ, документ об избрании руководителя, документы, подтверждающие личность руководителя и лиц, имеющих право подписи. Документы можно предоставить в копиях, заверенных нотариально, регистрирующим органом, руководителем или сотрудником Банка при наличии оригиналов.","Для юридического лица необходимо предоставить следующие документы для открытия счета в банке Tinkoff:
1. Учредительные документы юридического лица: Устав юридического лица и/или Учредительный договор.
2. Выписка из Единого государственного реестра юридических лиц (ЕГРЮЛ).

Документы можно предоставить в виде сканов, но в некоторых случаях банк может запросить оригиналы для верификации. В любом случае, рекомендуется уточнить требования банка относительно предоставления документов."
Можно ли открыть счет индивидуальному предпринимателю – иностранному гражданину? Какие документы для этого нужны?,"['3.1. Идентификация индивидуального предпринимателя осуществляется на основании документов и сведений, указанных в пункте 1.4 настоящего Перечня', '3.2. Документ, подтверждающий право иностранного гражданина или лица без гражданства на пребывание (проживание) в Российской Федерации...']","Да, индивидуальному предпринимателю-иностранному гражданину можно открыть счет. Для этого нужно предоставить документ, удостоверяющий личность, документ, подтверждающий право пребывания/проживания в РФ (напр. миграционную карту), ИНН, СНИЛС, выписку из ЕГРИП и контактную информацию.","Для открытия счета индивидуальному предпринимателю – иностранному гражданину необходимо предоставить ряд документов. В частности, для идентификации бенефициарного владельца осуществляется на основании следующих документов и сведений:
- Документы, удостоверяющие личность и указанные в пункте 1.4 настоящего Перечня;
- В отношении физического лица, которое является иностранным гражданином или лицом без гражданства — документ, подтверждающий право иностранного гражданина или лица без гражданства на пребывание (проживание) в Российской Федерации, в случае если наличие такого документа предусмотрено законодательством Российской Федерации в соответствии с пунктом 1.5 настоящего Перечня.

Таким образом, для открытия счета индивидуальному предпринимателю – иностранному гражданину потребуется предоставить документы, подтверждающие личность и право на пребывание в Российской Федерации."
"Какие документы потребуются, если открывать счет для нотариуса, занимающегося частной практикой? Может ли нотариус быть иностранцем при этом?","['5.1. Документ, удостоверяющий личность и указанный в пункте 1.4 настоящего Перечня', '5.2. Документ, подтверждающий наделение нотариуса полномочиями (назначение на должность), выдаваемый органами юстиции субъектов Российской Федерации, в соответствии с законодательством Российской Федерации']","Для открытия счета нотариусу, занимающемуся частной практикой, требуется предоставить документ, удостоверяющий личность, документ о назначении на должность нотариуса от органов юстиции, регистрационные документы, финансовые документы и контактные данные. Нотариус может быть иностранцем, в этом случае дополнительно потребуется документ, подтверждающий право на пребывание/проживание в РФ.","Для открытия счета для нотариуса, занимающегося частной практикой, требуются следующие документы и сведения, согласно предоставленному контексту:

1. Документ, удостоверяющий личность нотариуса.
2. Документ, подтверждающий наделение нотариуса полномочиями, выдаваемый органами юстиции субъектов Российской Федерации.
3. Адрес места жительства или места пребывания нотариуса.
4. Контактная информация (номер телефона, факс, адрес электронной почты, почтовый адрес).
5. Выписка из ЕГРИП.
6. Информация о страховом номере индивидуального лицевого счета.

Кроме того, если нотариус является иностранным гражданином, ему также потребуется предоставить миграционную карту и/или документ, подтверждающий его право на пребывание (проживание) в Российской Федерации, если такое требование предусмотрено законодательством Российской Федерации."
"Как узнать, кто является бенефициарным владельцем юридического лица? Какие документы для этого нужны?",['12. Идентификация бенефициарного(ых) владельца(ев) осуществляется на основании следующий документов и сведений...'],"Для идентификации бенефициарного владельца юридического лица необходимо предоставить документы, удостоверяющие личность бенефициара, документ о регистрации/пребывании в РФ (если бенефициар - иностранец), ИНН, адрес регистрации и контактные данные. Также можно заполнить анкету бенефициарного владельца по форме Банка.","Для того чтобы узнать, кто является бенефициарным владельцем юридического лица, необходимо осуществить идентификацию на основании Анкеты физического лица — бенефициарного владельца по форме Банка, подписанной Клиентом. В случае если бенефициарный владелец является иностранным гражданином или лицом без гражданства, или возникают сомнения в достоверности полученной информации, идентификация осуществляется на основании соответствующих документов и сведений, без использования анкеты бенефициарного владельца по форме Банка."
Расскажи про термины 'Договор страхования' и 'КАСКО',"['1. Термины и определения     \n                    Договор страхования — договор, по которому одна сторона (Страховщик) обязуется за обусловленную договором \n                    плату (страховую премию) при наступлении предусмотренного в договоре события (страхового случая) осуществить \n                    другой стороне (страхователю) или иному лицу, в пользу которого заключен договор (выгодоприобретателю), \n                    страховое возмещение в пределах определенной договором суммы (страховой суммы).', 'КАСКО — комбинированное страхование транспортных средств и сопутствующих рисков.']"," Да, конечно! Договор страхования — это договор, по которому одна сторона (Страховщик) обязуется за обусловленную договором 
                    плату (страховую премию) при наступлении предусмотренного в договоре события (страхового случая) осуществить 
                    другой стороне (страхователю) или иному лицу, в пользу которого заключен договор (выгодоприобретателю), 
                    страховое возмещение в пределах определенной договором суммы (страховой суммы). 
                    КАСКО — это комбинированное страхование транспортных средств и сопутствующих рисков.","Договор страхования - это договор, по которому одна сторона (Страховщик) обязуется при наступлении страхового случая осуществить страховое возмещение другой стороне (страхователю) или выгодоприобретателю в пределах определенной суммы. КАСК - это комбинированное страхование транспортных средств и сопутствующих рисков."
"Какой минимум страховой выплаты мне вернут, если моя страховая сумма = 50 000 долларов?"," 
                    2.19.   При добровольном страховании непредвиденных расходов путешественников страховая сумма в договоре 
                    страхования может быть установлена в рублях или иностранной валюте в рублевом эквиваленте по официальному 
                    курсу иностранных валют ЦБ РФ на дату заключения Договора страхования, но не менее чем 66,7 руб. за 1 у.е.  при 
                    страховой сумме 30 000 у.е., 57,2 руб. за 1 у.е. при страховой сумме 35 000 у.е., 50 руб. за 1 у.е. при страховой сумме 
                    50 000 у.е., 26,7 руб. за 1 у.е. при страховой сумме 75 000 у.е."," 
                    Минимальная страховая выплата, которую вам вернут, если ваша страховая сумма составляет 50 000 долларов, составляет 50 рублей за 1 доллар США. Минимальная выплата составит 2 500 000 рублей.
                    Обратите внимание, что это минимальная выплата, которую вы получите. Фактическая сумма выплаты может варьироваться в зависимости от условий вашего договора.
        ","Минимальная страховая выплата в случае, если страховая сумма установлена в 50 000 долларов, составит 10 000 российских рублей за один страховой случай."
"При принятии пользовательских соглашений, кому еще попадают мои данные?","['\n                    5. Персональные данные     \n                        5.1.       Пользователь подтверждает, что с использованием Дистанционных каналов взаимодействия дает Страховщику, \n                        аффилированным лицам страховщика, Страховому агенту или Страховому брокеру, а также лицам, \n                        предоставляющим услуги по использованию их информационных возможностей для целей заключения договоров \n                        страхования, хранения документов, в том числе, облачных сервисов, серверов, программных продуктов, согласие на \n                        обработку его персональных данных с целью осуществления дистанционного взаимодействия с последними при \n                        использовании их Сайта и/или сайтов в сети Интернет или при помощи ПО Страховщика и в целях осуществления \n                        маркетинговых коммуникаций перечисленных лиц с Пользователем.  \n        ']","
                    Согласно пункту 5.1 пользовательского соглашения, ваши персональные данные могут быть переданы следующим сторонам:
                        • Аффилированные лица страховщика
                        • Страховой агент
                        • Страховой брокер
                        • Лица, предоставляющие услуги по использованию их информационных возможностей для целей заключения договоров страхования, хранения документов, в том числе облачных сервисов, серверов, программных продуктов
","При принятии пользовательских соглашений, ваши данные могут попасть к страховщику, аффилированным лицам страховщика, страховому агенту, страховому брокеру, а также лицам, предоставляющим услуги по использованию их информационных возможностей для целей заключения договоров страхования, хранения документов и осуществления маркетинговых коммуникаций. Пользовательские данные третьих лиц предоставляются с их согласия на обработку персональных данных."
Зачем страховщик ведет аудио и видеозапись при взаимодействии с клиентом? Как долго эти записи хранятся?,"['При заключении Договоров страхования, а также при ином обращении Клиента или Пользователя к Страховщику или его представителям Страховщик вправе осуществлять наблюдение, фотографирование, аудио- и видеозапись, включая запись телефонных разговоров, а также копирование и хранение переписок между Пользователем и Страховщиком (его представителями) по электронной почте или в мессенджерах, без дополнительного уведомления Клиента (Пользователя) о такой записи. Клиент соглашается, что Страховщик вправе хранить такие записи в течение 5 (пяти) лет с момента прекращения отношений с Клиентом (Пользователем), с целью улучшения качества обслуживания, исполнения Договора страхования, а также использовать их при проведении любых расследований в связи с Договором страхования.']","Страховщик ведет аудио, видеозапись, фотографирование, копирует переписку с клиентом без дополнительного уведомления с целью улучшения качества обслуживания, исполнения договора страхования, а также для использования этих записей при проведении расследований, связанных с договором. Такие записи страховщик вправе хранить в течение 5 лет с момента прекращения отношений с клиентом.","Страховщик ведет аудио и видеозапись при взаимодействии с клиентом с целью улучшения качества обслуживания, исполнения Договора страхования, а также использования записей при проведении расследований в связи с Договором страхования. Эти записи хранятся в течение 5 лет с момента прекращения отношений с клиентом, согласно условиям пользовательского соглашения банка Tinkoff."
В каких случаях застрахованному могут быть оплачены планируемые расходы по страховому случаю до предоставления подтверждающих документов? Какие ограничения есть по размеру таких выплат?,"['По договорам добровольного страхования непредвиденных расходов путешественников по предварительному согласованию со Страховщиком Застрахованному могут оплачиваться планируемые расходы по предусмотренным договором страхования страховым событиям, предусматривающим возмещение расходов на оказание Экстренной или Неотложной амбулаторной и/или стационарной помощи, с условием предоставления Застрахованным документов, подтверждающих такие расходы Страховщику непосредственно после их несения (чеки, платежные документы и пр.). В случае если в результате страхового случая Застрахованным лицом были понесены соответствующие расходы на оказание Экстренной или Неотложной амбулаторной и/или стационарной помощи, в том числе, предварительно согласованные Страховщиком, но не были предоставлены документы, подтверждающие их оплату, Страховщик возмещает расходы в размере не более 200 у.е. (если страховая сумма установлена в валюте, отличной от российского рубля) или 10 000 российских рублей (если страховая сумма установлена в российских рублях), за один страховой случай.']","По договорам добровольного страхования непредвиденных расходов путешественников застрахованному могут быть оплачены планируемые расходы по страховым случаям, предусматривающим возмещение расходов на экстренную/неотложную амбулаторную или стационарную помощь, по предварительному согласованию со страховщиком. Условие - предоставление подтверждающих документов сразу после несения расходов. Если документы не предоставлены, то страховщик возмещает расходы в размере не более 200 у.е. (если страховая сумма в валюте) или 10 000 рублей (если в рублях) за один случай.","Застрахованному могут быть оплачены планируемые расходы по страховому случаю до предоставления подтверждающих документов в случае, если были понесены расходы на оказание экстренной или неотложной амбулаторной и/или стационарной помощи, в том числе предварительно согласованные со Страховщиком, но не были предоставлены документы, подтверждающие оплату. Однако размер таких выплат ограничен - не более 200 у.е. (если страховая сумма установлена в валюте, отличной от российского рубля) или 10 000 российских рублей (если страховая сумма установлена в российских рублях) за один страховой случай."
Куда пользователь может направить обращение при возникновении вопросов или спора со страховщиком?,"['При возникновении вопросов или спора можно отправить обращение:\n\nв АО «Тинькофф Страхование» по почте по адресу: 127287, Российская Федерация, г. Москва, ул. 2-я Хуторская, дом 38А, строение 26, либо путем заполнения соответствующей формы на сайте Страховщика;\nк финансовому уполномоченному путем регистрации обращения на сайте — finombudsman.ru или по почтовому адресу: 119017, г. Москва, Старомонетный пер., дом 3;\nво Всероссийский союз страховщиков на сайте — ins-union.ru, приложив к обращению необходимые документы и сведения, либо на почтовый адрес: 115093, г. Москва, ул. Люсиновская, д. 27, стр. 3;\nв Центральный Банк Российской Федерации (Банк России) через интернет-приемную на официальном сайте — cbr.ru, приложив к обращению необходимые документы и сведения, либо на почтовый адрес: 107016, г. Москва, ул. Неглинная, д. 12.']","При возникновении вопросов или спора с АО 'Тинькофф Страхование' пользователь может направить обращение:

 - В АО 'Тинькофф Страхование' по почте или через форму на сайте;
 - Финансовому уполномоченному на сайте finombudsman.ru или почтовым адресом;
 - Во Всероссийский союз страховщиков на сайте ins-union.ru или почтовым адресом;
В Центральный Банк РФ через интернет-приемную на сайте cbr.ru или почтовым адресом.","Пользователь может направить обращение при возникновении вопросов или спора со страховщиком следующим образом:
- в АО «Тинькофф Страхование» по почте по адресу: 127287, Российская Федерация, г. Москва, ул. 2-я Хуторская, дом 38А, строение 26, либо путем заполнения соответствующей формы на сайте Страховщика;
- к финансовому уполномоченному путем регистрации обращения на сайте — ﬁnombudsman.ru или по почтовому адресу: 119017, г. Москва, Старомонетный пер., дом 3;
- во Всероссийский союз страховщиков на сайте — ins-union.ru, приложив к обращению необходимые документы и сведения, либо на почтовый адрес: 115093, г. Москва, ул. Люсиновская, д. 27, стр. 3;
- в Центральный Банк Российской Федерации (Банк России) через интернет-приемную на официальном сайте — cbr.ru, приложив к обращению необходимые документы и сведения, либо на почтовый адрес: 107016, г. Москва, ул. Неглинная, д. 12."
Где можно ознакомиться с дополнительной информацией и документами о деятельности АО 'Тинькофф Страхование'?,"['Дополнительная информация и документы о деятельности Страховщика в соответствии с п. 6.1 Закона РФ от 27.11.1992 N 4015-1 «Об организации страхового дела в Российской Федерации» и п. 2.1.1. «Базового стандарта защиты прав и интересов физических и юридических лиц — получателей финансовых услуг, оказываемых членами саморегулируемых организаций, объединяющих страховые организации» размещены по ссылкам: tinkoffinsurance.ru/about, tinkoffinsurance.ru/about/documents.']",Дополнительная информация и документы о деятельности АО 'Тинькофф Страхование' в соответствии с законом 'Об организации страхового дела в РФ' и базовым стандартом защиты прав получателей финансовых услуг размещены на сайте страховщика по ссылкам tinkoffinsurance.ru/about и tinkoffinsurance.ru/about/documents.,"Вы можете ознакомиться с дополнительной информацией и документами о деятельности АО ""Тинькофф Страхование"" на официальном сайте компании или отправив обращение по почте по указанному адресу: 127287, Российская Федерация, г. Москва, ул. 2-я Хуторская, дом 38А, строение 26. Также вы можете обратиться к финансовому уполномоченному на сайте finombudsman.ru или по почтовому адресу: 119017, г. Москва, Старомонетный пер., дом 3."
Что означает 'Партия' и вообще 'Слиток' для драгоценных металлов?,"['\n                    Партия — приобретенные Клиентом Слитки в количестве, превышающем 1 (одну) штуку, и подлежащие доставке Клиенту, \n                    в рамках одной Заявки', ' Слиток — аффинированный драгоценный металл: золото, серебро, платина и палладий в виде слитков (стандартных, \n                    мерных), соответствующих установленным в Российской Федерации стандартам или международным стандартам качества, \n                    изготовленных и маркированных организацией, осуществляющей аффинаж драгоценного металла. Слиток в рамках \n                    предоставления Сервиса доставляется / принимается на хранение в ненарушенной Упаковке с приложением Сертификата-\n                    ярлыка (при наличии) и Сертификата качества слитка']","Давайте разберемся! 
                    Партия — это приобретенные клиентом слитки в количестве, превышающем 1 штуку, и подлежащие доставке клиенту, в рамках одной заявки.
                    Слиток — это аффинированный драгоценный металл: золото, серебро, платина и палладий в виде слитков (стандартных, 
                    мерных), соответствующих установленным в Российской Федерации стандартам или международным стандартам качества, 
                    изготовленных и маркированных организацией, осуществляющей аффинаж драгоценного металла. Слиток в рамках 
                    предоставления Сервиса доставляется / принимается на хранение в ненарушенной Упаковке с приложением Сертификата-
                    ярлыка (при наличии) и Сертификата качества слитка.
        ","Согласно извлеченному контексту, термин ""Партия"" означает приобретенные клиентом слитки в количестве, превышающем 1 штуку, и подлежащие доставке клиенту в рамках одной заявки. Таким образом, ""Партия"" для драгоценных металлов представляет собой группу приобретенных слитков, которые будут доставлены клиенту в рамках одной заявки."
Меня действительно должны фотографировать после полкчения слитка? Какой это пункт в соглашении?,"['\n                    2.13.12. После подтверждения получения Клиентом/Доверенным лицом Слитка Представитель фотографирует Клиента/\n                    Доверенное лицо с полученным Слитком в ненарушенной заводской упаковке и документом, удостоверяющим личность \n                    Клиента/Доверенного лица']","Да, Вас действительно должнен сфотографировать Представитель в соответсвии с пунктом 2.13.12.","Пункт 2.20 пользовательского соглашения банка Tinkoff устанавливает, что при заключении Договоров страхования, а также при ином обращении Клиента или Пользователя к Страховщику или его представителям, Страховщик вправе осуществлять наблюдение, фотографирование, аудио- и видеозапись без дополнительного уведомления Клиента (Пользователя) о такой записи. Поэтому, в соответствии с этим пунктом, вас действительно могут фотографировать после получения слитка без вашего дополнительного уведомления."
Какие условия хранения?,"[' \n                    2.14.9. Условия хранения: температура воздуха от +17 до +25 °С, атмосферное давление от 740 до 760 мм рт. ст., относительная \n                    влажность воздуха от 30 до 60%']","
                    В соответсвии с пунктом 2.14.9. условия хранения слитка слудующие: 
                        - температура воздуха от +17 до +25 °С,
                        - атмосферное давление от 740 до 760 мм рт. ст.,
                        - относительная влажность воздуха от 30 до 60% ","Условия хранения слитков драгоценных металлов в банке Tinkoff включают следующие параметры: 
- температура воздуха должна быть от +17 до +25 °C,
- атмосферное давление должно быть от 740 до 760 мм рт. ст.,
- относительная влажность воздуха должна быть от 30 до 60%.

Кроме того, банк имеет право изменить условия и место хранения слитков с письменного согласия клиента или без него в случае обстоятельств непреодолимой силы, производства обыска или выемки в соответствии с законодательством Российской Федерации, а также в других случаях, предусмотренных законодательством. Клиент также обязан получить слиток самостоятельно или через доверенное лицо в соответствии с установленными правилами."
Что такое 'Сертификат качества слитка'?,"['Сертификат качества слитка — документ о качестве драгоценного металла, содержащий сведения о соответствии драгоценного металла стандартам качества, технические характеристики и параметры Слитка, информацию о химическом составе, произведенный/заверенный предприятием-изготовителем Слитка.']","Сертификат качества слитка - это документ, выданный изготовителем слитка драгоценного металла, который содержит информацию о соответствии металла стандартам качества, его технические характеристики, параметры и химический состав.","Сертификат качества слитка - это документ о качестве драгоценного металла, который содержит информацию о соответствии драгоценного металла стандартам качества, технические характеристики и параметры слитка, а также информацию о химическом составе. Этот документ производится или заверяется предприятием-изготовителем слитка и является важным элементом при покупке, продаже или хранении драгоценных металлов."
На какой срок выдается эта доверенность? Можно ли ее передоверить другому лицу?,"['Датой выдачи доверенности считается дата предоставления Представляемым Банку данных своего представителя. Доверенность выдана сроком на 1 (один) год, полномочия по настоящей доверенности не могут быть передоверены другим лицам.']",Доверенность выдается сроком на 1 год. Полномочия по этой доверенности нельзя передоверять другим лицам.,Доверенность выдается на срок 1 (один) год. Полномочия по данной доверенности не могут быть передоверены другим лицам.
"Как клиент может получить сертификат качества слитка, который он передал на хранение в банк?","['По требованию Клиента Банк предоставляет Клиенту заверенную Банком копию Сертификата качества слитка, переданного на ответственное хранение.']","По требованию клиента банк предоставляет ему заверенную копию сертификата качества слитка, который клиент передал на ответственное хранение в банке.","Клиент может получить сертификат качества слитка, который он передал на хранение в банк, путем обращения к банку и запроса заверенной копии сертификата качества слитка. Согласно правилам оказания сервиса ""Покупка/продажа слитков драгоценных металлов"", банк обязуется предоставить клиенту заверенную копию сертификата качества слитка, переданного на ответственное хранение, по требованию клиента. Таким образом, клиент может получить сертификат качества слитка, просто обратившись в банк и запросив соответствующий документ."
Какие условия хранения слитков в банке? Где их хранят?,"['Хранение Банком Слитка Клиента осуществляется в хранилище 5 (Пятого) класса устойчивости к взлому, оборудованном системой видеонаблюдения и охранно-пожарной и тревожной сигнализации с выводом сигнала на пункт централизованной охраны, с осуществлением физической круглосуточной специализированной охраны хранилища.', 'Условия хранения: температура воздуха от +17 до +25 °С, атмосферное давление от 740 до 760 мм рт. ст., относительная влажность воздуха от 30 до 60%.']","Слитки хранятся в специальном хранилище 5 класса устойчивости к взлому, оборудованном системами видеонаблюдения, охранно-пожарной и тревожной сигнализацией, а также круглосуточной охраной. Условия хранения: температура +17...+25°С, атмосферное давление 740-760 мм рт.ст., влажность 30-60%.","Условия хранения слитков в банке Tinkoff следующие: слитки хранятся в хранилище 5 класса устойчивости к взлому, оборудованном системой видеонаблюдения и охранно-пожарной и тревожной сигнализации. Условия хранения включают в себя температуру воздуха от +17 до +25 °C, атмосферное давление от 740 до 760 мм рт. ст., и относительную влажность воздуха от 30 до 60%. Банк вправе изменить условия и место хранения слитков без уведомления клиента в случаях обстоятельств непреодолимой силы, производства обыска или выемки в соответствии с законодательством Российской Федерации, а также в других случаях, предусмотренных законодательством."
"Можно ли вернуть слиток в банк, если при получении были обнаружены его повреждения? Как это сделать?","['В случае обнаружения при приеме Слитка с ответственного хранения от Представителя нарушения целостности заводской упаковки Слитка, несоответствия нанесенной на Слиток маркировки данным, указанным в Сертификате качества слитка и/или Сертификате-ярлыке, отсутствия либо повреждения Сертификата качества слитка и/или Слитка (наличие на поверхности Слитка наплывов / заусенцев / царапин / жировых пятен / посторонних включений) Клиентом/Доверенным лицом и Представителем оформляется в двух экземплярах Рекламационный акт по форме Приложения № 3 к настоящим Правилам, в котором фиксируются указанные выше нарушения / несоответствия / повреждения. В случае наличия указанных выше нарушений / несоответствий / повреждений Слиток вместе с Сертификатом качества слитка и Сертификатом-ярлыком вкладываются Клиентом/Доверенным лицом в порожний сейф-пакет и запечатываются, после чего сейф-пакет помещается в Устройство для перевозки слитка с дальнейшим опломбированием номерной разовой пломбой. Номер сейф-пакета, а также номерной разовой пломбы отражаются в Рекламационном акте.']","Да, если при получении слитка с хранения были обнаружены его повреждения или нарушения упаковки, несоответствия маркировки и т.п., то клиент/доверенное лицо вместе с представителем банка оформляют рекламационный акт в двух экземплярах. В этом акте фиксируются все нарушения. После этого слиток вместе с сертификатами запечатывают в новый сейф-пакет и опломбировывают, указав номера на рекламационном акте. Затем слиток возвращается обратно в банк.","В случае обнаружения повреждений при приеме слитка с ответственного хранения от представителя, клиентом/доверенным лицом и представителем оформляется рекламационный акт по форме Приложения № 3 к правилам оказания сервиса ""Покупка/продажа слитков драгоценных металлов"". В этом акте фиксируются все выявленные нарушения, несоответствия или повреждения. После оформления рекламационного акта, слиток вместе с сертификатом качества слитка и сертификатом-ярлыком вкладывается клиентом/доверенным лицом в порожний сейф-пакет, который запечатывается и помещается в устройство для перевозки слитка с дальнейшим опломбированием номерной разовой пломбой. Банк рассматривает рекламационный акт в течение 5 рабочих дней с даты оформления. По результатам рассмотрения, банк обязан связаться с клиентом и предоставить новый слиток или вернуть старый слиток в течение 5 рабочих дней, если выявленные нарушения не были подтверждены по итогам проверки банка."
Кто может стать доверенным лицом?,"['Доверенное лицо — физическое лицо, уполномоченное Клиентом, которому предоставлено право на представление интересов Клиента и осуществление действий от его имени в рамках Сервиса на основании доверенности, оформленной посредством Дистанционного обслуживания в соответствии с п. 5.3 настоящих Правил по форме Приложения № 5 к настоящим Правилам.']","Доверенным лицом клиента может стать любое физическое лицо, которому клиент предоставит полномочия представлять его интересы в рамках сервиса покупки/продажи слитков драгоценных металлов. Доверенность на это лицо оформляется клиентом посредством дистанционного обслуживания в банке по форме из Приложения №5 к Правилам.","Доверенным лицом может стать лицо, которое получило полномочия от страхователя на совершение определенных действий, связанных с заключением или исполнением договора страхования. Полномочия должны быть подтверждены соответствующим документом, таким как доверенность или иной документ, признаваемый таковым. При этом доверенность должна содержать прямое указание на необходимые для совершения сделки полномочия представителя и действовать на момент заключения сделки."
Можно ли поменять доверенное лицо? Как это сделать?,"['Клиент может отменить выданную доверенность путем обращения в Банк посредством Дистанционного обслуживания в любое время, но не позднее одного дня до планируемой даты встречи с представителем Клиента.']","Да, клиент может отменить ранее выданную доверенность на доверенное лицо. Для этого он должен обратиться в банк посредством дистанционного обслуживания не позднее чем за 1 день до планируемой даты встречи с действующим доверенным лицом.","Да, можно поменять доверенное лицо. Для этого необходимо обратиться в Банк посредством дистанционного обслуживания и оформить соответствующую претензию. Сотрудники Банка помогут вам в этом процессе."
Как происходит покупка слитка банком? Есть ли какие-то особые условия?,"['Банк приобретает у Клиента только Слитки, находящиеся на ответственном хранении в Банке.', 'Клиент, обращаясь с Заявкой, подтверждает, что на момент заключения договора купли-продажи Слиток принадлежит на праве собственности Клиенту, не продан, не является предметом залога, не обременен правами третьих лиц, в споре, под арестом и иным запрещением не состоит.']","Банк осуществляет покупку слитков драгоценных металлов только у тех клиентов, чьи слитки находятся на ответственном хранении в самом банке. При подаче заявки на продажу слитка клиент должен подтвердить, что на момент продажи слиток принадлежит ему на праве собственности, не продан, не заложен, не арестован и не обременен правами третьих лиц.","Покупка слитка банком происходит следующим образом: Банк приобретает у клиента только слитки, которые находятся на ответственном хранении в банке. Заявки на совершение сделки купли-продажи слитка принимаются Банком в рабочие дни в определенное время. Клиент подтверждает, что слиток принадлежит ему на праве собственности, не продан, не заложен, не обременен правами третьих лиц, не находится в споре, под арестом или иным запрещением. Масса слитка, номер, цена за грамм драгоценного металла и итоговая стоимость согласовываются между клиентом и банком. После согласования заявки, банк направляет клиенту ключ простой электронной подписи и информацию о слитке. Клиент подтверждает свое согласие и подписывает акт приема-передачи. Зачисление стоимости слитка на картсчет клиента происходит после подписания документов. Договор купли-продажи слитка заключается на условиях, установленных правилами и законодательством России."
Что такое накопительный счет и как начисляются проценты?,"['\n                    3.1. Начисление процентов на остаток средств по Счету вклада/Накопительному счету производится со дня, следующего \n                    за днем зачисления денежных средств на Счет вклада/Накопительный счет Клиента, до дня окончания срока Вклада \n                    (включительно) либо до их списания со Счета вклада/Накопительного счета по иным основаниям.', ' \n                    3.3. Клиент имеет возможность по согласованию с Банком посредством Дистанционного обслуживания изменить Тарифный \n                    план Вклада на Тарифный план для мультивалютного Вклада. При смене Тарифного плана изменения в части процентной \n                    ставки по Счету вклада, изначально открытого в рамках текущего Договора вклада, не распространяются до конца срока \n                    размещения, установленного предыдущим Тарифным планом. Процентные ставки по валютам, отличным от валюты \n                    измененного Тарифного плана, устанавливаются новым Тарифным планом.\n                    3.4. При начислении процентов в расчет принимается величина процентной ставки (в процентах годовых) и фактическое \n                    количество календарных дней, на которое привлечены денежные средства. При этом за базу берется действительное \n                    число календарных дней в году (365 или 366 дней соответственно).\n                    ', ' \n                    Накопительный счет — счет, на котором учитываются денежные средства Клиента, предусматривающий начисление \n                    процентов на остаток денежных средств, в соответствии с Договором накопительного счета.']","
                    Накопительный счет - это счет, на котором учитываются денежные средства клиента и на который начисляются проценты на остаток денежных средств. Проценты начисляются в соответствии с условиями договора накопительного счета.
                    Проценты на накопительном счете начисляются со дня, следующего за днем зачисления денежных средств на счет, до дня окончания срока вклада (включительно) либо до их списания со счета по другим основаниям.

                    При начислении процентов учитываются:
                    • Величина процентной ставки (в процентах годовых)
                    • Фактическое количество календарных дней, на которое привлечены денежные средства

                    За базу берется действительное число календарных дней в году (365 или 366 дней соответственно).","Накопительный счет - это счет, на который можно переводить крупные суммы денежных средств для накопления. Проценты на накопительный счет начисляются в соответствии с условиями, установленными банком Tinkoff. Обычно проценты начисляются на остаток средств на счете ежемесячно или по иной установленной банком схеме. Для получения более подробной информации о начислении процентов на накопительный счет, рекомендуется обратиться в отделение банка или связаться с оператором по телефону."
Можно ли открыть вклад в 12 лет?,"['1.2. Банк не заключает Договор вклада (Договор накопительного счета) с лицами, не достигшими возраста 14 лет']","Нет, Банк не заключает договор вклада с лицами, не достигшими возраста 14 лет.","Вопрос о возможности открытия вклада в 12 лет не имеет отношения к предоставленному контексту о правилах обработки персональных данных и ответственности в рамках банковских соглашений. Для получения информации о возможности открытия вклада для лиц моложе 18 лет, рекомендуется обратиться к официальным документам и информации банка Tinkoff или проконсультироваться с представителями банка."
Могу ли я открыть несколько вкладов и пополнять их?,"['\n                    4.1. Клиент имеет право:\n                    4.1.1. Предъявить Банку требование о досрочном полном или частичном изъятии Вклада.\n                    4.1.2. Вносить дополнительные денежные средства во Вклад/Накопительный счет, если данная возможность установлена \n                    Тарифным планом.\n                    4.1.3. Разместить несколько Вкладов (открыть несколько Счетов вклада/Накопительных счетов на условиях, устанавливаемых \n                    Договором вклада (Договором накопительного счета), Тарифами:\n                    • через Дистанционное обслуживание;\n                    • в офисе Банка в часы работы операционного подразделения Банка.\n']"," 
                    Да, вы можете открыть несколько вкладов и пополнять их.
                    Согласно пункту 4.1.3 приведенного контекста, клиент имеет право разместить несколько вкладов (открыть несколько счетов вклада/накопительных счетов) на условиях, устанавливаемых договором вклада (договором накопительного счета) и тарифами.
                    Вы можете открыть несколько вкладов как через дистанционное обслуживание, так и в офисе банка в часы работы операционного подразделения банка.","Да, вы можете открыть несколько вкладов в банке Tinkoff и пополнять их. Для этого вам необходимо обратиться в банк через дистанционное обслуживание и оформить соответствующие документы. Сотрудник банка поможет вам с этим процессом."
Для получения страховой выплаты в случае несчастного случая с летальным исходом нужна ли справка из психушки?,['\n                    6.1. По риску Смерть в результате Несчастного случая должны быть предоставлены следующие документы:\n                    j. Справка из психоневрологического диспансера и наркологического диспансера'],"Да, в таком случае необходимы справки из психоневрологического диспансера и наркологического диспансера.","Для получения страховой выплаты в случае несчастного случая с летальным исходом не требуется предоставление справки из психушки. Вам необходимо предоставить документы, подтверждающие понесенные расходы на оказание Экстренной или Неотложной амбулаторной и/или стационарной помощи, включая чеки, платежные документы и прочее, непосредственно после их несения. В случае если такие расходы были понесены, но не были предоставлены документы, подтверждающие их оплату, страховщик может возместить расходы в соответствии с условиями договора страхования."
Дают ли кредит на автомобиль?,"['3.1. Банк предоставляет Клиенту Кредит на потребительские цели, в том числе на приобретение Товара и/или Автомобиля, в соответствии с законодательством Российской Федерации.']","Да, в соответсвии с пунктом 3.1. Банк предоставляет Клиенту Кредит на потребительские цели, , в том числе на приобретение автомобиля.","Да, банк Tinkoff предоставляет кредиты на автомобили. В случае оформления заявки на кредитный договор для получения кредита на автомобиль посредством дистанционного обслуживания, акцептом договора залога является направление банком клиенту уведомления о принятии имущества в залог."
Распростроняется ли страховое покрытие на смерть в алкогольном опьянении?,"[' \n                    Страховое покрытие по рискам «Смерть» и «Инвалидность» не распространяется на события, произошедшие в результате \n                    и/или в период:\n                    a. действий, совершенных Застрахованным лицом в состоянии алкогольного, наркотического и/или токсического \n                    опьянения; в результате употребления им наркотических, сильнодействующих лекарственных препаратов \n                    и психотропных веществ без предписания врача (или по предписанию врача, но с нарушением указанной  \n                    им дозировки); болезни Застрахованного лица, прямо связанной с наркоманией, токсикоманией, хроническим \n                    алкоголизмом\n                    ']","Нет, страховое покрытие не распространяется на смерть в алкогольном опьянении.",Страховое покрытие не распространяется на смерть в алкогольном опьянении в соответствии с условиями пользовательского соглашения банка Tinkoff.
"Может ли Банк изменить Тарифный план по кредитной карте, и какие условия должны быть соблюдены для этого?","['\n                    Банк вправе в одностороннем порядке изменить Тарифный план, применяемый\nв рамках Договора, и/или заменить его на другой Тарифный план, в том числе при заключении Договора и/или\nна определенный период времени по усмотрению Банка, с целью уменьшения процентной ставки по кредиту\nи/или улучшения иных условий обслуживания при условии, что это не повлечет возникновение новых или увеличение размера существующих денежных обязательств Клиента\n                    ']","Да, Банк может изменить Тарифный план по кредитной карте в одностороннем порядке, но при условии, что это не приведет к возникновению новых или увеличению уже существующих денежных обязательств клиента ","Банк имеет право изменить Тарифный план по кредитной карте, однако для этого должны быть соблюдены условия, установленные в Общих условиях выпуска и обслуживания кредитных карт и Общих условиях открытия, ведения и закрытия счетов физических лиц, а также выпуска и обслуживания расчетных карт. Пользователь должен быть проинформирован об изменениях заранее в установленном порядке, чтобы иметь возможность ознакомиться с новыми условиями и принять решение о дальнейшем использовании кредитной карты."
Можно ли внести частичное досрочное погашение кредита? И как это повлияет на остаток задолженности?,"['«Клиент имеет право досрочно погасить Задолженность с уплатой Банку суммы непогашенного Кредита и начисленных процентов, а также (если применимо) комиссий и плат, предусмотренных Тарифным планом, в любой момент путем зачисления необходимой суммы денежных средств на Картсчет (Счет) и извещения Банка о необходимости проведения досрочного погашения. В случае частичного досрочного погашения уменьшается срок Кредита или сумма Регулярного платежа по выбору Клиента, при этом Клиент не освобождается от оплаты ближайшего Регулярного платежа, а также применимых комиссий и плат, предусмотренных Тарифным планом.», «При обращении Клиента в Банк для совершения частичного досрочного погашения до или в дату оплаты ближайшего Регулярного платежа Клиенту может быть предложено совершить частичное досрочное погашение с погашением ближайшего Регулярного платежа и последующим уменьшением срока Кредита или суммы Регулярного платежа по выбору Клиента.»']","Да, Клиент имеет право совершить частичное досрочное погашение кредита. При этом по выбору Клиента уменьшится либо срок кредита, либо сумма регулярного платежа. Однако Клиент не освобождается от оплаты ближайшего регулярного платежа и применимых комиссий.","Да, можно внести частичное досрочное погашение кредита. При этом уменьшается срок кредита или сумма регулярного платежа по выбору клиента. Клиент не освобождается от оплаты ближайшего регулярного платежа, а также применимых комиссий и плат, предусмотренных тарифным планом. При частичном досрочном погашении уменьшается сумма задолженности, а начисленные проценты включаются в следующий регулярный платеж. В случае полного погашения суммы ближайшего регулярного платежа, клиенту не предъявляется требование об их оплате. При неполном погашении суммы ближайшего регулярного платежа, клиент не освобождается от оплаты соответствующей части суммы, а также применимых комиссий и плат."
Что будет в случае просрочки платежа по кредиту? И какой штраф может быть начислен?,"['«В случае неоплаты платежа Клиент должен уплатить штраф за неоплату Минимального платежа согласно Тарифному плану. Банк рассматривает любой поступивший платеж Клиента как признание Клиентом данного штрафа в размере поступившего платежа, но не более суммы штрафа, определенного в соответствии с Тарифами.»']","В случае неоплаты минимального платежа по кредиту, Клиент должен уплатить штраф в соответствии с Тарифным планом. Размер штрафа определяется Тарифами, и любой поступивший от Клиента платеж Банк будет рассматривать как оплату штрафа в пределах установленной суммы.","В случае просрочки платежа по кредиту вам необходимо сообщить об этом в Банк посредством дистанционного обслуживания и оформить претензию. Сотрудник Банка поможет вам в этом. Штраф за просрочку платежа будет начислен в соответствии с условиями вашего кредитного договора, поэтому рекомендуется своевременно выполнять платежи, чтобы избежать дополнительных расходов."
Можно ли на время приостановить выплаты по кредиту? И как это повлияет на начисление процентов?,"['«На основании обращения Клиента и по согласованию с Банком на период от 1 (одного) до 12 (двенадцати) месяцев возможно приостановление обязанности Клиента по погашению Задолженности, по оплате Регулярных платежей и/или иных платежей. В указанный период Банк вправе приостановить начисление процентов и иных сумм, предусмотренных Договором реструктуризации задолженности.»']","Да, на основании обращения Клиента и по согласованию с Банком возможно приостановить обязанность по погашению задолженности и оплате платежей на срок от 1 до 12 месяцев. В этот период Банк вправе также приостановить начисление процентов и иных сумм по кредиту.","Да, можно на временный период приостановить обязанность по погашению задолженности, выплате регулярных платежей и других платежей по согласованию с Банком на период от 1 до 12 месяцев. В указанный период Банк имеет право приостановить начисление процентов и иных сумм, предусмотренных кредитным договором."
Я хочу оформить дополнительную карту на супругу. Как это сделать? И будет ли она иметь доступ к общему лимиту по кредитке?,"['«3.2. По заявлению Клиента, переданному в Банк на бумажном носителе или через Дистанционное обслуживание, в рамках Договора кредитной карты Банком может быть выпущена одна или несколько дополнительных Кредитных карт.»', '«3.5. Клиент вправе установить лимит для проведения расходных операций с использованием Кредитной карты.»']","Вы можете оформить дополнительную кредитную карту на супругу, подав заявление в банк на бумажном носителе или через дистанционное обслуживание. Дополнительная карта будет иметь доступ к общему лимиту задолженности по вашей основной кредитной карте, однако вы можете установить отдельный лимит для расходных операций по дополнительной карте.","Для оформления дополнительной карты на супругу вам необходимо обратиться в Банк через дистанционное обслуживание и оформить соответствующую заявку. После этого сотрудник Банка поможет вам с этим процессом. При оформлении дополнительной карты на супругу, она будет иметь доступ к общему лимиту по кредитке, если это предусмотрено условиями использования карты."
"А что если я потеряю карту? Сколько у меня есть времени, чтобы ее заблокировать? И как вообще это делается? Через приложение или звонить надо?","['«6.1. При обнаружении утери, кражи или порчи Кредитной карты и/или возникновения подозрений, что Кредитная карта или ее реквизиты, а также ПИН-код, QR-код, Коды доступа, Аутентификационные данные, Абонентский номер, Абонентское устройство могли быть утрачены или похищены, а также в случае изъятия Кредитной карты в банкомате или торгово-сервисном предприятии и в случае изменения имени или фамилии Держателя Клиент должен незамедлительно уведомить Банк по телефонам 8 800 555-10-10 или +7 495 645-59-19 (круглосуточно) и заблокировать Кредитную карту и/или Интернет-Банк и/или Мобильный банк, а также подать заявление о досрочном перевыпуске Кредитной карты.»']","В случае утери или кражи кредитной карты, вы должны незамедлительно уведомить банк по телефонам горячей линии 8 800 555-10-10 или +7 495 645-59-19 (круглосуточно) и заблокировать карту. Также необходимо подать заявление на досрочный перевыпуск новой карты. Чем быстрее вы заблокируете карту, тем меньше риск несанкционированного использования.","При потере карты важно как можно быстрее сообщить об этом в Банк и заблокировать карту. Вы можете заблокировать карту по телефону, через интернет-банк или мобильное приложение Банка. Чем раньше вы это сделаете, тем меньше вероятность несанкционированного использования карты злоумышленниками. После блокировки карту перевыпустить нельзя. Если не уверены, что карту украли, можно установить лимит на операции и запретить покупки через интернет. В случае украденной карты на территории РФ, необходимо заявить об этом в полицию. При краже за границей, следует обратиться в полицию или в консульский отдел посольства Российской Федерации."
"Прочитал тут у вас про блокировку карточки. А если я её забуду забрать в банкомате, что тогда делать?","['«6.1. [...] а также в случае изъятия Кредитной карты в банкомате или торгово-сервисном предприятии и в случае изменения имени или фамилии Держателя Клиент должен незамедлительно уведомить Банк по телефонам 8 800 555-10-10 или +7 495 645-59-19 (круглосуточно) и заблокировать Кредитную карту и/или Интернет-Банк и/или Мобильный банк, а также подать заявление о досрочном перевыпуске Кредитной карты.»']","Если вы забыли карту в банкомате, вам необходимо незамедлительно сообщить об этом в банк по телефонам горячей линии 8 800 555-10-10 или +7 495 645-59-19 и заблокировать кредитную карту, а также подать заявление на ее досрочный перевыпуск. Это позволит предотвратить возможное несанкционированное использование забытой карты третьими лицами.","Если вы забыли забрать карту в банкомате, вам следует обратиться в банк посредством дистанционного обслуживания. Если карта была удержана банкоматом стороннего банка, вам необходимо обратиться в банк, обслуживающий этот банкомат. В случае технического сбоя или промедления с извлечением карты, возможно ее получение при предъявлении документа, удостоверяющего личность. Некоторые сторонние банки могут потребовать письменный запрос из банка, выпустившего карту, для возврата удержанной карты. Помните, что сторонний банк, обслуживающий банкомат, может не возвращать карту, если она была заблокирована ранее вами или банком, выпустившим карту."
"А есть ли какие-то льготные условия, если я захочу приостановить выплаты по кредитке на какое-то время? Например, на ремонт или что-то в этом роде?","['«5.15. На основании обращения Клиента и по согласованию с Банком на период от 1 (одного) до 12 (двенадцати) месяцев возможно приостановление обязанности Клиента по погашению Задолженности, по оплате Минимальных платежей, Регулярных платежей и/или иных платежей. В указанный период Банк вправе приостановить начисление процентов и иных сумм, предусмотренных Договором кредитной карты.»']","Да, в документе указано, что по обращению клиента и по согласованию с банком возможно приостановление обязанности по погашению задолженности, выплате минимальных и регулярных платежей на срок от 1 до 12 месяцев. В этот период банк также может приостановить начисление процентов и других сумм по кредитной карте. Таким образом, вы можете получить льготный период для ремонта или других нужд, обратившись в банк с соответствующим заявлением.","Да, есть возможность приостановить обязанность по погашению задолженности по кредитной карте на период от 1 до 12 месяцев, при условии согласования с банком. В указанный период банк может также приостановить начисление процентов и иных сумм, предусмотренных договором кредитной карты."
Какие процедуры предусмотрены банком для обработки жалоб клиентов?,"['Банк имеет установленные процедуры для обработки и рассмотрения жалоб клиентов, включая регистрацию жалобы, ее анализ и предоставление ответа клиенту в установленные сроки.']","Банк следует четко установленным процедурам для обработки жалоб клиентов, которые включают регистрацию жалобы, ее тщательный анализ и предоставление ответа клиенту в соответствии с установленными сроками.","Банк Tinkoff предусматривает следующие процедуры для обработки жалоб клиентов: клиент может представить письмо по форме Банка с указанием пояснений по каждому документу о причинах невозможности его представления. В случае, если со дня регистрации юридического лица прошло менее 45 календарных дней, пояснительное письмо может не представляться в Банк. Кроме того, клиент может предоставить сведения о деловой репутации в письменной форме от других клиентов Банка или от других кредитных организаций, в которых клиент ранее находился на обслуживании. В случае отсутствия возможности получения сведений в виде документов, клиент может предоставить различные источники информации, такие как письменный отзыв о юридическом лице от контрагента клиента или письмо с описанием бизнеса и структуры компании. Если клиент не может предоставить определенные документы или сведения, он должен представить письмо по форме Банка с пояснениями по каждому документу."
Что происходит с депозитами в случае смерти?,['В случае смерти клиента банк замораживает депозиты до решения вопросов наследства в соответствии с законодательством.'],"После смерти клиента банк замораживает все его депозиты и удерживает их до тех пор, пока не будут решены вопросы наследства в соответствии с действующим законодательством.","В случае смерти клиента, депозиты и другие активы, находящиеся на его счетах в банке Tinkoff, могут быть переданы наследникам в соответствии с наследственным законодательством Российской Федерации. Банк несет ответственность за правильное оформление и передачу наследникам активов умершего клиента в соответствии с законом."
Могу я отказаться от получения уведомлений от банка и как это влияет на его обслуживание?,"['Клиенты имеют право отказаться от получения определенных типов уведомлений от банка, однако это может повлиять на их способность получать своевременную информацию о изменениях условий, сбоях в системе или других важных обновлениях.']","Клиенты могут отказаться от получения определенных типов уведомлений от банка, но это может привести к тому, что они не будут получать важные обновления и информацию своевременно, что может повлиять на их способность управлять своими счетами и услугами эффективно.","Да, вы можете отказаться от получения уведомлений от банка. Однако, важно понимать, что уведомления могут содержать информацию о важных операциях с вашим счетом или картой, а также предупреждения о мошеннической деятельности. Если вы откажетесь от получения уведомлений, это может повлиять на вашу способность оперативно реагировать на подозрительную активность или важные события, связанные с вашими финансами. Поэтому, прежде чем отказываться от уведомлений, обратитесь в банк для получения подробной информации о последствиях такого действия."
Как я могу увеличить лимит по своей кредитной карте?,"['Для увеличения кредитного лимита клиенты должны подать заявление через мобильное приложение или веб-сайт банка, после чего банк рассмотрит их кредитную историю и текущую финансовую ситуацию.']","Чтобы увеличить кредитный лимит, клиентам необходимо подать соответствующее заявление через мобильное приложение или веб-сайт банка. Банк затем оценит их кредитную историю и текущую финансовую ситуацию перед принятием решения.","Для увеличения лимита по своей кредитной карте вы должны обратиться в банк и запросить увеличение лимита. Однако, банк вправе отказать вам в увеличении лимита снятия наличных с использованием карты, если имеет основания полагать, что операция противоречит действующему законодательству РФ, без объяснения причин."
"Каковы условия отмены банковской операции, например, перевода средств или платежа?","['Клиенты могут отменить определенные банковские операции, если они не были еще обработаны банком. Условия отмены операций установлены в пользовательском соглашении и зависят от типа операции.']","Условия отмены банковской операции зависят от того, была ли операция уже обработана банком. Для операций, которые еще не обработаны, клиенты могут инициировать отмену, следуя процедурам, описанным в пользовательском соглашении и в зависимости от типа операции.","Условия отмены банковской операции, например, перевода средств или платежа, зависят от конкретного контекста и типа операции. В случае расторжения Договора реструктуризации задолженности, банк может в одностороннем порядке расторгнуть договор по определенным причинам, таким как невыполнение обязательств клиентом или нарушение условий договора. При этом банк осуществляет возврат денежных средств клиенту, если они излишне перечислены при погашении задолженности. Банк также может удержать комиссию за перевод денежных средств в случае возврата клиенту излишне перечисленных средств.

В случае неполучения распоряжения клиента о переводе денежных средств, банк может считать указанные средства безвозмездно переданными, если остаток не превышает определенной суммы и если клиент не проявляет активности в течение определенного периода времени. В случае расторжения Договора расчетной карты, банк также может направить денежные средства клиента на оплату услуг связи или осуществить их возврат почтовым переводом или иным согласованным способом, при этом удерживая комиссию за перевод.

Таким образом, условия отмены банковской операции могут быть определены в договоре и могут включать различные сценарии возврата денежных средств клиенту в зависимости от конкретной ситуации."
Какие услуги доступны клиентам через Интернет-банк?,"['Через Интернет-банк клиенты могут управлять своими счетами, осуществлять платежи и переводы, а также получать детальную информацию о своих финансовых операциях.']","Интернет-банк предоставляет клиентам возможности управления их счетами, осуществления платежей и переводов, а также доступ к подробной информации о всех их финансовых операциях.","Клиентам доступны следующие услуги через Интернет-банк, Мобильный банк, Мобильные приложения банка и другие каналы обслуживания в Интернет для получения информации и совершения операций. Различные операции могут быть осуществлены через интернет-банк, включая пополнение наличными денежными средствами, снятие наличных, платежи и переводы денежных средств, получение информации об остатке денежных средств на договоре, обмен валюты и другие операции по усмотрению банка."
"Я не пользовалась кредиткой год, но у меня там лежат мои 800 рублей, я могу их как-то вернуть?","['""8. Расторжение Договора кредитной карты\n                8.1. Банк вправе в любой момент расторгнуть Договор кредитной карты в одностороннем порядке в случаях, предусмотренных \n                законодательством Российской Федерации, а также:\n                • в случае если Держатель не пользовался Кредитной картой более, чем 6 (шесть) месяцев при отсутствии \n                Задолженности по Договору кредитной карты;\n                В этих случаях Банк блокирует все Кредитные карты/Токены, выпущенные в рамках Договора кредитной карты. Договор \n                кредитной карты считается расторгнутым со дня формирования Банком Заключительного счета, который направляется \n                Клиенту. Если в момент расторжения Договора кредитной карты Задолженность Клиента перед Банком отсутствует, Банк \n                вправе расторгнуть Договор кредитной карты без направления Заключительного счета, информируя Клиента о своем \n                решении любым способом по усмотрению Банка.\n                8.5. В случае, если при расторжении Договора кредитной карты в Банке находятся денежные средства Клиента, излишне \n                перечисленные им при погашении Задолженности, Банк осуществляет возврат таких денежных средств по распоряжению \n                Клиента почтовым переводом или иным способом, указанном в распоряжении Клиента. При этом Банк вправе удержать \n                из суммы такого перевода комиссию за перевод денежных средств в размере, предусмотренном Тарифами на услуги \n                по переводам, платежам и дополнительные услуги с использованием каналов Дистанционного обслуживания.\n                8.6. В случае неполучения Банком распоряжения Клиента о переводе денежных средств в течение 120 (ста двадцати) дней \n                со дня обработки Банком последней операции Клиента/Держателя и, если остаток денежных средств не превышает \n                1000 руб., указанный остаток считается безвозмездно переданным Банку. \n                В случае неполучения Банком распоряжения Клиента о переводе денежных средств в течение 3 (трех) лет со дня обработки \n                Банком последней операции Клиента/Держателя указанные денежные средства считаются безвозмездно переданными \n                Банку.\n                ']","Согласно пунуту 8.6 - вы не можете вернуть ваши деньги, так как не дали распоряжение Банку о переводе денежных средств в течение 120 дней.","Да, вы можете вернуть свои 800 рублей, которые лежат на кредитной карте, неиспользуемой в течение года. Для этого вам необходимо сообщить об этом в Банк посредством дистанционного обслуживания и оформить претензию. Сотрудник Банка поможет вам в этом процессе."
