question,contexts,ground_truth,answer,faithfulness,answer_relevancy,context_precision,context_relevancy,answer_similarity,bleu_score,cos-sim-TF-IDF,sim-spacy,cos-sim-BertModel
Можно ли не расписываться на карте?,"[""['После получения карты поставьте свою подпись в прямоугольнике, расположенном на оборотной стороне карты. При отсутствии подписи карта может быть не принята к оплате в торгово-сервисном предприятии, а также повышается риск использования карты злоумышленниками в случае ее утраты/кражи.']""]","При отсутствии подписи карта может быть не принята к оплате в торгово-сервисном предприятии, а также повышается риск использования карты злоумышленниками в случае ее утраты/кражи.",Не указано в контексте.,,0.0,0.9999999999,1.0,0.8000977881893989,0.0,0.06895502284478262,0.42524506083149,0.91615593
"Мой друг попросил меня дать свою карту для оплаты и потом вернуть, это не опасно?","[""['Никогда не принимайте рекомендации, советы, помощь от третьих лиц при пользовании картой, особенно при снятии наличных денежных средств в банкоматах. В случае возникновения затруднений при совершении операции обратитесь Банк посредством дистанционного обслуживания. Обращайте внимание на расположение банкоматов. Старайтесь не пользоваться банкоматами, расположенными в плохо освещенных и безлюдных местах', 'Не передавайте карту другим лицам, в т.ч. родственникам и знакомым для проведения транзакций. С целью исключения Ваших потерь от несанкционированного использования Вашей карты (копирования информации с Вашей карты для ее дальнейшего мошеннического использования): при совершении операции оплаты с использованием карты никогда не выпускайте Вашу карту из поля зрения и требуйте от обслуживающего Вас лица, чтобы все операции с использованием карты совершались в Вашем присутствии.']""]","Не передавайте карту другим лицам, в т.ч. родственникам и знакомым для проведения транзакций и никогда не принимайте рекомендации, советы, помощь от третьих лиц при пользовании картой, особенно при снятии наличных денежных средств в банкоматах.","Да, передавать свою карту другому человеку для оплаты и последующего возврата может быть опасно. Это может привести к несанкционированному использованию вашей карты и возможной потере денег. Рекомендуется всегда следить за операциями с использованием вашей карты и требовать от обслуживающего лица, чтобы все операции с картой совершались в вашем присутствии.",,0.9105179434455518,0.9999999999,1.0,0.9129485960116092,0.0,0.05358797469131104,0.7728493017173009,0.9857865
Безопасно ли хранить пинкод в заметках в телефоне?,"[""['Категорически запрещается записывать ПИН-код на карте. Постарайтесь не записывать ПИН-код, запомните его. Если же Вы предпочитаете записать свой ПИН-код, никогда не указывайте, что это ПИН-код и не храните документ с записанным ПИН-кодом рядом с картой.']""]","Да, однако не указывайте в названии заметки, что это ПИН-код от Вашей карты.","Нет, не безопасно хранить пинкод в заметках в телефоне. Мошенники могут использовать различные методы для получения доступа к вашему пин-коду, включая установку специальных устройств на банкомате или подглядывание за вами при использовании банкомата. Рекомендуется принять все меры для обеспечения конфиденциальности вашего пин-кода, например, не вводить его в видимости других людей и использовать случайную последовательность цифр вместо реального пин-кода.",1.0,0.9701508607473244,0.9999999999,1.0,0.869195808159202,0.0,0.09159022420207741,0.7256527645688629,0.93512434
Я потеряла карту,"[""[' Вы потеряли карту или ее украли\\nПрежде всего, как можно быстрее, сообщите о случившемся в Банк посредством дистанционного обслуживания \\nи заблокируйте карту. Заблокировать карту можно по телефону, в интернет-банке или в мобильном приложении Банка. \\nЧем раньше Вы это сделаете, тем меньше вероятность несанкционированного использования карты злоумышленниками. \\nРазблокировать карту нельзя — можно только перевыпустить. Если вы не уверены, что карту украли, не спешите ее \\nблокировать, установите лимит «0» на операции и запретите покупки через Интернет, если карта будет найдена лимиты \\nможно изменить.\\nНапоминаем Вам, что в соответствии с Общими условиями выпуска и обслуживания кредитных карт и Общими \\nусловиями открытия, ведения и закрытия счетов физических лиц, а также выпуска и обслуживания расчетных карт Ваша \\nответственность за дальнейшее использование карты прекращается, после осуществления блокировки, если не станет \\nизвестно, что незаконное использование карты имело место с Вашего согласия.\\nЕсли карта была у Вас украдена на территории РФ, после блокировки карты заявите о случившемся в полицию. При краже \\nкарты за границей, заявите в полицию или в консульский отдел посольства Российской Федерации в стране, на территории \\nкоторой произошла кража. Пожалуйста, сохраняйте копию протокола (квитанцию о заявлении) для последующего \\nпредъявления в Банк.']""]","Если вы не уверены, что карту украли, не спешите ее блокировать, установите лимит «0» на операции и запретите покупки через Интернет, если карта будет найдена лимиты можно изменить. В случае, если вы полагаете, что Вашу карту всё-таки украли, то как можно быстрее, сообщите о случившемся в Банк посредством дистанционного обслуживания и заблокируйте карту. Это возможно сделать по телефону, в интернет-банке или в мобильном приложении Банка.","Если вы потеряли карту, вам следует немедленно уведомить банк и заблокировать карту. Вы также можете подать заявление о досрочном перевыпуске карты. После блокировки карты ваша ответственность за ее дальнейшее использование прекращается, если не станет известно, что незаконное использование карты имело место с вашего согласия.",1.0,0.8430453875838686,0.9999999999,0.1,0.9012080164921698,0.0,0.197965049284806,0.8881971189866495,0.99341816
"Почему при использовании карты важно не расписываться на квитанциях/чеках до того, как вы проверите правильность указанной суммы?","[""['Проверяйте правильность суммы, указанной на платежном чеке. Поставив подпись на платежном чеке, Вы соглашаетесь со списанием указанной на нем суммы с Вашего карточного счета.']""]","Важно проверять правильность суммы перед подписанием квитанции/чека, потому что после подписи вы соглашаетесь с этой суммой, и она будет списана с вашего счета.","Подписывая квитанции или чеки до проверки правильности указанной суммы, вы можете подписаться под неправильной суммой, что может привести к финансовым потерям для вас. Поэтому важно сначала проверить сумму, а затем уже подписывать квитанции или чеки.",,0.922110314698094,0.9999999999,1.0,0.9389775122252773,0.0,0.14194078547877104,0.8742797204151725,0.98576975
"Что делать, если я потеряла телефон, на котором было установлено мобильное приложение банка?","[""['При утрате Мобильного телефона, используемого с абонентским номером подвижной радиотелефонной связи, на который установлено Мобильное приложение Банка, Вам следует срочно обратиться к своему оператору сотовой связи для блокировки SIM-карты и в Банк посредством дистанционного обслуживания для блокировки доступа в мобильное приложение Банка и удаления данных карты с Мобильного телефона.']""]","Если вы потеряли телефон с установленным мобильным приложением банка, необходимо:

Срочно обратиться к оператору сотовой связи для блокировки SIM-карты.
Обратиться в банк через дистанционное обслуживание для блокировки доступа в мобильное приложение и удаления данных карты с телефона.","Если вы потеряли телефон, на котором было установлено мобильное приложение банка, вам следует срочно обратиться к своему оператору сотовой связи для блокировки SIM-карты и в банк для блокировки доступа в мобильное приложение банка и удаления данных карты с мобильного телефона.",1.0,0.9811158911629488,0.9999999999,1.0,0.9860997375999904,0.3495,0.671163658185695,0.9636728683088306,0.9963163
Можно ли использовать интернет-кафе и другие общедоступные места для совершения операций по карте в интернете? Объясните причину.,"[""['Избегайте осуществления Интернет-операций с использованием карты в местах, где услуги Интернет являются общедоступными, например, в Интернет-кафе.']""]","Нет, не рекомендуется использовать интернет-кафе и другие общедоступные места для совершения операций по карте в интернете. Причина в том, что такие общедоступные сети являются менее безопасными, и есть риск перехвата данных карты злоумышленниками.","Нет, не рекомендуется использовать интернет-кафе и другие общедоступные места для совершения операций по карте в интернете. Это связано с повышенным риском мошенничества и кражи личных данных. Лучше всего использовать проверенные интернет-магазины и соблюдать меры безопасности при вводе данных карты.",,0.9085463555924944,0.9999999999,1.0,0.9770716659747148,0.3943,0.4185308673819039,0.8555060952146614,0.99338245
"Что делать, если я получил SMS-оповещение о операции по карте, которую я не совершал?","[""['Если Вы уверены, что операция не могла быть совершена Вами, то как можно быстрее сообщите об этом в Банк посредством дистанционного обслуживания и заблокируйте карту.']""]","Если вы получили SMS-оповещение о операции, которую не совершали, нужно как можно быстрее сообщить об этом в банк через дистанционное обслуживание и заблокировать карту.","Если вы получили SMS-оповещение о операции по карте, которую вы не совершали, вам следует немедленно сообщить об этом в банк и заблокировать карту. Блокировку можно осуществить через интернет-банк, мобильное приложение банка или позвонив по указанному на карте номеру телефона. Также рекомендуется установить лимит на операции и запретить покупки через интернет, если карта была найдена.",1.0,0.9774982238627414,0.9999999999,1.0,0.9577292618247076,0.11,0.41012485205758026,0.8560184313832033,0.98817295
Как обезопасить себя от съема данных карты в банкомате злоумышленниками? Приведи два способа.,"[""['Поэтому, при пользовании банкоматом не ленитесь внимательно осмотреть его и убедиться в отсутствии каких-либо «накладок» и посторонних устройств.', 'Пожалуйста, примите все меры, чтобы вводимый Вами ПИН-код был не заметен для окружающих.']""]","Чтобы обезопасить себя от съема данных карты в банкомате:

Внимательно осматривайте банкомат перед использованием на наличие подозрительных накладок и посторонних устройств.
Прикрывайте рукой клавиатуру при вводе ПИН-кода, чтобы его не могли увидеть окружающие.","Для защиты вашей карты от съема данных злоумышленниками в банкомате можно использовать следующие способы:

1. Прикрывайте клавиатуру банкомата рукой при вводе ПИН-кода. Это поможет скрыть цифры от камер видеонаблюдения.
2. Убедитесь, что дверь в помещение, где находится банкомат, открывается без ввода ПИН-кода. Если вам предлагают ввести ПИН-код для открытия двери, это может быть признаком мошенничества.
3. Никогда не сообщайте свой ПИН-код при проведении операций по карте через интернет, телефон, электронную почту и другие средства связи.
4. Используйте защищенный режим при проведении операций в интернете. Получайте одноразовые пароли в виде SMS-сообщений или Push-уведомлений на ваше мобильное устройство.
5. Обратите внимание на предупреждения банка о возможных мошеннических действиях и следуйте их рекомендациям.",1.0,0.9526817555209708,0.9999999999,1.0,0.9547697816699744,0.0,0.2107366448957227,0.9330012762847384,0.9837135
"Правда ли, что при бронировании гостиницы по карте мне необходимо сообщить все реквизиты карты, включая ПИН-код? Если нет, то что именно требуется сообщить?","[""['При бронировании номера в гостинице по карте Вас попросят сообщить свое имя, номер карты, срок ее действия (иногда, дополнительно — трехзначный код безопасности, напечатанный на обратной стороне карты на полосе для подписи) и срок Вашего пребывания.']""]","Нет, неправда. При бронировании гостиницы по карте не требуется сообщать ПИН-код. Обычно для бронирования запрашивают ваше имя, номер карты, срок ее действия, иногда трехзначный код безопасности (CVV/CVC) с оборотной стороны карты и планируемый срок пребывания.","Нет, при бронировании гостиницы по карте вам не нужно сообщать ПИН-код. Вам потребуется сообщить только имя, номер карты, срок ее действия и срок вашего пребывания.",,0.947335821147834,0.9999999999,1.0,0.966128365352519,0.1977,0.47989784310035644,0.9443498943651089,0.99086493
"Если я из другой страны и у меня нет паспорта РФ, что мне делать?","[""['\\n                     1. Документы и сведения, получаемые в целях идентификации Клиентов-физических лиц, а также в целях обслуживания таких Клиентов в рамках Универсального договора\\n                     1.4. Реквизиты документа, удостоверяющего личность: серия (при наличии) и номер документа, дата выдачи документа, наименование органа, выдавшего документ (при наличии кода подразделения может не устанавливаться), и код подразделения (при наличии).\\n                     1.4.2.для иностранных граждан:\\n                     •паспорт иностранного гражданина;\\n                     •дипломатический паспорт, служебный паспорт, удостоверяющие личность иностранного гражданина.', '.5.Документ, подтверждающий право иностранного гражданина или лица без гражданства на пребывание (проживание) в Российской Федерации (миграционной карты в случае отсутствия иных документов), в случае если наличие таких документов обязательно в соответствии с международными договорами Российской Федерации и законодательством Российской Федерации;Документами, подтверждающими право иностранного гражданина или лица без гражданства на пребывание (проживание) в РФ, являются:\\n                    •миграционная карта в случае отсутствия иных документов;\\n                    •вид на жительство;\\n                    •разрешение на временное проживание;\\n                    •виза;\\n                    •иной документ, подтверждающий в соответствии с международными договорами Российской Федерации и законодательством РФ право иностранного гражданина или лица без гражданства на пребывание (проживание) в РФ.\\n']""]","
                        Если вы из другой страны, то для заключения договора вам неообходимы документы, удостоверяющие Вашу личность. Для иностранных граждан это:
                            •паспорт иностранного гражданина;
                            •дипломатический паспорт, служебный паспорт, удостоверяющие личность иностранного гражданина.
                        Также необходимы документы, подтверждающие право иностранного гражданина (проживание) в Российской Федерации (миграционной карты в случае отсутствия иных документов), в случае если наличие таких документов обязательно в соответствии с международными договорами Российской Федерации и законодательством Российской Федерации;Документами, подтверждающими право иностранного гражданина или лица без гражданства на пребывание (проживание) в РФ, являются:
                            •миграционная карта в случае отсутствия иных документов;
                            •вид на жительство;
                            •разрешение на временное проживание;
                            •виза;
                            •иной документ, подтверждающий в соответствии с международными договорами Российской Федерации и законодательством РФ право иностранного гражданина или лица без гражданства на пребывание (проживание) в РФ. ","Я не знаю ответа на этот вопрос. Пожалуйста, уточните ваш вопрос или предоставьте больше информации.",,0.0,0.9999999999,0.1666666666666666,0.7761885534597726,0.0,0.04966794907955054,0.5378301237151824,0.916926
В течении скольких дней действительна выписка из ЕГРЮЛ?,"[""['\\n                    2.2. Выписка из Единого государственного реестра юридических лиц (ЕГРЮЛ). Банком может быть принята копия \\n                    выписки, заверенная регистрирующим органом. Выписка считается действительной для предоставления в Банк \\n                    в течение 30 (тридцати) календарных дней с даты ее выдачи и должна содержать актуальные сведения на дату  \\n                    ее предоставления;']""]",Выписка из Единого государственного реестра юридических лиц (ЕГРЮЛ) действительна в течении 30 дней с даты ее выдачи.,Выписка из ЕГРЮЛ считается действительной для предоставления в Банк в течение 30 (тридцати) календарных дней с даты ее выдачи и должна содержать актуальные сведения на дату ее предоставления.,,0.945457095095952,0.9999999999,0.25,0.9287416792166888,0.0958,0.28851544498363413,0.8116122610548312,0.9800623
Нужно ли ИП указывать свой сайт для предприятия?,"[""['\\n                    3. Документы и сведения, предоставляемые Клиентом-индивидуальным предпринимателем: \\n                    3.5. Сведения о доменном имени, указателе страницы сайта в сети «Интернет», с использованием которых Клиентом \\nоказываются услуги (при наличии);\\n                    ']""]","Да, индивидуальному предпринимателю необходимо указать сведения о доменном имени, указателе страницы сайта в сети «Интернет».","В контексте нет информации о том, нужно ли ИП указывать свой сайт для предприятия.",,0.0,0.9999999999,0.6666666666666666,0.8906010204336043,0.0,0.0,0.7710220575462547,0.9754296
Может ли Банк запросить дополнительные документы - не из списка обязательных?,"[""['\\n                     26. Банк может запросить у Клиента, а Клиент обязуется предоставить по запросу Банка дополнительные документы \\n                    и сведения, как предусмотренные, так и не предусмотренные настоящим Перечнем, в том числе в целях надлежащей \\n                    идентификации Клиента, его представителя, выгодоприобретателя и бенефициарного владельца в соответствии \\n                    с требованиями действующего законодательства Российской Федерации, нормативных актов Банка России, а также \\n                    требованиями Банка. Банк вправе не запрашивать отдельные документы и сведения, предусмотренные настоящим \\n                    Перечнем, в случаях, установленных внутренними правилами Банка.']""]","Да, Банк может запросить у Вас дополнительные не предусмотренные Перечнем документы.","Да, банк может запросить у клиента дополнительные документы, которые не предусмотрены списком обязательных.",,0.981001159657163,0.9999999999,0.25,0.9680089573639056,0.0,0.4739393421029532,0.8642171291207541,0.9922153
Какие документы нужно предоставить физическому лицу для открытия счета?,"[""['1. Документы и сведения, получаемые в целях идентификации Клиентов-физических лиц, а также в целях обслуживания таких Клиентов в рамках Универсального договора']""]","Физическому лицу для открытия счета необходимо предоставить документ, удостоверяющий личность (паспорт или иной документ из списка в п.1.4), документ, подтверждающий регистрацию или место пребывания, ИНН, СНИЛС и контактную информацию.","Для открытия счета физическому лицу необходимо предоставить следующие документы и сведения:
- Заявление-Анкету или Заявку, оформленную с использованием Аутентификационных данных и/или Кодов доступа;
- Документы и сведения, необходимые для проведения идентификации клиента, представителя клиента, выгодоприобретателя, бенефициарного владельца в соответствии с законодательством Российской Федерации.",1.0,0.9850544715206766,0.9999999999,1.0,0.9535676244485172,0.0,0.17951137150257607,0.9094096671738858,0.9807076
Какие документы необходимо предоставить юридическому лицу для открытия счета в Банке? Можно ли предоставить сканы документов или нужны оригиналы?,"[""['2.1. Учредительные документы юридического лица...', '2.2. Выписка из Единого государственного реестра юридических лиц (ЕГРЮЛ)...', '2.3. Документ об избрании единоличного исполнительного органа юридического лица...']""]","Юридическому лицу необходимо предоставить учредительные документы, выписку из ЕГРЮЛ, документ об избрании руководителя, документы, подтверждающие личность руководителя и лиц, имеющих право подписи. Документы можно предоставить в копиях, заверенных нотариально, регистрирующим органом, руководителем или сотрудником Банка при наличии оригиналов.","Для открытия счета в Банке юридическому лицу необходимо предоставить следующие документы:
- Учредительные документы юридического лица: Устав юридического лица и/или Учредительный договор (при необходимости в зависимости от организационно-правовой формы юридического лица). Банком могут быть приняты копии учредительных документов юридического лица, заверенные регистрирующим органом. Документы предоставляются по требованию.
- Документы-основания участия бенефициара или бенефициаров в отношениях по договору номинального счета (договор, шаблон применяемого договора, правила инвестиционной).
Необходимо предоставить оригиналы или сканы документов, заверенные регистрирующим органом.",1.0,0.9495991846748087,0.9999999999,0.0,0.9318636300338112,0.0,0.23581239161602735,0.8790901571924633,0.9889571
Можно ли открыть счет индивидуальному предпринимателю – иностранному гражданину? Какие документы для этого нужны?,"[""['3.1. Идентификация индивидуального предпринимателя осуществляется на основании документов и сведений, указанных в пункте 1.4 настоящего Перечня', '3.2. Документ, подтверждающий право иностранного гражданина или лица без гражданства на пребывание (проживание) в Российской Федерации...']""]","Да, индивидуальному предпринимателю-иностранному гражданину можно открыть счет. Для этого нужно предоставить документ, удостоверяющий личность, документ, подтверждающий право пребывания/проживания в РФ (напр. миграционную карту), ИНН, СНИЛС, выписку из ЕГРИП и контактную информацию.",Из предоставленного контекста нельзя однозначно ответить на вопрос. Необходимо обратиться к конкретному банку или финансовому учреждению для получения информации о возможности открытия счета индивидуальному предпринимателю – иностранному гражданину и необходимых для этого документах.,,0.0,0.9999999999,1.0,0.9219114277358064,0.0,0.1459519214989411,0.8912314872337167,0.9834532
"Какие документы потребуются, если открывать счет для нотариуса, занимающегося частной практикой? Может ли нотариус быть иностранцем при этом?","[""['5.1. Документ, удостоверяющий личность и указанный в пункте 1.4 настоящего Перечня', '5.2. Документ, подтверждающий наделение нотариуса полномочиями (назначение на должность), выдаваемый органами юстиции субъектов Российской Федерации, в соответствии с законодательством Российской Федерации']""]","Для открытия счета нотариусу, занимающемуся частной практикой, требуется предоставить документ, удостоверяющий личность, документ о назначении на должность нотариуса от органов юстиции, регистрационные документы, финансовые документы и контактные данные. Нотариус может быть иностранцем, в этом случае дополнительно потребуется документ, подтверждающий право на пребывание/проживание в РФ.","Для открытия счета нотариусу, занимающемуся частной практикой, потребуется предоставить следующие документы:
   - Документ, удостоверяющий личность и указанный в пункте 1.4 настоящего Перечня;
   - Документ, подтверждающий наделение нотариуса полномочиями (назначение на должность), выдаваемый органами юстиции субъектов Российской Федерации, в соответствии с законодательством Российской Федерации;
   - Адрес места жительства (регистрации) или места пребывания (если его нельзя установить из документа, удостоверяющего личность, а также если адрес места жительства (регистрации) или места пребывания не совпадают);
   - Контактная информация (например, номер телефона, факса, адрес электронной почты, почтовый адрес (при наличии));
   - Выписка из ЕГРИП. Банком может быть принята копия выписки, заверенная регистрирующим органом. Выписка считается действительной для предоставления в Банк в течение 30 (тридцати) календарных дней с даты ее выдачи и должна содержать актуальные сведения на дату ее предоставления.

Нотариус может быть иностранцем при открытии счета, однако, ему потребуется разрешение Национального (Центрального) банка иностранного государства на открытие счета (с заверенным переводом на русский язык), если наличие такого разрешения требуется в соответствии с международными договорами с участием Российской Федерации или законодательством иностранного государства.",,0.9603591308866708,0.9999999999,1.0,0.9618943306832088,0.0116,0.2574675913376894,0.92809111891026,0.9870274
"Как узнать, кто является бенефициарным владельцем юридического лица? Какие документы для этого нужны?","[""['12. Идентификация бенефициарного(ых) владельца(ев) осуществляется на основании следующий документов и сведений...']""]","Для идентификации бенефициарного владельца юридического лица необходимо предоставить документы, удостоверяющие личность бенефициара, документ о регистрации/пребывании в РФ (если бенефициар - иностранец), ИНН, адрес регистрации и контактные данные. Также можно заполнить анкету бенефициарного владельца по форме Банка.","Идентификация бенефициарных владельцев может осуществляться на основании Анкеты физического лица — бенефициарного владельца по форме Банка, подписанной Клиентом (в том числе при наличии бенефициарного владельца, отличного от Клиента-физического лица).",,0.9242203853553204,0.9999999999,1.0,0.9508613142837244,0.071,0.21400252287484323,0.8976178293782886,0.9918035
Расскажи про термины 'Договор страхования' и 'КАСКО',"[""['1. Термины и определения     \\n                    Договор страхования — договор, по которому одна сторона (Страховщик) обязуется за обусловленную договором \\n                    плату (страховую премию) при наступлении предусмотренного в договоре события (страхового случая) осуществить \\n                    другой стороне (страхователю) или иному лицу, в пользу которого заключен договор (выгодоприобретателю), \\n                    страховое возмещение в пределах определенной договором суммы (страховой суммы).', 'КАСКО — комбинированное страхование транспортных средств и сопутствующих рисков.']""]"," Да, конечно! Договор страхования — это договор, по которому одна сторона (Страховщик) обязуется за обусловленную договором 
                    плату (страховую премию) при наступлении предусмотренного в договоре события (страхового случая) осуществить 
                    другой стороне (страхователю) или иному лицу, в пользу которого заключен договор (выгодоприобретателю), 
                    страховое возмещение в пределах определенной договором суммы (страховой суммы). 
                    КАСКО — это комбинированное страхование транспортных средств и сопутствующих рисков.","Термин ""Договор страхования"" относится к юридическому документу, который устанавливает условия и обязательства между страхователем и страховщиком. Это соглашение определяет риски, которые будут покрываться страховкой, а также размер и порядок выплаты страхового возмещения. 

Термин ""КАСКО"" является аббревиатурой от ""Комплексное Автомобильное Страхование, Кроме Ответственности"". Это тип страхования, который защищает автомобиль от различных рисков, таких как угон, повреждения в результате ДТП или стихийных бедствий. Он обычно не включает ответственность перед третьими лицами, то есть ущерб, причиненный другим автомобилям или людям в результате аварии.",1.0,0.8923643665761385,0.9999999999,0.0,0.9279791173941968,0.0,0.11484516119704781,0.9100770520833612,0.9865069
"Какой минимум страховой выплаты мне вернут, если моя страховая сумма = 50 000 долларов?","[' \n                    2.19.   При добровольном страховании непредвиденных расходов путешественников страховая сумма в договоре \n                    страхования может быть установлена в рублях или иностранной валюте в рублевом эквиваленте по официальному \n                    курсу иностранных валют ЦБ РФ на дату заключения Договора страхования, но не менее чем 66,7 руб. за 1 у.е.  при \n                    страховой сумме 30 000 у.е., 57,2 руб. за 1 у.е. при страховой сумме 35 000 у.е., 50 руб. за 1 у.е. при страховой сумме \n                    50 000 у.е., 26,7 руб. за 1 у.е. при страховой сумме 75 000 у.е.']"," 
                    Минимальная страховая выплата, которую вам вернут, если ваша страховая сумма составляет 50 000 долларов, составляет 50 рублей за 1 доллар США. Минимальная выплата составит 2 500 000 рублей.
                    Обратите внимание, что это минимальная выплата, которую вы получите. Фактическая сумма выплаты может варьироваться в зависимости от условий вашего договора.
        ","Я не могу ответить на этот вопрос, так как текст, который вы предоставили, не содержит информации о минимальной страховой выплате.",,0.0,0.9999999999,0.2,0.8561570401341955,0.0,0.01365083595657315,0.8831359842344044,0.96684027
"При принятии пользовательских соглашений, кому еще попадают мои данные?","[""['\\n                    5. Персональные данные     \\n                        5.1.       Пользователь подтверждает, что с использованием Дистанционных каналов взаимодействия дает Страховщику, \\n                        аффилированным лицам страховщика, Страховому агенту или Страховому брокеру, а также лицам, \\n                        предоставляющим услуги по использованию их информационных возможностей для целей заключения договоров \\n                        страхования, хранения документов, в том числе, облачных сервисов, серверов, программных продуктов, согласие на \\n                        обработку его персональных данных с целью осуществления дистанционного взаимодействия с последними при \\n                        использовании их Сайта и/или сайтов в сети Интернет или при помощи ПО Страховщика и в целях осуществления \\n                        маркетинговых коммуникаций перечисленных лиц с Пользователем.  \\n        ']""]","
                    Согласно пункту 5.1 пользовательского соглашения, ваши персональные данные могут быть переданы следующим сторонам:
                        • Аффилированные лица страховщика
                        • Страховой агент
                        • Страховой брокер
                        • Лица, предоставляющие услуги по использованию их информационных возможностей для целей заключения договоров страхования, хранения документов, в том числе облачных сервисов, серверов, программных продуктов
","Данные пользователя могут быть переданы третьим лицам, включая операторов фискальных данных и операторов электронного документооборота, с целью проверки платежеспособности, предложения и/или предоставления продуктов и услуг Банка и его партнеров, а также заключения, исполнения и/или прекращения договоров.",,0.0,0.9999999999,0.25,0.8725261979535627,0.0,0.09789238406904827,0.8964073861796229,0.9906435
Зачем страховщик ведет аудио и видеозапись при взаимодействии с клиентом? Как долго эти записи хранятся?,"[""['При заключении Договоров страхования, а также при ином обращении Клиента или Пользователя к Страховщику или его представителям Страховщик вправе осуществлять наблюдение, фотографирование, аудио- и видеозапись, включая запись телефонных разговоров, а также копирование и хранение переписок между Пользователем и Страховщиком (его представителями) по электронной почте или в мессенджерах, без дополнительного уведомления Клиента (Пользователя) о такой записи. Клиент соглашается, что Страховщик вправе хранить такие записи в течение 5 (пяти) лет с момента прекращения отношений с Клиентом (Пользователем), с целью улучшения качества обслуживания, исполнения Договора страхования, а также использовать их при проведении любых расследований в связи с Договором страхования.']""]","Страховщик ведет аудио, видеозапись, фотографирование, копирует переписку с клиентом без дополнительного уведомления с целью улучшения качества обслуживания, исполнения договора страхования, а также для использования этих записей при проведении расследований, связанных с договором. Такие записи страховщик вправе хранить в течение 5 лет с момента прекращения отношений с клиентом.","Страховщик ведет аудио и видеозапись при взаимодействии с клиентом для улучшения качества обслуживания, исполнения договора страхования и проведения расследований в связи с договором страхования. Эти записи хранятся в течение 5 лет после прекращения отношений со страховщиком.",1.0,0.944101115283048,0.9999999999,1.0,0.9814845374609013,0.1606,0.47834858596311436,0.9660741507421784,0.9929295
В каких случаях застрахованному могут быть оплачены планируемые расходы по страховому случаю до предоставления подтверждающих документов? Какие ограничения есть по размеру таких выплат?,"[""['По договорам добровольного страхования непредвиденных расходов путешественников по предварительному согласованию со Страховщиком Застрахованному могут оплачиваться планируемые расходы по предусмотренным договором страхования страховым событиям, предусматривающим возмещение расходов на оказание Экстренной или Неотложной амбулаторной и/или стационарной помощи, с условием предоставления Застрахованным документов, подтверждающих такие расходы Страховщику непосредственно после их несения (чеки, платежные документы и пр.). В случае если в результате страхового случая Застрахованным лицом были понесены соответствующие расходы на оказание Экстренной или Неотложной амбулаторной и/или стационарной помощи, в том числе, предварительно согласованные Страховщиком, но не были предоставлены документы, подтверждающие их оплату, Страховщик возмещает расходы в размере не более 200 у.е. (если страховая сумма установлена в валюте, отличной от российского рубля) или 10 000 российских рублей (если страховая сумма установлена в российских рублях), за один страховой случай.']""]","По договорам добровольного страхования непредвиденных расходов путешественников застрахованному могут быть оплачены планируемые расходы по страховым случаям, предусматривающим возмещение расходов на экстренную/неотложную амбулаторную или стационарную помощь, по предварительному согласованию со страховщиком. Условие - предоставление подтверждающих документов сразу после несения расходов. Если документы не предоставлены, то страховщик возмещает расходы в размере не более 200 у.е. (если страховая сумма в валюте) или 10 000 рублей (если в рублях) за один случай.","Застрахованному могут быть оплачены планируемые расходы по страховому случаю до предоставления подтверждающих документов в следующих случаях:
- расходы на оказание экстренной или неотложной амбулаторной и/или стационарной помощи;
- расходы на оказание экстренной медицинской помощи за рубежом.
Ограничения по размеру таких выплат составляют:
- не более 200 у.е. (если страховая сумма установлена в валюте, отличной от российского рубля) или 10 000 российских рублей (если страховая сумма установлена в российских рублях), за один страховой случай.",0.6666666666666666,0.9546656088468224,0.9999999999,1.0,0.9608148824508695,0.1907,0.3778851923309686,0.9556619740457232,0.9925243
Куда пользователь может направить обращение при возникновении вопросов или спора со страховщиком?,"[""['При возникновении вопросов или спора можно отправить обращение:\\n\\nв АО «Тинькофф Страхование» по почте по адресу: 127287, Российская Федерация, г. Москва, ул. 2-я Хуторская, дом 38А, строение 26, либо путем заполнения соответствующей формы на сайте Страховщика;\\nк финансовому уполномоченному путем регистрации обращения на сайте — finombudsman.ru или по почтовому адресу: 119017, г. Москва, Старомонетный пер., дом 3;\\nво Всероссийский союз страховщиков на сайте — ins-union.ru, приложив к обращению необходимые документы и сведения, либо на почтовый адрес: 115093, г. Москва, ул. Люсиновская, д. 27, стр. 3;\\nв Центральный Банк Российской Федерации (Банк России) через интернет-приемную на официальном сайте — cbr.ru, приложив к обращению необходимые документы и сведения, либо на почтовый адрес: 107016, г. Москва, ул. Неглинная, д. 12.']""]","При возникновении вопросов или спора с АО 'Тинькофф Страхование' пользователь может направить обращение:

 - В АО 'Тинькофф Страхование' по почте или через форму на сайте;
 - Финансовому уполномоченному на сайте finombudsman.ru или почтовым адресом;
 - Во Всероссийский союз страховщиков на сайте ins-union.ru или почтовым адресом;
В Центральный Банк РФ через интернет-приемную на сайте cbr.ru или почтовым адресом.",Пользователь может направить обращение при возникновении вопросов или спора со страховщиком в Банк.,,0.9843726030971034,0.9999999999,1.0,0.9125522964950814,0.0474,0.2551965247318621,0.7893734657762518,0.95187724
Где можно ознакомиться с дополнительной информацией и документами о деятельности АО 'Тинькофф Страхование'?,"[""['Дополнительная информация и документы о деятельности Страховщика в соответствии с п. 6.1 Закона РФ от 27.11.1992 N 4015-1 «Об организации страхового дела в Российской Федерации» и п. 2.1.1. «Базового стандарта защиты прав и интересов физических и юридических лиц — получателей финансовых услуг, оказываемых членами саморегулируемых организаций, объединяющих страховые организации» размещены по ссылкам: tinkoffinsurance.ru/about, tinkoffinsurance.ru/about/documents.']""]",Дополнительная информация и документы о деятельности АО 'Тинькофф Страхование' в соответствии с законом 'Об организации страхового дела в РФ' и базовым стандартом защиты прав получателей финансовых услуг размещены на сайте страховщика по ссылкам tinkoffinsurance.ru/about и tinkoffinsurance.ru/about/documents.,"Дополнительную информацию и документы о деятельности АО 'Тинькофф Страхование' можно найти на сайте Страховщика, а также на сайтах других организаций, таких как Центральный Банк Российской Федерации (Банк России) и Всероссийский союз страховщиков.",,0.991227345765786,0.9999999999,1.0,0.9547757595519012,0.1774,0.14721938859270092,0.8986094897713877,0.9846336
Что означает 'Партия' и вообще 'Слиток' для драгоценных металлов?,"[""['\\n                    Партия — приобретенные Клиентом Слитки в количестве, превышающем 1 (одну) штуку, и подлежащие доставке Клиенту, \\n                    в рамках одной Заявки', ' Слиток — аффинированный драгоценный металл: золото, серебро, платина и палладий в виде слитков (стандартных, \\n                    мерных), соответствующих установленным в Российской Федерации стандартам или международным стандартам качества, \\n                    изготовленных и маркированных организацией, осуществляющей аффинаж драгоценного металла. Слиток в рамках \\n                    предоставления Сервиса доставляется / принимается на хранение в ненарушенной Упаковке с приложением Сертификата-\\n                    ярлыка (при наличии) и Сертификата качества слитка']""]","Давайте разберемся! 
                    Партия — это приобретенные клиентом слитки в количестве, превышающем 1 штуку, и подлежащие доставке клиенту, в рамках одной заявки.
                    Слиток — это аффинированный драгоценный металл: золото, серебро, платина и палладий в виде слитков (стандартных, 
                    мерных), соответствующих установленным в Российской Федерации стандартам или международным стандартам качества, 
                    изготовленных и маркированных организацией, осуществляющей аффинаж драгоценного металла. Слиток в рамках 
                    предоставления Сервиса доставляется / принимается на хранение в ненарушенной Упаковке с приложением Сертификата-
                    ярлыка (при наличии) и Сертификата качества слитка.
        ","Партия и Слиток в контексте драгоценных металлов означают следующее:

- Партия - это определенное количество драгоценных металлов, которое продается или покупается.
- Слиток - это форма поставки драгоценных металлов, обычно представляющая собой кусок металла, который может быть переплавлен или использован для производства ювелирных изделий или других продуктов.",1.0,0.9733750346778184,0.9999999999,1.0,0.9242810280083747,0.0,0.11548682445908624,0.9055524925373,0.9919596
Меня действительно должны фотографировать после полкчения слитка? Какой это пункт в соглашении?,"[""['\\n                    2.13.12. После подтверждения получения Клиентом/Доверенным лицом Слитка Представитель фотографирует Клиента/\\n                    Доверенное лицо с полученным Слитком в ненарушенной заводской упаковке и документом, удостоверяющим личность \\n                    Клиента/Доверенного лица']""]","Да, Вас действительно должнен сфотографировать Представитель в соответсвии с пунктом 2.13.12.","Да, после подписания акта приема-передачи представитель должен сфотографировать клиента или доверенное лицо с полученным слитком в ненарушенной заводской упаковке и документом, удостоверяющим личность клиента или доверенного лица.",,0.8569268214047033,0.9999999999,1.0,0.8775219455446238,0.0,0.09919263652880699,0.619097473688089,0.9721963
Какие условия хранения?,"[""[' \\n                    2.14.9. Условия хранения: температура воздуха от +17 до +25 °С, атмосферное давление от 740 до 760 мм рт. ст., относительная \\n                    влажность воздуха от 30 до 60%']""]","
                    В соответсвии с пунктом 2.14.9. условия хранения слитка слудующие: 
                        - температура воздуха от +17 до +25 °С,
                        - атмосферное давление от 740 до 760 мм рт. ст.,
                        - относительная влажность воздуха от 30 до 60% ","Условия хранения включают температуру воздуха от +17 до +25 °С, атмосферное давление от 740 до 760 мм рт. ст., относительную влажность воздуха от 30 до 60%.",,0.8668723118177085,0.9999999999,0.75,0.9329296520219852,0.4573,0.7876386456756866,0.9093865102834484,0.99093175
Что такое 'Сертификат качества слитка'?,"[""['Сертификат качества слитка — документ о качестве драгоценного металла, содержащий сведения о соответствии драгоценного металла стандартам качества, технические характеристики и параметры Слитка, информацию о химическом составе, произведенный/заверенный предприятием-изготовителем Слитка.']""]","Сертификат качества слитка - это документ, выданный изготовителем слитка драгоценного металла, который содержит информацию о соответствии металла стандартам качества, его технические характеристики, параметры и химический состав.","Сертификат качества слитка - это документ, который содержит информацию о качестве драгоценного металла, включая сведения о соответствии стандартам качества, технические характеристики и параметры слитка, информацию о химическом составе, а также заверенный производителем слитка.",1.0,0.9645125633714192,0.9999999999,1.0,0.992201672163016,0.2592,0.6417085467432302,0.9635851152133867,0.99659884
На какой срок выдается эта доверенность? Можно ли ее передоверить другому лицу?,"[""['Датой выдачи доверенности считается дата предоставления Представляемым Банку данных своего представителя. Доверенность выдана сроком на 1 (один) год, полномочия по настоящей доверенности не могут быть передоверены другим лицам.']""]",Доверенность выдается сроком на 1 год. Полномочия по этой доверенности нельзя передоверять другим лицам.,"Из предоставленного контекста невозможно точно определить срок действия данной доверенности. Однако, указано, что она может быть передоверена другому лицу.",,0.0,0.9999999999,1.0,0.8977766230136088,0.0,0.03327647181829747,0.6917900023664966,0.98326266
"Как клиент может получить сертификат качества слитка, который он передал на хранение в банк?","[""['По требованию Клиента Банк предоставляет Клиенту заверенную Банком копию Сертификата качества слитка, переданного на ответственное хранение.']""]","По требованию клиента банк предоставляет ему заверенную копию сертификата качества слитка, который клиент передал на ответственное хранение в банке.","Клиент может получить сертификат качества слитка, который он передал на хранение в банк, обратившись в банк и запросив соответствующую информацию.",,1.0,0.9999999999,1.0,0.9597604504327572,0.0,0.3299864425401229,0.8529751354640513,0.9875815
Какие условия хранения слитков в банке? Где их хранят?,"[""['Хранение Банком Слитка Клиента осуществляется в хранилище 5 (Пятого) класса устойчивости к взлому, оборудованном системой видеонаблюдения и охранно-пожарной и тревожной сигнализации с выводом сигнала на пункт централизованной охраны, с осуществлением физической круглосуточной специализированной охраны хранилища.', 'Условия хранения: температура воздуха от +17 до +25 °С, атмосферное давление от 740 до 760 мм рт. ст., относительная влажность воздуха от 30 до 60%.']""]","Слитки хранятся в специальном хранилище 5 класса устойчивости к взлому, оборудованном системами видеонаблюдения, охранно-пожарной и тревожной сигнализацией, а также круглосуточной охраной. Условия хранения: температура +17...+25°С, атмосферное давление 740-760 мм рт.ст., влажность 30-60%.","Слитки хранятся в хранилище 5 (Пятого) класса устойчивости к взлому, оборудованном системой видеонаблюдения и охранно-пожарной и тревожной сигнализацией с выводом сигнала на пункт централизованной охраны, с осуществлением физической круглосуточной специализированной охраны хранилища. Условия хранения включают температуру воздуха от +17 до +25 °С, атмосферное давление от 740 до 760 мм рт. ст., относительную влажность воздуха от 30 до 60%.",1.0,0.9390432745965044,0.9999999999,1.0,0.9805639690310264,0.0961,0.4318250379327586,0.9736032148340046,0.9900789
"Можно ли вернуть слиток в банк, если при получении были обнаружены его повреждения? Как это сделать?","[""['В случае обнаружения при приеме Слитка с ответственного хранения от Представителя нарушения целостности заводской упаковки Слитка, несоответствия нанесенной на Слиток маркировки данным, указанным в Сертификате качества слитка и/или Сертификате-ярлыке, отсутствия либо повреждения Сертификата качества слитка и/или Слитка (наличие на поверхности Слитка наплывов / заусенцев / царапин / жировых пятен / посторонних включений) Клиентом/Доверенным лицом и Представителем оформляется в двух экземплярах Рекламационный акт по форме Приложения № 3 к настоящим Правилам, в котором фиксируются указанные выше нарушения / несоответствия / повреждения. В случае наличия указанных выше нарушений / несоответствий / повреждений Слиток вместе с Сертификатом качества слитка и Сертификатом-ярлыком вкладываются Клиентом/Доверенным лицом в порожний сейф-пакет и запечатываются, после чего сейф-пакет помещается в Устройство для перевозки слитка с дальнейшим опломбированием номерной разовой пломбой. Номер сейф-пакета, а также номерной разовой пломбы отражаются в Рекламационном акте.']""]","Да, если при получении слитка с хранения были обнаружены его повреждения или нарушения упаковки, несоответствия маркировки и т.п., то клиент/доверенное лицо вместе с представителем банка оформляют рекламационный акт в двух экземплярах. В этом акте фиксируются все нарушения. После этого слиток вместе с сертификатами запечатывают в новый сейф-пакет и опломбировывают, указав номера на рекламационном акте. Затем слиток возвращается обратно в банк.","Да, согласно представленному контексту, поврежденный слиток можно вернуть в банк. Для этого необходимо оформить рекламационный акт, который будет рассмотрен банком в течение 5 рабочих дней. Если повреждения будут подтверждены, банк обязуется предоставить новый слиток или вернуть старый в течение 5 рабочих дней.",0.5,0.9534747158966008,0.9999999999,1.0,0.9009198217401294,0.0,0.15102936448915233,0.8252117890130616,0.9881071
Кто может стать доверенным лицом?,"[""['Доверенное лицо — физическое лицо, уполномоченное Клиентом, которому предоставлено право на представление интересов Клиента и осуществление действий от его имени в рамках Сервиса на основании доверенности, оформленной посредством Дистанционного обслуживания в соответствии с п. 5.3 настоящих Правил по форме Приложения № 5 к настоящим Правилам.']""]","Доверенным лицом клиента может стать любое физическое лицо, которому клиент предоставит полномочия представлять его интересы в рамках сервиса покупки/продажи слитков драгоценных металлов. Доверенность на это лицо оформляется клиентом посредством дистанционного обслуживания в банке по форме из Приложения №5 к Правилам.","Доверенным лицом может стать любое физическое лицо, которое имеет необходимые полномочия для совершения сделки. Это может быть как гражданин Российской Федерации, так и иностранный гражданин или лицо без гражданства, если это предусмотрено международными договорами и законодательством РФ.",1.0,0.9850808482005712,0.9999999999,1.0,0.921239923665669,0.1081,0.21099995574454142,0.8846451966709986,0.98439217
Можно ли поменять доверенное лицо? Как это сделать?,"[""['Клиент может отменить выданную доверенность путем обращения в Банк посредством Дистанционного обслуживания в любое время, но не позднее одного дня до планируемой даты встречи с представителем Клиента.']""]","Да, клиент может отменить ранее выданную доверенность на доверенное лицо. Для этого он должен обратиться в банк посредством дистанционного обслуживания не позднее чем за 1 день до планируемой даты встречи с действующим доверенным лицом.","Из предоставленного контекста нельзя однозначно определить, можно ли поменять доверенное лицо и как это сделать.",,0.0,0.9999999999,0.0,0.8440504217312347,0.0,0.05123405022704752,0.7398737719795122,0.9765033
Как происходит покупка слитка банком? Есть ли какие-то особые условия?,"[""['Банк приобретает у Клиента только Слитки, находящиеся на ответственном хранении в Банке.', 'Клиент, обращаясь с Заявкой, подтверждает, что на момент заключения договора купли-продажи Слиток принадлежит на праве собственности Клиенту, не продан, не является предметом залога, не обременен правами третьих лиц, в споре, под арестом и иным запрещением не состоит.']""]","Банк осуществляет покупку слитков драгоценных металлов только у тех клиентов, чьи слитки находятся на ответственном хранении в самом банке. При подаче заявки на продажу слитка клиент должен подтвердить, что на момент продажи слиток принадлежит ему на праве собственности, не продан, не заложен, не арестован и не обременен правами третьих лиц.","Банк приобретает у клиента только слитки, находящиеся на ответственном хранении в банке. Заявки на совершение сделки купли-продажи слитка принимаются банком в рабочие дни в период с 10:00 до 17:00 часов по московскому времени посредством дистанционного обслуживания. Клиент, обращаясь с заявкой, подтверждает, что на момент заключения договора купли-продажи слиток принадлежит ему на праве собственности, не продан, не является предметом залога, не обременен правами третьих лиц, в споре, под арестом и иным запрещением не состоит.",0.6666666666666666,0.9058779721723246,0.9999999999,1.0,0.9455518118588826,0.1875,0.4967644606761053,0.9282858448825674,0.99200654
Что такое накопительный счет и как начисляются проценты?,"[""['\\n                    3.1. Начисление процентов на остаток средств по Счету вклада/Накопительному счету производится со дня, следующего \\n                    за днем зачисления денежных средств на Счет вклада/Накопительный счет Клиента, до дня окончания срока Вклада \\n                    (включительно) либо до их списания со Счета вклада/Накопительного счета по иным основаниям.', ' \\n                    3.3. Клиент имеет возможность по согласованию с Банком посредством Дистанционного обслуживания изменить Тарифный \\n                    план Вклада на Тарифный план для мультивалютного Вклада. При смене Тарифного плана изменения в части процентной \\n                    ставки по Счету вклада, изначально открытого в рамках текущего Договора вклада, не распространяются до конца срока \\n                    размещения, установленного предыдущим Тарифным планом. Процентные ставки по валютам, отличным от валюты \\n                    измененного Тарифного плана, устанавливаются новым Тарифным планом.\\n                    3.4. При начислении процентов в расчет принимается величина процентной ставки (в процентах годовых) и фактическое \\n                    количество календарных дней, на которое привлечены денежные средства. При этом за базу берется действительное \\n                    число календарных дней в году (365 или 366 дней соответственно).\\n                    ', ' \\n                    Накопительный счет — счет, на котором учитываются денежные средства Клиента, предусматривающий начисление \\n                    процентов на остаток денежных средств, в соответствии с Договором накопительного счета.']""]","
                    Накопительный счет - это счет, на котором учитываются денежные средства клиента и на который начисляются проценты на остаток денежных средств. Проценты начисляются в соответствии с условиями договора накопительного счета.
                    Проценты на накопительном счете начисляются со дня, следующего за днем зачисления денежных средств на счет, до дня окончания срока вклада (включительно) либо до их списания со счета по другим основаниям.

                    При начислении процентов учитываются:
                    • Величина процентной ставки (в процентах годовых)
                    • Фактическое количество календарных дней, на которое привлечены денежные средства

                    За базу берется действительное число календарных дней в году (365 или 366 дней соответственно).","Накопительный счет - это вид банковского счета, который позволяет клиентам накапливать деньги и получать проценты на остаток средств. Проценты начисляются на остаток средств на счете и выплачиваются со дня, следующего за днем зачисления денежных средств на счет, до дня окончания срока вклада или до их списания со счета по другим основаниям. Изменение тарифов в части процентной ставки по накопительному счету может производиться путем информирования клиента не позднее дня, предшествующего дню изменений.",1.0,0.9534691364632104,0.9999999999,0.3333333333333333,0.9401772600441364,0.2898,0.5438944112722427,0.953360640791618,0.99234664
Можно ли открыть вклад в 12 лет?,"[""['1.2. Банк не заключает Договор вклада (Договор накопительного счета) с лицами, не достигшими возраста 14 лет']""]","Нет, Банк не заключает договор вклада с лицами, не достигшими возраста 14 лет.","Нет, согласно представленным фрагментам контекста, банк не заключает договор вклада с лицами, не достигшими возраста 14 лет.",1.0,0.8878288560541149,0.9999999999,1.0,0.9658919986815796,0.6193,0.7995189954301452,0.9453972544537212,0.9920809
Могу ли я открыть несколько вкладов и пополнять их?,"[""['\\n                    4.1. Клиент имеет право:\\n                    4.1.1. Предъявить Банку требование о досрочном полном или частичном изъятии Вклада.\\n                    4.1.2. Вносить дополнительные денежные средства во Вклад/Накопительный счет, если данная возможность установлена \\n                    Тарифным планом.\\n                    4.1.3. Разместить несколько Вкладов (открыть несколько Счетов вклада/Накопительных счетов на условиях, устанавливаемых \\n                    Договором вклада (Договором накопительного счета), Тарифами:\\n                    • через Дистанционное обслуживание;\\n                    • в офисе Банка в часы работы операционного подразделения Банка.\\n']""]"," 
                    Да, вы можете открыть несколько вкладов и пополнять их.
                    Согласно пункту 4.1.3 приведенного контекста, клиент имеет право разместить несколько вкладов (открыть несколько счетов вклада/накопительных счетов) на условиях, устанавливаемых договором вклада (договором накопительного счета) и тарифами.
                    Вы можете открыть несколько вкладов как через дистанционное обслуживание, так и в офисе банка в часы работы операционного подразделения банка.","Да, вы можете открыть несколько вкладов и пополнять их.",1.0,0.9930342833937212,0.9999999999,0.375,0.8935026601727989,0.1386,0.5354738541409173,0.6889970526739597,0.91956735
Для получения страховой выплаты в случае несчастного случая с летальным исходом нужна ли справка из психушки?,"[""['\\n                    6.1. По риску Смерть в результате Несчастного случая должны быть предоставлены следующие документы:\\n                    j. Справка из психоневрологического диспансера и наркологического диспансера']""]","Да, в таком случае необходимы справки из психоневрологического диспансера и наркологического диспансера.","Нет, справка из психушки не требуется для получения страховой выплаты в случае несчастного случая с летальным исходом.",,0.0,0.9999999999,0.6666666666666666,0.8551683023140721,0.0,0.08150598686233711,0.8111485674851496,0.9788718
Дают ли кредит на автомобиль?,"[""['3.1. Банк предоставляет Клиенту Кредит на потребительские цели, в том числе на приобретение Товара и/или Автомобиля, в соответствии с законодательством Российской Федерации.']""]","Да, в соответсвии с пунктом 3.1. Банк предоставляет Клиенту Кредит на потребительские цели, , в том числе на приобретение автомобиля.","Да, кредит на автомобиль может быть предоставлен.",,0.951349046832783,0.9999999999,1.0,0.9165084891731026,0.0,0.23006782192650208,0.7098780043098166,0.972793
Распростроняется ли страховое покрытие на смерть в алкогольном опьянении?,"[""[' \\n                    Страховое покрытие по рискам «Смерть» и «Инвалидность» не распространяется на события, произошедшие в результате \\n                    и/или в период:\\n                    a. действий, совершенных Застрахованным лицом в состоянии алкогольного, наркотического и/или токсического \\n                    опьянения; в результате употребления им наркотических, сильнодействующих лекарственных препаратов \\n                    и психотропных веществ без предписания врача (или по предписанию врача, но с нарушением указанной  \\n                    им дозировки); болезни Застрахованного лица, прямо связанной с наркоманией, токсикоманией, хроническим \\n                    алкоголизмом\\n                    ']""]","Нет, страховое покрытие не распространяется на смерть в алкогольном опьянении.","Да, страховое покрытие не распространяется на смерть в алкогольном опьянении.",,0.9856761715671896,0.9999999999,0.5,0.97375889479017,0.8801,0.8019783064439235,1.0,0.9988552
"Может ли Банк изменить Тарифный план по кредитной карте, и какие условия должны быть соблюдены для этого?","[""['\\n                    Банк вправе в одностороннем порядке изменить Тарифный план, применяемый\\nв рамках Договора, и/или заменить его на другой Тарифный план, в том числе при заключении Договора и/или\\nна определенный период времени по усмотрению Банка, с целью уменьшения процентной ставки по кредиту\\nи/или улучшения иных условий обслуживания при условии, что это не повлечет возникновение новых или увеличение размера существующих денежных обязательств Клиента\\n                    ']""]","Да, Банк может изменить Тарифный план по кредитной карте в одностороннем порядке, но при условии, что это не приведет к возникновению новых или увеличению уже существующих денежных обязательств клиента ","Да, Банк может изменить Тарифный план по кредитной карте. Для этого необходимо согласие клиента и Банка. Банк также имеет право в одностороннем порядке изменить Тарифный план, если это не повлечет возникновение новых или увеличение размера существующих денежных обязательств Клиента. Банк также может уведомить Клиента о таких изменениях через Дистанционное обслуживание.",1.0,0.9706013720519308,0.9999999999,1.0,0.96465205632615,0.1645,0.48121120612657636,0.963407780086417,0.98496705
Можно ли внести частичное досрочное погашение кредита? И как это повлияет на остаток задолженности?,"[""['«Клиент имеет право досрочно погасить Задолженность с уплатой Банку суммы непогашенного Кредита и начисленных процентов, а также (если применимо) комиссий и плат, предусмотренных Тарифным планом, в любой момент путем зачисления необходимой суммы денежных средств на Картсчет (Счет) и извещения Банка о необходимости проведения досрочного погашения. В случае частичного досрочного погашения уменьшается срок Кредита или сумма Регулярного платежа по выбору Клиента, при этом Клиент не освобождается от оплаты ближайшего Регулярного платежа, а также применимых комиссий и плат, предусмотренных Тарифным планом.», «При обращении Клиента в Банк для совершения частичного досрочного погашения до или в дату оплаты ближайшего Регулярного платежа Клиенту может быть предложено совершить частичное досрочное погашение с погашением ближайшего Регулярного платежа и последующим уменьшением срока Кредита или суммы Регулярного платежа по выбору Клиента.»']""]","Да, Клиент имеет право совершить частичное досрочное погашение кредита. При этом по выбору Клиента уменьшится либо срок кредита, либо сумма регулярного платежа. Однако Клиент не освобождается от оплаты ближайшего регулярного платежа и применимых комиссий.","Да, можно внести частичное досрочное погашение кредита. Это повлияет на остаток задолженности, так как уменьшится срок кредита или сумма регулярного платежа по выбору клиента. Однако клиент не освобождается от оплаты ближайшего регулярного платежа, а также применимых комиссий и плат, предусмотренных тарифным планом. При обращении клиента в банк для совершения частичного досрочного погашения до или в дату оплаты ближайшего регулярного платежа клиенту может быть предложено совершить частичное досрочное погашение с погашением ближайшего регулярного платежа и последующим уменьшением срока кредита или суммы регулярного платежа по выбору клиента.",0.8333333333333334,0.9671219599588208,0.9999999999,1.0,0.9602187613380126,0.0805,0.5884229118050776,0.943133673373566,0.98671806
Что будет в случае просрочки платежа по кредиту? И какой штраф может быть начислен?,"[""['«В случае неоплаты платежа Клиент должен уплатить штраф за неоплату Минимального платежа согласно Тарифному плану. Банк рассматривает любой поступивший платеж Клиента как признание Клиентом данного штрафа в размере поступившего платежа, но не более суммы штрафа, определенного в соответствии с Тарифами.»']""]","В случае неоплаты минимального платежа по кредиту, Клиент должен уплатить штраф в соответствии с Тарифным планом. Размер штрафа определяется Тарифами, и любой поступивший от Клиента платеж Банк будет рассматривать как оплату штрафа в пределах установленной суммы.",В случае просрочки платежа по кредиту могут быть начислены штрафы. Конкретный размер штрафа зависит от условий кредитного договора и политики банка.,1.0,0.957756711197781,0.9999999999,1.0,0.9171528074641008,0.0,0.1939142952057362,0.9225126859262256,0.9851002
Можно ли на время приостановить выплаты по кредиту? И как это повлияет на начисление процентов?,"[""['«На основании обращения Клиента и по согласованию с Банком на период от 1 (одного) до 12 (двенадцати) месяцев возможно приостановление обязанности Клиента по погашению Задолженности, по оплате Регулярных платежей и/или иных платежей. В указанный период Банк вправе приостановить начисление процентов и иных сумм, предусмотренных Договором реструктуризации задолженности.»']""]","Да, на основании обращения Клиента и по согласованию с Банком возможно приостановить обязанность по погашению задолженности и оплате платежей на срок от 1 до 12 месяцев. В этот период Банк вправе также приостановить начисление процентов и иных сумм по кредиту.","Да, на основании обращения клиента и согласования с банком возможно приостановление обязанности клиента по погашению задолженности, оплате регулярных платежей и/или иных платежей. В этот период банк вправе приостановить начисление процентов и других сумм, предусмотренных кредитным договором. Оставшийся срок возврата кредита продлевается на согласованный период приостановления обязанности клиента по погашению задолженности, оплате регулярных платежей и/или иных платежей.",1.0,0.924777671777644,0.9999999999,1.0,0.9637295125736564,0.1175,0.5349165625178,0.9469207606554948,0.988955
Я хочу оформить дополнительную карту на супругу. Как это сделать? И будет ли она иметь доступ к общему лимиту по кредитке?,"[""['«3.2. По заявлению Клиента, переданному в Банк на бумажном носителе или через Дистанционное обслуживание, в рамках Договора кредитной карты Банком может быть выпущена одна или несколько дополнительных Кредитных карт.»', '«3.5. Клиент вправе установить лимит для проведения расходных операций с использованием Кредитной карты.»']""]","Вы можете оформить дополнительную кредитную карту на супругу, подав заявление в банк на бумажном носителе или через дистанционное обслуживание. Дополнительная карта будет иметь доступ к общему лимиту задолженности по вашей основной кредитной карте, однако вы можете установить отдельный лимит для расходных операций по дополнительной карте.","Для оформления дополнительной карты на супругу необходимо обратиться в банк, который выдал основную кредитную карту. Процесс оформления дополнительной карты включает подачу заявления на бумажном носителе или через дистанционное обслуживание. Банк может выпустить одну или несколько дополнительных кредитных карт. Дополнительная карта может быть использована держателем, достигшим 18-летнего возраста. Лимит для проведения расходных операций с использованием кредитной карты может быть установлен клиентом.",,0.929396750068852,0.9999999999,1.0,0.9536057632752892,0.119,0.24550943193036512,0.967893080235548,0.99334633
"А что если я потеряю карту? Сколько у меня есть времени, чтобы ее заблокировать? И как вообще это делается? Через приложение или звонить надо?","[""['«6.1. При обнаружении утери, кражи или порчи Кредитной карты и/или возникновения подозрений, что Кредитная карта или ее реквизиты, а также ПИН-код, QR-код, Коды доступа, Аутентификационные данные, Абонентский номер, Абонентское устройство могли быть утрачены или похищены, а также в случае изъятия Кредитной карты в банкомате или торгово-сервисном предприятии и в случае изменения имени или фамилии Держателя Клиент должен незамедлительно уведомить Банк по телефонам 8 800 555-10-10 или +7 495 645-59-19 (круглосуточно) и заблокировать Кредитную карту и/или Интернет-Банк и/или Мобильный банк, а также подать заявление о досрочном перевыпуске Кредитной карты.»']""]","В случае утери или кражи кредитной карты, вы должны незамедлительно уведомить банк по телефонам горячей линии 8 800 555-10-10 или +7 495 645-59-19 (круглосуточно) и заблокировать карту. Также необходимо подать заявление на досрочный перевыпуск новой карты. Чем быстрее вы заблокируете карту, тем меньше риск несанкционированного использования.","Для блокировки карты необходимо связаться с банком через дистанционное обслуживание, телефон или интернет-банк. Чем быстрее вы это сделаете, тем меньше вероятность несанкционированного использования карты злоумышленниками. После блокировки карты, ее можно только перевыпустить. Если вы не уверены, что карту украли, установите лимит ""0"" на операции и запретите покупки через Интернет.",1.0,0.8837325425887097,0.9999999999,1.0,0.9161143575821776,0.0,0.25136459893067564,0.9155447270672644,0.988281
"Прочитал тут у вас про блокировку карточки. А если я её забуду забрать в банкомате, что тогда делать?","[""['«6.1. [...] а также в случае изъятия Кредитной карты в банкомате или торгово-сервисном предприятии и в случае изменения имени или фамилии Держателя Клиент должен незамедлительно уведомить Банк по телефонам 8 800 555-10-10 или +7 495 645-59-19 (круглосуточно) и заблокировать Кредитную карту и/или Интернет-Банк и/или Мобильный банк, а также подать заявление о досрочном перевыпуске Кредитной карты.»']""]","Если вы забыли карту в банкомате, вам необходимо незамедлительно сообщить об этом в банк по телефонам горячей линии 8 800 555-10-10 или +7 495 645-59-19 и заблокировать кредитную карту, а также подать заявление на ее досрочный перевыпуск. Это позволит предотвратить возможное несанкционированное использование забытой карты третьими лицами.","Если вы забыли забрать свою карточку в банкомате, вам следует немедленно сообщить об этом в банк и заблокировать карту. Блокировка карты может быть осуществлена через интернет-банк, мобильное приложение банка или по телефону. Чем скорее вы это сделаете, тем меньше вероятность того, что ваша карта будет использована злоумышленниками. После блокировки карты, вы не сможете разблокировать ее, но можете перевыпустить. Если вы не уверены, что ваша карта была украдена, вы можете установить лимит ""0"" на операции и запретить покупки через Интернет. Банк не несет ответственности за отказы в приеме карты к обслуживанию со стороны организаций торговли/услуг, ошибки, допущенные по вине третьих лиц, а также невозможность использования карты в ситуациях, не контролируемых банком и связанных со сбоями в работе внешних систем.",1.0,0.8309030942262389,0.9999999999,1.0,0.9270674770798972,0.032,0.20509495000562283,0.8505712354019875,0.9847035
"А есть ли какие-то льготные условия, если я захочу приостановить выплаты по кредитке на какое-то время? Например, на ремонт или что-то в этом роде?","[""['«5.15. На основании обращения Клиента и по согласованию с Банком на период от 1 (одного) до 12 (двенадцати) месяцев возможно приостановление обязанности Клиента по погашению Задолженности, по оплате Минимальных платежей, Регулярных платежей и/или иных платежей. В указанный период Банк вправе приостановить начисление процентов и иных сумм, предусмотренных Договором кредитной карты.»']""]","Да, в документе указано, что по обращению клиента и по согласованию с банком возможно приостановление обязанности по погашению задолженности, выплате минимальных и регулярных платежей на срок от 1 до 12 месяцев. В этот период банк также может приостановить начисление процентов и других сумм по кредитной карте. Таким образом, вы можете получить льготный период для ремонта или других нужд, обратившись в банк с соответствующим заявлением.","Да, согласно условиям программы ""Рассрочка"", на основании обращения клиента и по согласованию с банком на период от 1 до 12 месяцев возможно приостановление обязанности клиента по погашению задолженности, оплате минимальных платежей, регулярных платежей и/или иных платежей. В этот период банк также может приостановить начисление процентов и других сумм, предусмотренных договором кредитной карты.",,0.890863318452634,0.9999999999,1.0,0.967992090323301,0.3198,0.5677101375754188,0.9508989047995288,0.9968855
Какие процедуры предусмотрены банком для обработки жалоб клиентов?,"[""['Банк имеет установленные процедуры для обработки и рассмотрения жалоб клиентов, включая регистрацию жалобы, ее анализ и предоставление ответа клиенту в установленные сроки.']""]","Банк следует четко установленным процедурам для обработки жалоб клиентов, которые включают регистрацию жалобы, ее тщательный анализ и предоставление ответа клиенту в соответствии с установленными сроками.","Банк предусматривает следующие процедуры для обработки жалоб клиентов: 1) Запрашивать у клиента документы и сведения об операциях с денежными средствами, целях установления и предполагаемом характере деловых отношений с Банком, целях финансово-хозяйственной деятельности, финансовом положении, деловой репутации, источниках происхождения денежных средств и (или) иного имущества клиента, а также письменные пояснения, подтверждающие соответствие характера проводимых операций режиму Картсчета, определенному настоящими Общими условиями; 2) Блокировать действие Расчетной карты/Токена, в том числе устанавливать лимиты на совершение операций по Расчетной карте; 3) Рассматривать претензии клиента по оспариванию операций в течение 30 (тридцати) дней по операциям, совершенным на территории РФ, и 60 (шестидесяти) дней по операциям, совершенным за пределами территории РФ, со дня получения письменного заявления клиента и необходимых документов.",0.5,0.9936888843062942,0.9999999999,1.0,0.9005885221349903,0.0,0.04747741867389481,0.8939462889777424,0.98205763
Что происходит с депозитами в случае смерти?,"[""['В случае смерти клиента банк замораживает депозиты до решения вопросов наследства в соответствии с законодательством.']""]","После смерти клиента банк замораживает все его депозиты и удерживает их до тех пор, пока не будут решены вопросы наследства в соответствии с действующим законодательством.",В случае смерти депозиты могут быть выплачены наследникам в соответствии с законодательством и условиями договора.,,0.9607008614573976,0.9999999999,1.0,0.9083112424772696,0.0,0.15062977551743595,0.8251131433724014,0.9837941
Могу я отказаться от получения уведомлений от банка и как это влияет на его обслуживание?,"[""['Клиенты имеют право отказаться от получения определенных типов уведомлений от банка, однако это может повлиять на их способность получать своевременную информацию о изменениях условий, сбоях в системе или других важных обновлениях.']""]","Клиенты могут отказаться от получения определенных типов уведомлений от банка, но это может привести к тому, что они не будут получать важные обновления и информацию своевременно, что может повлиять на их способность управлять своими счетами и услугами эффективно.","Вы можете отказаться от получения уведомлений от банка, но это не является основанием для изменения или расторжения договора, отказа в заключении договора с банком или отказа в предоставлении продуктов и услуг банка. Вы также можете отозвать свое согласие на получение рекламы по сетям электросвязи в любое время как полностью, так и частично.",,0.9520877952782656,0.9999999999,1.0,0.9143669756298236,0.0929,0.1532279983592761,0.827532860748975,0.99148554
Как я могу увеличить лимит по своей кредитной карте?,"[""['Для увеличения кредитного лимита клиенты должны подать заявление через мобильное приложение или веб-сайт банка, после чего банк рассмотрит их кредитную историю и текущую финансовую ситуацию.']""]","Чтобы увеличить кредитный лимит, клиентам необходимо подать соответствующее заявление через мобильное приложение или веб-сайт банка. Банк затем оценит их кредитную историю и текущую финансовую ситуацию перед принятием решения.","Вы можете увеличить лимит по своей кредитной карте, обратившись в банк, выпустивший вашу карту, и подав заявление на увеличение лимита. Подробности процедуры могут различаться в зависимости от банка, поэтому рекомендуется обратиться к условиям вашего договора или связаться со службой поддержки клиентов вашего банка.",1.0,0.9850357052679776,0.9999999999,1.0,0.9199234943070776,0.0,0.11405534638931476,0.6812707252613813,0.98792046
"Каковы условия отмены банковской операции, например, перевода средств или платежа?","[""['Клиенты могут отменить определенные банковские операции, если они не были еще обработаны банком. Условия отмены операций установлены в пользовательском соглашении и зависят от типа операции.']""]","Условия отмены банковской операции зависят от того, была ли операция уже обработана банком. Для операций, которые еще не обработаны, клиенты могут инициировать отмену, следуя процедурам, описанным в пользовательском соглашении и в зависимости от типа операции.","Условия отмены банковской операции, например, перевода средств или платежа, могут различаться в зависимости от банка и типа операции. Обычно для отмены операции необходимо обратиться в банк и предъявить претензию по оспариваемым операциям. Также может потребоваться оформление заявления на отказ от операций и предоставление доказательств того, что в определенный момент вы не могли совершить эти операции.",,0.9496092837971124,0.9999999999,1.0,0.9504356916069474,0.0,0.3204146218215072,0.8113715014322774,0.9915591
Какие услуги доступны клиентам через Интернет-банк?,"[""['Через Интернет-банк клиенты могут управлять своими счетами, осуществлять платежи и переводы, а также получать детальную информацию о своих финансовых операциях.']""]","Интернет-банк предоставляет клиентам возможности управления их счетами, осуществления платежей и переводов, а также доступ к подробной информации о всех их финансовых операциях.","Через Интернет-банк клиентам доступны следующие услуги: интернет-банк, мобильный банк, мобильные приложения банка и другие каналы обслуживания в Интернете, включая приложения, размещенные на интернет-сайтах партнеров банка в сети Интернет, а также сервисы передачи сообщений.",,1.0,0.9999999999,1.0,0.9367096973347402,0.0,0.1637988214343436,0.8691142743203982,0.98213124
"Я не пользовалась кредиткой год, но у меня там лежат мои 800 рублей, я могу их как-то вернуть?","['[\'""8. Расторжение Договора кредитной карты\\n                8.1. Банк вправе в любой момент расторгнуть Договор кредитной карты в одностороннем порядке в случаях, предусмотренных \\n                законодательством Российской Федерации, а также:\\n                • в случае если Держатель не пользовался Кредитной картой более, чем 6 (шесть) месяцев при отсутствии \\n                Задолженности по Договору кредитной карты;\\n                В этих случаях Банк блокирует все Кредитные карты/Токены, выпущенные в рамках Договора кредитной карты. Договор \\n                кредитной карты считается расторгнутым со дня формирования Банком Заключительного счета, который направляется \\n                Клиенту. Если в момент расторжения Договора кредитной карты Задолженность Клиента перед Банком отсутствует, Банк \\n                вправе расторгнуть Договор кредитной карты без направления Заключительного счета, информируя Клиента о своем \\n                решении любым способом по усмотрению Банка.\\n                8.5. В случае, если при расторжении Договора кредитной карты в Банке находятся денежные средства Клиента, излишне \\n                перечисленные им при погашении Задолженности, Банк осуществляет возврат таких денежных средств по распоряжению \\n                Клиента почтовым переводом или иным способом, указанном в распоряжении Клиента. При этом Банк вправе удержать \\n                из суммы такого перевода комиссию за перевод денежных средств в размере, предусмотренном Тарифами на услуги \\n                по переводам, платежам и дополнительные услуги с использованием каналов Дистанционного обслуживания.\\n                8.6. В случае неполучения Банком распоряжения Клиента о переводе денежных средств в течение 120 (ста двадцати) дней \\n                со дня обработки Банком последней операции Клиента/Держателя и, если остаток денежных средств не превышает \\n                1000 руб., указанный остаток считается безвозмездно переданным Банку. \\n                В случае неполучения Банком распоряжения Клиента о переводе денежных средств в течение 3 (трех) лет со дня обработки \\n                Банком последней операции Клиента/Держателя указанные денежные средства считаются безвозмездно переданными \\n                Банку.\\n                \']']","Согласно пунуту 8.6 - вы не можете вернуть ваши деньги, так как не дали распоряжение Банку о переводе денежных средств в течение 120 дней.","Вы можете вернуть свои 800 рублей, которые остались на вашей кредитной карте, если вы не пользовались ею в течение года. Однако, для этого вам нужно связаться с банком и запросить возврат средств. Обычно, банк может вернуть деньги, если они были ошибочно зачислены на ваш счет или если произошла техническая ошибка. Если же вы не пользовались картой в течение года, то скорее всего эти средства уже были использованы для оплаты различных услуг или товаров.",1.0,0.0,0.9999999999,0.0769230769230769,0.8690961237136698,0.0,0.1777772737643439,0.7864348725913701,0.9713945
