question,contexts,ground_truth,answer
Можно ли не расписываться на карте?,"['После получения карты поставьте свою подпись в прямоугольнике, расположенном на оборотной стороне карты. При отсутствии подписи карта может быть не принята к оплате в торгово-сервисном предприятии, а также повышается риск использования карты злоумышленниками в случае ее утраты/кражи.']","При отсутствии подписи карта может быть не принята к оплате в торгово-сервисном предприятии, а также повышается риск использования карты злоумышленниками в случае ее утраты/кражи.","Да, в некоторых случаях может потребоваться расписаться на карте."
"Мой друг попросил меня дать свою карту для оплаты и потом вернуть, это не опасно?","['Никогда не принимайте рекомендации, советы, помощь от третьих лиц при пользовании картой, особенно при снятии наличных денежных средств в банкоматах. В случае возникновения затруднений при совершении операции обратитесь Банк посредством дистанционного обслуживания. Обращайте внимание на расположение банкоматов. Старайтесь не пользоваться банкоматами, расположенными в плохо освещенных и безлюдных местах', 'Не передавайте карту другим лицам, в т.ч. родственникам и знакомым для проведения транзакций. С целью исключения Ваших потерь от несанкционированного использования Вашей карты (копирования информации с Вашей карты для ее дальнейшего мошеннического использования): при совершении операции оплаты с использованием карты никогда не выпускайте Вашу карту из поля зрения и требуйте от обслуживающего Вас лица, чтобы все операции с использованием карты совершались в Вашем присутствии.']","Не передавайте карту другим лицам, в т.ч. родственникам и знакомым для проведения транзакций и никогда не принимайте рекомендации, советы, помощь от третьих лиц при пользовании картой, особенно при снятии наличных денежных средств в банкоматах.","Да, это может быть опасно, так как ваш друг может использовать вашу карту для совершения незаконных операций. Рекомендуется обсудить этот вопрос со своим другом и убедиться, что он понимает риски и будет возвращать вам карту после использования."
Безопасно ли хранить пинкод в заметках в телефоне?,"['Категорически запрещается записывать ПИН-код на карте. Постарайтесь не записывать ПИН-код, запомните его. Если же Вы предпочитаете записать свой ПИН-код, никогда не указывайте, что это ПИН-код и не храните документ с записанным ПИН-кодом рядом с картой.']","Да, однако не указывайте в названии заметки, что это ПИН-код от Вашей карты.","Нет, не безопасно хранить пинкод в заметках в телефоне."
Я потеряла карту,"[' Вы потеряли карту или ее украли\nПрежде всего, как можно быстрее, сообщите о случившемся в Банк посредством дистанционного обслуживания \nи заблокируйте карту. Заблокировать карту можно по телефону, в интернет-банке или в мобильном приложении Банка. \nЧем раньше Вы это сделаете, тем меньше вероятность несанкционированного использования карты злоумышленниками. \nРазблокировать карту нельзя — можно только перевыпустить. Если вы не уверены, что карту украли, не спешите ее \nблокировать, установите лимит «0» на операции и запретите покупки через Интернет, если карта будет найдена лимиты \nможно изменить.\nНапоминаем Вам, что в соответствии с Общими условиями выпуска и обслуживания кредитных карт и Общими \nусловиями открытия, ведения и закрытия счетов физических лиц, а также выпуска и обслуживания расчетных карт Ваша \nответственность за дальнейшее использование карты прекращается, после осуществления блокировки, если не станет \nизвестно, что незаконное использование карты имело место с Вашего согласия.\nЕсли карта была у Вас украдена на территории РФ, после блокировки карты заявите о случившемся в полицию. При краже \nкарты за границей, заявите в полицию или в консульский отдел посольства Российской Федерации в стране, на территории \nкоторой произошла кража. Пожалуйста, сохраняйте копию протокола (квитанцию о заявлении) для последующего \nпредъявления в Банк.']","Если вы не уверены, что карту украли, не спешите ее блокировать, установите лимит «0» на операции и запретите покупки через Интернет, если карта будет найдена лимиты можно изменить. В случае, если вы полагаете, что Вашу карту всё-таки украли, то как можно быстрее, сообщите о случившемся в Банк посредством дистанционного обслуживания и заблокируйте карту. Это возможно сделать по телефону, в интернет-банке или в мобильном приложении Банка.","Если вы потеряли карту или ее украли, прежде всего, сообщите об этом в Банк и заблокируйте карту. Блокировку можно осуществить по телефону, в интернет-банке или мобильном приложении банка. Чем быстрее вы это сделаете, тем меньше вероятность несанкционированного использования карты злоумышленниками. Разблокировка карты невозможна, можно только перевыпустить ее. Если вы не уверены, что карту украли, установите лимит ""0"" на операции и запретите покупки через Интернет. Помните, что ваша ответственность за дальнейшее использование карты прекращается после блокировки, если не станет известно о факте кражи."
"Почему при использовании карты важно не расписываться на квитанциях/чеках до того, как вы проверите правильность указанной суммы?","['Проверяйте правильность суммы, указанной на платежном чеке. Поставив подпись на платежном чеке, Вы соглашаетесь со списанием указанной на нем суммы с Вашего карточного счета.']","Важно проверять правильность суммы перед подписанием квитанции/чека, потому что после подписи вы соглашаетесь с этой суммой, и она будет списана с вашего счета.","Не расписываясь на квитанциях/чеках до проверки правильности указанной суммы, вы можете избежать мошенничества, связанного с использованием вашей карты."
"Что делать, если я потеряла телефон, на котором было установлено мобильное приложение банка?","['При утрате Мобильного телефона, используемого с абонентским номером подвижной радиотелефонной связи, на который установлено Мобильное приложение Банка, Вам следует срочно обратиться к своему оператору сотовой связи для блокировки SIM-карты и в Банк посредством дистанционного обслуживания для блокировки доступа в мобильное приложение Банка и удаления данных карты с Мобильного телефона.']","Если вы потеряли телефон с установленным мобильным приложением банка, необходимо:

Срочно обратиться к оператору сотовой связи для блокировки SIM-карты.
Обратиться в банк через дистанционное обслуживание для блокировки доступа в мобильное приложение и удаления данных карты с телефона.","Если вы потеряли телефон, на котором было установлено мобильное приложение банка, вам следует срочно обратиться к своему оператору сотовой связи для блокировки SIM-карты и в банк посредством дистанционного обслуживания для блокировки доступа в мобильное приложение банка и удаления данных карты с мобильного телефона."
Можно ли использовать интернет-кафе и другие общедоступные места для совершения операций по карте в интернете? Объясните причину.,"['Избегайте осуществления Интернет-операций с использованием карты в местах, где услуги Интернет являются общедоступными, например, в Интернет-кафе.']","Нет, не рекомендуется использовать интернет-кафе и другие общедоступные места для совершения операций по карте в интернете. Причина в том, что такие общедоступные сети являются менее безопасными, и есть риск перехвата данных карты злоумышленниками.","Нет, не рекомендуется использовать интернет-кафе и другие общедоступные места для совершения операций по карте в интернете. Это связано с риском кражи личных данных и мошенничества. Лучше всего использовать надежные и проверенные интернет-магазины, где вы уверены в их безопасности."
"Что делать, если я получил SMS-оповещение о операции по карте, которую я не совершал?","['Если Вы уверены, что операция не могла быть совершена Вами, то как можно быстрее сообщите об этом в Банк посредством дистанционного обслуживания и заблокируйте карту.']","Если вы получили SMS-оповещение о операции, которую не совершали, нужно как можно быстрее сообщить об этом в банк через дистанционное обслуживание и заблокировать карту.","Если вы получили SMS-оповещение о операции по карте, которую вы не совершали, вам следует проверить наличие карты и, если она у вас, убедиться, что данные вашей карты не стали известны третьим лицам. Также стоит учесть, что сообщения могут доставляться с задержкой, поэтому проверьте, соответствуют ли они операциям, которые вы совершили по карте за последнее время. Если вы уверены, что сообщение не соответствует вашим действиям, вам следует связаться с банком и оформить претензию через дистанционное обслуживание. Сотрудник банка поможет вам в этом процессе."
Как обезопасить себя от съема данных карты в банкомате злоумышленниками? Приведи два способа.,"['Поэтому, при пользовании банкоматом не ленитесь внимательно осмотреть его и убедиться в отсутствии каких-либо «накладок» и посторонних устройств.', 'Пожалуйста, примите все меры, чтобы вводимый Вами ПИН-код был не заметен для окружающих.']","Чтобы обезопасить себя от съема данных карты в банкомате:

Внимательно осматривайте банкомат перед использованием на наличие подозрительных накладок и посторонних устройств.
Прикрывайте рукой клавиатуру при вводе ПИН-кода, чтобы его не могли увидеть окружающие.","1. Прикрывайте клавиатуру банкомата рукой при вводе ПИН-кода, чтобы избежать возможности компрометации вашего кода через видеокамеры.
2. Никогда не сообщайте свой ПИН-код при совершении операций по карте через сайты сети Интернет, при опросах/ информировании по телефону, электронной почте и т.д., даже если вам звонят лица, представляющиеся сотрудниками Банка."
"Правда ли, что при бронировании гостиницы по карте мне необходимо сообщить все реквизиты карты, включая ПИН-код? Если нет, то что именно требуется сообщить?","['При бронировании номера в гостинице по карте Вас попросят сообщить свое имя, номер карты, срок ее действия (иногда, дополнительно — трехзначный код безопасности, напечатанный на обратной стороне карты на полосе для подписи) и срок Вашего пребывания.']","Нет, неправда. При бронировании гостиницы по карте не требуется сообщать ПИН-код. Обычно для бронирования запрашивают ваше имя, номер карты, срок ее действия, иногда трехзначный код безопасности (CVV/CVC) с оборотной стороны карты и планируемый срок пребывания.","Нет, при бронировании гостиницы по карте вам не нужно сообщать ПИН-код. Вам следует указать только реквизиты карты, такие как номер карты, срок действия и код CVV."
"Если я из другой страны и у меня нет паспорта РФ, что мне делать?","['\n                     1. Документы и сведения, получаемые в целях идентификации Клиентов-физических лиц, а также в целях обслуживания таких Клиентов в рамках Универсального договора\n                     1.4. Реквизиты документа, удостоверяющего личность: серия (при наличии) и номер документа, дата выдачи документа, наименование органа, выдавшего документ (при наличии кода подразделения может не устанавливаться), и код подразделения (при наличии).\n                     1.4.2.для иностранных граждан:\n                     •паспорт иностранного гражданина;\n                     •дипломатический паспорт, служебный паспорт, удостоверяющие личность иностранного гражданина.', '.5.Документ, подтверждающий право иностранного гражданина или лица без гражданства на пребывание (проживание) в Российской Федерации (миграционной карты в случае отсутствия иных документов), в случае если наличие таких документов обязательно в соответствии с международными договорами Российской Федерации и законодательством Российской Федерации;Документами, подтверждающими право иностранного гражданина или лица без гражданства на пребывание (проживание) в РФ, являются:\n                    •миграционная карта в случае отсутствия иных документов;\n                    •вид на жительство;\n                    •разрешение на временное проживание;\n                    •виза;\n                    •иной документ, подтверждающий в соответствии с международными договорами Российской Федерации и законодательством РФ право иностранного гражданина или лица без гражданства на пребывание (проживание) в РФ.\n']","
                        Если вы из другой страны, то для заключения договора вам неообходимы документы, удостоверяющие Вашу личность. Для иностранных граждан это:
                            •паспорт иностранного гражданина;
                            •дипломатический паспорт, служебный паспорт, удостоверяющие личность иностранного гражданина.
                        Также необходимы документы, подтверждающие право иностранного гражданина (проживание) в Российской Федерации (миграционной карты в случае отсутствия иных документов), в случае если наличие таких документов обязательно в соответствии с международными договорами Российской Федерации и законодательством Российской Федерации;Документами, подтверждающими право иностранного гражданина или лица без гражданства на пребывание (проживание) в РФ, являются:
                            •миграционная карта в случае отсутствия иных документов;
                            •вид на жительство;
                            •разрешение на временное проживание;
                            •виза;
                            •иной документ, подтверждающий в соответствии с международными договорами Российской Федерации и законодательством РФ право иностранного гражданина или лица без гражданства на пребывание (проживание) в РФ. ","Если вы являетесь гражданином другой страны и у вас нет паспорта РФ, вам следует обратиться к соответствующим органам вашей страны для получения паспорта РФ или документа, который может быть признан в соответствии с международным договором."
В течении скольких дней действительна выписка из ЕГРЮЛ?,"['\n                    2.2. Выписка из Единого государственного реестра юридических лиц (ЕГРЮЛ). Банком может быть принята копия \n                    выписки, заверенная регистрирующим органом. Выписка считается действительной для предоставления в Банк \n                    в течение 30 (тридцати) календарных дней с даты ее выдачи и должна содержать актуальные сведения на дату  \n                    ее предоставления;']",Выписка из Единого государственного реестра юридических лиц (ЕГРЮЛ) действительна в течении 30 дней с даты ее выдачи.,Выписка из ЕГРЮЛ считается действительной для предоставления в Банк в течение 30 календарных дней с даты ее выдачи и должна содержать актуальные сведения на дату ее предоставления.
Нужно ли ИП указывать свой сайт для предприятия?,"['\n                    3. Документы и сведения, предоставляемые Клиентом-индивидуальным предпринимателем: \n                    3.5. Сведения о доменном имени, указателе страницы сайта в сети «Интернет», с использованием которых Клиентом \nоказываются услуги (при наличии);\n                    ']","Да, индивидуальному предпринимателю необходимо указать сведения о доменном имени, указателе страницы сайта в сети «Интернет».","Да, индивидуальному предпринимателю необходимо указывать свой сайт для предприятия. В контексте указано, что требуется информация о доменном имени, указателе страницы сайта в сети ""Интернет"", с использованием которых клиентом оказываются услуги (пункт 3.5)."
Может ли Банк запросить дополнительные документы - не из списка обязательных?,"['\n                     26. Банк может запросить у Клиента, а Клиент обязуется предоставить по запросу Банка дополнительные документы \n                    и сведения, как предусмотренные, так и не предусмотренные настоящим Перечнем, в том числе в целях надлежащей \n                    идентификации Клиента, его представителя, выгодоприобретателя и бенефициарного владельца в соответствии \n                    с требованиями действующего законодательства Российской Федерации, нормативных актов Банка России, а также \n                    требованиями Банка. Банк вправе не запрашивать отдельные документы и сведения, предусмотренные настоящим \n                    Перечнем, в случаях, установленных внутренними правилами Банка.']","Да, Банк может запросить у Вас дополнительные не предусмотренные Перечнем документы.","Да, Банк может запросить дополнительные документы, которые не являются обязательными, если это предусмотрено его внутренними правилами."
Какие документы нужно предоставить физическому лицу для открытия счета?,"['1. Документы и сведения, получаемые в целях идентификации Клиентов-физических лиц, а также в целях обслуживания таких Клиентов в рамках Универсального договора']","Физическому лицу для открытия счета необходимо предоставить документ, удостоверяющий личность (паспорт или иной документ из списка в п.1.4), документ, подтверждающий регистрацию или место пребывания, ИНН, СНИЛС и контактную информацию.","Для открытия счета физическому лицу необходимо предоставить следующие документы:
- Паспорт гражданина РФ;
- ИНН (индивидуальный номер налогоплательщика);
- СНИЛС (страховой номер индивидуального лицевого счета)."
Какие документы необходимо предоставить юридическому лицу для открытия счета в Банке? Можно ли предоставить сканы документов или нужны оригиналы?,"['2.1. Учредительные документы юридического лица...', '2.2. Выписка из Единого государственного реестра юридических лиц (ЕГРЮЛ)...', '2.3. Документ об избрании единоличного исполнительного органа юридического лица...']","Юридическому лицу необходимо предоставить учредительные документы, выписку из ЕГРЮЛ, документ об избрании руководителя, документы, подтверждающие личность руководителя и лиц, имеющих право подписи. Документы можно предоставить в копиях, заверенных нотариально, регистрирующим органом, руководителем или сотрудником Банка при наличии оригиналов.","Юридическому лицу необходимо предоставить следующие документы для открытия счета в Банке: учредительные документы, такие как Устав юридического лица и/или Учредительный договор. Банк может принять копии этих документов, заверенные регистрирующим органом. Оригиналы документов предоставляются по требованию."
Можно ли открыть счет индивидуальному предпринимателю – иностранному гражданину? Какие документы для этого нужны?,"['3.1. Идентификация индивидуального предпринимателя осуществляется на основании документов и сведений, указанных в пункте 1.4 настоящего Перечня', '3.2. Документ, подтверждающий право иностранного гражданина или лица без гражданства на пребывание (проживание) в Российской Федерации...']","Да, индивидуальному предпринимателю-иностранному гражданину можно открыть счет. Для этого нужно предоставить документ, удостоверяющий личность, документ, подтверждающий право пребывания/проживания в РФ (напр. миграционную карту), ИНН, СНИЛС, выписку из ЕГРИП и контактную информацию.","Да, индивидуальный предприниматель – иностранный гражданин может открыть счет в банке. Для этого ему необходимо предоставить следующие документы:
- Документ, подтверждающий право иностранного гражданина или лица без гражданства на пребывание (проживание) в Российской Федерации (например, миграционная карта).
- Лицензии (разрешения, патенты), выданные в установленном законодательством Российской Федерации порядке, на право осуществления деятельности, подлежащей лицензированию."
"Какие документы потребуются, если открывать счет для нотариуса, занимающегося частной практикой? Может ли нотариус быть иностранцем при этом?","['5.1. Документ, удостоверяющий личность и указанный в пункте 1.4 настоящего Перечня', '5.2. Документ, подтверждающий наделение нотариуса полномочиями (назначение на должность), выдаваемый органами юстиции субъектов Российской Федерации, в соответствии с законодательством Российской Федерации']","Для открытия счета нотариусу, занимающемуся частной практикой, требуется предоставить документ, удостоверяющий личность, документ о назначении на должность нотариуса от органов юстиции, регистрационные документы, финансовые документы и контактные данные. Нотариус может быть иностранцем, в этом случае дополнительно потребуется документ, подтверждающий право на пребывание/проживание в РФ.","Для открытия счета нотариусу, занимающемуся частной практикой, потребуются следующие документы: документ, удостоверяющий личность, документ, подтверждающий наделение нотариуса полномочиями, адрес места жительства или места пребывания, контактная информация и выписка из ЕГРИП. Нотариус может быть иностранцем при этом."
"Как узнать, кто является бенефициарным владельцем юридического лица? Какие документы для этого нужны?",['12. Идентификация бенефициарного(ых) владельца(ев) осуществляется на основании следующий документов и сведений...'],"Для идентификации бенефициарного владельца юридического лица необходимо предоставить документы, удостоверяющие личность бенефициара, документ о регистрации/пребывании в РФ (если бенефициар - иностранец), ИНН, адрес регистрации и контактные данные. Также можно заполнить анкету бенефициарного владельца по форме Банка.","Для того чтобы узнать, кто является бенефициарным владельцем юридического лица, необходимо обратиться к документам, указанным в пунктах 1.5 и 12.3-12.5 настоящего Перечня. Эти документы включают идентификационный номер налогоплательщика, адрес места жительства или места пребывания, контактную информацию и анкету физического лица - бенефициарного владельца по форме Банка, подписанную клиентом."
Расскажи про термины 'Договор страхования' и 'КАСКО',"['1. Термины и определения     \n                    Договор страхования — договор, по которому одна сторона (Страховщик) обязуется за обусловленную договором \n                    плату (страховую премию) при наступлении предусмотренного в договоре события (страхового случая) осуществить \n                    другой стороне (страхователю) или иному лицу, в пользу которого заключен договор (выгодоприобретателю), \n                    страховое возмещение в пределах определенной договором суммы (страховой суммы).', 'КАСКО — комбинированное страхование транспортных средств и сопутствующих рисков.']"," Да, конечно! Договор страхования — это договор, по которому одна сторона (Страховщик) обязуется за обусловленную договором 
                    плату (страховую премию) при наступлении предусмотренного в договоре события (страхового случая) осуществить 
                    другой стороне (страхователю) или иному лицу, в пользу которого заключен договор (выгодоприобретателю), 
                    страховое возмещение в пределах определенной договором суммы (страховой суммы). 
                    КАСКО — это комбинированное страхование транспортных средств и сопутствующих рисков.","Договор страхования - это соглашение между страхователем и страховщиком, которое определяет права и обязанности сторон в отношении страхования определенных рисков. В контексте данного текста, речь идет о договоре страхования как таковом, без конкретизации его типа. 

Термин ""КАСКО"" относится к определенному виду страхования транспортных средств. Это комбинированный вид страхования, который включает в себя защиту от различных рисков, связанных с эксплуатацией автомобиля, таких как угон, повреждения в результате ДТП и т.д."
"Какой минимум страховой выплаты мне вернут, если моя страховая сумма = 50 000 долларов?"," 
                    2.19.   При добровольном страховании непредвиденных расходов путешественников страховая сумма в договоре 
                    страхования может быть установлена в рублях или иностранной валюте в рублевом эквиваленте по официальному 
                    курсу иностранных валют ЦБ РФ на дату заключения Договора страхования, но не менее чем 66,7 руб. за 1 у.е.  при 
                    страховой сумме 30 000 у.е., 57,2 руб. за 1 у.е. при страховой сумме 35 000 у.е., 50 руб. за 1 у.е. при страховой сумме 
                    50 000 у.е., 26,7 руб. за 1 у.е. при страховой сумме 75 000 у.е."," 
                    Минимальная страховая выплата, которую вам вернут, если ваша страховая сумма составляет 50 000 долларов, составляет 50 рублей за 1 доллар США. Минимальная выплата составит 2 500 000 рублей.
                    Обратите внимание, что это минимальная выплата, которую вы получите. Фактическая сумма выплаты может варьироваться в зависимости от условий вашего договора.
        ",Я не знаю ответа на этот вопрос.
"При принятии пользовательских соглашений, кому еще попадают мои данные?","['\n                    5. Персональные данные     \n                        5.1.       Пользователь подтверждает, что с использованием Дистанционных каналов взаимодействия дает Страховщику, \n                        аффилированным лицам страховщика, Страховому агенту или Страховому брокеру, а также лицам, \n                        предоставляющим услуги по использованию их информационных возможностей для целей заключения договоров \n                        страхования, хранения документов, в том числе, облачных сервисов, серверов, программных продуктов, согласие на \n                        обработку его персональных данных с целью осуществления дистанционного взаимодействия с последними при \n                        использовании их Сайта и/или сайтов в сети Интернет или при помощи ПО Страховщика и в целях осуществления \n                        маркетинговых коммуникаций перечисленных лиц с Пользователем.  \n        ']","
                    Согласно пункту 5.1 пользовательского соглашения, ваши персональные данные могут быть переданы следующим сторонам:
                        • Аффилированные лица страховщика
                        • Страховой агент
                        • Страховой брокер
                        • Лица, предоставляющие услуги по использованию их информационных возможностей для целей заключения договоров страхования, хранения документов, в том числе облачных сервисов, серверов, программных продуктов
","Данные могут быть переданы третьим лицам, включая операторов фискальных данных и операторов электронного документооборота, для проверки платежеспособности."
Зачем страховщик ведет аудио и видеозапись при взаимодействии с клиентом? Как долго эти записи хранятся?,"['При заключении Договоров страхования, а также при ином обращении Клиента или Пользователя к Страховщику или его представителям Страховщик вправе осуществлять наблюдение, фотографирование, аудио- и видеозапись, включая запись телефонных разговоров, а также копирование и хранение переписок между Пользователем и Страховщиком (его представителями) по электронной почте или в мессенджерах, без дополнительного уведомления Клиента (Пользователя) о такой записи. Клиент соглашается, что Страховщик вправе хранить такие записи в течение 5 (пяти) лет с момента прекращения отношений с Клиентом (Пользователем), с целью улучшения качества обслуживания, исполнения Договора страхования, а также использовать их при проведении любых расследований в связи с Договором страхования.']","Страховщик ведет аудио, видеозапись, фотографирование, копирует переписку с клиентом без дополнительного уведомления с целью улучшения качества обслуживания, исполнения договора страхования, а также для использования этих записей при проведении расследований, связанных с договором. Такие записи страховщик вправе хранить в течение 5 лет с момента прекращения отношений с клиентом.",Страховщик ведет аудио и видеозапись при взаимодействии с клиентом для улучшения качества обслуживания и разрешения возможных споров или претензий. Записи хранятся в течение 5 лет после прекращения отношений со страхователем.
В каких случаях застрахованному могут быть оплачены планируемые расходы по страховому случаю до предоставления подтверждающих документов? Какие ограничения есть по размеру таких выплат?,"['По договорам добровольного страхования непредвиденных расходов путешественников по предварительному согласованию со Страховщиком Застрахованному могут оплачиваться планируемые расходы по предусмотренным договором страхования страховым событиям, предусматривающим возмещение расходов на оказание Экстренной или Неотложной амбулаторной и/или стационарной помощи, с условием предоставления Застрахованным документов, подтверждающих такие расходы Страховщику непосредственно после их несения (чеки, платежные документы и пр.). В случае если в результате страхового случая Застрахованным лицом были понесены соответствующие расходы на оказание Экстренной или Неотложной амбулаторной и/или стационарной помощи, в том числе, предварительно согласованные Страховщиком, но не были предоставлены документы, подтверждающие их оплату, Страховщик возмещает расходы в размере не более 200 у.е. (если страховая сумма установлена в валюте, отличной от российского рубля) или 10 000 российских рублей (если страховая сумма установлена в российских рублях), за один страховой случай.']","По договорам добровольного страхования непредвиденных расходов путешественников застрахованному могут быть оплачены планируемые расходы по страховым случаям, предусматривающим возмещение расходов на экстренную/неотложную амбулаторную или стационарную помощь, по предварительному согласованию со страховщиком. Условие - предоставление подтверждающих документов сразу после несения расходов. Если документы не предоставлены, то страховщик возмещает расходы в размере не более 200 у.е. (если страховая сумма в валюте) или 10 000 рублей (если в рублях) за один случай.","Застрахованному могут быть оплачены планируемые расходы по страховому случаю до предоставления подтверждающих документов в случае, если это предусмотрено договором страхования и если эти расходы связаны с оказанием экстренной или неотложной амбулаторной и/или стационарной помощи. Ограничения по размеру таких выплат устанавливаются договором страхования."
Куда пользователь может направить обращение при возникновении вопросов или спора со страховщиком?,"['При возникновении вопросов или спора можно отправить обращение:\n\nв АО «Тинькофф Страхование» по почте по адресу: 127287, Российская Федерация, г. Москва, ул. 2-я Хуторская, дом 38А, строение 26, либо путем заполнения соответствующей формы на сайте Страховщика;\nк финансовому уполномоченному путем регистрации обращения на сайте — finombudsman.ru или по почтовому адресу: 119017, г. Москва, Старомонетный пер., дом 3;\nво Всероссийский союз страховщиков на сайте — ins-union.ru, приложив к обращению необходимые документы и сведения, либо на почтовый адрес: 115093, г. Москва, ул. Люсиновская, д. 27, стр. 3;\nв Центральный Банк Российской Федерации (Банк России) через интернет-приемную на официальном сайте — cbr.ru, приложив к обращению необходимые документы и сведения, либо на почтовый адрес: 107016, г. Москва, ул. Неглинная, д. 12.']","При возникновении вопросов или спора с АО 'Тинькофф Страхование' пользователь может направить обращение:

 - В АО 'Тинькофф Страхование' по почте или через форму на сайте;
 - Финансовому уполномоченному на сайте finombudsman.ru или почтовым адресом;
 - Во Всероссийский союз страховщиков на сайте ins-union.ru или почтовым адресом;
В Центральный Банк РФ через интернет-приемную на сайте cbr.ru или почтовым адресом.","Пользователь может направить обращение при возникновении вопросов или спора со страховщиком через сайт Страховщика, сайты в сети Интернет страховых агентов и страховых брокеров Страховщика, а также аффилированных лиц Страховщика и/или их мобильных приложений."
Где можно ознакомиться с дополнительной информацией и документами о деятельности АО 'Тинькофф Страхование'?,"['Дополнительная информация и документы о деятельности Страховщика в соответствии с п. 6.1 Закона РФ от 27.11.1992 N 4015-1 «Об организации страхового дела в Российской Федерации» и п. 2.1.1. «Базового стандарта защиты прав и интересов физических и юридических лиц — получателей финансовых услуг, оказываемых членами саморегулируемых организаций, объединяющих страховые организации» размещены по ссылкам: tinkoffinsurance.ru/about, tinkoffinsurance.ru/about/documents.']",Дополнительная информация и документы о деятельности АО 'Тинькофф Страхование' в соответствии с законом 'Об организации страхового дела в РФ' и базовым стандартом защиты прав получателей финансовых услуг размещены на сайте страховщика по ссылкам tinkoffinsurance.ru/about и tinkoffinsurance.ru/about/documents.,Дополнительную информацию и документы о деятельности АО 'Тинькофф Страхование' можно найти на официальном сайте компании.
Что означает 'Партия' и вообще 'Слиток' для драгоценных металлов?,"['\n                    Партия — приобретенные Клиентом Слитки в количестве, превышающем 1 (одну) штуку, и подлежащие доставке Клиенту, \n                    в рамках одной Заявки', ' Слиток — аффинированный драгоценный металл: золото, серебро, платина и палладий в виде слитков (стандартных, \n                    мерных), соответствующих установленным в Российской Федерации стандартам или международным стандартам качества, \n                    изготовленных и маркированных организацией, осуществляющей аффинаж драгоценного металла. Слиток в рамках \n                    предоставления Сервиса доставляется / принимается на хранение в ненарушенной Упаковке с приложением Сертификата-\n                    ярлыка (при наличии) и Сертификата качества слитка']","Давайте разберемся! 
                    Партия — это приобретенные клиентом слитки в количестве, превышающем 1 штуку, и подлежащие доставке клиенту, в рамках одной заявки.
                    Слиток — это аффинированный драгоценный металл: золото, серебро, платина и палладий в виде слитков (стандартных, 
                    мерных), соответствующих установленным в Российской Федерации стандартам или международным стандартам качества, 
                    изготовленных и маркированных организацией, осуществляющей аффинаж драгоценного металла. Слиток в рамках 
                    предоставления Сервиса доставляется / принимается на хранение в ненарушенной Упаковке с приложением Сертификата-
                    ярлыка (при наличии) и Сертификата качества слитка.
        ","Партия - это приобретенные клиентом слитки в количестве, превышающем 1 штуку, и подлежащие доставке клиенту в рамках одной заявки. Слиток - это физический объект драгоценного металла, а сертификат-ярлык и сертификат качества слитка - это документы, подтверждающие его подлинность и качество."
Меня действительно должны фотографировать после полкчения слитка? Какой это пункт в соглашении?,"['\n                    2.13.12. После подтверждения получения Клиентом/Доверенным лицом Слитка Представитель фотографирует Клиента/\n                    Доверенное лицо с полученным Слитком в ненарушенной заводской упаковке и документом, удостоверяющим личность \n                    Клиента/Доверенного лица']","Да, Вас действительно должнен сфотографировать Представитель в соответсвии с пунктом 2.13.12.","В предоставленном контексте нет информации о том, должен ли клиент быть сфотографирован после получения слитка."
Какие условия хранения?,"[' \n                    2.14.9. Условия хранения: температура воздуха от +17 до +25 °С, атмосферное давление от 740 до 760 мм рт. ст., относительная \n                    влажность воздуха от 30 до 60%']","
                    В соответсвии с пунктом 2.14.9. условия хранения слитка слудующие: 
                        - температура воздуха от +17 до +25 °С,
                        - атмосферное давление от 740 до 760 мм рт. ст.,
                        - относительная влажность воздуха от 30 до 60% ",Условия хранения должны быть от 30% до 60% влажности воздуха.
Что такое 'Сертификат качества слитка'?,"['Сертификат качества слитка — документ о качестве драгоценного металла, содержащий сведения о соответствии драгоценного металла стандартам качества, технические характеристики и параметры Слитка, информацию о химическом составе, произведенный/заверенный предприятием-изготовителем Слитка.']","Сертификат качества слитка - это документ, выданный изготовителем слитка драгоценного металла, который содержит информацию о соответствии металла стандартам качества, его технические характеристики, параметры и химический состав.","Сертификат качества слитка - это документ, содержащий основные сведения о слитке, такие как номер слитка, соответствие драгоценного металла стандартам качества, лигатурная масса, проба драгоценного металла, дата выпуска, а также технические характеристики и параметры слитка, информация о химическом составе. Этот сертификат производится или заверяется предприятием-изготовителем слитка."
На какой срок выдается эта доверенность? Можно ли ее передоверить другому лицу?,"['Датой выдачи доверенности считается дата предоставления Представляемым Банку данных своего представителя. Доверенность выдана сроком на 1 (один) год, полномочия по настоящей доверенности не могут быть передоверены другим лицам.']",Доверенность выдается сроком на 1 год. Полномочия по этой доверенности нельзя передоверять другим лицам.,"Доверенность выдана сроком на 1 (один) год, и полномочия по ней не могут быть переданы другим лицам."
"Как клиент может получить сертификат качества слитка, который он передал на хранение в банк?","['По требованию Клиента Банк предоставляет Клиенту заверенную Банком копию Сертификата качества слитка, переданного на ответственное хранение.']","По требованию клиента банк предоставляет ему заверенную копию сертификата качества слитка, который клиент передал на ответственное хранение в банке.","Для получения сертификата качества слитка, который был передан на хранение в банк, клиент должен заключить договор ответственного хранения слитка и сертификата качества слитка. Это делается путем акцепта банком заявки клиента и подписанием акта приема-передачи, подтверждающего прием слитка банком на ответственное хранение."
Какие условия хранения слитков в банке? Где их хранят?,"['Хранение Банком Слитка Клиента осуществляется в хранилище 5 (Пятого) класса устойчивости к взлому, оборудованном системой видеонаблюдения и охранно-пожарной и тревожной сигнализации с выводом сигнала на пункт централизованной охраны, с осуществлением физической круглосуточной специализированной охраны хранилища.', 'Условия хранения: температура воздуха от +17 до +25 °С, атмосферное давление от 740 до 760 мм рт. ст., относительная влажность воздуха от 30 до 60%.']","Слитки хранятся в специальном хранилище 5 класса устойчивости к взлому, оборудованном системами видеонаблюдения, охранно-пожарной и тревожной сигнализацией, а также круглосуточной охраной. Условия хранения: температура +17...+25°С, атмосферное давление 740-760 мм рт.ст., влажность 30-60%.","Слитки хранятся в хранилище 5 класса устойчивости к взлому, оборудованном системой видеонаблюдения и охранно-пожарной и тревожной сигнализацией с выводом сигнала на пункт централизованной охраны, с осуществлением физической круглосуточной специализированной охраны хранилища. Условия хранения включают температуру воздуха от +17 до +25 °С, атмосферное давление от 740 до 760 мм рт. ст., относительную влажность воздуха от 30 до 60%."
"Можно ли вернуть слиток в банк, если при получении были обнаружены его повреждения? Как это сделать?","['В случае обнаружения при приеме Слитка с ответственного хранения от Представителя нарушения целостности заводской упаковки Слитка, несоответствия нанесенной на Слиток маркировки данным, указанным в Сертификате качества слитка и/или Сертификате-ярлыке, отсутствия либо повреждения Сертификата качества слитка и/или Слитка (наличие на поверхности Слитка наплывов / заусенцев / царапин / жировых пятен / посторонних включений) Клиентом/Доверенным лицом и Представителем оформляется в двух экземплярах Рекламационный акт по форме Приложения № 3 к настоящим Правилам, в котором фиксируются указанные выше нарушения / несоответствия / повреждения. В случае наличия указанных выше нарушений / несоответствий / повреждений Слиток вместе с Сертификатом качества слитка и Сертификатом-ярлыком вкладываются Клиентом/Доверенным лицом в порожний сейф-пакет и запечатываются, после чего сейф-пакет помещается в Устройство для перевозки слитка с дальнейшим опломбированием номерной разовой пломбой. Номер сейф-пакета, а также номерной разовой пломбы отражаются в Рекламационном акте.']","Да, если при получении слитка с хранения были обнаружены его повреждения или нарушения упаковки, несоответствия маркировки и т.п., то клиент/доверенное лицо вместе с представителем банка оформляют рекламационный акт в двух экземплярах. В этом акте фиксируются все нарушения. После этого слиток вместе с сертификатами запечатывают в новый сейф-пакет и опломбировывают, указав номера на рекламационном акте. Затем слиток возвращается обратно в банк.","Да, вы можете вернуть слиток в банк, если при получении были обнаружены его повреждения. Однако, как указано в правилах, банк имеет право изменить условия и место хранения слитка без письменного уведомления клиента в случае возникновения обстоятельств непреодолимой силы или других случаев, предусмотренных законодательством Российской Федерации. Поэтому вам следует обратиться в банк для получения дальнейших инструкций по возврату поврежденного слитка."
Кто может стать доверенным лицом?,"['Доверенное лицо — физическое лицо, уполномоченное Клиентом, которому предоставлено право на представление интересов Клиента и осуществление действий от его имени в рамках Сервиса на основании доверенности, оформленной посредством Дистанционного обслуживания в соответствии с п. 5.3 настоящих Правил по форме Приложения № 5 к настоящим Правилам.']","Доверенным лицом клиента может стать любое физическое лицо, которому клиент предоставит полномочия представлять его интересы в рамках сервиса покупки/продажи слитков драгоценных металлов. Доверенность на это лицо оформляется клиентом посредством дистанционного обслуживания в банке по форме из Приложения №5 к Правилам.","Доверенным лицом может стать любое лицо, которому доверитель хочет передать свои права и обязанности. Это может быть как физическое лицо, так и юридическое. Однако, для того чтобы стать доверенным лицом, необходимо иметь соответствующие полномочия, которые должны быть указаны в доверенности."
Можно ли поменять доверенное лицо? Как это сделать?,"['Клиент может отменить выданную доверенность путем обращения в Банк посредством Дистанционного обслуживания в любое время, но не позднее одного дня до планируемой даты встречи с представителем Клиента.']","Да, клиент может отменить ранее выданную доверенность на доверенное лицо. Для этого он должен обратиться в банк посредством дистанционного обслуживания не позднее чем за 1 день до планируемой даты встречи с действующим доверенным лицом.","Да, можно поменять доверенное лицо. Для этого необходимо обратиться в Банк посредством Дистанционного обслуживания и отменить выданную доверенность."
Как происходит покупка слитка банком? Есть ли какие-то особые условия?,"['Банк приобретает у Клиента только Слитки, находящиеся на ответственном хранении в Банке.', 'Клиент, обращаясь с Заявкой, подтверждает, что на момент заключения договора купли-продажи Слиток принадлежит на праве собственности Клиенту, не продан, не является предметом залога, не обременен правами третьих лиц, в споре, под арестом и иным запрещением не состоит.']","Банк осуществляет покупку слитков драгоценных металлов только у тех клиентов, чьи слитки находятся на ответственном хранении в самом банке. При подаче заявки на продажу слитка клиент должен подтвердить, что на момент продажи слиток принадлежит ему на праве собственности, не продан, не заложен, не арестован и не обременен правами третьих лиц.","Из предоставленного контекста нельзя однозначно ответить на вопрос о том, как происходит покупка слитка банком и есть ли особые условия для этого процесса. Однако, можно отметить, что банк принимает слитки на хранение и учитывает их на соответствующем счете в балансе банка по учетной цене с момента начала действия договора хранения. Также отмечается, что договор хранения прекращается в случае возврата слитка с хранения или совершения сделки купли-продажи слитка. Кроме того, услуга покупки слитка доступна клиентам с подключенным сервисом Tinkoff Premium / Private."
Что такое накопительный счет и как начисляются проценты?,"['\n                    3.1. Начисление процентов на остаток средств по Счету вклада/Накопительному счету производится со дня, следующего \n                    за днем зачисления денежных средств на Счет вклада/Накопительный счет Клиента, до дня окончания срока Вклада \n                    (включительно) либо до их списания со Счета вклада/Накопительного счета по иным основаниям.', ' \n                    3.3. Клиент имеет возможность по согласованию с Банком посредством Дистанционного обслуживания изменить Тарифный \n                    план Вклада на Тарифный план для мультивалютного Вклада. При смене Тарифного плана изменения в части процентной \n                    ставки по Счету вклада, изначально открытого в рамках текущего Договора вклада, не распространяются до конца срока \n                    размещения, установленного предыдущим Тарифным планом. Процентные ставки по валютам, отличным от валюты \n                    измененного Тарифного плана, устанавливаются новым Тарифным планом.\n                    3.4. При начислении процентов в расчет принимается величина процентной ставки (в процентах годовых) и фактическое \n                    количество календарных дней, на которое привлечены денежные средства. При этом за базу берется действительное \n                    число календарных дней в году (365 или 366 дней соответственно).\n                    ', ' \n                    Накопительный счет — счет, на котором учитываются денежные средства Клиента, предусматривающий начисление \n                    процентов на остаток денежных средств, в соответствии с Договором накопительного счета.']","
                    Накопительный счет - это счет, на котором учитываются денежные средства клиента и на который начисляются проценты на остаток денежных средств. Проценты начисляются в соответствии с условиями договора накопительного счета.
                    Проценты на накопительном счете начисляются со дня, следующего за днем зачисления денежных средств на счет, до дня окончания срока вклада (включительно) либо до их списания со счета по другим основаниям.

                    При начислении процентов учитываются:
                    • Величина процентной ставки (в процентах годовых)
                    • Фактическое количество календарных дней, на которое привлечены денежные средства

                    За базу берется действительное число календарных дней в году (365 или 366 дней соответственно).","Накопительный счет - это счет, на котором учитываются денежные средства клиента, предусматривающий начисление процентов на остаток денежных средств. Проценты начисляются в соответствии с договором накопительного счета."
Можно ли открыть вклад в 12 лет?,"['1.2. Банк не заключает Договор вклада (Договор накопительного счета) с лицами, не достигшими возраста 14 лет']","Нет, Банк не заключает договор вклада с лицами, не достигшими возраста 14 лет.","Нет, согласно представленному фрагменту контекста, Банк не заключает договор вклада с лицами, не достигшими возраста 14 лет."
Могу ли я открыть несколько вкладов и пополнять их?,"['\n                    4.1. Клиент имеет право:\n                    4.1.1. Предъявить Банку требование о досрочном полном или частичном изъятии Вклада.\n                    4.1.2. Вносить дополнительные денежные средства во Вклад/Накопительный счет, если данная возможность установлена \n                    Тарифным планом.\n                    4.1.3. Разместить несколько Вкладов (открыть несколько Счетов вклада/Накопительных счетов на условиях, устанавливаемых \n                    Договором вклада (Договором накопительного счета), Тарифами:\n                    • через Дистанционное обслуживание;\n                    • в офисе Банка в часы работы операционного подразделения Банка.\n']"," 
                    Да, вы можете открыть несколько вкладов и пополнять их.
                    Согласно пункту 4.1.3 приведенного контекста, клиент имеет право разместить несколько вкладов (открыть несколько счетов вклада/накопительных счетов) на условиях, устанавливаемых договором вклада (договором накопительного счета) и тарифами.
                    Вы можете открыть несколько вкладов как через дистанционное обслуживание, так и в офисе банка в часы работы операционного подразделения банка.","Да, вы можете открыть несколько вкладов и пополнять их. Однако, согласно представленному контексту, пополнение продленного вклада возможно только после получения уведомления о пролонгации."
Для получения страховой выплаты в случае несчастного случая с летальным исходом нужна ли справка из психушки?,['\n                    6.1. По риску Смерть в результате Несчастного случая должны быть предоставлены следующие документы:\n                    j. Справка из психоневрологического диспансера и наркологического диспансера'],"Да, в таком случае необходимы справки из психоневрологического диспансера и наркологического диспансера.","Нет, справка из психушки не требуется для получения страховой выплаты в случае несчастного случая с летальным исходом."
Дают ли кредит на автомобиль?,"['3.1. Банк предоставляет Клиенту Кредит на потребительские цели, в том числе на приобретение Товара и/или Автомобиля, в соответствии с законодательством Российской Федерации.']","Да, в соответсвии с пунктом 3.1. Банк предоставляет Клиенту Кредит на потребительские цели, , в том числе на приобретение автомобиля.","Да, кредит на автомобиль может быть предоставлен."
Распростроняется ли страховое покрытие на смерть в алкогольном опьянении?,"[' \n                    Страховое покрытие по рискам «Смерть» и «Инвалидность» не распространяется на события, произошедшие в результате \n                    и/или в период:\n                    a. действий, совершенных Застрахованным лицом в состоянии алкогольного, наркотического и/или токсического \n                    опьянения; в результате употребления им наркотических, сильнодействующих лекарственных препаратов \n                    и психотропных веществ без предписания врача (или по предписанию врача, но с нарушением указанной  \n                    им дозировки); болезни Застрахованного лица, прямо связанной с наркоманией, токсикоманией, хроническим \n                    алкоголизмом\n                    ']","Нет, страховое покрытие не распространяется на смерть в алкогольном опьянении.","Да, страховое покрытие не распространяется на смерть в алкогольном опьянении."
"Может ли Банк изменить Тарифный план по кредитной карте, и какие условия должны быть соблюдены для этого?","['\n                    Банк вправе в одностороннем порядке изменить Тарифный план, применяемый\nв рамках Договора, и/или заменить его на другой Тарифный план, в том числе при заключении Договора и/или\nна определенный период времени по усмотрению Банка, с целью уменьшения процентной ставки по кредиту\nи/или улучшения иных условий обслуживания при условии, что это не повлечет возникновение новых или увеличение размера существующих денежных обязательств Клиента\n                    ']","Да, Банк может изменить Тарифный план по кредитной карте в одностороннем порядке, но при условии, что это не приведет к возникновению новых или увеличению уже существующих денежных обязательств клиента ","Да, Банк может изменить Тарифный план по кредитной карте. Для этого необходимо заявление клиента и согласие банка. Банк также имеет право изменить Тарифный план в одностороннем порядке, например, для уменьшения процентной ставки или улучшения других условий обслуживания. Однако это должно быть сделано таким образом, чтобы не повлечь возникновение новых или увеличение размера существующих денежных обязательств клиента."
Можно ли внести частичное досрочное погашение кредита? И как это повлияет на остаток задолженности?,"['«Клиент имеет право досрочно погасить Задолженность с уплатой Банку суммы непогашенного Кредита и начисленных процентов, а также (если применимо) комиссий и плат, предусмотренных Тарифным планом, в любой момент путем зачисления необходимой суммы денежных средств на Картсчет (Счет) и извещения Банка о необходимости проведения досрочного погашения. В случае частичного досрочного погашения уменьшается срок Кредита или сумма Регулярного платежа по выбору Клиента, при этом Клиент не освобождается от оплаты ближайшего Регулярного платежа, а также применимых комиссий и плат, предусмотренных Тарифным планом.», «При обращении Клиента в Банк для совершения частичного досрочного погашения до или в дату оплаты ближайшего Регулярного платежа Клиенту может быть предложено совершить частичное досрочное погашение с погашением ближайшего Регулярного платежа и последующим уменьшением срока Кредита или суммы Регулярного платежа по выбору Клиента.»']","Да, Клиент имеет право совершить частичное досрочное погашение кредита. При этом по выбору Клиента уменьшится либо срок кредита, либо сумма регулярного платежа. Однако Клиент не освобождается от оплаты ближайшего регулярного платежа и применимых комиссий.","Да, можно внести частичное досрочное погашение кредита. Это повлияет на остаток задолженности следующим образом: к оплате будут предъявлены только начисленные проценты и сумма непогашенного кредита, входящая в состав ближайшего регулярного платежа. Оплаченные совместно с ближайшим регулярным платежом комиссии и платы будут направлены на их досрочную оплату. Проценты, начисленные за использование кредита с даты частичного досрочного погашения до установленной даты оплаты погашенного ближайшего регулярного платежа, будут включены в следующий регулярный платеж."
Что будет в случае просрочки платежа по кредиту? И какой штраф может быть начислен?,"['«В случае неоплаты платежа Клиент должен уплатить штраф за неоплату Минимального платежа согласно Тарифному плану. Банк рассматривает любой поступивший платеж Клиента как признание Клиентом данного штрафа в размере поступившего платежа, но не более суммы штрафа, определенного в соответствии с Тарифами.»']","В случае неоплаты минимального платежа по кредиту, Клиент должен уплатить штраф в соответствии с Тарифным планом. Размер штрафа определяется Тарифами, и любой поступивший от Клиента платеж Банк будет рассматривать как оплату штрафа в пределах установленной суммы.","В случае просрочки платежа по кредиту могут быть начислены штрафы. Размер штрафа зависит от условий договора между заемщиком и кредитором. Обычно размер штрафа указывается в договоре и может составлять определенный процент от суммы просроченного платежа или фиксированную сумму. Рекомендуется внимательно изучить условия договора перед его подписанием, чтобы избежать возможных проблем в будущем."
Можно ли на время приостановить выплаты по кредиту? И как это повлияет на начисление процентов?,"['«На основании обращения Клиента и по согласованию с Банком на период от 1 (одного) до 12 (двенадцати) месяцев возможно приостановление обязанности Клиента по погашению Задолженности, по оплате Регулярных платежей и/или иных платежей. В указанный период Банк вправе приостановить начисление процентов и иных сумм, предусмотренных Договором реструктуризации задолженности.»']","Да, на основании обращения Клиента и по согласованию с Банком возможно приостановить обязанность по погашению задолженности и оплате платежей на срок от 1 до 12 месяцев. В этот период Банк вправе также приостановить начисление процентов и иных сумм по кредиту.","Да, согласно представленному контексту, банк может приостановить начисление процентов и других сумм, предусмотренных кредитным договором, на определенный период. Однако это может привести к продлению срока возврата кредита на согласованный период приостановки обязанности клиента по погашению задолженности. Также возможно изменение даты регулярного платежа, что может повлиять на срок возврата кредита и дату формирования выписки по договору расчетной карты или счету."
Я хочу оформить дополнительную карту на супругу. Как это сделать? И будет ли она иметь доступ к общему лимиту по кредитке?,"['«3.2. По заявлению Клиента, переданному в Банк на бумажном носителе или через Дистанционное обслуживание, в рамках Договора кредитной карты Банком может быть выпущена одна или несколько дополнительных Кредитных карт.»', '«3.5. Клиент вправе установить лимит для проведения расходных операций с использованием Кредитной карты.»']","Вы можете оформить дополнительную кредитную карту на супругу, подав заявление в банк на бумажном носителе или через дистанционное обслуживание. Дополнительная карта будет иметь доступ к общему лимиту задолженности по вашей основной кредитной карте, однако вы можете установить отдельный лимит для расходных операций по дополнительной карте.","Для оформления дополнительной карты на супругу вам необходимо обратиться в банк, который выдал основную кредитную карту. Процесс оформления может отличаться в зависимости от банка, но обычно он включает заполнение заявления и предоставление необходимых документов. Однако, стоит учесть, что доступ к общему лимиту по кредитке может быть ограничен банком."
"А что если я потеряю карту? Сколько у меня есть времени, чтобы ее заблокировать? И как вообще это делается? Через приложение или звонить надо?","['«6.1. При обнаружении утери, кражи или порчи Кредитной карты и/или возникновения подозрений, что Кредитная карта или ее реквизиты, а также ПИН-код, QR-код, Коды доступа, Аутентификационные данные, Абонентский номер, Абонентское устройство могли быть утрачены или похищены, а также в случае изъятия Кредитной карты в банкомате или торгово-сервисном предприятии и в случае изменения имени или фамилии Держателя Клиент должен незамедлительно уведомить Банк по телефонам 8 800 555-10-10 или +7 495 645-59-19 (круглосуточно) и заблокировать Кредитную карту и/или Интернет-Банк и/или Мобильный банк, а также подать заявление о досрочном перевыпуске Кредитной карты.»']","В случае утери или кражи кредитной карты, вы должны незамедлительно уведомить банк по телефонам горячей линии 8 800 555-10-10 или +7 495 645-59-19 (круглосуточно) и заблокировать карту. Также необходимо подать заявление на досрочный перевыпуск новой карты. Чем быстрее вы заблокируете карту, тем меньше риск несанкционированного использования.","Для блокировки карты необходимо связаться с банком через приложение или позвонить. Блокировка карты должна быть осуществлена как можно скорее, чтобы предотвратить несанкционированное использование карты злоумышленниками. После блокировки карты, ее дальнейшее использование прекращается, если только она не будет перевыпущена."
"Прочитал тут у вас про блокировку карточки. А если я её забуду забрать в банкомате, что тогда делать?","['«6.1. [...] а также в случае изъятия Кредитной карты в банкомате или торгово-сервисном предприятии и в случае изменения имени или фамилии Держателя Клиент должен незамедлительно уведомить Банк по телефонам 8 800 555-10-10 или +7 495 645-59-19 (круглосуточно) и заблокировать Кредитную карту и/или Интернет-Банк и/или Мобильный банк, а также подать заявление о досрочном перевыпуске Кредитной карты.»']","Если вы забыли карту в банкомате, вам необходимо незамедлительно сообщить об этом в банк по телефонам горячей линии 8 800 555-10-10 или +7 495 645-59-19 и заблокировать кредитную карту, а также подать заявление на ее досрочный перевыпуск. Это позволит предотвратить возможное несанкционированное использование забытой карты третьими лицами.","Если вы забыли забрать свою карточку из банкомата, вам следует как можно скорее заблокировать ее. Это можно сделать по телефону, через интернет-банк или мобильное приложение банка. Чем быстрее вы это сделаете, тем меньше вероятность того, что картой воспользуются злоумышленники. Разблокировать карту невозможно, ее можно только перевыпустить. Если вы не уверены, что карту украли, вы можете установить лимит ""0"" на операции и запретить покупки через Интернет."
"А есть ли какие-то льготные условия, если я захочу приостановить выплаты по кредитке на какое-то время? Например, на ремонт или что-то в этом роде?","['«5.15. На основании обращения Клиента и по согласованию с Банком на период от 1 (одного) до 12 (двенадцати) месяцев возможно приостановление обязанности Клиента по погашению Задолженности, по оплате Минимальных платежей, Регулярных платежей и/или иных платежей. В указанный период Банк вправе приостановить начисление процентов и иных сумм, предусмотренных Договором кредитной карты.»']","Да, в документе указано, что по обращению клиента и по согласованию с банком возможно приостановление обязанности по погашению задолженности, выплате минимальных и регулярных платежей на срок от 1 до 12 месяцев. В этот период банк также может приостановить начисление процентов и других сумм по кредитной карте. Таким образом, вы можете получить льготный период для ремонта или других нужд, обратившись в банк с соответствующим заявлением.","Да, согласно условиям, описанным в контексте, банк может предоставить клиенту кредит на условиях, отличных от предусмотренных разделом, в соответствии с условиями программы ""Рассрочка"". Также возможно приостановление обязанности клиента по погашению задолженности, оплате минимальных платежей и других платежей на период от 1 до 12 месяцев. В этот период банк также может приостановить начисление процентов и других сумм, предусмотренных договором кредитной карты."
Какие процедуры предусмотрены банком для обработки жалоб клиентов?,"['Банк имеет установленные процедуры для обработки и рассмотрения жалоб клиентов, включая регистрацию жалобы, ее анализ и предоставление ответа клиенту в установленные сроки.']","Банк следует четко установленным процедурам для обработки жалоб клиентов, которые включают регистрацию жалобы, ее тщательный анализ и предоставление ответа клиенту в соответствии с установленными сроками.","Из предоставленного контекста невозможно однозначно определить, какие процедуры предусмотрены банком для обработки жалоб клиентов."
Что происходит с депозитами в случае смерти?,['В случае смерти клиента банк замораживает депозиты до решения вопросов наследства в соответствии с законодательством.'],"После смерти клиента банк замораживает все его депозиты и удерживает их до тех пор, пока не будут решены вопросы наследства в соответствии с действующим законодательством.","В случае смерти депозита, банк прекращает начисление процентов, пересчитывает проценты в соответствии с Тарифным планом в порядке досрочного изъятия, направляет средства наследникам по реквизитам, указанным в заявлении на получение наследства, закрывает все счета вклада/накопительные счета и картсчета, расторгает договор вклада (договор накопительного счета)."
Могу я отказаться от получения уведомлений от банка и как это влияет на его обслуживание?,"['Клиенты имеют право отказаться от получения определенных типов уведомлений от банка, однако это может повлиять на их способность получать своевременную информацию о изменениях условий, сбоях в системе или других важных обновлениях.']","Клиенты могут отказаться от получения определенных типов уведомлений от банка, но это может привести к тому, что они не будут получать важные обновления и информацию своевременно, что может повлиять на их способность управлять своими счетами и услугами эффективно.","Да, клиент может отказаться от получения уведомлений от банка. Это не является основанием для изменения или расторжения договора, отказа в заключении договора с банком или отказа в предоставлении продуктов и услуг банка. Клиент имеет право отозвать свое согласие на получение рекламы по сетям электросвязи в любое время."
Как я могу увеличить лимит по своей кредитной карте?,"['Для увеличения кредитного лимита клиенты должны подать заявление через мобильное приложение или веб-сайт банка, после чего банк рассмотрит их кредитную историю и текущую финансовую ситуацию.']","Чтобы увеличить кредитный лимит, клиентам необходимо подать соответствующее заявление через мобильное приложение или веб-сайт банка. Банк затем оценит их кредитную историю и текущую финансовую ситуацию перед принятием решения.",Вы не можете самостоятельно увеличить лимит по своей кредитной карте. Это решение принимается банком-эмитентом вашей карты на основе предоставленной вами информации.
"Каковы условия отмены банковской операции, например, перевода средств или платежа?","['Клиенты могут отменить определенные банковские операции, если они не были еще обработаны банком. Условия отмены операций установлены в пользовательском соглашении и зависят от типа операции.']","Условия отмены банковской операции зависят от того, была ли операция уже обработана банком. Для операций, которые еще не обработаны, клиенты могут инициировать отмену, следуя процедурам, описанным в пользовательском соглашении и в зависимости от типа операции.",Я не знаю ответа на этот вопрос.
Какие услуги доступны клиентам через Интернет-банк?,"['Через Интернет-банк клиенты могут управлять своими счетами, осуществлять платежи и переводы, а также получать детальную информацию о своих финансовых операциях.']","Интернет-банк предоставляет клиентам возможности управления их счетами, осуществления платежей и переводов, а также доступ к подробной информации о всех их финансовых операциях.","Из предоставленного контекста невозможно точно определить, какие услуги доступны клиентам через Интернет-банк."
"Я не пользовалась кредиткой год, но у меня там лежат мои 800 рублей, я могу их как-то вернуть?","['""8. Расторжение Договора кредитной карты\n                8.1. Банк вправе в любой момент расторгнуть Договор кредитной карты в одностороннем порядке в случаях, предусмотренных \n                законодательством Российской Федерации, а также:\n                • в случае если Держатель не пользовался Кредитной картой более, чем 6 (шесть) месяцев при отсутствии \n                Задолженности по Договору кредитной карты;\n                В этих случаях Банк блокирует все Кредитные карты/Токены, выпущенные в рамках Договора кредитной карты. Договор \n                кредитной карты считается расторгнутым со дня формирования Банком Заключительного счета, который направляется \n                Клиенту. Если в момент расторжения Договора кредитной карты Задолженность Клиента перед Банком отсутствует, Банк \n                вправе расторгнуть Договор кредитной карты без направления Заключительного счета, информируя Клиента о своем \n                решении любым способом по усмотрению Банка.\n                8.5. В случае, если при расторжении Договора кредитной карты в Банке находятся денежные средства Клиента, излишне \n                перечисленные им при погашении Задолженности, Банк осуществляет возврат таких денежных средств по распоряжению \n                Клиента почтовым переводом или иным способом, указанном в распоряжении Клиента. При этом Банк вправе удержать \n                из суммы такого перевода комиссию за перевод денежных средств в размере, предусмотренном Тарифами на услуги \n                по переводам, платежам и дополнительные услуги с использованием каналов Дистанционного обслуживания.\n                8.6. В случае неполучения Банком распоряжения Клиента о переводе денежных средств в течение 120 (ста двадцати) дней \n                со дня обработки Банком последней операции Клиента/Держателя и, если остаток денежных средств не превышает \n                1000 руб., указанный остаток считается безвозмездно переданным Банку. \n                В случае неполучения Банком распоряжения Клиента о переводе денежных средств в течение 3 (трех) лет со дня обработки \n                Банком последней операции Клиента/Держателя указанные денежные средства считаются безвозмездно переданными \n                Банку.\n                ']","Согласно пунуту 8.6 - вы не можете вернуть ваши деньги, так как не дали распоряжение Банку о переводе денежных средств в течение 120 дней.","Да, вы можете вернуть свои деньги, которые остались на заблокированной кредитной карте. Однако, для этого вам нужно обратиться в банк и запросить возврат средств."
